label_id	text
26	一种探测器地月转移轨道修正方法及装置<sep>本发明公开了一种探测器地月转移轨道修正方法，包括：获取主卫星入轨时刻的状态量，将获取到的所述状态量作为所述探测器的入轨时刻状态量；以所述入轨时刻状态量作为初值在预设的轨道动力学模型下进行轨道数值积分运算，求得修正时刻状态量；以所述修正时刻状态量作为初值在所述预设的轨道动力学模型下进行轨道数值积分运算，求得终端时刻状态量；计算所述终端时刻状态量与终端时刻标准量的差值，所述差值为第一偏差量；根据所述第一偏差量计算第一修正量；按照所述第一修正量对所述修正时刻状态量进行修正。本发明还公开了一种探测器地月转移轨道修正装置。
26	一种面向多曲率动态成像目标的遥感卫星姿态规划方法<sep>本发明提供一种面向多曲率动态成像目标的遥感卫星姿态规划方法，通过在多曲率目标轨迹上采点，并利用圆弧拼接拟合的方法，最终得到曲率连续的可行光滑曲线以表征目标轨迹。将对多曲率目标的观测过程划分为成像时间段与机动时间段，在拟合曲线上离散求取地面成像点，分别采用成像点姿态求解模型与正弦机动路径策略完成对卫星成像时间段与机动时间段的姿态规划。
26	一种基于卫星通信的扩频倍数无损切换方法<sep>一种基于卫星通信的扩频倍数无损切换方法，包括：主站接收各个端站定时发送的接收信道质量信息，计算各个信道的扩频参数；主站判断是否有信道扩频参数需要变化；主站下发信道扩频参数给信道发送设备和接收设备；主站一段时间内接收到信道设备的应答消息；主站下发信道扩频切换指令给发送设备；信道发送设备将业务数据存到自己的缓存中，使用原信道扩频参数发送m帧空数据，帧头携带信道扩频倍数切换指令，然后切换为新信道扩频参数，再发送n帧空数据，最后再从缓存中发送业务数据；信道接收设备接收到帧头携带信道扩频倍数切换指令的帧时，立刻切换为新的接收信道扩频参数，调整自己的接收模块，建立新的通信链路。
26	一种用于航天器轨道动态测试的干扰场景模拟系统<sep>本发明提供一种用于航天器轨道动态测试的干扰场景模拟系统，位置条件计算单元按照被测航天器和通信目标的真实运动轨道信息、被测航天器和干扰源之间的真实运动轨道信息，模拟航天器与通信目标之间的相对运动、航天器与干扰源之间的相对运动，形成模拟的位置条件组；然后轨道动态模拟单元采用位置条件组模拟干扰信号与基带信号，同时传输信道模拟单元采用位置条件组模拟由于航天器与通信目标、干扰源之间的位置变化引入的信号功率动态变化过程，使得被测航天器与其在轨实际工作条件一致，有效减小了现有模拟条件与被测航天器在轨运动过程中的误差，使被测航天器工作于更真实的干扰场景中，提高了抗干扰测试的准确性。
26	轨道间卫星通信路由方法及装置<sep>本公开涉及一种轨道间卫星通信路由方法及装置，所述方法包括：获取各相邻卫星的交互参数；对于每个相邻卫星，根据相邻卫星的交互参数计算对应的效用信息；从各效用信息中确定出最优效用；将所述最优效用对应的相邻卫星确定为下一跳卫星节点。本公开通过效用信息确立的动态路由，实现了卫星间信息传输的高效动态路由。
26	一种基于轨道动力学辅助的星载gnss接收机信号同步方法<sep>一种基于轨道动力学辅助的星载gnss接收机信号同步方法，包括：(1)进行gnss接收机的输入数据准备；(2)进行gnss接收机运动状态轨道动力学递推；(3)计算t时刻所有到达gnss接收机的信号的发射时刻估计值和所对应的gnss卫星在eci系下的位置和速度；(4)辅助信息计算；(5)信号同步辅助。本发明可以大幅度减小gnss信号同步所需时间，继而提高星载gnss接收机整体导航性能，其算法简单可靠，适用于星载gnss接收机使用。
26	导航装置及方法<sep>本发明公开了一种导航装置，包括：第一获取模块，用于在侦测到移动终端位于基站覆盖盲区时，通过短距无线通信的方式发送第一移动网搜索请求至搜索到的无线热点，并接收无线热点返回的，连接到无线热点的各其他终端的移动网信号强度以及位置信息；第一确定模块，用于基于各移动网信号强度及对应的位置信息，确定基站覆盖区域的目标位置；导航模块，用于计算移动终端到达目标位置的导航路径，并在移动终端输出计算的导航路径。本发明还公开了一种导航方法。本发明能够帮助处于基站覆盖盲区的移动终端用户找到基站覆盖区域。
26	一种低轨卫星通信方法<sep>本发明公开了一种低轨卫星通信方法。它包括以下步骤：低轨卫星判断当前自身所处位置是否位于能够与地面接收站直接通信的区域，如果位于能够与地面接收站直接通信的区域，则低轨卫星直接与地面接收站通信，如果位于不能够与地面接收站直接通信的区域，则低轨卫星选择一个既能和自身直接通信又能和地面接收站直接通信的高轨卫星作为中转站，并与该高轨卫星建立通信，作为中转站的高轨卫星转发低轨卫星与地面接收站之间的通信数据。本发明能够保证低轨卫星全轨道与地面接收站始终保持通信，实现低轨道卫星无缝覆盖。
26	一种基于精准环路滤波的并行定时同步方法<sep>本发明公开了一种基于精准环路滤波的并行定时同步方法，其按如下步骤执行：一，并行处理定时同步插值步骤；二，并行处理定时误差检测步骤；三，并行处理环路滤波步骤；四，并行处理插值控制步骤。本发明具有同步速度较快、性能好的优点，其广泛应用于适合低信噪比传输的地面无线应急通信、卫星与电力线通信等数字通信领域。
26	一种基于三角窗的双窗全相位dft同步相量测量方法及系统<sep>本发明涉及一种基于三角窗的双窗全相位dft同步相量测量方法及系统，利用两个三角窗对采集信号进行预处理，对处理后的数据进行傅里叶变换，得到高精度的相角估计，并基于时移相位差校正法进行频谱校正，得到频率、幅值的估计结果，实现同步相量的测量。本发明有利于确保更高的测量精度和更短的响应时间。
26	一种激光驾束制导测角接收机<sep>本发明提供激光驾束制导测角接收机，属于近程地空、地地导弹姿态测量和控制技术领域。包括：广角光学镜头组件、四象限光电探测器、信号转换及放大电路、滤波电路和模/数混合解算电路。该接收机通过接收地面激光驾束制导仪发射的调制激光制导信息，通过光学会聚成像、信号转换及放大电路、整形滤波电路和和差处理电路对信号进行实时处理后，经过数字信号解算电路和软件来获得导弹在空间激光驾束制导信息场中相对于信息场中心的二维位置坐标、导弹轴线相对于激光驾束制导信息场激光射线的俯仰偏移角和偏航偏移角。本发明采取编码激光直接照射、测角接收机接收的方式，同时测量出导弹相对制导信息场的位置信息和姿态信息，从而为导弹提供精确的位置和姿态角度测量，大幅度提高导弹的瞬态控制品质。
26	一种基于卫星通信的应急通信系统及方法<sep>本发明公开一种基于卫星通信的应急通信系统，涉及应急通信技术领域，包括用户端、接收端、地面中继站以及通信卫星，地面中继站包括发送地面站以及接收地面站，发送地面站的数量至少为两个，且用户端与至少两个发送地面站通信连接；用户端中配置有通信链路选择模块以及用于检测至少两个发送地面站与通信卫星之间通信质量的检测模块；检测模块经至少两个发送地面站、通信卫星分别发送代表各条通信链路的特定数据信号至目标接收地面站，接收目标接收地面站的反馈信号，根据反馈信号判定各条通信链路的通信质量；链路选择模块与检测模块数据连接，根据各个通信链路的通信质量，选通其中一条通信链路进行通信，保证通信的正常进行与通信质量。
26	一种设备校准方法和装置<sep>本公开提供一种设备校准方法和装置，其中方法包括：获取探测晶体的本底辐射的扫描数据；根据所述扫描数据确定设备状态为待调整，并根据所述扫描数据得到数据校正因子；通过能量因子转换系数，对所述数据校正因子进行调整，得到应用数据校正因子；根据所述应用数据校正因子，对探测晶体获取的图像重建数据进行校正。本公开使得能够根据本底辐射的扫描数据进行设备校准，不再需要使用外置源，节省了成本。
26	基于空间信息索引的多道匹配追踪方法、存储介质及终端<sep>本发明涉及一种基于空间信息索引的多道匹配追踪方法、存储介质及终端。该方法包括处理获取的多道信号得到最佳匹配原子以及最佳匹配原子的振幅参数；构建空间时变原子库用于对邻道进行分解，空间时变原子库中时间参数为变化量；计算空间时变原子库确定预设道信号的最佳原子，由最佳原子的中心时间替换空间时变原子库中时间参数，替换后的空间时变原子库继续对下一道信号进行多道搜索。本发明通过构建空间时变原子库，以振幅信息作为最优原子指示参数，能够实现有方向的多道搜索，实现对地震资料进行有方向的多道分解，既能充分利用地震资料的横向连续性，又考虑到地震同相轴的方向性，更符合实际地球物理勘探开发的需求。
26	一种基于北斗卫星导航系统的并发数据异步传输方法<sep>本发明提供了一种基于北斗卫星导航系统的并发数据异步传输方法，所述方法包括如下步骤：发送端将待发送的数据包拆成数个子数据包并通过北斗卫星导航系统传输至接收端，待发送的数据包包括表示第一开头标识的标识符、表示第一结尾标识的标识符、表示校验码的标识符及表示该数据包序号的标识符，子数据包包括表示第二开头标识的标识符、表示第二结尾标识的标识符、表示数据长度的标识符及表示子数据包序号的标识符；接收端接收子数据包，并将接收的子数据包组成一个完整的数据包，再对组成后的数据包进行校验。本发明在发送端对数据进行拆包、在接收端进行组包，从而实现了并发数据的可靠异步传输。
26	在轨卫星扩频应答机性能变化的发现和评估方法以及模块<sep>本发明公开了一种在轨卫星扩频应答机性能变化的发现和评估方法和模块，能够发现在轨卫星扩频应答机的性能变换情况，并进行严重性的分段评估。所述方法针对多个满足“配备两台相同扩频体制应答机的在轨卫星，且两台扩频应答机接收机均开机工作”的卫星，提取每颗卫星两台扩频应答机的历史agc电平遥测数据；对每颗卫星的两组agc电平遥测数据进行相关系数计算，获得一个相关系数；利用所有满足条件卫星的相关系数构建评估阈值；对于待评估的在轨卫星i，确定卫星i两台扩频应答机的agc电平遥测数据的相关系数ρ，与评估阈值进行对比，获得评估结果。
26	一种农业机械自动导航定位定向系统<sep>本发明公开了一种农业机械自动导航定位定向系统，包括设置于农业机械的mcu，用于接收卫星定位的信号和天线接收信号，还包括rtk基准站、基准站电台、主天线、从天线、移动站、移动站电台，所述rtk基准站接收卫星信号，再传输至基准站电台；所述移动站通过主天线、从天线双天线接收卫星信号，通过有源功分器模块再传输至移动站电台，所述基准站电台和移动站电台对卫星信号进行解包分析，再传输至mcu进行分析；所述mcu基于所设置的农业机械，还统一连接有图像识别单元、机械控制单元和环境检测单元。本发明在基于高精度自动卫星导航定位的同时，设置适用性强的农业机械控制系统，提高了基于精准定位定向的终端强大农业应用功能。
26	一种用于运载火箭回收的辅助回收系统<sep>本发明提供一种用于运载火箭回收的辅助回收系统，包括：承载平台、设置于所述承载平台一侧且连接所述承载平台的侧壁、设置于所述侧壁外侧的多个可伸缩装置及用于控制所述可伸缩装置启动的控制器；所述侧壁彼此面对的部分设有多对彼此对应的开孔，每一对彼此对应的开孔中的至少一个配备所述可伸缩装置，所述可伸缩装置启动后的伸长长度大于对应的两个开孔之间的距离。本发明实施例的辅助回收系统，可以在待回收火箭子级降落前，对其运动进行导向和限位，避免其在着陆过程中发生侧翻或倾覆，降低了待回收火箭子级的姿态要求，提高了回收成功率。
26	基于空间压缩的多站接力导航下运动体路径规划方法<sep>本发明公开了一种基于空间压缩的多站接力导航下运动体路径规划方法，采用角度编码方式对中间路点进行编码，可用局部极坐标系下的极角坐标(一个变量)代替二维平面坐标(两个变量)唯一表示交接区域边界上任意点的位置，可显著降低问题维度和计算量；根据导航交接约束阈值与导航站位置及有效作用半径之间的几何关系，压缩路点极角坐标的取值范围，在运行路径规划算法之前直接剔除了部分违反导航交接约束的不可行解，缩小了路径的规划空间，有利于路径规划算法更快找到高质量的可行解。
26	一种适用于卫星光照条件的多参数自主诊断辨识方法<sep>本发明涉及一种适用于卫星光照条件的多参数自主诊断辨识方法，属于在轨卫星光照条件诊断辨识领域；步骤一、获取逻辑太阳敏感器的测量信号、太阳夹角数据、模拟太阳敏感器的测量信号和太阳电池阵的输出电流；步骤二、判断逻辑太阳敏感器的测量信号的输出为true或false；步骤三、判断太阳夹角数据的输出为true或false；步骤四、判断模拟太阳敏感器的测量信号的输出为true或false；步骤五、判断太阳电池阵的输出电流的输出为true或false；步骤六、建立逻辑树；步骤七、判断卫星是否处于光照区；本发明能够根据在轨卫星遥测参数设置的情况，实现高可靠性的光照区‑地影区状态检测，同时操作简单，适用性强。
26	多模式输出一体泵马达及其应用方法<sep>本发明公开了一种多模式输出一体泵马达及其应用方法，一体泵马达包括：输入轴组件，输入轴上安装输入轴主动齿轮；输出轴组件，输出轴上空套安装输出轴从动齿轮、输出轴从动齿轮结合齿，输出轴从动齿轮与输入轴主动齿轮啮合，输出轴上安装花键毂；行星齿轮机构，包括太阳轮、齿圈和行星架，行星架上设行星齿轮，太阳轮与行星齿轮啮合，行星齿轮与齿圈啮合；液压输出轴上固装液压输出轴齿轮，其与齿圈外齿轮啮合，设液压输出轴齿轮结合齿；结合套可移动安装在花键毂外侧；还包括一体式液压泵马达和换档控制装置。该一体泵马达解决了现有的一体泵马达液压系统效率低，燃油经济性差的问题。
26	一种分瓣式火箭尾段装配工艺<sep>本发明公开了一种分瓣式火箭尾段装配工艺，包括:提供下半罩和上半罩，使下半罩和上半罩从火箭发动机尾端沿火箭轴向方向的外侧移动到预定位置；使所述上半罩和/或所述下半罩与火箭尾段的相邻端面对接，并使两个半罩彼此对接。与现有技术相比，整个工艺，通过将尾端分为下半罩和上半罩两个单独的部件，完成下半罩与上半罩完成相互对接，且使两个半罩与火箭的相邻端面对接，形式新颖，操作简单，既不需要对尾段结构做很大调整，又可以巧妙的避开发动机本身，解决了当多台火箭发动机机进行并联，发动机最大包络尺寸较大时，尾段整体无法常规对接的问题。
26	气象台站面密度度量方法<sep>本发明公开了气象台站面密度度量方法，该方法利用核函数近似对台站面密度进行平滑处理，并引入局地尺度等，最终获得自适应的气象台站面密度；该方法可以消除现有计算台站密度方法的主观性、不连续性及单一尺度性，可以满足台站密度的客观度量及进一步使用插值、eof分析等统计方法的要求。
26	一种球铰链以及航天器指向机构<sep>一种航天器指向机构，包括：底座，若干个球铰链，第一驱动杆，所述第一驱动杆的一端通过球铰链与底座连接，至少两个第二驱动杆，所述第二驱动杆的一端通过球铰链与底座连接、另一端通过球铰链连接至所述第一驱动杆的另一端；所述球铰链包括：第一球铰片，至少一个第二球铰片，固定装置，用于在所述球铰链的某一固定轴方向固定连接所述第一球铰片和第二球铰片，其中，所述第一球铰片和第二球铰片可沿所述球铰链的所述固定轴方向旋转，连接口，设置于所述第一球铰片上。本发明的指向机构刚度高、精度高，适用于卫星微波通信的中继、数传指向机构产品，也适用于各类卫星光学相机，激光通信等领域。
26	用于中继卫星天地一体化网络的移动ip通信系统的方法<sep>本发明提供一种用于中继卫星天地一体化网络的移动ip通信系统及方法，属于卫星通信技术领域。切换控制器使用snmp协议对ip路由器进行控制：当用户中心的设备需要与航天器内的设备进行通信时，切换控制器根据可视状态信息，实时选定可使用的中继卫星，从静态路由表和动态路由表中确定最优路由路径；据此建立前向通信链路进行数据传输。所提出的静态和动态路由控制方法针对不同的中继卫星网络结构，适用性强，控制简单、实现灵活，适合对中继卫星系统中的网络设备进行管理，解决固定ip移动所带来的天地网络链路自动化切换和动态路由修复问题。
26	用于液体火箭发动机的阀门结构及液体发动机<sep>本发明提供了一种用于液体火箭发动机的阀门结构及液体发动机。本发明的阀门结构和液体发动机，通过在阀门的主体部一侧设置作动筒，并在液体推进剂入口处设置活门及弹性件，可以通过向作动筒中通入控制气，调整阀门的开关状态，并在撤销控制气时，通过弹性件及介质压力将活门保持在原有位置，从而可以以较小的控制气用量，实现对推进剂出入口的开关，改善液体发动机的工作性能。
26	一种基于伪距测量特征值提取的araim故障检测方法<sep>本发明提供了一种基于伪距测量特征值提取的araim故障检测方法，包括：计算各个故障模式下的完好性风险总和，以及各故障模式下完好性风险值的最大值，利用各个模式下的完好性风险总和，与最大故障的完好性风险的比值计算故障模式的数量，将对应的伪距测量值的样本数量作为有效样本数；将某一时间段t，与所述有效样本数的比值，作为有效采样时间；以所述有效采样时间，对接收机采集的伪距测量值样本进行采样，得到有效伪距测量集；利用所述伪距有效测量集，计算检验统计量，并进行完好性故障检测。本发明降低了机载接收机数据处理量，减少机载接收机的负担，提高了算法实时性。
26	基于双频组合的室内定位方法<sep>本发明提出一种基于双频组合的室内定位方法，主要步骤为发射基站生成多路双频导航信号，并使两路信号相对1pps的偏移量相同；然后计算各频点的实测距离值或组合相位实测距离差值；最后利用最小二乘定位算法进行定位；本发明通过利用双频信号的方式构建观测量，有效扩大室内定位的作用范围，并通过模拟验证可得由此得出的定位精度均能满足1米需求。
26	一种在线发动机推力和比冲估计方法及系统<sep>一种在线发动机推力和比冲估计方法及系统，包括：(1)根据主发动机的地面试车结果，确定主发动机推力以及比冲的估计初值，并对后续迭代过程需要的相关参数进行初始化；(2)结合姿控推力器工作在主发动机推力方向产生的附加加速度和姿控推力器引起的质量消耗，求解出主发动机推力和比冲的估计值，从而实现在线发动机推力和比冲估计。本发明考虑了动力过程主发动机以外其他姿控发动机喷气造成的额外质量消耗和加速度，并将它们的影响从估计方程中扣除，最后通过递推最小二乘方法得到主发动机推力和比冲的精确估计结果。这种方式的好处是可以实时在线进行并且剔除了其他发动机工作对估计结果的不利影响。
26	同相路和正交路不平衡测量方法和装置<sep>本发明实施例提供一种同相路和正交路不平衡测量方法和装置，该方法包括：发射端发射单边带信号；测量发射的单边带信号经过调制后的光信号在各频率分量上的功率，得到主信号功率谱和镜像信号功率谱；其中，该主信号功率谱是与该单边带信号频率位置相同的信号功率谱，该镜像信号功率谱是与该单边带信号频率位置相反的信号功率谱；根据该主信号功率谱和镜像信号功率谱，计算同相路和正交路相位不平衡和/或时延不平衡，通过上述实施例测量相位不平衡和/或时延不平衡，测量过程简单且测量结果准确。
26	128进制正交振幅调制信号的载波相位补偿方法及系统<sep>本发明公开一种128进制正交振幅调制信号的载波相位补偿方法及系统。首先将接收到的128进制正交振幅调制信号序列中的iv类信号、ix类信号和xiii类信号向同一方向旋转π/4弧度并归一化处理，对i类信号、iii类信号、v类信号、viii类信号、xi类信号、xii类信号和xvi类信号归一化处理，将ii类信号、vi类信号、vii类信号、x类信号、xiv类信号和xv类信号置零处理，获得预处理调制信号序列。根据预处理调制信号序列，采用滑动平均方法，确定接收信号序列中各元素的载波相位估计值，进而对接收信号序列进行载波相位补偿。本发明提供的载波相位补偿方法及系统，激光器线宽容限大，实用性强，具有良好的应用前景。
26	车载智能组合导航设备<sep>车载智能组合导航设备，包括：卫星定位模块，用于接收定位信息；惯性定位模块，用于获取车辆的惯导信息；数据整合模块，用于处理定位信息、惯导信息，获得车辆的定位信息；温度监测模块，用于监测车内温度。车载智能组合导航设备，在卫星定位的基础上与惯性定位相结合，提高了定位的精度；增加了车内温度监测，通过控制光照强度控制车内温度的，避免了因光线过于强烈造成车内温度过高，而对能源的浪费。
26	一种基于低轨星座的导航完好性监测系统及方法<sep>本发明公开一种基于低轨星座的导航完好性监测系统及方法，其中系统包括多个低轨卫星，每个低轨卫星作为天基监测站接收导航信号，每个低轨卫星的每个接收通道上均设置数据处理模块；数据处理模块对接收的导航信号进行导航电文完好性监测和观测量完好性监测的处理，并通过星间链路与附近能够观测同一导航卫星的低轨卫星进行通信，通过其中任一低轨卫星上设置的综合处理逻辑模块对能够观测同一导航卫星的所有低轨卫星的处理结果进行冗余判决，给出最终的导航完好性监测结果。
