label_id	text
26	一种基于海量终端的卫星通信网络的私有协议测试方法<sep>本发明提供一种基于海量终端的卫星通信网络的私有协议测试方法，用于测试卫星通信网络是否支持海量终端访问某种基于tcp/udp的私有协议。包括：开发海量终端模拟软件建立数万量级模拟终端模型。在网络测试仪上设置客户端和服务器端。客户端和服务器端分别与海量终端模拟软件和卫星主站相连；在网络测试仪上配置客户端和服务器端网络；客户端导入捕获的待测协议的会话报文，创建播放列表，配置负载模型和用户行为。服务器端播放客户端导入的播放列表里的流文件并执行测试；网络测试仪对测试结果进行统计处理，并形成测试报告。本发明的技术效果在于开发仿真模型软件，挖掘现有测试工具的特点，对它们进行结合使用达到测试目的。
26	多接头火箭壳体加工方法<sep>本发明公开了一种多接头火箭壳体加工方法，粗加工、淬火回火‑净尺寸加工‑定位、焊接‑拆卸并焊接‑焊缝射线探伤、补焊、射线探伤并去应力退火。针对小型火箭壳体数量多、周期紧、价格低的市场压力，采用激光连接参数优化技术、定位装置、净尺寸设计、公差分配技术及激光连接配套热处理技术，节约机械加工时间三分之一以上，突破了传统的火箭壳体加工技术和工艺流程。
26	一种太阳光压辅助下欠驱动航天器姿态的双模mpc控制方法<sep>本发明公开了一种太阳光压辅助下欠驱动航天器姿态的双模mpc控制方法，针对高轨卫星及深空探测器等采用飞轮作为执行机构、受到的环境力矩主要是太阳光压力矩的挠性欠驱动航天器姿态控制系统。首先，建立以飞轮为执行机构的挠性航天器动力学与运动学模型，并根据航天器构型，建立太阳光压力矩解析式；然后，根据状态方程建立离散预测模型并确定约束条件；最后，根据近似的线性模型，确定终端惩罚矩阵和终端域，设计双模mpc控制律。本发明考虑了帆板转角、转速的限制，以及帆板的刚性转动和振动对航天器姿态的干扰，通过控制帆板转角产生太阳光压力矩作为辅助力矩，实现了欠驱动挠性航天器三轴姿态稳定。
26	一种极化反馈蚁群算法的北斗卫星选择方法<sep>本发明公开了一种极化反馈蚁群算法的北斗卫星选择方法，其特征是按如下步骤进行：首先计算出可视卫星的方位角和高度角，得到选择n颗卫星的状态矩阵，并将gdop值作为卫星选择的目标函数；然后利用一种极化反馈蚁群算法搜索能使目标函数值达到最小的卫星组合，在算法的选择概率中设计的扰动作用可以提高算法的全局搜索能力，同时提出的极化反馈机制可以提高算法的收敛速度。本发明将改进型蚁群算法应用于北斗卫星选择，有效提高了北斗卫星选择的质量和效率，具有广阔的应用前景。
26	基于组网低轨卫星的卫星导航系统完好性监测方法和系统<sep>本发明公开了一种基于组网低轨卫星的卫星导航系统完好性监测方法和系统。该方法包括：每个低轨卫星接收导航卫星系统的导航信号及相邻低轨卫星的测距信号，获得导航电文与伪距观测量；低轨卫星利用获得的导航电文与伪距观测量执行完好性监测；低轨卫星接收至少2颗相邻低轨卫星的完好性监测结果，从而获得至少3组完好性监测结果，以此综合判断导航卫星是否存在故障；低轨卫星向地面用户播发判断结果。该系统包括导航卫星导航信号接收机、相邻低轨卫星链路收发机、完好性监测数据获取装置、完好性监测分立处理装置、完好性监测联合处理装置、及完好性监测联合处理结果发射机。本发明能有效监测卫星故障，减小用户导航结果受到故障信号影响的概率。
26	基于vtdm帧结构的低速可变速率多模式编码调制器<sep>本发明公开了一种基于vtdm帧结构的低速可变速率多模式编码调制器，包括指令解析模块、接口管理模块、编码模块、组帧模块、成形滤波模块和数字上变频模块。本发明的处理分为两个层面进行，一是控制层面，二是业务层面。控制层面是由指令解析模块解析出各种控制信号，用于对接口管理模块、编码模块、组帧模块、成形滤波模块和数字上变频的控制。业务层面首先由接口管理模块对基带输入数据进行识别和接收，接收到的数据在控制信号的控制下送编码模块进行编码，编码后的数据进行组帧、成形滤波及数字上变频处理。本发明具有解调门限低、数据处理灵活、适用站型广和可移植性好等优点。特别适用于星间或星地各种环境条件、各种不同类型基站之间通信使用。
26	一种智能光频侦察通信一体化系统<sep>本发明涉及一种智能光频侦察通信一体化系统，包括：互相通信连接的凝视传感器阵列单元、激光通信单元、空间基准单元和信息智能处理单元；空间基准单元输出时空基准；凝视传感器阵列单元基于时空基准进行待测目标的跟踪和测量，将多目标的侦察信息发送给信息智能处理单元；激光通信单元基于时空基准与外部通信对象进行跟踪和通信，将通信对象的通信信息发送给信息智能处理单元；信息智能处理单元对获取的多目标的侦察信息和通信对象的通信信息在时空基准下进行融合。以高精度统一时空基准为基础，集多目标光电跟踪侦察、激光通信、空间基准测量与统一以及智能识别感知等功能单元为一体，并实现智能信息融合，使光电设备的效能得到最大程度发挥。
26	基于非线性偏差演化的航天器轨道机动检测方法和装置<sep>本申请涉及一种基于非线性偏差演化的航天器轨道机动检测方法和装置。所述方法包括：根据轨道测量数据，计算前后两个时刻目标航天器的测量定轨状态统计值矢量，根据在前测量数据预测在后测量时刻的目标航天器状态矢量，与在后测量时刻的测量定轨状态统计值矢量比较。当偏差大于预设值时，通过非线性偏差演化，基于在前时刻的测量定轨状态统计值矢量进行前向预测，基于在后的测量定轨状态统计值矢量进行后向预测，在每个预测时刻上得到两个定轨状态统计值矢量，当某个时刻二者偏差小于预设值时，判定两次测量数据对应于机动前后的同一目标航天器。采用上述方法能够匹配两次检测获得的目标航天器数据，近实时地识别出目标航天器的轨道机动情况。
26	一种稳定的rs232总线的卫星接收端机的通信单元<sep>本实用新型公开一种稳定的rs232总线的卫星接收端机的通信单元，包括存储单元、控制单元和总线单元，所述存储单元与所述控制单元连接，所述控制单元与所述总线单元连接，其特征在于：所述总线单元与接口隔离单元连接，所述总线单元包括rs232总线单元和i2c总线单元，所述rs232总线单元采用sp3232芯片。本实用新型针对宇宙环境的特殊性，专门设计了rs232总线单元，确保通信的稳定，同时还安装了多种总线单元，增加了通信单元的兼容性。
26	一种简易的雷达俯仰角调节机构<sep>本实用新型涉及雷达设备技术领域，尤其是涉及一种简易的雷达俯仰角调节机构。本实用新型的两个t型接头分别固定在雷达固定板、雷达阵面上，反牙螺杆活动连接与固定在雷达阵面上的t型接头连接，正牙螺杆活动连接与固定在雷达固定板上的t型接头连接，反牙螺杆通过反牙螺母与花篮螺丝连接，正牙螺杆通过正牙螺母与花篮螺丝连接。本实用新型具有结构简单，成本低等特点。
26	一种通信卫星星表设备场强预估方法及系统<sep>一种通信卫星星表设备场强预估方法及系统，包括(1)建立发射天线‑通道标识矩阵；(2)逐一进行推饱和操作；(3)确定所述发射天线‑通道标识矩阵中元素的值、推饱和的功率以及推饱和通道对应的场强探头读数；(4)计算换算因子；(5)确定最小与最大的换算因子；(6)计算每一发射天线对应的转发器所有通道推饱和时的最小和最大场强值；(7)预估所有天线对应的所有通道推饱和时星表设备处的最小和最大场强值。本发明既解决了测试不能直接获得实际数据的问题，又解决了脱离测试数据完全依赖仿真结果而带来的准确度低、效率低和高成本的问题。
26	一种低轨卫星广播星历参数表达方法<sep>本发明公开一种低轨卫星广播星历参数表达方法，该方法包括：步骤1，基于低轨卫星精密轨道进行广播星历参数拟合，所述广播星历参数采用兼容导航卫星广播星历的表达方法，在原有参数基础上增加卫星轨道长半轴变率、平均运动角速度变率、纬度幅角三分之一周正弦和余弦调和改正系数，以吸收低轨卫星轨道周期性摄动；步骤2，采用导航卫星导航电文编排格式中保留位置进行轨道长半轴变率、平均运动角速度变率、纬度幅角三分之一周正弦和余弦调和改正系数表达。本发明充分利用现有中高轨导航卫星星历设计和表达方法，实现低轨卫星星历与中高轨卫星导航星历的参数兼容和表达方式统一，降低用户综合使用中高轨导航卫星和低轨卫星星历的复杂性。
26	一种低轨卫星与地面接收站通信的方法<sep>本发明公开了一种低轨卫星与地面接收站通信的方法。它包括以下步骤：低轨卫星判断当前自身所处位置是否位于能够与地面接收站直接通信的区域，如果位于能够与地面接收站直接通信的区域，则低轨卫星直接与地面接收站通信，如果位于不能够与地面接收站直接通信的区域，则低轨卫星选择一个既能和自身直接通信又能和地面接收站直接通信的高轨卫星作为中转站，并与该高轨卫星建立通信，作为中转站的高轨卫星转发低轨卫星与地面接收站之间的通信数据。本发明能够保证低轨卫星全轨道与地面接收站始终保持通信，实现低轨道卫星无缝覆盖。
26	用于多路复用混合卫星星座的方法和装置<sep>一种用于操作包括可以属于不同类型的卫星星座的不同卫星的卫星系统的方法和装置。在一些实施方式中，卫星系统可以包括leo卫星星座和一个或多个非leo卫星星座，一个或多个非leo卫星星座可以用于增加leo卫星星座的前向链路容量，例如，通过允许leo卫星将其至少一些前向链路业务卸载到非leo卫星中的一个非leo卫星。用户终端可以在leo卫星和非leo卫星之间动态地切换前向链路通信，同时保持与leo卫星的返回链路连接。
26	多波束波形发射方法及系统<sep>本发明实施例提供了一种多波束波形发射方法及系统，所述方法包括：获取雷达与通信共用阵列的发射波形矩阵，并获取所述雷达与通信共用阵列的阵列流形矩阵；基于循环坐标下降法，将所述发射波形矩阵和阵列流形矩阵进行矩阵合成，得到所述雷达与通信共用阵列的基带波形矩阵，以根据所述基带波形矩阵发射多波束波形。本发明实施例提供的一种多波束波形发射方法及系统，通过循环坐标下降迭代降低发射波形矩阵和阵列流形矩阵合成的均方误差，从而生成恒模的阵列基带波形矩阵，并有效降低多波束波形设计的计算量。
26	一种模拟飞轮半实物仿真系统及方法<sep>本发明一方面公开了一种模拟飞轮半实物仿真系统，包括星载计算模块、飞轮模拟模块和仿真计算模块；星载计算模块用于采集卫星姿态信息并处理得到输入飞轮的指令信息；飞轮模拟模块用于接收所述指令信息并处理得到飞轮输出的运动信息；仿真计算模块用于根据所述运动信息解算卫星的姿态，本发明还公开了一种应用该系统的模拟飞轮半实物仿真方法，解决飞轮器件参与半实物仿真损耗和试验精度等问题，设计模拟飞轮实现对姿态控制系统的验证需求。
26	时分体制星座网络的数据优先级同步调整及数据检索方法<sep>本发明公开了一种时分体制星座网络的数据优先级同步调整及数据检索方法，包括如下步骤：步骤一、每颗卫星按照数据优先级调整遥控指令同步改为同一优先级策略；步骤二、将卫星中待发送数据的数据优先级pri与数据类型type进行映射，步骤三、将卫星中的待发送数据关联序号戳typeindex并按照数据类型type及目的采用循环缓存方式分类存储；步骤四、根据数据的优先级和先后时序发送数据。增强卫星对数据优先级修改任务响应的速度及星座各卫星执行的同步性；减少数据优先级调整代码实现难度；减少数据检索时对计算资源占用，且采用循环缓存方式无需对数据进行频繁移动。
26	一种基于m估计不完全约束的车辆导航方法<sep>一种基于m估计不完全约束的车辆导航方法，由基于mimu传感器的车辆导航系统实现。利用不完全约束算法构建卡尔曼滤波器，在车辆行驶过程中对mimu的导航信息进行修正，提高纯惯性导航下的导航精度，同时结合m估计算法，增强不完全约束算法的普适性，从而解决作战车辆在作战环境恶劣且无法使用gps等卫星导航系统情况下的导航定位问题。
26	基于眼图和信息熵的载波参数估计方法<sep>本发明提出了一种基于眼图和信息熵的载波参数估计方法，主要解决现有技术进行载波参数估计实时性差和估计准确性低的问题。其实现方案是：在发送端，对随机产生的一串二进制信息序列进行mpsk调制并发送；根据接收的数据算出眼图熵，做出不同定时相位下眼图熵的变化图形；根据接收的数据算出两个符号周期的眼图熵及平均值，做出该平均值的变化图形；根据接收的数据做出不同载波频偏下星座图熵的变化图形；分别找到三个变化图形中熵值最小的点，最小点所对应的位置即为定时恢复的最佳采样时刻，实际符号速率的估计值和载波频偏的估计值。本发明便于实现，估计精度高，可用于定时恢复、符号速率、载波频偏估计及设计高精度一体化的同步器。
26	一种卫星通信资源的动态管控系统和管控方法<sep>本发明公开了一种卫星通信资源的动态管控系统体系架构和管控方法，该系统的体系架构包括三层硬件架构和四层功能架构，该架构通过资源实现监视管理、面向任务匹配的网络规划与资源分配、需求更新的动态资源调配等手段，实现了卫星资源的可视、可控和动态高效分配。本发明解决了传统卫星通信系统中存在的网络开通时间长、资源使用过程缺少有效管控手段等问题，本发明的优点是，可以面向任务申请进行快速的资源分配和在任务执行过程中根据需求变化进行动态资源调配，可以实时监视卫星通信资源使用情况从而对空闲资源进行快速回收和重分配，大大缩短了网络规划和资源分配时间。
26	一种卫星智能化开放式综合电子系统<sep>一种卫星智能化开放式综合电子系统，包括中心控制模块、多级总线数据转换模块、低速遥测采集和遥控分发模块，定义了通用的综合电子系统架构，通过中心控制模块、多级总线数据转换模块、低速遥测采集和遥控分发模块实现了开放式的基础服务平台，能够通过程序上传进行在轨任务的更新和添加，可根据具体型号的特定需求，解决了现有卫星平台不能快速进行在轨任务更新的问题。
26	具备动力冗余能力的多发动机并联火箭控制装置及控制方法<sep>本申请提供了一种具备动力冗余能力的多发动机并联火箭控制装置，包括：检测设备，运算设备和执行设备，所述检测设备用于采集发动机核心工作参数；所述运算设备将采集到的所述参数进行基于故障模型的智能解算和分析，根据相应的智能算法给出发动机故障诊断结果，并根据所述诊断结果选择相应的控制策略；和所述执行设备接收所述运算设备给出的指令，并执行相应的控制策略。此外，本申请还提供了一种采用所述控制装置进行多发动机并联火箭控制的方法。
26	一种利用磁力矩器卸载卫星合成角动量的双滞环方法<sep>本发明涉及一种利用磁力矩器卸载卫星合成角动量的双滞环方法，属于卫星姿态控制技术领域。该方法针对磁卸载在地磁场方向刚满足卸载条件的轨道弧段附近磁控电压的频繁切换的问题，针对角动量误差以及地磁场矢量与角动量误差矢量夹角引入双滞环卸载策略，最后对卸载电压进行滤波平滑后输出，有效降低磁控力矩对卫星姿态稳定度的影响，实现了卫星的高稳定度姿态控制。相比传统磁卸载方法，采用本发明的方法可降低磁控力矩引起的卫星姿态角和角速度的波动，有效克服磁卸载对卫星的姿态稳定度产生的恶劣影响。
26	基于ofdm符号同步算法低复杂度实现及同步更新方法<sep>本发明提供了一种基于ofdm符号同步算法低复杂度实现及同步更新方法，包括基于迭代的ofdm信号延时相关函数的延时计算方法和基于对ofdm符号起始位置估计平滑处理的同步估计结果稳定更新方法。在计算时延上，次复数乘法可同时计算，和1次复数乘法相同，个样点复数相乘值的累加所需的‑1次加法，时延为‑1个时钟周期，2次加法时延为2个时钟周期，该方法将‑1个时钟周期变为2个时钟周期，大大减少了算法时延。由于受到噪声等因素的影响，位置偏差值是随机变化的，其分布情况与延时相关函数的幅度峰值分布有关。通过迭代运算对进行低通滤波实现平滑处理，通过系数来控制适用于真实位置变化快慢的情况。
26	基于信息论的预测快速协方差交互融合无源协同定位方法<sep>本发明提出一种基于信息论的预测快速协方差交互融合无源协同定位方法。该方法首先构建两个接收站一个外辐射源的无源协同定位系统的数学模型。第二，两个接收站分别通过扩展卡尔曼滤波算法对目标状态分别进行预测更新。第三，根据信息理论优化准则，并将原先的融合状态估计考虑在内，可得到各个误差协方差之间的k‑l散度(kullback‑leibler divergence)，并提出预测快速协方差交互融合算法权值的闭式解的计算方法。最后，提出了预测快速协方差交互融合算法得到目标的状态估计。本发明能够在多接收站一个外辐射源的无源协同定位环境下，改善融合效果，提高目标跟踪精度，算法复杂度低。
26	一种时钟同步系统<sep>本发明涉及一种时钟同步系统，包括：内置gps接收机，用于在接收到外部的gps天线输出的gps信号后锁定gps卫星并在锁定gps卫星后输出1pps时钟信号和tx差分信号；测试电路板，分别与所述内置gps接收机、主口和多个从口连接，用于将所述内置gps接收机输出的1pps时钟信号和tx差分信号分别输出到所述主口、多个从口；所述主口和多个从口分别用于将接收到的1pps时钟信号和tx差分信号输出到与主口、多个从口连接的需要时钟同步的设备以实现设备的时钟同步；电源接口，分别与所述内置gps接收机、测试电路板连接，用于在与外部电源接通后分别对所述内置gps接收机、测试电路板进行供电。本发明成本低，同步时间短。
26	2000测绘基准框架统一方法、装置与计算机可读存储介质<sep>本发明提供了一种2000测绘基准框架统一方法、装置与计算机可读存储介质，所述方法包括建立目标城市的cors基准站主网以及同等精度cors基准站扩充网；以省cors系统的基准站为起算点，并以起算点传递的方式，分别对cors基准站主网、同等精度cors基准站扩充网、第一控制网、第二控制网以及第三控制网进行平差计算，获得cors基准站主网、同等精度cors基准站扩充网、第一控制网、第二控制网以及第三控制网的基准站对应的cgcs2000大地坐标、1980西安坐标和2000坐标。该方法以cors系统为基准统一测绘基准框架，能够实现目标城市的2000大地坐标的动态维护和更新，同时能够实现坐标系统的信息共享，方便城市管理和城市建设。
26	无星历自主接入低轨广播卫星的方法<sep>本发明提出的一种无星历自主接入低轨广播卫星的方法，旨在解决终端设备在无星历条件下无法接入低轨广播卫星的问题。本发明通过下述技术方案予以实现：在无星历或者星历失效的情况下，终端设备通过自主方式接入低轨广播卫星，自主接入分三个阶段：目标搜索阶段、目标精跟踪阶段和轨道数据接收阶段。首先是目标搜索阶段，在搜索空域内全范围遍历的方式进行目标搜索，搜索到卫星信号后转入目标精跟踪阶段；通过轨道观测和外推的方法确保终端在一定时间内能持续接收卫星信号，在进行固定时间的精跟踪后转入轨道数据接收阶段；终端接收机在接收的数据帧中解算卫星下发的轨道数据，并利用新的轨道数据完成本地星历的更新和后续圈次的接入。
26	低时延高频单向旋转的cordic算法装置及算法<sep>本发明公开了一种低时延高频单向旋转的cordic算法装置及算法。先通过用[0,π/4]替代全象限，能压缩一半的查找表来节省资源；然后将查表法和单向旋转迭代运算结合使用；最后通过一次单向的加法树合并迭代来获得结果。跟其他算法相比，单向旋转能最大程度上节省资源，减少功耗，而合并迭代通过加法树并行运算来实现，能满足高频下的时序要求和有效缩短时延。通过仿真验证发现本发明相对传统的cordic算法的整体性能有了明显的改善，缩短了时延，减少了资源消耗，提高了工作的最高频率，更适用于高频的场景，也减少了综合器综合的压力，有利于获得最优的结构和最小的面积。
26	导航方法、装置、终端、导航服务器及存储介质<sep>本申请实施例公开了一种导航方法、装置、终端、导航服务器及存储介质，一种导航方法应用于终端设备，包括：获取第一终端设备的第一位置信息和第一速度信息，向导航服务器发送第一位置信息和第一速度信息，接收导航服务器发送的至少一个第二终端设备的第二位置信息和第二速度信息，至少一个第二终端设备是位于第一位置预设范围内的终端设备，根据第一位置信息、第二位置信息、第一速度信息和第二速度信息判断至少一个第二终端设备是否将在预设时间内超过第一终端设备，若是则显示超车提示信息。本申请实施例提供的导航方法、装置、终端、导航服务器及存储介质，可以有效避免交通事故的发生。
26	基于粒子滤波的gnss相位系统间偏差实时追踪和精密估计方法<sep>本发明公开了一种基于粒子滤波的gnss相位系统间偏差实时追踪和精密估计方法，包括以下步骤：步骤1：数据预处理，导入卫星星历、当前历元伪距观测值和当前历元相位观测值；步骤2：建立系统内和系统间的观测值方程，并线性化，得到单历元法方程或与之前历元累加法方程；步骤3：改正gnss观测值法方程系统间偏差；解法方程，更新粒子滤波权；根据带权粒子，计算相位系统间偏差小数部分的数值及粒子均方根；步骤4：重复步骤1‑3，实时追踪gnss系统间相位偏差小数部分的值，实现实时追踪；或重复步骤1‑3，精确估计相位系统间偏差值，固定系统内和系统间的双差整周模糊度，实现精密定位；本发明可高效的实现gnss相位系统间偏差的实时追踪和精确估计，实现系统无差别的多模gnss精密定位。
