label_id	text
26	一种基于滤波平滑的闭环控制系统姿态引入修正方法<sep>本发明涉及一种基于滤波平滑的闭环控制系统姿态引入修正方法，属于卫星姿态控制技术领域。本发明提出的基于机动能力约束的任务规划系统设计方法，是一种全新的针对实现多点目标、匀地速主动推扫和匀角速度扫描等多种模式成像任务规划的解决方法，很好地解决了由于主动推扫和被动推扫成像任务混合且主动推扫任务复杂多样导致的星上统一成像任务指令实现困难以及各成像任务在姿态机动能力约束下的最短机动时间计算问题。
26	一种静态伪距单点定位的方法及装置<sep>本发明提供的一种静态伪距单点定位的方法及装置，通过计算每个历元中每颗卫星的高度角和方位角，删除高度角小于预设值的卫星，并根据步骤s12处理后的卫星的高度角和方位角确定当前历元各颗卫星在站心坐标系e、n、u方向上的权重矩阵，根据所述权重矩阵通过最小二乘估计方法分步估计所述接收机在当前历元的位置，将计算得到的接收机在各个历元中的位置取平均，得到所述接收机的静态伪距单点定位结果，通过多历元解算并且求平均，有效的削弱伪距误差对单点定位的影响，从而提高定位精度且无需与固定基站配合。
26	一种卫星信号接收处理系统及处理方法<sep>本发明实施例提供了一种卫星信号接收处理系统及处理方法，其中系统包括：滤波器，第一低噪放大器，混频器，第二低噪放大器，数模转换器，以及可视化信号处理模块，其中可视化信号处理模块包括：滤波子模块，信号同步子模块，基带处理子模块，数据分析子模块，显示子模块。本发明实施例的卫星信号接收处理系统及处理方法，能够使卫星信号的接收与处理过程保持同步，从而满足测试人员对卫星信号的实时分析需求，并且，由于处理结果能够直接以可视化方式进行显示，因此能够使测试人员在第一时间直观地查看卫星信号处理结果，从而提高用户体验。
26	车辆导航控制方法及装置<sep>本发明公开了一种车辆导航控制方法，所述车辆导航控制方法包括以下步骤：当车辆在预设时间段内被启动时，获取所述预设时间段内对应的历史行车轨迹；判断车辆启动时的位置距离所述历史行车轨迹的最小值是否大于第一预设值；当所述车辆启动时的位置距离所述历史行车轨迹的最小值大于所述第一预设值时，启动导航，并将所述历史轨迹的终点设定为当前导航的目的地址。本发明还公开了一种车辆导航控制装置。本发明提高了导航控制的灵活性。
26	星载导航接收机自主完好性监测方法与系统<sep>本发明提供了一种星载导航接收机自主完好性监测方法与系统，应用于星载导航接收机，包括：获取目标卫星的导航信息；基于导航信息计算目标卫星的当前历元的瞬时轨道根数；获取目标卫星的多个历史历元的瞬时轨道根数；基于多个历史历元的瞬时轨道根数，拟合目标卫星的轨道根数随时间变化的曲线，得到目标时间曲线；基于当前历元的瞬时轨道根数和目标时间曲线，进行自主完好性监测，得到监测结果。本发明缓解了现有技术中存在的在接收到低于5颗可见导航卫星的信号情况下，不能有效发现故障和解算异常的技术问题。
26	基于种群超启发式算法的洋流环境下auv路径规划方法<sep>本发明公开了基于种群超启发式算法的洋流环境下auv路径规划方法，属于水下机器人领域。首先初始化种群，再根据代价函数得到整个种群中所有个体的初始综合代价值；然后设置种群基本操作集合和对应的操作选择概率向量；选择种群中的一个个体，和操作选择概率向量中最大概率对应的种群基本操作，对该个体进行操作，重复该种群基本操作直至遍历整个种群，完成一次迭代；再调整操作选择概率向量，进行下一次迭代，直到迭代次数达到设定值；最后在迭代完成后，选择代价值最小的个体，结合b样条曲线的起点、终点和固定控制点构成一组控制点，再生成最优路径。本发明解决了现有auv路径规划方法规划的路径不光滑、难以跟踪和跟踪耗能高的问题。
26	一种基于网络传输的北斗定位设备<sep>本发明提供了一种基于网络传输的北斗定位设备，包括主芯片、北斗模块和网络模块，北斗模块和网络模块分别与主芯片连接，北斗模块包括北斗天线和北斗定位芯片，网络模块包括以太网控制器和网络变压器，主芯片还分别连接晶振模块、复位电路、电源、存储器、指示灯和配置调试串口。同时支持以太网口和串口进行数据收发和功能配置，接口多样、使用灵活、功能丰富；采用udp协议传输，包括链路侦测消息和定位数据消息，通信协议轻巧、数据传输简单有效；支持浏览器web页面登陆访问设备、修改网络参数，用户操作体验好；掉电数据不丢失，使用方便；支持直流宽电压输入，供电方便；有工作指示灯，提示直观。
26	一种无盲点的gnss三频组合周跳探测与修复方法<sep>本发明公开了一种无盲点的gnss三频组合周跳探测与修复方法，首先构造一个三频无几何相位组合和一个三频stpir组合；利用这两个组合构建出公共盲点模型，进而得到三频伪距相位组合的系数约束条件；以此条件为基础，构造出可以探测出前两种组合盲点的三频伪距相位组合。将三频无几何相位组合、三频stpir组合和特别构造的三频伪距相位组合联立，实现对各频点观测值周跳的无盲点探测与修复。该发明是一种适用于多系统的周跳探测与修复方法。与其他常用三频组合探测法相比，具有良好的无盲点探测与修复效果，更适合实际应用。
26	低轨航天器多点多参数轨道上行数据计算方法<sep>本发明提供了一种低轨航天器多点多参数轨道上行数据计算方法，地面测控站接收航天器的遥外测数据，通过数据网发送给地面测控中心，地面测控中心完成数据处理后进行精密轨道确定，生成一分钟一点的弹道文件；将弹道文件转换为j2000坐标系瞬时轨道根数，每一点弹道记录对应一组瞬时轨道根数；将j2000坐标系瞬时轨道根数转换为拟平均轨道根数并进行处理，得到纬度幅角；采用纬度幅角替换平近点角，将轨道倾角、升交点赤经、近地点幅角、纬度幅角转换为弧度的格式；将纬度幅角归一化，采用差值拟合法计算q参数及其变率，最终得到航天器轨道上行数据的各参数变率。本发明同时满足航天器快速计算和精度较高的需求，具有较高的实用价值。
26	推进剂加注系统<sep>本发明提供了一种推进剂加注系统，包括挤压氦气输出容器(1)、加注容器增压端截止阀(2)、加注容器出口端截止阀(3)、加注容器挤压压力传感器(4)、加注容器(5)、加注管路进产品端截止阀(9)、产品端推进剂加注阀(10)、产品贮箱压力传感器(11)、产品贮箱(12)、产品端测试用阀门(13)、产品贮箱上游阀门(14)，还包括气动隔膜泵(6)、气动隔膜泵驱动气阀门(7)、气动隔膜泵驱动气输出容器(8)。本发明采用气动隔膜泵(6)，能够在推进剂加注容器压力低于推进系统贮箱压力时将推进剂加注到贮箱中，全程避免推进剂中溶解的氦气析出、积存，不会影响贮箱工作的可靠性。
26	一种基于音频的运载火箭故障检测装置及检测方法<sep>本发明涉及一种基于音频的运载火箭故障检测装置及检测方法，声音传感器阵列接收火箭待测产品的声音信号，对声音信号进行信号采集处理；进行小波变换、傅里叶变换后，进行特征值提取；将特征值与声音库中正常工作时的特征值进行对比，如果任一特征值超出限定阈值，则判断火箭上待测产品存在故障；将特征值与声音库中对应的典型故障下的声音特性进行匹配，如果处于某一典型故障的声音特性包络范围内，则判断故障类型为该典型故障。本发明通过声音信号进行故障检测，实现了对火箭的非接触测试，减少了火箭内部的测试电路，避免了在箭上测试电路故障带来的问题，同时减轻了火箭的重量。
26	一种以五连杆机构为可展单元的空间折展机构<sep>一种以五连杆机构为可展单元的空间折展机构，包括八边形支座、三自由度铰链、销轴、斜边杆、l形杆、短杆和直边杆，所述八边形支座与三自由度铰链固定连接，所述斜边杆通过转动副与三自由度铰链连接，所述斜边杆、l形杆、短杆和直边杆之间通过销轴连接，所述直边杆通过转动副与另一个三自由度铰链连接。本发明杆件均由二副杆构成，且运动副均为转动副，则结构简单、可通过电机驱动，且电机驱动可对展开速度进行控制，各可展单元稳定性好，同步性高，本发明具有质量小、折叠比大、定位精度高、结构强度大、稳定性高、可靠性高、结构简单、制造成本低的特点，且空间折叠过程简单。
26	仪器设备周围危险状况的报警装置<sep>本实用新型涉及gnss接收机技术领域，具体地说，涉及一种仪器设备周围危险状况的报警装置，其包括gnss接收机安装座，gnss接收机安装座内设有gnss接收机安装腔，gnss接收机安装腔中设有gnss接收机、主控模块、电池组、用于检测gnss接收机安装腔的温度的温度传感器以及蜂鸣器；gnss接收机安装腔的外围设有输水腔，gnss接收机安装座内位于输水腔的外围设有散热机构安装腔，散热机构安装腔中设有散热机构。本实用新型不仅具有较为稳定散热机构，还使得相关的人员可以及时对该仪器设备周围危险状况的报警装置进行检查。
26	一种针对btt导弹的非奇异滚转指令生成算法<sep>本发明公开一种针对btt导弹的非奇异滚转指令生成算法，其步骤为：步骤一：分别计算法向过载指令和侧向过载指令；步骤二：对法向过载指令在零值附近设计死区；步骤三：对侧向过载指令在零值附近设计滞环区域；步骤四：根据步骤二、步骤三中得到的法向、侧向过载指令计算滚转角指令。该算法分别对法向过载指令设计死区结构，对侧向过载指令设计滞环区域，并利用处理后过载指令计算滚转指令，从而避免滚转角指令由于气动干扰造成的符号突变，导致控制紊乱的问题。
26	一种实现卡尔曼滤波定位的方法和装置<sep>本文公布了一种实现卡尔曼滤波定位的方法和装置，包括：根据上一个历元时状态向量的预测值和上一个历元时误差协方差矩阵计算当前历元时状态向量的最优估计值和当前历元时状态向量的最优估计值的误差协方差矩阵；对于当前历元时状态向量的最优估计值中的每一个元素，计算该元素上上一个历元时最优估计值和当前历元时最优估计值之间的平均值，和上一个历元时最优估计值之间的差值；判断出一个或多个元素对应的计算得到的差值小于或等于预设阈值，将当前历元时最优估计值删除一个或多个元素，将当前历元时最优估计值的误差协方差矩阵删除对应的一个或多个元素，再继续执行计算下一个历元时状态向量的预测值，计算下一个历元时误差协方差矩阵的步骤。
26	gps,glonass和sdars频带的cpw馈电修改套筒单极<sep>一种薄膜柔性天线，具有特定应用以粘附到车辆玻璃，其中，所述天线具有宽频带天线几何形状，且能操作从例如gps和sdars卫星接收右手或左手圆形极化信号。所述天线是形成到基底上的印制平面天线，且包括在其中形成有槽的接地平面以及具有竖直部分和水平部分的调谐套筒。所述平面天线还包括辐射元件，所述辐射元件定位靠近所述调谐套筒且包括定位在所述槽内的馈电部分，其中，所述辐射元件包括从竖直部分朝向套筒的竖直部分延伸的第一水平部分和第二水平部分。所述接地平面能操作产生圆形极化信号以由辐射元件接收，其中，所述套筒提供信号的相位调谐。
26	一种接收机导航定位的方法以及接收机<sep>本申请提供一种用于接收机导航定位的方法，包括：接收多个卫星的基本广播电文以及改正参数，并分别建立对应于每个卫星的伪距观测方程和相位观测方程；使用接收到的改正参数对所述伪距观测方程和所述相位观测方程进行修正，得到经修正的伪距观测方程和相位观测方程；根据经修正的伪距观测方程和所述经修正的相位观测方程，构建观测量一；根据所述经修正的伪距观测方程和相位观测方程，构建观测量二；以及通过将得到的多个卫星的观测量一和观测量二联合求解，以得到用户定位的运算结果，其中，所述改正参数选自以下组合：分区综合改正数x；以及所述分区综合改正数x与轨道改正数x、钟差改正数x、电离层改正数x三者中的至少一个的组合。
26	一种遥测下行热备份且无缝衔接的星务遥测中断处理方法<sep>本发明公开一种遥测下行热备份且无缝衔接的星务遥测中断处理方法，涉及星务遥测技术领域，包括以下步骤：1、中心处理器接收中断信号；2、中心处理器记录该中断信号的发生时间，并清除所述中断信号；3、中心处理器判断所述中断信号的发生时间距离上次中断处理时间的间隔是否大于设定的阈值，若是，视为新的遥测中断进行中断处理，清除所有遥测中断信号，然后进行下一帧遥测数据组帧处理；若否，视为无效中断不做处理，直接进行下一帧遥测数据组帧处理。本发明的星务遥测中断处理方法可实现两个或多个独立的遥测通道完全热备份和无缝衔接，避免出现遥测丢帧问题。
26	一种新型梳状滤波的实时分次谐波检测方法<sep>本发明公开了一种新型梳状滤波的实时分次谐波检测方法，通过使每个二阶积分器的输出为一对正交信号，从而测出各单次谐波的幅值信号；在具体的过程中，将每个二阶积分器的输出相加与系统的输入相减，即可消除其他次谐波的影响，保证了系统的稳态精度；这样消除了传统的基于带通滤波器的多重二阶广义积分器的冗余的解耦环节，减小了计算负担，增快了系统响应速度。
26	一种静止气象卫星热红外数据估算近地面大气温度方法<sep>本发明属于大气遥感技术领域，公开了一种静止气象卫星热红外数据估算近地面大气温度方法，利用卫星观测亮温、气象台站和数值预报模式资料，获取具有代表性的热红外观测亮温和近地面大气温度；利用卫星云检测产品，获取无云条件下的观测亮温、台站实测气温和辅助资料的匹配数据集；基于逐步回归方法分析卫星观测辐射亮温、大气压力、相对湿度、卫星观测角度、儒略日参数等与近地面大气温度的关系，确定用于估算大气温度的关键因子；利用神经网络技术构建近地面气温估算的反演模型；采用本发明的方法可实现在静止气象卫星热红外数据晴空条件下的反演近地面大气温度的目的。
26	一种无线缆高密度立方星及其装配方法<sep>本发明公开了一种无线缆高密度立方星及其装配方法，包括主结构框架、太阳能电池阵、天线板、星上综合电子系统、动量轮、陀螺仪、磁力矩器、遥感相机、蓄电池组、相机紧固架、丝杆，主结构框架包括上端盖和星壳体，动量轮、陀螺仪、磁力矩器和相机紧固架固定于星壳体内，遥感相机固定于相机紧固架内，星上综合电子系统是通过将一块整的电路板经过折叠后形成的一多层电路板并将该多层电路板放置于星壳体内，太阳能电池阵固定在主结构框架的侧壁上。本发明实现了星上综合电子一体化与各系统间的无缆化，实现了立方星的高密度集成，提高了立方星内部空间的利用率。
26	航天器再入返回轨道规划方法<sep>本发明涉及一种航天器再入返回轨道规划方法，包括步骤：a.确定航天器再入返回轨道的再入点位置和速度；b.确定返回轨道规划的参数变量；c.建立返回轨道规划方程；d.返回轨道计算；e.计算倾侧角时间曲线；f.规划航天器再入返回轨道的再入过载；g.重复步骤a～f，迭代求解航天器返回轨道。根据本发明的航天器再入返回轨道规划方法，采用该方法可以快速设计航天器的返回轨道，对近地轨道返回和深空跳跃式返回的返回轨道设计有一定的参考价值。
26	一种用于空中动目标跟踪的云台指向及星体姿态协同控制方法<sep>本发明涉及一种用于空中动目标跟踪的云台指向及星体姿态协同控制方法，属于卫星控制技术领域。本发明首次在卫星系统中集成应用了云台及云台相机技术，使整星具备了牵引性的对动目标态势感知能力及相匹配的面向应急任务的星上实时响应能力，充分拓展开发和利用高机动遥感卫星的功能和整星资源。
26	一种基于静止修正的垂线偏差测量方法<sep>本发明公开了一种基于静止修正的垂线偏差测量方法，包括建立组合系统垂线偏差观测模型的姿态位置速度方程和测量方程；建立静止修正垂线偏差观测模型；判断载体是否匀速，若载体匀速，则将位置差值和航向角修正的测量值作为测量方程对垂线偏差方程进行改正；否则，将速度、位置差值及航向角修正的测量值作为观测量对垂线偏差方程进行改正；基于改正的静止修正的垂线偏差观测模型对惯性系统输出状态变量进行静止修正。本发明不仅使用速度、位置信息作为观测量，同时添加零角度修正观测量来限制航向角误差，通过更新角速度传感器的常值零偏来减少航向角漂移，解决了组合系统垂线偏差测量中天向姿态误差补偿不到位和航向角误差随时间积累增大的问题。
26	小型化可生存智能深空高速撞击器<sep>本发明属于深空探测技术领域，具体涉及一种小型化可生存智能深空高速撞击器。旨在解决现有技术中深空撞击器体积大、成本高且撞击后无法生存的问题。本发明提供的小型化可生存智能深空高速撞击器采用高加固单元与高集成单元双系统设计方法，基于着陆撞击后有效载荷的利用率进行分级防护，基于分时分工原理，将撞击后高利用率的有效载荷进行多层复合式防护缓冲结构进行保护，合理分配有限资源，以保证本发明在深空撞击任务中，通过自主智能化管理实现任务轨迹自主规划、飞行过程自主导航、撞击区域自主选择等高精度导航制导控制，而且能够实现撞后生存自主管理。
26	一种基于北斗短报文卫星通信的路灯控制系统及方法<sep>本发明涉及一种基于北斗短报文卫星通信的路灯控制系统及方法。该控制系统在每个路灯中集成单收的北斗短报文接收模组，路灯指挥调度中心通过北斗卫星链路对各路灯发送控制命令实现对路灯的控制。本发明无需在路灯终端中配置北斗用户卡，通过虚拟用户方式对路灯实现组播和组播功能。北斗短报文接收模组主要包括北斗短报文s频点无源天线、s频点低噪放、下变频、基带电路和单片机等组成。通过集成北斗短报文接收模组，解决传统路灯数据通信架设成本、管理成本、资费成本高的问题，采用本发明所提供的方法，路灯建设、改造简单，数据通信基本属于免费模式，极大提升了产业效率。
26	用于遥感卫星发动机喷口的防护装置<sep>本发明公开了一种用于遥感卫星发动机喷口的防护装置，包括用于对发动机喷口进行密封的密封垫圈，所述密封垫圈安装在保护盖内，所述保护盖包括圆盘部、弧形板部、凸起部和第一转动部，所述凸起部与第一转动部对立设置，所述第一转动部转动连接有耳片，所述耳片远离第一转动部的一端转动连接有锁紧扣，所述锁紧扣与凸起部形状相匹配。
26	一种导航卫星预报轨道的处理方法及系统<sep>本发明公开了一种导航卫星预报轨道的处理方法及系统，该方法包括：获取导航卫星的多个预报轨道弧段，包括当前预报轨道弧段和历史预报轨道弧段，其中任意相邻的两个预报轨道弧段之间具有重叠部分；根据多个预报轨道弧段确定导航卫星的基准轨道，计算多个预报轨道弧段中每一弧段相对于基准轨道的均方根误差；根据每一弧段相对于基准轨道的均方根误差判断当前预报轨道弧段相对于历史预报轨道弧段是否发生跳变；若发生跳变，则对当前预报轨道弧段进行跳变修复，得到导航卫星的连续预报轨道。本发明能够消除预报轨道边界跳变问题，兼顾高低轨道的导航星历播发，从而为用户提供实时高精度服务，提升导航系统服务性能。
26	一种卫星变轨期间横向质心高精度实时辨识方法<sep>本发明提供了一种卫星变轨期间横向质心高精度实时辨识方法，包括：建立490n发动机推力随燃料贮箱压强变化的数学模型；建立490n发动机远地点点火期间绕卫星横向的控制力矩与干扰力矩平衡方程；根据遥测数据下传时间间隔，建立连续两次遥测时间间隔内干扰力矩辨识模型；根据卫星遥测下传的10n推力器累积喷气量和490n发动机点火时长实时解算得到490n发动机干扰力矩；根据轨道测量信息对490n发动机推力变化模型进行修正。本发明通过卫星遥测数据实时高精度获取卫星的质心变化与490n发动机干扰力矩变化曲线，供地面人员判读，保证远地点点火期间卫星安全。
26	一种多模式联合的北斗变形监测数据处理系统及方法<sep>本发明提供了一种多模式联合的北斗变形监测数据处理系统及方法，该系统主要包括数据管理模块、数据处理模块、预测分析模块、预警模块。其中数据处理模块包括厘米精度实时解算模块和毫米高精度延时解算模块。本发明利用两种精度的解算模块同时进行解算，两个解算模块存在联系，实时解算能够为延时解算提供基线长度约束信息，提高多基线解算模块模糊度固定率；延时解算能够根据实时解算提供的形变点id对形变信息进行检验和判断，提高实时结果的稳定性，剔除部分粗差值；延时解算一方面能够提供高精度的解算结果，另一方面能够根据实时结果调整解算模式，提高延时结果的时效性，两者相辅相成提高监测的精度和时效性。
26	一种轨道短时失效情况下对地定向姿态的计算方法<sep>本发明公开了一种轨道短时失效情况下对地定向姿态的计算方法，包括：判断轨道数据有效状态；当轨道数据有效时，利用当前时刻的轨道信息计算当前时刻的j2000系到轨道系的姿态转化矩阵信息；当轨道数据无效时，利用上一周期的j2000系到轨道系的姿态转化矩阵信息和轨道角速度信息拟合计算当前时刻的j2000系到轨道系的姿态转化矩阵信息；以及基于当前时刻的j2000系到卫星本体系的姿态转化矩阵信息和陀螺测量角速度信息计算卫星本体系相对轨道系的姿态角和姿态角速度。
26	卫星间切换路径的确定方法、装置、终端及存储介质<sep>本申请实施例提供了一种卫星间切换路径的确定方法、装置、终端及存储介质。其中方法包括：基于多个卫星分别对应的卫星星历以及目标终端的位置信息和速度信息，确定经过目标终端的目标终端在多个过顶卫星各自的信号覆盖范围内对应的可驻留时间信息；依据目标终端在多个过顶卫星各自的信号覆盖范围内对应的可驻留时间信息，生成针对目标终端的多条卫星间预切换路径；确定多条卫星间预切换路径各自对应的卫星间切换次数以及馈电切换相关信息；依据卫星间切换次数和馈电切换相关信息，确定推荐切换路径。本申请实施例解决了现有技术中因仅考虑卫星间切换次数导致最终确定的推荐路径存在切换时延过长、甚至业务中断的问题。
