label_id	text
13	可锡焊的覆银镍导电层的制备方法及自动丝印覆银装置<sep>采用本发明的技术方案，不需要用特殊的助焊剂和焊锡料，只需采用一次共烧结的方法，就可获得具有更好的锡焊效果和焊锡结合力的镍导电层，而且操作简单方便，生产产品的一致性和稳定性好，不增加三废排放，绿色环保，适合工业化生产。
13	一种具有良好板形的双金属复合板轧制方法<sep>本发明只在轧前对材料进行处理，降低了轧后处理对设备的要求，工艺较为简单，并且得到的复合板板形得到有效改善。
13	一种钛铁矿碳热-电解制备钛铁合金的方法<sep>属于电化学冶金领域本发明具有流程简短、操作简单、设备要求低，钛铁矿中钛元素回收率高，以及无废渣、废水，绿色、清洁的特点。
13	一种具有优异抗高温软化的铝基材及其制备方法<sep>与传统具有特氟隆涂层烘焙容器相比，本发明下的产品无需复合，生产工艺更加简单。
13	钛合金<sep>所述含钴α‑β钛合金在冷加工期间未表现出实质性破裂。
13	一种硬磁高熵合金及其制备方法<sep>通过加入适量的硼元素以及稀土金属钐、钇、钕等稀有金属元素，在机械合金化的过程中与高熵合金中的铁元素和钴元素生成硬磁相，合金中的硬磁相与高熵合金原有的软磁相产生良好的磁性交互作用
13	一种高纯铂的制备方法<sep>实验结果表明，由本发明提供的方法得到的高纯铂纯度可达99.99％。
13	一种制备fe基纳米晶合金带材的方法<sep>得到fe基纳米晶合金带材。本发明提供的方法不需要改变非晶喷带机的结构，仅依靠外加静态磁场装置就能提高fe基纳米晶合金带材的软磁特性，结构简单；可显著提高fe基纳米晶合金带材的非晶形成能力及磁性能。
13	一种6000系铝合金的热处理方法及其应用<sep>属于铝合金热处理技术领域本发明在保持6000系铝合金板材力学性能的同时，明显改善了6000系铝合金板材的表面质量，消除了6000系铝合金板材的表面缺陷，这对扩大铝合金车身板的应用范围具有重要意义。
13	一种原子层级二维氧化铂量子点的制备方法<sep>本发明利用液氮辅助剥离法及其双氧水氧化法，简单有效的制备出大量高质量的单层或者少层的二维氧化铂量子点，并降低贵金属催化的成本。
13	一种钛合金钻孔设备<sep>所述第一动力轴的下端设置有一螺旋空间，所述螺旋空间内部设置有一能调节打孔间距的调节机构，本发明旨在设计一种无需设计新的工装，仅通过装置本身即可制定出不同孔距的装配孔的装置。
13	6xxx铝合金及其制备方法<sep>其中si的重量％对mg的重量％的比值在2.0:1(si:mg)至4.5:1(si:mg)的范围内；0.12‑0.44重量％的cu；0.08‑0.19重量％的fe；0.02‑0.30重量％的mn；0.01‑0.06重量％的cr；0.01‑0.14重量％的ti；和≤0.25重量％的zn；余量为铝和杂质，其中所述铝合金包含≤0.05重量％的任何一种杂质，并且其中所述铝合金包含总共≤0.15的所有杂质。
13	一种便于吊装的挤压铝型材<sep>涉及铝型材技术领域所述若干第一加强条前后两侧对应位置均开设有卡绳槽，左侧板和右侧板的外侧壁沿长度方向固设有若干第二加强条，本实用新型结构强度大，方便吊装。
13	一种提高镍白铜材料纯净度的方法<sep>总之，本发明具有工艺完善、提纯效率高且制得镍白铜纯净度高等优点。
13	一种用于碳纤维辊表面热喷涂工艺的打底层合金<sep>属于材料技术领域本发明制备得到的合金粉末比热容小，熔点适中，结合力强，不易氧化。
13	一种铝合金型材淬火装置<sep>冷却单元的分流板底端设置的喷嘴既可以实现上下移动，也可以实现转动，使喷嘴喷洒的范围更加广，对方形管材冷却更加均匀化，防止管材应力集中和冷却不均匀产生的变形或裂纹。
13	一种快速溶解的高强度高延伸率镁合金及其制备方法<sep>该快速溶解的高强度高延伸率镁合金既可快速与水溶介质反应溶解，且同时兼具高强度、高延伸率的力学强度性能，可满足多种工业领域的应用需求。
13	一种高强高导耐热的铜铬系合金材料及其制备工艺<sep>制备条件不苛刻，对设备要求低，易于产业化推广。
13	一种组织均匀tnm合金锻坯的制备方法<sep>本发明采用的是非等温锻造，且锻造温度较低，能够有效提高经济效益；并且本发明每个道次的变形参数以及热处理参数相同，操作简单。
13	一种高耐蚀性海洋用钛板的制备方法<sep>深度渗氧层的存在大幅增加了钛板在海洋环境中的耐蚀性，从而提高复合钛金属材料的服役期，降低相关装置的使用成本，具有很好的应用前景。
13	一种高致密化钨铜难熔合金的制备方法<sep>本发明采用振荡压力烧结的方式，使钨铜合金在保温石墨模具内经热场和力场的多场耦合作用，形成铜网填充在钨颗粒的间隙，并在循环压力作用下，促使粉体重排、液相流动和气孔排出，从而凝固成形，得到致密度较高的难熔合金，基本达到理论致密化，并且本发明制得的钨铜难熔合金内部只发生熔化和凝固反应，析出相简单。
13	用于空调器消音降噪的泡沫合金及其制备方法和应用<sep>镍能够在铜表面形成钝化膜，进而可以显著提高泡沫合金的耐腐蚀性能，具体地可以将腐蚀失重速率降至不高于0.045毫克/年。
13	一种al-mg-li-yb合金三级均匀化处理工艺<sep>属于有色金属技术领域该工艺通过三级均匀化处理保证合金不过烧的前提下，使得非平衡的共晶相溶解，提高合金组织的均匀性。
13	铜合金材料、制备方法及滑动轴承<sep>涉及铜合金制备的技术领域本发明的铜合金材料具有较高的抗拉强度、屈服强度，良好的延伸性且硬度可靠的优点。
13	一种适用于铝锂合金的湿喷丸表面改性方法<sep>与现有技术相比，本发明不借助其他处理方式，仅通过工艺参数的优化实现对材料组织结构的调控，提高了方法的通用性；利用湿喷丸中水对材料表面的冷却作用，可以降低铝锂合金表层动态回复再结晶引起的弱化作用，以充分发挥喷丸改性效果。
13	内燃机发动机铝活塞专用的高铜高镍铝合金液熔炼方法<sep>涉及铝合金铸造领域包括如下步骤：（1）测定zl109铝合金液的主要元素成分：（2）制备高铜高镍铝合金液：①计算铜、镍的加入量：②铜镍的溶解、熔化：（3）测定高铜高镍铝合金液中的铜、镍含量。本发明具有无需额外增加熔炼设备，节约熔炼成本，缩短熔炼周期的积极效果。
13	一种nimngacocu记忆合金薄条带的制备方法<sep>制备的记忆合金薄条带具有高韧性、柱状晶粒有序排列、晶格扭曲度可调的特点。
13	一种高强高导铜合金及其制备方法<sep>属于先进铜合金制备技术领域所得铜合金材料具有很好的机械性能。
13	一种利用氟代脂肪胺对钙钛矿薄膜进行疏水性修饰的方法<sep>进而提高钙钛矿电池的稳定性；同时修饰材料的引入使电池内部的电阻明显降低，电池内部界面电荷传输效率提高，这对其实际应用有重要意义。
13	一种骨诱导抗菌镁合金及其制备方法与应用<sep>与现有技术相比，本发明方案的镁合金既具有良好的抗菌性能又具有较好的骨诱导性，具有良好的医用价值。
13	一种超强高韧高延伸率7xxx系铝合金及其制备工艺<sep>而现有铝合金产品难以实现高强、高延展率的兼顾。
13	一种镁合金板材细晶化控边裂轧制方法<sep>属于金属材料加工技术领域为提高成材率、细化晶粒、促进镁合金板材规模化应用提供技术保障，具有广阔应用前景。
13	一种抑制镁合金腐蚀的缓蚀剂及其在汽车冷却液中的应用<sep>本发明的缓蚀剂还具有用量少，成本低，成分简单，易获得，对环境友好，适用范围广、操作安全方便和经济性好等优点。
13	适用于单向四柱液压机的金属材料模动式往复挤压装置<sep>在往复挤压挤压坯料(13)受到三向压应力作用，多次往复挤压，使挤压坯料(13)积累较大变形量，显著改善金属变形过程中的裂纹、空隙等组织缺陷，同时通过往复挤压能够有效细化金属晶粒。
13	一种成段铝合金的多种类造型装置<sep>属于铝合金加工技术领域本发明通过所有的定位夹持的部件能够有效的对待成型的铝合金进行固定作业，则在成型的过程中，能够有效的提高铝合金加工成型的精度。
13	一种高质量6系铝合金挤压铸坯及其制备方法<sep>最终得到既可以提升挤压性能又有助于提高最终时效强度的高质量挤压铸坯。
13	一种获得可靠连接并提高ti-al-nb合金自身性能的钎焊方法<sep>此外，通过合理的热循环工艺，减少了合金出厂前的工序，起到节约资源保护环境的作用。
13	一种氮掺杂炭材料担载贵金属催化剂及制备和应用<sep>即得担载型催化剂。该催化剂制备方法简单有效、绿色环保，经还原后，得到贵金属颗粒尺寸分布较窄、分散均匀的担载型催化剂。且该催化剂在醇的催化氧化领域具有广阔的应用前景。
13	用于晶粒细化的铝铌硼合金杆的制备方法<sep>属于晶粒细化剂材料制备领域采用本发明制备的铝铌硼合金杆中nbal和nbb颗粒分布均匀，具有更强的抗衰退性能和更高的细化效率。
13	一种短时间内获全固溶体接头的超声辅助铝合金焊接方法<sep>本发明的焊接方法在秒级的短时间内完成焊接，得到无脆性组织的高力学强度的全固溶体接头。
13	自阻电加热板材拉深成形装置和方法<sep>本发明解决了常温下钛及钛合金、镁合金和铝锂合金等难变形材料拉深成形时所表现出的成形深度浅、法兰起皱和壁部开裂等难题，也适合变形抗力较大的厚板料拉深成形。
13	一种结构可控的核-壳合金电催化剂合成方法<sep>或过渡金属(tm)与贵金属(pgm)所形成合金核(a)；壳的组成为金属铂(pt)；核壳的结构和组成可以通过调整各金属离子的浓度、与聚酰胺‑胺树形分子络合方式、还原剂及还原的方式和溶液ph等来实现。本发明核壳合金电催化剂还通过导电碳颗粒与聚酰胺‑胺树形分子的共价交联，克服聚酰胺‑胺树形分子聚合物弱的导电性，从而改善电催化剂的导电性。
13	耐热性铝合金<sep>所要求保护的合金的特征在于高水平的物理机械性质和加工性的组合以及高热稳定性。
13	一种用于焊接的中熵合金材料及焊接方法<sep>涉及焊接材料技术领域本发明利用中熵合金中的“扩散阻滞”效应，延缓甚至阻止焊接过程中异种材料的扩散，防止了各种脆性中间相的形成，极大提升了焊缝机械性能，且涉及的元素较少，配制简单，易于实现工业化生产，同时具有成本低、环境友好等优点。
13	一种cu-ni-sn-ticx铜基复合材料及其制备方法<sep>涉及铜基复合材料技术领域4.对铸锭坯进行高温长时间均匀化处理，通过固溶时效处理调整强度、韧性、摩擦磨损、抗应力松弛和导电导热性能等性能。
13	一种铝合金型材挤压成型装置<sep>涉及挤压成型装置领域本实用新型通过设置的余料刮除机构，刮除掉铝合金棒从挤压机出口挤出后，残留在模具上铝合金棒的尾部，避免影响下一次挤压；通过设置的自动板、下落槽和余料传送装置相互配合，使得残留的铝合金棒被刮除后落入余料传送装置被回收。
13	一种合金催化剂及其制备方法和其在氢析出反应中的应用<sep>本发明还提供了一种上述技术方案所述的方法制备得到的合金催化剂及其在氢析出反应中的应用。
13	一种铝钛钼中间合金及其制备方法<sep>本发明制备得到的铝钛钼中间合金成分均匀、偏析小、杂质含量低。
13	一种生物体内可降解mg-zn-ca-m的吻合钉材料及其制备方法<sep>而且可提供必要的营养补充，具有较高的生物安全性。适用于口腔、胃肠等器官的缝合或吻合手术中的吻合器用吻合钉材料，避免二次手术,为患者减轻痛苦。其中释放的微量银元素,还可抑制植入物周围细菌性炎症的发生。
13	一种具有混晶结构的硬质合金及其制备方法<sep>涉及冶金技术领域本发明的有益效果是本发明混晶结构的硬质合金同时兼具韧性和耐磨性能，使用寿命优于普通的矿用硬质合金，可应用于高硬岩层的挖掘。
13	切削刀具<sep>当用于加工诸如ti合金和ni基合金的非铁合金时，硬质合金本体表现出改善的耐化学磨损性能。
13	一种耐腐蚀铝合金及其制备方法<sep>能有效提高铝合金的硬度，增强了铝合金板的机械特性，而且加工出的铝合金重量更轻，减少使用过程中的重量负担。
13	一种散裂靶靶球表面金属等离子体浸没离子注入与沉积复合强化处理方法<sep>本发明解决了粉末冶金技术制备的非金属间化合物形态的散裂靶钨铁镍靶球磨损率高，薄膜与基体之间残余应力大、膜基结合力差和单一膜层承载能力差等问题，有效抑制了薄膜表面剥落，并能够制备出一种高膜基结合力，高硬度、摩擦系数低、耐磨损能力强的梯度功能复合薄膜。
13	一种化学式为[chnndo]金属有机框架化合物的合成及应用<sep>化学式为[chnndo]金属有机框架化合物晶体属于单斜晶系，p2/c空间群，晶胞参数为a＝5.4573nm，b＝10.900nm,c＝10.410nm，β＝98.172°，晶胞体积为v＝612.9nm，面心晶胞f(000)＝350，goof＝1.042，晶胞内分子数z＝4，化学式为[chnndo]金属有机框架化合物是以吡嗪‑2,3‑二羧酸、4,4‘‑联吡啶、稀土盐为原料，140℃下反应72小时
13	一种离心成型制备nipt合金靶材的方法<sep>通过使用旋转加热平台及特别设计的模具进行浇铸，使铸锭形状几近产品形状，后续经过简单的机加工即可达到最终尺寸，制成合格产品，成功的解决了使用传统应力加工方法对该成分区间产品进行加工时极高报废率的问题。
13	一种细晶镁合金管塑性加工方法<sep>属于镁合金管材制造领域本发明工艺稳定性好、工艺装备简单、工艺流程短，且生产成本低。
13	无氧铜板及陶瓷配线基板<sep>所述无氧铜板通过轧制而形成为平板状，具有与轧制面平行的晶面为{022}面、{002}面、{113}面、{111}面和{133}面的晶体，进行了在900℃的条件下加热10分钟的热处理后的平均晶体粒径为0.4mm以下。
13	一种超高强高韧高导电铜镍锡合金及其制备方法<sep>该制备方法实现和利用了多重复合因素强韧化铜合金，所得到的铜镍锡合金同时具有细晶强化、形变强化、弥散强化和沉淀硬化的特征，从而获得了较高的强度、韧性和导电性。
13	铜合金材的制造装置及制造方法<sep>所述制造装置为将熔铜连续铸造而制造铜合金材的铜合金材的制造装置，具备向熔铜中添加金属元素的添加单元、储存包含金属元素的熔铜的中间包、与中间包连接且用于使熔铜从中间包流出的浇注嘴以及配置于中间包内且由与金属元素的氧化物、金属元素的氮化物、金属元素的碳化物和金属元素的硫化物中的至少一种为同一种材料构成的附着构件。
13	金属栅的制造方法<sep>本发明能消除金属栅的化学机械研磨工艺在层间膜上的金属残留。
13	ta(1-18)/5系铝合金/ta(1-18)复合板材及焊接方法<sep>综合运用稀疏波边界效应消除技术、铝合金板防变形脆裂控制技术及消除ta(1‑18)/5系铝合金/ta(1‑18)单面或双面复合板爆炸应力退火工艺参数，试验得到了ta(1‑18)/5系铝合金‑ta(1‑18)焊合率为100％的高强度双面复合材料及成套焊接工艺参数方法，成功实现了ta(1‑18)/5系铝合金复合材料的一次爆炸焊接，为轻质高强度高耐蚀复合材料的应用提供了技术方案和工艺方法。
13	一种软磁片及其制备方法和用途<sep>实现了软磁合金带材裂而不碎，裂纹宽度很窄；压力控制使得裂纹宽度可控；绝缘处理在真空条件下进行，效果更加优异。
13	一种具有择优位向关系的nbsi合金<sep>本发明具有择优位向关系的nbsi合金，改善nb‑si基合金室温断裂韧性。
13	一种铜合金材料及其制备方法<sep>本发明中制备的铜合金的银含量较少，并且该制备过程可极大减少贵金属银的烧损，降低了生产成本；配合适当的热处理与冷加工工艺获得的铜合金材料具有高强高导的特点，成分均匀，性能稳定，便于加工成各种铜材，为其广泛应用提供了保障。
13	一种用于太空环境下发泡的泡沫合金及制备方法<sep>所述泡沫合金包括以下组分：镁、铝、钙、发泡剂和杂质；其中，镁和铝组成的合金体系中，镁的质量分数为66.4％，铝的质量分数为33.6％；在所述泡沫合金中，钙的质量分数为2％，发泡剂的质量分数为1.5％；镁和铝的质量分数之和大于96％。
13	wcp/eps消失模模样及wcp/fe复合材料制备<sep>属于金属成型技术领域本发明提供的工艺方法，使得合金颗粒与基体间结合牢固，颗粒分散均匀、提高产品综合力学性能，通过消失模铸造可制作大型、形状复杂的wcp/fe复合材料零件。
13	一种镦挤制备高强镁或镁合金的方法<sep>本发明通过镦粗压缩类应变与挤压伸长类应变合理结合的镦挤成形，极大削弱传统镁或镁合金棒材、管材、型材、板材等加工材的强基面织构，并结合变形温度调控，实现组织充分细化，根本消除镁或镁合金加工材的力学性能各向异性，使其具有高拉伸屈服强度、高压缩屈服强度及高对称疲劳强度，同时具有优异的二次成形性，适于镁或镁合金加工材及其轻体结构件在各类动载荷及多向载荷等复杂受力工况下的稳定服役。
13	一种半导体器件用金铍合金材料及制备方法<sep>通过本方法得到的金铍合金材料成分均匀，合金稳定，形状规则，可满足半导体器件欧姆接触电极的性能要求。
13	一种切削刀具用多主元合金涂层及其制备方法<sep>属于金属材料及其制备领域本发明方法制备的多主元高熵合金材料成分与原料配比成分一致；可以与多种基体材料有效结合，并可根据工件的具体使用情况通过微调多主元合金成分和结构来满足不同的刀具性能变化的需求；设备简单，生产效率高，适用范围广。
13	fe基非晶质合金带<sep>rp表示最大峰高度(μm)，rv表示最大谷深度(μm)，pn表示高度为0.5μm以上且3.0μm以下的峰的数目，vn表示深度为0.5μm以上且3.0μm以下的谷的数目，p表示自最高峰至第5高的峰为止的5个峰的高度的平均值，v表示自最深的谷至第5深的谷的5个谷深度的平均值。
13	一种用于得到低含锆量钛锆合金完全再结晶组织的处理工艺<sep>用清洗液进行清洗及干燥处理；3)将干燥处理后的合金进行热轧；4)将热轧处理后的钛锆合金进行第一次热处理；5)将处理后的合金再进行温轧；6)将温轧处理后的钛锆合金进行第二次热处理；7)将处理后的钛锆合金用清洗液进行清洗及干燥处理。本发明提供的得到钛锆合金完全再结晶组织的处理工艺简单易行，所涉及的设备药品等较为常见易得。使用本方法可在钛锆合金中获得细小的晶粒使材料强韧化，满足临床应用种植牙的需要。
13	一种单齿头硬质合金复合柱齿及其制备方法<sep>解决了现有硬质合金柱齿不能同时兼顾耐磨性和韧性的技术问题。
13	具有高长期热稳定性的6系低合金成分及其制备方法<sep>mg/si控制在0.95～1.15，采用本发明所公开生产工艺获得的铝型材在温度稳定性方面有巨大优势，能够满足当前市场对于合金材料长期热稳定性的需求，同时为今后开发高端汽车零部件奠定基础。
13	一种高矫顽力铝镍钴永磁合金及其制备方法<sep>较商用成熟的alnico5和alnico8永磁体，本发明的永磁合金具有较大的矫顽力和较好的剩磁，综合磁性能好。
13	一种提高铝合金强度的连续式热处理生产线及其工作方法<sep>属于铝、铜、镁、钛合金清洁生产与深加工技术领域本发明的连续式热处理生产线，通过设置的一条往复输送带组件，能够使得铝合金在退火、淬火和时效处理三个工序之间逐一进行，不需要人工干预，系统根据设定的时间，自动进行相应的处理，节省人力，能耗低，处理后得到的铝合金硬度高，而且提高了铝合金的断裂强度，提高了材料的耐损伤能力，提高铝合金的综合力学性能。
13	一种铝合金熔炼铸造铝液导流槽<sep>本发明可以解决目前对于铝液导流槽的设计，铝液导流槽设计的样式有封闭式与半封闭式，会存在以下问题：封闭式导流槽内，在导流槽与铝液的接触面上覆盖一层凝固的铝，后期的清理带来困难；半封闭式导流槽，铝液在导流槽内流淌时，出现铝液溅出的危险；无法对导流槽内的铝液进行保温助流；铝液的流淌速度不能调节。
13	一种高强韧ti-al系金属间化合物及其制备方法<sep>所述合金材料室温抗拉强度970mpa，延伸率达8%，800℃的抗拉强度达到450mpa，延伸率达9%，满足未来航空发动机对高比强度、高比刚度的轻质高温结构材料的迫切要求。
13	一种陶瓷覆铝铜板及其制备方法、散热元件和igbt模组<sep>本公开所述的陶瓷覆铝铜板与焊接得到的陶瓷覆铜板相比具有更少的空洞，该陶瓷覆铝铜板具有更薄的铝层，提高了散热元件的导热效率，并且对称的结构可以使陶瓷片两面应力均匀，不易弯曲毁坏。
13	高硬度钴基合金及其制造方法<sep>本发明的钴基合金，强化相为颗粒状，硬度高，耐磨性好，韧性好；其制造方法，科学合理，工艺简单易行。
13	一种高导热压铸铝合金材料及其制备方法<sep>本发明的高导热压铸铝合金材料成分配比合理，具有较好的散热效果。
13	一种l型钛合金型材生产方法<sep>属于金属加工技术领域生产工艺简单可控，成材率可提高35%以上，材料利用率可达到60%左右，大大降低了产品成本，达到批量生产重要条件。
13	用于在hall-héroult类型电解槽中生产铝的电解过程中使用的阳极以及制造该阳极的方法<sep>本发明还描述了一种用于在阳极顶部中加工底切凹部(10)以将阳极块(20)机械地固定到电流引导部上的突出部(8)的方法。
13	一种钛铝合金靶材的制备方法<sep>本发明的制备方法，控制简单，加工成本低，加工效率高。
13	部件的制造方法<sep>此外，从第四端部朝向第三端部沿着预备线方向延伸的直线和从第一端部朝向第二端部沿着焊接线方向延伸的直线所形成的角度为钝角。
13	一种抗菌镁合金<sep>属于镁合金生物医疗材料制备领域本发明通过优化镁合金成分设计，添加了ag、cu元素，赋予镁合金植入器件以抗菌活性，有效的避免了植入物周围细胞或组织感染的发生，显著提高了植入治疗的成功率和预后效果。
13	镍基粉末高温合金及其制备方法与应用<sep>所述镍基粉末高温合金的成分包括：c 0.02％～0.10％、co 14.0％～22.0％、cr 6.0％～14.0％、mo 1.8％～4.0％、w 3.0％～6.0％、ta 2.5％～6.0％、al 2.8％～4.0％、ti 2.6％～4.4％、nb 1.2％～3.2％、hf 0.1％～0.5％、zr 0.01％～0.08％、b 0.01％～0.08％、os 0.3％～6.0％和/或ru 0.5％～6.0％，以及余量的ni。所述镍基粉末高温合金具有优异的高温抗拉强度、屈服强度和高温持久性能以及更高的最高工作温度。
13	用于磁制冷应用的磁致热合金<sep>公开的材料的性能与许多已知的昂贵稀土类磁致热材料类似或更好。
13	一种汽车精密铝合金部件加工装置<sep>包括退火炉，退火炉的内部设置有工作腔，工作腔内设置有隔板，隔板将工作腔隔成退火腔和冷却腔，还包括热电偶、温度显示器、输入平台、输出平台、左支板、右支板、驱动电机、丝杠、限位杆、输送板、支撑板、转轴、第一滚珠轴承、第二滚珠轴承、齿轮、齿条、冷却风机、隔板、安装板、冷却风罩、两组滑杆、风管、牵引绳、第一磁铁、第二磁铁和多组硅碳加热棒，退火炉的左端和右端分别设置有导入口和导出口。
