label_id	text
13	一种高效产氢的双卤代物钙钛矿光催化剂的制备及应用<sep>属于催化剂的制备技术领域所得催化剂在可见光条件下，无贵金属铂助催剂辅助，表现出优良的催化活性。
13	一种钡钨阴极的简易制备方法<sep>属于难熔金属阴极材料技术领域得到孔度结构良好的亚微米级钡钨阴极，阴极表面出现纳米级活性物质，发射性能得到提高。
13	一种铝型材用电泳漆、其制备方法及电泳制得的铝型材<sep>采用本发明中提供的电泳漆经电泳处理铝型材，可以省去阳极氧化和着色这两项高能耗工序，节能环保、质量稳定。
13	全导通高柔韧金属箔带生产方法及一种高柔韧金属箔带<sep>本发明的全导通高柔韧金属箔带，在电缆做绕包或纵拖包时，减少或者消除因塑料绝缘隔断形成的环形通路引发的电感,避免信号数据衰减损失，保持导致屏蔽层圆周的阻抗一致，避免电磁波泄露，改善屏蔽效能。
13	稀土粘结磁粉及其制备方法和粘结磁体<sep>m为co、nb、zr中的一种或多种；核心层外部包覆铁氮层。此外，还公开了其制备方法和粘结磁体。本发明有效避免了在磷化以及后续处理过程中磁性原粉的氧化与腐蚀，进一步提高了材料的长时间耐温性与环境耐受性。
13	一种锂二次电池用负极及其制备方法及其锂二次电池<sep>它属于化学电源领域本发明能够防止纳米骨架在长期循环过程中的结构破坏造成电极的坍塌，充分抑制电极的体积变化提高界面稳定性，进一步提高锂负极的电化学性能。
13	高精度全液压模锻锤<sep>在开始加工前，固定组件固定下模，开始加工时，工作液压缸的活塞杆带动撞锤移动，撞锤推动上模撞击下模，固定组件限制下模的移动范围，以此降低上模撞击下模时，下模发生偏移的可能性，从而降低上模与下模的相对位置发生偏移的可能性，进而提高工件的加工精度。
13	铁离子掺杂氧化钨水合物覆盖的泡沫镍催化电极的制备方法<sep>该电极表面形成尖端放电效应，有望替代贵金属电极，大大的降低电催化制氢成本。
13	一种过氧钨酸盐稀土衍生物及制备方法<sep>该材料具有一定的发光性能，荧光寿命为8.72μs；此外其制备工艺简单且易于操作，使用原料廉价易得，产物收率高，纯度高，有潜在的应该用前景。
13	铜板表面防腐处理装置<sep>本实用新型通过设置导流板、集液箱、第一抽液管、第一抽液泵、第一安装机构、第一出液管、储液箱、加液管、第二抽液管、第二抽液泵、第二安装机构、第二出液管、横管、固定机构和喷淋头相互配合，达到了保护工人身体健康的优点，使工人在对铜板进行防腐处理时，能够有效的避免工人身体与化学溶液接触，保证了工人的身体健康，方便工人使用。
13	一种柔性纸基生物形态ni-v电极及其制备方法<sep>所制得的柔性纸基生物形态ni‑v电极中保留了纸基材料纤维的微观结构，由ni基颗粒连接而成，其中含有占总金属元素摩尔百分比0～5.0％的钒元素，该电极表现出了优良的电催化性能。
13	一种汽车用含钒钛钢合金化冶炼方法<sep>本发明利用含钒钛铁水对汽车用含钒钛钢直接进行合金化的冶炼方法，通过含钒钛铁水与转炉冶炼后的钢水进行混合，实现利用含钒钛铁水中钒、钛合金元素对汽车含钒钛钢进行钒、钛合金化，可显著降低汽车用含钒钛钢合金成本。
13	活性硬钎焊材料及用于组件的活性硬钎焊的方法<sep>并且由与所述第一反应物进行放热反应的第二反应物组成，其中，所述反应物的放热反应的生成焓大于或等于45kj/mol，特别是大于或等于50kj/mol。
13	铜球<sep>此外，预料之外的是，通过将纯度设为99.995％以下，使得铜球的球形度提高。
13	一种钨钴硬质合金制品热连接方法<sep>（5）对小样块的连接效果进行验证。
13	基于金属氧化物纳米带的有序化膜电极及其制备和应用<sep>本发明所构建的膜电极具有催化剂担载量低、催化剂利用率高、易于放大等优点。
13	高效二卤钙钛矿制氢光催化剂的制备及应用<sep>反应温度为40-110℃，常压。在可见光条件下，所得催化剂在没有贵金属铂助催化剂的情况下表现出优异的催化活性。
13	基于金属氧化物纳米带的有序薄膜电极及其制备与应用<sep>本发明构建的膜电极具有催化剂负载量低、催化剂利用率高、易于放大等优点。
13	用于铝型材的电泳漆及其制备方法和电泳制备的铝型材<sep>可以避免阳极氧化和着色两个高能耗工序，节能环保，质量稳定。
13	一种钡钨阴极的简单制备方法<sep>属于难熔金属阴极材料技术领域获得了具有良好孔隙结构的亚微米钡钨正极，纳米活性物质出现在正极表面，提高了发射性能。
13	基于金属氧化物纳米带的有序化膜电极及其制备和应用<sep>本发明所构建的膜电极具有催化剂担载量低、催化剂利用率高、易于放大等优点。
13	一种钨钴硬质合金制品热连接方法<sep>（5）对小样块的连接效果进行验证。
13	铜球<sep>此外，预料之外的是，通过将纯度设为99.995％以下，使得铜球的球形度提高。
13	活性硬钎焊材料及用于组件的活性硬钎焊的方法<sep>并且由与所述第一反应物进行放热反应的第二反应物组成，其中，所述反应物的放热反应的生成焓大于或等于45kj/mol，特别是大于或等于50kj/mol。
13	一种汽车用含钒钛钢合金化冶炼方法<sep>本发明利用含钒钛铁水对汽车用含钒钛钢直接进行合金化的冶炼方法，通过含钒钛铁水与转炉冶炼后的钢水进行混合，实现利用含钒钛铁水中钒、钛合金元素对汽车含钒钛钢进行钒、钛合金化，可显著降低汽车用含钒钛钢合金成本。
13	一种柔性纸基生物形态ni-v电极及其制备方法<sep>所制得的柔性纸基生物形态ni‑v电极中保留了纸基材料纤维的微观结构，由ni基颗粒连接而成，其中含有占总金属元素摩尔百分比0～5.0％的钒元素，该电极表现出了优良的电催化性能。
13	铜板表面防腐处理装置<sep>本实用新型通过设置导流板、集液箱、第一抽液管、第一抽液泵、第一安装机构、第一出液管、储液箱、加液管、第二抽液管、第二抽液泵、第二安装机构、第二出液管、横管、固定机构和喷淋头相互配合，达到了保护工人身体健康的优点，使工人在对铜板进行防腐处理时，能够有效的避免工人身体与化学溶液接触，保证了工人的身体健康，方便工人使用。
13	一种过氧钨酸盐稀土衍生物及制备方法<sep>该材料具有一定的发光性能，荧光寿命为8.72μs；此外其制备工艺简单且易于操作，使用原料廉价易得，产物收率高，纯度高，有潜在的应该用前景。
13	铁离子掺杂氧化钨水合物覆盖的泡沫镍催化电极的制备方法<sep>该电极表面形成尖端放电效应，有望替代贵金属电极，大大的降低电催化制氢成本。
13	一种锂二次电池用负极及其制备方法及其锂二次电池<sep>它属于化学电源领域本发明能够防止纳米骨架在长期循环过程中的结构破坏造成电极的坍塌，充分抑制电极的体积变化提高界面稳定性，进一步提高锂负极的电化学性能。
13	稀土粘结磁粉及其制备方法和粘结磁体<sep>m为co、nb、zr中的一种或多种；核心层外部包覆铁氮层。此外，还公开了其制备方法和粘结磁体。本发明有效避免了在磷化以及后续处理过程中磁性原粉的氧化与腐蚀，进一步提高了材料的长时间耐温性与环境耐受性。
13	全导通高柔韧金属箔带生产方法及一种高柔韧金属箔带<sep>本发明的全导通高柔韧金属箔带，在电缆做绕包或纵拖包时，减少或者消除因塑料绝缘隔断形成的环形通路引发的电感,避免信号数据衰减损失，保持导致屏蔽层圆周的阻抗一致，避免电磁波泄露，改善屏蔽效能。
13	一种铝型材用电泳漆、其制备方法及电泳制得的铝型材<sep>采用本发明中提供的电泳漆经电泳处理铝型材，可以省去阳极氧化和着色这两项高能耗工序，节能环保、质量稳定。
13	高精度全液压模锻锤<sep>在开始加工前，固定组件固定下模，开始加工时，工作液压缸的活塞杆带动撞锤移动，撞锤推动上模撞击下模，固定组件限制下模的移动范围，以此降低上模撞击下模时，下模发生偏移的可能性，从而降低上模与下模的相对位置发生偏移的可能性，进而提高工件的加工精度。
13	一种高效产氢的双卤代物钙钛矿光催化剂的制备及应用<sep>属于催化剂的制备技术领域所得催化剂在可见光条件下，无贵金属铂助催剂辅助，表现出优良的催化活性。
13	全导电高柔金属箔及高柔金属箔的生产方法<sep>屏蔽层，避免电磁波泄漏，提高屏蔽效果。
13	稀土粘结磁粉及其制备方法和粘结磁体<sep>芯层包覆有铁和氮层。此外，还公开了制备方法和粘结磁体。本发明有效避免了磁粉在磷化及后续处理过程中的氧化和腐蚀，进一步提高了材料的长期耐温性和环境耐受性。
13	一种钡钨阴极的简易制备方法<sep>属于难熔金属阴极材料技术领域得到孔度结构良好的亚微米级钡钨阴极，阴极表面出现纳米级活性物质，发射性能得到提高。
13	高精度全液压模锻锤<sep>模具，进而提高工件的加工精度。
13	铁离子掺杂氧化钨包覆泡沫镍催化电极的制备<sep>在电极表面形成尖端放电效应，有望替代贵金属电极，大大降低电催化制氢成本。
13	过氧钨酸盐稀土衍生物及其制备方法<sep>产品收率高，纯度高，具有潜在的应用前景。
13	锂二次电池用负极及其制备方法和锂二次电池<sep>属于化学电源领域本发明可防止长期循环过程中纳米骨架结构破坏导致电极塌陷，充分抑制电极体积变化，提高界面稳定性，进一步提高锂负极的电化学性能电极。
13	柔性纸基生物形态镍钒电极及其制备方法<sep>该电极表现出优异的电催化性能。
13	汽车用含钒钛钢的合金化冶炼方法<sep>钒钛铁水中的钒及钛合金元素用于汽车用钒钛钢合金化，可显着降低汽车用钒钛钢合金的成本。
13	用于组件的活性钎焊的活性钎焊材料和方法<sep>其他，每一层包括至少一个钎焊材料层(L)，其中每一层序列(SF)的每一钎焊材料层(L)包含基础活性钎焊剂(AHL)的至少一种组分(K)并且，以相互结合的方式，包含所有组分（K，...，K），其层序（SF）中的每一个包括至少一个第一反应层（Ra），第一反应层（Ra）由第一反应物、至少一个与活性钎焊材料中的第一反应层直接相邻的第二反应层(Rb)组成，并且由与第一反应物进行放热反应的第二反应物组成，其中形成焓为反应物的放热反应nt大于等于45kJ/mol，特别是大于等于50kJ/mol。
13	铜球<sep>此外，出乎意料的是，铜球的球形度通过将纯度设置为低于 99.995% 得到了改善。
13	一种钨钴硬质合金制品的热粘合方法<sep> (4)根据组合件的物理性能，选择合适的连接温度进行热粘合处理； (5)验证小样本的连接效果。
13	铜板表面防腐处理装置<sep>可有效避免工人身体接触化学溶液，保障工人健康，方便使用。
13	一种可快速氧化银氧化锡氧化铟电接触材料及制备方法<sep>且氧化速度比传统内氧化速度提高30％以上。
13	一种2系高损伤容限铝合金板材及其制备方法<sep>从而得到与基础2024‑t351合金相当的断裂韧性，而静强度得到大幅度提高的合金。
13	一种抗中温蠕变的铝合金导线材料及其制备方法<sep>还拥有较高的导电性能和抗拉强度。
13	一种键合用铝基合金母线的制备方法<sep>采用本发明能够提升键合用铝基合金母线的抗拉强度，并使其具有较高的延伸率。
13	用于空调器消音降噪的泡沫合金及其制备方法和应用<sep>还可以使泡沫合金具有较好的消音降噪效果以及与泡沫铜相当的力学性能和耐腐蚀性能，其中，泡沫合金的抗拉强度不低于280mpa、屈服强度不低于125mpa、延伸率不低于20.5％、腐蚀失重速率不高于0.076毫克/年。
13	一种基于半监督极限学习机的铝电解过热度识别方法<sep>本发明能够充分发掘无标签数据中隐含的信息，克服传统laplacian正则化的推断力弱的问题，且训练速度较传统方法快，能实现对工业系统的过热度状态的进行准确实时监测。
13	一种强韧抗高温氧化钼合金及其制备的方法<sep>本发明制备的钼合金具有较好的致密度、较强的韧性和抗高温氧化性能，因此具有广阔的应用前景和推广价值。
13	具有高玻璃形成能力无镍无铍锆基非晶合金及制备和应用<sep>本发明的锆基块体非晶合金择优成分具有>7%的塑性变形能力和超过1600mpa的屈服强度，较高的玻璃转变温度和初始晶化温度，较宽的过冷液相区，同时不含ni、be等生物不相容元素，在体育器材、医疗器械、高端微机械零部件等领域具有广阔的应用前景。
13	一种含zn的高强度铝基轻质中熵合金及其制备方法<sep>该合金的设计思路是从构型熵角度出发，在5083变形铝合金的基础上，通过添加zn元素，以提高合金的构型熵，同时该合金变为可热处理强化合金，再通过相应的热处理工艺，包括真空感应熔炼并采用重力铸造、均匀化处理、固溶与时效等，使合金的强度得到提高，可加工性能得到改善，扩大了合金的应用前景。
13	一种铜锌铝催化剂及其制备方法<sep>混合后经焙烧、成型后得到催化剂。本发明方法简单易行，制得的催化剂具有大的比表面积和高的表面铜元素含量，从而保证了催化剂的高催化性能和高耐热性能。
13	一种细化镁合金挤压型材组织的方法<sep>实现了以常规挤压工艺制备组织更细的挤压型材，节约能源，降低成本，易于推广应用，具有良好的应用前景。
13	一种铝合金轮毂的制备方法<sep>本发明的制备方法简单，实验过程可操作性强，工艺简单，易于操作。
13	纳米碳化物晶内强化型中高强铌合金粉末的制备方法<sep>本发明采用粒度较小的nbc粉末、通过滚动球磨制备纳米碳化物晶内强化型中高强铌合金粉末，使得铌合金中的碳化物第二相细化并绝大部分分布在晶内形成纳米碳化物，提高了nbc的强化效果，从而提高了铌合金的强度，解决了常规碳化物强化型铌合金制备方法中碳化物尺寸大、绝大部分沿晶界呈网状分布，难以破碎、均匀化的问题，弥补了加工设备能力的不足。
13	一种卷取侧导板的堆焊修复方法<sep>718材质卷取侧导板经焊接修复后堆焊金属与基体金属结合良好，无裂纹、夹渣、气孔、未熔合等焊接缺陷，焊前不预热或低温预热，不需要堆焊过渡层，焊后不需进行热处理，其制造工艺简单，堆焊工序少、修复效率高，且能进行多次修复以降低生产成本，实现了卷取侧导板循环再利用。
13	一种耐蚀铸造铝锂合金及其制备方法<sep>本发明的合金采用多元复合微合金化，加入元素铬、锆和镱，能明显提高铸造铝锂合金的耐蚀性，降低成本，性能优异。
13	拉链用链牙<sep>所述铝合金具有由通式：alsicumg(a、b、c、d以质量％计，a为余量、0.4≤b≤0.9、0.15≤c≤0.8、0.8≤d≤2.0，可包括不可避免的杂质元素)表示的组分，并包括含有mg和si的析出物。
13	一种抑制封装基板焊盘表面导电银胶扩散的表面修饰方法<sep>属于封装基板表面处理技术领域因此，本发明适用于印制电路板和封装基板铜焊盘的改性。
13	带孔道铝合金筒状壳体的精密铸造方法<sep>该精密铸造方法的成本低，原材料消耗少，制成的孔道光滑可靠，成品率高。
13	一种平均晶粒尺寸大于15μm wc-co硬质合金的制备方法<sep>以粗颗粒wc粉末为原料，经过过筛分级后与一定比例的peg和扩散搅拌混合，经干燥、压制制备wc冷压坯体；将冷压坯体直接进行不同质量co粉涂覆和压实，置于低压烧结炉内进行烧结和冷却，获得wc晶粒尺寸大于15μm的wc‑co硬质合金材料；或将冷压坯体进行与烧结，制备出多孔碳化物；进而将多孔碳化物进行不同质量co粉涂覆压实后，进行低压烧结，制备出wc晶粒尺寸大于15μm、不同co含量的硬质合金材料。
13	一种复合有色金属木纹金制作方法<sep>采用根本方法制得的复合有色金属木纹金强度高，木纹清晰可控。
13	一种利用局部滚压获得软硬异质层状金属薄板的制备方法<sep>具体是指通过局部剧烈塑性变形，将均匀的金属板材制备成软硬异质层状金属薄板的方法，主要涉及金属强化领域通过调整滚压区域的形状和分布，使金属的综合性能变得更加优秀，提高金属的实际工业适用范围。
13	金属板、金属板的制造方法、和使用金属板制造蒸镀掩模的方法<sep>蚀刻后的样品的翘曲的曲率k为0.008mm以下。
13	一种利用真空自耗法制备高导高强铜基材料的方法<sep>步骤四：将真空电弧熔炼炉清洗后充入氩气，将烧结模料作为真空自耗电弧熔炼炉的自耗电极，在真空自耗电弧熔炼炉中进行电弧熔炼，冷却后得到所述高导高强铜基材料。
13	一种提高2618铝合金固溶效果的工艺方法<sep>本发明提供的恒温固溶加循环降温‑升温固溶处理工艺方法简单，使2618铝合金的固溶效果明显好于传统的固溶处理工艺，具有很好的应用价值。
13	一种高强度抗疲劳铝合金及其制备方法<sep>本发明提出的铝合金的制备方法过程简单，得到的铝合金强度高、韧性好、热稳定性和抗疲劳性优异。
13	一种金属多层板的制备方法<sep>由此，可以得到界面影响区域比例更高的新的多层板,使最终得到的产品在维持较低的生产成本以及耐腐蚀的前提下既具有高强度,又具备较高的拉伸塑性，且本发明所提供的方法易于在工业上形成规模化生产。
13	砖砌结构金属材料及其制备方法<sep>最终获得具有微纳米尺度砖砌结构及良好力学性能的金属材料。本发明制备的砖砌结构材料不仅从微观到宏观三维尺寸可以精确控制，而且通过调整电沉积材料的组元和结构，根据需求调控整体材料的性能。本发明为可利用电沉积制备的金属材料的性能改善和变形机制研究提供新的方法。
13	一种钼基合金涂层的制备方法<sep>属于合金涂层制备领域本发明能够有效地解决在低熔点基体上制备高温涂层时，涂层和基体之间的热膨胀系数不一致的问题，结合强度较高。
13	硬质合金及制备方法<sep>氧化钇弥散分布在粘结相中，经过合金性能检测，氧化钇的加入提高合金强度和合金硬。
13	一种汽车热交换系统用铝合金钎焊复合工艺<sep>属于有色金属材料加工技术领域本发明的生产工艺流程短、生产成本低、提供的汽车热交换系统用铝合金复合材料产品质量高、缺陷少。
13	一种汽车轮胎用硬质合金防滑钉芯及其制备方法<sep>本发明的硬质合金防滑钉芯，其技术要求能达到硬度≥hv 1350、抗弯强度≥1700n/mm、密度为≤12.5g/cm、rs值为70～105、钴含量≤4％，能够满足“异型化”、“小型化”、“轻量化”、“低钴化”的市场要求。
13	具有高强度高塑性易切削环保无铅硅黄铜的定量识别方法<sep>本发明测试方法实施简单、成本低，可以定量识别出高强度高塑性易切削硅黄铜合金。
13	一种用于铝合金挤压后处理的牵引设备<sep>减少了产品的报废率，同时，通过设置的吸收装置可以将切割时的铝屑进行收集，保障了车间的生产环境。
13	一种用于铝合金热处理的冷却装置<sep>本实用新型通过设置散热槽、第一防尘网、吹风散热机构、进气槽、第二防尘网、壳体、制冷箱、制冷器、抽风管、抽风机、安装机构、出风管、横管、固定机构、吹风罩、支撑脚和防滑垫相互配合，达到了对铝合金冷却效果好的优点，使铝合金在进行冷却时，能够同时对铝合金的顶部和底部进行冷却，缩短了铝合金的冷却时间，提高了铝合金的冷却效果，从而提高了铝合金热处理的冷却装置的实用性。
13	一种铝合金加工生产用自清洗式分流盘<sep>该铝合金加工生产用自清洗式分流盘设置有单独的导液结构，可以直接将清洗液导入到该装置的内部，对内部的流道进行清洗，方便后期的维护工作。
13	具有纳米结构的铅基硫属化合物合金颗粒及其制备方法<sep>本发明所合成的铅基硫属化合物合金不但形貌可控、比表面积高，而且产量高，制备条件要求低，易于产量化制备。
13	一种锌-铜合金的变质处理方法<sep>同时还提供该变质剂对锌‑铜合金进行变质处理的方法，处理过程中只需要在熔炼过程中加入变质剂搅拌均匀即可，制备工艺简单，效果明显。
13	一种低钼含量钼铜合金及其制备方法<sep>得到压坯；排胶步骤：去除所述压坯中的所述粘结剂，得到坯料；烧结步骤：将所述坯料进行烧结处理，得到钼铜合金。该方法具有效率高、致密性高、组织均匀、一致性好、成品率高等效果。
13	连续热浸镀金属装置以及连续热浸镀金属方法<sep>和第2支承辊(8)：在镀浴(3)内位于第1支承辊(7)的上方，与钢带(2)的与沉没辊(6)接触的面的相反面接触，并且第1支承辊(7)的直径(d1)、第2支承辊(8)的直径(d2)以及第1支承辊(7)的旋转轴与第2支承辊(8)的旋转轴的铅垂方向的距离(l)满足特定的条件。
13	一种高熵合金浸银复合材料及其制备方法和应用<sep>涉及高熵合金材料技术领域本发明通过将银基复合材料浸入alcocrfeni高熵合金内部后，将高熵合金具有的高强度和高耐磨性特性与银基复合材料具有的低摩擦系数特性相结合，同时提高高熵合金浸银复合材料的抗高温氧化性能，使其作为动密封材料的应用温度可达600℃，解决现有400～600℃动密封材料寿命短，可靠性差的技术缺陷。
13	改善的厚锻7xxx铝合金及其制备方法<sep>并且实现改善的特性组合，诸如改善的裂纹偏离抗性、强度、断裂韧度和耐腐蚀性的组合。
13	一种制作铜线的生产方法<sep>热处理，最后拉丝机拉伸成铜线，其具有优异的延伸性能，产品合格率高。
13	一种耐蚀性、高强度的铝合金及其制备方法<sep>本发明可以获得以下有益效果：采用稀土变质和电脉冲凝固技术相结合的复合技术制备的铝合金，相比于现有技术，可以获得尺寸均匀的等轴晶组织，所制备的铝合金拥有很高的抗拉强度、高塑性以及优异的耐腐蚀性。
13	一种粉末锻造制备高致密度细晶钛合金的方法<sep>本发明方法工艺流程短、原料成本低、材料利用率高，制备出的钛合金制件致密度高、成分均匀、晶粒细小、力学性能优异。
13	基于搅拌摩擦加工制备al-pb合金耐磨层的方法<sep>本发明通过搅拌摩擦加工工艺，利用搅拌头的快速旋转生热使纯铝产生热塑性，并使铅颗粒液化，充分混合到纯铝基体中，冷却后铅以较大尺寸的粒子“嵌”在基体内，形成少量改善铝铅合金耐磨性的“pb包si”微观结构，在一定程度上改善因铝铅比重差别较大而引起的偏析问题，可用于汽车轴瓦材料。
13	一种re-si共改性铝化物涂层及其制备方法<sep>属于高温防护涂层技术领域本发明的优点：制备工艺简单；成分可控性高；涂层中分布有带状的γ’‑nial相，有利于提高涂层的韧性；可获得crrew均匀分布于β‑nial外层的涂层结构。
13	防扭曲无关节联轴器<sep>并通过前处理、冶炼、制粉成型、成品等工艺进行联轴器制备，通过原料配方和采用循环氢化‑去氢化的改进，不仅获得合适联轴器合金的颗粒大小，同时能显著降低合金中存在的杂质元素含量。
13	一种高强高导铜合金管及其制备方法<sep>本发明通过在传统铬锆铜成分基础上，进一步通过添加nb能细化基体晶粒和析出相cr的粒径、添加re(稀土)能够净化晶界和基体，从而提高了合金的韧塑性、降低合金冷变形抗力，使合金管材加工工艺的顺应性得到明显改善，提高了制成品的合格率。
