label_id	text
16	一种可调节光源聚光度的太阳能led灯<sep>采用了复位弹簧，当导电块和电控制块抵接时，移动灯泡和固定灯泡处于通电发光状态，随着固定杆的继续向下移动，复位弹簧可保障导电块始终和电控制块抵接，从而实现壳体向下移动时，固定灯泡和移动灯泡始终处于通电发光状态。
16	一种太阳能充电控制器<sep>本技术通过在壳体内设置半导体制冷片实现对控制芯片进行散热，提高了控制芯片的散热性能，进而优化整个太阳能充电控制器的散热性能，提高了太阳能充电控制器的工作性能。
16	一种太阳能光伏电池制造用扩散炉<sep>该太阳能光伏电池制造用扩散炉，通过加热部位处于匀速变换状态，即可提高加热的均匀性，同时两个sic桨在转动时，始终有一部分处于石英舟的底部，对石英舟起到支撑作用，因此也可以保证石英舟在加热时，处于稳定的状态。
16	一种掺杂离子稳定剂的钙钛矿薄膜及其制备方法和应用<sep>本发明还公开了一种掺杂离子稳定剂的钙钛矿薄膜的制备方法和应用，通过掺杂本发明中的离子稳定剂，制备得到掺杂的钙钛矿太阳能电池，提高电池性能，并提高太阳能电池的稳定性。
16	一种智能型太阳能路灯<sep>根据本发明提供的技术方案，透光筒可以为太阳能组件提供防风保护，防止太阳能组件常年受风吹拂发生损坏；另外，雨水收集箱内的雨水还可防止路人攀爬灯杆。
16	光伏组件焊带内反射光学利用率的表征方法<sep>本发明的光伏组件焊带内反射光学利用率的表征方法可准确评估不同类型光伏组件焊带的内反射光学利用率，以方便光伏组件厂家进行光伏组件焊带的选择。
16	一种多臂结构有机光伏材料及其制备方法与应用<sep>然后通过在末端引入强吸电子基团而构成。该合成方法原料来源广泛、易于纯化，有望成为商业化的有机光伏材料。该有机光伏材料表现出较强的吸光度、良好的热稳定性和较高的电子、空穴迁移率；基于该材料制备的有机光伏器件具有较高的光电转化效率，在光伏领域具有潜在的应用价值。
16	一种太阳能三七干燥装置<sep>本发明干燥稳定性好，干燥效率高，能量利用率高，且节能环保。
16	一种镧系掺杂硒化锌纳米材料的制备方法<sep>本发明制备工艺简单、产率高、可控制备等优势，并且在生物医学，太阳能电池，温度检测等领域具有广阔的应用前景。
16	太阳能集热管<sep>该太阳能集热管(1)的特征在于，红外线反射层(3)为分散有nb(6)的ag层(7)，且nb(6)的含有率为0.1at％～31.8at％。
16	一种光伏组串中失配组件的定位方法、装置及光伏系统<sep>该方法并不是对于失配组串中的每个光伏组件进行逐一拍照，判断是否发生失配，而是按照台阶电压区间进行ir拍照，因此，可以提高失配组件定位的效率。
16	一种稳固式太阳能电池片串焊机<sep>属于太阳能电池片技术领域底板上的安装槽起到卡合减振垫的作用，减振垫可减轻串焊机作业时产生的振动，或传送带输送太阳能电池片时产生的振动，避免较大的振动影响串焊机的焊接精度。
16	一种光伏电站的异常数据检测方法、装置及电子设备<sep>进一步的，本发明通过密度值和距离值两个维度数据来确定聚类中心点，进而使得确定的聚类中心点更准确，进而使用该聚类中心点得到的聚类结果更加准确，确定出的异常数据也更加准确。
16	利用通过平面镜均匀地收集的光线和通过直接接触的冷却法的太阳光发电装置及方法<sep>构成：所述太阳能发电装置包括：框架(frame)；太阳能电池板(photovoltaic panel)，布置于所述框架上，使得受光面在背向太阳的状态下与太阳光入射方向垂直；至少两个平面镜(mirror)，布置于所述框架上，将入射的太阳光反射到所述太阳能电池板的受光面；转动机构(rotation mechanics)，跟踪太阳光，使所述框架双轴旋转，使得太阳能电池板的受光面与太阳光入射方向垂直；及柱子(post)，支撑所述框架和所述转动机构(rotation mechanics)。
16	一种平板式太阳能发电制热器<sep>本实用新型结构简单，设计紧凑，操作方便，能够快速的安装或拆卸制热器，提高了安装、拆卸的效率，降低了工作强度，适合推广使用。
16	一种防冻太阳能集热管<sep>本发明通过白天光伏板对电磁铁供电，进而使得在白天时对盘簧进行上劲储能，通过夜晚盘簧释放能量，使得搅拌叶片对内管中的水进行搅动，保持内管内的水的流动，进而防止内管里的水结冰，使内管爆裂；通过盘簧带动往复丝杠转动，往复丝杠带动丝杠螺母移动，进而使弹性刮环对内管的内壁的水垢进行刮除，使内管保持良好的导热能力。
16	光伏组件功率优化电路及其通信方法<sep>功率优化电路可以利用电力载波信号的方式向外发送数据，除了使每个光伏组件中的每一个光伏电池串都对应由一个功率优化电路执行最大功率追踪之外还集成了通讯功能。
16	用于水电工程大水位差的漂浮光伏电站系统<sep>尤其是公开了一种用于水电工程大水位差的漂浮光伏电站系统，属于水利水电工程附属发电装备设计制造技术领域所述的漂浮光伏电站系统，包括浮箱基座和布置在该浮箱基座上的漂浮支架，所述的漂浮光伏电站系统还包括侧向自适应活动锚固机构，通过浮箱连杆连接为一个整体的各件所述的浮箱基座在所述侧向自适应活动锚固机构的配合下随水面可升降的锚固在水面上。
16	一种光导管互穿内照明太阳电池<sep>本发明的优点是：通过光导管回收光阳极基底上没有照射到光阳极薄膜上的太阳光，并将太阳光全光谱引入到光阳极薄膜中，使光阳极薄膜更多的接收到太阳光，从而提高太阳电池的光电转换效率。
16	基于金属原子气体操控的纤端光学天线及其制备方法<sep>其特征是：所述纤端光学天线主要由一段三芯光纤1组成，三芯光纤1的一个纤端经过研磨形成纤端圆锥台2，而纤端圆锥台2的端面上采用原子光刻技术沉积有一维周期性金属光学天线3；其中，三芯光纤1包含包层4、中央纤芯5以及两个偏芯6，中央纤芯5位于包层4的中央，两个偏芯6关于中央纤芯5对称分布；一方面，中央纤芯5(或两个偏芯6)传输的传导光波7直接(或经过纤端圆锥台2全内反射后)作用在一维周期性金属光学天线3上
16	一种太阳能和相变材料耦合的供暖系统及其控制方法<sep>再配合新型热水回路，能较好的分配和使用热量，提高太阳能利用率，减少能源的浪费。
16	一种用于正面接触钝化的双层钝化膜及其制备方法<sep>本发明中的用于正面接触钝化的双层钝化膜，即掺磷sicx/掺磷多晶硅叠层薄膜，结合图形化刻蚀工艺可大幅减少正面的吸光，刻蚀过程中，掺磷sicx薄膜是极佳的刻蚀阻挡层，从而可以保护其下的金字塔不被破坏，刻蚀后，钝化区为隧穿氧化硅/掺磷sicx叠层结构，仍可提供有效的接触钝化，sicx薄膜由于其宽的光学带隙，寄生吸收少，金属区则为隧穿氧化硅/掺磷sicx/厚多晶硅薄膜，可保证烧结过程中不被浆料烧穿。
16	一种太阳能庭院灯<sep>本实用新型的优点在于：无需地下布线，提供照明的同时有灯光特效散发出来。
16	一种太阳能电池的制作方法及太阳能电池烧结装置<sep>本发明同时提供了一种具有上述有益效果的太阳能电池烧结装置及太阳能电池。
16	一种高价值植被的植物培育系统及培育高价值植被的方法<sep>从而有效提高经济效益。解决了现有价值植被的植物培育系统不能选择性地利用太阳光中的有效波段来缩短植物的生长周期以及提高植物的品质进而有效提高经济效益的技术问题。
16	用于光伏组件的升降压型电压转换器及电压调制方法<sep>在含有光伏电池的应用场合中在基于可实现降压及升压的前提下用于光伏组件的升降压型的电压转换器，能够根据实际情况决定对阵列中的光伏组件电压进行电压调制。
16	一种光伏电站自动预警云平台及系统<sep>本发明由于采用了云部署设计，使得少量运维人员可以在办公室监控更多的光伏电站。
16	绒面均匀空穴或电子传输膜的液膜高温高浓速涂原位速干制备方法<sep>本发明在不对硅金字塔绒面进行抛光磨平处理的条件下，利用高温及溶剂自身极易挥发特性的综合作用下溶剂快速挥发的特点，可以实现在μm尺度起伏的金字塔绒面基底上全覆盖均匀仿形空穴传输层及电子传输层薄膜的制备，保持了硅太阳能电池高效率的优势，能够实现光电转换效率大于35％的硅‑钙钛矿两端叠层太阳能电池技术。
16	一种管道防冻型太阳能系统<sep>属于太阳能热水器技术领域同时主管道实现进水和放水两用功能，省去了进水管道，降低了安装成本。
16	一种散热型光伏组件边框及光伏组件<sep>两个侧框架相对的侧面上对称设有安装组件，安装组件包括两个上下相对设置的夹板，下方的夹板与安装板之间设有间隙，夹板上设有至少一个以上散热孔，上方的夹板与前框架相对的侧面上设有螺孔，前框架上设有与螺孔匹配的固定孔。
16	含光伏的低压配电网分布式储能优化配置与运行方法<sep>本方法首先根据对节点电压允许偏移的要求来确定整个lvdn所需des的总额定功率和总额定电量，然后构建了以上级电网负荷率最大为目标、考虑des的电压无功控制特性对lvdn电压的支撑作用以及lvdn中des的安装点数限制的优化模型，优化结果表明所提出优化模型能够对des的安装位置、额定功率、额定电量和各时段的充放电状态和功率同时进行优化决策，在对上级电网负荷率进行优化的同时也能够使电网的有功损耗得到一定程度的减小。
16	一种空穴传输材料及其制备方法、钙钛矿太阳能电池<sep>本发明所述空穴传输材料在酞菁环上引入6个甲基，一个长链烷烃，可以诱导酞菁分子成膜后在钙钛矿层上形成平躺的面面堆积分子构型，提高酞菁分子薄膜在太阳能器件中的空穴迁移率，增加酞菁材料有机溶解性，实现器件全液相工艺制备，而且所述空穴传输材料具有优良的疏水性能，可以更好的保护钙钛矿吸光层，避免受水氧影响而产生分解，从而提高钙钛矿太阳能电池器件的寿命；将所述空穴传输材料用于n‑i‑p钙钛矿太阳能电池器件，器件的光电转换效率可达17.27％，且器件运行1300h还可以维持初始光电转换效率的90％以上，器件的稳定性高。
16	一种基于人工智能的太阳能发电系统<sep>本发明主要用于解决现有人工智能管理的太阳能发电系统无法实时对周围的植被和动物进行实时监控，导致太阳能电池板容易遭受破坏的问题。
16	一种太阳能光伏发电装置<sep>从而随太阳高度改变而变化，能够通过转动组件使光伏板转动从而使之正对太阳，能够通过控制组件控制转动组件的开启，能够通过洗刷组件对光伏板进行喷水清洗并且能够通过刷子对光伏板进行清刷。
16	一种果林集水灌溉系统<sep>本发明能够充分利用光伏板作为集水载体，进行果林集水和灌溉，同时充分利用自然能源。
16	一种两分体光伏接线盒<sep>本实用新型具有不易损坏，牢固耐用的优点。
16	一种异质结太阳能电池及其制备方法<sep>异质结光伏电池的制作方法包括：n型硅片的清洗；在n型硅片的表面制备硅纳米线阵列；对n型硅片以及硅纳米线各自的表面进行钝化处理；硅纳米线/spiro‑ometad复合活性膜的制备；pedot:pss/银纳米颗粒/多壁碳纳米管复合导电层的制备；聚乙烯醇有机钝化层的制备；ito透明导电层的制备；正面银栅电极的制备；背面电极的制备。
16	一种双面玻璃光伏建材构件及其制备方法<sep>高稳定性的采光发电性能，同时制造过程可以实现美观的弧度与单块大尺寸构件化，特别适合复杂曲面的幕墙、采光顶、农业大棚、阳光房、停车棚、候车厅等建筑使用。
16	一种自清洁智能太阳能发电装置<sep>大大提高了发电能力，使单位时间里转化的电量达到最大化，同时也能够每天对发电板进行表面清洁，延长装置整体的使用时间。
16	一种提高太阳能电池钙钛矿吸收层结晶密度的方法<sep>本发明钙钛矿吸收层的晶体重结晶过程中晶粒排布更加紧凑致密，提高其光电转换效率。
16	一种高增透耐脏污减反射镀膜液及其制备方法及太阳能光伏电池封装玻璃<sep>本发明采用双原位聚合法即无机组分溶胶凝胶过程与聚合单体分子同时进行聚合制备高增透耐脏污减反射镀膜液，该镀膜液的ph偏弱酸性，对镀膜胶辊无腐蚀且安全环保，用此镀膜液制备的太阳能光伏电池封装玻璃既具有高增透效果和耐脏污性能，很好的解决了增加透光率与保持好的耐脏污性能及高的机械强度之间的矛盾。
16	一种光伏组件用封装材料<sep>本发明不仅制造成本低，而且在满足抗紫外、抗老化、抗冲击、防火等光伏行业技术标准要求的前提下，有效实现了解决了光伏组件封装材料的轻量化，提高安装的便利度，降低安装成本，非常适合在光伏领域规模推广应用。
16	一种时钟转动式光伏发电装置<sep>装置升起透明的保护塑料，从而进行保护，并且不会阻挡太阳光的进入，从而提高发现效率。
16	一种太阳能毛细管温度梯度箱<sep>涉及太阳能集热技术领域通过利用环壁式毛细管换热器换热，具有换热面积大，换热温差小的特点，能够实现箱内的快速变温和均匀分布。
16	新能源热泵热水器系统<sep>本实用新型解决了用电安全隐患，且能耗低，节能环保，降低了运营成本。
16	一种包裹铜管的太阳能吸热翅片及其焊接方法<sep>本发明焊接过程中无需对铜制流管表面进行打磨，避免铜制流管受到损坏，且能够起到保护铜制流管的效果，避免了不同材质的膨胀系数不同而导致的焊接不稳定现象产生，不会在翅片表面产生焊缝，不会破坏翅片及铜制流管的氧化层，防止被腐蚀，焊接后的翅片360度全包裹铜管，导热接触面增加90％以上，增加导热效果。
16	一种基于三元无机平板型异质结薄膜的太阳电池及其制备方法<sep>本发明的技术进步和创新点主要体现在下列方面：（1）在核心材料方面，关键的cuins薄膜层的制备方法与现有技术完全不同，我们的制备方法更易实现大面积制备；（2）在电池结构和性能方面，我们在电池中使用有机空穴传输层，有效地避免au原子沉积过程中产生的短路现象，电池具有更高的v。
16	一种基于计算机视觉的定日镜监测控制系统<sep>本发明实施中，利用飞行器装载光学采集装置对定日镜列阵进行监测，数量不多的飞行器即可对大面积的定日镜列阵进行监测。
16	一种具有自清除真空管水垢功能的太阳能热水器<sep>本发明构思新颖，可对太阳能真空管内壁的水垢进行去除，保证了太阳能真空管的加热效率和使用寿命。
16	一种用于梯形彩钢瓦屋面的光伏支架结构<sep>该用于梯形彩钢瓦屋面的光伏支架结构，通过设置彩钢瓦本体、连接板、支撑板、第一螺纹孔、螺纹杆、第二螺纹孔、支撑杆、安装框架、第一安装槽、光伏板、伸缩装置和挡板，从而减少光伏支架的安装的步骤，方便工作人员对光伏支架进行安装，提高了安装效率。
16	bazrs薄膜及其制备方法及其应用<sep>该材料具有优良的可见光吸收能力，在太阳能电池领域具有较大的应用前景。
16	一种能源系统的控制方法<sep>属于节能技术领域采用该可选实施例，实现了对废弃能量的收集和调度，供应其他设备使用，减少能源消耗和浪费，实现节能减排。
16	太阳能电池的低压扩散工艺及利用其制备得到的太阳能电池<sep>涉及太阳能电池技术领域利用该低压扩散工艺能够缓解现有技术的低压扩散工艺造成的氧化层形成速度慢、厚度薄以及由此导致的太阳能电池效率低的技术问题，达到了提高电池片转换效率的技术效果。
16	一种新能源用太阳能板安装架<sep>该新能源用太阳能板安装架，达到了该太阳能板安装架便于调节的目的，从而解决了一般太阳能板安装架不便于调节的问题，大大提高了该太阳能板安装架的使用效率，使人们使用起来更加的简单，省时省力，进一步满足了人们的使用需求，给人们的工作带来了便利。
16	一种能源互联网光伏发电装置<sep>本发明所述装置通过旋转件和调节件的设置，可以使光伏发电装置在单个电机的的带动下进行自动追光，始终使太阳光直射太阳能电池板。
16	一种基于旋转离心力的太阳能电板支架结构<sep>涉及太阳能光伏技术领域该基于旋转离心力的太阳能电板支架结构，降低了太阳能电板和安装和更换时的工作强度，提高了太阳能电板架设的效率，能够对太阳能电板的朝向和倾斜角度进行调节，且不论遭遇任何方向的风力，均能够使太阳能电板趋于水平状态，从而降低了风力对于太阳能电板的损坏。
16	一种智能可调节太阳能发电装置<sep>本发明的有益效果是，结构简单，实用性强。
16	一种塔式光热发电用潜热集热器<sep>熔盐出口与上侧外集箱管连接，所述上侧内集箱管通过多个内圈换热管与下侧内集箱管连接，所述上侧外集箱管通过多个外圈换热管与下侧外集箱管连接，下侧内集箱管通过内外圈集箱导管与下侧外集箱管连接。
16	蓄电池控制装置、蓄电池充放电系统、太阳能发电系统以及蓄电池控制方法<sep>在预测充电量是正的情况下，以在预测区间(60)中能够充电预测充电量的方式控制起点的蓄电池(12)的充电状态，预测区间(60)是以预测为在太阳能发电的发电电力达到最大值之后成为与负载电力相同的电力的时刻为终点的区间。
16	一种太阳能光伏发电装置<sep>包括底座以及安装在其上方的发电座，所述底座上方设置有可活动的翻盖，所述底座内部安装有液压泵，且所述底座顶部焊接有两根平行的侧撑柱、两根平行的立柱，两根所述侧撑柱顶端均设置有一个卡扣。
16	一种低成本的光伏光热一体化系统及其控制方法<sep>本发明结构简单，成本低，可有效提高光伏光热一体化系统的发电效率和回收的热量。
16	一种板块太阳能光伏组件加工工艺<sep>涉及光伏组件加工领域而且整个加工过程自动化程度高，可以提高生产效率、大大减少人工人员数量、减少人工成本，且可以很好地避免人员操作带来的不良，使得生产出来的产品稳定性高。
16	一种可展开的太阳能电池<sep>本发明的太阳能电池在整体结构上更加合理和巧妙，使用起来也非常方便，可以同时实现光伏材料的拉伸收纳，保存起来更加方便，同时设备能够调节柔性光伏材料与光照角度，提高设备转换率，设备还能够周向转动调节光伏板朝向，使光伏板接受更多光照，提高设备转换量，本发明设备方便移动，便于使用，大大提高设备发电能力，具有较高的使用和推广价值。
16	一种手机用太阳能充电宝的帆板机构<sep>本实用新型能够提高太阳能充电宝的受光效率，更好的满足使用需要。
16	能够实现全闭环控制的行星减速电机及关节机器人<sep>用于减少反向间隙。
16	一种内接多面体的能源自给球形装置<sep>内接多面体上的几个能够接受太阳光的面太阳电池持续发电，支撑感知环境状况的传感器探测单元、信息处理单元、球体驱动装置持续工作，能够在滚动过程中兼顾发电与环境感知探测、信号发射、球体驱动等功能。
16	一种光伏板的自动转向遮挡装置<sep>通过膨胀块的吸热膨胀，推动使得光伏板能够调整位置，使得光伏板面对太阳，促使有效的吸收太阳能，而在太阳移动时，通过膨胀块的吸热膨胀，推动使得光伏板能够根据太阳的移动位置而调整光伏板相对于太阳的直面程度。
16	一种太阳能热水器管道清洗机<sep>本发明通过左右位置能够调节距离的一号夹紧装置和二号夹紧装置能够将太阳能真空管的左右两端进行夹紧，确保了太阳能真空管在清洗过程中的稳定安全，不容易破碎，然后通过便于装卸的清洗杆能够对太阳能真空管内部进行旋转清洗，在清洗过程中还能通过用手将按压二号转动底座带动太阳能真空管倾斜角度，便于将太阳能真空管内的污水和水垢倒出。
16	基于太阳能的便携式野外多功能保障装置<sep>本装置是可利用太阳能实现野外生活和通讯保障的便携式多功能装置，能很好的满足士兵野外取水、衣物干燥、食物加工及通讯供电需求，从而提高了单兵的野外生存及作战能力，同时也适用于野外勘探、施工等人员的使用。
16	一种移动型太阳能发电装置<sep>该移动型太阳能发电装置，通过四个移动轮实现对整个设备的位置快速移动的效果，同时两个支撑弹簧起到对整体设备的支撑平衡效果，从而达到了对发电设备的移动缓冲减震效果，保证了整体发电设备不会出现移动过程中震动损坏，同时也方便了整个发电设备移动搬运和转移位置。
16	一种柔性单晶颗粒薄膜及其制备方法和应用<sep>本发明采用卷对卷法结合静电转印技术制备大面积柔性单晶颗粒薄膜的制备，克服现有技术中因导电材料在使用过程中容易被折断而影响柔性单晶颗粒薄膜的可靠性问题，在工业化生产方面具有明显的优势。
16	一种太阳能电池的辅助与保护装置<sep>通过风扇对电池板上的雨雪灰尘进行吹除，保证电池板表面的清洁的状态。
16	一种调整集热板光照功率防水垢的智能太阳能热水器<sep>对储水箱进行电加热过程中，当出水流量为非零值时，控制器操纵电加热器暂停加热，直至出水流量值为零值时止，继续加热直到达到设定温度值，以避免水越用越热，需要不停调整冷、热水的比例，带来诸多不便。
16	一种有机无机杂化太阳能电池及其制备方法<sep>有机无机杂化太阳能电池的制作方法包括：硅基底的清洗；硅基底的表面钝化处理；硅纳米线/pedot:pss复合膜的制备；pedot:pss/银纳米线/黑磷烯复合导电层的制备；背面界面层的制备；正面银栅电极的制备；背面电极的制备。
16	太阳能电池用区熔单晶硅的制造方法及太阳能电池<sep>由此，可提供一种太阳能电池用区熔单晶硅的制造方法，该太阳能电池用区熔单晶硅的制造方法能减少不可避免地进入直拉晶体中的氧，防止生成会对太阳能电池特性造成影响的硼‑氧对，并能抑制浮区处理中的镓掺杂剂的蒸发量，防止单晶硅高电阻化。
16	一种太阳能连续烘焙系统及方法<sep>本系统的能量利用率高，可以实现全天候下的连续烘焙，并且无污染，工作状态稳定可靠。
16	一种光伏电池板及其制备方法<sep>本发明的光伏电池板的制备方法简单易行，易于工业化生产。
16	用于光伏组件的功率优化器在不同工作模式之间切换的方法<sep>瞬态短接待切换工作模式的功率优化器所属的链路所提供的串级电压，侦测被瞬态短接的链路中因为串级电压被短路而诱发的预定指标的变化量，在变化量满足预设的变化条件时，待切换工作模式的功率优化器完成从一种工作模式切换到另一种工作模式。
16	一种集装箱式太阳能光伏系统<sep>属于光伏发电技术领域通过采用第一封盖机构和第二封盖机构的设计，一方面可以在运输过程中和不使用时，对第一光伏组件和第二光伏组件进行保护，另一方面便于快速敞开集装箱顶端和左右两侧，使第一光伏组件和第二光伏组件快速移至集装箱外进行光伏发电。
16	一种背接触太阳能电池及太阳能电池组件<sep>该背接触太阳能电池能减少细栅电阻的影响，降低银浆的使用量，提高填充因子，减少背面金属对背面入射光的遮挡。
