label_id	text
16	一种定日镜清洗装置<sep>本发明提供的装置在冰点温度以下时，能够实现水洗清洁定日镜。
16	一种无损转移碳纳米管薄膜制备异质结太阳能电池的方法<sep>本发明在转移碳纳米管薄膜的过程中未使用无水乙醇外的其他溶剂，过程简单，提高碳纳米管与基底的结合，所构建的太阳能电池具有优异的光电转换性能及稳定性。
16	一种降低柔性铜铟镓硒太阳电池串联电阻的方法<sep>采用本发明的方法能够提高前电极与电池芯片之间的金属化接触面积，使串联电阻大大降低、同时焊接拉力大大提升。
16	一种支撑工装和具有其的工装组件<sep>通过支撑工装和夹持板、夹具的配合能够使得工装组件稳固地组装边框，提高组装质量，该支撑工装和工装组件结构简单，易于加工制造，实用性强，适于在业界广泛推广使用。
16	一种适应性强的太阳能光伏支架<sep>该适应性强的太阳能光伏支架，使得底板和第一光伏板的角度可以调节，可以增加整个太阳能光伏装置的接光能力，整个装置的角度可调节，保证了整个装置的接光率，保证了光能的转化效果，可以防止第一光伏板与第二光伏板受损，能够有效的保证整个光伏板的使用寿命。
16	一种受光功率及补水恒温智能控制的太阳能热水器<sep>集热板和固定架枢轴连接，驱动电机适于驱动集热板转动，储水箱内置换热器和电加热器，集热板和换热器间相连通的加热管路中设置循环泵；储水箱的冷水输入管路上设置电磁比例阀、流量传感器和温度传感器；当储水箱的水温达到预设值时，控制器操纵集热板转动使其受光功率减小到最小值，阻止水温升高，以避免储水箱及换热器上积结水垢；用户用水过程中水位过低时，控制器自动补水并启动电加热器，使同时间段所补入量冷水的温度升高到储水箱的水温所需要的热量与电加热器产生的热量相当，冷水补入后，诸水箱的水温维持恒定，方便用水。
16	一种具有扫雪功能的太阳能发电装置<sep>通过积雪清扫机构，利用清洁辊的旋转，能够清理光伏板表面的灰尘与积雪，从而提高了光伏板的工作效率，提高了太阳能的转化率。
16	一种太阳能供电切换电路<sep>如此，即利用太阳能供电缓解了市电压力，又通过太阳能供电到市电的自动切换，保证了太阳能不足时，负载的正常工作。
16	一种光伏逆变器的统一控制方法和系统<sep>所述统一控制方法包括：a、计算电网电压负序αβ轴的分量e；b、计算电网电压参考的d、q轴分量对应的αβ轴参考u；c、将所述电网电压负序αβ轴的分量e和所述电网电压参考的d、q轴分量对应的αβ轴参考u叠加，得到用于驱动逆变模块有功或无功的输出的驱动信号；所述步骤a中，锁相环根据采样得到的三相电网电压计算得到电网电压当前的相位，通过虚拟锁相环在电网电压小于某一定值时提供相位，根据电网电压的正、负序d、q轴分量判断是否满足设定滞环选择相位；用选择的相位重新计算电网电压的负序d、q轴分量，变换得到分量e。
16	一种自动调节光伏组件倾角装置<sep>本发明通过感光器获取太阳的高度角，由控制器控制步进电机，控制倾角装置自动调节光伏组件跟随太阳，获得最佳的照射角度，以获得最佳的发电效率。
16	太阳能绝热空调板<sep>属能源、建筑领域这样，本装置不仅仅可以保温，还可以利用太阳能空调，从而节省能源。
16	光伏组件用泡棉胶带透水性检测方法<sep>属于光伏组件领域从而能够取得组件铝边框与钢化玻璃之间或与背板之间泡棉胶带透水性的真实情况，为生产工艺提供可靠的检测数据，从而保证组件的产品质量，降低组件的使用风险。
16	集成通信功能的光伏组件监测系统<sep>具有耦合到第一和/或第二节点处的载波发送模块，用于将产生的载波信号耦合到连接于第一和/或第二节点处的连接线上，在光伏电池与载波发送模块之间的第一传输线路和/或第二传输线路上设置有电感元件，以避免载波信号加载在光伏电池上引起其正极和负极之间的电压纹波。
16	一种pecvd工序中镀膜膜厚偏薄片的处理工艺<sep>采用该工艺补镀后的电池片边缘厚度与中间均匀一致，外形美观，颜色正常。
16	一种核壳结构硅纳米线-四氧化三钴复合光催化材料及其制备与应用<sep>该催化剂制备方法简单，反应后容易分离回收，原料丰富，价格低廉，对环境友好。
16	一种渔光一体式太阳能备用电源及其控制方法<sep>节省土地资源；控制漂浮装置的位姿，使得光伏板跟随太阳，充分利用太阳能。
16	一种利用土壤冷量冷却光伏电池的太阳能综合利用系统<sep>该系统通过在不同季节运行不同的模式来实现全年光伏和光热收益最大化。
16	一种无损转移碳纳米管薄膜制备异质结太阳能电池的方法<sep>本发明在转移碳纳米管薄膜的过程中未使用无水乙醇外的其他溶剂，过程简单，提高碳纳米管与基底的结合，所构建的太阳能电池具有优异的光电转换性能及稳定性。
16	一种定日镜清洗装置<sep>本发明提供的装置在冰点温度以下时，能够实现水洗清洁定日镜。
16	光伏组件用泡棉胶带透水性测试方法<sep>属于光伏组件领域为生产过程提供可靠的检测数据，从而保证元器件的产品质量，降低元器件的使用风险。
16	太阳能绝热空调板<sep>属于能源和建筑领域这样，设备不仅可以保暖，还可以利用太阳能空调，从而节约能源。
16	一种光伏组件倾角自动调节装置<sep>本发明通过光电传感器获取太阳的高度角，通过控制器控制步进电机，控制倾斜装置自动调节光伏组件跟随太阳获得最佳照射角度，从而获得最佳发电量效率。
16	光伏逆变器统一控制方法及系统<sep> .根据电网电压的正序d和Q轴分量判断是否满足磁滞回线选择相位；将电网电压的负序d和Q轴分量用选定的相位重新计算，变换得到分量e。
16	一种适应性强的太阳能光伏支架<sep>保证了光能的转换效果，防止了第一光伏板和第二光伏板的损坏，有效保证了整个光伏板的使用寿命。
16	一种具有扫雪功能的太阳能发电装置<sep>可以将光伏板表面的尘雪清扫干净，从而提高光伏板的工作效率，提高太阳能的转化率。
16	一种恒温智能控制光功率补水的太阳能热水器<sep>加入冷水后，水箱水温保持恒定，方便用水。
16	一种支撑工具和具有该支撑工具的工具组件<sep>易于制造，实用性强，适合在行业中广泛使用。
16	一种降低柔性铜铟镓硒太阳能电池串联电阻的方法<sep>采用本发明的方法，可以增加前电极与电池芯片的金属化接触面积，大大降低串联电阻，同时大大提高焊接张力。
16	一种无损转移碳纳米管薄膜制备异质结太阳能电池的方法<sep>乙醇自然挥发后，碳纳米管膜与硅基板之间的作用力大于碳纳米管膜与微孔滤膜之间的作用力，直接用镊子将滤膜去除；然后制备上电极（银凝胶）和下电极（铟镓合金），得到太阳能电池。本发明在转移碳纳米管薄膜的过程中不使用除无水乙醇以外的其他溶剂，工艺简单，改善了碳纳米管与基板的结合，构建的太阳能电池具有优异的光电转换性能和稳定性.
16	一种定日镜清洗装置<sep>本发明提供的装置可以在温度低于冰点时实现对定日镜的清洗和清洗。
16	一种太阳能电源的开关电路<sep>这样，利用太阳能供电缓解了市电压力，太阳能供电自动切换到市电，保证了太阳能不足时负载的正常运行。
16	一种降低柔性铜铟镓硒太阳电池串联电阻的方法<sep>采用本发明的方法能够提高前电极与电池芯片之间的金属化接触面积，使串联电阻大大降低、同时焊接拉力大大提升。
16	一种适应性强的太阳能光伏支架<sep>该适应性强的太阳能光伏支架，使得底板和第一光伏板的角度可以调节，可以增加整个太阳能光伏装置的接光能力，整个装置的角度可调节，保证了整个装置的接光率，保证了光能的转化效果，可以防止第一光伏板与第二光伏板受损，能够有效的保证整个光伏板的使用寿命。
16	一种受光功率及补水恒温智能控制的太阳能热水器<sep>集热板和固定架枢轴连接，驱动电机适于驱动集热板转动，储水箱内置换热器和电加热器，集热板和换热器间相连通的加热管路中设置循环泵；储水箱的冷水输入管路上设置电磁比例阀、流量传感器和温度传感器；当储水箱的水温达到预设值时，控制器操纵集热板转动使其受光功率减小到最小值，阻止水温升高，以避免储水箱及换热器上积结水垢；用户用水过程中水位过低时，控制器自动补水并启动电加热器，使同时间段所补入量冷水的温度升高到储水箱的水温所需要的热量与电加热器产生的热量相当，冷水补入后，诸水箱的水温维持恒定，方便用水。
16	一种利用土壤冷量冷却光伏电池的太阳能综合利用系统<sep>该系统通过在不同季节运行不同的模式，全年最大限度地发挥光伏和光热效益。
16	宇光一体化太阳能后备电源及其控制方法<sep>节约土地资源；控制浮动装置的位置和姿态，使光伏板跟随太阳，充分利用太阳能。
16	一种核壳型硅纳米线-四氧化钴复合光催化材料及其制备与应用<sep>该催化剂制备方法简单，反应后易于分离回收，原料丰富，价格低廉，对环境友好。
16	集成通讯功能的光伏组件监控系统<sep>光伏电池与载流子传输模块之间的第二传输线，以避免光伏电池上加载的载波信号引起光伏电池正负极间的电压纹波。
16	一种利用土壤冷量冷却光伏电池的太阳能综合利用系统<sep>该系统通过在不同季节运行不同的模式来实现全年光伏和光热收益最大化。
16	一种渔光一体式太阳能备用电源及其控制方法<sep>节省土地资源；控制漂浮装置的位姿，使得光伏板跟随太阳，充分利用太阳能。
16	一种核壳结构硅纳米线-四氧化三钴复合光催化材料及其制备与应用<sep>该催化剂制备方法简单，反应后容易分离回收，原料丰富，价格低廉，对环境友好。
16	一种pecvd工序中镀膜膜厚偏薄片的处理工艺<sep>采用该工艺补镀后的电池片边缘厚度与中间均匀一致，外形美观，颜色正常。
16	集成通信功能的光伏组件监测系统<sep>具有耦合到第一和/或第二节点处的载波发送模块，用于将产生的载波信号耦合到连接于第一和/或第二节点处的连接线上，在光伏电池与载波发送模块之间的第一传输线路和/或第二传输线路上设置有电感元件，以避免载波信号加载在光伏电池上引起其正极和负极之间的电压纹波。
16	光伏组件用泡棉胶带透水性检测方法<sep>属于光伏组件领域从而能够取得组件铝边框与钢化玻璃之间或与背板之间泡棉胶带透水性的真实情况，为生产工艺提供可靠的检测数据，从而保证组件的产品质量，降低组件的使用风险。
16	太阳能绝热空调板<sep>属能源、建筑领域这样，本装置不仅仅可以保温，还可以利用太阳能空调，从而节省能源。
16	一种自动调节光伏组件倾角装置<sep>本发明通过感光器获取太阳的高度角，由控制器控制步进电机，控制倾角装置自动调节光伏组件跟随太阳，获得最佳的照射角度，以获得最佳的发电效率。
16	一种光伏逆变器的统一控制方法和系统<sep>所述统一控制方法包括：a、计算电网电压负序αβ轴的分量e；b、计算电网电压参考的d、q轴分量对应的αβ轴参考u；c、将所述电网电压负序αβ轴的分量e和所述电网电压参考的d、q轴分量对应的αβ轴参考u叠加，得到用于驱动逆变模块有功或无功的输出的驱动信号；所述步骤a中，锁相环根据采样得到的三相电网电压计算得到电网电压当前的相位，通过虚拟锁相环在电网电压小于某一定值时提供相位，根据电网电压的正、负序d、q轴分量判断是否满足设定滞环选择相位；用选择的相位重新计算电网电压的负序d、q轴分量，变换得到分量e。
16	一种太阳能供电切换电路<sep>如此，即利用太阳能供电缓解了市电压力，又通过太阳能供电到市电的自动切换，保证了太阳能不足时，负载的正常工作。
16	一种具有扫雪功能的太阳能发电装置<sep>通过积雪清扫机构，利用清洁辊的旋转，能够清理光伏板表面的灰尘与积雪，从而提高了光伏板的工作效率，提高了太阳能的转化率。
16	一种支撑工装和具有其的工装组件<sep>通过支撑工装和夹持板、夹具的配合能够使得工装组件稳固地组装边框，提高组装质量，该支撑工装和工装组件结构简单，易于加工制造，实用性强，适于在业界广泛推广使用。
16	PECVD工艺中厚薄膜的一种处理工艺<sep>第三步：电池贴片补料准备：对电池片的平均厚度进行取样，按照补给速率12s/nm计算补镀所需时间，将待镀电池片插入准备好的石墨舟中；第四步：补充电池片： 第五步：将电镀后的电池片拿起，正常转移到下一道工序使用此工序后，电池片边缘厚度与中间均匀，外观美观，颜色正常。
16	一种基于界面蒸发的高温太阳能蒸汽发生器<sep>与现有技术相比，所提出的高温太阳能蒸汽发生器具有高效太阳能光热转化效率，能够实现在较低光照强度和常压下产生121℃以上蒸汽，能够满足蒸汽杀菌、热力清洗等应用，具有热响应速度快，结构简单，运行稳定，蒸汽易于收集等优点。
16	一种全光谱光稳定的高效钙钛矿太阳能电池的制备方法<sep>本发明的全光谱光稳定的高效钙钛矿太阳能电池制备方法简单，而且成本较低，有望实现钙钛矿太阳能电池的商业化。
16	提高量子点太阳电池效率的斜切衬底上多层量子点及制备<sep>本发明引入斜切衬底，得到了均匀性较好，而且密度大的量子点；通过采用斜切衬底，抑制了量子点在生长过程中合并的现象，得到理想的多层量子点，拓宽对太阳光谱的利用范围，最终有效提高电池的光电效率。
16	太阳电池单晶硅基绒面生成工艺<sep>最后，使用氢氧化钾、山梨酸钾、乙酸钠、消泡剂、表面活性剂混合溶液，在形成氧化层的该硅基上生成致密、均匀的绒面结构。
16	一种彩色光伏组件及其制备方法<sep>从总体上降低光伏组件的安装成本，非常适合在光伏建材领域规模推广应用，而且进一步地有效实现了光伏组件外观色彩的自由选择和变换，增强了光伏组件的美观度。
16	一种全覆式太阳能电池板散热装置<sep>涉及电池片散热设备技术领域本发明通过将输有冷却水的冷却管贴附于载有太阳能电池片的第二基板表面上，有效地降低太阳能电池片上的温度，并利用皮带带动浸有冷水的海绵套绕第二基板转动，进一步保证了对太阳能电池片的散热效果，具有较高的市场推广价值。
16	一种表面无水自清洁和自我保护的光伏板<sep>设备会将在设备上层覆盖一层玻璃板，保护设备在雨天时不受侵蚀，并可以持续工作，设备具有较高的一体化程度。
16	一种空间用太阳电池模块的焊接及定位模具<sep>本发明提出的空间用太阳电池模块的焊接及定位模具，焊接方便，定位精度高，可以满足工程化应用的要求，该模具能够有效对太阳电池模块内各组件的相对位置及组件连接片的位置进行精确定位，并且能够完成太阳电池组件和组件连接片的焊接。
16	一种太阳能热水器清理装置<sep>在清洗用具不使用时，通过收纳箱对清洗用具进行收集，使清洗用具置于收纳箱内，减小外界因素对清洗用具的影响，对清洗用具起保护作用，避免清洗用具在运输过程中损坏。
16	一种坡面光伏电站改造设计方法<sep>采用本改造设计方法，通过更好的设计优化避免坡面光伏电站工程中的问题，在细节方面对发电量和电站的安全起到重要的作用。
16	一种可实现光伏组件domino式自动化雪的控制模块和系统<sep>本发明尤其有利于提高屋顶光伏发电系统在冰冻季节里，光伏发电的工作时间和发电效益。
16	一种用于光伏电站的倾角式光伏支架<sep>太阳能板靠近地面的一侧设置定位杆，定位杆的两端均通过定位块固定在立柱上，该装置结构简单，便于安装。
16	一种稀土掺杂的光伏薄膜材料及其制备方法<sep>本发明通过在硅基材料表面溅射多晶材料以及注入稀土离子氧化物得到光伏薄膜材料，能比现有的光伏材料实现更好的光电转换，有效提高光电转化效率，光电转化率达到31％，具有美好的应用前景。
16	一种虚拟同步发电机的参数量测方法<sep>本发明提供的方法，能够确定各种类型的光伏虚拟同步发电机的阻尼系数和转动惯量，为推进光伏虚拟同步发电机相关标准制定提供良好基础。
16	太阳能控制器的控制方法、装置及系统<sep>本发明实现了太阳能控制器的并联均流控制，提高了产品使用寿命，支持热插拔，软件组网方便功率拓展，便于安装。
16	一种薄膜光伏组件内联结构及生产工艺<sep>从而相比现有技术中的薄膜光伏组件内联结构“死区”面积更小，使薄膜光伏组件单位面积利用率更高，电阻更小，工艺更加简单，制备过程中激光设备投入更少，更加稳定。
16	一种汇流条焊接方法<sep>属于光伏技术领域该汇流条焊接方法首先将电池片焊接成电池串；每组电池串的两端具有露出的互联条：其次将汇流条分别焊接在位于每组电池串两端的互联条上，使电池串位于同侧端部的互联条通过汇流条连接，在电池片焊接成串后直接在所述电池串的端部焊接汇流条，避免了电池串被多次连续搬运出现破损，从而实现了汇流条的稳定焊接。
16	一种可调节温度的太阳能养鱼箱<sep>养殖室内的温度检测器和含氧量检测器便会将数据反映至显示屏，可通过观察显示屏所反映的数据，转动加热器转扭调节加热器的温度，调整至最适合鱼类生长的温度。
16	一种光伏电力转换到电池的方法及系统<sep>确定控制因数与参考控制因数的差值，确定差值是否在波动范围，如果是，则进行等量投入太阳能电池，转换到电池进行充电，如果否，则根据反馈的控制因数与参考控制因数的差值，重新进行软件模拟，调整参考控制因数，直到模拟结果和反馈结果满足预定标准。
16	一种水利用太阳能漂浮物拦截装置<sep>该水利用太阳能漂浮物拦截装置设置有太阳能供电机构，采用成熟的太阳能供电技术与该装置进行结合，有效的为装置提供电能，降低了装置电能的需求，增加装置整体的节能性。
16	一种智能收纳的太阳能光伏发电板<sep>固定槽的内部活动连接有与其相适配的铁销，本发明通过设置固定槽、铁销、第一弹簧、第一铁芯、第一线圈、电磁阀外壳、支撑杆、第一光伏板、第二光伏板、连接槽、连接杆、活动杆、第一限位齿、第二限位齿、衔铁、第二弹簧、第二线圈、第二铁芯、缓冲垫、第一缓冲块、第二缓冲块、支撑块、步进电机、雨滴传感器、光电传感器、螺杆、电机、第一接近开关、第二接近开关，解决了常见的太阳能光伏发电板不便于收纳的问题，同时对太阳能光伏发电板造成的可能破坏起着及时保护的作用。
16	一种具有自洁功能的道路反光镜<sep>本发明无需电力驱动，充分利用太阳能对反光镜进行清洁，节能环保，同时通过设置震动棒、化纤材料和玻璃筒，在汽车经过后可将扬起的灰尘通过静电吸附在玻璃筒上，减少道路反光镜上灰尘的积累，影响过往车辆的视线。
16	一种尺寸均一的碲化铅纳米棒、制备方法及其应用<sep>使用方便。通本发明合成的碲化铅纳米棒在紫外可见‑近红外光吸收谱中特征吸收峰为400～550 nm之间，具有特殊的光学性能，有利于碲化铅纳米棒应用于太阳能电池、光电探测器等光电以及热电器件中。
16	一种太阳能再生能源低温技术除湿机<sep>本实用新型所述的一种太阳能再生能源低温技术除湿机，可以极大的降低设备运行的能耗，从而降低使用成本，达到使用清洁能源节能减排的目的，为环保事业做贡献，带来更好的使用前景。
16	一种可靠的太阳能真空管的清洗装置<sep>第二固定组件配合固定管对真空管起固定作用，提升对真空管的固定效果，防止真空管在清洗时从底座上脱出，避免真空管在清洗时损坏。
16	一种碲化镉薄膜太阳能电池及其制备方法<sep>本发明所述的碲化镉薄膜太阳能电池设置碲化锑与硒化铜的复合材料的背接触层，可以与碲化镉光吸收层形成良好的欧姆接触，降低了势垒，同时掺杂的硒化铜可以有效的改善碲化镉光吸收层的缺陷，而且硒扩散到碲化镉界面后，可以有效的提高碲化镉的禁带宽度，呈现深“v”型的梯度变化，电池初始性能、长期稳定性优异，转换效率高。
16	一种计算双面组件阵列排布背面辐射量的方法<sep>本发明方法考虑了双面组件阵列排布的安装倾角、安装高度、安装间距、安装方位角和空中直射与散射强度比例等影响因素，能够较为准确地计算出双面组件背面接收到的总辐射量，结合组件正面辐射量模型有助于优化太阳能双面组件的安装方式。
16	一种带有远程监控调节功能的环保型太阳能热水器<sep>本发明的有益效果是，结构简单，实用性强。
16	含有热致凝胶的太阳能电池正面银浆专用载体及制备方法<sep>采用此方法制备的太阳能电池正面银浆，烧结后线型好、饱满、填充高，具有较低的串阻和高的光电转换效率。
16	一种新能源汽车电机运行检测系统及检测方法<sep>本发明通过故障检测模块当检测到电机堵转故障时，及时停止电机控制器的扭矩输出，从而可以安全可靠的保护电机控制器的igbt驱动模块和电机；通过能量补偿模块将用户行程信息与车载电源的供电要求建立关联，使车辆在进行工作的全过程中，在太阳能电池电量不足时及时通过备用电源进行补给，有效避免在用户事先无法判断的情况下，车辆供电突然不足的问题。
16	光伏组件热斑定位方法及装置<sep>涉及光伏电站巡检技术领域通过该方法避免了由于光伏电站地形起伏导致的巡检数据误差，实现了热斑的精准定位。
16	太阳能单电池和太阳能电池组件<sep>能够在n型单晶硅基片(22)与n型非晶硅层(26)之间设置i型非晶硅层(24)，在n型单晶硅基片(22)与p型非晶硅层(32)之间设置另一i型非晶硅层(30)。
16	一种新型纳米光催化材料agmoo-wo异质结的制备方法<sep>此异质结生产成本低，光催化降解有机污染物效率高且无二次污染，极大提高对太阳光的利用率，节约能源，可循环使用。
16	一种光储发电的配电网系统的控制方法<sep>属于电网控制技术领域通过功率检测充电控制器、补偿控制器和并网控制电路的分别对不同点线路的功率进行检测，根据检测的功率对恒压dc/dc电路、dc/ac并网逆变电路和dc/dc充电电路进行控制，从而使得最终dc/ac并网逆变电路输出端的输出功率与设定的功率相同，从而使得输出的电能更加稳定，电能质量更好。
16	提高石墨烯肖特基结太阳电池性能的复合减反膜、太阳电池及制备<sep>本发明的方法简单有效，成本低，通过复合减反膜的引入使得电池的光电转换效率明显提高。
16	一种太阳能电池片智能切割方法及切割系统<sep>该系统通过对摄像机拍摄的太阳能电池片的图像进行重构，并通过重构的图像获取切割路径，避免了拍摄的图像因扭曲造成的造成误差，有效的提高了切割的精度。
16	基于ga-grnn的太阳能集热系统光热效率预测方法<sep>本发明的光热效率预测方法，弥补了天气、气候因素的不确定性，大大降低了数据收集的难度，能够较准确的预测太阳能集热器的光热功率。
