label_id	text
16	抑制摩尔纹的薄膜半透明光伏组件的制作系统和方法<sep>同时保证不透光光伏电池的面积均匀分布，总的透光面积和不透光面积之比为一设定数，以尽可能避免形成空间调制频率的周期性，从而尽可能避免形成摩尔纹。
16	一种排版机用的光伏焊带涂锡机的传输机构<sep>从而保证了加工质量，另外还设有对涂锡部件加工区域的调节，满足不同型号涂锡部件的使用，实用性强。
16	一种倾角可调的光伏电站<sep>本实用新型具有使用方便、便于调节光伏板倾角、调节效率高等优点。
16	用于太阳能热水器清洁的立式真空管清洗装置<sep>通过上述结构的设置，使得太阳能真空管可以通过清洗毛刷进行有效的清洗，以便于有效的去除太阳能真空管内壁上的污垢，同时可以避免驱动件的设置，降低对该装置的维护成本，且体积较小，有效的减少了占用空间，该装置结构简单且易于操作，十分的实用。
16	一种太阳能电池片的处理方法<sep>该方法采用纯化学方法实现单面刻蚀绕镀面的硅薄膜，工艺简洁，而且不受硅薄膜厚度的限制。
16	一种光伏路灯用太阳能电量储备装置<sep>同时内嵌槽内蓄积的雨水则通过排水槽排出，有效保护太阳能板的阳光接收面，并能够灵活控制太阳能板的朝向，延长太阳能板的使用寿命。
16	光伏支架结构<sep>在安装时，只需将单榀支架梁的的一端安装在前支撑上，将后斜梁安装在后支撑上，最后将单榀支架梁固定在后斜梁上即可，安装过程方便快捷，稳定性强，且部件少成本较低。
16	绒面均匀钙钛矿膜的液膜冷基抑爬热胶涂膜原位速干析晶制备方法<sep>本发明在不对硅金字塔绒面进行抛光磨平处理的条件下，采用溶液沉积法实现了在微米尺度起伏的金字塔绒面基底上全覆盖均匀仿形钙钛矿薄膜的制备，保持了硅太阳能电池高效率的优势。
16	一种太阳能热水器系统<sep>涉及热水器领域本发明中，利用斜射的太阳光对导向集热管加热，通过导向集热管内部压力升高，产生的压力使转动架带动热水器集热管转动至面向阳光较强的一侧，提高光利用率。
16	一种se太阳电池正面开槽结构及se太阳电池<sep>实施本实用新型，可有效减少硅片损伤，减少复合中心，提升太阳电池转换效率。
16	一种带有太阳能电池板安装架的房车<sep>该带有太阳能电池板安装架的房车，结构合理，便于实现安装对接且易于拆卸维护，实用性强。
16	在电池串组中实现将光伏组件接入或移除的切换方法<sep>瞬态短接一次或多次待切换的光伏组件所属的电池串组提供的串级电压，待切换的光伏组件配置的处理器侦测电池串组是否发生瞬态短接事件，藉由侦测到的瞬态短接事件作为判断从电池串组中将光伏组件接入或移除的依据，能够控制组件在正常接入的工作模式或屏蔽的移除模式之间切换。
16	一种太阳能电池板的支撑结构<sep>本实用新型结构简单、重量轻，且收合后体积小，方便太阳能电池板的使用、携带与收藏。
16	一种具有螺旋形加强热管的纳米流体集热器<sep>热管内设有螺旋强化冷凝器，且热管内填充有纳米流体作为导热工质，本发明以纳米流体为工作介质能够有效提高太阳能集热效率。
16	一种置于阳台的太阳能收集装置支架<sep>本发明提供的置于阳台的太阳能收集装置支架，安装于阳台底板上，并伸出栏杆这样能节省阳台的空间，且面板框的朝向和倾角可调，这样能获得最大的太阳能收集效率，同时栅网、软性格挡片的设置能在不同阶段下保护安装于面板框内的太阳能收集装置。
16	一种太阳能发电控制方法<sep>本发明对具备电池组的太阳能发电控制方法进行了有效的发电调配控制，其一方面保障电池不被过充过放，另一方面使得太阳能电力的利用效率显著提升。
16	一种富勒烯三丙二酸铵衍生物、制备方法及其应用<sep>使得具有该阴极界面层的钙钛矿太阳能电池的电池效率和寿命均显著提高。
16	带升压保护的太阳能充电装置<sep>整体结构简单，不需要额外的控制器件(如mcu)的参与，实施成本低。
16	一种具有十字交叉结构特征的材料及其制备方法和应用<sep>应用于器件时的较高的外部量子效率，是适合作为oled主体材料的替代物，可用于制备有机发光二极管、有机太阳能电池或传感器。
16	一种cdte薄膜太阳能电池组件及其制备方法<sep>所述电池组件增加了短波和长波波段的吸收，使cdte薄膜太阳能电池组件的开路电压和填充因子高，提高电池的性能，转换效率高，长期稳定性佳，同时，其制备方法操作简单，工艺简单，容易控制。
16	一种波浪能和太阳能综合发电四体无人艇<sep>其中，甲板上方设有上层建筑，上层建筑上设有太阳能发电装置，上艇体装有两套对称分布的吊舱推进装置，上层建筑后方设有与主控器相连接的环境感知装置和自主或半自主航行系统，本发明综合利用多自由度的波浪能发电装置和辅助太阳能发电设备，提高了无人艇续航力，有相当的经济性，并且可以根据天气情况自主航行进行区域转移，提高了灵活性，在航行过程中可利用制动装置将浮子固定，从而保证艇体在高海况航行过程中的良好性能。
16	一种太阳能电池硅片矫正装置<sep>利用装置可以方便的对生产线上传送的太阳能电池硅片进行位置矫正，且能够对不同尺寸大小的太阳能电池硅片进行位置矫正。
16	一种双罐熔盐储换热的动力系统及动力产生方法<sep>能够提高系统效率，节约成本。
16	一种太阳能电池板用防护装置<sep>涉及太阳能电池板领域本实用新型利用凹槽与连接块相配合的设置方式，通过栏杆两端的连接块在凹槽内的滑动穿插连接，在两个栏杆间安装有防护网，通过防护网的防护，使周边树叶不会直接掉落在太阳能电池板上，使其太阳能电池板能进行正常光照，对太阳能电池板进行了防护。
16	一种蔬菜种植用具有太阳能发电功能的驱虫装置<sep>本发明能够多角度的运动，提高了驱虫和杀虫的范围，有效的对蔬菜进行防虫的保护，改变高压电网和太阳能电池板的高度，满足不同位置环境下的使用，大大的提高了对太阳光的利用效率。
16	一种基于共阳极充电器的太阳能充电检测电路及检测方法<sep>实现共阳极充电器的太阳能充电检测。
16	钙钛矿薄膜太阳能电池及其制备方法<sep>本发明中使用掺杂有有机小分子掺杂剂的c作为电子传输层，既能满足器件的光电流输出的要求，又大大降低了器件的成本，有利于钙钛矿薄膜太阳能电池在工业上推广应用。
16	一种基于改进mppt方法与蓄电池自平衡快速充电耦合控制的光伏发电系统<sep>属太阳能光伏发电技术领域本发明提出了一种适用于中小型光伏发电系统的兼顾精度、速度和成本的自适应变步长逐步逼近扰动观察最大功率跟踪及其与蓄电池恒压限流自平衡快速充电耦合控制方法，既实现准确地最大功率点跟踪，又使光伏系统对蓄电池输出平均充电电流的瞬时变化更符合蓄电池当前的充电状态，能够提高蓄电池组的荷电水平，使蓄电池长期工作在欠充的状况得以改善，延长蓄电池的总循环寿命，提高光伏发电系统能量利用效率。
16	一种太阳能监控装置<sep>本实用新型通过设置太阳能板，使本实用新型能够在没有电网的野外山区进行监控，扩大了监控领域的工作范围，且提高了监视野外情况的效率；通过设置移动组件，扩大了摄像头的工作范围，为户外监控提供了更高效的监控设备；通过设置升降件，使太阳能板能够根据太阳照射的角度调节自身相应的角度，提高了太阳能转换成电能的效率，实现了节能减排的目标；通过设置清洁组件，避免太阳能板的表面在野外受到污染，影响太阳能转换成电能的效率，避免监控装置失去电源，无法正常工作。
16	一种巡逻雨衣<sep>本实用新型与现有技术相比，由于采用了此种结构，能够在有太阳时利用太阳能电池板对蓄电池进行充电，将电量存储于蓄电池内；在阴雨天时穿上本申请的巡逻雨衣，将存储于蓄电池的电对对讲机放电，使用十分方便；同时尤其是太阳能电池板位置是设置在第一衣袖的袖口的外表面，放置顺手，操作便捷。
16	一种热管分布变化的太阳能蒸汽发生器<sep>本发明提供了一种新的热管结构的太阳能蒸汽发生器，通过热管分布密度的变化，能够保证强化传热。
16	一种发电储能一体化电池及其制作方法<sep>本发明的方法具有操作简便等优点。
16	一种定日镜的自清洁装置<sep>清洁横梁朝向定日镜的一侧上设置有清洁块，清洁块包括有多个沿清洁横梁长度方向均布的喷嘴，导轨本体两端的出气口分别通过通气管与清洁横梁上的喷嘴连接。
16	一种异质结薄膜太阳能电池及其制备方法<sep>进一步的提高光电转换效率，从而有望获得光电转化效率较高的新型太阳能电池。该制备方法简单易行，适合大规模生产建设。
16	一种碲化镉薄膜太阳能电池组件的制作方法<sep>本发明可以实现碲化镉薄膜太阳能电池组件以低电压的方式输出，使得电池组件输出电压降低一半或者甚至更多，方便市场推广及应用。
16	一种选择性吸光材料的新用途及新型光热系统<sep>本发明的方法具有环境友好，应用广泛等优点，非常适合于工业生产和实际应用。
16	太阳能光伏板支撑装置<sep>由于太阳能光伏板为露天使用在雨水较多时要可以为其提供有效的防潮支撑，避免配件的损伤。
16	一种基于移动互联网的分布式光伏发电系统<sep>且光伏组件在一天的时间内随着太阳的出升和日落转动带动光伏板面朝太阳光最强的角度，本发明具有发电效率变高，省去了单独建立的基站，通信网络，使得在偏远的地区也能远程地对光伏发电系统进行控制，成本低廉，适用范围广等优点。
16	一种用于制备钙钛矿太阳能电池的团簇式真空沉积系统<sep>本发明全部使用真空沉积法机械化自动制备各层薄膜，有助于提高钛矿太阳能电池的稳定性和均匀性，也能在大规模生产中提高产品的良率。
16	用于光伏模块的非对称的一体式框架<sep>并且其中，一个或多个一体式框架中的每一个都在靠近一个或多个连接器的位置连接到光伏层压板，使得一个或多个一体式框架在制造过程期间、在使用期间、在安装期间或其组合期间为一个或多个连接器提供支撑。
16	一种带保护的转向太阳能路灯<sep>同时在一些经常遭台风肆虐的地方，能够将太阳能板受到的风力减到最小，避免被破坏，造成财产损失。
16	一种光伏发电用组合式变压器<sep>本发明结构简单，原理明确，能够快速便捷的对组合式变压器本体移动至合适的位置，并对组合式变压器本体进行固定，节省了时间和工人们的体力消耗，而且在移动过程中，能够卸载掉因为路况等外界原因对组合式变压器本体造成的振动，避免组合式变压器本体的损伤。
16	一种真空层压机的层压结构<sep>本发明通过在硅胶板的内层加设顶压筒，并设定充气管的进气口径大于导气管的出气口径，由此，在抽真空加热阶段，可先通过充气将顶压筒优先撑起，由顶压筒撑起后顶撑上盖的内顶而使得导气管位于顶压筒下方的部分优先顶压住太阳能组件的四角，从而有效防止太阳能组件的钢化玻璃四角翘起。
16	利用太阳能供热和高温热化学储热的sofc-gt联合发电系统<sep>所述系统可连续稳定运行，发电效率和太阳能利用率高，适用范围广。
16	一种透明转光复合膜及其制备方法<sep>本发明的复合薄膜不仅力学性能强，且具有优异的耐老化性能；同时，具有优越的转光性能，能够有效提高太阳能电池对光的利用率；此外，该复合膜具有连续化生产条件，具有柔性特征，可代替玻璃作为太阳能电池用膜。
16	一种基于蒽结构的空穴传输材料及其制备方法与应用<sep>本发明提供的空穴材料以蒽为核心同时引入烯键连接三芳胺，其较大的二维共轭平面结构可有效提升空穴迁移率，且具有较好的平面堆积作用，缩短了分子相互作用距离，强化了空穴传输能力，使此类材料可作为空穴传输材料应用于太阳电池等电子器件，具有广泛的应用前景。
16	一种低温制备柔性钙钛矿太阳能电池的方法<sep>属于太阳能电池技术领域该方法解决了现有制备甲脒铅碘体系钙钛矿太阳能电池所存在的退火温度过高导致无法应用于柔性衬底，或降低退火温度而导致电池效率较低的问题，并且本发明制备方法绿色简单、成本较低、有利于高效率柔性钙钛矿太阳能电池的制备和钙钛矿太阳能电池的产业化。
16	一种太阳能电池片的背抛光工艺<sep>该背面抛光硅电池的硅片背表面平整光亮，入射到硅片背表面的光子可以只反射一个方向，增加了反射光的能量，激发更多的电子空穴对，提高电池片的电流，提高了电池片的效率。
16	一种新能源公交站牌太阳能发电光板<sep>不妨碍公交站牌的日常使用，本发明操作简单，实用性强，便于推广使用。
16	钙钛矿太阳能电池及其制备方法<sep>降低针孔的形成和分布，内阻小；乙酰丙酮锌还能有效填充zno纳米颗粒之间的空隙。同时乙酰丙酮锌还能起到表面修饰作用，可以提高钙钛矿在zno电子传输层上的热稳定性。本发明钙钛矿太阳能电池制备方法能够有效保证形成的含有zno和乙酰丙酮锌的膜层质量稳定。
16	一种太阳能热水器的制造方法<sep>它具有承压能力强，安装维护方便，换热快速，节约使用成本的技术效果。
16	一种带有接地变压器单相断电的检测方法<sep>可在三相并网光伏逆变系统、风力发电并网系统、储能系统等领域得到广泛应用。
16	一种光伏电池制造用扩散炉进气装置及其控制方法<sep>本发明通过称重传感器对恒温槽称重以检测恒温槽的重量变化率，即小n携带的pocl的重量变化率，由此，plc控制器与气动式调节阀的配合工作，根据称重传感器的反馈数据控制经由进氧管通入主通管的o含量，保证o依过程反应所需比例通入，实现o通入量与恒温槽内pocl的单位时间供给量能够依过程反应所需比例达到实时动态平衡，提高资源有效利用率，降低因o过量通入给温控系统带来的额外负载强度。
16	一种太阳能硅片的丝网印刷工艺<sep>本发明通过对丝网印刷过程中各个参数的设定，印刷得到的太阳能硅片外观美观，细腻精制，工艺简单，操作控制方便，质量稳定，生产效率高，可大规模工业化生产。
16	一种可隐藏太阳能光伏板的保护支架<sep>本发明可以在风雪天气将太阳能光伏板组件移入至遮挡板的下侧，可以有效保护太阳能光伏板，从而提高太阳能光伏板的使用寿命。
16	太阳能电池<sep>所述第一扩散区域被局部地形成以与第一导电区域对应并且具有低于第一导电区域的掺杂浓度的掺杂浓度，其中，所述第二扩散区域被局部地形成以与第二导电区域对应并且具有低于第二导电区域的掺杂浓度的掺杂浓度。
16	一种太阳能发电装置<sep>能够通过旋转组件使太阳能板与光线传播方向垂直从而使太阳能板尽可能大的吸收光能，并且能够通过倾斜组件使太阳能板调节到光线最佳吸收角度，从而使增加装置的工作效率，在遇到特殊天气时能够关闭遮挡板从而保护装置。
16	一种太阳能节能环保制冷装置<sep>本实用新型可以通过蓄电池配合太阳能板的工作，使其便于携带至户外进行使用，且在进行制冷工作时，无需损耗现有的电资源，有效的提高了其节能环保性能，实用性较高。
16	一种角度可调的太阳能光伏板<sep>本发明可以通过调节底座调节光伏板的角度，以满足不同地理位置的需求，且在不使用时可以将光伏板收拢，降低对光伏板的损伤。
16	一种小型太阳帆板展开与限位锁紧机构<sep>本发明形式紧凑、简单，能够为电池片的粘贴提供更多的空间，为纯机械驱动方式，可靠性高。
16	一种光伏板用集摆动与清洗于一体的固定架<sep>本发明实现了自动调节摆动角度以及对光伏板表面清理的技术效果。
16	一种太阳能电池片烧结工艺<sep>本发明在太阳能电池片烧结完成的基础上增加修复表层的涂覆，有效保证太阳能电池片正常运行，防止由于温度过高导致燃烧；并且修复表层具有一定的自修复性，有助于延长太阳能电池片的使用寿命，降低更换频率。
16	一种基于物联网的太阳能led交通信号灯<sep>节约了能源，同时可调节的亮度的功能，使得在不同天气下都可以使用，也节约了能源。
16	一种基于扰动法的光伏自动化控制设备和方法<sep>本发明根据设置扰动量，优先使用超级电容充放电，根据超级电容的充放电次数设置扰动量的值，减少蓄电池的充放电次数，提高光伏设备的自动化控制的准确性。
16	一种气泡剥离法制备类石墨相氮化碳纳米片的方法<sep>产物纯度达99.8％，可在光照条件下催化降解有机物，可在光伏产品中使用，是先进的制备类石墨相氮化碳纳米片的方法。
16	一种太阳能环保光暖器<sep>该太阳能环保光暖器设置有太阳光热转换装置、壳体和风杯，在使用过程中通过风杯和外界进行接触，从而空气中一些流动的气流带动风杯进行旋转，使得壳体进行旋转，进而带动太阳光热转换装置内多个太阳光热装置旋转，使得多个太阳光热装置整个表面都可以被太阳光照射，增加该装置的实用性。
16	一种光伏逆变器的固接系统<sep>抵顶框与定位框之间形成有插接间隙，光伏板插接固定于夹持槽内，固接组件包括插设架、扣合架、接地螺钉、顶持螺钉、线缆架与椭球壳件。所述光伏逆变器的固接系统的接地连接较为稳定。
16	一种用于清理太阳能热水器的清洁装置<sep>本发明的有益效果是，结构简单，实用性强。
16	一种光伏微电网用三相微电网逆变装置<sep>本实用新型通过卡扣与铝型材散热器连接，可以通过铝型材散热器进行导热，提高壳体的散热效果，避免壳体内部温度过高，卡扣连接还可方便对装置的整体安装，通过壳体正面的多组光伏板连接端口，可以与多组光伏板组件进行连接，减少了线路连接的复杂度。
16	一种无源空间环境航天器自适应变形机构<sep>本发明利用太阳光作为能源驱动混杂复合材料驱动板，摆脱了自适应变形机构对航天器能源的依赖，实现了无源化设计。
16	一种快速拆装的太阳能电池片组件<sep>属于太阳能电池片技术领域安装牢固快捷，拆卸时只需通过伸缩杆再次对卡块进行调节，使卡块脱离太阳能电池片即可，减轻了操作人员安装太阳能电池片组件的拆卸难度。
16	一种基于模糊控制的光伏自动化控制设备和方法<sep>本发明适用于未来清洁能源转换的自动控制，方便以自动控制的方式跟踪目标和为系统提供可靠的控制。
16	一种轨道交通用指示装置<sep>本实用新型采用太阳能电板和蓄电池，将太阳能转化为电能并储存在蓄电池内，便于指示组件使用；采用支撑杆和支撑套，配合电动推杆，自由调节指示组件的高度好角度，再利用调节旋钮，将支撑杆固定，保证支撑架的稳定；采用插地钉和底座板与地面固定连接，从而稳定支撑架；采用传感器和蜂鸣器，在灯泡通电不亮时，及时发出信号，同时警示指示组件需要维修。
16	一种光伏虚拟同步发电机的参数量测方法<sep>本发明提供的方法确定各种类型的光伏虚拟同步发电机的阻尼系数和转动惯量，为推进光伏虚拟同步发电机相关标准制定提供良好基础。
16	一种光伏控制系统<sep>本申请公开的上述技术方案，监控系统中包含的多个用户账户对应同一个通信器，从而提高整个光伏控制系统的适用性。
16	一种塔式太阳能热发电用多级固体颗粒吸热器<sep>高温固体颗粒(19)将热量传递给发电工质后变成低温固体颗粒(3)，然后流入低温固体颗粒储罐(23)。
16	一种节能光伏深井泵及其工作方法<sep>通过第二液压缸控制第二活塞板向工作箱的内部移动，便可将底板及其顶部装置收入工作箱的内部，对深井泵进行保护，避免其受到意外损坏。
16	一种复合金属氧化物中空多壳层材料及其制备方法和用途<sep>本发明通过两步吸附法使得金属氧化物空心球的内壳层附着的窄带隙金属氧化物的相对含量高，而外壳层附着的宽带隙金属氧化物的相对含量高，从而实现对太阳光谱中各个波段的光次序吸收。
16	一种智能降温光伏模组<sep>夜间或者其它低温环境下，开关关闭，并且定时开关控制喷头对感光面板进行定期冲洗，智能化程度较高。
16	面积可调且自动跟踪式太阳能灶<sep>所述仰调装置包括与所述竖直轴的轴心连线夹角呈90度分布的前后仰调装置和左右仰调装置，其中，前后仰调装置调整承放架的前后仰角，左右仰调装置调整承放架的左右仰角，整个装置结构简单，并能根据太阳方向调整聚光板的角度，而且能够调整聚光板的光照面积，调整灶体的受热量。
16	太阳能电池片的氢钝化处理方法及其处理装置<sep>为此，本发明还提供了一种实现上述方法的氢钝化处理装置。
16	可调角度支架及光伏装置<sep>以及通过设置左旋调节结构和右旋调节结构与不同的立柱铰接，实现双梁安装架与立柱之间相对位置的调节，形成使用方便可靠的可调角度支架。
16	选择发射极电池印刷对准方法<sep>涉及晶硅太阳能电池正电级的印刷领域印刷头进行对准印刷。
16	一种太阳能电池制程追溯方法<sep>提升工作效率，降低生产成本。
16	基于噻吩类添加剂提升有机太能电池性能和稳定性的方法<sep>因此基于噻吩类化合物作为溶剂添加剂的有机太能电池具有光电转换效率高、寿命长、制备工艺简单以及成本低的优点。
16	一种可保护太阳能板的太阳能路灯<sep>太阳能板可以收缩至太阳能箱体内部，从而保护太阳能版的安全，同时还可以对太阳能板表面进行清洁，确保太阳能板不会因为表面积灰而影响其工作。
16	一种荒漠太阳能板自转向清洗轨道车<sep>且也能给自身清洗清洁，本发明结构紧凑，自动化程度高，大大降低在荒漠太阳能发电场的工作人员的劳动量。
16	一种高温电解制氢太阳能集热管<sep>本发明可直接将集热管用于太阳能吸收器并能实现水的电解，无需经过中间介质的换热过程，可有效提升太阳能的利用效率。
16	一种具有高耐热散热性能的太阳能光伏接线盒<sep>通过二极管焊接方式和耐高温材料，增加接线盒的耐高温性能，避免接线盒在高温工况下损坏，延长接线盒使用寿命。
16	一种太阳能真空管抗暴性能观测装置<sep>本发明通过电热管可以方便对太阳能真空管进行电加热操控，从而可以方便操作者对太阳能真空管的耐热抗暴性进行观测以及检测。
16	一种太阳能光电系统用光伏控制器<sep>本实用新型中，通过温度传感器，可以实时监测控制器本体内的温度，并将温度数值传递给plc控制板，当温度数值高于plc控制板时，通过预设的程序可以控制电动扇工作，提高控制器本体的散热效果，防止内部温度过高，造成元器件的损坏，提高了装置的使用寿命。
16	能量分布收集转换与波束集中控制发射的空间太阳能电站<sep>本发明将整体尺寸大的太阳能电站转化为多组相同装置，分布式收集转换空间太阳能，相互独立，互不影响，单一装置尺寸小，质量轻，无需在轨组装和拼接，有效降低对运载要求，大幅降低工程实现难度。
16	一种钙钛矿型太阳能电池及其制备方法<sep>薄膜覆盖度也大大提高，可以用来做大面积器件，为将来的产业化提供了可行性方法。
