label_id	text
23	橡塑机械密炼室专用堆焊药芯焊丝<sep>本发明的堆焊药芯焊丝，熔敷金属为高合金，金相组织为cr13型马氏体加合金碳化物，适合半自动化连续作业，而且具有优良的耐磨料磨损，冲击韧性好的特性，使密炼机的使用寿命提高1倍以上。
23	一种耐腐蚀的石油输送用螺旋埋弧焊管及其制备方法<sep>还提供了其制备方法，由此制备得到耐腐蚀性好的石油输送用螺旋埋弧焊管。
23	齿轮用圆钢及其制备方法<sep>属于炼钢技术领域齿轮用圆钢对ti、n成分精确控制，通过di公式修正，有效将淬透性带宽稳定控制在≤4hrc。
23	一种超大截面莱氏体型冷作模具钢棒材及其制备方法<sep>本发明还提供了一种超大截面莱氏体型冷作模具钢棒材的制备方法。
23	奥氏体合金气阀用钢的热处理设备<sep>有益效果在于：本实用新型通过设置l型结构的箱门，可以在开启箱门后，腾出较大的进出口空间，方便放置和取出热处理的气阀部件，较为实用，通过设置多组温度传感器测温，同时通过控制柜控制各个区域的电加热丝与温度传感器检测到的温度信息实现联动启停，确保热处理箱体内部各个区域温度的一致性，进而提高气阀部件的热处理效果。
23	一种低成本耐腐蚀高强度钢<sep>该方法生产的钢产品性能优异，成本低。
23	大线能量焊接用钢焊接药芯焊丝及其制备方法与焊接方法<sep>本发明所述药芯焊丝采用单质态的材料作为药芯材料的成分，在焊接操作之前，药芯材料的稳定更好，以使焊接的效果更稳定。
23	一种低镍含氮奥氏体不锈钢药芯焊丝及其制备方法<sep>本发明属于焊接材料技术领域焊接时无需气体保护；所述药芯由合金组分和渣系混合而成；所述合金组分按质量分数由电解锰、硅铁、金属铬、金属镍、钼铁、铜粉和氮化铬铁粉混合而成；所述渣系按质量分数由复合氟化物、碳酸盐混合物、钾长石、金红石、锆英砂和al‑mg合金混合而成。方法：将合金组分与渣系混合后，填充于不锈钢外皮中，拉拔、减径后得到低镍含氮奥氏体不锈钢药芯焊丝。
23	一种临氢设备用铬钼钢的冶炼方法<sep>采用本发明方法冶炼的钢水适用于15crmor、12cr2mo1r等临氢铬钼钢的生产，使其具有良好的抗高温回火脆化能力。
23	一种粉末高速钢的制备方法<sep>本发明具制备的高速钢具有较好的致密性和强度。
23	一种宽热成形加热工艺窗口的锌基镀层热成形钢及其制备方法<sep>本发明在传统的热成形钢产品中添加0.030‑0.10％的p元素，使得热成形过程中锌铁合金化反应速率降低，当加热时间较长时、镀层中仍含有较高比例的γ相，从而使镀层仍具有较高的耐蚀性能，使锌基镀层热成形钢产品的加热工艺窗口相较于传统产品扩大近一倍，同时热成形钢中b元素的存在能有效的防止p在晶界的偏聚所引起的二次加工脆化现象。
23	一种解决碳氮共渗质量不合格的方法<sep>其具有能有效解决待处理工件的软点及渗层不均匀的问题的优点。
23	一种粉末冶金高锰奥氏体无磁钢及制备方法<sep>本发明的优点在于：所制备的材料具有高锰、高氮、无镍、无磁、密度较高、氧含量低的特点，适合于一次成形制备形状复杂、无磁的高性能小型零部件。
23	超级双相不锈钢气体保护焊接用药芯焊丝及其制备方法<sep>药粉所含组分及含量为：铬粉36.0％～38.0％、高氮铬铁9.0％～13.0％、电解金属锰2.5％～3.0％、钼粉4.0％～5.0％、硅铁0.5％～1.0％、钛铁1.0％～1.5％、铝镁合金0.5％～1.0％、金红石18.0％～20.0％、石英1.0％～2.0％、锆英砂5.0％～6.0％、钾长石1.0％～1.5％、钠长石3.0％～3.5％、萤石1.0％～1.5％、钠冰晶石0.5％～1.0％、钛酸钾1.0％～1.5％、氧化铋0.1％～0.3％，其余为铁粉。本发明能够保证熔敷金属的成分及两相比例的均衡，获得成形质量好、耐腐蚀性能优良的双相不锈钢焊接接头。
23	一种铁路列车连接用高强度23mn2crnimovrea钢及其制备方法<sep>连接用高强度23mn2crnimovrea钢具有易于焊接、抗拉性能强、低温(‑60℃)屈服强度高的优点，该铁路列车连接用高强度23mn2crnimovrea钢的制备方法具有过程易于控制、适于推广的优点。
23	一种钠冷快堆用奥氏体不锈钢光焊丝及其应用<sep>属于焊接材料技术领域本发明不锈钢焊丝能够得到符合要求性能的焊缝，可以替代进口焊丝。
23	一种汽车零部件用非调质钢及其生产工艺<sep>本发明非调质钢通过成分的合理设计，添加微量的ni、nb、ti、n等元素来细化晶粒、提高材料的强度及韧性，精炼通过窄成分控制技术，连铸过程使用轻压下并采用合理的参数减少铸坯低倍缺陷，有利于提高材料致密度，轧制过程通过高温扩散工艺来均匀组织，并通过控冷控轧技术来细化晶粒，提高强度，最后使得材料的综合性能得到了极大提高。
23	一种获取轧钢加热炉钢坯加热过程中表面脱碳的试验方法<sep>涉及冶金轧钢技术领域在优化钢坯防脱碳加热工艺过程中，不需要使用整根试验坯，可以大量试验，方便研究在不同加热条件(加热温度、加热气氛、停机待轧等)下的各钢种脱碳情况。
23	一种炼钢柔性制造的方法<sep>应用本发明可实现更加多样化的初炼炉、精炼炉、连铸机的匹配关系，增强炼钢过程的柔性制造。
23	一种耐磨型盘形滚刀刀圈及其制备方法<sep>本发明提供的滚刀刀圈比高碳刀圈的硬度相同时耐磨性提高30％，且冲击韧性和回火稳定性显著改善。
23	一种低锰低磷钢的冶炼方法<sep>本发明能够将钢水中的成品锰控制在0.05％以下、磷控制在0.005％以下，使得冶炼的钢水和浇注的钢锭具有优良性能。
23	一种450mpa级汽车轻量化冷轧双相钢及其生产方法<sep>本发明的冷轧双相钢及其生产方法，通过优化控制成分含量以及轧制工艺中参数，得到的冷轧双相钢的吨钢生产成本低，屈强比低、初始加工硬化速率高，具有良好的冷加工成形性，成形后具有较高的屈服强度；市场前景广阔，有利于满足社会发展的需要，本发明的冷轧双相钢的生产方法，制备方法简单，适合工业化生产。
23	一种高强度高韧性桥索钢及其制备方法<sep>本发明得到的高强度高韧性桥索钢抗拉强度达到2400mpa以上，同时能满足扭转20次以上。
23	一种厚度方向性能优良的超高强度调质钢板及其制造方法<sep>本发明提供的钢板常温下的屈服强度reh≥890mpa，抗拉强度rm≥940mpa，断后伸长率a在15%~20%，‑40℃温度下冲击功kv≥100j，厚度方向断面收缩率z%≥45%，具有超高强度、高韧性、良好焊接性及优良的厚度方向性能。
23	一种板锤用高碳高铬钢及其制备方法<sep>本发明制备的高碳高锰钢用于反击式破碎机的板锤，抗拉强度在3800mpa以上，冲击韧性在13j/cm以上，硬度在60hrc以上，能够满足反击式破碎机板锤对抗拉强度、冲击韧性和硬度等的要求。
23	奥氏体twip或trip/twip钢部件的制造方法<sep>从而使扁平制品(1)变形，以便在变形制品(5)中具有嵌入延性材料基质中的高强度钢区域。本发明还涉及该部件的应用，其中在同一部件中需要嵌入在延性材料基质中的高强度钢区域。
23	一种980mpa级高延性低密度汽车用奥氏体钢及其制备方法<sep>该方法基于常规喷气冷却退火生产方法，通过设计合理的合金成分体系以及与之相匹配的合理工艺方法，使得低密度奥氏体钢具有良好的延伸率和加工硬化能力。
23	一种超高强钢筋及其生产方法<sep>本发明超高强钢筋成分设计采用较低含量的贵重合金元素，轧制后的钢筋降温时采用加盖保温罩，减缓温降速度，以利于v（c/n）的充分析出，得到的产品具有力学性能好、贵重合金元素含量少的优点。
23	一种屈服强度＞460mpa的低温韧性优异的特厚耐腐蚀钢板及其生产方法<sep>本发明的特厚耐腐蚀钢板无需添加大量mo、cr等贵重金属，生产工艺简单，本发明方法生产的120～130mm特厚耐腐蚀钢板具有高强度、高塑性、低屈强比，优异的低温韧性和耐腐蚀性能、抗层状撕裂性能、焊接性能、冷热加工性能，钢板各部位性能均匀性高。
23	一种连退炉快速复产的方法<sep>属于冷轧连续退火领域本发明能够使吹扫在开机状态下进行，不仅能够极大地缩短复产时间，而且不会对设备本身造成损坏。
23	一种钢背烘干装置<sep>烘干部用于喷出气体。
23	一种耐火捆带的制备方法<sep>通过该方法制备得到的耐火捆带具有较高的强度，良好的电绝缘性能、绝热性能、耐热性能和抗热震性能。
23	马氏体系不锈钢箔及其制造方法<sep>厚度为35μm以下，650mm长度中的陡度为0.75％以下。截面的金属组织优选为分散有碳化物的铁素体组织，进一步优选以质量％计c：0.25～1.5％、cr：10～18％、si：1.0％以下(不包括0％)、mn：1.5％以下(不包括0％)、mo：3.0％以下(包括0％)、余量由fe和杂质组成。
23	一种超快冷工艺制备的高强度桥梁用钢及其生产方法<sep>其特征在于：成分是c 0.065～0.068％、si 0.05～0.08％、mn 1.5～1.55％、p≤0.01％、s≤0.004％、nb+ti+v 0.13～0.2％、al≤0.050％，还含有cr、mo、ni、cu、稀土这5类的至少2类，余量为fe和不可避免的杂质元素。
23	下注钢锭或电极坯及其制备方法<sep>属于冶金技术领域本发明的工艺简单，成本低。
23	一种p80高镜面塑料模具钢板的制造方法<sep>本发明采用转炉+连铸+超快冷工艺生产，取代了电炉+模铸+离线固溶生产模式，生产效率高，实现了高质量p80高镜面塑料模具钢的大批量生产。
23	一种压力容器用钢07cr2almor及其生产方法<sep>本发明连铸过程采用保护浇铸防止钢水二次氧化，采用板坯重压下和电磁搅拌技术改善铸坯中心偏析，铸坯堆冷大于48h后再进行正火+回火热处理，产品性能和探伤均满足标准要求。
23	一种退火炉防瓢曲的起车方法<sep>炉区采用“阶梯提速”操作直至停在炉内热区的带钢完全离开加热段以及均热段，采用“阶梯提速”是为了让带钢与炉辊的温度尽可能趋于一致，避免了因易瓢曲料起车严重瓢曲而导致的炉内断带事故的发生。
23	降低残余应力的回火方法<sep>本方法增强了回火对残余应力的调控效果，抑制了回火过程新生残余应力的形成，同时有助于提高材料的强韧性。
23	无取向性电磁钢板和无取向性电磁钢板的制造方法<sep>结晶粒径为板厚的1/6以下的晶粒的总面积相对于钢板的截面积的面积率r为2％以上，并且，上述平均结晶粒径r(μm)和上述面积率r(％)满足下述(1)式的条件。r＞‑2.4×r+200…(1)。
23	一种800mpa级热轧螺纹钢筋及生产方法<sep>并在后续的轧制及冷却过程中形成弥散的nb(c、n)纳米级析出，析出强化效果好。采用上述成分和工艺生产的螺纹钢显微组织为铁素体+贝氏体，下屈服强度≥800mpa。
23	以if钢为过渡层的双面钛钢复合板及其高温制备方法<sep>轧后if钢过渡层厚度为280～320μm，分板后得到厚度为6～75mm的双面钛钢复合板，具有优良的耐腐蚀性和力学性能。
23	一种高强韧低屈强比厚钢板及其生产工艺<sep>属于钢铁材料领域本发明优点在于，强度高、低温韧性高及较低的屈强比，可用于低温环境下的船体结构建造。
23	一种薄规格超高硅硅钢的热轧轧制方法<sep>所述卷取工序中，卷取侧导板采用位置控制。
23	一种1000mpa级冷轧带钢铸坯纵裂的控制方法<sep>本发明从控制结晶器与铸坯接触面的热流密度的角度，避免铸坯与结晶器接触温度差过大导致微裂纹的产生，实现对铸坯表面深度≤1mm纵裂的控制，消除了缺陷，使得铸坯表面质量适应冷轧带钢的要求；将冷轧因纵裂降级率由65%降低至0.2%以下，显著降低了因质量原因导致的经济损失。
23	一种抗拉强度780mpa级冷轧双相钢及其生产方法<sep>本发明具有生产难度较小、生产成本低和产品力学性能优异的特点。
23	一种家具用高韧性耐强酸马氏体不锈钢制备工艺<sep>本发明制得的马氏体不锈钢的具备较高的韧性和耐强酸性。
23	食品级高耐磨马氏体不锈钢材料及其制备方法<sep>属于不锈钢材料领域本发明通过添加较高含量的c和cr以平衡材料的耐蚀性能；控制cr当量，获得马氏体组织，保证δ铁素体含量低于2％；通过调整mo和c的质量比，以mo固c保证耐蚀性，同时加入适量cu以及优化材料制备工艺，进而获得含钼的碳化物和富铜相的弥散析出，最终获得高硬度的马氏体基体，同时具有广谱抗菌性能。
23	一种无针孔缺陷的冷轧搪瓷钢板及其制造方法<sep>所述钢板金相显微组织含铁素体，并在铁素体基体或晶界上存在渗碳体。
23	一种高强度、高韧性低合金耐磨钢的制造方法<sep>本发明中含有微量硼元素和稀土元素的低合金结构钢，通过热处理工艺和优良铸造工艺，该低合金耐磨钢具备较高的强度（抗拉大于1300mpa）和硬度(约40hrc)，且常温韧性良好，可以作为优秀的耐磨机构件的材质。
23	一种镀锌钢丝绕线筒装置<sep>本实用新型有益效果：本实用新型设置有第一限位杆机构和第二限位杆机构，第一限位杆机构和第二限位杆机构对绕线筒收线或放线时起到限位作用，避免收放线时卷线翘起来，影响绕线筒收放线。
23	一种高强度建筑结构用抗震耐火钢及其制备方法<sep>属于建筑钢领域通过转炉或电炉冶炼，铸造采用连铸，轧制采用中厚板轧机，轧后钢板通过在α+γ相区保温后淬火以及回火的热处理工艺，通过调控贝氏体、马氏体和铁素体的组织比例来控制材料的强度和屈强比；屈服强度≥690mpa，抗拉强度850～950mpa，屈强比﹤0.85，断后延伸率≥20％，‑40℃kv2≥150j，600℃保温3h后的屈服强度大于室温屈服强度的2/3，可广泛应用于高层、超高层同时要求高强度及抗震、耐火等要求的建筑钢。
23	一种马氏体耐热钢及其制备方法<sep>本发明将马氏体耐热钢的合金化设计与回火工艺精确控制相结合，通过调整合金元素的含量及种类，采用较低温度回火，可显著提高马氏体耐热钢的高温强韧性能，获得高韧性的同时保持较高强度和硬度，避免回火脆性。
23	渗碳轴部件<sep>从外周表面起算沿孔的轴向1mm的深度位置且从孔的表面起算20μm的深度位置的组织中的马氏体和残余奥氏体的合计体积率为97％以上，从外周表面起算沿孔的轴向1mm的深度位置且从孔的表面起直到200μm深度为止的范围中的最大残余奥氏体体积率(r1)为10.0～30.0％，由r1、和从外周表面起算沿所述孔的轴向1mm的深度位置且从孔的表面起算20μm的深度位置的残余奥氏体体积率(r2)，通过式(a)：δγ＝(r1－r2)/r1×100求出的残余奥氏体减少率为20％以上。
23	一种钼/钢接头及其制备方法<sep>接头界面结合良好，无裂纹及孔隙等缺陷，接头连接强度较高。
23	一种冷轧低合金高强度钢及其生产方法<sep>生产方法，该生产方法依次通过高炉铁水，转炉炼钢，lf精炼，板坯连铸，热轧，酸冷轧，本发明的一种冷轧低合金高强度钢及其生产方法，具有易于加工和冲压的优势，同时具有较高的抗拉强度，符合减轻车辆整体重量的发展趋势，进而降低汽车燃料消耗。
23	高强度钢板及其制造方法<sep>并且，满足ma的平均当量圆直径：1.0μm以下，残留奥氏体的平均当量圆直径：1.0μm以下，和当量圆直径为1.5μm以上的残留奥氏体在全部残留奥氏体中所占的体积比例：5％以上。
23	铸态厚大断面球墨铸铁的生产方法及其铸件产品<sep>本发明的抗拉强度≥600mpa，屈服强度≥450 mpa，延伸率≥12%，球化率≥85%，珠光体含量2%‑5%，无游离碳化物及磷共晶。
23	一种低预热温度焊接的620mpa级高性能桥梁钢及其制备方法<sep>通过上述成分控制及钢板的生产工艺控制，制得的钢板强度、低温韧性、焊接性能优良，其中焊接预热温度小于等于30℃，能满足有一定要求的公路桥梁、铁路桥梁及公铁两用桥梁。
23	一种低锰抗磨铸铁磨球或磨段及其制备方法<sep>本发明生产工艺简单、成本低、且能制造出使用性价比高的低锰抗磨铸铁磨球或磨段。
23	一种连铸坯直接热轧成六角不锈钢盘卷的方法<sep>第三步，六角不锈钢大盘卷经过1000～1100℃的高温固溶热处理，经固溶处理的六角不锈钢大盘卷通过预酸洗、混酸洗、冲洗、钝化、中和相关工序后生产成酸白的六角不锈钢盘卷。
23	一种hb450级履带板用非调质高强耐磨钢的生产方法<sep>本发明方法以上述高强耐磨钢为实施对象，通过bof转炉冶炼+lf炉外精炼+rh处理+板坯连铸+控制轧制工艺流程进行钢板的生产实施，与传统高强耐磨钢生产工艺流程相比，具有生产工艺流程简洁，生产周期短、成本低、钢板性能稳定优良等特点，具有良好的经济性和技术创新性。
23	一种高强耐候钢q550nqr1、q550qnh配套电焊条<sep>本发明的焊条在焊接的过程中，焊接工艺表现优良，电弧稳定，脱渣容易，飞溅小，焊缝成形美观，全位置操作性良好，熔敷金属合金元素控制合理，各项力学性能良好，‑40℃冲击吸收能≥100j，耐大气腐蚀指数i＝12.4，满足高强耐候钢q550nqr1、q550qnh等的耐腐蚀指数要求(i≥6.5)。
23	结构钢线材、改善结构钢线材切削性能的方法<sep>属于钢铁冶炼领域该结构钢线材具有好的切削性能。
23	采用真空光亮热处理炉的不锈钢热处理工艺<sep>采用不锈钢真空光亮热处理炉的热处理工艺不但可以通过碳粒加热盒实现光亮热处理，而且可以大幅缩短转运之间，更有利于冷却速度的控制和调节。
23	一种ti微合金化高强韧性贝氏体非调质钢及其控锻控冷工艺和生产工艺<sep>此钢种和40cr调质钢相比，在原材料成本相当的前提下，疲劳性能更高、与更高等级的42crmo调质钢相当，可为锻造企业省略了热处理回火工序，降低零件制造成本并减少能源消耗，可用来替代40cr和42crmo调质钢制造对强韧性要求较高的零部件。
23	一种lpg船焊接用烧结焊剂及其制备方法与应用<sep>所述的lpg船焊接用烧结焊剂，为氟碱性烧结焊剂，包含如下按质量份计的组分：caf12～18份；mgo 25～33份；alo15～20份；cao 5～8份；sio9～15份；tio5～9份；mno 0.5～2.5份；稀土硅铁1～3份；zro0.5～2份；硼铁0.1～0.5份；金属合金1～3份；水玻璃15～20份；该焊剂与eh14埋弧焊丝匹配，工艺性较好，低温韧性优良，适用于lpg船建造用大线能量焊接，低温韧性好、抗裂纹敏感性好，且成本较低，具有较大的市场推广前景和良好的经济效益。
23	一种蠕状石墨铸铁及其制备工艺和应用<sep>材料机械性能得到极大提升，抗拉强度≥450n/mm、屈服强度≥315n/mm、延伸率≤3%、硬度范围为hb200~250，耐久寿命测试达2600小时，能够应用于高机械强度需求的压缩机核心零件涡旋盘。
23	一种8～25mm厚低屈强比罐车用高强钢板及其制造方法<sep>具有屈强比低、强度高、低温韧性和塑性优异、焊接性好等特性，且生产成本低、可操作性强。
23	一种易切削重载汽车轮毂轴承用钢及制造方法<sep>本发明生产的汽车轮毂轴承用钢加工成轮毂轴承后硬度提高、未淬透组织含量减少，同时具有良好的切削性能，更有利于汽车重载要求，也可用于自动机床加工曲轴、火车轴、齿轮轴等产品。
23	一种φ36～40mm hrb500e螺纹钢筋的生产方法<sep>本发明方法中，通过对生产流程步骤、温度等条件参数，以及钢筋中n、v等元素含量等因素的调整和控制，能够得到具有高力学性能和高稳定性的成品钢筋。
23	0cr12mn5ni4mo3al弹性垫圈的生产工艺<sep>本发明的0cr12mn5ni4mo3al弹性垫圈的生产工艺，能够将0cr12mn5ni4mo3al钢材用于制作不锈钢鞍形弹性垫圈、不锈钢波形弹性垫圈、不锈钢外锯齿锁紧垫圈、高端装备制造专用普通平垫圈或高端装备制造专用带倒角平垫圈，为各种电子设备的螺纹连接提供强韧性配合好、耐腐蚀性能良好、抗应力腐蚀性能优越、多种规格的弹性垫圈。
23	一种复合马氏体钢及其制备方法<sep>利用上述制备方法制备得到的复合马氏体钢具有较好的强度和韧性。
23	一种轧制极薄材料的cr5型锻钢工作辊的制备方法<sep>另外，通过驱动装置驱动进风筒转动，通过进风筒将氮气引至轧辊处，进一步使轧辊受冷均匀，提高深冷质量；同时在进风筒外壁设置叶轮，借用进风筒的驱动力使叶轮转动，促进深冷箱内气体的运动，使气体分布更加均匀；而且无需额外动力，降低了成本。
23	用于焊接高锰钢辙叉与钢轨的不锈钢钢轨材料及制备方法<sep>本发明能够降低成本、避免焊接高锰钢辙叉出现液化裂纹、提高焊接高锰钢辙叉的质量和成品率。
23	一种耐高温耐腐蚀沉没辊及其制造方法<sep>属于热浸镀设备领域本发明通过在沉没辊辊体及辊轴表面均喷涂特定成分的涂层材料，大大减缓了沉没辊被腐蚀速度，有效延长了沉没辊的使用寿命。
23	一种供纺织用gcr15热轧带钢的生产方法<sep>本发明通过优化加热工艺来降低脱碳层厚度、优化生产组织和压下量分配消除带钢表面凹坑和边部减薄现象、优化除磷工艺消除表面氧化铁皮压入问题及优化压下量分配及控制终冷温度消除带钢带状组织，得到的gcr15热轧带钢的脱碳层＜0.05mm、热轧带钢表面无凹坑或氧化铁皮压入、边部圆滑、无明显带状组织。
23	一种60公斤级高强焊丝用热轧盘条及其生产方法<sep>本发明利用钒、钛合金化生产高强焊接用热轧盘条，结合精轧温度、吐丝温度、冷却速度和集卷温度控制得到等轴铁素体+珠光体的微观组织，热轧盘条加工成气保焊丝，其熔敷金属抗拉强度600～700mpa，盘条成本低、性能稳定性好。
23	一种适用于锚泊定位阴极保护浮体的r6级高强韧性海洋系泊链钢及其系泊链<sep>v仅用于强化，实现vcn中n含量的提高，尤其提高了链淬火温度使钢中m3c、m2c和vcn充分固溶和回火中充分析出，提高了析出强化效果，抵消了限制合金总量可能导致的机械性能弱化，属于裂纹敏感性低和表面与内部组织和性能差别小的复合贝氏体型r6级链钢和链。
23	一种连铸坯生产保证芯部抗层状撕裂性能的大厚度钢板的制造方法<sep>抗层状撕裂性能优良，厚度二分之一处z向(厚度方向)拉伸断面收缩率＞35％，可广泛应用于大型桥梁、高层建筑等钢结构的建造。
23	一种海底管线钢x65mo的生产方法<sep>本发明生产的钢板具有良好的强、塑、韧等力学性能，弯、焊等工艺性能，以及抗hic等化学性能的综合性能匹配，适用于海底石油、天然气输送用直缝焊管的制造及其管道建设，且生产工序简单、效率高、成本低。
23	在淬火回火后具有高强度且低温韧性优异的钢<sep>以质量％为单位计含有c：0.08～0.12％、si：0.05～0.50％、mn：1.50～3.00％、p：0.040％以下、s：0.020％以下、v：0.010％以下、ti：0.010％以下、nb：0.005％以下、cr：1.00～2.50％、cu：0.01～0.50％、ni：0.75～1.60％、mo：0.10～0.50％、al：0.025～0.050％、n：0.0100～0.0200％、ca：0～0.0100％、zr：0～0.0100％和mg：0～0.0100％，余量由fe和杂质构成，al含量与n含量之比为2.6以下，mn含量与ni含量之比为1.5以上且3.0以下。
23	一种低碳含硼钢连铸板坯角部裂纹控制方法<sep>将钢包直接转入氩站进行吹氩精炼；(7)在连铸过程，在连铸坯的宽、窄面足辊区、立弯段的二至四区、弧形段的1段采用强冷却控制，而后弧形2～8段采用常规冷却控制。本发明实现了低碳含硼钢稳定控制铸坯角部裂纹发生率＜0.1％。
23	在线淬火高强钢板的板形控制方法<sep>该方法对于在没有配备预矫直机的中厚板生产线，通过板形控制工艺，提高在线淬火高强钢板的板形质量，回火后板形不平度控制在7mm/2m以下，避免调质挽救和改尺，降低生产成本，提高成材率。
