label_id	text
23	一种低硬度20crmnti圆钢的生产方法<sep>轧后圆钢穿水后进入冷床进行自然冷却，圆钢上冷床温度控制在930±30℃。
23	药芯焊丝、焊接接头的制造方法和焊接接头<sep>α相对于β的比为0.10～4.00，mgco、naco和lico的总含量为0～3.00％，除所述氟化物、所述氧化物、所述cao、所述碳酸盐和所述铁粉以外的化学成分在规定范围内，ceq为0.10～0.44％。
23	一种高品质煤矿链环用cr54钢及其生产方法<sep>本发明引入碳当量、冷裂纹敏感系数、热裂纹敏感系数，保证cr54钢优良的焊接性能，提高抗冷、热脆性；采用创新性的工艺使钢材表面质量得到提升，废品率降低，有效成本增加少。
23	一种多成分药芯焊丝及其制备方法<sep>本发明以所要焊接的零件为基础，选择最优的焊接路径，根据焊缝不同位置对各项性能的不同需求，通过数值仿真模拟，结合所需性能，以现有的焊接技术与药芯焊丝特性作为参考，计算模拟获得不同焊缝需求的药芯焊丝的成分及比例，同时确定药芯焊丝的长度和对应的焊接工艺参数；得到最优的焊缝位置相应的药芯焊丝成分及长度，对药芯粉进行铺装、旋转和拉拔后，得到各段药芯成分对应焊缝路径且中间不存在成分过渡的药芯焊丝。
23	一种低镍含氮奥氏体不锈钢焊条及其制备方法<sep>本发明属于焊接材料技术领域混合后得到药皮；二、将药皮与钾钠水玻璃混合均匀后包覆于不锈钢焊芯上，经低温和高温烘焙，得到低镍含氮奥氏体不锈钢焊条。本发明的焊条综合性能优异。
23	一种抗再热裂纹的含w高强度低合金耐热钢<sep>本发明耐热钢具有优异的抗再热裂纹性能，能够应用于超(超)临界火电机组高温部件。
23	含nb铁素体系不锈钢热轧钢板及其制造方法、和含nb铁素体系不锈钢冷轧钢板及其制造方法<sep>在该含nb铁素体系不锈钢热轧钢板中，nb碳氮化物的析出量为0.2质量％以上，且粒径0.1μm以下的laves相在每10μm的面积为10个以下。
23	一种挖掘机斗齿用合金材料及其制备方法<sep>本发明通过加入钇基重稀土，促进铸态下初生奥氏体和共晶体中的奥氏体向马氏体的转变，使硬度和冲击韧性比铸态下都有大的提高，采用硅钙脱氧剂进行脱氧，深层净化钢水，从而得到更纯净的钢水。
23	一种低碳含钴高强度桥索钢及生产方法<sep>本发明首次在桥索钢上采用金相组织为无碳化物贝氏体，并通过添加co，起到加快相变进程，促进无碳化物贝氏体组织的形成，微观组织通过相变可实现微裂纹的自我修复，使钢丝经镀锌、稳定化处理后强度可达2200mpa以上，同时满足扭转35次以上。
23	一种轧机滑板用复合钢板及其生产方法<sep>组坯焊接无需真空处理，生产成本低、生产工艺简单、生产效率和可靠性高。
23	一种抑制氧化钼压块高温挥发的添加剂及氧化钼压块及其制备和应用<sep>将此添加剂以一定比例和粒度与氧化钼、还原剂共同压块后混合在钢水中进行冶炼就可完成，运行成本低廉，可降低氧化钼的挥发损失量，进而提高合金钢的钼收得率，具有冶炼能源消耗量少、冶炼成本低的特点。
23	一种耐高温抗变形电解槽用钢及其制备方法<sep>本发明解决大型铝电解槽高温应力状态下槽壳低寿命问题，可替代大型铝电解槽槽壳现服材料q345b，使用寿命延长为q345b的1.5‑2倍，为电解铝企业节省成本。
23	一种薄板坯全无头轧制电驱动用无取向电工钢及制备方法<sep>属于钢铁制造领域与现有技术相比较，本工艺合理设计，制备出了板形和磁性能优异的薄规格、磁性优良且均匀的电驱动电机用无取向电工钢。
23	一种极寒地区用高性能耐候桥梁钢的焊接方法<sep>本发明较全面地涵盖了桥梁结构的接头形式和厚度规格，技术方案简便、适用性强，实施效果均符合现行桥梁钢及桥梁结构建造相关标准的技术要求，可实际运用于q420qfnh耐候钢桥梁结构的焊接。
23	适用于大型半自磨机衬板的高强韧性贝氏体耐磨钢及其制备方法<sep>还提供了制备方法：将经熔炼锻造或轧制成的厚板进行球化退火和热处理，得到的耐磨钢包含纳米级或亚微米级的无碳化物贝氏体和薄膜状奥氏体、以及少量的块状奥氏体。
23	一种钢板加工设备<sep>切割组件对钢板切割时，冷却组件对切割组件起冷却作用，使切割组件和钢板上的温度下降，避免切割组件上的温度过高对切割组件的使用寿命造成影响，同时避免高温对钢板的切面造成影响，进一步的提升钢板的切割效果。
23	一种提高酸溶硼含量的宽板坯生产方法<sep>解决了现有技术中含硼钢收得率低，b含量不稳定，酸溶硼占比低、成本增加的技术问题，利用现有先进的生产装备，通过加强各工序控制，达到控氮控氧的目的，提升酸溶硼含量并提高其均匀性的问题，达到生产低倍质量良好的宽板坯。
23	降低残余应力的热轧高强度带钢制备方法<sep>可以在保证材料强韧性的条件下，实现快速冷却过程中残余应力的在线调控，成本低。
23	一种钻铤用高精度无缝钢管及其制备方法<sep>本发明成管后质量好、尺寸精度高、成本低、生产效率高、合格率高、产品性能优良，尺寸精度可以达到外径满足api7‑1中对于钻铤管的精度要求，不需要做进一步的内外表车削加工；另外，本发明方法得到的无缝钢管的厚径比最大可达0.35，钢管的长度最大可达12m。
23	一种高韧性高镜面预硬模具钢及其制造工艺<sep>该高韧性高镜面预硬模具钢及其制造工艺，可实现通过利用mn‑cr‑ni‑mo复合合金化充分提高模具钢的淬透性，保证模具钢硬度及均匀性，并改善模具钢的塑韧性和强度，预硬型模具钢硬度均匀、硬度为38‑43hrc，抛光性能高、冲击韧性优越、淬透性优良，同时具有良好的焊接性与耐蚀性。
23	超高强度弹簧钢<sep>另外，基于总重还包含组成余量的铁。
23	一种恢复石墨化调质钢综合力学性能的热处理方法<sep>属于钢铁材料加工技术领域经过上述处理的石墨化调质钢，不仅可以消除仅利用调质热处理中的淬火过程使石墨回溶到基体时所带来的组织粗大、不均，进而影响其力学性能的问题；而且保证该石墨化钢组织中无石墨粒子、组织细小均匀，进而使该钢综合力学性能恢复到基础钢水平，即具有较高的综合力学性能，从而实现石墨化调质钢对其综合力学性能的较高要求。
23	一种大规格高强韧对称球扁钢及其生产方法<sep>生产方法包括冶炼、连铸、加热、轧制和冷却工艺；所生产的对称球扁钢具有优良力学性能：屈服强度在400mpa以上，‑60℃冲击吸收能量在100j以上，经5％应变、250℃保温1h时效处理后，‑60℃冲击吸收能量在70j以上；最大规格可达40#。
23	一种高性能耐腐蚀移动压力容器用钢板及其制造方法<sep>同时具有较高的耐腐蚀性能，特别适用于制作要求较高的移动式压力容器。
23	一种贝马奥复相耐磨蚀钢的制备方法<sep>生产工艺简化控制冷速的工艺，便于大生产简单的控制、质量好、耐磨性高的贝马奥复相耐磨蚀钢的制备方法。
23	耐腐蚀性能强的金属面夹芯板<sep>本实用新型通过设置镀锌层，起到了防锈、美观的效果，通过设置镀镍层，起到了根据金属镍自身的钝化能力，在表面能迅速生成一层极薄的钝化膜，能抵抗大气、碱和某些酸的腐蚀效果，通过设置挤塑聚苯乙烯层、酚醛泡沫层和三聚酯层，起到了防火、防爆和保温的效果，解决了彩钢夹芯板在使用过程中多在户外，长时间受到环境中的雨水和阳光照射的影响，会慢慢氧化、生锈，从而缩短彩钢夹芯板使用寿命的问题。
23	一种铬合金大型型钢精轧辊<sep>该精轧辊的显微组织晶粒细化，硬度高，落差小，耐磨性好，韧性强度优异，抗热裂能力强，轧材表面质量优异。
23	一种超高强钢板及其制造方法<sep>本发明可以实现2.5‑6mm薄规格高强钢板的生产，钢板屈服强度在1300mpa以上，抗拉强度超过1500mpa，延伸率≥8％，同时‑40℃冲击功值超过27j，满足d＝8a、90°折弯要求，成形性能优良，平度度良好。
23	一种1500mpa级低氢致延迟开裂敏感性热成形钢及生产方法<sep>不仅能减轻汽车车身重量，且能有效保护驾乘人员的安全。
23	高强度镀锌钢板及其制造方法<sep>铁素体、不含碳化物的贝氏体、马氏体及残留奥氏体的总面积率为3～30％，残留奥氏体中的c量为0.10～0.50％，含碳化物的贝氏体的平均结晶粒径及回火马氏体的平均结晶粒径为5～20μm。
23	一种高磷if钢及其冶炼方法<sep>采用本发明所述的方法浇注高磷if钢时，其结晶器液面波动明显降低，铸坯中大型夹杂物含量较低，冷轧过程中轧材缺陷率降低，有明显的经济效益。
23	一种大数据环境下的炼钢多工序温度协调控制系统及方法<sep>属于炼钢自动控制领域本发明提出的炼钢多工序温度协调控制方法，用尽可能低的转炉出钢温度满足连铸工序的过热度要求，对比现有的提高转炉出钢温度来保证连铸过热度的方法，可以降低转炉出钢温度，减少氧气消耗、减少降温料消耗、减少钢水含氧量、减少钢水回磷，从而降低转炉工序的成本，改善钢水质量，并提高从炼钢、精炼、连铸多工序的温度协调控制水平。
23	取向电工钢板用退火隔离剂组合物、取向电工钢板及其制造方法<sep>根据本发明的一个实施例的取向电工钢板用退火隔离剂组合物包含100重量份的氧化镁和氢氧化镁中的至少一种、5重量份至200重量份的氢氧化铝及0.1重量份至20重量份的硼化合物。
23	表层超硬化型超高强度耐热齿轮轴承钢及制备方法<sep>优点在于，与现有技术相比具有更高的抗拉强度、屈服强度和较好的塑性、韧性和耐热性，具有优异的表层渗碳超硬化性能和疲劳性能，达到了心部超强韧化和表层超硬化的良好配合。
23	f6nm马氏体不锈钢筒体锻件及热处理方法<sep>生产后产品检验尺寸都符合客户图纸要求，试样取样送第三方检测，机械性能均满足了指标要求，后经过多次生产，其机械性能都很稳定，大大降低了f6nm马氏体不锈钢生产报废的风险。
23	一种提高大规格高碳锰铬钢致密度的轧制方法<sep>通过对连铸圆坯进行多次加热，采用合理的“圆→方”或“方→圆”形变模式，达到了显著提高钢材的致密度，从而使得钢材各项性能大幅提升的技术效果。
23	一种超细贝氏体型桥梁缆索钢及其制备方法<sep>属于桥梁缆索用线材及其生产领域然后取出空冷至室温。
23	一种低硫低硼管线钢的冶炼方法<sep>本发明可将硫含量保持在0.0015%以下的情况下，控制钢中硼含量在0.0005%以下。
23	高碳铬磨球钢及其制备方法<sep>通过优化钢的组分配比以及工艺参数的调整，相互协同配合，降低了高碳铬磨球钢的碳偏析比例，圆钢弯曲较小，无断裂。
23	一种工程机械用钢板及制备方法<sep>通过4300mm双机架轧制及调质(淬火+回火)等工艺技术的实施，在低压缩比的情况下获得100‑110mm大厚度高强度工程机械用钢板。钢板拉伸强度、‑20℃低温冲击功、z向性能稳定，满足了低压缩比情况下批量生产大厚规格高强度工程机械用钢的需要。
23	一种550mpa级低温钢配套药芯焊丝<sep>药芯成分及用量按质量百分比计为：fzni‑45镍铬硼硅系自熔合金粉1.0%~2.0%，femn84c0.05微碳锰铁1.2%~1.8%，feti80‑a钛铁3.0%~5.0%，remgsife‑07cec稀土镁硅铁2.5%~4.5%，alsi50铝中间合金2.0%~3.0%，纳米mo粉2.0%~3.5%，naf 3.0%~4.5%，余量为fht100·25还原铁粉。
23	高硬度且韧性优异的钢<sep>余量由fe及不可避免的杂质构成，所述钢的淬火后的组织为马氏体组织和球状化碳化物的两相组织，长径比为1.5以下的球状化渗碳体占全部渗碳体的90％以上，旧奥氏体晶界上的球状化渗碳体个数所占的比例为全部渗碳体数的20％以下。
23	基于淬火-碳分配理念的低碳si-mn系热轧复相钢及制造方法<sep>钢板屈服强度≥460mpa，抗拉强度>800mpa，延伸率>24％，强塑积>20gpa.％。
23	高速工具钢、工具用材料及工具用材料的制造方法<sep>且所述高速工具钢中，由下述式所算出的m值满足‑1.5≤m值≤1.5。式：m值＝‑9.500+9.334[％c]‑0.275[％si]‑0.566[％w]‑0.404[％mo]+3.980[％v]+0.166[％co]，其中[]括号内表示各元素的质量％的含量。
23	用于高韧度等速万向节外轮的合金钢及其制造方法<sep>用于等速万向节外轮的合金钢基于合金钢的总重量包括：0.50wt％至0.60wt％的c(碳)、0.15wt％至0.35wt％的si(硅)、0.4wt％至0.8wt％的mn(锰)、大于0wt％且小于0.03wt％的p(磷)、大于0wt％且小于0.035wt％的s(硫)、大于0wt％且小于0.3wt％的cu(铜)、大于0wt％且小于0.00002wt％的o(氧)、以及余量的fe(铁)。
23	罐用钢板及其制造方法<sep>在轧制方向和水平面内与轧制方向成90°的方向上，拉伸强度ts≥550，断裂伸长率el>‑0.02×ts+17.5。
23	一种方便清洗的钢铁加工用冷却装置<sep>本实用新型传动辊上方设置有出水板，且传动辊的下方固定有出水管，通过出水板和出水管的共同作用，实现了以钢铁的厚度中心面的均匀对称冷却，大幅度提高了冷却效率，使冷却的效果更佳均匀，有利于提高钢铁的生产质量。
23	适用于机械除鳞的70级帘线钢盘条氧化铁皮厚度控制方法<sep>还能控制氧化铁皮中的feo含量不超过25%，更好地满足客户机械除磷的需要，既环保又保证产品性能及质量。
23	镀覆钢板及其制造方法<sep>所述马氏体的平均晶体粒径为2μm以下，所述贝氏体的平均晶体粒径为3μm以下，所述组织在每100μm中平均含有30个以上的平均粒径为0.10μm以下的ti或nb系析出物。
23	焊料合金以及使用其的安装结构体<sep>满足以下的式(i)或(ii)的in、0.5≤[sb]≤1.0的情况下5.5≤[in]≤5.50+1.06[sb]···(i)1.0＜[sb]≤1.25的情况下5.5≤[in]≤6.35+0.212[sb]···(ii)(式中，[sb]表示sb含有比例(质量％)，[in]表示in含有比例(质量％))0.5质量％以上且1.2质量％以下的cu、0.1质量％以上且3.0质量％以下的bi、1.0质量％以上且4.0质量％以下的ag、和0质量％以上且0.025质量％以下的co，余量由sn构成。
23	一种厚度300mm高强调质钢板q550ez35及其生产方法<sep>有利于保证钢板的低温冲击韧性及强度匹配，性能稳定，易于实现批量生产。
23	一种高强高韧高氮奥氏体不锈钢焊丝及其制备方法<sep>本发明的焊丝成分配比科学合理，增加氮元素的含量，调整了锰元素含量，增加氮的固溶度，使得制备的焊丝焊接过程稳定，氢元素逸出量少，气孔缺陷少，焊接工艺性好，熔敷金属强度高，‑40℃低温下仍表现出优良的冲击韧性，适用于高氮奥氏体不锈钢的焊接，特别是对低温冲击韧性有要求的奥氏体不锈钢的焊接，也可用于堆焊作为其他钢铁材料的耐蚀层。
23	一种800mpa级高强塑积q＆p钢板及其制备方法<sep>属于冷轧汽车用钢生产技术领域本发明对工艺装备要求不高，适合于现有连续退火生产线生产。
23	用于阀弹簧的超高强度弹簧钢<sep>基于按重量计100％的超高强度弹簧钢，所述弹簧钢包括按重量计0.5‑0.7％的碳(c)、1.3‑2.3％的硅(si)、0.6‑1.2％的锰(mn)、0.6‑1.2％的铬(cr)、0.1‑0.5％的钼(mo)、0.05‑0.8％的镍(ni)、0.05‑0.5％的钒(v)、0.05‑0.5％的铌(nb)、0.05‑0.3％的钛(ti)、0.001‑0.01％的硼(b)、0.01‑0.52％的钨(w)、0.3％或更少(不包括0％)的铜(cu)、0.3％或更少(不包括0％)的铝(al)、0.03％或更少(不包括0％)的氮(n)、0.003％或更少(不包括0％)的氧(o)、以及余量的fe和其他不可避免的杂质。
23	一种辊压成型高强度钢结构件用奥氏体不锈钢的制造工艺<sep>本发明的原料成本低；所制得的奥氏体不锈钢具有良好耐蚀性，且屈服强度达到600mpa以上，抗拉强度达到900mpa以上，延伸率达到35%以上，同时还具有优良的冷弯性能。
23	一种低碳烘烤硬化钢及其生产方法<sep>解决现有技术中低碳烘烤硬化钢存在较长的屈服平台会导致后续平整工艺难以消除，且易于在冲压成形使用过程中出现拉伸应变伤痕缺陷，影响外板表面质量的技术问题，达到了在未平整状态下生产具有较短屈服平台长度的低碳烘烤硬化钢，减小了实际生产中后续平整工序难度，消除在冲压使用过程中出现拉伸应变痕缺陷的技术效果。
23	一种稀土处理的耐低温x80m管线钢及其制备方法<sep>本发明通过添加稀土铈铁合金，控制冶炼、连铸、轧制以及冷却工艺得到的管线钢具有良好的拉伸性能、低温冲击韧性、dwtt断裂韧性。
23	一种铸钢材料及其铸造方法<sep>在不增加成本的前提下，尽可能减低s、p、cu、cr、ni等元素的含量，同时，适当提高mo、mn等元素的含量，最大限度的保证材料的力学性能和焊接性能。
23	一种锆钢复合板及其制备方法<sep>本发明所公开的锆钢复合板的制作方法，采用封焊后进行压延复合的方式进行制作，能够在普通的工作环境下进行，而无需像爆炸复合制作方法，需要选取偏僻的环境进行，耗时耗力，且危险性高。
23	低成本、短流程、高效率生产sphc的工艺<sep>属于钢铁冶金工艺技术领域工艺处理过程缩短，可以减少能源介质消耗，降低成本，最终所得产品的指标容易得到控制。
23	一种药芯焊丝<sep>本发明通过各物质相互配合，可大大降低焊接飞溅的问题，使得焊接涂层气孔率低，涂层组织致密，韧性好，强度高。
23	一种700mpa级高强度亚稳态奥氏体-马氏体不锈钢<sep>本发明的有益效果在于：本发明不锈钢包含马氏体和奥氏体的两相组织，与传统的高强度不锈钢相比，具有更低的合金成本，且强度和韧性综合性能优异。
23	密封盖的生产方法<sep>该生产方法所生产出的密封盖具有较好的力学性能，并且还可以对密封盖的底面结构进行预加工，生产更加便捷。
23	一种添加tic的低密度高强度钢及其制备方法<sep>属于金属材料技术领域本发明所述方法不仅实现添加的tic均匀分布，且有效提升了钢的弹性模量，并一定程度提高了钢的强度，同时降低了钢的密度。
23	一种应变设计管线钢x65钢板及其生产方法<sep>同时，解决了水冷却时导致钢板长度上性能波动的问题，实现高效率生产性能稳定的管线钢。
23	一种镜面取向硅钢的制造方法<sep>将经过干燥退火后的所述冷轧板以预设升温速度升至1170～1250℃进行高温退火。
23	抗疲劳性优良的高强度钢丝及其制造方法<sep>
23	一种耐磨搓丝板及其生产工艺<sep>纳米复合镀层以镍镀层为基础，复合纳米微粒，兼具良好的韧性和塑性、强度和硬度，使镀层的抗粘着磨损率增强。
23	一种抗拉强度800mpa级热镀锌高强钢及其减量化生产方法<sep>其生产方法为：炼钢，精炼，连铸热轧，酸洗，退火镀锌，光整，省掉了传统生产工艺流程的冷轧工序，生产流程显著缩短，生产过程能耗和co排放大大降低，生产效率显著提升。
23	一种冲孔镀镍钢带的退火装置<sep>本发明能提高冲孔镀镍钢带抗拉强度和延伸率的均一性和稳定性。
23	一种熔模精密铸造球墨铸铁qt700-8生产方法<sep>本发明的方法制备的球墨铸铁qt700‑8抗拉强度rm≥700mpa，断后伸长率a≥8％，基体组织为珠光体基体，珠光体含量60‑80％，球化级别1‑2级，石墨大小6‑7级；填补了熔模精密铸造生产qt700‑8的空白，与砂铸qt700‑8相比，仅加入少量的铜，不需加入ni或mo等贵重金属，生产成本更低；降低缩松缩孔风险、提高抗震性；只需要加入少量合金元素，就可以得到与qt700‑2同等抗拉强度，同时具有更高的韧性。
23	用于铸铁件的水性防腐蚀低温自干涂料与防闪锈涂装方法<sep>车桥壳，离合器片，圆柱齿轮壳和平衡轴支架等铸铁材质的关键零部件的腐蚀防护。
23	一种高铝冷硬钢带的连续酸洗工艺<sep>本方法通过焊接参数的设计，酸轧参数的设计，降低了焊缝区三氧化二铝氧化物含量，解决了酸轧过程中焊缝氧化物伤辊的问题，保证了酸轧带钢的表面质量同时降低酸轧断带的风险，有效提高了酸轧连续生产的成材率，降低了生产成本；生产的高铝含量钢带头尾带钢表面质量良好。
23	一种屈服强度390mpa级别高铁转向架构架用钢及其制备方法<sep>所述钢种具有成本低、综合力学性能优异、易焊接、耐腐蚀等特点。
23	一种无镀铜er50-6气保护实心焊丝<sep>本发明所述的实心焊丝，采用特殊的表面涂层使无镀铜焊丝在导电、润滑、导电嘴磨损、防锈等指标上等同和优于镀铜焊丝。
23	铁素体耐热不锈钢及其制备方法<sep>能够提高不锈钢的高温抗氧化性能，同时对c、si、mn、p、s和cr的含量进行调整控制，能够生产出具有优异的抗高温氧化性能、冲击韧性、低膨胀系数和焊接性能的铁素体耐热不锈钢。
23	一种含纳米晶奥氏体的多元低合金耐磨铸钢及其制备方法<sep>本发明多元低合金耐磨铸钢经多元微合金复合处理后，凝固组织明显细化，经进一步超高温、高温和中高温的变温淬火处理后，获得了马氏体加纳米晶奥氏体的复相组织，具有硬度高、耐磨性好和强韧性好等特点，具有很好的使用效果，推广应用具有良好的经济和社会效益。
23	一种双相钢淬火速冷却装置<sep>有益效果在于：本实用新型通过设置缓冲桶和换热管，可对循环使用的水源进行换热处理，既提高了能源的利用效率，又加速了冷却水的降温，有利于双相钢的快速冷却淬火。
23	提高横向磁通感应加热带钢横向温度均匀性装置及方法<sep>将测温仪数据在带钢宽度方向上按一定比例分为固定区域、中部区域、边部区域和带钢边沿四个部分，根据各区域带钢温度实际值，按照不同策略分别调整磁极和屏蔽罩位置。
23	一种高导热高强度灰铸铁及其制备方法<sep>本发明提供灰铸铁的抗拉强度为280～350mpa，硬度为210～240hb，导热系数为50～60w/(m·k)，相同试验条件下导热系数显著高于同等水平抗拉强度的灰铸铁。
23	一种石油套管及其制备方法<sep>本发明的石油套管具有良好的力学性能，减小了热加工时组织的拉长趋向，并使材料的各向异性降至最低，加入稀土微合金化，使钢种塑性性能大幅度提高。
23	一种货架用低成本冷轧高强钢<sep>p≤0.025wt％，s≤0.015wt％，alt≥0.020wt％，余量为fe和不可避免的微量元素。
23	一种脉冲电流消除a508-3钢老化脆化的方法<sep>本发明可以“原位”对已发生辐照脆化的a508‑3钢进行处理，使已老化脆化的a508‑3钢的位错缺陷数量得到大幅度降低，进而恢复其夏比冲击韧性，同时还可以进一步降低消除a508‑3钢脆化所需要的温度，节约大量能源。
23	一种屈服强度500mpa级的耐多种介质腐蚀钢及其制备方法<sep>能耐氯离子、硫酸根和亚硫酸根离子混合介质腐蚀，其屈服强度在500mpa以上，‑40℃冲击韧性≥80j，焊接性能优良。
23	用于铣削淬硬钢的硬质合金刀片及其制备方法<sep>本发明提供的制备方法成本低廉，适合大规模生产，制备得到的硬质合金刀片在铣削淬硬钢时的耐磨性和抗崩刃性良好。
23	一种耐大气腐蚀特厚板q355gnh钢板及其生产方法<sep>与现有技术相比，本发明能将奥氏体一定量的晶粒分割成多个区域，并在后期冷到贝氏体转变温度后，被分割的各区内不同取向亚晶界上的析出物促使贝氏体在各亚晶界形核，亚晶的取向差引起各亚晶贝氏体束方向不同，并且各束贝氏体的长大过程受亚晶界的限制；在双相区淬火后得到软、硬相结合的组织，即游离铁素体+贝氏体+残余奥氏体的混合组织，从而完成本发明。
