label_id	text
28	一种蒸汽补热空气储能调峰系统<sep>本实用新型在储能模式下消耗汽轮机组发电量驱动压缩机压缩空气，降低燃煤机组上网负荷，释能模式下可以选择串联或并联方式利用蒸汽加热低温空气推动膨胀机发电，提升燃煤机组上网负荷，压缩机工作温度低、单位功耗少，补热过程中充分利用了机组蒸汽的潜热和部分显热，实现了蒸汽的梯级利用，降低了机组发电煤耗。
28	用于将来自热源的废热转换成机械能的有机朗肯循环以及利用该有机朗肯循环的压缩机装置<sep>其特征在于，orc(8)配备有用于确定由膨胀器(12)产生的机械能的装置(21)和调节进入膨胀器(12)的工作流体的蒸汽分率的控制装置(22)，其中控制装置(22)将基于所确定的机械能来调节前述蒸汽分率，使得由膨胀器(12)产生的机械能最大化。
28	一种余热回收燃烧锅炉<sep>本实用新型结构设计新颖，能够实现对锅炉本体冷却水换热重新利用，余热用于水加热或室内保温，减少了能源的浪费。
28	一种具有多种运行模式的热回收式多联机系统及控制方法<sep>还通过在水力模块与热泵制冷系统间设置多个电磁阀，在结合不同的水温、室温、冷媒温度情况下根据系统的多种运行模式以交替通断以对热水转换不同的加热模式，具有节约能耗、结构简单可靠，方便维护等优点。
28	热源转换装置及泛能站余热综合利用系统<sep>本发明能够回收绝大部分泛能站能源系统中没有利用的低温热量，并将部分能量提升品位满足更高的需求，提高了整个系统的能源利用效率、节约了能源投资、减小了热排放对环境的热污染，完善了整个系统整体热量利用性能。
28	蒸汽发生器给水环组件装焊定位装置及定位方法<sep>该装焊定位装置制备简单成本低、后期维护便利，可以用于蒸汽发生器给水组件的焊接、加工和定位安装的全部工序中，防止c型环管的变形和保持平面度。
28	环敷在回转窑壁面的热回收系统及选用方法<sep>该系统与蓄热系统、热泵系统等联合使用，还能进一步扩大使用用途。
28	基于转轮式热回收、间接蒸发冷却及机械制冷的空调机组<sep>本实用新型解决了单独使用蒸发冷却系统或机械制冷系统时，降温幅度有限以及能耗较大的问题，实现蒸发冷却与机械制冷的优势互补，充分提高机组的能效比。
28	一种组合式省煤器<sep>本实用新型结构新颖，构思巧妙，两次热交换，使烟气温度达到排烟要求，不仅有效降低了锅炉的排烟温度，节约燃料，实现节能减排。
28	一种熔盐燃料多堆系统<sep>包含一套中子源系统，来驱动反应堆。本发明的熔盐燃料多堆系统充分利用液态燃料的流动性，可在同一个系统内实现产能、增殖、嬗变等功能。
28	一种冷热电和纯水四联供系统及联供方法<sep>本公开的冷热电和纯水四联供系统能高效梯级利用排气余热及余压，一次能源综合利用效率高，且对环境友好。
28	一种溴化锂吸收式制冷机节能系统<sep>本系统能充分回收利用溴化锂吸收式制冷机组的热量增加加热效率，能避免降温时对水量的蒸发和电能的消耗，在提升系统运行效率的同时降低了系统能耗成本，实现了系统的节能环保。
28	一种基于复杂工况的燃气内燃机发电功率及排烟参数的计算方法<sep>本发明能够准确计算基于复杂工况的燃气内燃机发电功率及排烟参数，为燃气内燃机在工程中的配置方案提供依据，进而使整个工程系统的热效率达到最大，最终达到节能降耗的目的。
28	节水型蒸发式冷凝器<sep>本发明具有增加水蒸气回收量，降低水分损失，达到节水的有益效果。
28	变容积冷冻冷藏风冷式制冷设备<sep>实现降低制冷设备的制造成本，简化控制过程并提高运行可靠性。
28	一种高节能纳米真空蒸发源<sep>缩小了蒸发时的散射面，能够提高源材料的有效利用率，减少了源材料的浪费，避免出口堵塞。
28	机房和热水系统的组合空调系统及其控制方法<sep>本发明既能实现机房高效制冷，又能实现机房热回收全年高能效提供热水，充分利用室外自然冷源与机房热量，具有优异的节能减排效果。
