label_id	text
33	基于海浪波力能原理驱动的多缸海浪发电装置<sep>涉及海洋工程技术领域该基于海浪波力能原理驱动的多缸海浪发电装置，利用海浪运动产生的波力能原理为动力源，不需要借助外力，减少了该装置的使用成本，提高了该装置的实用性，除在海上使用，该装置还可应用于水面较大且流速较高的河流或湖泊，提高了该装置的适用性。
33	一种带有抗震与光轴调节机构的船用跟踪监视搜索装置<sep>涉及海域监控领域本实用新型能够避免船艇震动带来传感器震动，有效提高图像质量提高镜头的抗震性，延长镜头的使用寿命，降低使用成本。
33	用于地震数据采集的可变浮力控制和回收系统<sep>控制器可构造成响应于压载流体的传递来调整地震线缆系统的浮力，例如，其中内部容积基于流体传递扩张或收缩。
33	一种水下移动目标智能抓取装置<sep>可方便地实现对水下移动目标的抓取。
33	一种海洋石油钻井立管系统分流器<sep>该海洋石油钻井立管系统分流器，通过搭扣和搭把能够将分流器体与钻井立管进行临时连接，通过螺纹杆和螺纹筒与固定环配合，利用转把转动固定环，能够使螺纹杆在螺纹筒的内部转动，从而将分流器体与钻井台进行连接。
33	绞车<sep>属于机械设备领域推动装置整体占用的空间较小，可实现绞车在一些狭小空间内的安装，绞车的通用性也有所提高。
33	深水导管下入过程中钻头伸出量的模拟方法及系统<sep>本发明提供的深水导管下入过程中钻头伸出量的模拟方法及系统，能够对深水导管下入过程的钻头伸出量进行室内实验模拟和评价。
33	一种水上浮动平台结构<sep>缓冲件固定座外侧端上部及下部对称设置有能扣入环形橡胶件的凹槽，相邻浮力单元上相邻的底座之间经穿过环形橡胶件的连接件连接，本水上浮式平台结构易于搭建，稳定性、抗风浪能力显著提高。
33	一种基于波浪能原理的多圆柱体波浪发电装置<sep>该原理基于海洋波浪力驱动的多缸波浪动力装置，利用波浪运动产生的波浪力可以作为动力源，不需要使用力，降低了装置的使用成本，提高了装置的实用性，除在海上使用外，该装置还可以应用于水面和流速较高的河流或湖泊，提高了装置的适用性。
33	本实用新型涉及一种具有抗震、光轴调节机构的海洋跟踪监测搜索装置<sep>涉及到海洋监测领域本实用新型专利技术可以避免传感器因船舶振动而引起的振动，有效提高图像质量，提高透镜的抗冲击性能，延长透镜的使用寿命，降低使用成本。
33	用于地震数据采集的可变浮力控制与回收系统<sep>控制器可以根据压载流体的传输来调整地震线系统的浮力，例如，内部体积根据流量传输而膨胀或收缩。
33	一种水下运动目标的智能抓取装置<sep>连接臂的外端与拖网自身(19)之间设有锁紧机构;每个拖网自备(19)上分别设置有拉绳连接在抓网(2)的开口端，所述抓网单元组与所述抓网(2)端口之间设置有捆绑机构;便于水下运动目标的抓取。
33	本实用新型涉及一种海洋石油钻井隔水管系统的转喷器<sep>海洋石油钻井隔水管系统的分流器可以通过卡扣和表带与分流体和钻井隔水管临时连接，螺杆和螺缸与固定环配合，螺杆可以通过旋转手柄在螺缸内转动，将分流体与钻井平台连接起来。
33	绞车<sep>属于机械设备领域驱动装置占用的整体空间小，可以实现绞车在一些狭窄空间的安装，也提高了绞车的通用性。
33	深水导管运行过程中钻头扩展的仿真方法与系统<sep>本发明提供的深水导管运行过程中钻头延伸的模拟方法和系统，可在实验室实验中对深水导管运行过程中钻头延伸进行模拟和评价。
33	水上的浮动平台结构<sep>浮式平台结构易于搭建，稳定性和抗风浪能力显著提高。
33	一种海洋石油钻井立管系统分流器<sep>该海洋石油钻井立管系统分流器，通过搭扣和搭把能够将分流器体与钻井立管进行临时连接，通过螺纹杆和螺纹筒与固定环配合，利用转把转动固定环，能够使螺纹杆在螺纹筒的内部转动，从而将分流器体与钻井台进行连接。
33	一种水上浮动平台结构<sep>缓冲件固定座外侧端上部及下部对称设置有能扣入环形橡胶件的凹槽，相邻浮力单元上相邻的底座之间经穿过环形橡胶件的连接件连接，本水上浮式平台结构易于搭建，稳定性、抗风浪能力显著提高。
33	深水导管下入过程中钻头伸出量的模拟方法及系统<sep>本发明提供的深水导管下入过程中钻头伸出量的模拟方法及系统，能够对深水导管下入过程的钻头伸出量进行室内实验模拟和评价。
33	水上浮台结构<sep>相邻浮力单元上的相邻底座通过环橡胶件的连接件连接，浮式平台结构易于搭建，稳定性和抗风浪能力显着提高。
33	基于海浪波力能原理驱动的多缸海浪发电装置<sep>涉及海洋工程技术领域该基于海浪波力能原理驱动的多缸海浪发电装置，利用海浪运动产生的波力能原理为动力源，不需要借助外力，减少了该装置的使用成本，提高了该装置的实用性，除在海上使用，该装置还可应用于水面较大且流速较高的河流或湖泊，提高了该装置的适用性。
33	一种带有抗震与光轴调节机构的船用跟踪监视搜索装置<sep>涉及海域监控领域本实用新型能够避免船艇震动带来传感器震动，有效提高图像质量提高镜头的抗震性，延长镜头的使用寿命，降低使用成本。
33	用于地震数据采集的可变浮力控制和回收系统<sep>控制器可构造成响应于压载流体的传递来调整地震线缆系统的浮力，例如，其中内部容积基于流体传递扩张或收缩。
33	一种水下移动目标智能抓取装置<sep>可方便地实现对水下移动目标的抓取。
33	绞车<sep>属于机械设备领域推动装置整体占用的空间较小，可实现绞车在一些狭小空间内的安装，绞车的通用性也有所提高。
33	绞盘<sep>属于机械设备领域推动装置占用的整体空间较小，可以实现在一些狭窄空间安装绞盘，也提高了绞盘的通用性。
33	波浪力能量原理驱动的多缸海浪发电装置<sep>涉及海洋工程技术领域本装置除可用于海上外，还可应用于水面大、流速高的河流或湖泊，提高了装置的适用性。
33	一种海上石油钻井立管系统分流器<sep>螺纹杆可在螺纹筒内转动，从而将分流器体与钻井平台连接起来。
33	一种水下运动目标的智能抓取装置<sep>便于抓握水下运动目标。
33	用于地震数据采集的可变浮力控制和恢复系统<sep>控制器可以被配置为响应于压载流体的转移调节地震电缆系统的浮力，例如，在内部容积基于流体转移而膨胀或收缩的情况下。
33	一种带地震光轴调节机构的海洋跟踪、监测和搜索装置<sep>涉及海域监测领域本实用新型可以避免船体振动引起的传感器振动，有效提高图像质量，提高镜头的抗震能力，延长镜头的使用寿命，降低使用成本。
33	水上的浮动平台结构<sep>浮式平台结构易于搭建，稳定性和抗风浪能力显著提高。
33	深水导管进入过程钻头突出模拟方法及系统<sep>其中参考信号包括压力信号、张力信号、位移信号和液压信号。根据参考信号，选择预定实验条件下深水导管进入过程中目标钻头的突出量。本发明提供的深水导管进入过程中钻头突出量的模拟方法和系统，可以模拟和评估深水导管进入过程中的钻头突出量。
33	绞车<sep>属于机械设备领域驱动装置占用的整体空间小，可以实现绞车在一些狭窄空间的安装，也提高了绞车的通用性。
33	深水导管运行过程中钻头扩展的仿真方法与系统<sep>本发明提供的深水导管运行过程中钻头延伸的模拟方法和系统，可在实验室实验中对深水导管运行过程中钻头延伸进行模拟和评价。
33	一种水下运动目标的智能抓取装置<sep>连接臂的外端与拖网自身(19)之间设有锁紧机构;每个拖网自备(19)上分别设置有拉绳连接在抓网(2)的开口端，所述抓网单元组与所述抓网(2)端口之间设置有捆绑机构;便于水下运动目标的抓取。
33	用于地震数据采集的可变浮力控制与回收系统<sep>控制器可以根据压载流体的传输来调整地震线系统的浮力，例如，内部体积根据流量传输而膨胀或收缩。
33	本实用新型涉及一种具有抗震、光轴调节机构的海洋跟踪监测搜索装置<sep>涉及到海洋监测领域本实用新型专利技术可以避免传感器因船舶振动而引起的振动，有效提高图像质量，提高透镜的抗冲击性能，延长透镜的使用寿命，降低使用成本。
33	一种基于波浪能原理的多圆柱体波浪发电装置<sep>该原理基于海洋波浪力驱动的多缸波浪动力装置，利用波浪运动产生的波浪力可以作为动力源，不需要使用力，降低了装置的使用成本，提高了装置的实用性，除在海上使用外，该装置还可以应用于水面和流速较高的河流或湖泊，提高了装置的适用性。
33	本实用新型涉及一种海洋石油钻井隔水管系统的转喷器<sep>海洋石油钻井隔水管系统的分流器可以通过卡扣和表带与分流体和钻井隔水管临时连接，螺杆和螺缸与固定环配合，螺杆可以通过旋转手柄在螺缸内转动，将分流体与钻井平台连接起来。
33	一种基于可抛载足垫的自适应海底着陆器<sep>属于深海探测技术领域本发明通过设置可伸缩支撑腿，实时调整着陆器着陆时的姿态，防止其倾倒，适应各种复杂的海底环境；可抛载足垫既作为配重压载，又可以实现着底支撑作用。
33	一种水轮装置及带有水轮装置的船<sep>本发明在现有的船舶条件下高效利用了水轮装置，将发电、推进和减摇的功能合并，可以减少船体内部空间的使用。
33	一种系缆脱缆装置<sep>属于海洋工程装备领域此时，由于夹紧机构承载了缆绳的拉力，工作人员可以很轻松的将缆绳系于固定钩机构上，而不会因为缆绳受力变化带来危险。
33	船用远距离无线传输中转支架<sep>在开阔的区域将伸缩杆完全伸开，使得无线传输中转避开货物载运区域，当及货物不遮挡或者航行区域拥挤时，可以将伸缩杆收缩使其靠近船身。
33	一种已知子载波频率的ofdm-mfsk水声通信宽带多普勒估计与补偿方法<sep>属于水声通信领域本发明提出的方法，可以仅通过一次数据过采样即可实现水下ofdm‑mfsk通信系统中宽带多普勒的精确估计与补偿，避免了传统多普勒估计与补偿方法需要进行数据重采样的过程，提高了计算效率。
33	一种用于石油钻杆表面除锈装置<sep>本发明除锈时可将石油钻杆进行顶升起来并利用压梁和压轮组进行压住，而压杆驱动机构驱动灵活，可方便的实现压轮组的下压与抬起的转换，提高操作的方便性。
33	一种水下拖曳系统拖头及装配方法<sep>本发明用于声纳系统、海洋声学测量仪器等水下拖曳系统的承力元件，按照本装配方法使拖头设计破断载荷最高达到了拖缆本体强度85％以上，满足了拖头的设计要求，且该拖头已经过多次海上验证和实验验证，技术已经成熟，已经在多艏舰船上进行了列装。
33	一种海上浮动平台的快速连接装置<sep>整体采用螺栓等结构连接，连接稳固性好，整体浮力效果好，载重能力强，负荷性能强，同时利用连接件、固定螺栓c和连接杆的配合使用，将整体连接稳固，使其整体抗风浪性好，且载板安装后，由于固定板的厚度与踏板槽的深度一致，使得各载板上的连接缝隙减小，减少因磕绊引起的安全隐患问题，本装置采用装配一体化模块方式，连接快速稳固、整体结构连接性强、抗风浪效果好、安全性高以及使用效果好，值得推广使用。
33	海洋平台应急救生系统<sep>升降房外部设有与升降轨道限位配合的辊轮；所述升降房内至少设置防火门、防火窗、照明灯以及与升降电机绞车连接的启动器、减速控制器。该系统解决现有自升式平台在发生事故时逃生仅仅依赖斜梯的安全隐患，平时有运输人员和轻便物资的功能，使生产和工作更加方便。
33	一种低能耗双体船结构<sep>属船舶制造领域其特征在于：一种低能耗双体船结构，所述两个船体对称，外侧均设置为平直板，船头至船尾的外侧平直板间距相等，所述两个船体内侧，设置为竖直平直板和向船尾外侧弯曲的流畅形曲面板，所述两个船头均设置尖角为19.5°的尖端分水头，外侧三角面与船体外侧平直板同平面，内侧三角面竖直向船尾倾斜，在距船头纵向水平距离l/ctg19.5°的船底架设有湍流导向板，双体船在向前航行时，船头排开的水只涌向双体船内侧，通过湍流导向板增加向船尾的流速，辅助船舶推进器增大推进力，同时提升船尾的水压强，缩小船舶首尾的水压强差，减少兴波阻力，提高航速。
33	海洋内波观测潜标防腐防裂防电化重力锚<sep>不仅解决了深海潜标重力锚的材料、重量确定以及与标体连接蚀断等问题，而且形体美观、搬运方便、使用可靠。
33	球鼻船首、具有这种船首的海船和其制造及安装方法<sep>本发明还涉及包括这种球鼻船首的海船以及制造球鼻船首的方法和安装或更换球鼻船首的方法。
33	半潜平台及其下浮体<sep>降低平台主机或拖轮主机的燃油消耗量，进而降低了作业成本。进一步地，本发明还可改善了平台垂荡性能。
33	一种用于海上浮动平台的刚柔式多维波浪运动补偿装置<sep>本发明提供的补偿装置解决了现有主动式波浪补偿装置不能满足实际应用需求、补偿效果差的问题。
33	一种多功能四体船<sep>四个片体船结构可以通过液压传动装置带动液压折叠杆伸缩实现整体合拢状态以及四个片体船同时并行链接航运状态，在平时正常运货时，液压折叠杆完全伸展，四个片体船共同平行运输载货，即四体船舶，使在江海联运中，能够实现一个整体船面的延伸，增加甲板面积，达到一种整体宽扁形船舶效果，可以保证在江海联运区域正常航行；同时，当遇到紧急海况或者战时状态时，可以将四片体船合拢为一个密封整体弹状船体，实现下潜潜艇的功效。
33	一种基于连续油管电驱动的双梯度钻井系统<sep>属于天然气水合物和海底浅层油气钻探设备技术领域本发明能够有效对海洋天然气水合物进行开采，提高开采成功率，是一种可靠性较高的工艺设备。
33	一种用于水下对接的机械手<sep>属于机械设计及自动化技术领域本发明搭载于水下机器人，适用于实现水下对象对接作业的领域<sep>本发明的对接对象需有与本发明的机械手相适配的目标对接体。
33	一种新型深海采矿提升系统<sep>本发明的优点在于：本发明采用水利提升，能够将提升到水面的废水打回海底、同时通过废水驱动海底提升泵提升矿石，保护采矿海面的环境。
33	用在海上船上的对波浪引起的运动补偿的起重机、船及负载传递方法<sep>其中悬臂梁可围绕基本竖直的回转轴线回转，并且可在悬臂梁的纵向方向上平移。优选地，可以基于吊臂结构的角度定向来调平悬臂梁。
33	一种矿山地质测量用gps接收机<sep>该矿山地质测量用gps接收机，方便进行使用的工作，同时能够更好的进行连接使用，防止出现脱落的情况，同时能够长时间的进行使用，提高设备的使用时间。
33	一种温盐深传感器的非接触式传动矢量推进载体<sep>该载体采用非接触式传动以便在深水域能够承受巨大水压，同时具有非接触式控制螺旋桨偏转的功能，以便能够在水里实现转向。
33	一种半主动波浪补偿绞车<sep>油泵的出油口分别与储能器和电磁换向阀的第一油口连接，电磁换向阀的第一油口与储能器连接，第二油口与油箱连接，第三油口分别与第一输油管和第二输油管连接。
33	一种线缆抗拉连接结构及使用该结构的承重水密连接器<sep>通过本发明的实施，使用了一种在同轴导线外部增加承力绳及密封保护层的承重同轴电缆，利用该承重电缆将水上分机与水下分机连接，水上分机通过单根电缆即可实现对水下分机的直接供能、操控，同时在连接器上设置了专门的防水结构，各个关键器件之间也大多通过螺纹连接与过盈配合的方式进行连接，大大提高了连接器的防水性能。
33	一种适用于波浪能滑翔器的水下耐疲劳减震装置<sep>属于海洋工程技术领域本发明能够有效减小挂缆疲劳断裂的风险，大大提高波浪能滑翔器的使用周期。
33	钻井平台隔水套管张紧液压缸的安装方法<sep>本发明张紧液压缸的安装方法，从平台主体的下方进行起吊和安装，不受平台上各设备测试顺序的限制，省去专用安装设备，仅通过设置船只、吊索具即可完成安装作业，大大降低了安装成本。
33	围网的投网航迹显示及控制系统<sep>其以通过所述发送接收部而从安装于所述围网船的测量装备接收的数据为基础，预测捕捞鱼群所需的投网轨迹路径；以及统合显示画面生成部，其生成包括从所述投网轨迹路径预测部预测的投网轨迹路径的统合显示画面信息。
33	一种具有沉陷状态监测装置的海底采矿车<sep>避免因纵向重心偏移导致前后沉陷深度不一从而造成沉陷误判，且内置水平调节机构，使得海底采矿车于斜坡状海底沉积层运行时，有效减轻因平面倾斜导致的重心偏移及沉陷。
33	一种海底监测平台重块自动释放装置<sep>该装置适用于无缆式海底监测装置，可自行抛载回收，稳定性高。
33	一种油气勘探用钻井平台作业设备<sep>本发明可以解决现有坐底式钻井平台沉垫在实际作业过程中存在的水底抓着力小，影响钻井平台工作的稳定性，注水后的沉垫沉入水底，着力点比较集中，支撑力不足，不利于钻井平台稳定作业等难题，可以实现坐底式钻井平台沉垫稳定作业的功能，水底抓着力大，稳定性好等优点。
33	一种泡沫陶瓷结构组装成的海上环岛平台<sep>本发明具有性质稳定，受自然环境的影响小的特点，能够解决高密度聚乙烯浮筒随时间的老化问题，可极大的延长结构的使用寿命。
33	一种多波束设备安装装置及其拆装方法<sep>一种多波束设备安装装置包括设置于船体的月池内的楔形安装体、楔形支撑基座以及导向结构、锁紧装置和起吊结构；本发明通过楔形安装体的自重与楔形支撑基座配合安装，多波束设备固定于楔形安装体的底部，通过导向结构和锁紧装置对楔形安装体进行导向以及限位，通过起吊结构进行吊装，使在船底的安装更稳定，无需进船坞便可对设备进行维护，另外，楔形安装体采用半开式导向设计，在导向的基础下使结构紧凑，适应最小月池大小和月池顶部舱口盖开口的拆装，且能适应较大海况，另外还提供了对上述安装装置进行拆装的方法，能合理、高效且安全的实现了对多波束设备的拆装。
33	一种船体外壳水线下检查清污机器人<sep>本实用新型提出的一种船体外壳水线下检查清污机器人，配合磁吸式履带以及本体的多段式结构，可以实现清污过程中机器人全程稳定地吸附在船体表面，避免脱落，清污效果好且范围大，效率高。
33	天然气水合物开发深水海床钻井系统<sep>本发明能够大幅度降低水合物井的钻完井成本。
33	用于驱动船的船驱动装置<sep>其中，设置一种水识别装置(4)，所述水识别装置设置用于识别所述螺旋桨(3)是否浸没在水中，并且借助所述水识别装置能够通过所述操控单元(18)影响所述电动机(2)的功率。
33	一种基于海床基式的陡坡波流测量装置及部署方法<sep>解决了陡坡处的波流测量装置布放的安全性问题，确保了测量稳定性和数据准确性，并且考虑了回收可靠性。
33	一种基于拍卖博弈论的水下数据传输通信链路选择方法<sep>本方法可以有效地解决水下占用光信道的使用者减少，有效的解决了信道拥挤带来的传输速率下降，时延过大的问题。
33	自升式平台的弦相位标定方法<sep>属于海洋平台升降系统技术领域该方法可以准确检测各个弦杆的弦相位，保证自升式平台升降过程中的安全性。
33	一种海洋工程用钻井平台防风装置<sep>本发明中，两个侧挡风板的内弧面承受风力，通过风力推动两个侧挡风板的内弧面，拉动两个副挡风板，带动滑套在弧形结构的滑杆表面滑动，使得第二挡风板的外弧面始终朝向风向，提高防风装置的防风效果。
33	一种应用于水下机器人的滑索式可折叠布放装置及其布放方法<sep>还公开了一种滑索式可折叠布放装置的布放方法，该采用可折叠机构，结构紧凑，可以实现水下机器人从船基或岸基到水面的稳定快速布放。
33	水下固体压载抛载装置<sep>水下固体压载抛载装置能够解决现有固体压载抛载装置不能实现超深抛出，及不能适用不同工作深度且调试不便的问题。
33	一种高强度耐磨型深海电缆<sep>该高强度耐磨型深海电缆，采用夹紧结构，可以对深海电缆的接头处更好的防水，让海水隔离在深海电缆外，同时安装有固定圈和固定器，可以对接头处进行二次固定，减小深海电缆在海底因为洋流而脱落的几率。
33	一种获取海域天然气水合物层实时钻井扩径率的方法<sep>本发明根据监测到的在环空井口温度、压力条件下，单位时间内的气相流量得到标况井口温度、压力条件下的单位时间内的气相流量，进而得到单位时间内进入井筒的天然气水合物体积量，然后根据单位时间内进入井筒的天然气水合物体积量计算井筒中固相总体积，利用单位时间内井筒中固相总体积求出井筒扩径率，因此本发明可以监测到的在环空井口温度、压力条件下，单位时间内的气相流量实时获取海域天然气水合物层钻井扩径率。
33	一种海底管道定位方法<sep>本发明能够对海底管道的走向和位置进行检测，充分满足人们对海底管道的定位需求。
33	船用推进器电动转向系统的控制方法<sep>本发明提供的船用推进器电动转向系统的控制方法，使电动转向系统能够适用于不同船用推进器的系统，简化了用户设置，控制方便直观，具有良好的用户体验。
33	一种钻井泥浆导流装置<sep>有益效果在于：本实用新型通过设置电动推杆、支撑杆、电机和导流杆，可以有效疏导泥浆，确保泥浆流动稳定，避免堵塞，同时可以降低导流杆受到的工作阻力，降低能耗，提高工作效率，通过设置侧导流管，可以增加泥浆导流能力，避免泥浆堵塞溢出，提高装置环保性。
33	一种收回式柔性海水舵翼<sep>本发明其可适用于安静的滑翔工况，为水下航行体滑翔航行提供更大的滑翔力，利于水下航行体的滑翔，辅助水下航行体的航行，减少推进装置的航行功率，通过回收柔性海水翼可以降低直航阻力，满足高速航行的需求，提高水下航行体的隐蔽和续航能力。
33	面向保密需求的海洋大数据敏感度评估系统及防范方法<sep>用于实现来源于各类海洋业务系统、不同数据敏感度、价值密集度涉海数据的识别与保护。
33	一种水上施工平台<sep>涉及水上施工技术领域本发明通过采用预制平台板，便于对平台板进行安装，因而能够缩短工期。
33	一种设有水下控制房的浮动平台<sep>将所有零配件，如电机、泵等都引入在控制箱内，不需再拉很多电缆线到岸边，从而减小了电缆上电能的损耗，起到了节能的作用。
33	一种海底石油管道配重层结构及其施工方法<sep>由于受力筋、箍筋和套箍的加固作用，配重层的抗剪强度大大提高，整体结构强度也有一定程度的提高，避免了配重层断裂的问题。
