label_id	text
7	一种低温氨还原处理浓硝尾气的方法及装置<sep>本发明涉及一种低温氨还原处理浓硝酸尾气的方法及装置<sep>包括以下步骤：a、浓硝系统的废气通过一级、二级循环槽上的喷射器被抽入循环槽冷却吸收；b、循环槽的废气通过废气收集罐送入循环吸收塔，吸收塔内的镁尾水进行降温吸收。c、被吸收处理后的废气经过加热器升温后进入氨还原器，与氨在触媒上进行催化还原反应，彻底将废气中残余nox去除。d、由还原器出来的废气，其中nox含量完全符合环保要求，可以直接排放。本发明的优点在于：运用低温吸收液吸收尾气中氮氧化物，一方面通过吸收得到部分低浓度稀硝酸，另一方面通过吸收降低氨还原触媒的反应负荷，减少还原反应耗氨量，延长催化剂的使用周期<sep>另外，氨还原反应释放的热量还可以用来提升进还原器的废气温度，从而减少蒸汽的消耗量，降低使用成本
7	一种环氧氯丙烷改性feo磁性纳米材料及其制备和应用<sep>本发明公开了一种环氧氯丙烷改性feo磁性纳米材料及其制备和应用<sep>属于磁性功能材料的合成及水处理应用领域<sep>本发明以环氧氯丙烷为反应介质和改性剂，以亚铁盐为铁源，采用氧化沉淀法一步合成了环氧氯丙烷原位改性feo磁性纳米材料；该材料可应用于吸附脱除水中重金属铜离子，吸附铜离子后可进一步用于催化降解水体中的新兴有机污染物(如甲硝唑等)，且涉及的制备方法原料廉价易得，操作简单方便，能耗低，是一种具有广泛应用前景的综合水处理剂
7	一种超临界水颗粒物可视化测量实验装置和方法<sep>本发明提供了一种超临界水颗粒物可视化测量实验装置和方法<sep>该装置包括对管道中流体初步加热的预热段、对管道中流体二次加热的加热段、观测颗粒物的可视段、对管道内流体降温的冷却段、调节回路压力的稳压段和回路加水与颗粒物的进料段<sep>该实验装置可以通过可视化测量的方式研究管道内部流体的流动情况及流体中颗粒物杂质的沉积运动情况，观测直观，能够准确、有效测量相关数据，满足实验需求及工程应用
7	一种景观水体生态系统修复后观赏鱼养殖的方法<sep>本发明提供一种景观水体生态系统修复后观赏鱼养殖的方法<sep>基于营养盐平衡公式确定观赏鱼养殖水域面积、观赏鱼的种类与密度；水质净化的植物选取；观赏鱼养殖水域的幼鱼控制；观赏鱼养殖水域外围带水域的净水措施<sep>本发明是对生态修复后的景观水体养殖观赏鱼的客观需求，通过对生态修复后的景观水体进行养殖水域划分、鱼类密度控制、养殖污染物的削减等措施，实现了景观水体在不影响生态修复区域水质的情况下发展观赏鱼养殖的目的，本方法具有安全、成本低等特点
7	一种燃煤烟气去铅用的负载纳米零价铁的改性沸石的制备方法<sep>本发明公开了一种燃煤烟气去铅用的负载纳米零价铁的负载纳米零价铁的改性沸石的制备方法<sep>包括以下步骤：预处理，制备纳米铁，合成负载纳米零价铁的改性沸石，干燥洗涤<sep>本发明所制备的纳米零价铁不仅利用了零价铁的高还原性，还结合并提高了沸石的高吸附性质，以及壳聚糖对铅的螯合吸附作用，能够吸附燃煤烟气中单质pb和化合态pbcl的形式存在的pb，最大限度去除燃煤烟气中的重金属污染
7	一种粉尘智能测控治系统及其抑尘降尘方法<sep>本发明公开一种粉尘智能测控治系统及其抑尘降尘方法<sep>该系统包括感知模块、视觉模块、决策模块、控制模块与执行模块；感知模块用于获取待测控治区域的环境参数以及测量点的粉尘浓度值；执行模块用于对待测控治区域进行抑尘；控制模块用于控制执行模块中各抑尘装置的运行；视觉模块用于获取待测控治区域中各个位置的多视角图像；决策模块与视觉模块相连，用于将待测控治区域网格化，得到三维网格化视场；决策模块与感知模块相连，用于得到待测控治区域的粉尘浓度分布，进而得到执行模块的控制策略；决策模块与控制模块相连，使控制模块根据控制策略控制各抑尘装置运行<sep>实现粉尘的网格化监测、智能化控制，精准化治理，减少水、电资源消耗
7	一种畜禽粪污液体生态治理系统及方法<sep>本发明涉及一种畜禽养殖场粪污液体生态治理系统<sep>包括源头分离节水型栏舍、污染治理工厂、饲料工厂以及配套种植土地，污染治理工厂包括源头分离节水型栏舍、固体高温好氧发酵系统、液体中温厌氧发酵系统、加热及热量平衡系统和检测控制系统；调节池经输送泵连接液体中温厌氧发酵系统的进料口，液体中温厌氧发酵系统产生的沼气输送到加热及热量平衡系统，加热及热量平衡系统通过管道连接液体中温厌氧发酵系统的加热盘管<sep>本发明将污染治理工厂的产成品液体有机无机复混肥和液体微生物肥料，用于浇灌、滴灌配套种植土地上种植的作物，而牧草作为饲料工厂的饲料原料，为养殖降低了成本，提高了饲料的营养水平，促进养殖业与生态环境的和谐发展
7	智能生态水净化器<sep>本实用新型涉及一种水净化器<sep>特别涉及一种用于景观鱼池和养殖业的智能生态水净化器。一种智能生态水净化器，包括箱体，箱体内分为分离区和培菌区；分离区一侧设有进水口和维修排水口，分离区包括分离鼓、内清理器、喷淋装置、电机；分离鼓在箱体内沿其轴线旋转，内清理器设于分离鼓内，且内清理器的一端和分离鼓接触设置；喷淋装置设于分离鼓外的上方；电机连接分离鼓和内清理器；培菌区放置有培菌体；培菌区一侧设有出水口；紫外灯安装在所述培菌区<sep>本实用新型的智能生态水净化器，不仅能进行固液水污分离，还可以同时培养有益菌，使得水中的菌种均衡，更适合景观鱼池和养殖业
7	一种吸附回收高含硫量烟气中co的方法<sep>本发明公开了一种吸附回收高含硫量烟气中co2的方法<sep>其通过将电石渣溶解在水中先进行脱碳生成碳酸钙，并经沉降池的沉降作用使得碳酸钙和电石渣中的还原性物质进行分离<sep>最后将获得电石渣通入脱硫塔中进行脱硫实现了增浓烟气中二氧化碳浓度以满足使用吸附装置回收二氧化碳的需求
7	一种用于油水分离的反冲洗移动式过滤装置<sep>本发明公开了一种用于油水分离的反冲洗移动式过滤装置<sep>依次包括气动隔膜泵i、过滤器以及气动隔膜泵ii，气动隔膜泵i与过滤器通过污水输送管连通，气动隔膜泵ii与过滤器通过净水输送管连通，污水输送管端部设有带阀门的排污口，净水输送管端部设有带阀门的净水出水口；气动隔膜泵i一侧连通混合液进液口，气动隔膜泵ii一侧连通净水进液口，过滤器连有排油管，油水混合液通过气动隔膜泵i进入过滤器中，经过油水分离的净水通过净水出水口排出，经过油水分离的油通过排油管排出；反冲洗净水通过气动隔膜泵ii进入过滤器中，冲洗后的污水通过排污口排出<sep>本发明过滤装置不仅能够实现油水分离，而且还能够进行反冲洗实现装置自清洁
7	一种选择性催化还原脱硝装置<sep>本发明属于烟气脱硝技术领域<sep>具体的说是一种选择性催化还原脱硝装置，包括烟气注入管、氨气注入管、混合罐、喷氨装置和反应器；混合罐底部设有氨气注入管，氨气注入管的一侧设有烟气注入管，混合罐顶部一侧通过管道连接着反应器，反应器内设有催化剂；喷氨装置设置在混合罐内；喷氨装置包括固定管、传动轴、传动齿轮、连杆、滑环和弹性螺旋管<sep>本发明通过喷氨装置的弹性螺旋管喷出氨气时，可以通过电机控制连杆摆动，连杆由原先固定管的切线方向变成垂直于固定管，通过连杆将弹性螺旋管向外撑，改变弹性螺旋管的喷氨范围，弹性螺旋管喷出的氨气和烟气充分混合后进入反应器内进行还原反应。
7	一种防止地下水污染的可渗透反应墙<sep>本实用新型涉及可渗透反应墙技术领域<sep>具体涉及一种防止地下水污染的可渗透反应墙，它包括：墙体，墙体内部开有处理室，处理室顶部延伸出墙体，且墙体左右两侧均开有通口，通口均与处理室相通，左方通口内嵌入有呈左右排布的筛网一和筛网二，筛网一和筛网二内侧均焊接有若干块斜板，且筛网一和筛网二上的斜板整体排布呈阶梯状；本实用新型的有益效果在于：可减缓污水流动的速度，使得污水与石灰粉充分接触，使得污水杀菌效果更佳，筛网一和筛网二可对污水中的杂质进行过滤，污水经过多次净化，可避免地下水受污染，便可对滤网一、活性炭板一、生物降解板、活性炭板二和滤网二进行更换<sep>具有结构简单合理，使用方便的特点。
7	一种低浓度废水处理的设备及中水回用工艺<sep>本发明公开了一种低浓度废水处理的设备<sep>包括abp工艺中的水解酸化h池、abp工艺中的a/o池和纤维转盘滤池；低浓度废水处理的中水回用工艺，包括以下步骤，步骤一，污水水解酸化分解为可生化有机物及氨氮；步骤二，a池厌氧反硝化反应去除水中的硝态氮；步骤三，硝化反硝化及去除大量有机物及总氮；步骤四，过滤；步骤五，消毒；步骤六，中水回用；系统主要运用abp工艺中的h/a/o高效生物富集填料接触氧化工艺和出水除磷和ss的纤维转盘过滤，与传统工艺相比省去了二沉池、回流泵或回流泵房、加氯间等土建和设备<sep>运用高效生物富集填料和纤维转盘运营成本低、出水水质好并且稳定、占地面积小、运行费用低等显著特点
7	一种污水处理装置<sep>一种污水处理装置<sep>包括消毒箱，其特征在于：消毒箱内安装有搅拌组件，消毒箱的右侧上部安装有加药箱，消毒箱的左侧上部通过若干个固定杆固定安装有过滤箱，过滤箱包括箱体，箱体的下端安装有排污管，排污管的底部通过螺纹连接有下螺纹旋盖，下螺纹旋盖与排污管之间设有密封垫，箱体内右侧壁上设有过滤器，且箱体右侧对应过滤器的位置设有进水管，进水管的右端连通消毒箱，箱体上端通过螺纹连接有上螺纹旋盖，上螺纹旋盖的中部设有进水口<sep>本实用新型过滤箱可将污水中颗粒物提前过滤掉，且过滤器中的过滤板清理和更换方便，提高了污水处理效果
7	一种用于环境保护的烟气脱硫脱硝装置<sep>本实用新型涉及环境保护的技术领域<sep>特别是涉及一种用于环境保护的烟气脱硫脱硝装置，其减少现有装置功能单一性，增加对环境的保护，减少对身体造成的危害，降低使用局限性；包括除尘箱、第一进气口、第一出气口、集尘漏斗、除尘器、集尘器和除尘口，第一进气口输出端与除尘箱空腔连通，除尘器顶端固定安装在除尘箱空腔顶端，集尘器底端与除尘箱空腔底端连接，除尘口位于除尘箱空腔侧壁底部<sep>还包括净化箱、第二进气口、第二出气口、进水口、进水阀、出水口、出水阀和喷洒装置，第二进气口输出端与净化箱工作腔连通，并且第二进气口左端与第一出气口右端连通，第二出气口输入端与除尘箱工作腔连通，进水口与净化箱工作腔连通。
7	一种环保建筑保温材料的制备方法<sep>本发明涉及一种环保建筑保温材料的制备方法<sep>包括如下步骤：s1将建筑垃圾再生料、生石灰、木质纤维素与水搅拌，得到混合料a；s2向步骤s1获得的混合料a中加入改性硅藻土和普通硅酸盐水泥搅拌，得到混合料b；s3将步骤s2获得的混合料b浇筑于预制模型中，初凝后进行养护、干燥，即得环保建筑保温材料。本发明的保温材料具有良好的隔热和保温的效果，且在保证了隔热和保温的效果基础上，进一步提高了保温材料的甲醛吸附效果，能够有效减少室内污染<sep>本发明的制备工艺简单，原料来源广泛，产品成本低，不会出现墙体开裂、鼓泡等问题
7	一株矿化沉淀重金属铅离子及还原六价铬离子的细菌及其应用<sep>本发明提供一株矿化沉淀重金属铅离子及还原六价铬离子的细菌及其应用<sep>属于生物技术领域。该细菌分类命名为苏云金芽孢杆菌（bacillus thuringiensis）hm‑311株，保藏编号为：gdmcc no：60592。hm‑311株具有矿化沉淀重金属铅离子及还原六价铬离子的能力，可用于重金属污染治理。该菌株对铅离子的最高耐受浓度为2100 mg/l，对六价铬离子的最高耐受浓度为600 mg/l<sep>在含有1500mg/l铅离子的培养基中发酵培养两天，可去除培养基中97%的铅离子；在含有100 mg/lcr的培养基中发酵培养两天，可还原培养基中70%的六价铬离子离子
7	一种环保的建筑工程领域的污水净化装置<sep>本实用新型公开了一种环保的建筑工程领域的污水净化装置<sep>包括污水净化装置，所述污水净化装置的右侧连通有进水管，所述进水管的底部固定连接有传动箱，所述传动箱内壁的右侧固定连接有横板，所述传动箱内壁的后侧固定连接有电机<sep>本实用新型通过设置污水净化装置、进水管、传动箱、横板、电机、转盘、第一活动板、第一固定块、第二活动板、第二固定块、传动柱、传动板、滑动板、滑块、传动杆和推块配合使用，解决了现有市面上大多数的污水处理装置不设有防堵塞机构，污水中会存在大量的杂质，在通过进水管进入污水处理装置时可能会出现堵塞的现象，导致污水处理装置无法正常工作，从而降低了污水处理装置的实用性的问题
7	一种医药废水一体化处理工艺<sep>本发明属于污水处理技术领域<sep>具体涉及一种医药废水一体化处理工艺，包括向医药废水中先加入废水处理微生物，再加入废水处理剂<sep>本发明采用微生物和化学试剂结合对医药废水进行处理，工艺简单，废水中的cod、bod和nh‑n的去除率高，医药废水处理效果较好
7	一种具有分离和收集粉尘功能的大气监测装置<sep>本发明公开了一种具有分离和收集粉尘功能的大气监测装置<sep>包括抽气泵、第二收集室、摆动齿轮轴、静置室和收集刷，所述抽气泵与第一收集室相互连接，所述吸附带与从动轮相互连接，所述第二收集室与转移管相互连接，所述第一电机与第一电机轴相互连接，所述摆动齿轮轴与轴承的内侧和摆动齿轮相互连接，所述静置室的顶部固定有第二电机，所述收集刷固定在第二电机轴上<sep>该具有分离和收集粉尘功能的大气监测装置，采用3个具有分离和收集功能的结构，对空气中的粉尘进行针对性的处理，不仅提高了传统装置的分离和收集的效率，还保证了分离和收集粉尘的效果，能充分分离和收集大气中的粉尘，便于对大气环境的监测
7	一种含重金属废渣堆存场地的微生物修复方法<sep>本发明公开的是含重金属废渣堆存场地的微生物修复的方法<sep>通过利用含铅、锌、镉等重金属的危险废物作为培养介质，对硫酸盐还原菌进行驯化，提高硫酸盐还原菌在铅、锌、镉、砷等重金属的危险废物中生存能力和环境适应性<sep>添加各类营养物质使硫酸盐还原菌与枯草芽孢杆菌混合对土壤的修复得到强化，迅速去除污染物质，恢复土壤农作物种植能力。
7	一种写字楼污水综合处理装置<sep>本发明公开了一种写字楼污水综合处理装置<sep>包括圆形池体，所述圆形池体内部设有与圆形池体同圆心的圆形生物净化池，所述圆形生物净化池外壁与圆形池体内壁之间为密封式的环状处理带，所述环状处理带内设有填料，环状处理带内还设有将环状处理带依次分隔为一级厌氧池、一级曝气池、二级缺氧池和二级曝气池的四个隔板，所述一级厌氧池与一级曝气池、一级曝气池与二级缺氧池、二级缺氧池与二级曝气池、二级曝气池与圆形生物净化池之间均通过提升泵系统连通<sep>本发明结构新颖、占地面积小、高效综合处理污水且能够设置在居民区或商业办公区
7	一种废水排放细小颗粒处理设备<sep>本发明公开了一种废水排放细小颗粒处理设备<sep>包括过滤箱，所述过滤箱内设有竖槽，所述竖槽内设有阻挡机构，所述阻挡机构包括设置在所述竖槽右侧内壁中的收纳腔，所述过滤箱内设有连接管道，所述连接管道上侧与所述竖槽下侧连通，所述过滤箱内设有吸附机构，所述过滤箱内设有清理腔，所述清理腔内设有清理机构，所述清理机构包括转动设置在所述清理腔右侧内壁的连接轴，本装置能够对工业废水进行处理后排放，先对工业废水中的较大的物质进行隔离，并进行收集，不需要人工处理，在对废水中的细小颗粒进行吸附处理<sep>使得废水能够符合标准
7	一种多孔ti/iro-nbo-bio电极的制备方法及其应用<sep>本发明涉及水和废水处理领域<sep>特别涉及一种多孔ti/iro‑nbo‑bio电极的制备方法及其应用，制备方法包括以下步骤：(1)预处理：除去多孔钛基板表面的油脂、碱溶杂质及酸溶杂质；(2)制备多孔ti/iro‑nbo基板；(3)制备多孔ti/iro‑nbo‑bio电极。本发明的制备方法通过涂刷和沉积法制得能有效降低水中氯离子含量的多孔ti/iro‑nbo‑bio电极<sep>本发明的应用涉及的是电催化高级氧化法，该方法能在常温常压下，通过有催化活性的电极反应直接或间接氧化水中氯离子，其优势在于能有效降低水中氯离子含量，并且装置简单，操作方便
7	立式电磁静电污水净化装置<sep>本发明公开了一种利用电磁结合高频脉冲静电吸附进行污水净化的一种立式电磁静电污水净化装置<sep>由垂直安装的静电箱体1和水平安装的电磁筒体2两部分组成，电磁筒体2的出口连接于静电箱体1的进水口，其进口处安装进水阀8；静电箱体1上下两端呈锥状，上端为出水口3，下端设排污阀4，在排污阀4与箱体之间的倒锥体内部空腔为污泥仓5，在污泥仓5以上箱体下部侧面上设有连接电磁筒体2的进水口，在进水口以上的箱体内部由下往上依次交替排列阴极板7、阳极板6<sep>本发明具有污水处理效果好，处理量大，周期短，灭菌性能强且不存在化学污染的特点，可广泛应用于各类工业废水回用及农田喷灌水净化和生活水预处理
7	反洗滤膜组件及净水装置<sep>本实用新型提供了反洗滤膜组件及净水装置<sep>属于净水设备技术领域。该反洗滤膜组件安装架和反洗滤膜器。所述安装架包括竖板、环形板和固定件，所述竖板设置有两个，所述环形板固定在两个所述竖板的外表面，所述固定件包括盖板和锁扣，所述盖板设置有两个，所述盖板分别铰接在所述环形板的两侧，所述锁扣之间安装有锁扣，所述反洗滤膜器包括进水箱、出水箱和膜管道，所述膜管道安装在所述进水箱和所述出水箱之间，所述进水箱和所述出水箱插接与所述竖板之间，所述盖板位于所述出水箱的顶面<sep>本实用新型在对反洗滤膜器进行拆装时，可以直接将反洗滤膜器从竖板表面的滑槽中拉出即可，这样拆装可以更加的简单方便
7	一种多段式废水高级氧化处理装备及工艺<sep>本发明公开了一种多段式废水高级氧化处理装备及工艺<sep>属于环境保护的废水处理领域。装备包括依次连接的液液混合单元、预热单元、气液混合单元、并联式光催化反应器组和氧化塔；所述液液混合单元用于将待处理废水与双氧水混合；所述预热单元用于预热待处理废水与双氧水混合溶液；所述气液混合单元用于将常温的臭氧与经预热的待处理废水与双氧水混合溶液混合形成气液混合物；所述并联式光催化反应器组中设置若干光催化反应器<sep>该装备根据自由基反应的特点，合理设计并联式光催化反应器组及氧化塔，提高臭氧及双氧水的利用率，降低废水的处理成本
7	微电解-加压生物过滤处理工业废水生化尾水的耦合工艺<sep>本发明公开了一种微电解‑加压生物过滤处理工业废水生化尾水的耦合工艺<sep>该工艺包括如下步骤：(1)微电解反应器预处理：将工业废水生化尾水的ph调整到3.5～5.5后送入充填有微电解填料的微电解反应器内进行预处理；(2)加压生物过滤处理：采用加压生物过滤器对步骤(1)中经微电解反应器预处理后的出水进行处理；其中，加压生物过滤器内填微生物磁性填料。本发明中通过改进微电解填料的成分、结构和形状，利用微电解的降解作用、加压生物铁及磁场对微生物的活化作用、微电解与加压生物过滤器的协同作用强化污染物的去除效果<sep>本发明具有占地面积少、运行成本低、出水水质好、污泥量少等优点，适用于各种工业废水生化尾水的深度处理
7	一种持久性有机物污染土壤的氧化电位水淋洗修复方法<sep>本发明涉及一种持久性有机物污染土壤的氧化电位水淋洗修复方法<sep>本发明将氧化电位水生成器的两极出水分别加入相应的药剂，配制成三种淋洗剂，阴极的碱性水加入十二烷基硫酸钠和十二玩基硫酸钠混合溶液配制成淋洗液a，阳极的酸性水一部分加入fecl配制成淋洗液b，一部分加入ho配制成淋洗液c，按照a液淋洗‑水洗‑b液淋洗‑c液淋洗‑水洗的顺序对土壤进行淋洗<sep>本发明工艺比较简单，淋洗后的废液正好可以完全中和，处理较为容易，运行安全可靠；且本发明操作维护容易，材料成本与运行能耗较低，适用于有机物污染浓度不是很高的工业污染场地土壤的修复，对多种有机物包括持久性有机物污染的土壤也有较好的修复效果，是一种简洁有效的有机污染土壤修复技术
7	一种金属喷涂挂具的环保脱漆方法<sep>本发明涉及一种金属喷涂挂具的环保脱漆方法<sep>采用脱漆剂对待清理的喷涂挂具进行浸泡2～6h，然后用脱漆剂冲洗挂具，使漆皮脱落，最后采用超声波清洗的方法，用超声波清洗剂清洗10～30min，脱除挂具表面的残漆，得到表面清洁光亮的挂具。本发明采用的脱漆剂和超声清洗剂属于环保、低毒的水基型清洗剂，不溶解漆皮，可循环使用，具有环保的优势<sep>本发明的生产方法在室温下即可完成脱漆过程，能耗低，处理效果显著，对挂具无损害，且工艺流程简单，设备投资少，成本低，易于大规模生产应用
7	一种自净取水装置的工作方法<sep>本发明所提供的自净取水装置的工作方法<sep>自净取水装置包括取水管，所述取水管具有吸水端和放水端，所述取水管的吸水端设置有过滤网箱；所述取水管在放水端上向下连接有心型输送装置，其中所述心型输送装置的心轴向外横向连接有螺旋输送管，且所述心型输送装置的心轴与所述螺旋输送管的绞龙轴同轴设置；所述心型输送装置向下接装有一u型管，所述u型管上的两个直管部分别与心型输送装置及螺旋输送管相连通；其中所述u型管设置为网孔结构，所述u型管上网孔的截面积之和大于所述取水管上放水端的管径截面面积<sep>本发明结构简单，使用方便，实现该河道取水装置在取水时对所取的水中含有的杂质无动力清理的作用
7	一种具有除烟功能的建筑消防工程设备<sep>本实用新型提供了一种具有除烟功能的建筑消防工程设备<sep>包括：除尘器本体、板状收尘区、收尘板；所述除尘器本体内部的中间位置设有板状收尘区，且板状收尘区的内部设有收尘板与高压极板；所述收尘板的顶端螺栓固定在板状收尘区的顶端，且高压极板的底端螺栓固定在板状收尘区的底端；所述收尘板的正下方设置有集尘槽，且集尘槽开设在板状收尘区的底端上<sep>本实用新型具有结构合理，板状收尘区的底端不易积尘，方便集尘槽收集下落的灰尘，提高集尘的效果，实用性较强，便于散热的优点，从而有效的解决了本实用新型提出的问题和不足。
