label_id	text
7	一种用于地下式污水处理厂的污泥转运系统及方法<sep>本发明提供一种用于地下式污水处理厂的污泥转运系统<sep>包括：地面轨道：铺设在地下式污水处理厂中地下楼层的地面上，地面轨道具有主轨道、与主轨道相连的接料位轨道、以及与主轨道相连的装卸位轨道；污泥箱：用于盛放污泥；接料移动平车：用于装载污泥箱，接料移动平车停留在接料位轨道上、并能沿主轨道移动至装卸位轨道处；污泥运输车：能够到达地下式污水处理厂的负一层或地面层；移送单元：能够将装卸位轨道处的污泥箱移送至污泥运输车上<sep>本申请可靠地实现了处理后的污泥在地下空间的转运和最终外运，且符合污泥运输车只设计到达地下式污水处理厂的负一层或地面层的要求，由此不会增加地下式污水处理厂的占地面积和土建成本
7	一种用于农业污水过滤治理设备<sep>本实用新型为一种用于农业污水过滤治理设备<sep>包括处理箱，所述处理箱的顶部固定安装有对称设置的两个支撑杆，且两个支撑杆相互靠近的一侧固定安装有同一个固定杆，所述固定杆的外侧套设有滑动连接的滑动环，所述滑动环的顶部固定连接有推动组件，所述滑动环的底部分别固定安装有第一固定板和第二固定板，且第一固定板和第二固定板上转动连接有同一个转动杆，所述第一固定板和第二固定板上设置有相配合的用于驱动转动杆转动的转动组件，所述转动杆的底部固定安装有连接杆<sep>本技术方案通过利用带动污水翻滚增大氧气含量以及对污水中的藻类物质进行过滤的双重操作下，有效的降低了污水的富养化。
7	一种在微通道中调控不规则气泡形状的方法<sep>本发明公开了一种在微通道中调控不规则气泡形状的方法<sep>将设定量的十六烷基三甲基溴化铵、二氧化硅纳米颗粒和水的复配体系与气体通入微通道中；微通道为十字型，由两个液相通道、一个气相通道和一个混合通道相互连通构成，两个液相通道与混合通道相连通，混合通道与调控管相连通；液相入口、气相入口、液相通道、气相通道和混合通道的内径相同，均小于调控管内径<sep>将复配体系作为连续相注入微通道液相入口，将气体作为分散相注入微通道气相入口，在调控管中得到连续的不规则形状的气泡，本发明具有高效、装置简单、操作方便等优点，有利于促进非球形气泡在各个方面更深入研究，为非球形气泡在其他方面的应用提供了可能性。
7	一种利用脱水污泥与生物炭复配钝化剂修复砷污染农田土壤的方法<sep>本发明公开了一种利用脱水污泥与生物炭复配钝化剂修复砷污染农田土壤的方法<sep>该方法包括以下步骤：将脱水污泥与生物炭复配钝化剂和砷污染农田土壤混合进行钝化，完成对砷污染农田土壤的修复，其中脱水污泥与生物炭复配钝化剂是由干化污泥和生物炭混合后制备得到<sep>本发明方法，利用干化污泥和生物炭的复配进行钝化修复，能够实现砷污染修复和土壤质量改善的双赢，且不会影响农时耕作，同时对工艺控制要求不严，可操作性强，具有工艺简单、原料易得、成本低廉、修复效果好、易于推广等优点，有着较高的实用价值和较好的应用前景
7	电芬顿催化氧化去除气态污染物的方法及其装置<sep>本发明公开一种电芬顿催化氧化去除气态污染物的方法及其装置。其中<sep>所述电芬顿催化氧化去除气态污染物的装置包括电化学反应器，所述电化学反应器包括电源、阳极、阴极、质子交换膜、阳极气流通道及阴极气流通道，所述质子交换膜设于所述阳极和所述阴极之间，所述阳极设于所述阳极气流通道内，所述阴极设于所述阴极气流通道内，所述阴极为负载过渡金属催化剂的多孔导电吸附材料电极。阴极电化学还原氧气产生过氧化氢，负载在阴极表面的芬顿催化剂催化分解过氧化氢产生羟基自由基活性物种，羟基自由基进而氧化去除气态有机污染物，通过阳极电解水或水蒸气产生氧气<sep>本发明的技术方案能够有效地去除气态污染物，应用范围广泛
7	一种环己酮氨肟化法生产己内酰胺废液的处理方法<sep>本发明提出了一种环己酮氨肟化法生产己内酰胺废液的处理方法<sep>其目的在于，取缔焚烧法，彻底解决己内酰胺生产中离交废液和苯萃废液对环境产生的污染，回收利用废液中的水资源，并资源化得到工业硫化钠产品。本发明以简单的工艺流程解决了环己酮氨肟化法生产己内酰胺废液对环境的污染，同时得到工业硫化钠，具有较好的经济效益<sep>本发明处理过程零排放，工艺清洁，易于实施，具有显著的社会效益和环境效益
7	一种重金属污染的土壤过滤清理设备<sep>本发明公开了一种重金属污染的土壤过滤清理设备<sep>包括机体，机体10中设有传动腔65，传动腔65下侧设有抓取腔66，抓取腔66中设有抓取土壤的抓取装置68，抓取装置68包括固定安装在传动腔65上侧壁的固定块60，此设备可方便快捷地对土壤进行清理过滤处理<sep>减少土壤中的有害成分
7	一种化工炼焦尾气处理工艺<sep>本发明涉及烟气处理技术领域<sep>具体的说是一种化工炼焦尾气处理工艺，该工艺包括以下步骤：s1，将尾气通入袋式除尘器中进行除尘；s2，将s1中排出的尾气通入喷淋系统中进行脱硝处理；s3，将s2中排出的尾气通入净化塔中进行净化，然后由净化塔排至空气中<sep>本工艺采用的喷淋系统可使得反应液能够呈网状喷出，使得反应液能够覆盖到筒体内的各个角落，有效的增大的反应液的覆盖面积；流通管采用s形结构，可减缓反应液的流通速度，并且由于流通管的底部为封闭结构，反应液只可从侧面的出液管倾斜向上喷出，从而提高了反应液的运动行程，减缓反应液的流通速度，使得反应液的在空中的停留时间更长，与烟气的接触时间更久，反应液的利用更为彻底
7	一种一体化生物流化床处理及过滤消毒回用水设备<sep>本实用新型公开了一种一体化生物流化床处理及过滤消毒回用水设备<sep>箱体内设有隔板将箱体依次分隔为厌氧区、兼氧区、好氧区、沉淀区、澄清区，澄清区后设置有设备区，澄清区内设有清水区和若干过滤区；所述沉淀区内设有中心导流筒，好氧区出水口通过一号管道和中心导流筒连通，一号管道上设有加药口，加药装置通过二号管道和加药口连通，中心导流筒内设有若干螺旋叶片，沉淀区底部设有截面为梯形的集泥槽，集泥槽底部设有排泥管，中心导流筒底端位于集泥槽上方并近集泥槽处，中心导流筒底端还设有伞形反射板<sep>本实用新型中沉淀区沉淀效果好，过滤区的过滤压力小，本设备一体化形成，占地面积小
7	co连续旋转式吸附系统和方法<sep>本发明涉及co吸附领域<sep>公开了co连续旋转式吸附系统和方法。系统包括：转轴(3)、上底板(20)、下顶板(21)、设置在所述上底板的上面的上转筒(22)和设置在所述下顶板的下面的下转筒(23)；转轴串联上底板、下顶板、上转筒和下转筒并带动上转筒和下转筒转动，上底板和下顶板设置为固定；上底板和下顶板分别设置各种介质的进口和出口；在所述上转筒和下转筒中分别设置多层环形的挡板(5)，挡板沿转轴的轴向延伸，在上转筒和下转筒中分隔出多个环绕转轴的吸附剂装填区；上转筒和下转筒中还各自沿径向设置多块密封板(18)，将上转筒和下转筒的内部空间划分出多个相互隔离的区域<sep>能够降低co吸附能耗且提高吸附得到的co纯度
7	一种海上油田液体复合脱硫剂的制备方法<sep>本发明公开了一种油田用液体复合脱硫剂<sep>由以下质量百分含量的组分组成：2，2‑双噁唑烷类化合物20％～35％；三嗪类5％～10％；哌嗪类2％～5％；机碱1.0％～1.5％；表面活性剂0.5％～1％；消泡剂0.1％；溶剂：环丁砜、二甲基亚砜中一种或两种20％～25％；其余为水<sep>本发明油田用液体复合脱硫剂通过各组分的协同作用具有选择性吸收高、环保高效，硫容大且不产生沉淀的优势，可广泛用于海上、陆上油田、煤气田、天然气等化工领域
7	一种快速去除苯并（a）芘（bap）和砷复合污染废水的方法<sep>一种快速去除苯并（a）芘（bap）和砷复合污染废水的方法<sep>涉及一种去除复合污染废水的方法，本发明bap和as预氧化和微生物降解两步法的协同使用。预氧化所选用的高铁酸钾能同时氧化两种污染物、降低复合污染的毒性而其本身不带来二次污染的一种强氧化剂，微生物降解所选用的微生物是既能耐受高毒性复合污染废水，同时又能高效吸附与降解复合污染物的镰刀菌。本发明首次运用2步法（预氧化和生物处理）有效解决了高毒性有机物与重金属复合污染难于生化的瓶颈。经处理后的复合污染废水，bap 10d的去除率为88.98%，总as（as和as）的去除率为96.15%<sep>该方法技术通用性好，广泛适用于毒性强难于生化的有机物与重金属复合污染废水的治理
7	一种改性曝气生物滤池复合填料及其制备方法<sep>本发明公开了一种改性曝气生物滤池复合填料<sep>成分及其重量份为：改性贻贝壳20~30份、改性椰壳生物炭10~20份和珍珠岩50~70份。有益效果为：本发明复合填料集填料截留和生物吸附于一身，具有微生物量大、活性高和传质速率快，挂膜时间短，充分发挥了baf的物理拦截、化学氧化和生物代谢的共同作用。具有较大的中孔结构、巨大的表面积和复杂而发达的孔隙结构，有很强的物理吸附和化学吸附功能<sep>填料与填料间具有较大的空隙可以保证气、水的均匀分布，易于冲洗和反冲洗；填料有很好的颗粒性，同时有一定的强度，具有耐磨性和耐久性
7	一种促进菌丝球快速形成的方法<sep>本发明公开了一种促进菌丝球快速形成的方法<sep>属于环境微生物领域。本发明通过分阶段控制菌丝球培养过程中的转速条件，比目前传统方法控制恒定转速培养菌丝球，其不仅具有操作简单、成球率高、重复利用率高等优点，还有效地缩短菌丝球的成球时间，提高菌丝球的产量，增强菌丝球的吸附能力<sep>本发明不仅为talaromyces flavus s1菌丝球的扩大培养提供依据，还为其应用于污水处理提供了方法
7	袋式除尘收集装置<sep>本发明提供一种袋式除尘收集装置<sep>它包括有出尘通道，所述出尘通道的内部设计有水平的出尘腔，所述出尘通道内前侧设计有弹性的过滤网，所述出尘腔的后部装配有可以前后滑动的风箱板，所述除尘通道的上部装配有进尘通道，所述进尘通道内设计有与所述除尘腔垂直相交的进尘腔，所述进尘腔与所述除尘腔相交位置位于所述过滤网与所述风箱板之间；所述风箱板的后部装配有推动推杆连同风箱板前后运动的推板块，所述进尘通道上设计有控制通断的控制阀，所述出尘通道的下部装配有储尘箱<sep>该装置使用时通过所述风箱板以及弹性过滤网的设计，使得粘附在过滤网上的灰尘可以自动被抖落，这样可以保持过滤网的清洁
7	一种污水处理剂及其制备方法<sep>本发明公开了一种污水处理剂的制备方法<sep>包括步骤：1)聚合硅酸铝铁表面修饰；2)氨基淀粉改性表面修饰聚合硅酸铝铁；3)二甲基‑乙烯基磷酸酯交换；4)聚合；5)离子交换。本发明还公开了采用所述污水处理剂的制备方法制备得到的污水处理剂<sep>该污水处理剂污水处理效果更显著，使用量更小，反应速度快，反应过程中无有毒有害气体产生，使用更加安全环保；反应前后对人体安全，对设备无腐蚀；使用方法简便，无需增加设备和附加材料
7	一种天神芽孢杆菌、其菌剂及在重金属修复领域的应用<sep>本发明属于重金属土壤修复技术领域<sep>具体涉及一种天神芽孢杆菌、其菌剂及在重金属修复领域的应用。本发明从重金属污染的土壤中，筛选得到一株天神芽孢杆菌(bacillus tianshenii)p46，所述菌株为解磷菌，应用于作物培养对植物生长无毒，并且具有一定的促进作用；该菌株对金属镉、铅具有良好的降解作用，并且对重金属离子修复的同时，不影响土壤的稳定性<sep>目前关于天神芽孢杆菌的相关报道较少，本发明提供了一株具有良好解磷、重金属修复效果的菌株，应用于重金属土壤修复，提高作物生长情况具有良好的应用前景
7	一种存量垃圾原位资源化处理方法和系统<sep>本发明公开了一种存量垃圾原位资源化处理方法和系统<sep>系统包括：将垃圾暂存区内的垃圾运送至板式给料机；板式给料机依次连接第一破碎装置和滚筒筛；滚筒筛的第一出口连接风选装置；风选装置的第一出口连接第一破碎装置，第二出口依次连接第二磁选装置、液体式滚筒筛和脱水装置；脱水装置的出口连接好氧生物干化反应器的第一入口；滚筒筛的第二出口连接第一磁选装置和弛张筛；其中，弛张筛的出口连接好氧生物干化反应器的第二入口；好氧生物干化反应器的出口连接有机肥料压缩打包装置；好氧生物干化反应器还连接有渗滤液处理系统和除臭系统<sep>且垃圾暂存区还与渗滤液处理系统相连接，既能够杜绝二次污染的产生，又可实现存量垃圾高度资源化利用。
7	畜禽养殖废水处理装置<sep>本实用新型公开了一种畜禽养殖废水处理装置<sep>该装置包括依次设置的厌氧区、好氧区和臭氧区，其中厌氧区入水口连接进水管，厌氧区上部连接至好氧区，好氧区上部通过管道连接至臭氧区，臭氧区出水口连接至出水管；好氧区内设有曝气装置和膜组件，臭氧区设有臭氧输入通道<sep>本实用新型提供的装置在厌氧好氧膜处理后增设臭氧氧化处理部分，且经臭氧处理后的尾水可回流至厌氧区，该工艺可通过厌氧氨氧化和短程硝化反硝化脱氮，通过臭氧进一步降解废水中的有机污染物，同时提高废水脱色和消毒效果，出水水质满足畜禽行业排放标准或可中水回用实现零排放
7	一种多级流态床式生物除臭装置及工艺方法<sep>本发明公开了一种多级流态床式生物除臭装置及工艺方法<sep>包括床体，床体内设有隔离器，床体顶部设有出料口，出料口上设有气固分离滤网，床体的底部分别设有进风口和固体残渣出口，进风口上依次设有加湿器和风机，床体侧壁上设有进料口，出料口和进风口处均设有气体检测器；隔离器内由下至上设有多个筛板，多个筛板的筛孔由上至下逐渐变大，隔离器与床体侧壁之间留有循环间隙，隔离器的下方与进风口之间设有粗筛板，隔离器与粗筛板之间设有循环通道<sep>大大提高了除臭效果；提高了滤料的利用率；利用风机富余能量使滤料悬浮，提高了能量的利用率；可保证反应环境稳定，占地面积更小，同时解决了微生物膜堵塞填料问题
7	一种电站锅炉scr脱硝精细化喷氨控制方法<sep>本发明属于烟气脱硝相关技术领域<sep>并具体公开了一种电站锅炉scr脱硝精细化喷氨控制方法，该方法包括将长短时神经记忆网络模型和智能优化算法相结合实现主阀门开度的控制，并根据多个nox检测点的检测情况对分阀门开度进行控制<sep>本发明通过预测下一时刻出口nox浓度，并获得最优喷氨策略，从而弥补电站锅炉scr脱硝喷氨系统中pid控制器造成的大滞后缺陷，使得喷氨量控制更加及时准确，提高电厂运行的环保性和安全性；此外，本发明提出分区检测、分区喷氨的方法，使得scr出口nox浓度更加均匀，测量值更具有代表性
7	一种处理水中硝态氮的生物滤料<sep>本发明提供了一种新型的生物滤料<sep>用于处理生活及工业废水中的硝态氮污染物。该生物滤料利用硫自养反硝化和异养反硝化两种原理对水中的硝态氮进行反硝化去除。生物滤料中含有提供硫自养反硝化细菌所用的电子供体硫单质、供异养反硝化细菌生长所用的缓释碳源、改善生物表面电荷属性的金属氧化物以及碳酸盐<sep>本发明的生物滤料表面能生长大量的自养及异养两类反硝化细菌，在高效处理水中的硝态氮的同时，剩余污泥产量小，无需调控反应过程的酸碱度，并且使用周期较长
7	一种具有保护结构的扎扣袋底除尘滤袋<sep>本实用新型公开了一种具有保护结构的扎扣袋底除尘滤袋<sep>包含袋口、袋身、扣扎袋底、保护结构。袋底的滤料部分或全部为筒状袋身靠底端部的滤料，或连接于筒状袋身延伸的筒状滤料，袋底的结构形状为紧紧相聚的一撮，在该撮滤料的外部设有锁紧类部件；滤袋底部内侧增加至少一层保护材料和/或滤袋底部设置有填充物<sep>通过所设置的保护结构，有效的解决了这种新式滤袋袋底存在的磨损破坏及疲劳破坏的问题，延长了滤袋的使用寿命
7	一种高能效的活性氧离子除臭集成装置<sep>本实用新型提供一种高能效的活性氧离子除臭集成装置<sep>所述高能效的活性氧离子除臭集成装置包括箱体；排气室，所述排气室开设在所述箱体上；臭气室，所述臭气室开设在所述箱体上；新风室，所述新风室开设在所述箱体上；混合室，所述混合室开设在所述箱体上；臭气进风管，所述臭气进风管开设在所述箱体上，所述臭气进风管与所述臭气室相连通；新风过滤器，所述新风过滤器设置在所述新风室内；离子发生器，所述离子发生器固定安装在所述新风室的内壁上<sep>本实用新型提供的高能效的活性氧离子除臭集成装置具有简洁美观、占地面积小、耗能较低、能使废气与氧离子充分接触的优点
7	扬尘在线监测预警及应急处理装置<sep>本实用新型属于环境监测及应急处理技术领域<sep>具体涉及一种扬尘在线监测预警及应急处理装置。本装置包括：监测机构、预警应急处理机构及分别与监测机构和预警应急处理机构电性连接的控制器；监测机构适于对现场扬尘进行在线监测，并发出信号给控制器；控制器适于接收监测机构发出的信号，并控制预警应急处理机构进行报警及喷淋<sep>本扬尘在线监测预警及应急处理装置，装置中同时设置有监测机构及预警应急处理机构，监测机构在线监测现场扬尘并向控制器发出信号，控制器控制预警应急处理机构进行报警及喷淋，提醒相关人员注意防护并及时采取措施进行消尘，喷淋降低现场扬尘浓度，减轻扬尘对人体的伤害，避免发生安全事故，保障人身安全
7	利用厌氧颗粒污泥处理高浓度废水制备能源气体的系统<sep>本实用新型提供一种利用厌氧颗粒污泥处理高浓度废水制备能源气体的系统。一种利用厌氧颗粒污泥处理高浓度废水制备能源气体的系统<sep>包括依次连接的废水储水装置、发酵产气装置和分离集气组件，废水储水装置连接发酵产气装置的进水端，发酵产气装置包括发酵产气装置本体和回流泵，发酵产气装置本体的出气端设有三相分离器，回流泵连通发酵产气装置本体两端，分离集气组件包括依次连接的脱氨装置、脱酸装置、脱水装置和集气装置<sep>本实用新型厌氧处理占地面积小，产气效率高，所得能源气体纯度高，可直接利用，整套系统能够不间断的进行能源气体的连续制备
7	一种黑臭水体净化方法<sep>本发明提供了一种黑臭水体净化方法<sep>该黑臭水体净化方法包括：分批次向水体底部投加碱金属过氧化物缓释颗粒；向水体底部投加生物酶制剂颗粒；向水体表面投洒硫化细菌复合制剂颗粒；向水体表面分批次均匀分散投加碱金属过氧化物速溶颗粒；向水体内部投放高效降解菌液，同时在水体表面或浅层安装曝气增氧设备，用于使水体持续复氧；向水体中投放鱼类和/或在水体近岸处种植水生植物进行生物处理，从而实现黑臭水体的净化和良好的生态循环<sep>本发明的黑臭水体净化方法工程措施少、施工工程量少、对环境二次污染小，通过生态系统的重新构建，使得水体自净能力的恢复，逐渐消除黑臭水体的异味和色度，从感官上恢复水体的观赏娱乐价值
7	一种低次生环境风险的土壤重金属钝化剂的制备和使用方法<sep>本发明提供一种低次生环境风险的土壤重金属钝化剂的制备和使用方法：将腐殖化秸秆、粉碎秸秆、粉煤灰以及粘土矿物混合后造粒<sep>得均匀的颗粒钝化剂；将颗粒钝化剂喷淋海藻酸钠水溶液、聚乙烯醇水溶液，完成包埋过程，然后冷冻干燥，得到缓释型颗粒钝化剂。在污染原状土中施加所述缓释型颗粒钝化剂，施加比例为5～20％，钝化周期为30～120天<sep>本发明所制备的低次生环境风险的土壤重金属钝化剂抑制了钝化剂本身对土壤造成的二次污染，促进了钝化剂对重金属的形态变化、吸附、迁移等行为，保障了土壤重金属去除过程的稳定性，降低了钝化剂修复重金属土壤的环境风险，缓释后土壤性质影响很小，污染物释放有所降低，达到了生态环保型钝化的目标
7	一种电厂输煤净化站含煤废水处理装置<sep>本实用新型涉及一种电厂输煤净化站含煤废水处理装置<sep>包括初沉池，所述初沉池的上端连接含煤废水的管道，侧壁上端通过管道连接第一污水输送泵，所述第一污水输送泵连接在一公路集水池的下部，所述初沉池的上端通过管道连接第二污水输送泵的进口，所述第二污水输送泵的出口通过管道连接在第一预沉池的上端，所述第一预沉池的底部设有第一净水池，第一预沉池的侧壁下部连接有第一排泥管，所述第一排泥管伸入煤泥干化池，所述煤泥干化池的上部通过管道连至排水管网<sep>本实用新型的电厂输煤净化站含煤废水处理装置，简化含煤废水处理工艺，在保障出水达到达标排放要求的同时，避免煤泥在处理装置中频繁发生堵塞的现象
7	碳纳米管吸附构件、制备方法及应用<sep>本发明公开了一种碳纳米管吸附构件、制备方法及应用<sep>该碳纳米管吸附构件的碳纳米管生长在金属丝网带的一侧，该侧由金属丝网带没有碳的一侧进行间隔排列形成带状结构；带状结构上下外层为过滤布包装，整体呈现带状，能够卷曲盘绕；盘绕成圆柱结构时，高径为比为1:1‑1:5；碳纳米管吸附构件应用的碳纳米管吸附装置，吸附装置内全部装填碳纳米管吸附构件，构件床层空隙率为70‑95％，装置内没有气体或液体分配装置；本发明还公开了碳纳米管吸附构件的制备方法及碳纳米管吸附装置的安装方法；碳纳米管吸附装置不用再设置独立的气体或液体分配装置，可用于吸附废水或气体中的有机物，并可快速脱附<sep>具有结构牢固、使用寿命长，通量大，制备成本低、处理能耗低等优点。
7	一种脱氮除磷微生物燃料电池<sep>本发明公开了一种脱氮除磷微生物燃料电池<sep>包括砾石层，砾石层的底部设有进水口，上部设有出水口；砾石层上种植有能够除磷的湿地植物；砾石层中设有硝化阳极、硝化阴极、反硝化阳极和反硝化阴极，硝化阳极和反硝化阳极上附着有能够分解有机物的微生物，硝化阴极上附着有能够硝化氨氮的微生物，反硝化阴极上附着有能够反硝化硝酸盐和亚硝酸盐的微生物；硝化阳极通过第一外部电路将硝化反应产生的电子传输至硝化阴极，反硝化阳极通过第二外部电路将反硝化反应产生的电子传输至反硝化阴极<sep>本发明工艺简单，处理效果好，同时能耗与运行费用较低，使用寿命较长，维修方便
