label_id	text
7	一种一段式半亚硝化-厌氧氨氧化-反硝化耦合工艺处理城镇生活污水的方法<sep>本发明公开了一段式半亚硝化‑厌氧氨氧化‑反硝化耦合工艺处理城镇生活污水的方法。在氧化沟内加入准备好的半亚硝化污泥和厌氧氨氧化污泥<sep>同时在氧化沟内的非曝气区域悬挂有厌氧氨氧化生物膜的辫带式填料，氧化沟采用连续流方式运行，廊道内设置底部推流推动水流，采用高负荷、低溶解氧浓度，同时分时段变气量曝气控制曝气强度的综合控制策略运行驯化。运行初期采用人工配水方式，氧化沟稳定运行且总氮去除效率达45%后，运行70天后总氮去除率保持在80%以上<sep>本发明方法，解决了现有处理城镇生活污水总氮去除效果低，出水水质难以稳定达到城镇污水处理厂污染物排放标准一级a标准且运行费用高的问题
7	一种cu-edta重金属络合废水的处理方法<sep>本申请公开一种cu‑edta重金属络合废水的处理方法<sep>首先，利用水热法合成一种钛酸钡/石墨烯的压电复合材料；通过超声来提供压力，利用压电材料的压电化学效应，进行重金属络合的破络及破络后有机物的降解；破络降解后的溶液，游离的cu或弱络合态的cu能被石墨烯进一步的吸附进行回收，从而高效去除cu‑edta重金属络合废水<sep>本申请将压电效应与化学过程耦合，同时再耦合吸附和电脱附的作用，打破了传统重金属废水处理方法成本高、过程繁琐、二次污染严重、需二次回收处理的现状，实现了edta的有效去除和cu的高效回收，解决了传统技术的不足，是一项绿色高效的处理技术，为开发新的水处理技术提供了新的发展方向。
7	一种全自动隔油分解处理设备<sep>本实用新型公开了一种全自动隔油分解处理设备<sep>涉及餐厨垃圾处理设备技术领域。本实用新型包括底座，底座上设有隔油槽，隔油槽内设有隔板，隔板与后板之间形成浮油槽，在浮油槽内设有捞油组件和刮油组件，在隔油槽的一侧设有分解槽，在分解槽一侧设有用于向分解槽供给碱性分解液的储液桶<sep>本实用新型可实现泔水自动隔油分解操作，效率高、油水分离效果好、设备体积小、适用性广泛
7	一种新型生物滤料及其制备方法<sep>本发明公开了一种新型生物滤料及其制备方法<sep>其特征在于它以水、钢渣、干猪粪、铝盐类化学污泥、无机污泥为主要原料，经混合，干燥与高温煅烧而成，所述的原料及各组分的质量配比为：水3～10％，钢渣8‑12％，干猪粪6‑13％，铝盐类化学污泥20‑40％，无机污泥30‑50％，本发明实现了多种废物及危废的多角度有效资源化利用，有利于环境保护和生态文明建设<sep>生物滤料生产能耗能实现自给自足
7	沸石-多孔碳-光触媒三元复合材料、其制备方法及废水处理装置<sep>本发明提供了一种沸石‑多孔碳‑光触媒三元复合材料及其制备方法<sep>该三元复合材料包括：载体，包括复合的沸石和多孔碳；光触媒，负载在载体的内表面和外表面上。本申请的沸石‑多孔碳‑光触媒三元复合材料的载体中同时包含沸石和多孔碳，复合后沸石作为载体提高了三元复合材料的废水处理效果<sep>上述三元复合材料的载体为多孔载体从而为光触媒催化剂供吸附环境，沸石或多孔炭起到吸附、过滤的作用，将重金属吸附或者离子交换，进而将有机物拦截固定，同时微生物也被吸附在沸石或者多孔碳的表面，进而对截留的有机物进行降解分解；光触媒纳米颗粒造成一个强氧化环境，将水中的有机物全都分解掉
7	一种土壤污染修复组合物及其应用<sep>本发明提供了一种土壤污染修复组合物及其应用<sep>所述组合物包括如下成分：过碳酸钠、硫酸亚铁、柠檬酸和过硫酸钠，其中硫酸亚铁和柠檬酸摩尔比为1：1，以过碳酸钠和过硫酸钠为氧化剂，柠檬酸和氧化剂的摩尔比为(1‑5)：10，过碳酸钠与过硫酸钠的摩尔比为1：(5‑10)；其中至少过碳酸钠、和过硫酸钠在使用前是分别各自独立包装的<sep>本发明的组合物能够更加有效的对被污染的土壤进行修复
7	一种净水器的滤芯预警方法及系统<sep>本发明所述的一种净水器的滤芯预警方法及系统<sep>包括如下步骤：采集水质参数，微控制器接收所述水质参数，依据水质参数统计、监控净水器滤芯状态；子服务器接收微控制器监测到的净水器滤芯状态，并转发给远端服务器；远端服务器接收每一净水器的水质参数、成品水改善值、过滤累计时间及滤水总量，依据所接收的数据获取水质硬度参数，从预设的滤芯寿命算法表中查找所述水质硬度参数匹配的滤芯寿命算法，并将所对应的滤芯寿命算法下发给微控制器<sep>由远端服务器实时更新每个净水器的滤芯寿命算法，通过监测不同地区、不同季节水质变化，结合滤芯使用状态，实时更新滤芯寿命算法，使得净水器滤芯的寿命使用更加贴合实际使用情况
7	入海排污口过滤降污装置<sep>本实用新型涉及水利工程技术领域<sep>特别涉及入海排污口过滤降污装置；包括滤水坝和平面格栅，所述滤水坝设置于入海排污口处，所述滤水坝在海水流入的一面固接有平面格栅，所述滤水坝包括外壳、上游坝体、中间过滤体和下游坝体，所述外壳内部由海水流入的方向依次设有上游坝体、中间过滤体和下游坝体，所述中间过滤体活动连接有过滤降污装置，所述过滤降污装置内部固接有若干药包，所述中间过滤体为敞口中空的坝体结构<sep>本实用新型结构简单，维护更换方便、成本较低，能够加速过滤净化进度，提高过滤净化效果
7	在线清洗式曝气系统及其清洗方法<sep>本发明提供一种在线清洗式曝气系统及其清洗方法<sep>所述系统包括鼓风充氧系统，所述鼓风充氧系统包括依次连接的鼓风机、空气主管路和曝气单元，所述曝气单元包括依次连接的空气支阀、分支立管和位于曝气池池底的池底曝气扩散单元，所述系统还包括气提吹扫系统和药液清洗系统，所述气提吹扫系统包括依次连接的气提管、气提阀、和过滤槽，并通过气提管与曝气单元相连通；所述药液清洗系统包括依次连接的药液箱、加药泵、流量计、球阀、止回阀，并通过止回阀与曝气单元相连通，药液清洗系统在出现无机物污堵时开启<sep>根据本发明，不用降低水位拆除池底曝气扩散单元，就可进行曝气单元无机污垢内堵的吹扫及清洗，尽快恢复曝气池的生化充氧效能
7	一种城市污水处理装置<sep>本发明公开了一种城市污水处理装置<sep>包括处理箱，所述处理箱的底部固定有支架，所述处理箱的上端开设有进水口，所述进水口的内壁设有分流机构，所述处理箱的内壁固定有隔板，所述隔板的两侧均设有过滤装置，所述过滤装置包括固定在处理箱内壁上的滤板，所述滤板的上端设有用于淤泥清理的清扫机构，所述处理箱的侧壁贯穿开设有出渣槽，所述出渣槽的内壁转动连接有密封板，所述处理箱的外壁固定有收集箱<sep>优点在于：通过滤板对污水进行过滤，使得污水中的淤泥等粘稠物在穿过污水穿过粘稠物时吸附在滤板上，使得污水能够得到有效的初步清理，避免淤泥影响后续的处理，同时避免淤泥堵塞清理输送管道，使得污水处理装置能够保持畅通
7	一种废液臭氧气浮预处理装置<sep>本实用新型涉及一种废液臭氧气浮预处理装置<sep>有效的解决了现有装置无法对废液污水中的漂浮物、块状重物和厨余垃圾进行过滤处理的问题；其解决的技术方案是包括箱体，箱体左右两侧分别开设有进水口和出水口，其特征在于，箱体沿着进水口到出水口方向分为三格且分别称为沉淀池、块状物过滤池和漂浮物过滤池；漂浮物过滤池靠近出水口的一侧壁固定连接有前鼓风机，漂浮物过滤池远离出水口一侧壁开设有漂浮物出料口，漂浮物出料口一侧设置有转动连接在箱体内的两个出料辊，两个出料辊上均均匀的固定连接有若干拨抓<sep>本实用新型结构简洁，可有效的将废液中的漂浮物、块状重物和厨余垃圾进行过滤处理、便于操作，实用性强。
7	一种基于相关系数计算的钠中气泡噪声探测器<sep>本发明为一种基于相关系数计算的钠中气泡噪声探测器<sep>由一次仪表和二次仪表组成；一次仪表主要由漩涡发生体、磁钢、金属管道和电极组成；液态金属钠流经漩涡发生体后会形成规律的漩涡，沿管道方向运动的漩涡切割位于漩涡发生体下游的恒定磁场会产生近似正弦波形式的输出信号，其频率和幅值均与液态金属钠的流速有关，而且频率是流速的线性函数<sep>二次仪表对放大和滤波后的信号进行处理，利用频谱变换的方法求出信号的频率，并根据频率计算出一个信号周期的数据长度，取最新的相邻两个长度等于一个信号周期长度的数据，计算相关系数，对多个计算出的相关系数进行滤波和平均，与阈值进行比较，判断蒸汽发生器是否发生了泄漏。
7	利用固定化漆酶处理抗生素废水的方法<sep>本发明公开了一种利用固定化漆酶处理抗生素废水的方法<sep>包括以下步骤：将固定化漆酶、介体物质和抗生素废水混合进行降解处理，完成对废水中抗生素的降解处理，其中固定化漆酶是以介孔化膨润土为载体，介孔化膨润土上固定有漆酶，介孔化膨润土是以膨润土为原料经酸碱刻蚀后制备得到<sep>本发明方法利用固定化漆酶处理抗生素废水时能够快速高效的降解废水中的抗生素，同时固定化漆酶对环境有着更好的适应性，使得固定化漆酶相对游离漆酶具有更宽泛的应用环境，具有简单、快速、高效、成本低、无二次污染等优点，在抗生素的催化氧化降解中有着很好的应用前景
7	一种具有丰富lewis酸性位的fe-mof催化剂的制备及其脱硫应用<sep>本发明公开了一种具有丰富lewis酸性位的fe‑mof催化剂的制备及其脱硫应用。该方法以铁盐和均苯三甲酸为原料<sep>在高压反应釜中进行水热合成，经过热水和无水乙醇多次洗涤、真空干燥后制得产物fe‑mof催化剂（即mil‑100(fe)）<sep>本发明所制备的mil‑100(fe)催化剂具有大的比表面积和丰富的lewis酸性位，有利于提高反应过程中催化剂与反应物hs的作用，因而有效的促进了反应的进行，使催化剂在较低的温度下表现出优异的催化性能和较好的稳定性，在相同测试条件下，其性能远优于商业的feo和活性碳
7	一种垃圾热解污水处理系统及处理方法<sep>本发明公开了一种垃圾热解污水处理系统及处理方法<sep>可以实现通过将垃圾热解和热解污水处理同步进行，共同构建一个十分紧密的循环配合系统，实现水和余热的多重交叉利用，最大限度的利用一切资源，同时可以将热解产物中的热解炭经过特殊的磁化和改性处理，提高其吸附性能和商用潜力，充当高比表面积和多孔隙结构的吸附剂，直接用于热解污水中进行吸附净化，不仅节约了商用吸附剂的成本和消耗，同时有效利用垃圾的热解产物，另外在吸附净化后方便通过磁铁一步回收重新加以利用，也可以进行精加工用于商业变废为宝，一方面可以实现垃圾热解处理后的无污染排放<sep>另一方面可以有效利用剩余价值
7	一种控制土壤重金属镉铅污染菜心的方法<sep>本发明公开了一种控制土壤重金属镉铅污染菜心的方法<sep>本发明选取具有不同的镉积累能力的菜心品种，间作种植镉低量积累菜心品种和镉高量积累菜心品种；所述镉低量积累菜心品种为四九菜心，所述镉高量积累菜心品种为翠绿王油青甜菜心<sep>本发明能够有效降低间作双方的cd和pb含量；安全性高，无需添加外源材料，避免了二次污染的可能；对土壤扰动小，不影响土壤理化性质和肥力；成本低，可操作性强，无需特殊的材料、设备和栽培技术，适于广泛种植
7	氨氮降解菌的分离纯化方法、氨氮降解菌种及应用<sep>本发明涉及微生物领域<sep>具体而言，涉及一种氨氮降解菌的分离纯化方法、分离得到的氨氮降解菌种及应用。该菌株保藏于中国微生物菌种保藏管理委员会普通微生物中心，保藏编号为：cgmcc no:15930；保藏时间为：2018年06月11日。该菌株具有优异的氨氮降解效果，而且对于cod和总磷等指标均具有一定降解作用<sep>故该菌株在底泥生物修复工程中具备巨大潜能，应用前景广阔
7	含pva退浆废水两步法处理及回用新工艺<sep>本发明涉及含pva退浆废水两步法处理及回用新工艺<sep>属于水处理领域，两步法包括含pva退浆废水膜分离法系统和减压蒸馏浓缩系统；工艺如下步骤：含pva退浆废水通过精细过滤器预处理后，进入废水收集池，经自吸泵，泵入膜分离装置，分离出的渗透液进入渗透液收集罐，且渗透液可作为反冲洗及配制上浆料液的部分来源，浓缩液进入一级pva浓缩液收集罐；一级pva浓缩液输送至蒸馏罐继续浓缩，经减压蒸馏后浓缩液送入二级pva浓缩液收集罐，二级pva浓缩液可直接上浆回用，同时真空蒸馏产生的蒸汽，通过换热器对纺织过程洗涤水加热，实现热量利用<sep>本发明工艺处理退浆废水，高效、周期短，实现pva污染物减量化和资源化双重目标
7	一种复合袋式除尘器<sep>本实用新型公开了一种复合袋式除尘器<sep>包括进气箱、沉降室、过滤室、净气室、出气箱、灰斗和支架，进气箱、沉降室和过滤室顺次连接，进气箱、沉降室和过滤室均经支架支撑固定于地面上，过滤室内布置有若干滤袋，净气室与过滤室连接，且净气室设于过滤室上方，出气箱与净气室连接，烟气由烟气入口进入进气箱，并顺次通过沉降室、过滤室、净气室和出气箱，最终由烟气出口排出，灰斗连接于沉降室和过滤室下方<sep>本实用新型提高除尘器的除尘效果，不会产生臭氧，提高了除尘器中滤袋和脉冲阀的使用性能和使用寿命，本实用新型结构简单，操作方便，设备成本和运行成本低廉，从经济效益和除尘效果上均优于传统的袋式除尘器、电除尘器和电袋除尘器
7	一种浓盐水的浓缩分离系统<sep>本发明公开了一种浓盐水浓缩分离系统<sep>包括织物动态分离模块、热能浓缩分离回路、冷冻结冰分离回路；织物动态分离模块包括设置在支架上部的风道，在风道进风口的里侧设置有静压箱，在支架下部、位于风道的下方设置有盐水浓缩池，在盐水浓缩池中设置有浸没于浓盐水中的至少一个托辊，在风道也设置有至少一个托辊，风道中的一个托辊通过链条与电动机和变速器相连，风道底壁上设置有至少一个通道，织物通过通道依次悬挂在多个托辊上形成首尾相连的环状，通过链条带动托辊转动，保证织物的持续循环转动<sep>该系统能量来源主要为自然能，清洁环保、处理成本低，且系统可处理浓盐水浓度范围广、效率高，引入冷冻分离后，系统运行时间延长。
7	生物炭改性钒酸铋催化剂、制备方法及其应用<sep>本发明公开了一种生物炭改性钒酸铋催化剂的制备方法<sep>包括如下步骤：步骤一、生物炭的制备：将核桃壳制作成核桃壳生物炭；步骤二、生物炭改性钒酸铋催化剂的制备：将一定量p123完全溶解于浓硝酸中，然后加入乙醇，在剧烈搅拌下加入bi(no)·5ho和nhvo，调节ph值，搅拌0.5～2h，然后将混合物转移到高压釜中，在鼓风干燥箱中加热到120℃并保持12h，自然冷却到室温后，将得到的黄色沉淀洗涤干燥，得到生物炭改性钒酸铋催化剂。本发明还提供了一种生物炭改性钒酸铋催化剂及其应用<sep>本发明提供的生物炭改性钒酸铋催化剂，成本低廉、颗粒更加均匀，能有效降解磺胺废水中的磺胺，具有较强的实用价值
7	一种受污染城市内湖水质净化与水生态修复方法<sep>本发明公开一种受污染城市内湖水质净化与水生态修复方法<sep>所述的方法包括下述步骤：1)入湖河道的沿河雨水口或混排污水溢流口的排入河道处，设置雨污水预处理净化区；2)在湖内进行微地形水生态构建，所述微地形构建包括从湖岸至湖心依次构建浅水沉水植物恢复区、缓坡过渡区、深水调蓄区；在沉水植物恢复区中种植沉水植物；3)在湖心或深水调蓄区布置循环水泵，所述循环管道铺设于湖底<sep>本发明适用于管网溢流污染和城镇地表径流污染入湖负荷高的城市内湖水环境治理，可显著改善湖泊水质，降低湖泊富营养化程度，恢复水生态景观
7	一种城市污水处理装置<sep>本发明涉及一种处理装置<sep>更具体的说是一种城市污水处理装置,包括整机支架、脱水内支架、矩形槽板、连接支架、动力机构、分离机构、控制机构、连杆和近气机构，可以通过近气机构将氧气送人到装置内使进行反应，好氧性微生物繁殖而形成的污泥状絮凝物形成活性污泥吸附的悬浮固体和其他一些物质<sep>当装置内的活性污泥达到一定的程度需要进行泥水分离时，手动推动控制机构，改变控制机构在整机支架上的卡接位置，近气机构不在向装置内提供氧气，使泥水混合物落入到脱水内支架内，动力机构开始带动分离机构进行转动，分离机构将脱水内支架内的泥水混合物进行分离。
7	一种电解盐工业废水处理罐的汞蒸气防护检查盖<sep>本发明涉及一种电解盐工业废水处理罐的汞蒸气防护检查盖<sep>其结构包括：检查盖、废水处理罐、入水口、处理罐底座，检查盖的下端嵌入安装于废水处理罐的上方，废水处理罐的右侧通过焊接的方式与入水口的左端相连接，废水处理罐的下端与处理罐底座的上端相焊接，当操作人员打开检查盖时，集气泵内部产生低气压使处理罐内的汞蒸汽通过进气口被集气泵所吸收，使汞蒸汽在集气泵内部的旋转浆叶上凝结并被离心力甩至腔壁<sep>在旋转浆叶的推送下集至排液口并被重新汇入废水之中
7	垂直流人工湿地及其处理污水中氮、磷及四环素类的方法<sep>本发明公开了一种垂直流人工湿地<sep>包括依次串联的一级垂直流人工湿地池、二级垂直流人工湿地池及三级垂直流人工湿地池，一级垂直流人工湿地池及三级垂直流人工湿地池内均设有曝气管、曝气管上方设有填料层，填料层上设有土壤层，土壤层上种植有水生植物，二级垂直流人工湿地池内不设置曝气管，其它内部结构与一级垂直流人工湿地池相同，二级垂直流人工湿地池上方设有第二进水管。本发明还提供了一种垂直流人工湿地处理污水中氮、磷、四环素类的方法<sep>本发明利用垂直流人工湿地中后段的净化能力，提高去除负荷，降低占地面积，通过曝气提高垂直流人工湿地的出水指标，使排水达标，为小规模污水处理提供了一种简单易行的方法
7	一种介孔f、ce共掺杂scr催化剂<sep>本发明公开了一种介孔f、ce共掺杂vo‑wo/tio的选择性催化脱硝的催化剂。该催化剂将卤素元素f和稀土元素ce掺杂到普遍使用的商业催化剂vo‑wo/tio中<sep>并对催化剂中v和w元素的负载量及w元素的负载方式进行优化，从而拓宽了vo‑wo/tio催化剂活性温度窗口<sep>本发明解决了vo‑wo/tio催化剂在燃煤烟气温度过低、空速变化较大时，达不到脱硝目的等技术问题，适用于选择性催化脱硝处理工业燃煤产生的烟气
7	一种光催化杀菌剂及其制备方法和应用<sep>本发明公开了一种光催化杀菌剂及其制备方法和应用<sep>将光催化杀菌剂加入待处理的含e.coli废水中，暗处吸附反应平衡后可见光照射，进行光催化杀菌；所述光催化杀菌剂由如下方法制备：将rgo去离子水剥离液逐滴加入2‑甲基咪唑溶液与ag溶液混合的混合溶液中，搅拌混匀得到rgo/ag‑2mi前驱体溶液；将rgo/ag‑2mi前驱体溶液经离心、洗涤并烘干后，均匀分散在甲醇溶液中，在除氧的条件下，利用紫外光进行原位还原；(然后依次通过离心、洗涤、n吹干和研磨后得到rgo/ag@ag‑2mi光催化杀菌剂<sep>本发明所制备得到的光催化杀菌剂是一种新型高效的抗菌剂，具有优于目前常见的抗菌材料的抗菌性能，并且具有很好的可见光响应能力，材料稳定，杀菌效果可控并且不会造成二次污染
7	颗粒密度传感器的零点校准<sep>本发明涉及颗粒密度传感器的零点校准的方法<sep>所述传感器具有以下传感器特性：传感器的输出具有对从零密度开始的某个范围中的颗粒密度的明确限定的依赖性。在方法中，将传感器放置在密闭腔体（5）中，其中借助于空气净化器连续降低颗粒密度，而同时利用传感器重复测量颗粒密度以提供测量样本（1）序列。在腔体中的颗粒密度达到恒定值之前停止测量。为了评估传感器的零点，针对测量样本（1）序列的至少部分拟合基于空气净化器的已知空气清洁特性的颗粒密度的减小模型，并且从经拟合的模型提取对应于传感器的零点的恒定值<sep>方法允许在比常用方法更短的时间内的零点校准并且不要求用于实现零密度环境的技术装备
7	一种反硝化污水处理装置及其处理工艺<sep>本发明公开了一种反硝化污水处理装置及其处理工艺<sep>属于污水处理技术领域，处理装置包括预处理主要包括原水池、粗滤罐、ph调节池一、曝气罐、反硝化池、ph调节池二、消毒箱和污泥处理装置；处理方法为预处理、填料制备、填料挂膜及污泥驯化、反硝化处理、出水；本发明在污水反硝化处理之前对污水进行预处理，将制得的复合填料投加到反硝化池中，并接种活性污泥，在反硝化池内进行脱氮。本发明的污水处理方法脱氮和除磷效果优异，氮磷去除率高<sep>总之，本发明提供的一种反硝化污水处理装置及其处理工艺，结构新颖、脱氮效果好、成本低，出水水质好
7	对开型压滤污泥脱水方法<sep>本发明公开了一种对开型压滤污泥脱水方法<sep>将压滤首板(11)、多个中间滤板(13)和压滤尾板(14)依次排列，并安装于支撑柱(22)上，由分设于两侧的两个半圆筒形结构组成对开式圆筒形腔体(7)；在所述压滤首板(11)与中间滤板(13)之间、相邻中间滤板(13)之间、中间滤板(13)与压滤尾板(14)之间均设有柔性排水毛细管束(12)；所述对开式压滤污泥脱水方法包括进泥前阶段、进泥阶段、压滤脱水阶段、卸泥阶段和清洗阶段等步骤<sep>本发明具有易损件少、脱水后污泥含水率较低、压榨结束后易卸泥和清理的优点
7	一种垃圾热解气化焚烧处理设备<sep>本发明提供一种垃圾热解气化焚烧处理设备<sep>其结构包括进料孔、废液处理机构、脱硫塔、活性炭吸附罐、裂解焚烧室、垃圾导入管道、废液过滤器，进料孔下端焊接于废液过滤器上方，小型气泵通过高压加气使转子上的螺旋槽的气压增高，提高了液体在螺旋槽内的运动速度，从而增加了液体和螺旋槽的碰撞速度，致使液体的雾化效果更好，雾化的废液进入到加热室内时，由于导热板在导热环作用下发烫，将会使加热室内的温度逐渐升高，使得雾化进来的废液直接被蒸发掉，从而能够有效的将垃圾所产生的废液处理掉，有效的防止滋生细菌、长虫、发出臭味等现象发生<sep>同时要求避免长时间存放而致使废液酸性程度也会逐渐增加
