label_id	text
9	基于截屏操作的搜索方法及装置<sep>并且，配合截图的触摸操作也更方便用户在操作输入界面选择要进行搜索的内容，从而也提高了选取待搜索内容的精确度。
9	一种三维仿真模型及模型库的构建方法及装置<sep>有效实现了三维仿真模型的多样性，丰富了模型库，有效减少了构建数量巨大、内容风格丰富的三维模型库时的计算量，提高了三维仿真模型及模型库的构建效率。
9	通信装置、通信方法和计算机可读存储介质<sep>所述av放大器(12)接收所述未压缩图像数据的动态范围转换定义信息，并且基于所述动态范围转换定义信息来生成图形图像数据以进行叠加，从而使得所述tv接收器(13)可通过进行动态范围反向转换来显示具有期望亮度的所图形。
9	基于触摸设备的视频监控会议系统<sep>本发明、采用触摸设备生成控制指令，控制视频监控会议，操作简便，可移动性强；视频会议功能强大；可用于公检法等办案指挥中心，为指挥人员提供视频会商办案功能。
9	直播视频的转码装置、方法及计算机可读存储介质<sep>本发明提高了直播视频的转码效率，并且能够避免因转码失败而导致用户错过直播内容。
9	视频业务质量评估的方法及装置<sep>涉及通信技术领域本发明应用在iptv业务的质量监控过程中。
9	一种基于鱼眼摄像头录制的全景视频的自动标定方法<sep>本发明的有益效果为：免选错标定值带来造成播放不完整的问题；解决了全景视频播放时标定文件的生成、管理、准确性的问题；使用者可以利用播放器播放多种摄像头录制的视频，而无需专门匹配对应的标定文件进行播放。
9	一种iptv机顶盒浏览器的按键处理方法及系统<sep>涉及机顶盒技术领域本发明通过重构按键事件在当前页面中执行按键操作指令，无论当前页面内的注册按键事件是onkeypress、onkeydown或者onkeyup事件，都能确保每个按键操作指令的正确执行，降低了机顶盒浏览器适配页面的难度，提高服务质量和用户体验度。
9	基于多特征融合的视频描述方法<sep>本方法优点是通过多特征融合，能更好地提取到更加鲁棒的时空特征，同时在句子生成模型中加入平均池化特征，以便视觉信息与单词间建立更多联系，最后采用word2vec词向量方法替换one‑hot vector词表征，在单词与单词之间建立更多的联系，有效提高视频描述性能。
9	一种录制管理方法及系统<sep>本申请实施例方法包括：录制管理系统接收用户终端发送的目标录制任务的预约请求，预约请求携带目标录制任务的所需存储空间；确定用户的剩余存储空间是否满足目标录制任务的所需存储空间；若用户的剩余存储空间不能满足目标录制任务的所需存储空间，则根据用户的录制任务的删除策略确定可删除的录制任务的存储空间；确定可删除的录制任务的存储空间与用户的剩余存储空间是否满足目标录制任务的所需存储空间；若满足，则向用户终端返回录制任务预约成功响应，且在删除时间自动删除部分或全部可删除的录制任务。
9	一种网络直播监控方法和装置<sep>由此解决了现有技术中网络直播监控滞后的技术问题，达到了实时有效监控的技术效果。
9	图像处理方法、装置、系统、界面、介质和计算设备<sep>避免了现有视频交流方式存在的从会议现场视频中无法获取显示屏上的展示内容的问题，大大改善了用户的参会体验，提升了视频交流效果。
9	用于检测视频的方法和设备<sep>确定待检测视频的场优先顺序；生成待检测视频的检测结果，其中，待检测视频的检测结果中包括待检测视频的逐隔行类型和场优先顺序。该实施方式能够快速地生成视频的检测结果。
9	虚拟现实中的头部、手势和触摸输入的动态切换和合并<sep>响应于某些触发输入，可以在远场显示和近场显示之间转移虚拟对象的显示，以适应与虚拟对象的特定交互模式和操纵。
9	视频播放方法、存储介质和终端<sep>本发明还提供一种存储介质和终端。
9	信息处理装置、动态图像再现方法以及记录介质<sep>并且，动态图像再现部(104)使用提取出的帧的差分信息和再现开始帧的差分信息，生成再现开始帧的显示对象信息，从再现开始帧起开始动态图像的再现。
9	一种游戏内容效果的声音加强方法及系统<sep>本发明的有益效果为：能实现一个或多个声音的加强，实现单个或多个游戏内容的表现多个效果的目的。
9	用于使用单播abr流播在交换数字视频网络中提供vod内容的系统和方法<sep>以便选择能够最好地适应所请求的vod会话的特定边缘qam装置。可调整选择的边缘qam装置的现存vod会话的uabr流的比特率，以便适应在用于所请求的vod会话的选择的比特率的特定uabr流。可根据需要为现存vod会话和所请求的vod会话实现选择的边缘qam的带宽管道的uabr分配。如果适应会话请求，则可将包括一个或多个会话频率的响应消息传送到请求订户站。
9	一种基于流线长度累加的三维流场可视化方法<sep>属于流场可视化技术领域该方法通过流线体素化和体绘制技术，改善了三维流场中流线的遮挡情况，增强了流场内部结构特征的显示，有助于三维流场的交互式可视化分析。
9	一种倾斜摄影实景三维模型单体化方法<sep>涉及三维地理信息领域通过gpu着色器编程，提供修改片元最终显示颜色的一致性变量值，结合底面纹理图，实现模型高亮、高亮颜色和透明度修改以及模型的显隐。
9	一种像素通信方法、信息发送终端及信息接收终端<sep>本发明提供的方法，通过此方法，将待发送信息转化为视频信息投射在屏幕上，在可见光波段进行通信，可传递的信息种类丰富，不受互联网信号覆盖环境限制与影响，可以缓解移动通信的频谱资源耗尽的问题，同时基于可见光的短波频谱的高度定向特性，可应用在电磁敏感环境中。
9	交互式游戏过程回放系统<sep>并将其存储在游戏应用程序内或存储在网络可访问的位置中。
9	基于声控的直播关注方法、存储介质、电子设备及系统<sep>涉及网络直播的弹窗触发领域本发明能够根据主播的语音要求即时显示关注弹窗视图，关注弹窗视图显示的时段完美符合关注时段，显著提升了关注质量。
9	机顶盒用户界面加载方法及系统<sep>全部复制完后进行刷新数据的操作即可显示所需的图片，从而快速流畅的完成用户界面的加载，避免出现慢或者卡顿的问题，给用户带来良好的体验。
9	一种复杂三维物体的显示方法及系统<sep>该方法对矢量图像模型显示逼真，对于形状复杂的物体可以节约cpu与内存的消耗，对于运行大规模的实时渲染场景以及提高其运行的流畅度，具有很大的现实价值。
9	虚拟对象信息的显示方法和装置、存储介质、电子装置<sep>第三区域与第一区域不相交；在第一客户端的目标画面上显示用于指示第一对象和第二对象的信息，其中，目标画面是采集到的第一区域和第二区域的画面。本发明解决了相关技术中制作游戏道具的成本较高的技术问题。
9	一种生成和播放视频文件的方法、服务器及终端<sep>本发明提供的生成和播放视频文件的方法、服务器及终端，能够在确保跳播速度的基础上使得跳播到目标位置的准确度也随之提高。
9	一种阴影图的生成方法及装置<sep>本申请不但能够降低纹理显存的耗用量，还能够提高阴影渲染效率和阴影图质量。
9	基于人眼跟踪的裸眼3d显示方法、装置、设备及介质<sep>从而能够使每个用户左眼和右眼都能观看到正确的视点图内容，避免出现图像混叠或反转，提高了观看效果和用户的观看体验。
9	一种服务器控制方法、装置和系统<sep>本发明实施例可以通过在消息转发服务器接收客户端发送的控制请求后，生成控制指令并发送至视联网协转服务器，使得视联网协转服务器能够依据控制指令提供web服务，从而实现通过消息转发服务器控制视联网协转服务器提供web服务。
9	一种节目录制控制方法、系统以及管理、热度统计服务器<sep>应用于通信领域本发明不是所有的录制服务器都进行节目的录制，而是根据节目的热度信息来确定录制节目的录制服务器数量，即通过当前热度信息来预测将来对该节目的点播，这样既可以保证用户能够对节目进行点播，对用户的体验不会造成任何负面影响的同时，能节省很多的存储空间，即减少录制服务器的消耗，降低成本，提高产品的竞争力。
9	一种播放方法及装置<sep>本发明实施例中，判断第一位置信息对应的扬声器为第二扬声器后，使用第一扬声器对第二扬声器未播放的播放资源进行播放，使得第一设备能够根据变化后的用户的位置实时调节当前播放的扬声器，且可以使得当前播放的扬声器继续播放未播放的播放资源，从而可以保证用户收听到连续的播放资源，增强用户的体验感。
9	一种通用虚拟舞台平行仿真系统<sep>本发明通过平行仿真的方式使用通用舞台模块设计、控制和管理舞台，可以丰富舞台创意的实现方法，简化舞台的设计，提高效率、节约成本。
9	一种多媒体数据的播放方法和装置<sep>实现了用户可以多渠道获取多媒体数据的评论信息，以供用户选择观看自己感兴趣或评价较好的多媒体数据片段，增强了用户体验。
9	一种在智能电视上展示用户行为特征模型的方法<sep>本发明的方法弥补了不能在智能电视上展示用户行为特征模型的缺陷。
9	iptv频道列表生成使用方法及系统<sep>涉及iptv视讯终端的播放领域因此，本发明在iptv视讯终端无法接入服务端时，依然能够保证用户正常观看直播节目，进而显著提高了用户体验。
9	视频监控系统与视频监控方法<sep>根据对应所述视频串流的感测数据判断所述目标物件是否触发目标事件；若判定所述目标物件触发所述目标事件，根据预设分析条件、包含所述目标物件的所述视频串流及所述目标事件以输出对应所述目标物件的特征值；根据对应所述目标物件的所述特征值与模型权重值以产生对应所述目标物件的通知事件。
9	图像差值量化水印嵌入方法、提取方法、设备及存储介质<sep>本发明执行高效，不仅能够克服量化方法难以抵抗缩放攻击的缺陷，对各种常见的攻击也能够表现出很好的鲁棒性，并且还能使所有嵌入图像中的水印都获得良好的不可见性。
9	多游戏同屏实现方法和装置<sep>应用于与服务器通信连接的电子终端，涉及游戏开发技术领域本发明实施例能够实现在同一游戏显示界面中同时显示、运行多款游戏，可有效改善用户体验。
9	通过智能收音机实现音频点播的方法及装置<sep>避免了相关技术中点播节目时间受限的问题，并且第二终端通过指定第一终端为点播对象，提高了音频点播的私密性。
9	实时通信中录制控制方法、实时通信系统及通信终端<sep>进一步的，被录制方能够在录制方触发录制命令后收到提示，可以选择接受或者拒绝录制方的录制，从而能够保护被录制方的用户隐私。
9	视频质量预测方法和装置及电子设备<sep>本公开可以解决现有的视频质量评价方法不区分均匀失真和非均匀失真的问题，对于非均匀失真的视频质量评价结果更准确。
9	基于时间分片的主播排名方法及系统、服务器及存储介质<sep>最后根据分区的直播时间计算人气、观看时长、直播时长、收益，并根据得到的人气、观看时长、直播时长、收益计算直播排名，从而能够对直播主播进行细粒度划分统计，并对全能的、多方面均衡发展的主播进行有效的评价。
9	一种通过网页无控件低延迟查看实时监控视频的方法<sep>除低延迟外，本发明还具有视频网关占用的端口极少、不再需要转码以及流媒体复用和管理的优点，实现对同一摄像头的流进行复用和做无人观看时的资源回收。
9	一种网络音视频可播放性高效自动判别方法<sep>本发明是针对判别音视频是否可播放而制作的一整套判别方法，能够快速识别音视频是否可播放，解决人工判别音视频是否可播放的耗时耗力问题。
9	确定用于认证或者授权的多频道媒体分发者的恢复可用性<sep>权利服务转移一些或者所有请求以免到达多频道媒体分发者。这些请求用于与多频道媒体分发者关联的节目编排者向用户设备提供媒体内容。权利服务后续地向多频道媒体分发者传输测试请求。权利服务确定多频道媒体分发者基于测试请求已经认证在测试请求中包括的用户证书或者已经授权内容访问。基于这一确定，这指示多频道媒体分发者的可用性已经被恢复，权利服务向多频道媒体分发者传输后续认证或者授权请求。
9	基于生物特征识别的电视互动方法、智能电视及存储介质<sep>本发明通过人脸识别或者语音识别来获取用户的生物特征，将获取的生物特征与媒体数据库中存储的明星进行匹配，将匹配度最高的明星的相关视频推荐进行播放，直观地给用户展示智能电视所携带的独特功能，提升智能电视和用户的互动效果。
9	一种高效多通道预分配磁盘录像方法<sep>本发明通过监测外部供电，利用后备电池为大内存和磁盘提供持续供电保障，延迟关机断电时间，确保录像数据在外部异常断电情况下不会丢失。
9	视频监控方法、装置及视频监控设备<sep>能够第一时间控制云台旋转以对来访对象进行拍摄，避免遗漏任何来访对象的监控画面，消除时空上的监控盲区。
9	一种多平台并行导播推流的方法及系统<sep>本发明所提供的方案简单有效，且所需的设备以及操作人员均较少，同时还能够有效地节约成本。
9	游戏系统以及计算机程序的记录介质<sep>游戏系统(1)对判定标识图像(46)和对象图像(47)的显示进行控制，使得判定标识图像(46)以在各操作时期经过各轨道图像(42)上的对象图像(47)的方式移动，由此通过判定标识图像(46)与对象图像(47)的一致来引导各操作时期。
9	基于热点的视频编辑方法、服务器及视频播放系统<sep>本发明还公开了一种服务器及视频播放系统，本发明可实现热点客观、准确的选取，从而保证大多数用户能基于热点观看视频中的精彩及感兴趣的内容。
9	一种vilte视频通话质量控制系统及方法<sep>本申请在vilte视频通话中利用传输数据统计来实时地调整视频压缩编码的速率，从而对当前移动通讯网络的信号质量和上下行带宽的变化做出及时响应，提高了视频通话质量，增强了视频通话功能，提升了视频通话效果。
9	一种iptv浏览器的视频处理方法<sep>本发明提出了iptv机顶盒视频处理的通用的解决方案，对小窗口视频的显示问题和全屏播放处理机制更具有通用性,通过浏览器内核页面解析模块实时解析页面下发的web元素，通过浏览器视频播放处理模块实时处理，解决iptv页面视频播放和页面元素层次兼容性问题。
9	一种游戏物品数据传输的方法<sep>通过本发明，可实现减小在游戏物品传输时的大小，加快传输速度，以及减少物品对内存的占用，优化存储空间。
9	彩色汇聚误差的修正方法、装置及设备<sep>本发明提供的技术方案，能够对投影系统的彩色汇聚误差进行检测以及修正。
9	虚拟图像处理方法、图像处理系统及存储介质<sep>本发明提供的虚拟图像处理方法，通过获取的移动参数虚拟出虚拟摄像装置的位置及姿态，从而计算出待替换场景相对虚拟摄像装置的透视参数，在根据透视参数编码虚拟场景，可以实现编码虚拟场景与拍摄画面的无缝融合，可以适用于摄像装置移动中的虚拟显示。
9	一种移动终端城市二三维联动显示方法<sep>该方法可以实现二三维的联动显示，发挥二维地图在位置定位方面的优势，实现优势互补，在浏览三维城市场景的同时，可以在二维场景上看到当前视角的定位和观察方向。
9	一种视频站点优先级配置方法及装置<sep>从而针对该类型的客户端，配置待调整视频的播放源站点的优先级，实现了在不更改整体视频的播放源站点优先级的前提下，对个别视频进行播放源站点的优先级配置。
9	一种导航标签窗口颜色设置方法及装置<sep>该方案可以提高导航标签窗口的颜色的协调性以及美观程度，进而可以避免用户由于窗口的颜色而放弃点击导致导航标签窗口的点击频率降低的问题。
9	多人连麦混画方法及装置、存储介质及电子设备<sep>应用该方法，可以降低基准流与各个主播端的目标源流之间的时延，使各个主播端的互动与基准流之间的互动同步，提高用户观看体验。
9	一种移动视频监控方法、监控中心及系统<sep>减少中间环节耗费的时间，减少交通瘫痪问题，也使得受伤人员能够及时医治。
9	基于osgi框架的pon设备实现终端设备流量推送控制的方法<sep>采用该种基于osgi框架的pon设备实现终端设备视频流量推送控制的方法，可以对不同的设备进行统一化参数配置管理，大大简化了操作步骤，减小了重复操作，提高了使用者的操作效率，同时采用有线或无线的方式建立终端设备和流量推送插件的连接，使得网络组建更为便捷，不仅如此，在该pon设备中由于自带的解码模块，因此在通过hdmi接口投射至终端显示设备的过程中，便于lan侧流量转发。
9	一种视频广告播出监测方法<sep>同时，通过采取特征区域选择、判定重复帧、取头片段、取尾片段等操作，在保证精度的情况下，进一步提高了处理速度。
9	一种视频容错传输系统与容错发送装置<sep>通过第一线缆和第二线缆将串行数据发送到容错接收装置，第一数据流数据包串行数据与对应的第二数据流数据包串行数据发送时间不重合，容错接收装置校验第一数据流数据包及第二数据流数据包，并输出校验正确的第一数据流数据包所包含的视频数据或校验正确的第二数据流数据包所包含的对应的视频数据。
9	电视节目的播放方法及播放装置<sep>本发明可以自由选择节目的播放时间，不受节目在epg中播放时间的限制。
9	一种组播业务处理方法与接入点<sep>该方法实现连接在同一个ap下的终端，可同时存在组播、单播混合接收报文的模式，保证组播业务的质量，提高用户体验。
9	控制游戏技能释放的方法、装置、存储介质及移动终端<sep>第一触控事件为点击操作，第二触控事件的起始时刻、初始触屏点与第一触控事件的触屏时刻、触屏点的间隔小于预设时间、预设长度。本发明的方法及装置可及时触发技能释放，且触发准确率高、误操作少。
9	用于网络视频直播的媒体低延迟通信方法与系统<sep>该方法能够调整音、视频传输的优先级，以在网络通信有延时或不稳定时优先发送重要数据。
9	一种基于视觉矫正的三维点云地图融合方法<sep>通过这样处理，本发明能够将两个视角差异很大的三维点云地图融合在一起。
9	一种播放方法及装置<sep>同时可以根据连续两个媒体分片的下载速率进行自适应切换，保证实时网络状况的有效性，避免了突发的网络影响导致不适当的码率切换。
9	游戏对象控制方法及装置<sep>本实施例能够通过分组控件以及分组选择操作，将目标游戏对象的分组确定为目标分组子控件对应的目标分组，从而实现了对游戏对象的快速分组，以提升游戏的操作效率。
9	一种目标对象抓拍方法、装置、视频监控设备及存储介质<sep>本发明实施例能够在保证监控范围的前提下，提高目标对象的清晰度。
9	媒体资源的播放、传输方法和装置、存储介质及电子装置<sep>解决了通过人脸识别获取用户的特征，从而为用户个性化投放广告，由于用户隐私信息被获取导致的不安全的技术问题。
9	媒体流发送方法、装置、系统及服务器、终端、存储介质<sep>属于网络技术领域该方法可以为第二终端的观众用户提供主播用户完整的直播视频和音频。
9	一种分布式网络视觉监控系统<sep>本发明在解决了现有技术存在如何在保证识别跟踪效率的同时，提高了嵌入式视觉系统的实时性的关键问题，具有提高了视频监控在实时发现异常行为且及时传输报警信息方面的能力、极大节约人力成本，也将产生良好的经济社会效益、提高了安防监控的效率的有益技术效果。
9	一种视频生成方法、装置、电子设备及计算机可读存储介质<sep>采用本申请所提供的视频生成方法可以有效解决画面构图不佳等问题，在视频生成过程中不需要人工干预，剪拼接效率高。
9	监测iptv业务内容合法性的方法和系统<sep>本发明有效地实现对iptv内容安全自动监视，可以覆盖所有的iptv用户和所有的业务内容。
9	浏览器窗口中播放多路视频的方法及装置<sep>该方法可用于浏览器窗口中播放多路视频，其可以实现在一个浏览器窗口中播放多路视频。
9	建立机顶盒与用户的关联方法及装置<sep>涉及信息技术领域本发明综合提升了为机顶盒与用户建立关联的效率与可靠性。
9	图像分割方法、装置、计算机可读存储介质和设备<sep>从图像分割出分割目标。根据本申请的图像分割方法能够具有较高的鲁棒性，同时占用的计算资源较少，能够方便地与其它功能配合使用。
9	一种资源数据更新方法及机顶盒设备<sep>涉及数据更新技术领域本方案在资源数据更新时可以实现快速无缝切换，在观感上几乎不会对用户造成任何影响。
9	一种室内视频监控盲区识别方法<sep>使用此方法可快速识别监控点位盲区，且支持现场调整点位动态识别盲区，可用于现场监控点位微调设计，以最简单直观的方式来辅助进行现场点位设计确认。
9	游戏装置及程序<sep>所述显示装置显示游戏的画面，且构成为可载置具有表示预先规定的在游戏内登场的包含角色或装备的登场对象中的任一者的识别信息的实物体的游戏物品。游戏装置控制游戏的执行，并检测对于游戏的画面中包含的登场对象中任一者的虚拟物体的游戏物品及载置在显示机构的实物体的游戏物品的任一者的移动操作。
9	音视频预加载方法、装置、设备及存储介质<sep>本公开实施例不仅对音/视频进行预加载，从而提高音/视频的起播速度，实现快速打开并播放音/视频；同时，还根据目标用户对目标音/视频的偏好确定目标音/视频的预加载量，避免对所有音/视频都进行预加载，导致占用过多存储资源、以及浪费网络流量。
9	视频监控系统前端的安全智能处理装置<sep>涉及视频监控领域本申请在不改动图像采集器硬件情况下，利用图像采集器现有的硬件接口(网口和sd卡槽)进行改造，不但能够满足安全监控需要，而且还能够降低造价。
9	数字装置及其控制方法<sep>获取与所获取的内容信息对应的至少一个相关关键词，使用包含所获取的至少一个相关关键词的相关搜索项来检索与所述内容有关的相关信息中的至少一条相关信息，并且输出所述相关信息中的所检索到的至少一条相关信息。
9	一种4k点播智能判断识别码率的方法及装置和系统<sep>步骤e，终端机顶盒请求视频播放时，根据终端机顶盒型号返回对应的视频播放地址。
9	支持大跨度相关性信息编码的标识方法及系统<sep>在具体的应用中，可以使现有的传输系统支持监控视频、视频会议、网络电视、流媒体等视频内容利用大跨度相关性信息进行编码，以在实际的传输系统中，进一步提升视频内容的编码效率与传输效率。
