label_id	text
9	解码方法及装置、存储介质、处理器<sep>得到下一帧的硬件解码配置参数，并将下一帧的硬件解码配置参数存储至乒乓缓存中；以及在用于硬件解码的中断处理函数中，触发使用乒乓缓存中的硬件解码配置参数对待解码视频数据进行硬件解码。
9	用于使数据质量可视化的方法和系统<sep>且在所述表示中显示与所述第二类型的染料相关的所述多个数据点的第二部分。所述方法进一步包含在散布图显示中显示所述多个数据点的所述第一部分。所述散布图在y轴上展示与所述第一染料相关的荧光值且在x轴上展示与所述第二染料相关的荧光值。所述方法包含在所述散布图显示中显示所述多个数据点的所述第二部分。
9	运动字幕解交织方法、系统、移动终端及可读存储介质<sep>本发明可以高效的解决运动字幕出现的“锯齿”和“闪烁”现象。
9	数字艺术景观装置的独立显示模块输出方法及服务设备<sep>实施本发明实施例，能够缩短数量较多的独立显示模块的调整耗时，提高独立显示模块的输出效率。
9	一种可视电话的处理方法和装置<sep>通过本发明实施例，实现了视联网中不同网络区域的视联网终端之间的可视电话，提升了视联网的兼容性。
9	视讯实现系统及方法<sep>本地视讯终端在进行多媒体数据播放时还可以同步到远程视讯终端，从而在会议室内的参会人员可以在任意位置通过本地视讯终端实现多媒体数据的播放，避免了现有技术中采用有线方式进行投屏带来的位置限定的问题，提升了视讯分享的使用体验。
9	一种绘图方法及终端设备<sep>这样，通过指纹信息绑定画笔控件，跟踪所述第一输入的运行轨迹，以第一颜色和第二颜色进行绘图，从而在绘图的过程中，简化了用户的操作。
9	游戏选手确定方法及装置<sep>本发明所述的游戏选手确定方法及装置，可以根据游戏感应区域内的人员与所述当前互动模式的选手点位之间的距离从游戏感应区域内的人员中准确确定出游戏选手，从而可以提高游戏选手的用户体验。
9	增强现实ar的实现方法、装置和计算机可读存储介质<sep>提高了用户的参与度，可玩性更高，用户体验更好。
9	一种合成音视频数据流的方法和装置<sep>属于多媒体技术领域采用本发明，可以更加方便有效地实现数据流合成。
9	一种多实例交互式图像分割方法<sep>本发明方法相对现有技术在解决多实例交互式图像分割问题的时候，不仅充分考虑了图像的颜色信息，而且还考虑了图像之间的位置信息，通过综合利用图像的颜色和位置来实现高性能的图像分割。
9	控件的显示控制方法和装置以及计算机可读存储介质<sep>本发明能够克服现有技术中物品的信息控件一直随物品显示而造成的视野遮挡、用户体验不佳的问题。
9	电视游戏控制器的加载方法和装置<sep>本发明避免了启动一款游戏时需要下载并安装对应的游戏控制器安装包的问题。
9	过扫描自适应显示方法及装置<sep>由此，实现了过扫描自适应显示，提升了用户体验。
9	视听内容项数据流<sep>该方案可以具体地为视听内容提供改进的且更灵活的数据流。
9	基于时空一致的大型表演动态舞台视频编辑显示方法<sep>本发明在实现精准舞台视频背景的同时，降低了舞台管理的复杂度，提高了内存利用效率和映射速度。
9	一种基于三维模型的纹理映射方法和装置<sep>得到精准的自由曲面映射最终值，再根据该自由曲面映射最终值，将纹理图片映射至根据三维模型数据采集系统所采集的点云数据所建立的三维自由曲面初始结构上，以生成精准的仿真三维模型。
9	网页元素移位方法及装置<sep>属于互联网技术领域本发明通过为待移位的目标网页元素设置容器元素，并在容器元素中设置目标网页元素的移位属性，使得在检测到指针悬停操作触发目标网页元素产生移位时，容器元素的覆盖区域在移位前后始终包括目标网页元素覆盖的区域，因此即便目标网页元素脱离了指针的悬停位置，设置在容器元素中的移位属性仍然生效，不会产生目标网页元素的抖动现象，效果较佳。
9	一种基于压缩感知的无线图像传输方法<sep>该方法可以提高带宽不足的无线环境下图像传输的性能。
9	将直播流作为广告供应<sep>来推广从内容分发器所接收的直播流。内容服务器缓冲直播流。内容服务器从客户端设备接收对视频的请求。内容服务器识别用户所请求的视频以及与所识别的视频相关联的元数据。内容服务器基于元数据确定是否连同用户所请求的视频一起向客户端设备供应直播流广告，例如作为前置广告。然后内容服务器识别所缓冲的直播流广告，以连同所请求的视频一起传送给客户端设备。
9	游戏对象控制方法及装置<sep>本实施例通过分组控件进行第一分组选择操作以及第二分组选择操作，将第一对象组中的游戏对象合并至第二对象组中，从而实现了对不同的对象组中的游戏对象的快速合并，提升了游戏的操作效率。
9	一种游戏中图形文字的显示方法及终端<sep>本发明通过索引配置文件，能够快速获取显示文字对应的图形文字，处理速率快，并在游戏界面上显示相应的图形文字，使游戏界面文字显示效果更佳，提高了用户体验。
9	一种自适应网络的实时高清视频流分发方法及其系统<sep>涉及安防监控领域本发明通过在监控设备端自适应监控设备与一级分发器之间的网络通道，在二级分发器端自适应二级分发器与客户端之间的网络通道，并选择最适合该网络通道的传输码率，减少了客户端视频出现卡顿、延迟和丢帧等现象的概率，提高了预览的高清视频图像的质量。
9	图像显示装置、外部设备、图像显示方法及图像显示系统<sep>其预先与所述规定图案相关联地保存所述指令；以及控制部，其在所述图像判断部判断为与所述图像数据相关的图像中包含所述规定图案时，令所述设定变更部基于与所述规定图案相关联的所述指令来变更所述设定。
9	计算机播放画面即时管理系统<sep>由于对当前播放画面的内容复杂度进行分析，以在复杂度过高时停止释放弹幕，从而避免给观众带来过于纷乱的画面。
9	一种电视开机展示文件的播放方法及装置<sep>本发明可以解决开机展示文件与目标信号源的显示存在较大差异的问题。
9	基于多人语音房的游戏直播方法、介质及计算机设备<sep>本发明实现了将小游戏引入多人语音房，可以丰富语音房的玩法，提高直播间游戏玩法的时效性、以及增强主播与观众的互动性，提升用户体验。
9	一种游戏人工智能任务的设计系统和方法<sep>本发明的有益效果为：提高多核cpu的利用率，大大增强了ai的计算能力；方便了多平台间游戏代码的移植，增强了代码可维护性与可重用性，减少了游戏的开发成本，缩短了游戏的开发周期；提高了游戏ai的表现力。
9	一种互动电视业务质量检测的系统与方法<sep>发现问题可以用鼠标截图、录制视频，既可方便获取、制作汇报材料用素材，也方便与产品、研发团队进行沟通交流。
9	一种新闻分割的方法及装置<sep>由此可见，本发明实施例提供的新闻分割方法及装置，可以根据镜头序列和标题序列判断两个相邻不同标题之间是否存在渐变镜头，自动筛选出新闻分割点，从而利用所述新闻分割点对所述视频新闻进行分割。
9	游戏对象的速度控制方法和装置<sep>根据游戏对象的当前速度确定游戏对象的目标速度，并控制游戏对象的移动速度锁定为目标速度。通过本发明，达到了在游戏过程中方便操控的效果。
9	像素排列的显示方法、装置及显示设备<sep>其中方法通过横向相邻两个像素单元共用r子像素和/或b子像素形成目标像素单元，并获取目标像素单元中每个像素单元的三原色子像素的原始亮度值，从而确定目标像素单元中子像素的目标亮度值，以实现均匀显示、达到较好的显示效果的。
9	基于连续简化的超大几何体实时渲染方法<sep>本发明既提供了实时预览的高性能，又保留了数据原来的精度。
9	一种用于同步音频数据和视频数据的方法、系统及计算机可读存储介质<sep>大脑如何处理声音和/或视觉内容)的音频和视频同步感知模型。与不同音频部分相关联的相对情感影响可被用来确定用来有助于音频数据向视频数据的自动同步的转变点以创造实现对收听者/观看者的特定总体情感效果的产物。感知模型的各种处理技术可以利用音频部分内的感知特性来确定用于与视频数据的自动同步的转变点。
9	截图方法及装置<sep>通过在终端内预设面积大于截图面积的截图画布，在移动终端进行截图后，将截图放置在截图画面上，并在空余位置形成的信息嵌入区域写入附属信息，解决现有技术截图编辑方法复杂繁琐的问题。
9	用于确定音频语句的边界的方法和装置<sep>目标语句为组成组合句的至少三个连续语句中不在组合句边缘的语句，以及利用目标语句对应的声韵母序列对组合句对应的音素标签序列进行匹配，以确定目标语句的语音边界。该实施方式实现了对视频资源中的语句的音频的精准切分。
9	一种网络教学视频的播放方法<sep>其通过对视频进行图像分析后，提取语音和文字关键词，并添加到视频播放图像中。
9	基于linux电视的图像显示方法及装置<sep>用于提高linux电视的图像显示效果。
9	基于地理位置信息的互动方法、云端服务器、播放设备及系统<sep>终端发送包含互动文本输入信息、所述终端的地理位置坐标及通讯地址的互动文本输入指令，以获取播放设备播放的视频的互动内容中的互动信息。
9	虚像倍率测试方法、装置及虚拟显示设备<sep>本发明提供一种虚像倍率测试方法、装置及虚拟显示设备，能够测量虚像的放大倍率。
9	一种三维模型处理方法、装置、服务器及存储介质<sep>采用上述技术方案实现了在不失真的描述物体三维模型的前提下，节约三维模型数据存储空间，并减少三维模型检索的计算量。
9	一种基于视频监控的图像数据保存方法及系统<sep>采用本发明，可实现静止或画面不变的视频数据的有效过滤，大大减少视频图像数据的存储量，还可以减少翻查视频时花费的时间，提高工作效率。
9	一种检测方法和装置<sep>本发明实施例解决了只能通过咨询网管的方式检测视联网终端的mac地址是否支持多路连接的问题，从而可以提高检测的效率。
9	在用户端实现连麦预览的方法、存储介质、设备及系统<sep>涉及直播应用开发技术领域本发明能为用户端的用户提供连麦预览功能，消除了用户连麦顾虑，提高了用户连麦的积极性，使得直播间内活跃度高。
9	一种电视用户观看行为特征提取方法及系统<sep>得到每一用户的用户偏好类型；针对每一用户的用户价值类型和用户偏好类型进行电视节目个性化推荐。采用本发明的方法及系统，具有能够根据用户不同时期动态提取电视用户观看行为特征，便于进行个性化推荐的优点。
9	降低直播视频播放延迟的方法及装置<sep>上述方法及装置中，客户端首先向组服务器发送第一请求信息，由组服务器按照到客户端的延迟评估值来确定服务器ip地址，并选择延迟评估值最小的服务器ip地址作为客户端的请求地址，以实现数据源(即第一服务器)就近访问，减少视频数据传输延迟，提升用户体验。
9	一种视点补偿方法、装置、电子设备和存储介质<sep>以根据视点补偿量进行视点补偿。采用上述技术方案降低了由于观看裸眼3d图像时被追踪对象的左右移动，而导致的左右眼视图的串扰现象所发生的概率，提升了用户的观看体验。
9	用于互联网远程教育的媒体低延时通信方法及系统<sep>该方法能够调整音、视频传输的优先级，以在网络通信有延时或不稳定时优先发送重要数据。
9	减面方法、设备及显示设备<sep>每个三角形面包括三条边，每条边包括两个顶点。用于对三维角色模型进行减面的方法包括：确定所述三维角色模型中位于边缘的第一边；确定位于所述三维角色模型内部的第二边；以及相对于第一边优先减去第二边以减少三角形面数。根据本发明的实施例，可以减小减面处理对视觉感知的影响。
9	基于电视设备的个性化智能语音提示方法<sep>本发明根据决策算法从配置文件输出语音说法对用户进行个性化语音提示；提升用户体验度以及培养用户使用语音操作电视的习惯，更好的为用户提供个性化服务。
9	化身视频装置和方法<sep>可以描述和/或要求保护其他实施例。
9	一种视频监控设备部署方法及装置<sep>同时在维护阶段，通过模式识别字段和用户名密码双重鉴权，提高了安全性。
9	一种视频通话的方法、装置以及移动终端<sep>通过本发明实施例，实现了采用双面屏进行信息共享，避免了信息共享对视频通话的影响，提升了在视频通话的过程中信息共享的便捷性。
9	一种智能电视、其焦点控制方法、装置及可读性存储介质<sep>本发明在焦点需要重新回到播放窗口时，跳过节目列表标签而直接将焦点切换至播放窗口，省去用户先经过节目列表标签一步步切换到播放窗口的步骤，更符合用户的使用意图，具有更高的便捷性。
9	一种视频切换的方法、装置、电子设备及存储介质<sep>并且可以方便的在当前视频和上线视频之间进行切换，不需要退出当前播放的视频再重新打开上线视频，简化了切换流程。
9	歌词同步显示方法、系统、装置、介质及设备<sep>本发明提高了歌词的同步性。
9	一种视频遮罩方法、装置及设备<sep>通过本发明实施例提供的视频遮罩方法、装置及设备，能够提高遮罩处理过程的效率。
9	一种基于视频回放终端的视频回放方法和系统<sep>由此可实现权衡流量资费和视频体验，达到节约流量的目的。
9	音视频交互状态同步方法及装置<sep>属于网络技术领域第一管理设备检测到第一终端由正在交互状态切换为交互中断状态时，能够根据第二终端的第一路径信息，确定第二终端的第二管理设备，通过与第二管理设的交互，将第一终端的交互中断状态通知给第二终端所关联的用户所在终端，实现了音视频交互过程中，不同直播房间的状态同步。
9	分屏应用切换方法、装置、存储介质和电子设备<sep>本申请实施例可以在分屏界面当中生成悬浮窗及悬浮窗内的应用标识，根据用户针对应用标识触发的操作来选取其他的应用程序，并将其他应用程序对分屏应用程序进行替换，可以提高对分屏应用程序进行切换的效率。
9	一种直播学习的投影设备及其系统<sep>实施本实用新型的直播学习的投影设备及其系统可将学习内容进行投影，使用便利。
9	一种提升dvb数据流加扰速度的方法及装置<sep>能够大量减少需要加扰的ts数据包数量，使得对于计算资源的要求比加扰全部的音视频的ts的计算资源的要求低非常多，解决了如何降低加扰和解扰对硬件资源的计算能力的要求，从而大大节省运营商与消费者的硬件投入的技术问题。
9	三维模型的姿态模拟方法、装置、存储介质和电子设备<sep>属于计算机技术领域同时，不需要存储三维姿态检测模型，可以节约存储空间。
9	一种ar设备的控制方法、装置及ar设备<sep>涉及增强显示领域本发明上述实施例，达到了使得前置摄像头随用户眼球的转动而转动，进而使得显示出的增强现实图像与期望的图像相一致，提高用户体验的效果。
9	电视待机开机方法、电视及计算机可读存储介质<sep>通过本发明，仅需保持对存储器以及单片机的供电，降低了电视处于str待机模式时的整机功耗，使电视更加符合节能环保理念。
9	超广角畸变图像的修复呈现方法及能够拍摄该图像的手机<sep>包括：获取超广角畸变图像；构建超广角畸变图像修复模型；在坐标系x‑y‑z内选取视平面abcd作为初始角度的视平面，视平面abcd与yoz平面平行且与半球面相切，求取超广角畸变图像在视平面abcd上的投影图像；转动显示屏进而使视平面abcd旋转后获得其他角度的视平面，根据视平面abcd求取超广角畸变图像在其他角度视平面上的投影图像。在手机本体上设置广角镜头，使手机能够拍摄超广角畸变图像，并经过构建超广角畸变图像修复模型，将超广角畸变图像修复为180度视角空间，最终通过显示屏显示，避免了图像内容的浪费，降低图像处理硬件、软件的成本
9	用于运行虚拟现实系统的方法和虚拟现实系统<sep>本发明还涉及一种具有虚拟现实眼镜(12)的虚拟现实系统(10)。
9	视频信息同步显示方法、装置、设备及存储介质<sep>与视频播放界面中当前播放视频对应的关注用户。通过本公开实施例的技术方案，能够实现内外流视频的同步滚动，提高用户的观看体验。
9	信息的展示方法和装置、存储介质、电子装置<sep>得到第二雷达图，其中，多个顶点为第一雷达图上的顶点；在第一客户端上通过第二雷达图展示多个特征维度下的特征值。本发明解决了相关技术中对于游戏结果的展示方式单一的技术问题。
9	游戏系统以及在游戏系统中使用的计算机程序<sep>游戏系统(1)赋予用于从以具有与互不相同的变化分别对应的多个技能的方式准备的多个角色卡(39)中选择用于玩游戏的多个角色卡(39)的卡选择机会。而且，游戏系统(1)在特别模式下，在每次提供特别模式时按规定的顺序依次对音乐游戏赋予与在卡选择机会中选择出的各角色卡(39)的技能对应的变化。
9	离子注入层热点结构opc变换处理方法<sep>本发明通过结构特点定义并选出问题热点结构，并针对不同的热点结构进行相应的截断变换，从而将问题热点图形变换为风险较低的图形结构，有效地改善离子注入层中容易导致工艺问题的热点结构，增加工艺窗口，提高成品率。
9	三维数字模型双重盲水印的嵌入、提取方法和存储介质<sep>当挑选出的、与数位相应的二环邻居顶点的位置与相应数位处的水印值不匹配时，将数位相应的二环邻居顶点的位置调整为与水印值匹配。
9	用于实现云游戏系统的时移辅导的系统、方法及可读媒体<sep>且所述云游戏系统可识别出对应于所述请求辅导的用户当前正在玩的时间点或动作的先前发布的辅导视频。所述云系统可访问辅导选项的数据库，随后将所述辅导选项呈现给用户。所述辅导选项可以是游戏过程的视频和所述提供辅导的用户的视频。所述用户随后可以观看所述辅导视频、在需要时对所述辅导视频进行评级，且随后继续他或她的游戏过程。
9	一种屏下屏裸眼3d显示的显示结构及其显示终端<sep>本实用新型通过双屏显示不同景深的内容来实现裸眼3d图像。
9	一种基于弹幕的视频标注方法及终端<sep>本发明可以使终端根据用户的喜好为用户提供个性化的视频标注，无需人工参与，提升了用户观影体验。
9	一种基于浏览器的2.5d网页开发方法<sep>涉及一般的图像数据处理或产生技术领域本发明使用传统2d开发技术开发2.5d设计图中的二维元素，使用webgl开发2.5d设计图中的三维元素，开发难度低，实现效果好。
9	基于字幕生成关联弹幕的方法及设备、计算机可读介质<sep>为用户提供了灵活的字幕信息的理解参考，因此降低了对视频用户观看过程的干扰，提高了视频用户获取字幕信息内容的效率，从而增强了视频用户语言学习的效果。
9	终端<sep>终端接收形状输入，该形状输入用于通过按顺序指定规定数量的玩家角色而形成规定形状，基于形状输入形成规定形状，当已形成的形状的区域内存在对手角色时，进行指定的玩家角色攻击该对手角色的处理。
9	一种基于互联网电视的后台数据同步方法<sep>本发明的优点在于：开发成本较低，安全性高，数据同步多样化的一种基于互联网电视的后台数据同步方法，从而缓解了安全问题、数据同步问题与开发成本的矛盾。
9	一种直播处理方法、装置、设备及存储介质<sep>以使观众端显示该合并显示图像和播放该音频混流，通过本发明的技术方案，能够实现提升用户的参与度、用户的使用率、用户的兴趣度和用户的活跃度。
9	一种基于媒体自身属性以支持空间分块的存储与传输方法<sep>本发明有利于在存储和传输时都能准确索引到原多媒体内容及其空间分块内容，改进了现有的依赖于传输对原多媒体内容及其空间分块内容关联关系进行描述的严重缺陷。
9	数据显示方法及装置<sep>属于图形界面交互技术领域另外，后续显示数据时可通过一个自定义控件进行显示，不会因控件过多占用较多的资源，也不会造成性能损耗。
9	视频播放进度展示方法及装置、电子设备<sep>方便用户了解视频内容的精彩程度，做到更精准的引导观看视频内容，进而提升用户的观看体验。
9	一种全媒资的资源处理方法、系统和存储介质<sep>在本发明实施例的技术方案中，通过将从视频牌照方服务器中爬取的新增视频数据与全媒资数据库中的视频数据，按照预设合并规则进行合并，可以实现不同源的视频资源之间的统一管理，保证用户能够选择更全面且更优质的视频资源进行观看，节省用户对视频资源的查找时间，提升用户使用体验。
9	一种用于智能电视当前播放列表的偏移校正方法和装置<sep>因此本发明可以使当前播放列表中的切片文件与节目源服务器的切片文件同步播放，从而实现修正传输时间延迟和播放时间延迟引起的内容偏移问题，纠正不同智能电视的播放进度。
9	资源共享播放方法及装置<sep>控制第二终端设备播放指定资源，提高用户操作的便利性，提升用户体验。
9	基于电视的虚拟卡拉ok系统及方法<sep>本发明有效解决了由于家庭普通电视终端设备及信号采集播放链路的非专业性以及由此带来的链路延迟时间长等问题所产生的用户歌唱体验差、用户歌唱音视频和歌曲原有内容无法良好合成等问题，能够在家庭电视机终端实现单人和多人自身歌唱声音、视频和歌曲内容的良好混合呈现。
9	多类型媒体数据网络地址转换穿越方法、终端及系统<sep>该实现方式优化了nat穿越的流程，可减少nat穿越中信令协商的交互，提高nat穿越的效率和成功率，加快视频通话的首帧显示。
9	一种用于无线视频监控的信号与能量同传系统<sep>本发明提供的用于无线视频监控的信号与能量同传系统，可通过改变桥式功率驱动组件的配置，增加上位机及上位机开关，实现整合能量与信号的收发，达到能够通过无线方式传送电量与数据信号。
9	使用physx物理引擎模拟流程的整合优化方法及装置<sep>本发明技术方案的优势是：在物理开始模拟到物理结束模拟之间有一个游戏流程（一帧）的时间用于物理引擎的多线程模拟，这种情况下，游戏更新和渲染的同时，物理引擎的多线程在正常运行，在多核cpu下，这种方式明显能提高模拟效率。
9	推荐主播上热门的方法、存储介质、电子设备及系统<sep>涉及互联网移动端应用开发领域本发明能保证被推荐的主播具有最大的曝光度。
9	一种网络直播的未读消息提示方法及装置<sep>在直播界面中对该未读消息提示信息进行展示，从而实现在直播中对未读消息进行提示，并且当未读消息过多时，也可以根据该未读消息提示信息追溯相关未读消息，大大增强了消息传达的时效性。
9	网络电视用户数据修正方法、装置、存储介质及处理器<sep>涉及信息技术领域本发明适用于网络电视用户数据的修正。
