label_id	text
19	一种减振型风力发电塔架<sep>本发明是一种减振型风力发电塔架<sep>包括基础与空心塔筒固连，其特点是，在基础上与空心塔筒的下部固连有支撑架，在空心塔筒内的高度方向分若干层设置与空心塔筒内壁固连的止晃平台，在止晃平台的层与层之间设置粘滞阻尼器，粘滞阻尼器的连接杆与止晃平台的球铰固连，粘滞阻尼器的活塞杆与位于上层的止晃平台的止晃支杆、空心塔筒内壁结合部位固连，在空心塔筒的封顶部位通过吊杆悬吊调谐质量阻尼器<sep>具有结构合理，抵抗强风、地震等外力载荷的能力强，能够满足环境和使用要求，稳定性好，使用寿命长等优点
19	一种用于风电配件的自动焊接装置<sep>本实用新型公开了一种用于风电配件的自动焊接装置<sep>包括装置底板、第一腔体、第四腔体和第五腔体，所述装置底板顶端两端皆开设有贯穿至装置底板内部的滑槽，所述装置底板内部的一端开设有第一腔体，且第一腔体内部靠近滑槽的一端安装有第一电机，所述第一电机输出端通过轴承安装有贯穿至滑槽内部的正反丝杆，且正反丝杆外侧皆设置有贯穿装置底板顶端的第一丝杆螺母<sep>该用于风电配件的自动焊接装置，通过第二管道内部的风扇进行转动，当风扇在转动的时候将焊接组件焊接时产生的粉尘与有害气体进行吸收后，通过第一管道排入到第一装置外壳的内部再通过过滤板过滤后，防止焊接时产生有害气体对使用者的造成伤害
19	一种垂直轴风力发电设备<sep>本发明公开了一种垂直轴风力发电设备<sep>包括箱体，所述箱体的上端固定有支撑杆，所述支撑杆的顶端固定有安装板，所述安装板内转动连接有主动转轴，所述主动转轴上固定有连接杆，所述连接杆上固定有叶片，所述主动转轴的下端贯穿延伸至箱体的内部，所述主动转轴的下端设置有动力传输机构，所述动力传输机构位于箱体的内部，所述述动力传输机构的输出端设置有第一皮带轮，所述第一皮带轮通过传送带传动连接有第二皮带轮，所述第二皮带轮固定在增速机的输入轴上，所述增速机的输出轴通过联轴器与发电机的输入轴固定相连，所述增速机和发电机均固定在箱体的内部<sep>通过上述结构实现利用风力发电，结构简单，维修方便，成本降低
19	风力发电机的控制方法及装置<sep>本发明公开了一种风力发电机的控制方法及装置<sep>其中，该方法包括：采集风力发电机的风机数据，其中，风机数据是由传感器采集到的数据；根据采集到的风机数据修正风机模型，得到修正后的风机模型，其中，风机模型用于模拟风力发电机的状态；基于修正后的风机模型，调整风力发电机的控制参数；基于调整后的控制参数控制风力发电机<sep>本发明解决了相关技术中风力发电机在运行时采用的控制参数与风力发电机的实际状态存在误差导致的风力发电机的发电效率无法达到最优的技术问题
19	海上双馈风电机组高电压穿越控制方法及系统<sep>本发明公开了一种基于超级电容储能技术的海上双馈风电机组高电压穿越控制方法及系统<sep>该海上双馈风电机组高电压穿越控制方法包括：获取并网点电压标幺值和并网点电压升高的持续时间；确定是否启动高电压穿越控制模式降低并网点电压；在高电压穿越控制模式启动后，判断网侧变流器输出有功电流值是否超过网侧变流器正常工作能承受的有功电流最大值；当有功电流值超过有功电流最大值时，判断直流链路电压是否超过直流链路电压的临界值；当直流链路电压超过该临界值时，启动超级电容储能模块<sep>本发明旨在解决现有技术中的海上双馈风电机组由于电网电压骤升可能带来的机组脱网事故的问题
19	一种活塞式波浪能静水层发电装置<sep>本实用新型公开了一种活塞式波浪能静水层发电装置<sep>包括活塞缸，活塞缸包括缸体、活塞和活塞杆，活塞杆为中空管且下端与活塞缸的下腔相连通，活塞杆上端通过刚性水管连接有发电座、叶轮和发电机，刚性水管上位于发电座的下方固定有由上浮体、吸水模块和下浮体组成的浮动模块，缸体下端横向设置有静水板，以及纵向设置有防转板，缸体底部设有在活塞拉升时打开供水流入下腔的第一单向阀，缸体顶部设有在活塞压下时打开供水流入上腔的第二单向阀<sep>活塞杆上位于活塞上方设有在活塞拉升时打开以供活塞缸的上腔内的水流入活塞杆内、在活塞压下时关闭的第三单向阀
19	一种具有主动支撑电网功能的风机桨距角控制方法及装置<sep>本发明涉及一种具有主动支撑电网功能的风机桨距角控制方法及装置<sep>包括：根据目标电压、目标频率和目标电压下的发电机功率设定值，计算目标工况下的发电机电磁转矩静态值，目标工况为发电机工作在正常电力系统状态时的工况；将目标工况下的发电机电磁转矩静态值与当前工况下的发电机电磁转矩值作差，得到发电机电磁转矩预变量；根据发电机电磁转矩预变量，计算桨距角变化量，并根据桨距角变化量控制变桨系统<sep>本发明通过预先控制的方式，可以实时调整风轮桨距角，减小了发电机出现超速故障的概率，有利于风力发电机的稳定运行
19	具有线缆支撑结构的风轮机<sep>公开了一种风轮机(1)<sep>该风轮机(1)包括塔架结构，所述塔架结构包括沿着基本竖直方向延伸的主塔架部分(2)以及至少两个臂(3)。每个臂(3)均沿着具有水平分量的方向远离所述主塔架部分(2)延伸，并且所述臂(3)被布置成执行偏转运动。两个或更多个能量产生单元(4)安装在所述塔架结构上，使得所述塔架结构的每个臂(3)均承载至少一个能量产生单元(4)，每个能量产生单元(4)均包括转子(5)，所述转子(5)具有承载一组风轮机叶片(6)的毂<sep>所述主塔架部分(2)设置有线缆支撑结构(7)，允许电网的电缆(8)安装在所述主塔架部分(2)上
19	一种叶片净空距离监测系统及叶片净空距离监测方法<sep>本发明实施例公开了一种叶片净空距离监测系统及叶片净空距离监测方法<sep>用于通过雷达探头测量得到可靠性较高的净空距离<sep>本发明实施例方法包括：叶片净空距离监测系统包括雷达探头、控制器、塔筒和风力发电机，风力发电机包括至少一个叶片；风力发电机设于塔筒顶部，雷达探头设于风力发电机的机舱部位，控制器与雷达探头连接；雷达探头用于检测得到当目标叶片经过塔筒正面时的叶尖方位角，将叶尖方位角向控制器发送，以使得控制器根据叶尖方位角、预先获取的雷达探头与目标叶片的叶尖的距离、预先获取的基准线与塔筒的距离、以及预先获取的方位基准角，计算目标叶片与塔筒的当前净空距离，至少一个叶片包括目标叶片
19	风力发电系统监测的方法<sep>本发明提供了一种风力发电系统监测的方法<sep>该方法包括以下步骤：将监测部安装在混凝土基础的内部，所述监测部用于对所述混凝土基础的应力进行监控；根据所述监测部监测到的应力信息判断所述混凝土基础的受损程度；根据所述混凝土基础的受损程度控制安装在所述混凝土基础上的风机的工作状态<sep>使用该方法可以对混凝土基础内部的应力进行监测，用于反应风机的运行状态，保证混凝土基础的安全，进而保证风机的安全运行
19	用于减轻风力涡轮机叶片中的振荡的方法<sep>一种用于风电场的系统包括：控制系统<sep>该控制系统与多架无人驾驶飞行器通信，其中，控制系统被配置为在触发条件期间部署一架或多架无人驾驶飞行器；并且其中，被部署的无人驾驶飞行器被引导朝向指定的风力涡轮机并与该风力涡轮机的叶片相互作用，以便控制叶片的振荡。本发明还包含一种用于减轻风力涡轮机的叶片振荡的方法，该方法包括以下步骤：监测与风力涡轮机关联的触发条件；在检测到触发条件时，朝向风力涡轮机部署无人驾驶飞行器，并且使用无人驾驶飞行器与风力涡轮机的叶片相互作用，以控制叶片的振荡。因此，本发明提供了一种以最少的人类操作员干预来控制叶片振荡的高效方法<sep>一旦检测到合适的条件，就可以自动部署无人机，并且无人机可以通过物理地接触叶片或者通过与叶片很靠近地相互作用来与这些叶片自动接合，以便扰乱叶片周围的气流，从而减轻振荡
19	风力涡轮机中转子和机舱之间的雷电传导装置<sep>风力涡轮机中的转子和机舱之间的雷电传导装置<sep>其包括：第一电导体板(1)，其中其末端中的一个与放置在每个叶片根部的金属条(4)分开一距离；第二电导体板(2)，其中末端中的一个与风力涡轮机的槽元件(5)分开一距离；第一和第二板(2)之间的电导体元件；耦接至第一和第二板(2)的电绝缘体(6)，其还耦接至风力涡轮机的轮毂(3)<sep>以及第一和第二板(2)之间的相对位移元件，该元件配置为确保第一板(1)的末端和金属条(4)之间的预定距离，以及第二板(2)的末端和槽元件(5)之间的预定距离。
19	一种风电场功率控制方法<sep>本发明公开了一种风电场功率控制方法<sep>包括以下步骤：s1．根据电网调度功率给定和风场实测功率计算功率偏差，判定进行升功率控制或降功率控制；s2．检测风电机组状态；s3．检测各个机组待机时间及持续限功率运行时间；s4．根据实际功率和风速实时计算限功率和待机状态机组的升功率裕度；s5．进行优先级排序；s6．降功率控制时，将机组分为三类并做预处理；s7．升功率控制时，对机组进行分类预处理；s8．根据预处理结果控制风场各台机组运行状态；s9．通过变桨pi控制器对转速进行控制<sep>本发明可实现对风电场层功率精确控制的同时减小机组载荷，另外对单台机组采用闭环功率控制，确保单台机组的功率控制精度
19	适用于海上风机的结构监测和海洋环境监测系统及监测方法<sep>适用于海上风机的结构监测和海洋环境监测系统及监测方法<sep>属于风电场和海洋环境监测领域<sep>为了解决使用更少的构件对于海上风电场的风机结构和环境以及海洋环境信息更有效采集的问题，包括安装在风机单桩的升降架及伴随着波浪运动在升降架上进行上下浮动的浮筒，浮筒在竖向的浮动范围由升降架限制，浮筒的上底面安装用于监测风机的监测装置，浮筒的下底面安装用于监测海洋环境的监测装置，且监测数据通过信号发射器传输至上位机<sep>通过浮筒的随浪运动
19	一种半浸入式海洋风力发电设备用漂浮体<sep>本发明涉及海洋风力发电设备技术领域<sep>且公开了一种半浸入式海洋风力发电设备用漂浮体，包括漂浮体，所述漂浮体的内部开设有空腔，所述漂浮体的内部开设有位于空腔下方的气道，所述气道的顶部与空腔连通<sep>漂浮体另一侧翘起并牵拉相对应的缆索，缆索牵拉相对应的活塞向下移动，使进水孔与缓冲腔连通，海水通过进水孔被吸入缓冲腔的内部，增加漂浮体翘起一侧的重力，增加漂浮体倾斜的阻力，降低漂浮体倾斜的幅度，使漂浮体在重力作用下向水平状态恢复，进而实现漂浮体自动平衡的目的，减小风力发电组件的晃动幅度和倾斜幅度，增加海洋风力发电装置的稳定性，确保海洋风力发电装置正常工作，增加发电效率
19	风机偏航校正系统<sep>本发明实施例公开了一种风机偏航校正系统<sep>涉及风力发电技术领域<sep>用于解决现有技术缺乏对偏航角度误差情况的预判机制的问题<sep>本发明风机偏航校正系统包括：控制器、凸轮计数器以及电子开关量传感器；电子开关量传感器用于测试实时的偏航角度，控制器与电子开关量传感器相连，用于获取电子开关量传感器的第一测试结果；凸轮计数器包括滑动变阻器，利用滑动变阻器测量偏航角度，控制器与滑动变阻器相连，用于获取滑动变阻器的第二测试结果，计算第一测试值和第二测试值之间的第一差异，当第一差异超过第一预设差异时，启动报警，以通知工作人员偏航角度误差较大
19	一种利用海洋波浪能与风能双重发电的方法<sep>本发明公布了一种利用海洋波浪能与风能双重发电的方法<sep>其步骤在于：波浪使浮球上下起伏，浮球上下起伏并通过连接杆/连接支架牵引齿轮轴一转动，齿轮轴一转动并最终通过输入斜齿轮、传递斜齿轮、输出斜齿轮牵引转轴绕自身轴向转动；转轴转动并向行星增速机构的输入部件传递动力，且该动力经行星增速机构的输出部件向发电机的转子输出，发电机转子转动即利用海洋波浪能进行发电工作<sep>在发电机利用海洋波浪能进行发电过程中，伴随波浪同时出现的海洋风能会通过垂直轴螺旋风力发电扇叶驱使转轴做与发电机发电工作时的转子转向一致的转动，转轴转动并驱使发电机的转子转动，发电机即利用海洋风能进行发电工作。
19	用于海上电气平台的桶型基础结构<sep>本实用新型涉及一种用于海上电气平台的桶型基础结构<sep>本实用新型的目的是提供一种结构简单、制作方便、安全可靠的用于海上电气平台的桶型基础结构，以提高海上电气平台建造效率和降低施工风险、成本。本实用新型的技术方案是：一种用于海上电气平台的桶型基础结构，其特征在于：具有导管架，导管架的桩腿下端接于双壁桶型机构，导管架顶部设有上部安装平台，上部安装平台上设有水平仪和中控系统，所述上部安装平台与导管架之间设有液压调平机构；所述双壁桶型机构具有顶盖，顶盖上端面连接所述导管架的桩腿，顶盖下端面上同轴接有内桶和外桶<sep>本实用新型适用于海上风力发电领域技术领域
19	用于风力涡轮机转子叶片的模块化运输和存储系统<sep>本发明涉及一种用于风力涡轮机转子叶片的模块化运输和存储系统<sep>所述系统包括用于支撑叶片的第一和第二尖端插座（112,160），用于接收第一和第二尖端插座中的任一个的尖端框架（111），其中，第一尖端插座（112）适合于将叶片（10）支撑在大致竖直的位置中<sep>并且其中
19	节能控制方法、装置、存储介质及水多联系统<sep>本发明公开了节能控制方法、装置、存储介质及水多联系统<sep>该方法包括：确定当前的计算周期下的所有开机风盘中的所有计算风盘；其中，当前的计算周期下的所有计算风盘，是在当前的计算周期下的所有开机风盘中，参与计算当前的计算周期下的温差绝对值的一个风盘或两个以上风盘；确定在当前的计算周期下的所有计算风盘的目标室温与当前室温的温差绝对值；根据当前的计算周期下的温差绝对值，确定当前的计算周期下的目标水温；控制水多联系统按当前的计算周期下的目标水温运行，以控制水多联系统按第一换热阶段运行<sep>本发明的方案，可以解决水多联系统的运行经济性能较差的问题，达到提升水多联系统的运行经济性能的效果
19	一种风电机组侧有源次同步振荡抑制装置及其方法<sep>本发明涉及一种风电机组侧有源次同步振荡抑制装置及其方法<sep>包括小容量三相全控逆变器及其控制器，并联连接于风电机组箱变低压侧，需采集风电机组箱变低压侧电网电压、低压侧入网电流来提取次同步振荡信息，同时采集附加逆变器自身的输出电流和直流电压作为控制反馈，补偿风电机组次同步电流从而优化并联点电流和电压，从而增强整个系统在次同步频带上的电气阻尼<sep>实现整个风电并网系统输出的次同步振荡抑制,本发明便于已有工程改造实施
19	一种风力发电机的故障检测方法和系统<sep>本发明公开了一种风力发电机的故障检测方法和系统<sep>该方法包括：从正面利用激光跟踪照射运行中的风力发电机的叶片，通过激光测振原理获取叶片的振动信息；通过叶片的振动信息，获取风力发电机的各叶片垂直于旋转平面的摆振波形；比较各个叶片的摆振波形，判断是否存在振动差异，若存在振动差异，则判断风力发电机的叶片存在故障，若不存在振动差异，则判断风力发电机的叶片健康<sep>本申请利用激光正面照射风力发电机的叶片，获得各叶片垂直于旋转平面的摆振波形进行单机比较，判断风力发电机是否存在故障，相比于现有技术，本申请为非接触式测量方法，不影响风力发电机的结构和运行，无需风力放电机上布线供电，成本更低
19	可通过内部加强增加单机容量的海上风电大直径单桩基础<sep>本实用新型涉及一种可通过内部加强增加单机容量的海上风电大直径单桩基础<sep>包括有植入海泥面以下一定深度的钢管桩，钢管桩通过高强灌浆体固定于桩周围岩土体中，钢管桩内部通长或间断或沿桩身部分设置有加强结构，加强结构焊接于钢管桩内壁。通过其结构内部加强增强了单桩基础刚度，提高整体结构抗水平变形、抗弯、抗疲劳性能，使得在桩径不变的情况下有更高的承载性能，适用于更大单机容量的海上风电机组<sep>同时，解决目前海上风电领域大直径单桩基础施工装备稀缺等问题，降低海上基础施工投资，有效推进工程进度，具有很高的推广价值
19	一种便于安装的风能电机<sep>本实用新型公开的属于风能电机领域的一种便于安装的风能电机<sep>包括电机，电机左端侧壁和中心侧壁均设有凸台，电机外端设有壳体，壳体内腔设有第一滑动槽和第二滑动槽，第一滑动槽和第二滑动槽左端均设有固定区，电机右端设有固定孔位，固定孔位安装强力弹簧，强力弹簧右端固定连接电机底座，该种便于安装的风能电机，在使用的时候，设有第一滑动槽和第二滑动槽对电机形成多层滑动槽，对电机的紧固具有进行一定的作用，且固定区左端设有固定橡胶层可对凸台紧固具有一定的保护作用，设有过滤网不会使鸟类及其他杂物进入，对电机形成保护，且电机便于安装固定，且稳定性较强<sep>结构较为简单
19	一种海上风力发电机机舱叶轮组合体运输装置及实施方法<sep>本发明公开了一种海上风力发电机机舱叶轮组合体运输装置及实施方法<sep>属于风力发电运输设备的技术领域<sep>设有钢桁架、安装座、固定座、支撑杆以及销轴，利用钢框架和安装座作为机舱和叶轮的运输基台，并利用安装座上的连接组件将机舱进行固定，固定座与支撑杆通过销轴转动连接，支撑杆远离固定座的一端延伸至机舱内部并利用拉紧组件与内部的叶轮法兰连接进行辅助加固，且提高运输过程中的安全性，结构简单，实用性强且节约运输成本
19	基于神经网络模型预测控制的磁悬浮垂直轴风电机组控制方法<sep>本发明涉及基于神经网络模型预测控制的磁悬浮垂直轴风电机组控制方法<sep>属风电技术领域<sep>该方法采用神经网络模型预测控制策略，对磁悬浮垂直轴风电机组进行实时平稳控制：风速达到切入风速时，悬浮变流器采用pid控制算法及神经网络模型预测控制策略控制悬浮电流，使发电机旋转体上升至并保持在悬浮平衡点；风速在切入风速和额定风速之间时，悬浮变流器确保旋转体在旋转过程中保持在平衡点处，同时机侧变流器和转子侧变流器采用神经网络模型预测控制和零d轴电流控制策略，对风电机组实施mppt控制；风速大于额定风速小于切出风速时，悬浮变流器实施旋转阻尼控制，机侧变流器实施恒功率控制<sep>本发明控制简便，可实现低风速启动及大功率输出
19	风力发电机组塔底冷却装置及控制方法<sep>本发明公开了风力发电机组塔底冷却装置<sep>包括塔架(1)和散热器(2)，所述塔架(1)内部设有主风道，所述散热器(2)内置于所述主风道中；所述主风道中设有第一风机(6)，并通过所述第一风机(6)驱动所述主风道中的空气流动冷却所述散热器(2)；所述主风道与所述塔架(1)外环境组成开式循环。该塔底冷却装置将散热器内置于塔架内，可以提高散热系统集成度，对于海上机组，可降低基础外平台建造成本及海上吊装所需时间，同时减少塔架上用于进出水管及电缆的穿出而所需的开孔数量以及随之而来的密封问题<sep>本发明还公开了用于控制上述风力发电机组塔底冷却装置的控制方法
19	利用清洁自然能发电的方法<sep>本方案提供了利用清洁自然能发电的方法<sep>其步骤在于：首先，扇叶构件对任意方向的自然风进行捕捉并且利用自然风的冲击力驱动自身做旋转运动，自动调节构件驱动叶片在展开状态与折叠状态之间循环切换，促使扇叶构件对风能进行连续性捕捉；同时，自然风将吹动形成海浪并且风能转化成海浪的流动势能，海浪驱动装置对海浪的流动势能进行捕捉，海浪的流动势能将带动海浪驱动装置转动；海浪的流动势能转化成海浪驱动装置的转动势能<sep>而后，第二传动机构将海浪驱动装置的转动势能传递至第一传动机构，第一传动机构将接受叶片装置的转动势能以及第一传动机构的动力并且传递至变速器，传动装置中的变速器将动力输出并且驱动发电机运转发电。
19	风电机故障监控方法、装置和系统<sep>本发明公开了一种风电机故障监控方法、装置和系统<sep>其中，该方法包括：从作为监控对象的目标风电机接收多个参数，多个参数至少包括：风电机的外部环境温度、风电机的工况参数以及风电机的多个组件的组件温度；基于从目标风电机接收到的多个参数，利用用于多个组件的组件异常检测模型，确定目标风电机中存在工作异常的组件，以及基于确定目标风电机中存在工作异常的组件，确定目标风电机是否发生故障<sep>本发明解决了现有技术中仅通过机组温度确定风电机工作状态的方法易造成风电机工作状态的误判的技术问题
19	一种电网多时间尺度调度方法<sep>本发明涉及一种电网多时间尺度调度方法<sep>包括：依次执行均以常规机组、风电、caes电站和柔性负荷为调度资源并以运行经济性为优化目标的日前调度模型、日内调度模型和实时调度模型，得到常规机组、风电和caes电站的出力计划，柔性负荷调度计划，旋转备用容量，及agc容量购置计划；其中，各调度模型的约束条件包括各调度资源的运行约束；实时调度模型的约束条件还包括caes电站参与电网agc调频的约束<sep>本发明以含caes电站、柔性负荷等的系统为研究对象，综合考虑caes电站和多类型柔性负荷在不同时间尺度下的调度特性，caes电站和柔性负荷降低了系统弃风量，另外考虑agc机组旋转备用和caes电站的辅助调频服务，有效提升了风电消纳水平，保证了系统高效安全的经济运行
19	一种长短多桶负压桩筒型海上风电基础结构及其施工方法<sep>一种长短多桶负压桩筒型海上风电基础结构及其施工方法<sep>包括桩筒和装在桩筒底端的负压桶结构，所述的负压桶结构至少设有两种不同长度的负压桶桶体，负压桶桶体沿桩筒的周向均匀分布，不同长度的负压桶桶体等间隔设置，负压桶桶体通过连接件与桩筒固定相接，负压桶桶体的底端为开口端，负压桶桶体的顶端为封闭端，封闭端上开有排气孔，排气孔处装有排气阀<sep>本发明通过在桩筒底部设长短不一的负压桶桶体，每个负压桶桶体顶部留有排气阀，供下沉过程排气用，增设不同长度的负压桶桶体可满足现场地质条件及承载力、稳定性要求，避免出现局部或整体失稳，适用于地质条件复杂海域，确保每个负压桶桶体下沉到位，可用于软黏土海域
