label_id	text
19	一种永磁同步电机的控制系统<sep>本发明公开了一种永磁同步电机的控制系统<sep>包括包括固设与地面上的支撑杆，所述支撑杆上转动配合连接有机箱，所述机箱内固设有储槽，所述储槽上左端设置有转动组件，所述转动组件可以在风的驱动下转动，驱动设备发电，所述储槽的前后两端对称的设置有滑腔，所述滑腔内固设有开关门组件，所述开关门组间可以在转动组件位于所述储槽内或者所述储槽外时开关门，本发明结构简单，操作方便，通过风力带动转动组件上固设的导体架转动切割磁感线获取电能<sep>当风力过大或处于无风状态时
19	一种新型的储能式液压型风力发电机组调频控制系统及控制方法<sep>本发明公开了一种新型的储能式液压型风力发电机组调频控制系统及控制方法<sep>该系统包括四部分，分别为风力机部分、液压传动部分、液压储能子系统部分和发电部分，在负荷波动导致电网频率波动时，风力机通过控制风力机部分变桨距系统的桨距角、液压传动部分的变量马达摆角、液压储能子系统部分的变量泵/马达摆角来对系统输出的有功功率进行控制，进而对发电机输出的频率进行控制<sep>协调有功功率的原则为变量泵/马达摆角控制优先，再通过调控变量马达摆角来调节输入到发电机中的功率，通过调控变量马达摆角，同时控制变桨距系统的桨距角大小，改变系统能量的输入，从而稳定发电系统的频率
19	一种安装于风力机塔筒的降噪装置及风力机<sep>本发明公开了风力机降噪装置技术领域<sep>具体涉及一种安装于风力机塔筒的降噪装置及风力机，旨在解决现有技术中叶片噪声经塔筒反射后增大了叶片噪声的声压级同时叶片噪声引发塔筒振动产生二次噪声的技术问题<sep>降噪组件通过安装组件安装在塔筒上；安装组件包括上支撑环板和下支撑环板，上支撑环板和下支撑环板分别通过螺栓与塔筒的安装法兰连接，下支撑旋转环板与下支撑环板滑动连接，降噪组件安装在上支撑环板和下支撑旋转环板之间且降噪组件随下支撑旋转环板同步绕塔筒的轴线转动；通过在风力机塔筒上设置降噪装置，减少了风力机塔筒对叶片噪声的反射，同时减少了由叶片噪声引发风力机塔筒振动产生的二次噪声
19	用于风轮机转子叶片的空气流构造<sep>本公开内容针对一种用于风轮机(10)的转子叶片组件(100)。转子叶片组件(100)包括具有外表面的转子叶片(22)<sep>外表面限定大体上沿翼展方向在内侧区域(36)与外侧区域(38)之间延伸的压力侧(23)和吸力侧(24)，以及前缘(26)和后缘(28)。内侧区域(36)包括具有圆形后缘(28)的叶片根部(34)。此外，转子叶片组件(100)还包括至少一个空气流分离元件(102)，其安装到内侧区域(36)内且邻近于圆形后缘(28)的转子叶片(22)的压力侧(23)或吸力侧(24)中的一者或两者上。此外，至少一个空气流分离元件(102)对应于转子叶片(22)的压力侧(23)或吸力侧(24)的轮廓<sep>因此，至少一个空气流分离元件(102)构造成在标准操作期间在内侧区域(36)中提供固定的空气流分离位置
19	一种偏航驱动器自动测试系统<sep>本发明涉及一种偏航驱动器自动测试系统<sep>属于风力发电装备技术领域<sep>测试系统，包括至少一套测试单元，测试单元包括第一电机和第二电机，第一电机和第二电机轴联，第一电机用于被第一被测偏航驱动器控制，第二电机用于被第二被测偏航驱动器控制；集成控制模块，用于通信连接各被测偏航驱动器，以实现对各被测偏航驱动器的硬件功能进行测试，集成控制模块用于根据硬件功能测试启动指令，控制各被测偏航驱动器执行相应的硬件功能测试并接收各被测偏航驱动器的反馈信息，根据反馈信息进行判断，实现硬件功能测试<sep>该系统将各测试单元集成在集成控制模块中，实现了偏航驱动器的硬件功能的全面测试，保证偏航驱动器的出厂质量达标
19	一种风机转速恢复方法及系统<sep>本发明提供了一种风机转速恢复方法及系统<sep>该方法包括：实时采集风机转速及电网频率；判断电网频率是否偏离电网额定频率；如电网频率偏离电网额定频率，按照第一电磁功率曲线控制风机变流器控制器，第一电磁功率曲线根据虚拟同步控制算法计算得到；判断风机转速是否下降到预设的第一转速限值；如风机转速下降到所述第一转速限值，按照第二电磁功率曲线控制风机变流器控制器，第二电磁功率曲线根据比例积分算法计算得到；判断风机转速是否从第一转速限值上升到第二转速限值<sep>如风机转速从第一转速限值上升到第二转速限值，按照第三电磁功率曲线控制风机变流器控制器，第三电磁功率曲线根据mppt算法计算得到。
19	一种弧线型抗冰风电基础<sep>本发明涉及一种弧线型抗冰风电基础<sep>包括横向尺寸较小的上部基础、中部基础和横向尺寸较大的下部基础；整个中部基础的形状为上小下大的倒锥形或喇叭形，中部基础包括弧线型主桩腿，弧线型主桩腿为弧线形，横截面为梭子形；梭子形的横截面分为长轴和短轴，当冰排平行于横截面短轴方向作用于弧线型桩腿时，迫使冰排发生弯曲破坏模式<sep>当冰排平行于横截面长轴方向作用于弧线型桩腿时，其尖端形成破冰刃切割冰排的抗冰模式。
19	一种既能风力发电又能吹风的装置<sep>本发明公开的一种既能风力发电又能吹风的装置<sep>包括基座，所述基座内设有吹风用加速腔，所述吹风用加速腔底壁内固设有吹风用电机，所述吹风用电机上侧的输出轴上固设有驱动主轴，所述驱动主轴上固设有大齿轮，所述吹风用加速腔底壁内转动连接有传动轴，所述传动轴上固设有啮合连接于所述大齿轮的小齿轮，所述大齿轮的齿数比所述小齿轮的齿数多，本发明相比于传统的风力发电装置，结构更小，适宜于居民使用，且本发明不仅能通过扇叶转动来进行风力发电<sep>还能通过控制装置改风力发电为吹风冷却
19	风力发电机组<sep>本发明实施例提供一种风力发电机组<sep>包括机舱和塔筒；机舱安装在塔筒的顶部，并且机舱和塔筒之间通过偏航轴承连接；在机舱的底部安装与偏航轴承同轴布置的转轴，在转轴上安装两个或两个以上间隔布置且相互绝缘的转子滑道，每个转子滑道对应与一根机舱电缆导通；在塔筒中设有与转子滑道一一配合的定子滑道，每个定子滑道与一根塔筒电缆导通<sep>本发明实施例提供的风力发电机组，机舱电缆和塔筒电缆通过滑环连接作为传输电力的主电缆，使机舱电缆相对于机舱处于相对静止状态，塔筒电缆相对于塔筒处于静止状态，从而使电缆在机舱偏航的过程中不会产生扭缆现象，从而可以降低主电缆的技术特性要求，无需电缆高耐扭，高耐磨性能，使得电缆成本降低
19	一种基于风能利用的隧道内监控设备<sep>本发明公开了一种基于风能利用的隧道内监控设备<sep>包括监控块，所述监控块内设有收纳腔所述监控块左右两侧对称设有两个自然风发电机构，所述自然风发电机构包括与所述监控块固定连接的连接块，所述连接块远离所述监控块的一端固定设有安置块，所述安置块内设有开口朝前的安置腔，所述安置腔内设有可转动的第一发电轴，本发明可利用隧道内来往车辆产生的风力进行发电供能，十分清洁环保，且成本很低，且根据来往车辆产生的风力大小可自动判断来往车辆的车速，并对超速车辆自动进行拍摄，较为智能化，维护交通法律法规，且能保证交通安全<sep>发明内设有防止隧道内自然风干扰的机构
19	风能设备的转子叶片和风能设备<sep>本发明涉及一种用于风能设备的具有吸入侧和压力侧的转子叶片(1)<sep>所述转子叶片具有：毂区域(i)的转子叶片根部(4)，用于将转子叶片(1)连接到转子毂上；和转子叶片尖部(5，7)，其设置在尖部区域(iii)的背离转子叶片根部(4)的一侧上<sep>根据本发明提出，在毂区域(i)的区域中，转子叶片至少部分地具有厚翼型，所述厚翼型在其后缘上具有刺状扩展部，其中在毂区域的区域中，厚翼型至少部分地在吸入侧具有在后缘上的第一刺状扩展部，并且在压力侧具有在后缘上的第二刺状扩展部，并且在毂区域的区域中，厚翼型至少部分地在吸入侧和/或压力侧上具有流动稳定器和/或涡流发生器
19	考虑逆变器限流特性的直驱式永磁同步风电机组控制方法<sep>本发明公开了一种考虑逆变器限流特性的直驱式永磁同步风电机组控制方法<sep>该方法包括如下步骤：设置逆变器输出电流限定值i，测量并网电流i、电压v，计算并网功率p；在整流侧控制器的转速外环中，将逆变器电流参考值i与限定值i比较，若i<i，则根据最大功率点来确定转速参考值ω；否则根据电流限定值i来确定并网功率参考值，由换流器效率确定风机的期望输出功率，进而确定风机的转速参考值ω；采用svpwm控制整流和逆变电路，使风机运行在确定的转速参考值下<sep>本发明方法当网侧故障使得逆变器电流快速上升时，风机的输出功率减小；同时逆变器电流受到限制，不会触发过电流保护，使风电机组能够在低电压下维持并网运行
19	一种柔性塔架风电机组停机、停机保护方法<sep>本发明公开了一种柔性塔架风电机组停机、停机保护方法。解决现有技术中风力发电机组在停机状态下受到涡流的影响的问题<sep>方法包括对在特定风速区间触发停机指令时采用设定停机流程，对停机状态下在风速进入特定风速区间时采用保护流程，设定停机流程和保护流程中都包括设定调节，通过调节叶片位置保持一片叶片垂直向下，调节机舱与主导风向夹角呈90°，使得能破还均匀的涡流场，避免了涡流在塔架周围产生均匀的周期性冲击而引起的共振
19	一种变速恒频风力发电系统<sep>本发明公开了一种变速恒频风力发电系统<sep>其特征在于，包括风能捕获模块、发电模块和变流器；所述风能捕获模块与发电模块的第二机械端口连接；所述发电模块的第一电端口连接变流器的一端，第二电端口自短路；第一机械端口不带负载；所述变流器的另一端连接电网；所述发电模块用于在无电刷磨损的情况下将风能转化为恒频输出的电能；所述变流器用于将发电模块产生的电能转换为电网所需的电能<sep>发电模块可等效为两电机，第一电机对风速变化自适应；第二电机完成转矩变化的自平衡；因此，本发明发电模块为无刷双机电端口电机不仅实现了变速恒频的发电，同时有效地避免了增速齿轮箱和电刷带来的机械磨损
19	一种能调整风电叶片空中姿态的吊具<sep>本实用新型公开了一种能调整风电叶片空中姿态的吊具<sep>涉及到风电设备安装、维护技术领域<sep>叶片夹具和取向调节机构，叶片夹具通过取向调节机构与起重机的吊钩连接<sep>取向调节机构包括一上平台、若干致动器、若干动滑轮、一柔性体和若干导向滑轮，上平台与吊钩连接，若干致动器和若干导向滑轮分别设置在上平台上，若干动滑轮分别设置在叶片夹具，柔性体连接若干致动器、若干动滑轮、若干导向滑轮和上平台可大幅提高叶片安装、拆卸的效率。
19	一种基于新能源的电池储能在多场景应用的控制装置<sep>本实用新型公开了一种基于新能源的电池储能在多场景应用的控制装置<sep>包括风能预测装置、光能预测装置、电池储能控制装置、电池储能装置，所述风能预测装置的上端表面设置测风元件<sep>本实用新型在调节机构的作用下，热镀锌钢支架可以通过调节角度来使得风能预测装置和光能预测装置监测不同角度的风能和光能，当需要调节时，则需要两位工作人员同时进行操作，将两端的手拧螺母拧松，然后使得热镀锌钢支架与支撑杆之间开始有效的活动，这样使得工作人员可以有效的将热镀锌钢支架进行角度改变，从而使得顶端安装的风能预测装置和光能预测装置跟随改变，则监测到各个角度的风能和光能数据，使得第一控制装置的控制策略更加精准，从而获取更多利益
19	操作风力涡轮机偏转组件的方法<sep>本发明描述了一种操作风力涡轮机偏转组件（1）的方法<sep>该风力涡轮机偏转组件（1）包括偏转环（2）和多个偏转驱动单元（3），其中，偏转驱动单元（3）包括被设置为与偏转环（2）接合的小齿轮（30），该方法包括如下步骤：识别偏转环（2）上的受损齿（20、20）；将损坏描述符参数（d、d）提供至偏转驱动控制器（10）；以及在损坏描述符参数（d、d）的基础上控制偏转驱动单元（3）以便减小由其小齿轮（30）施加在受损齿（20、20）上的力<sep>本发明进一步描述了一种风力涡轮机偏转组件（1）、风力涡轮机（5）以及计算机程序产品
19	一种海上风力发电控制系统及方法<sep>本发明公开了一种海上风力发电控制系统和方法<sep>包括发电机监测模块、海上风能监测模块、电力监测模块、风向监测模块、风叶监测单元、风叶控制单元、数据采集终端和总控终端，所述电机监测模块、海上风能监测模块、电力监测模块、风向监测模块、风叶监测单元、风叶控制单元、数据采集终端和总控终端之间通过无线通信模块进行信息交互，总控终端用于集成第一控制信息、第二控制信息、第三控制信息、第四控制信息、第五控制信息和第六控制信息后进行控制操作<sep>通过本发明系统和方法，能够综合各种采集数据共同对发电机进行控制，能从环境因素和发电机自身参数角度出发综合对发电机进行控制，能够提高海上风力发电的稳定性，能够更好利用风能。
19	一种面向电池热管理的风冷系统导流板形状优化方法<sep>本发明公开了一种面向电池热管理的风冷系统导流板形状优化方法<sep>所述方法从均匀的主流道截面宽度分布出发，数值求解风冷系统的冷却流道流量，从远离入口或出口的冷却流道出发往入口或出口方向，通过依次调整每个主流道截面宽度，选出使系统目标函数最优的流道截面宽度。假设每个主流道截面宽度调整一次为一轮调整，通过反复多轮调整，不断逼近最佳截面宽度分布。当一轮调整中，目标函数值不再变化时，调整过程中记录的最佳目标函数值对应的主流道截面宽度分布为最佳分布。最后，由得到的最佳截面宽度分布，通过多项式拟合得出最终光滑的导流板形状<sep>本发明具有优化过程简单、性能指标好、扩展性好、实用性强等优点
19	一种风力发电机的故障检测方法和系统<sep>本发明公开了一种风力发电机的故障检测方法和系统<sep>该方法包括：从正面以预设频率采集风力发电机在运行中的叶片视频；通过叶片视频获取风力发电机的各叶片在旋转平面内的挥舞振动波形；比较各个叶片的挥舞振动波形，判断是否存在振动差异，若存在振动差异，则判断风力发电机的叶片存在故障，若不存在振动差异，则判断风力发电机的叶片健康<sep>本申请通过采集风力发电机在运行中的叶片正面视频，获取各叶片在旋转平面内的挥舞振动波形，通过单机叶片对比来判断风力发电机是否存在故障，具有非接触式测量、不影响风力发电机结构和运行的优点，成本更低，应用简单，检测可以覆盖叶片全部，足够全面
19	一种风力发电远程监控系统及其工作方法<sep>本发明涉及一种风力发电远程监控系统及其工作方法<sep>所述风力发电远程监控系统包括：云服务器、监控终端和风力发电机；其中所述风力发电机包括：控制模块，与该控制模块相连的数据采集模块和报警模块；所述数据采集模块适于采集风力发电机的运行参数，并发送至云服务器；所述云服务器存储有运行参数数据的阈值范围；当云服务器接收到的运行参数数据在阈值范围内，则保存运行参数数据；否则将运行参数数据和相应的报警信息发送至监控终端<sep>本发明的风力发电远程监控系统通过云服务器和监控终端能够远程监控风力发电机的工作情况，一旦发生异常，监控终端即能收到报警信息和当前风力发电机的运行参数数据，便于监控端及时采取相应措施。
19	一种基于改进多智能体一致性算法的风电场有功调度方法<sep>本发明公开了属于风电场有功调度技术领域的一种基于改进多智能体一致性算法的风电场有功调度方法。该方法针对风电场机组众多、运行工况复杂的特性<sep>在传统变比例分配算法的基础上进行了改进，并提出了风机动态分组的有功调度方法，将多智能体一致性算法运用于风电场有功调度的分布式调度方法中，避免了集中式调度的缺陷<sep>最后，对传统的多智能体一致性算法进行了改进，针对风机分组调度的策略，提出了分段更新的虚拟一致性调度方法，实现了对风电场风机的有功调度，能够有效实现对风电场在不同工况下风机的有功调度，充分利用风机调节裕度，减少控制系统动作次数，不仅降低了调度成本，还降低了更新算法的难度，增强了工程实践的可行性
19	一种风力发电机风功率曲线补偿控制装置及方法<sep>本发明公开了一种风力发电机风功率曲线补偿控制装置及方法<sep>所述装置包括可调谐振网络、风速传感器、霍尔传感器、微控制器、ac‑dc电路、开关切换电路和负载；风速传感器与微控制器相连；霍尔传感器与微控制器相连；ac‑dc电路的输入端和可调谐振网络相连或风力发电机输出相连，ac‑dc电路的输出端与负载连接；可调谐振网络的输入端与开关切换电路的亚匹配状态线路连接，输出端连接负载<sep>本发明通过在亚匹配状态下调节谐振频率的同时控制品质因数调节，使得在风速降低的过程中，风力发电系统能在瞬时风速下实时达到最大发电功率，减小已吸收能量损失的同时提高了风能利用率，使风力发电效率较于传统风力发电机大大提高
19	基于尾流效应因子的海上风电场等值方法、系统和装置<sep>本发明公开了一种基于尾流效应因子的海上风电场等值方法、系统和装置<sep>其中，所述方法包括以下步骤：获取海上风电场参数，其中，海上风电场参数包括海上风电场的来流风速、海上风电场中每台风电机组的位置信息、风轮半径、衰减常数和推力系数；根据海上风电场参数确定每台风电机组的尾流效应因子；根据尾流效应因子对海上风电中的风电机组进行分群；分别计算每个风电机组群的等值参数；根据每个风电机组群及其等值参数建立海上风电场等值模型<sep>该方法简单易实现，占用内存空间较少且准确度较高，可适用于大规模海上风电的研究
19	海上风电桩立桩施工船<sep>本实用新型提出一种海上风电桩立桩施工船<sep>属于海上风电桩基施工技术领域<sep>其能够独立完成海上风电桩的立桩施工，且其结构简单，施工成本低<sep>该立桩施工船包括船体，船体上设有放置区，放置区的一侧位于船体的一侧边缘处；以放置区位于船体边缘的一侧为前侧，放置区的前侧设有翻桩器；船体上还设有支撑架，支撑架包括对称设置于放置区左右两侧的两根立柱，两根立柱的上部均从放置区的前侧伸出船体；两根立柱分别安装有吊装装置，吊装装置连接风电桩直立时的上部；两根立柱的顶部分别设有抱桩器，两个抱桩器对称设置；船体上设有第一卷扬机，第一卷扬机缠绕有第一缆索，第一缆索连接有托底钩
19	一种风机控制方法<sep>本申请公开了一种风机控制方法<sep>包括将风机运行参数输出至就地控制屏与远程控制屏；接收所述就地控制屏和/或所述远程控制屏基于所述风机运行参数生成并发送的控制指令；解析所述控制指令并根据所述控制指令对风机进行控制。该风机控制方法不仅能够实现就地控制还可以实现远程控制，从而当风机运行参数存在异常时，可以通过远程控制屏第一时间及时向风机的中央控制器发送控制指令，以控制风机进行相应的操作，而无需技术人员达到现场利用就地控制屏进行就地控制，由此可以有效保障风机控制的及时性，降低飞车等恶性事故发生的概率<sep>本申请还公开了一种风机控制装置、系统以及计算机可读存储介质，均具有上述技术效果
19	一种含经风电场并网vsc-hvdc的最优潮流计算方法及装置<sep>本发明公开了一种含经风电场并网vsc‑hvdc的最优潮流计算方法<sep>包括如下步骤：建立风电场的有功出力模型和计及换流器损耗的vsc‑hvdc的数学模型；采用自回归滑动平均模型和基于kantorovich距离的场景削减策略模拟风电功率的不确定性，根据所述风电场的功率模型获取有限个风电场景集；采用内点法对所述有限个风电场景集和所述计及换流器损耗的vsc‑hvdc的数学模型进行最优潮流计算，得到输出变量的数字特征。本发明公开的含经风电场并网vsc‑hvdc的最优潮流计算方法能有效解决现有技术无法获得准确的输出变量的数字特征，计算过程复杂和计算效率低的问题<sep>本发明实施例还公开了一种含经风电场并网vsc‑hvdc的最优潮流计算装置
19	一种风力发电机蓄电池组固定架<sep>本实用新型涉及一种风力发电机蓄电池组固定架<sep>包括上固定板和下固定板，所述上固定板和所述下固定板之间设置有伸缩套杆，所述上固定板的下表面设开设有若干第一卡槽，所述第一卡槽内设置有压簧，所述压簧远离所述第一卡槽的一端固定设置有压板<sep>所述下固定板的上表面固定设置有卡块，所述卡块的顶部设置有若干与所述第一卡槽对应设置的第二卡槽，当把蓄电池组放入至所述第二卡槽之后，通过调节所述伸缩套杆，使得所述第一卡槽对蓄电池组进行的侧壁进行限位，通过所述压板、压簧的对蓄电池组的顶部进行压紧，从而保证蓄电池组放置的稳固性，不仅结构简单，安装取出还方便。
19	一种地铁隧道顶部用风力发电装置<sep>本发明提供了一种地铁隧道顶部用风力发电装置<sep>本发明包括如下结构：风力叶片，传动装置，转轮轴，发电机。本发明可应用于地铁隧道的顶部，当地铁通过装置下方时，高速运行的车辆带动起大量的高质量风能，通过风力叶片的作用，这些风能转化机械能，通过传动装置将所述机械能依次传递给转轮轴、联轴器、电机轴，最终，利用发电机将机械能转化为电能<sep>本发明具有占用空间少，安装方式简单，节能环保等优点
19	风电场场群控制方法和设备<sep>本发明提供一种风电场场群控制方法和设备<sep>所述风电场场群控制方法包括：获取风电场的各个风电机组所在位置的历史风资源数据；基于各个风电机组所在位置的历史风资源数据对各个风电机组进行载荷适应性评估，以确定各个风电机组的最大功率输出值；根据各个风电机组的最大功率输出值设置各个风电机组的功率闭环控制的功率给定值；按照设置的功率给定值对各个风电机组进行功率闭环控制<sep>根据本发明的实施例的风电场场群控制方法和设备，可充分挖掘各个风电机组的发电潜力，充分利用风电场的风资源，提高风电场的整体发电量，以及可实现风电机组在全年不同空气密度条件下满发功率的恒定，避免因不同季节导致满发功率波动的情况
