label_id	text
19	一种风力发电机组参与系统调频的综合控制方法及系统<sep>本发明公开一种风力发电机组参与系统调频的综合控制方法及系统<sep>所述方法包括：获取风电厂并网点的系统频率、发电机组受到的风速v和发电机组电机转速；通过辅助转速控制器和辅助频率控制器进行有功功率控制；辅助转速控制器进行有功功率控制包括判断发电机组电机转速与发电机组受到风速v时对应的最优转速ω及1.01ω的大小，得到对应的第一标记值，根据第一标记值，确定辅助转速控制器是否参与控制<sep>通过辅助转速控制器对发电机组电机转速的控制，防止发电机组向电网注入的有功功率大于发电机组可捕获的最大机械功率时，发电机组电机转速持续下降，最终造成停机的现象，提升系统工作的鲁棒性
19	基于lstm的含储能电力系统风电爬坡协调调度方法<sep>本发明的公开了一种基于lstm的含储能电力系统风电爬坡协调调度方法<sep>首先，利用lstm神经网络对风功率爬坡事件进行提前多步预测；然后，提出一种应对风电爬坡事件的提前‑滞后调节方法，利用储能系统进行提前滞后两步补偿，降低风功率爬坡时的速率，同时降低了对储能功率和容量的需求；基于上述预测和调节方法，建立了考虑风电爬坡事件的火储协调调度模型，提前协调机组，使机组在爬坡时有足够的可调备用容量，通过对不同的风电爬坡条件的判断协调机组和储能，实现更经济和安全的爬坡调度方案<sep>通过对预测方法的性能测试和爬坡调度仿真，验证了预测方法、调节方法和调度模型的有效性
19	用于风能设备的传动机构<sep>本发明涉及一种用于风能设备的传动机构(1)<sep>其具有以能围绕转子轴线(10)转动的方式布置的太阳轮(11)，该太阳轮能与所述风能设备的转子联接，在太阳轮(11)的周向上分布地布置有多个卫星单元(12)，所述多个卫星单元与太阳轮(11)作用连接，通过所述卫星单元能驱动能分派给所述卫星单元(12)的发电机(13)<sep>根据本发明，所述卫星单元(12)具有与太阳轮(11)分别接合的两个齿轴(14)和一个从动轴(15)，所述从动轴(15)与两个齿轴(14)相接合并且能与所分派的发电机(13)联接，卫星单元(13)模块化地实施并且以能分离的方式布置在太阳轮(11)上
19	一种风场参与调频方法及系统<sep>本发明实施例提供一种风场参与调频方法及系统<sep>该方法包括：对风电机组转子动能进行控制和功率备用调频控制；建立不同风速工况下每一风电机的综合调频控制策略；基于风速的变参数减载功率协调分配系数，建立风速、风电场减载总功率与每一风电机减载功率的量化计算关系；获取减载分配后每一风电机组的出力<sep>本发明实施例充分考虑了风场内部减载功率分配方式对整个风电场调频能力的影响，协调分配各风机的出力，适应集群化风电场内部风电机组间的风速分布差异，充分发挥风电场的调频能力
19	风力涡轮机的基于激光雷达的多变量前馈控制<sep>总之<sep>本发明涉及一种用于风力涡轮机的控制系统，其包括：‑向前馈送控制器，其具有风力涡轮机的转子有效风速作为输入参数并且具有多个输出参数；‑反馈控制器，其中输入参数是基于风力涡轮机的转子速度或发电机速度并且具有至少一个输出参数<sep>并且其中，ο向反馈控制器提供向前馈送控制器的一个输出参数作为输入参数，以及ο将向前馈送控制器的另一输出参数用作用于控制风力涡轮机的向前馈送控制参数，以及ο将反馈控制器的一个输出参数用作用于控制风力涡轮机的反馈控制参数，以及涉及一种风力涡轮机和一种控制方法。
19	一种垂直轴风力发电机<sep>本发明公开了一种垂直轴风力发电机<sep>包括底座，所述底座顶部的中点处固定连接有立杆，所述立杆的顶部固定连接有套杆，所述套杆表面的顶部和底部均套设有固定环，所述固定环内壁对应套杆的位置均开设有半圆形凹槽，所述半圆形凹槽的内部活动连接有与其相适配的滚珠<sep>本发明通过设置套杆、固定环、半圆形凹槽、滚珠、固定块、环形限位槽、限位杆、转块、挡块、连接板、连接杆、旋转叶片、限位圈与拉杆，实现了一种旋转更加稳定的垂直轴风力发电机，在叶片旋转过程中，首先降低了叶片对主轴产生的摩擦力，使其旋转更加稳定，而且将叶片旋转时的离心力分散在主轴上，因此使得本装置更加经久耐用
19	利用扑翼的俯仰-摇摆耦合运动采集风能的发电装置<sep>本发明涉及一种利用扑翼的俯仰‑摇摆耦合运动采集风能的发电装置<sep>包括摇臂，其上部铰接有伸缩装置，摇臂下部设置有配合其的摇摆运动以来回转动的气缸结构，气缸结构内具有密封的腔室；扑翼，其可活动地套设在摇臂的上部，伸缩装置的另一端与扑翼的一侧边铰接；以及磁流体发电机，其包括c形永磁铁、与c形永磁铁相对设置的磁场的磁流体以及通过电路与磁流体连接的电极，c形永磁铁套设在气缸结构外，磁流体设置在腔室内且其随着气缸结构做来回转动的过程中切割c形永磁铁产生的磁场从而产生电压和电流，电压和电流通过电极输出<sep>本发明结构简单且紧凑，其通过风能提供主要动力进行发电，节约了能源且能进行有效发电
19	基于全向角度风力发电供电的电力杆塔位移形变监测终端<sep>本发明涉及一种基于全向角度风力发电供电的电力杆塔位移形变监测终端<sep>包括mems传感器、存储单元、处理器、载波相位测量单元、网络传输单元、摄像装置，与全向角度风力发电装置。本发明除了能够监测杆塔的位移信息，还能够提供清晰、直观的现场工况。由于电力杆塔多在偏远山区，采用全向角度风力发电装置作为工作电源，可长期为监测终端进行供电，解决了设备在野外没有合适电源的问题。本发明的全向角度风力发电装置结构简单，体积小，重量轻；能接受不同方向的风能进行发电，效率高；有利于降低后期运维成本，并且不造成环境污染<sep>同时，本发明的技术思路也为其他户外监控、测量等设备提供一种供电方案的参考技术方案
19	一种安全可靠的有利于生态环境的智能型风力发电机<sep>本发明公开了一种安全可靠的有利于生态环境的智能型风力发电机,包括承重基座<sep>所述承重基座上端面设置有一发电机壳，所述发电机壳内设置有一传动腔，所述传动腔上端壁内设置有一推动机构，所述推动机构包括推动腔，所述推动腔下端壁左侧内设置有一旋转腔，所述推动腔上端壁设置有一推动轴，所述推动轴下端设置有一凸轮<sep>本发明工作中，该装置在发电轴转速过高时，通过机械的传动降低传递的转速，从而避免超出发动机的额定转速，从而避免影响装置的正常工作，同时不浪费的使用发电轴较高的转速，使风扇叶的转速提高，从而加快由于发电机极限发电产生的过量的热的去除，从而提高装置运行的稳定性。
19	风机运行控制方法、控制装置、制冷设备和存储介质<sep>本发明提出了一种风机运行控制方法、控制装置、制冷设备和存储介质<sep>其中，风机运行控制方法包括：在检测到制冷设备上电运行时，采集制冷设备的环境温度；确定环境温度所属的温度阈值范围，以确定温度阈值范围对应的启动参数；根据预设的采集频率分别采集冷藏室温度与冷冻室温度；根据冷藏室温度与第一预设温度阈值之间的关系，以及冷冻室温度与第二预设温度阈值之间的关系，确定对应的调节参数<sep>通过本发明的技术方案，提高了使用过程的便捷性，实现了冷藏室与冷冻室的快速降温的同时，制冷设备的节能操作
19	一种风力涡轮机<sep>本发明公开了一种风力涡轮机<sep>包括立柱，所述立柱上端面固设有固定块，所述固定块内安装有蓄电池，所述蓄电池前侧设有环形转腔，所述环形转腔内转动设有齿环，所述齿环下侧啮合连接有啮合齿轮，所述啮合齿轮的轴心处固设有转轴，所述转轴前端与所述环形转腔前端壁转动连接，所述环形转腔后端壁内安装有第一发电机，本发明工作中，转子叶片的角度可调节，使得风能利用率最大，其次，在恶劣天气使用时，可通过控制转子叶片的方向，以减小转子叶片及涡轮转块的转速，从而对装置起到保护作用，且在保护状态下<sep>转子轴内设置的转动叶片可转动工作进行发电
19	一种风力发电机平衡机构<sep>本发明公开了一种风力发电机平衡机构<sep>本发明的平衡调节装置能够施力于各个所述连杆，进而控制平衡支撑环对内固定拉环的平衡拉力以及平衡拉力的角度与方向；本发明还包括控制器，控制器与风力发电机的风叶的转速检测器反馈连接，这样，可以根据所述风叶的转速来自动调节各个拉杆的拉力情况，进而调节平衡支撑环的中心轴线与所述内固定拉环的中心轴线之间的角度<sep>且所述风叶的转速越大，所述角度越大，有效的保证转速较大时偏心力过大时的支撑能力。
19	风电变流器装置和变流器装置<sep>一种风电变流器装置<sep>包含：多个网侧变流器、多个机侧变流器以及直流母线模块。网侧变流器各包含电性耦接于电网的网侧输出端口与第一及一第二直流输入端口，且任两个相邻的网侧变流器分别包含的第二与第一直流输入端口相串联。机侧变流器各包含电性耦接于发电机装置的机侧输入端口与第一及第二直流输出端口，且任两个相邻的机侧变流器分别包含的第二及第一直流输出端口相串联<sep>直流母线模块电性耦接于网侧变流器及机侧变流器间
19	一种提高风电消纳的热电联合调度方法<sep>本发明公开了一种提高风电消纳的热电联合调度方法<sep>涉及大电网调度领域<sep>本发明计算热电机组初始与实际碳配额，通过比较限定热电机组因热负荷增加的不断出力，多余热负荷由蓄热式电锅炉供给；然后通过弃风给电储能充电；然后为降低含蓄热式电锅炉和电储能系统调控难度，建立了用于负荷分配和信息传递的热‑协‑电多代理模型；然后建立了仅考虑煤耗成本的优化模型；最后采用引入动态惯性权重和压缩因子改进粒子群算法对模型求解。本发明方法使系统在保证运行可靠性的情况下，能够减少系统成本，提高风能利用率<sep>利用matlab 7.10进行仿真，验证了该方法的合理性和有效性，证实了利用蓄热式电锅炉供给热负荷和利用弃风给电储能充电，均提高风电利用率
19	可变翼展风筝风力机<sep>本发明公开了一种可变翼展风筝风力机<sep>包括由系留缆索组连接的铰链帆、地面主机；按风阻面的形心位置对系留缆索组的张力及所受风载力矩的影响，铰链帆按对称面重合分为张力帆和力矩帆；力矩帆基于结构实现传统板式风筝的滞空机理和滞空可靠性；张力帆基于自身风载和轴对称平面连杆机构的特性，即时响应地面主机对收卷动力的开/关控制和对联动的动力及位置的限定，使其受结构限定仅与系留缆索组的张力相关的风载随铰链帆的往复运动方向自适应的“收/小、放/大”<sep>因而使可变翼展风筝风力机的风能转换高度与风载的受控变化无关、机群阵列密度与铰链帆的运动无关、占地面积的功率容限仅取决于可变风阻面积沿系留缆索组串接后的机械可靠性。
19	一种直驱永磁风电系统耗散能量稳定性检测方法及系统<sep>本发明涉及一种直驱永磁风电系统耗散能量稳定性检测方法及系统<sep>属于风力发电技术领域<sep>该方法包括以下步骤：s1，获取所述直驱永磁风电系统的运行数据；s2，根据所述运行数据计算直驱永磁风电系统耗散能量；s3，根据所述直驱永磁风电系统耗散能量对系统进行稳定性检测<sep>本发明构建出网侧变流器锁相环控制、电流环控制以及并联svg控制环节的风电系统耗散能量模型，基于该耗散能量模型对直驱风电系统进行稳定性检测，实现风电并网系统稳定性的实时检测
19	一种双速永磁风力发电系统<sep>本发明公开了一种双速永磁风力发电系统<sep>包括：同轴连接的叶轮、双速永磁电机、变流器和变压器；所述叶轮与所述双速永磁电机的输入端连接，所述双速永磁电机的输出端与所述变流器的输入端连接，所述变流器的输出端经过所述变压器与电网连接；所述双速永磁电机能够产生两种不同极对数的磁场，实现两个额定工作转速，用于将所述叶轮捕获的风能转化为电能；所述变流器，用于通过开关切换所述双速永磁电机定子绕组的工作状态，对电能转换过程进行监测和处理<sep>本发明的双速永磁风力发电系统功率密度大，电机效率高，且双速永磁电机产生能够两种不同极对数的磁场，实现两个额定工作转速，增大了转速调节范围，提高了风能转化效率
19	一种风力发电塔筒用升降平台<sep>一种风力发电塔筒用升降平台<sep>包括涡轮，涡轮通过轴承安装在塔筒的外周顶部，涡轮的底面固定安装第一伞齿轮，伸缩杆的一端固定安装第三转轴，第三转轴的外周轴承安装相同的带轮，挡板的另一侧下部固定安装拉簧的一端，拉簧的另一端与电推杆固定端底部固定连接，第二环形套的另一端开设数个凹槽，第二环形套的外周开设数个第一螺孔，第一螺孔与凹槽内部相通，第一弧形套的另一端固定安装数个卡块，卡块能够同时位于对应的凹槽内，卡块的前面开设第二螺孔，第二螺孔的中心线能够与对应的第一螺孔的中心线共线<sep>每个第一螺孔与对应的第二螺孔共同安装螺栓
19	一种水平轴风力发电机叶片用外置式微波除冰装置和方法<sep>本发明提供了一种水平轴风力发电机叶片用外置式微波除冰装置及方法<sep>外置式微波除冰装置包括移动机构和加热机构，所述加热机构设置在所述移动机构上，通过移动机构使加热机构沿风力发电机塔筒的外壁上下移动，加热机构配置有伸展臂和变形臂，伸展臂用于将变形臂推送到叶片附近或抽离叶片表面，变形臂上设置有积冰监测装置和微波发射装置，通过积冰监测装置观察叶片表面的积冰情况，并适时开启微波发射装置对叶片表面积冰区域进行加热<sep>除冰过程采用自上而下的除冰方式使得除冰效果彻底
19	一种风力发电出力分布特性计算方法和系统<sep>本发明公开了一种风力发电出力分布特性计算方法<sep>包括：收集风电场在预设时间内的历史风电出力数据，计算历史风电出力数据的功率标幺值；获取历史风电出力数据的时间尺度以及时间分辨率；将功率标幺值按照从小到大的顺序进行排序，得到有序的功率标幺值的数据集合；根据时间分辨率和时间尺度计算功率标幺值的数据集合中每一数值对应的持续时间标幺值；根据功率标幺值和持续时间标幺值输出风电场出力持续曲线；获取风电场出力持续曲线中与预设直线之间的交点的横坐标，交点的横坐标即为风电出力分布特性指数。本发明还公开了一种风力发电出力分布特性计算系统<sep>采用本发明实施例，能对风力发电进行快速、高效、简单、准确的分布特性分析
19	风能设备转子叶片<sep>提出一种风能设备转子叶片(200)<sep>其具有：吸入侧(201)，压力侧(202)，钝后缘(200c)和后缘扩展单元(500)，所述后缘扩展单元设置在钝后缘(200c)上并且具有至少两个阶梯部，其中后缘扩展单元(500)具有第一和第二部段(530，540)，其中从钝后缘(200c)至第一部段(530)的过渡部基本上不垂直地构成<sep>并且在第一和第二部段(530
19	用于移除或安装被安装在风力涡轮机的机舱中的发电机的定子部段的方法<sep>本发明描述了用于移除或安装被安装在风力涡轮机的机舱中的发电机的定子部段（981）的方法、以及用于移除或安装被安装在风力涡轮机的机舱中的发电机的定子部段（981）的更换装置（100）<sep>该方法包括：将更换装置（100）的提升机构（110）联接到多条提升绳索（512），其中，所述多条提升绳索（512）被固定至风力涡轮机的毂（471）；通过提升机构（110）将更换装置（100）自提升到毂（471）；将更换装置（100）紧固到毂（471）；使毂旋转（471），使得更换装置（100）与待移除的定子部段（981）对齐；以及在发电机的定子与更换装置（100）之间运送定子部段（981），以用于移除或安装定子部段（981）
19	便于安装的风力发电机叶片清洗装置<sep>本发明公开了一种便于安装的风力发电机叶片清洗装置,包括多个等距间隔设置的清洗机构<sep>所述清洗机构包括第一活动壳体和第二活动壳体，所述第一活动壳体和第二活动壳体上分别等距间隔设有多个用于对风力发电机叶片除垢处理的清理件,所述第一活动壳体上设有用于对风力发电机叶片烘干处理的烘干机构，还包括用于储存该装置的储存箱，所述储存箱包括用于放置该装置的储存箱体和用于启闭储存箱的盖板<sep>通过上述结构的设置，使得该装置可以通过储存箱体进行储存保护，避免装置轻易的损坏，保证了该装置的安全可靠性。
19	一种带有润滑功能的风力发电设备<sep>本发明公开了一种带有润滑功能的风力发电设备<sep>包括所述机体内设有加速齿轮腔，所述加速齿轮腔右侧设有传动腔一，所述加速齿轮腔左侧设有发电腔，所述发电腔左侧壁固定安装有发电机，所述发电机右侧壁转动安装有延伸至所述加速齿轮腔内的输出轴，所述加速齿轮腔与所述传动腔一之间转动设有向右延伸至所述机体外的输入轴<sep>本发明操作简便，制造成本低，可以通过所述滑杆沿着所述导向槽一左右滑动将所述油箱内的润滑油喷射在所述加速齿轮组上对其润滑，可以通过所述过滤网一对润滑后的润滑油进行过滤，并通过所述推块将过滤出的杂质推入所述杂质腔内，防止所述过滤网一的过滤孔堵塞。
19	一种风力发电机<sep>本发明公开了一种风力发电机<sep>包括塔架和内部设有活动槽的固定块，固定块上设有与活动槽相连的弧形槽和直槽，弧形槽与直槽相连通，塔架上垂直设有立柱、塔架上转动地设有旋转叶片，立柱的内壁固定有步进电机，步进电机的输出轴上连接有旋转机构、位于旋转机构下方的传动机构，固定块固定在旋转机构上，固定块内转动地设有穿过固定块、立柱的侧壁后连接在传动机构上的往复螺杆<sep>本发明的优点在于：无需攀爬就可通过步进电机带动连杆上的海绵移动，从而自动清洁旋转叶片和上部分的立柱，从而防止危险
19	一种具有减速功能的拆装便捷的风力发电机<sep>本发明涉及一种具有减速功能的拆装便捷的风力发电机<sep>包括机壳、发电机、驱动轴、安装柱和三个浆叶，还包括拆装机构和减速机构，所述拆装机构包括驱动组件、安装板、安装轴承、两个传动杆、两个连接组件、两个加固条和两个条形槽，所述减速机构包括动力组件、摩擦盘和两个减速组件，所述减速组件包括固定套管、气缸、摩擦块和移动杆，所述连接组件包括转动套管、固定轴和两个固定块，该具有减速功能的拆装便捷的风力发电机中，通过拆装机构提高了机壳与安装柱之间拆装的便捷度，提高了操作人员维修风力发电机的便捷度，通过减速机构可以控制驱动轴的转速<sep>降低了发电机发生超负荷运行的几率
19	风力涡轮机及在风力涡轮机中引起增升周期性失速的方法<sep>一种风力涡轮机<sep>包括：转子；叶片；以及周期性失速系统。周期性失速系统选择性地以振荡运动移动叶片的至少一部分，由此迎角连续改变以引起周期性失速<sep>周期性失速系统可移动整个叶片或者仅移动叶片的一部分，例如襟翼
19	风电球墨铸铁轮毂浇注控制方法改进工艺<sep>本发明提供风电球墨铸铁轮毂浇注控制方法改进工艺<sep>步骤包括(1)铁水包修护；(2)熔炼原料熔炼成铁水并清除浮渣；(3)铁水包内布置球化剂，将铁水倒入铁水包进行球化，并去除球化后渣；(4)铁水液面覆盖混合保温剂，其中混合保温剂由集渣剂与保温覆盖剂按照质量比1:(0～2)混合制成；(5)浇注铸件<sep>本发明主要通过改变熔炼浇注工艺方式来防止风电球墨铸铁轮毂铸件夹渣及解决铁水温度控制方面的问题，熔炼铁水前各设备进行清理，防止一次渣进入铸型；铁水液面覆盖混合保温剂能够避免球化衰退并且有效防止铁水温降过快，混合保温剂配比后可满足铁水直接浇注无需反复除渣的要求，提高了生产效率
19	一种带钢筋笼的风力发电机混凝土转接岩石基础<sep>本实用新型公开了一种带钢筋笼的风力发电机混凝土转接岩石基础<sep>包括基座；基座为内部按照计算配设钢筋的混凝土浇筑件，基座内部两侧端部设置了钢筋笼；基座的一侧布置有一圈预应力锚杆，基座通过预应力锚杆与基岩连接，基座远离预应力锚杆布置侧设有用于与风力发电机固定连接的第一钢环，第一钢环连有用于与第二钢环连接的一圈以上螺栓，第一钢环、第二钢环及一圈以上的螺栓围为环形螺栓笼，螺栓笼锚入基座中的钢筋笼，预应力锚杆布置在螺栓笼的外侧<sep>本实用新型的一种带钢筋笼的风力发电机混凝土转接岩石基础尺寸小，物料及运输成本低廉；施工开挖量小，人工成本低且施工难度低，相比于传统重力式基础，极大地减少了碳排放，极具应用前景
19	一种双馈风电并网系统稳定性调整系统及方法<sep>本发明涉及一种双馈风电并网系统稳定性调整系统及方法<sep>属于风力发电系统技术领域<sep>解决了现有技术中针对双馈风电并网系统中机网耦合难以量化分析及调整系统稳定性的难题。该方法包括如下步骤：在产生低频振荡的电网系统中采集双馈风电机组端口电压和电流数据，计算双馈风电机组端口实时动态能量；根据计算得到的实时动态能量，得到双馈风电机组耗散强度；根据双馈风电机组耗散强度评估得到双馈风电机组对低频振荡的阻尼水平；基于锁相环参数对双馈风电机组阻尼水平的影响规律，调整锁相环参数，提高双馈风电机组的阻尼水平，直至阻尼水平满足要求为止<sep>本发明能够实现及时的振荡稳定预警，通过调整锁相环参数实现系统的稳定性调整
19	一种船舶节能发电设备<sep>本发明提出了一种船舶节能发电设备<sep>包括发电部、位于发电部上方的风力部以及位于发电部下方的水力部，发电部包括外转子、内转子和集电环，外转子上部连接风力部的风力传动轴，风力传动轴通过风力固定轴承一和风力固定轴承二转动连接风箱，风力传动轴上设有均匀分布的风力叶片，风力传动轴上部还设有监测风力传动轴旋转方向和转速的风力转速传感器，风箱外侧设有多个进出风的集风口，集风口上设有控制挡风板旋转的转轴，转轴连接控制电机；本发明设计的转轴和挡风板实现对风向和风力传动轴转速的控制，避免出现外转子和内转子同向旋转的问题，使设备更加稳定和高效<sep>设计的伸缩器控制内转子在外转子内上下移动且能使水箱进入水里和离开水面。
