label_id	text
21	一种nbse单晶层状纳米片的合成装置及其合成方法<sep>本发明公开了一种nbse单晶层状纳米片的合成装置及其合成方法<sep>本发明通过以载气控制气流，精确控制生长环境氛围，即便在气相输运过程中载气源参与反应，也能合成纯净的nbse单晶层状纳米片，全部过程只需要使用封闭石英管在水平管式炉中生长，时间、经济成本大大降低，制备方法简单；表征结果均良好，实际样品可随意取用，将产率效率提升数个数量级；控制因素主要依赖于生长温度与时间、源与沉积衬底的间距、载片的形状结构、退火时间等，参数易于控制，重复性良好；本发明的方法能够制备出大量nbse单晶层状纳米片，待通过进一步的条件控制掺杂浓度后将对nbse纳米线乃至其他所有过渡金属二硫族化合物纳米结构的生长提供新方案，本发明具有重要参考意义
21	一种荧光二氧化硅-ctab复合纳米材料及其制备工艺<sep>本发明公开了一种荧光二氧化硅‑ctab复合纳米材料及其制备工艺<sep>属于纳米材料制备技术领域<sep>复合纳米材料由二氧化硅和ctab组成，二氧化硅和ctab的质量比为(0.66～1.032)：(2～3.35)；本发明提供一种荧光二氧化硅‑ctab复合纳米材料，在365nm紫外光照射下，在400～750nm具有显著的发射光谱，具有微秒级的荧光寿命以及具有很强的荧光稳定性，即使置于自然环境中12个月之后和经365nm紫外光持续照射24h后，其荧光性能依然保持稳定<sep>本发明提供一种荧光二氧化硅‑ctab复合纳米材料的制备工艺，该工艺重复性好，而且制备周期短、成本低，便于推广为大规模工业化生产。
21	高折射率纳米杂化消光材料及其制备方法<sep>本发明提供一种高折射率纳米杂化消光材料及其制备方法<sep>属于光学材料领域<sep>解决消光材料折射率低导致用于高折射率光学元上消光能力差的问题。该消光材料包由a、b组分，a组分：四溴双酚a环氧树脂10～35份、纳米二氧化钛5～15份、络合剂5‑15份、超细活性碳粉5‑10份、高色素炭黑2～8份、助剂2‑8份、无机填料4～13份、混合溶剂10～42份；b组份：固化剂5‑32份、混合溶剂5‑32份、氨基化石墨烯0.5‑3份。制备a组分：将纳米二氧化钛、络合剂、一部分溶剂混合分散；将一部分四溴双酚a环氧树脂、一部分助剂、高色素炭黑和另一部分溶剂分散；将剩余a组分原料分散；上述全部分散液混合。将固b组分原料超声分散<sep>该消光材料具有较高的折射率、制备方法简单
21	一种纳米金电极的制备方法<sep>本发明提供一种纳米金电极的制备方法<sep>属于电化学领域<sep>该方法先通过水平激光拉制仪制备石英纳米管；然后将石英纳米管通过碳电极烧制设备制备成为碳纳米电极；最后将碳纳米电极通过电化学计时安培法在制备好的碳纳米电极的尖端上沉积金，得到纳米金电极。本发明是利用电化学修饰方法，将碳纳米电极的尖端进行特定的修饰，所得修饰后的电极利用电化学手段进行表征，来验证纳米电极制作的是否成功<sep>利用这种电化学修饰在纳米碳电极尖端处沉积金的方法，操作简单，耗费时长少，效率高，可控尺寸，易于实现与重现
21	一种石墨烯电热膜生产用外膜换卷装置<sep>本实用新型公开了一种石墨烯电热膜生产用外膜换卷装置<sep>包括工作支架，工作支架两侧内壁上都铰接有上轴承座和下轴承座，上轴承座的下端铰接有拉伸液压缸一的输出端，拉伸液压缸一的另一端铰接在工作支架上，下轴承座的下端铰接有拉伸液压缸二的输出端；上轴承座和下轴承座分别可转动的安装有上膜辊和下膜辊；工作支架内壁固定有上承接板、下承接板和气缸一固定板，气缸一固定板下端固定安装有气缸一，气缸一的输出端固定安装有上膜热封板；下承接板下端固定有气缸二，气缸二的输出端固定安装有下膜热封板；工作支架内壁上安装有刮板一；下承接板安装有刮板二<sep>本实用新型的有益效果是实现新旧辊的更换和新旧膜的无缝结合，大大提高了生产效率
21	一种硫/聚吡咯/石墨烯/碳纳米管复合薄膜、制备方法及其应用<sep>本发明提供了一种硫/聚吡咯/石墨烯/碳纳米管复合薄膜、制备方法及其应用<sep>属于化学储能电池技术领域<sep>所述薄膜中聚吡咯枝接在还原氧化石墨烯上；还原的氧化石墨烯和官能化碳纳米管交织形成三维碳骨架；单质硫负载于所述三维碳骨架中。所述方法利用吡咯与氧化石墨烯之间的氧化还原反应引发自组装，同时，官能化多壁碳纳米管作为第二碳骨架提供离子/电子快速传输通道，并通过一步真空抽滤和后硫负载构建出一种柔性自支撑的复合薄膜<sep>利用聚吡咯对多硫化物的强吸附性与石墨烯和碳纳米管构筑的交织三维导电框架的协同作用，可以解决单质硫固有不导电性以及多硫化物“穿梭效应”等问题，进一步改善了锂硫电池的电化学性能
21	一种可穿戴多功能柔性传感器及其制备方法<sep>本发明属于电子材料技术领域<sep>具体为一种多功能柔性传感器及其制备方法。该多功能柔性传感器包括柔性基底层和感应导电复合材料层，柔性基底层包括纤维素织物，感应导电复合材料层主要为碳素墨水。通过简单有效的浸涂方法实现多功能柔性传感器的制备。该多功能柔性传感器具有普适性，对于绝大多数纤维素织物都适用，且具有快速大规模制备、成本低廉、产品性能好、操作简单、环保等特点<sep>该多功能柔性传感器结合了应变传感器和液体传感器的功能，在环境监测、人体运动和可穿戴领域都有广泛应用前景
21	一种二维铁氧化物纳米片催化剂的制备方法和应用<sep>本发明公开了属于类芬顿催化剂制备技术领域的一种二维铁氧化物纳米片催化剂的制备方法和应用<sep>包括步骤：(1)硅酸四乙酯与四甲基氢氧化铵混合后，经水热反应得到模板rub‑15；(2)混合铁源fecl·6ho与步骤(1)所述模板rub‑15后，研磨均匀得到前体混合物，所述前体混合物经煅烧得到混合物；(3)刻蚀步骤(2)所述混合物中模板rub‑15，得到所述二维铁氧化物纳米片催化剂。所得催化剂用于活化过一硫酸盐产生自由基，以降解有机污染物<sep>相比于传统技术，本发明制备的铁基催化剂无需与其他材料结合，性能优异、方法简单、成本低廉；本发明提供的层间限域生长策略为二维结构纳米材料的合成开辟了新的视野
21	一种用于电催化析氢的纳米管状钴/四氧化三钴基复合催化剂及其制备方法和应用<sep>本发明涉及一种用于电催化析氢的纳米管状钴/四氧化三钴基复合催化剂及其制备方法和应用<sep>复合催化剂以纳米管状钴/四氧化三钴为基底，再负载钼酸钴得到<sep>所述的制备方法中采用钴片作为管状四氧化三钴的唯一钴源，避免了其他盐离子对产物产生的影响；利用简单的阳极氧化技术不仅避免了高温高压等剧烈反应条件，减少能耗缩短反应时间；制备出了规整的纳米管阵列，这种管状形貌极大程度上提高了接触面积，同时其所具有的亲水疏气等特点更加利于氢气析出
21	一种空气辅助制备多孔纳米硅的方法<sep>本发明提供一种空气辅助制备多孔纳米硅的方法<sep>该方法包括以下步骤：将不同来源得到的二氧化硅与适量的镁粉均匀混合后放入管式炉中在惰性气氛下充分反应后得到硅化镁(4mg+sio＝mgsi+2mgo)，随后将反应产物放在空气中或者其他含有氧气的混合气体中，在合适温度条件下反应后(mgsi+o＝si+2mgo)得到产物，将反应物酸洗处理后得到高产量的超细多孔纳米硅<sep>该发明步骤简单易行，只需要将得到的硅化镁在空气中或者含氧气的气体中直接加热便可得到大量多孔纳米硅，此外该发明原料二氧化硅来源广泛，污染小，产率高，得到的纳米硅具有颗粒均匀且存在介孔等特点，可以广泛应用于锂离子电池负极材料领域
21	一种胶原蛋白膜包裹的氧化石墨烯/纳米银涂层制备方法<sep>本发明公开了一种由胶原蛋白膜包裹的氧化石墨烯/纳米银涂层制备方法<sep>步骤为先在氧化石墨烯表面负载纳米银，再将钛片碱热处理后，将钛片氨基化，再在钛片表面负载氧化石墨烯/纳米银复合材料，复合完后在钛片表面覆盖一层胶原蛋白薄膜。所述方法将氧化石墨烯，纳米银和胶原蛋白三者有机地结合起来，通过氧化石墨烯使纳米银以几纳米的尺寸均匀负载在氧化石墨烯片上，并且改善胶原蛋白易降解的缺陷<sep>所述方法制备出既具有抗菌活性，又具有良好生物相容性的杂化涂层材料，通过可见光照着杂化涂层产生活性氧，从而杀灭细菌
21	一种磁铁定向控制嵌段共聚物自组装的方法<sep>本发明属于高分子纳米材料技术领域<sep>具体为一种磁铁定向控制嵌段共聚物自组装的方法。本发明以带叔胺基侧基两嵌段共聚物为基础，通过与顺磁性离子配合作用得到具有磁响应性的嵌段共聚物，所述嵌段共聚物永磁铁控制下自组装，获得长程有序的纳米阵列结构；所述顺磁性嵌段共聚物可以通过改变磁场的方向实现精准的定向自组装，通过溶剂蒸汽的溶胀作用，分子链沿着磁力方向重排，得到整块材料尺度上的各向异性有序纳米分相结构<sep>本发明方法简单、有效、适用范围广，摆脱了嵌段共聚物磁场控制方法通常所需高强度电磁场的依赖性，可用于高度有序有机纳米结构材料的制备
21	一种复合型高效可见光光催化剂及其制备方法和应用<sep>本发明属于催化剂技术领域<sep>具体涉及一种复合型高效可见光光催化剂及其制备方法和应用。制备方法包括以下步骤：1)以改良hummers法制备氧化石墨烯水溶液；2)以甲基橙溶液为模板剂，高锰酸钾为氧化剂制备纳米二氧化锰改性聚吡咯管；3)将纳米二氧化锰改性聚吡咯管与氧化石墨烯溶液混合分散均匀，在高压水热釜中反应，制得二氧化锰‑聚吡咯石墨烯气凝胶光催化剂<sep>通过本发明所提供的复合型高效可见光光催化剂的制备方法可以简单、高效、低成本的制备得到活性良好，稳定性高的可见光光催化剂，易于工业化，解决了传统光催化剂成本高，重复性差的问题
21	一种石墨烯柔性电热膜快速焊接工具<sep>本实用新型公开了一种石墨烯柔性电热膜快速焊接工具<sep>包括上压合机构、下压合机构，所述上压合机构与下压合机构铰接，所述上压合机构包括上压合块、加热装置、压合臂，所述加热装置位于上压合块的一端，所述压合臂位于上压合块的另一端；所述下压合机构包括下压合块、压合面，所述压合面位于下压合块的一端，所述上压合块的一侧底端与下压合块铰接<sep>该焊接工具结构简单，操作简便，能快速将电热膜连接线与电源导线连接
21	丝粒并列微纳米结构的电流体动力学制备方法<sep>本发明涉及一种丝粒并列微纳米结构的电流体动力学制备方法<sep>将为“丝”的纳米纤维和为“粒”微米颗粒用电流体动力学制备结合在一起，形成并列结构特征。该制备工艺简单，单步有效、制备的丝粒并列结构产品结构清晰、分布均匀<sep>该并列微纳结构的制备方法能够为众多新型功能材料的开发提供有效工具
21	一种wo3纳米片阵列的制备方法<sep>本发明公开了一种wo纳米片阵列的制备方法。首先通过草酸、乙醇和六氯化钨溶剂热法在fto、碳布、硅片表面生长带有氧缺陷的wo·ho纳米片阵列薄膜<sep>再在马弗炉中以一定的温度煅烧得到结晶性较好的wo纳米片阵列。在基底上所制备的wo呈现规则的、垂直取向的纳米片阵列，大幅提高了其比表面积，0.5mol/l naso电解质中，0.7个太阳光光强，1.2v的偏压下，wo纳米片的光电流达到0.8ma/cm<sep>该方法操作简便、易于控制，制备的wo纳米片阵列薄膜，具有大的比表面积、高的光电化学活性和稳定性
21	氮化碳纳米材料及其制备方法和应用<sep>本发明公开了一种氮化碳纳米材料的制备方法<sep>包括：1)将前驱体在惰性气氛中600℃‑750℃热处理1小时‑48小时；前驱体为石墨相氮化碳、三聚氰胺、双氰胺、尿素、氰胺和三聚氰酸中的一种或多种；2)根据目标氮化碳纳米材料种类选择溶剂，利用溶剂从步骤1)热处理产物中收集和筛选氮化碳纳米材料。本发明还公开了上述方法制得的氮化碳纳米材料和应用<sep>本发明的方法可通过前驱体和收集溶剂的选择获得多种不同形貌的氮化碳纳米材料，具有广泛的可调控性和适用性，且该方法制得氮化碳量子点与商业溶酶体荧光探针相比表现出更好的光稳定性，更有利于长时间实时溶酶体成像应用的开展
21	一种topcon结构电池的制备方法<sep>本发明公开了一种topcon结构电池的制备方法<sep>在去除多晶硅绕镀的步骤之前，保留硅片正面bsg；在去除多晶硅绕镀的步骤中，通过配入了添加剂的碱溶液去除硅片正面的多晶硅；所述添加剂，其各组分的质量百分含量为：2%～5%的单硬脂酸甘油酯，1%～2.5%的二甘醇，1%～2.5%的月桂酸钠，1%～2%的β‑环糊精，余量为去离子水；所述碱溶液为koh溶液或naoh溶液。本发明通过配入了添加剂的碱溶液去除多晶硅绕镀，可保护bsg免受碱溶液腐蚀，进而使得碱无法腐蚀到扩磷处与扩硼处<sep>本发明工艺窗口较宽、效率更稳定，可提高扩散产能，槽式机、链式机均可应用，便于产线使用现有机台实现量产
21	一种石墨烯电光调制器<sep>本发明公开了一种石墨烯电光调制器<sep>包括第一绝缘材料层，掩埋于第一绝缘材料层中的输入波导、输出波导；掩埋于第一绝缘材料层中的位于输入波导和输出波导之间的亚波长结构；设于第一绝缘材料层上方的第二绝缘材料层，其内部上下布置两层石墨烯，两层石墨烯向外延伸并与金属电极连接，且下层石墨烯与亚波长结构之间、上层石墨烯与下层石墨烯之间均以绝缘材料间隔开来；设于第二绝缘材料层上方的第三绝缘材料层，与金属电极相连<sep>本发明所提出的亚波长结构波导，其有效折射率低于普通波导折射率，对光的束缚作用减弱，调制效率可提高一个数量级，调制器的尺寸也相应地减小一个数量级，插入损耗也得以降低，从而实现了调制器的超小型化和高度集成
21	au nps/氧化锌纳米锥阵列/泡沫石墨烯电极的制备及应用<sep>本发明涉及一种金纳米颗粒（au nps）/氧化锌纳米锥阵列/泡沫石墨烯电极的制备及电化学检测多巴胺<sep>本发明是要解决现有材料在检测多巴胺时灵敏度低和选择性差的问题。本发明主要包括：一、化学气相沉积法制备泡沫石墨烯（gf）；二、水热法将氧化锌纳米锥阵列生长在泡沫石墨烯表面（zno ncas/gf）；三、滴涂法制备金纳米颗粒/zno ncas/gf电极<sep>本发明制备的一种金纳米颗粒/氧化锌纳米锥阵列/泡沫石墨烯电极具有比表面积大、电导率高、活性位点多和电催化性能好等优点，可以作为电极材料检测多巴胺
21	一种球形二氧化硅纳米颗粒的制备方法<sep>本发明提供了一种球形二氧化硅纳米颗粒的制备方法<sep>包括以下步骤：将氮气通过微孔膜垂直分散至流动的硅酸钠溶液中，得到前驱体溶液；将硫酸溶液通过微孔膜垂直分散于流动的所述前驱体溶液中，发生沉淀反应，老化，得到球形二氧化硅纳米颗粒；所述硫酸溶液通过微孔膜的起始流量为5～30ml/min，每1～2min，所述硫酸溶液通过微孔膜的流量增大一次，每次增大幅度为0.1～10ml/min，最终流量为12～40ml/min<sep>根据实施例的记载，本发明所述制备方法制备得到的二氧化硅纳米颗粒的粒径为20～80nm，球形度好
21	一种电池盖石墨散热片生产工艺<sep>本发明公开了一种电池盖石墨散热片生产工艺<sep>其技术方案要点是：包括如下步骤：首先石墨膜、弱胶膜以及pet膜形成第一复合膜；第一复合膜传送进入第二刀座模切出外轮廓；在第一复合膜上粘上双面胶后，将弱胶膜与pet膜收卷回收形成第二复合膜；在第二复合膜下方贴上蓝膜和黑膜；蓝膜在最下层；在蓝膜的下方粘上pet膜后形成第三复合膜，将最上层双面胶表面的pe膜回收走，然后在双面胶的上表面粘上软膜。模切出散热片的轮廓、预留孔只切到最下层pet膜的上表面；将切后剩余的软膜回收形成第四复合膜；在双面胶胶层上面粘上离型纸并切割出断点，形成产品<sep>本发明优点是减少石墨膜在模切过程中产生碎屑的可能性
21	一种石墨烯铅碳电池的铅负极板及其制备方法<sep>本发明涉及一种石墨烯铅碳电池的铅负极板及其制备方法<sep>所述负极板包括负极板栅和铅膏，所述铅膏的原料由如下组分组成：铅粉、功能化石墨烯分散液、抑氢剂、炭黑、腐殖酸、短纤维、硫酸钡和木质素磺酸钠；所述负极板栅的表面制备石墨烯预处理层。制备方法包括如下步骤：s1制备功能化石墨烯分散液；s2制备铅膏；s3制备铅膏黏糊状物；s4制备石墨烯‑铅负极板<sep>本发明具有充电接受能力高、比功率大、石墨烯铅粉分散好、析氢量小以及循环寿命长的优点
21	一种用于化学链循环氧储氢的核壳储氢材料及制备方法<sep>本发明公布了一种用于化学链循环氧储氢的核壳储氢材料及其制备方法。该材料分两步制备<sep>分别采用水热合成法和溶胶凝胶法。第一步是将feo溶于硝酸并磁分离后得到酸改性的feo，洗涤后加入十六烷基三甲基溴化铵、葡萄糖和水，在高压釜中溶剂热处理，磁分离得feo@c微球。第二步是将feo@c微球溶于乙醇和氨水，同时将乙醇稀释的钛酸丁酯缓慢滴入上述溶液中并搅拌。磁分离混合溶液，煅烧所得固体物质，得到核壳储氢材料feo@tio。本发明所述的核壳储氢材料采用在材料中创造氧空位，再由氧空位逆变产氢的间接储氢方式，理论储氢密度达120kg/m以上<sep>该材料中惰性载体tio包覆在活性组分feo表面，有效防止活性组分的烧结和团聚，使材料的循环稳定性显著提高
21	一种纯净银纳米线的制备方法<sep>一种纯净银纳米线的制备方法<sep>属于银纳米材料制备领域<sep>先配制a溶液（聚二烯二甲基氯化铵的乙二醇溶液），其浓度为0.05mol/l‑0.1mol/l和b溶液（硝酸银的乙二醇溶液），其浓度为0.4mol/l；然后磁力搅拌下在a溶液中再滴加等体积的b溶液，将混合的溶液在室温下磁力搅拌10‑20min，再加热到160‑200℃，反应6‑10个小时，获得产物；将产物在室温下冷却后用离心机分离，离心后的产品经过洗涤后分散在乙醇中<sep>通过使用新型的包覆剂聚二烯二甲基氯化铵制备出银纳米线，且通过洗涤，能够去除银线表面包覆的保护剂，从而制备出纯净的银纳米线，以实现更好的导电性和透光率。
21	油/水两相界面制备石墨烯/量子点纳米复合材料的方法及得到的复合材料<sep>本发明公开了一种油/水两相界面制备石墨烯/量子点纳米复合材料的方法及得到的复合材料<sep>所述方法包括：1)将环氧基团改性的氧化还原石墨烯分散于油相中；2)将氨基改性的量子点分散于水中；3)步骤1)的油相分散液和步骤2)的水相溶液混合，搅拌反应，在两相界面处生成石墨烯/量子点纳米复合材料。本发明为不同溶解相体系的石墨烯与量子点材料的复合组装提供了一个可控场所，在常温即可简单快速地实现石墨烯与量子点的复合，该反应所需原料简单易得、成本低、毒性小，反应条件温和，操作简单易行<sep>而且，制备得到的复合材料中石墨烯与量子点间的共价键作用使得其结合作用力强，量子点可均匀分散到石墨烯片层及表面，不易产生团聚现象
21	碘酸钾钠非线性光学晶体及其制备方法和用途<sep>本发明涉及一种碘酸钾钠非线性光学晶体及其制备方法和用途<sep>该晶体的化学式为kna(io)(io)，分子量为959.69，属于单斜晶系，空间群为pc，晶胞参数为a=11.4483(6)å，b=8.1332(5)å，c=7.8077(4)å；α=90°，β=90.239°，γ=90°，v=726.98(7)å。有较宽的透光范围，紫外透过截止边为290 n，光学带隙为4.27 ev，非线性光学效应约为kdp的7.6倍<sep>该晶体采用水热法，通过程序降温或恒温的方法即可得到毫米级的透明的碘酸钾钠非线性光学晶体，该晶体具有操作简单、成本低、所用的试剂为无机原料、生长周期短、物化性质稳定等优点，在倍频转换、光参量振荡器等非线性光学器件中可以得到广泛应用
21	一种石墨烯薄膜预浸料的连续制备方法<sep>本发明涉及一种石墨烯薄膜预浸料的连续制备方法<sep>属于功能材料技术领域<sep>石墨烯薄膜预浸料是以树脂胶膜和石墨烯薄膜为原料，通过热熔工艺制备而成，树脂胶膜指的是在离型纸上涂有100‑1400mm幅宽和10‑100g/m2面密度的树脂，所用树脂为环氧树脂、酚醛树脂、不饱和聚酯、聚氨酯、双马树脂、聚酰亚胺树脂中的一种；石墨烯薄膜是以石墨烯为主要原料制备而成的具有三维网络结构或者多孔结构的薄膜，根据石墨烯薄膜预浸料的使用功能确定石墨烯薄膜的原料组成。本发明可连续制备决定了石墨烯薄膜预浸料具有产量高的优点，可以很好地满足实际应用的大量需求<sep>本发明最为关键的地方之一是石墨烯薄膜的可连续制备
21	一种石墨烯正极极片、其制备方法及铝-石墨烯电池<sep>本发明提供了一种石墨烯正极极片的制备方法<sep>包括以下步骤：a)将石墨烯分散至水中，搅拌得到石墨烯分散液；b)将步骤a)得到的石墨烯分散液稀释后，依次进行震荡、抽滤和冻干，得到石墨烯薄膜；c)将步骤b)得到的石墨烯薄膜进行辊压，再在氩气保护下进行退火处理，冷却后，得到石墨烯正极极片。与现有技术相比，本发明采用特定工艺制备得到石墨烯正极极片，该产品同时具有高晶粒取向、大尺寸片层和少缺陷；同时，采用本发明提供的制备方法得到的石墨烯正极极片进一步得到的铝‑石墨烯电池具有优异的性能<sep>实验结果表明，本发明提供的铝‑石墨烯电池在100a/g恒流充放电下，经过27000次循环后容量依然保持在在0.10ah/g以上
21	一种基于pvd技术的块体金属陶瓷/金属/金属陶瓷双向纳米梯度材料及其制备方法<sep>本发明涉及一种基于pvd技术的块体金属陶瓷/金属/金属陶瓷双向纳米梯度材料及其制备方法<sep>所述制备方法包括如下步骤：s1：将基片设置于pvd设备转架上，控制靶材工作面与基片正对，且两者的距离为7~20 cm；s2：控制靶材电流密度为150~300 a，基体偏压为0~‑50v，沉积时间3~30 h，氮气压力按六阶段控制，依次沉积即得所纳米梯度材料<sep>本发明通过优化靶材与基片之间的间距、靶材等核心工艺参数，使得基体负变压作用，实现了纳米梯度材料的制备；该纳米梯度材料从表层到心部硬度和应力呈现梯度变化规律特征，表层具有高硬度和耐磨性，心部具有优良的韧性，该材料具有优异的断裂韧性、承载能力及摩擦磨损性能
21	一种碳纳米管纳米颗粒复合保温材料其制备方法<sep>本发明提供了一种碳纳米管纳米颗粒复合保温材料其制备方法<sep>包括碳纳米管，所述碳纳米管表面附着纳米颗粒层，纳米颗粒层为由硅藻土纳米颗粒、凹凸棒土纳米颗粒和膨胀珍珠岩纳米颗粒组成的混合物a，纳米颗粒层表面涂覆由磷酸盐、氯化镁、氢氧化镁、纤维、硅酸盐、高温陶瓷胶、明矾、矿渣硅酸盐水泥、粉煤灰、发泡剂组成的混合物b，利用碳纳米管极大的比表面积<sep>将硅藻土纳米颗粒、凹凸棒土纳米颗粒和膨胀珍珠岩纳米颗粒附着在其表面
