label_id	text
21	一种石墨烯导热浆料及其制备方法<sep>本发明公布了一种石墨烯导热浆料及其制备方法<sep>属于石墨烯导热材料技术领域<sep>其特征是包括石墨烯、粘结剂、n‑甲基吡咯烷酮以及石墨烯气凝胶防沉剂，首先将粘结剂加入n‑甲基吡咯烷酮中，搅拌均匀，制成混合液，然后将石墨烯、石墨烯气凝胶防沉剂加入至混合液中，最后利用高剪切分散机对上述混合液搅拌，得到稳定分散的导热浆料<sep>本发明引入石墨烯气凝胶作为防沉剂，石墨烯在浆料中均匀稳定分散，浆料的导热系数有显著提升，附着力、柔韧性也有明显提升，固化成膜后石墨烯即可在膜层内部形成连续的导热网络发挥优异的导热作用，具有工艺简单、施工容易、附着力强、散热效果佳等优点。
21	基于银类纳米线的高透屏蔽薄膜的制备方法<sep>本发明公开了一种基于银类纳米线的高透屏蔽薄膜的制备方法<sep>包括：制备硫化银‑银复合结构纳米线；采用朗格缪尔‑布吉特技术制备得到具有多层银类纳米线的组装体薄膜；配制改性石墨烯分散液，将具有多层银类纳米线的组装体薄膜浸泡在改性石墨烯溶液中，加入缩合剂，超声，经洗涤、干燥，得到高透屏蔽薄膜<sep>本发明采用银纳米线、碲化银纳米线和硫化银‑银复合结构纳米线的多层组合进行制备组装体薄膜，并通过改性石墨烯进行缩合改性，制备的高透屏蔽薄的方阻低，屏蔽效果较好，且透光率极更优
21	具有高硬度的镍铬纳米层压涂层<sep>本公开描述具有由镍和/或铬组成的高硬度的电沉积纳米层压材料<sep>本文所述的纳米层压nicr材料的均匀外观、化学耐性和高硬度使得它们适用于多种目的，包括用于在装饰以及需求物理、结构和化学环境两者中使用的耐磨损(磨耗)屏障涂层
21	一种石墨烯/碳纳米片电极的制备方法<sep>本发明属于电极材料的制备领域<sep>具体涉及一种石墨烯/碳纳米片电极的制备方法，将氧化石墨烯和泡沫镍溶于甲醇，超声并多次静置、烘干，得到预负载氧化石墨烯的泡沫镍；将其置于含氧化石墨烯、4,4’‑联苯基二硼酸的甲醇溶液中，90℃反应24 h；甲醇洗涤，烘干称量；用三甲苯与二氧六环溶液洗涤，直接分散于三甲苯与二氧六环溶液，加入1,4‑苯二硼酸，120℃反应72 h，丙酮洗涤，烘干称量；在熔融盐保护下600℃煅烧，去离子水水浴洗涤数次，真空干燥，制得电极<sep>本发明制备的石墨烯/碳纳米片电极具有比表面积大的优点，在电化学测试中稳定性好，可进一步负载赝电容物质以获得比电容较高的超级电容器电极
21	一种4bs-石墨烯作添加剂的铅蓄电池正极板及其制备方法<sep>本发明公开了一种4bs‑石墨烯作添加剂的铅蓄电池正极板及其制备方法<sep>所述正极板的制备原料有铅粉、4bs、石墨烯、乙炔黑和红丹，所述正极板的主要成分有β‑pbo2、α‑pbo2和石墨烯<sep>该4bs‑石墨烯作添加剂的铅蓄电池正极板及其制备方法，4bs的添加能在正极固化操作中起晶种的作用，优化正极生板中4bs的大小和均匀分布程度，调整熟极板中α－pbo2和β‑pbo2的相对含量和结构，对铅酸电池正极的性能特别是寿命提升上产生有益影响，在电极材料中添加石墨烯可有效提高电极的导电性能，使电极微孔结构深层的活性物质能够得到充分利用，提高放电容量，抵消4bs作为添加剂所导致的正极熟极板中α－pbo2含量较高给正极容量带来的负面影响
21	一种ag@agcl/rgo三明治纳米复合材料及其制备方法与应用<sep>本发明公开了一种ag@agcl/rgo三明治纳米复合材料及其制备方法和作为等离子体增强型光催化剂的应用。本发明主要通过化学沉淀和光还原相结合的方法合成ag@agcl/rgo三明治纳米复合材料<sep>本发明充分利用石墨烯的物理特性以及ag@agcl作为光催化剂的化学特殊属性，将两者的优良性能共同作用下，制备出具有阵列结构三维等离子体效应的ag@agcl/rgo三明治纳米复合材料，这种纳米复合材料有效地解决了石墨烯的聚集，提高了ag@agcl的耐久性，效率和活性
21	手性金属纳米薄膜光学结构<sep>本发明涉及一种手性金属纳米薄膜光学结构<sep>包括金属膜、“v”字型缝和横缝；所述“v”字型缝和所述横缝开设在所述金属膜上；所述横缝开设在所述“v”字型缝的一侧<sep>本发明引入光的斜入射制备了一种手性金属纳米薄膜光学结构，通过在该薄膜结构上添加一个横缝使得圆二色性得到很大的增强
21	一种高柔性自交联碳纳米管薄膜的制备方法<sep>本发明公开了一种高柔性自交联碳纳米管薄膜的制备方法<sep>纳米材料领域<sep>技术方案为：(1)将羧基化碳纳米管加入溶有表面活性剂的溶剂中，得到体系a；(2)将羟基化碳纳米管或氨基化碳纳米管加入溶有表面活性剂的溶剂中，得到体系b；(3)将体系a与体系b混合，分散均匀；(4)抽滤，得到碳纳米管薄膜；(5)升温发生自交联反应，反应结束后干燥得到高柔性自交联碳纳米管薄膜；得到的薄膜应力和应变分别可达59.22mpa和12.15％，与纯碳纳米管薄膜相比，应力和应变分别提高了3.32倍和14.82倍<sep>本发明提供的方法提高了碳纳米管薄膜的力学性能
21	一种表面等离激元超材料的制备方法<sep>本发明提供一种表面等离激元超材料的制备方法<sep>属于纳米光子学以及纳米加工技术领域<sep>本发明采用电镀工艺，通过对旋涂光刻胶厚度的控制，实现对金属‑介质‑金属的中的中间介质层厚度的控制，而不同的介质层厚度可作为一种光学腔，并耦合表面等离激元，从而可实现不同的光学响应；同时利用金属的欧姆损耗来增强光学吸收，再结合表面等离激元的电磁能量局限效应，可实现光学近完美吸收(吸收率接近100％)以及高品质因子光学腔，本发明工艺方法简单、稳定并且廉价，可实现大面积加工
21	一种中空结构过渡金属纳米催化剂的制备方法<sep>一种中空结构过渡金属纳米催化剂及其制备方法<sep>所述制备方法以合成ni为核，过渡金属包覆ni，部分形成ni过渡金属合金，通过酸刻蚀单质ni，合成出中空结构过渡金属纳米催化剂，通过调整前驱体的初始浓度、还原剂和前驱体的比例、以及反应温度等制备出高度分散、纳米尺度的中空结构过渡金属纳米催化剂<sep>本发明不需要将金属前驱体进行预处理，也不需要任何表面活性剂或保护剂，液相下即可直接合成，通过电子效应有效调控可提高催化活性，而且制备过程操作简便可控，所制备的产品可以用于质子交换膜燃料电池阴极催化剂，还可以用于燃料电池阴、阳极催化剂，以及复合结构纳米材料、纳米技术、可控合成等领域
21	一种mop、fep、氧化还原石墨烯三相复合材料的制备方法<sep>一种mop、fep、氧化还原石墨烯三相复合材料的制备方法<sep>其特征在于，在氧化石墨烯上负载乙酰丙酮铁和乙酰丙酮钼<sep>以此为前驱体
21	用于皮革助剂的改性氧化石墨烯小尺寸纳米片层水相均匀分散液及其制备方法和应用<sep>本发明公开了一种可用于皮革助剂的改性氧化石墨烯小尺寸纳米片层水相均匀分散液及其制备方法<sep>改性氧化石墨烯小尺寸纳米片层水相均匀分散液由以下材料按照质量份制成：氧化石墨烯含量为0.1%~0.3%的纳米片层分散液100~300份、分散剂a 5~10份、分散剂b 6~9份、催化剂0.5~1份、稳定剂0.3~0.5份<sep>通过两步插层及酰胺化反应，制备了氧化石墨烯小尺寸纳米片层分散液，其片层厚度为0.4~0.8nm，平面尺寸为21.5~53.2nm，所制备的小尺寸氧化石墨烯纳米片层通过与合成鞣剂、树脂鞣剂、树脂填充剂、树脂复鞣剂、加脂剂等配伍使用引入皮革中，当控制氧化石墨在皮革中的含量达到0.02%~0.06%时可提高皮革收缩温度12~21℃，提高皮革助剂吸收率达到95%~99%，提高皮革柔软及弹性等级，显著提高这些皮革助剂的作用效果
21	一种nips纳米片及其制备方法<sep>本发明涉及制备一种纳米片<sep>具体涉及一种nips纳米片及其制备方法。本发明的nips纳米片为超薄的具有完整原子结构的二维nips纳米片<sep>本发明的制备方法是通过电化学法插层体相nips晶体制备nips纳米片；该方法特点是在双电极体系中，以体相nips晶体为阴极和以铂电极为阳极，以n，n二甲基甲酰胺(或二甲基亚砜)为溶剂，以四烷基四氟硼酸铵为电解质，以‑2v至‑10v为外加电压；本发明的方法可以快速、低成本的制备具有大尺寸、超薄以及完整原子结构的二维nips纳米片
21	一种石墨烯/铜纳米复合材料的制备方法<sep>本发明涉及新材料领域<sep>旨在提供提供一种石墨烯/铜纳米复合材料的制备方法，包括：将碱金属油酸盐与乙醇反应后，加氧化石墨烯水溶液，得到氧化石墨烯/碱金属油酸盐混合溶液；将铜化合物加至氧化石墨烯/碱金属油酸盐混合溶液中，冷凝回流下进行离子交换反应，制得氧化石墨烯/铜油酸盐络合物；在惰性氛围下将氧化石墨烯/铜油酸盐络合物与有机溶剂进行热还原反应，得到石墨烯/铜纳米复合材料。本发明使用均相反应器来进行热还原反应，可以提高石墨烯与铜的分散性，得到均匀的石墨烯/铜纳米复合材料<sep>本发明的制备过程环保、操作简单、成本较低，适合用于大规模生产，避免了有毒有害物质的使用，在制备高性能材料的同时保护环境
21	氮化硼纳米片粉体、其绿色宏量制备方法及应用<sep>本发明公开了一种氮化硼纳米片粉体、其绿色宏量制备方法及应用。所述绿色宏量制备方法包括：将硼源和载体混合作为前驱物<sep>在氨气气氛中升温到700～1100℃并保温60～180min，之后在保护气氛中降至室温，获得粗产物，再对所获粗产物进行后处理，即获得宏量的纯净氮化硼纳米片粉体，所述硼源包括氧化硼，所述载体包括氯化钠和/或氯化钾。本发明的制备工艺简单，绿色无公害，原料廉价易得且安全无毒，硼源的转化率可以达到89％，所获氮化硼纳米片粉体为六方氮化硼纳米片，其纯度在99％以上<sep>籍由本发明可以实现高纯度氮化硼纳米片粉体的克级批量绿色生产
21	一种常温常压下高产率制备花状镍纳米颗粒的方法<sep>本发明公开了一种常温常压下高产率制备花状镍纳米颗粒的方法<sep>以可溶性镍盐作为镍源，将其溶解到一元或多元醇的溶剂中，然后依次加入两种氧化还原电动势不同的还原剂，经过两步还原反应后得到多片层组成的花状镍纳米材料。本发明原料价格低廉，来源丰富，采用双还原剂体系可使得反应过程不需要加热，反应时间短而且可以获得较高的产率<sep>本发明制备的花状镍纳米颗粒具有高比表面积，可以用于制备吸波材料，具有匹配厚度薄和吸收频段宽的特点，可以在电磁屏蔽和隐身领域有广泛的应用
21	一种纳米荧光染料的制备方法<sep>本发明公开了一种纳米荧光染料的制备方法<sep>包括如下步骤：将荧光染料溶于有机溶剂，配制成荧光染料有机溶液，记为料液a；将表面活性剂溶于水中，配制成表面活性剂水溶液，记为料液b；将料液a和料液b通过进料口同时注入到超重力旋转填充床中，在超重力环境，使料液a和料液b进行充分混合沉淀后从出料口排出，收集得到纳米荧光染料浆料；将纳米荧光染料浆料通过减压蒸馏的方式除去有机溶剂，制备得到纳米荧光染料<sep>该方法采用超重力旋转填充床，制备出的纳米荧光染料颗粒粒径≤100纳米；粒度分布均匀，分散性好，pdi值≤0.3；并且制备工艺简单、反应时间短；本方法解决了染料纳米化工艺复杂、产品粒径大且粒度分布不均匀等问题
21	一种各向同性石墨块体的制备方法<sep>本发明涉及一种致密的各向同性石墨块体的制备方法。其包括：1．复合金刚石粉体的制备采用两种或几种金刚石粉体均匀混合后<sep>作为制备致密的各向同性石墨块体的前驱体。2．各向同性石墨块体的烧结制备将复合金刚石粉体放置于石墨模具中，加压加热烧结。高温时，晶刚石颗粒转变为由同心石墨烯层包裹而成的的洋葱状单晶体，从而得到致密的各向同性石墨块体本发明中所制备石墨具有独特的晶粒结构，即每个晶粒均是一个由同心石墨烯层包裹而成的洋葱状单晶体<sep>可用于减磨材料和核能工业
21	一种铁修饰的四氧化三钴纳米片阵列电极的制备方法及应用<sep>一种铁修饰的四氧化三钴纳米片阵列电极的制备方法及应用<sep>它属于电化学催化及能源领域<sep>具体涉及一种电极的制备方法及应用。本发明的目的是要解决现有纳米材料在严苛的碱性条件下析氧反应催化性能低的问题。方法：一、碳布的处理；二、配制溶液；三、浸泡；四、阴离子刻蚀；五、退火处理，得到四氧化三钴纳米片阵列电极和铁修饰的四氧化三钴纳米片阵列电极。一种铁修饰的四氧化三钴纳米片阵列电极用于催化碱性环境中的电解水析氧反应<sep>本发明可获得一种铁修饰的四氧化三钴纳米片阵列电极
21	一种锂离子电池用石墨烯负载过渡金属硅酸盐纳米膜材料及其制备方法<sep>本发明公开了一种锂离子电池用石墨烯负载过渡金属硅酸盐纳米膜材料及其制备方法。该纳米膜材料是由过渡金属盐、络合剂、石墨烯和四氯化硅在有机醇相体系中通过溶剂热法制备而成<sep>其化学式为msio/sio/g，其中m为过渡金属mn、fe、co或ni，g为石墨烯<sep>该材料用于锂离子电池负极中，其二维纳米膜结构有利于电荷在材料中的传输，且能有效减小材料在脱嵌锂过程中的体积膨胀，表现出较高容量和优异的循环性能
21	一种利用低层数氧化石墨烯制备石墨烯的生产系统<sep>本发明提供了一种利用低层数氧化石墨烯制备石墨烯的生产系统<sep>所述生产系统包括氧化石墨烯纯化装置、低层数氧化石墨烯制备装置以及还原装置，其中，所述氧化石墨烯纯化装置包括第一进料口、罐体、第一隔板、第二隔板、超声发生单元和第一出料口；所述低层数氧化石墨烯制备装置用于对氧化石墨烯纯化装置得到的纯化石墨烯进行冷冻干燥处理，包括水凝胶形成单元、低温干燥单元和传送机构；所述还原装置包括对低层数氧化石墨烯制备装置得到的具有第二层数的氧化石墨烯进行还原，包括料仓、行进机构、反应单元和气氛控制单元<sep>本发明的系统结构简单，生产效率高，氧化石墨烯依靠自身重力经历反应单元，能够实现石墨烯的连续化生产
21	石墨烯基互补型非对称π型结构thz调制器及制备方法<sep>本发明涉及石墨烯基互补型非对称π型结构thz调制器及制备方法<sep>thz调制器包括：聚合物柔性衬底层；氧化铟锡(indium tin oxide，ito)半导体溅射层；alo绝缘‑石墨烯有源区结构复合层：生长在ito层上，由至少一个alo绝缘‑有源区子结构叠加组成，所述的alo绝缘‑有源区子结构包括位于下方的alo绝缘层，以及生长在alo绝缘层上的互补型石墨烯微结构层；通过自旋喷涂的方法在最上方的一个有源区子结构上制作导电凝胶‑凝胶层为上电极<sep>与现有技术相比，本发明可以实现对太赫兹波的有效调节，调制器的品质因子高(q>30)、可调性能好和调制深度大等优点
21	硼硫化钡中远红外非线性光学晶体及制备方法和应用<sep>本发明涉及一种硼硫化钡中远红外非线性光学晶体及制备方法和应用<sep>该晶体的化学式为babs，分子量为287.20，非中心对称结构单晶，晶系为正交晶系，空间群为cc，晶胞参数a=6.665(3)å，b=15.727(6)å，c=6.039(2)å，β=110.987(4)°，z=4，单胞体积v=591.0(4)å<sep>采用将硫化钡或单质钡，单质硼，单质硫在真空条件下进行固相反应法和高温熔融法制备粉末纯样和单晶；通过本发明所述方法获得的硼硫化钡中远红外非线性光学晶体的纯样xrd图与理论值吻合；在2090nm的激光下，倍频效应是aggas的0.7倍；获得毫米级晶体
21	一种钨酸铯纳米粒子的合成方法<sep>本发明公开了一种钨酸铯纳米粒子的合成方法<sep>包括将羰基钨和氧化剂溶解于有机溶剂中并混合均匀得到混合溶液，在保护气体的保护下将混合溶液加热至150℃～180℃，后加入油酸铯的十八碳烯溶液，后升温至250℃～300℃反应0.5～48小时，得到的反应液经降温和后处理得到钨酸铯纳米粒子<sep>本发明制备获得的纳米粒子在800nm～1500nm的近红外波段具有较强的吸收能力，而在400nm～800nm的可见光波段吸收较弱
21	一种高硅cu-lta催化剂的制备方法及其应用<sep>本发明提供了一种cu‑lta催化剂的制备方法<sep>采用以双模板剂一步法合成cu‑lta催化剂，通过控制硫酸铜‑四乙烯五胺和有机模板剂的投入比例调控铜负载量为1.00‑5.00wt.％，同时控制铝源与硅源的投料比调控硅铝比为4‑20，得到具有优异的催化活性、水热稳定性的cu‑lta分子筛催化剂，该方法可以原位将cu物种引入到lta分子筛结构中，并能控制cu物种的引入量，克服了传统合成法必须通过后期离子交换工艺负载活性组分的缺点，避免了多次使用硝酸铵和铜盐溶液离子交换及分离，节约能源，环境友好<sep>制得的cu‑lta催化剂在较宽的温度窗口内保持优异的nh‑scr催化活性
21	一种氧化钇-氧化镁纳米复合粉体及其制备方法<sep>本发明涉及一种氧化钇‑氧化镁纳米复合粉体及其制备方法<sep>所述制备方法包括：配制包含钇离子和镁离子的金属离子溶液，然后向金属离子溶液中加入分散剂，得到反应溶液；将反应溶液和络合剂混合，调节混合体系的ph，然后将混合体系进行时效反应，得到溶胶体系；将溶胶体系进行溶胶‑凝胶化处理，得到湿凝胶；将湿凝胶进行冷冻干燥，得到干凝胶粉末；将干凝胶粉末进行煅烧，得到所述氧化钇‑氧化镁纳米复合粉体<sep>该制备方法采用氧化镁做为第二相引入氧化钇多晶材料中，形成纳米复合陶瓷，可改善单相多晶透明陶瓷的缺陷，抑制氧化钇制晶粒长大；通过调节溶胶‑凝胶制粉工艺获得形貌均匀、分散性好，粒径小于20nm的氧化钇‑氧化镁纳米复合粉体
21	一种碳纳米管分散剂及其制备方法<sep>本发明公开了一种碳纳米管分散剂及其制备方法<sep>该分散剂由n‑乙烯基吡咯烷酮、不饱和大单体a聚合制备获得<sep>本发明公开的碳纳米管分散剂具有分散效果好、稳定性佳、制备工艺简单、结构可控的优点，可应用于碳纳米管的分散领域<sep>还可用作其他领域的分散剂、悬浮剂、稳定剂
21	一种银和金纳米颗粒包覆氧化锌表面增强拉曼散射效应基底的制备方法<sep>本发明属于硅片表面增强拉曼散射效应领域并公开了一种银和金纳米颗粒包覆氧化锌表面增强拉曼散射效应基底的制备方法<sep>首先将覆盖于硅片基底上的聚苯乙烯微球层状阵列进行蒸金操作，然后通过电沉积法得到氧化锌纳米棒阵列；接着用甲苯溶液浸泡上述物质，经去离子水洗涤；然后再次进行蒸金工作；最后，通过原电池沉积法，在氧化锌纳米棒空心球表面沉积银纳米颗粒<sep>本发明方法所得到的物质结合了氧化锌的化学增强与银的物理增强作用，具有较高的sers活性；且该复杂层级纳米结构规则有序排列，其sers信号均匀性与重复性好，海胆状的外形可以实现很强的电磁场耦合；制备过程简单、成本低，制备的产品可广泛应用于环境、化学、生物等领域的快速检测
21	一种基于稀土掺杂材料的红外诱导热辐射的增效方法<sep>本发明公开了一种基于稀土掺杂材料的红外诱导热辐射的增效方法<sep>稀土离子掺杂氧化物由于具有较强的红外吸收能力、较高的熔点、较低的热导率，是目前公认的高效红外激光诱导热辐射材料。本发明在稀土掺杂氧化物材料中引入理离子，降低稀土离子局域晶场的对称性，因而可以增强稀土离子对红外激光的吸收能力，进而改善稀土掺杂氧化物材料的红外激光诱导热辐射的效率<sep>本发明具有成本低廉、操作简单、效果显著等优点
21	一种具有帐篷状结构的氧化石墨烯膜及其制备方法与应用<sep>本发明公开了一种具有帐篷状纳米结构的氧化石墨烯膜及其制备方法与应用。本发明建立了改进的过滤组装法<sep>实现了超薄氧化石墨烯膜在柔性基底上的可靠制备。通过将纳米颗粒插层到超薄结构内部，实现了超薄结构中帐篷状纳米结构的构建。特殊的纳米帐篷状结构能在保留截留性能的前提下，实现水通量的最大化。通过纳米颗粒插层比例的调节，该膜的筛分通道可实现分子尺度上的调控，并能选择性分离相似尺寸的小分子。该膜在不同ph水溶液中结构稳定，且膜的表面粗糙度、可润湿性及表面电性可调<sep>该膜优异的分离性能，以及可调的结构与性质，使其在环境污染治理领域及膜分离技术领域有很广泛的应用前景
21	利用石墨烯发热的加热装置<sep>本发明涉及石墨烯技术领域<sep>涉及一种利用石墨烯发热的加热装置，其防护层内设有安装腔，安装腔内塞有支撑板，支撑板设有挡板；石墨烯电热膜位于支撑板内的第一容置腔内；石墨烯电热膜左右侧分别设有凸条，挡条将凸条挡住；凸条左侧设有第一通电触头，第一容置腔设有与第一通电触头配合的第二通电触头，第二通电触头连接有金属通电杆，金属通电杆左侧与两个紧固螺母螺纹连接；第一容置腔下方与第二容置腔相通，金属插板位于第二容置腔内，金属插板顶面与石墨烯电热膜贴合，金属插板与金属贴合板连接，金属贴合板与金属导热板贴合，金属导热板与两个金属网格板连接<sep>本发明能利用石墨烯进行发热，能对石墨烯进行保护，加热速度快
21	一种铁氮共掺杂磁性多孔石墨化纳米碳气凝胶的制备方法<sep>本发明涉碳气凝胶技术领域<sep>具体涉及一种铁氮共掺杂磁性多孔石墨化纳米碳气凝胶的制备方法，包括以下步骤：(1)将壳聚糖溶解于醋酸溶液中，然后加入三价铁盐溶液，搅拌至反应完全，得到均一稳定的红棕色粘稠透明溶液，真空冷冻干燥，得到壳聚糖‑fe螯合物气凝胶；(2)碳化：得到黑色气凝胶碳化样品；(3)活化：得到所述铁氮共掺杂磁性多孔石墨化纳米碳气凝胶<sep>本发明选用含氮高分子材料壳聚糖与三价铁盐形成螯合物作为碳源、氮源和铁源，制备了一种铁氮共掺杂磁性多孔石墨化纳米碳气凝胶，具有极大的比表面积和理想的孔隙结构，通过调整铁含量可以使其表现出良好的电催化氧还原活性、双电层超级电容性能及有机染料吸附性能
21	一种紫外/可见光响应的石墨烯/二氧化钛/si基板及其制备方法<sep>本发明公开了一种紫外/可见光响应的石墨烯/tio/si基板及其制备方法<sep>该方法首先在重掺杂硅基板的抛光表面旋涂一层二氧化钛纳米点，再将单层石墨烯转移至tio/si基板的tio表面使石墨烯与tio纳米点和si基板均接触。单层石墨烯/si基板之间形成肖特基结，对可见光响应良好；二氧化钛纳米点对紫外响应良好，三者复合的石墨烯/tio/si基板对可见光和紫外光都能有很好的响应<sep>易于制备的石墨烯/tio/si三明治结构基板不仅能实现对紫外/可见光响应，更有望用于动态光致调控细胞行为
