label_id	text
21	一种含多元复合导电剂的锂离子电池正极极片的制备方法<sep>本发明属于动力锂离子电池技术领域<sep>具体涉及一种含多元复合导电剂的锂离子电池正极极片的制备方法，包括：(1)在合浆缸中依次加入pvdf和极性溶剂nmp，打胶40～60min，加入石墨烯粉体、石墨粉和镍粉；继续打胶，得到混合液；(2)将正极活性物质加入到混合液中搅拌混合，加入极性溶剂nmp调节浆料粘度；(3)将上述浆料低速匀浆，均匀涂布在正极集流体的正反两面，以甲烷作为辅助气体，采用超音速火焰喷涂的方式将铝粉喷涂到正极集流体表面，得到正极极片<sep>本发明以甲烷作为辅助气体，采用超音速火焰喷涂在涂层的表面形成碳纳米管，与深层的石墨烯粉体和石墨粉所形成的导电结构形成多层次，多元复合的导电形式，从而极大的提高了该正极极片的导电性。
21	一种树枝状大分子增强的带孔氧化石墨烯纸的制备方法<sep>一种树枝状大分子增强的带孔氧化石墨烯纸的制备方法<sep>属于氧化石墨烯生产技术领域<sep>本发明的目的在于解决氧化石墨烯膜/纸材料存在的拉伸强度低、应力松弛以及由于片层不渗透性导致最终制备得到的材料品质较低等问题，通过过氧化氢的强氧化性在氧化石墨烯片层内侵蚀环氧基官能团及其邻近的碳原子，形成纳米级孔洞，然后通过引入聚酰胺‑胺型树枝状高分子(pamam)在氧化石墨烯片层间形成共价交联，提升氧化石墨烯层间结合强度，最后通过定向过滤的方式，得到强度较高、品质较好的氧化石墨烯膜/纸材料<sep>该方法操作简单、成本低廉、效率较高且有望实现规模化制备
21	基于纳米压印技术的柔性透明显示屏<sep>本实用新型公开了一种基于纳米压印技术的柔性透明显示屏<sep>包括位于底端的柔性透明基材，所述柔性透明基材上均匀设置有合成树脂，采用纳米压印技术在柔性透明基材上加工出多个凹槽，所述凹槽内安装有导电线路和焊盘构成柔性透明显示屏基板，所述焊盘上连接有led芯片，所述柔性透明显示屏基板的端部连接有fpc连接器。所述柔性透明显示屏基板上对应fpc连接器的位置贴有acf胶，所述fpc连接器通过acf胶固定连接在柔性透明显示基板上<sep>该显示屏透光性能好、导电线路与焊盘牢固性好，可制作高密度的柔性透明显示屏，由于其结构简单，不仅便于生产，而且成本非常低廉适于广泛推广
21	基于直流偏置下的石墨烯下变频混频器及设计方法<sep>本发明公开了一种基于直流偏置下的石墨烯下变频混频器及设计方法<sep>采用分支线耦合器、混频单元、低通滤波器的结构，分支线耦合器用于将射频信号和本振信号耦合在一起形成耦合信号，经直通端和耦合端输出，混频单元包括依次设置的第一直流偏置器、多层石墨烯和第二直流偏置器；两个直流偏置器用来隔离交流信号和直流信号，第一直流偏置器还连接直流电源激励多层石墨烯<sep>直流信号激励多层石墨烯后能提升其混频性能，从而使耦合信号激励多层石墨烯后，更好的产生中频信号和高频信号，并利用低通滤波器滤除高频信号，从而得到中频信号，采用本发明设计的下变频混频器，驻波比低、输入功率线性度宽、变频损耗降低，有利于提高系统的灵敏度
21	一种钛酸钡-人工合成氟金云母复合材料的制备方法<sep>一种钛酸钡‑人工合成氟金云母复合材料的制备方法<sep>通过液相沉积法，将ticl、bacl和naoh逐步滴加入装有合成云母粉的反应釜中，在一定的温度和ph值的条件下，反应形成纳米级batio沉积在合成云母粉的表面，经过脱水，洗涤，最终得到钛酸钡‑人工合成氟金云母复合材料<sep>钛酸钡‑人工合成氟金云母复合材料，提高了钛酸钡的纯度及粒径可控性，降低了钛酸钡材料的使用成本，满足市场对高纯度钛酸钡材料的需求
21	一种网格状zno螺旋式多孔空心纳米线传感器的制备方法<sep>本发明公开了一种网格状zno螺旋式多孔空心纳米线传感器的制备方法<sep>该方法以纺丝液为原料，先在ito导电玻璃上使用静电纺丝制备前驱体，再将前驱体转移至电阻炉中煅烧获得网格状zno螺旋式多孔空心纳米线，然后在网格状zno螺旋式多孔空心纳米线四周涂覆ag或者au电极或者导电胶，并引出导线，即可获得结构完成的气敏传感器，该方法可控性好<sep>工艺简单
21	一种荧光增强的石墨烯量子点的制备方法<sep>本发明提供了一种荧光增强的石墨烯量子点的制备方法<sep>是将乙腈加入到石墨烯量子点溶液中，超声波清洗器中超声5~10min；随后转移至高压反应釜中，加热至175~185℃，恒温反应11~12h，冷却至室温，得到荧光增强的石墨烯量子点<sep>本发明以乙腈作为辅助中间体，并通过一步水热法制备了荧光增强的石墨烯量子点，其发光稳定性得到显著的提升，而且发光强度高，量子产率高；同时有效地防止了石墨烯量子点在高温高压环境下的荧光淬灭，极大地开拓了石墨烯量子点在光电转换、离子检测，传感器等更多领域的应用潜力
21	一种nbal超导线材前驱体的制备方法<sep>本发明公开了一种nb3al超导线材前驱体的制备方法<sep>包括：用nb棒、含有ta的箔材和cu管制备单芯复合棒；将制得单芯复合棒通过轧制工序轧制成正六边形的六方棒；将若干根制得的六方棒装入cu包套管内并密封，形成复合坯锭；将制得的复合坯锭通过热挤出加工工序制得cu包套的复合棒材；将制得的复合棒材通过多道次拉拔加工工序，制得nb3al超导线材前驱体导线<sep>通过本发明制备的nb3al超导线材前驱体在不影响超导转变温度、临界电流密度和上临界磁场等超导性能的前提下，有效抑制超导性能芯丝间耦合，显著降低了最终超导线材的交流损耗值
21	以质子化钛酸盐制备石墨烯/{001}面暴露的二氧化钛纳米复合材料的方法<sep>本发明公开了一种以质子化钛酸盐制备石墨烯/{001}面暴露的二氧化钛纳米复合材料的方法<sep>主要包括如下步骤：以层状质子化钛酸盐作为前驱体，将其与氧化石墨烯混合溶解在醇中，然后加入氢氟酸和葡萄糖后经水热反应，得到黑色沉淀物；将所得黑色沉淀物在温度为50℃～120℃条件下真空干燥12h～18h，得到石墨烯/{001}面暴露的二氧化钛纳米复合材料<sep>本发明以前驱体质子化钛酸盐水热法制备石墨烯/{001}面暴露的二氧化钛纳米复合材料，二氧化钛颗粒均匀地负载在片状的石墨烯上，具有较高的分散性以及高的比表面积，充分发挥石墨烯与二氧化钛的协同作用，协同效应的存在使得tio的光生电子更容易向石墨烯表面发生转移，抑制了光生电子‑空穴对重合，从而提高了光催化活性
21	一种微米球形铌酸钛及其制备方法和应用<sep>本发明涉及电极材料技术领域<sep>尤其涉及一种微米球形tinbo及其制备方法和应用。本发明提供的制备方法，包括以下步骤：将钛源、铌源和分散剂混合，依次进行喷雾热解和煅烧，得到所述微米球形tinbo<sep>根据实施例的记载，以所述微米球形tinbo作为锂离子电池的负极材料时，在0.1a g电流密度下可逆比容量可达200～260mah·g，且在5a g的大电流密度下依然能保留100～155mah·g的可逆比容量，并在1a·g电流密度下循环500次后，其比容量的保持率能达到80％～92％，具有优异的倍率性能和循环稳定性能
21	一种二维含能材料及其制备方法<sep>本发明公开了一种二维含能材料<sep>其氧化剂组分与燃料组分中至少一种为类石墨烯二维材料，并且已合成为二维纳米片。所述氧化剂组分含量为10％～90％，所述燃料组分含量为10％～90％；所述氧化剂组分为wo或mno；所述燃料组分为al、mg、b、ti、si或p中的一种<sep>本发明使二维材料与纳米含能材料完美结合在一起，解决了纳米含能材料的分散性差，粒子易团聚，瞬时放热差问题，也拓展了二维纳米材料的应用
21	一种卷对卷连续印刷制备的oled显示柔性衬底及方法<sep>本发明涉及oled显示柔性衬底技术领域<sep>具体涉及一种卷对卷连续印刷制备的oled显示柔性衬底，包括聚酰亚胺膜，聚酰亚胺膜的一侧有阳极导电膜，聚酰亚胺膜的另一侧有无机微膜；阳极导电膜为导电液印刷后固化形成，无机微膜为硅溶胶和含铝分散液共同印刷后固化形成。制备方法包括：将导电液印刷在溶胀的聚酰亚胺膜表面上，第一烘箱烘干定型，再将上述硅溶胶和含铝分散液共同印刷在溶胀的聚酰亚胺膜表面上，第二烘箱烘干定型，再经过热定型辊后即可收卷，即得<sep>本发明通过导电液将石墨烯、碳纳米管均匀固定在阳极导电膜中构成导电层且耐久性良好；无机微膜不但表现良好的透明性，而且使得聚酰亚胺膜的热膨胀系数降低，阻水阻氧性提升
21	一种石墨烯铅碳动力电池及其制造方法<sep>本发提供一种石墨烯铅碳动力电池<sep>包括壳体与内芯，所述内芯由依次排列的正极复合极板、隔膜与负极复合极板组成，所述正极复合极板、负极复合极板分别由正极铅膏板、负极铅膏板与包覆于所述正极铅膏板、负极铅膏板的极栅构成，其中，所述正极铅膏板由氧化铅与石墨烯纤维复合而成，所述负极铅膏板由铅、石墨烯、导电聚合物复合而成，所述极栅由铅板栅与包覆于铅板栅表面的石墨烯构成<sep>本发提供一种石墨烯铅碳动力电池改善传统铅酸电池出现负极“硫酸盐化”现象，具有长循环寿命、高充电接受能力、高比功率、良好低温性能等特性
21	一种氧化铜纳米线的制备方法<sep>本发明提供一种氧化铜纳米线的制备方法<sep>将氯化铜溶液涂覆于铜箔表面，中和反应快速发生，生成氯化亚铜；将氯化亚铜从铜箔表面刮除收集，放入含氧的乙醇中封闭加热，反应生成氧化铜纳米线<sep>本发明所公开的方法采用新的反应路径制备的氧化铜纳米线粒径均匀，尺寸、形貌和维度易于控制，利用氯化铜、铜箔、乙醇为原料与反应介质，价格低廉易得，降低了成本，步骤简单，便于操作，设备要求简单，有利于实现大规模的工业生产
21	二维材料解理方法<sep>一种二维材料解理方法<sep>包括：在母体层状晶体的表面形成绝缘薄膜镀层；在绝缘薄膜镀层表面粘贴热释放胶带；揭起热释放胶带，使热释放胶带粘附绝缘薄膜镀层，且绝缘薄膜镀层表面具有由部分母体层状晶体构成的中间层状晶体；在热释放胶带表面覆盖粘附印章，且粘附印章覆盖绝缘薄膜镀层和中间层状晶体；热处理热释放胶带，使热释放胶带与粘附印章、以及热释放胶带与绝缘薄膜镀层分离；之后，将粘附印章、中间层状晶体和绝缘薄膜镀层按压在衬底上，且绝缘薄膜镀层与衬底接触；之后，揭起粘附印章，粘附印章表面带走部分中间层状晶体，使绝缘薄膜镀层表面形成二维材料<sep>所述方法能够制备大面积高质量的二维材料，拓宽二维材料库
21	高密度锗纳米线的制备方法<sep>本发明提供一种高密度锗纳米线的制备方法<sep>包括如下步骤：1)提供一锗衬底，锗衬底包括相对的第一表面及第二表面；2)于锗衬底的第一表面生长石墨烯；3)于锗衬底的第一表面形成铟催化剂层，且铟催化剂层至少覆盖石墨烯；4)于铟催化剂层远离锗衬底的表面生长锗纳米线<sep>本发明无需采用电子束蒸发的方式沉积金属，大大简化了锗纳米线制备的工艺流程，并降低成本，非常适合于大规模低成本的锗纳米线的制备；本发明采用铟作为催化剂生长的锗纳米线具有较高的长宽比，同时具有较高的表面密度，这些特点使得该方法更便于锗纳米线的转移与应用，从而为基于四族纳米线的器件制备奠定工艺基础；同时，本发明制备的锗纳米线具有很好的稳定性和重复性
21	一种凹凸棒石复合光催化剂的制备方法及其应用<sep>本发明属于光催化合成氨技术领域<sep>特别涉及一种改性凹凸棒石/过渡金属氧化物纳米复合材料的制备方法及其应用。其制备方法包括：(1)取纯化过的凹凸棒石粘土进行酸化处理，使h置换出凹凸棒石八面体结构中的部分阳离子及层间部分阳离子；(2)将酸化后的凹凸棒石粘土放到过渡金属盐溶液中，在60～100℃的水浴锅中充分反应；(3)将上述反应液置于微波水热化学反应仪中反应，然后离心，洗涤，干燥后得到成品<sep>本发明能够将改性凹凸棒石/过渡金属氧化物作为催化剂，应用在光催化合成氨领域<sep>与传统的工业合成氨相比，制备方法简单，而且能耗大为降低
21	一种钌单质修饰的硫掺杂石墨烯二维材料及其制备与应用<sep>一种钌单质修饰的硫掺杂石墨烯二维材料及其制备与应用<sep>将rucl·6ho和氧化石墨烯加入去离子水中，调节ph值为0～6，超声震荡分散均匀，然后冷冻干燥除去溶剂，得到固体；将固体在惰性气氛下高温焙烧，冷却到室温后，酸浸，水洗，干燥，得到钌单质修饰的硫掺杂石墨烯二维材料<sep>本发明所制备的钌单质修饰的硫掺杂石墨烯二维材料具有良好的导电性，钌单质作为活性中心分布均匀；此类钌单质修饰的硫掺杂石墨烯二维材料可作为电催化水分解析氢催化剂，具有过电位低、催化性活性高、催化寿命长的特点
21	一种石墨烯纳米带缠绕锗纳米颗粒复合材料的制备方法<sep>本发明属于锂离子电池技术领域<sep>具体涉及一种锂离子电池负极材料的制备方法。即一种石墨烯纳米带缠绕纳米锗复合材料的制备方法，以石墨烯纳米带和二氧化锗粉末为原料，采用一步法原位合成锗‑石墨烯纳米带复合材料产品<sep>操作简便，成本低廉，环境友好，所制得的产物具有出色的结构稳定性和导电性，并且可以有效地抑制锗在充放电过程中的体积效应，可广泛应用于大电流大功率设备中，特别适用作锂离子电池负极材料
21	用于3d打印的碳纳米管/金属混合溶液的制备方法<sep>本发明涉及了一种用于3d打印的碳纳米管/金属混合溶液的制备方法<sep>属于3d打印材料领域<sep>其制备方法为将活性官能团碳纳米管分散液、金属纳米粉末缓慢加入到nafion溶液中，形成混合溶液，超声30~60分钟后，再磁力搅拌24~48小时，使其充分混合，根据实际需要调整浓度，即可得到用于3d打印的碳纳米管/金属混合溶液<sep>本发明具有低成本的、易实现规模化3d打印碳纳米管/金属的纳米材料的特点，且打印的产品具备实用化前景和商业价值
21	一种骨诱导碳基复合材料接骨板及其制备方法<sep>本发明涉及一种骨诱导碳基复合材料接骨板材料及其制备方法<sep>所述接骨板包括碳纤维、热解碳基体、sic表面层、含bmp活性蛋白的功能层；所述热解碳基体层均匀包覆于碳纤维上；所述含bmp活性蛋白的功能层镶嵌和/或包覆于sic表面层上；所述sic表面层位于含bmp活性蛋白的功能层和热解碳基体之间；所述骨诱导碳基复合材料接骨板的密度为1.8～2.0g/cm；所述含bmp活性蛋白的功能层的质量占接骨板总质量的0.5～1.0％<sep>其制备方法为：先编织预制体，然后高温释放应力，接着制备热解碳层，然后进行机加工和二次增密，二次增密后制备sic表面层，最后经氧化活化处理后负载含bmp活性蛋白分子
21	一种用于应变传感器的石墨烯/海藻酸钠/碳纳米管复合弹性气凝胶及其制备方法<sep>本发明公开了一种用于应变传感器的石墨烯/海藻酸钠/碳纳米管复合弹性气凝胶及其制备方法<sep>本发明方法基于构建纤维增强复合以及采用碳纳米管增加传感灵敏性的思路，将石墨烯、海藻酸钠以及碳纳米管混合形成气凝胶后，在hn·ho蒸汽气氛中进行还原反应，制备得到所述用于应变传感器的石墨烯/海藻酸钠/碳纳米管复合弹性气凝胶<sep>本发明的气凝胶具有高机械耐久性、良好弹性、结构连续性以及高灵敏度，通过控制氧化石墨烯、海藻酸钠以及碳纳米管配比的比例，控制了气凝胶的孔结构的规则度，形成了较为规则的网络，从而调控了气凝胶的机械性能，以及电阻变化响应性能；同时通过水合肼蒸汽的充分还原，使制备的气凝胶具有疏水性能
21	一种功能复合物rgo-ionp-peg的制备方法<sep>本发明提供一种功能复合物rgo‑ionp‑peg的制备方法,包括:(1)将c18pmh与nh2‑peg‑och溶解于二氯甲烷溶液<sep>加金属铁盐与edc,于微波辐射下催化反应；加入2‑(噻吩‑2‑甲基)苯基硼酸,微波辐射催化反应；转至50～65℃恒温水浴,搅拌,吹干得到粗产物固体粉末；透析获得c18‑pmh‑peg复合物；(2)将rgo‑ionp纳米复合物与c18‑pmh‑peg复合物混合,搅拌3～5min,超声处理<sep>加入2‑氯苯基硼酸,微波辐射催化反应,离心,洗涤,得到本发明复合物,本发明大大缩短整体工艺时间,且提高c18‑pmh‑peg复合物和rgo‑ionp‑peg纳米功能复合物产率。
21	一种金刚石基氮化镓高电子迁移率晶体管异质集成方法<sep>一种金刚石基氮化镓高电子迁移率晶体管异质集成方法<sep>在临时载片的表面涂覆粘合剂；将氮化镓高电子迁移率晶体管的正面粘结到临时载片上，烘烤，得到以临时载片为支撑的原始器件；将以临时载片为支撑的原始器件的衬底进行减薄，对减薄后器件的背面和金刚石衬底键合面进行反溅射处理去除表面污物；在减薄后器件的背面和金刚石衬底键合面溅射中间层材料w/au；使溅射有中间层材料的减薄器件背面与金刚石衬底键合面结合，实现衬底转移；再脱离临时载片即可<sep>本发明通过中间层材料w/au实现了gan hemt和金刚石的异质集成，实现了常温、大气压条件下金刚石基gan hemt的高效低成本制备，提高了其散热性能
21	一种具有吸附和催化降解功能的纳米复合材料及其制备方法和应用<sep>本发明公开了一种具有吸附和催化降解功能的纳米复合材料及其制备方法和应用<sep>制备如下：(1)恒温水浴中，将碳纳米管、聚乙二醇分散在纯净水中，超声形成均匀的悬浮液；(2)无氧环境下向所得悬浮液中加入fecl和fecl并持续搅拌，反应4～6小时，然后调节ph至11～11.5，升高水浴温度至70～80℃继续反应2～3小时，得混合液；(3)向混合液中依次加入mnso和kmno和koh，反应2～4小时，得混合液，经后处理即得复合材料<sep>本发明采用两步沉淀法制备cnt/mno/feo纳米复合材料，在复合物的制备过程中，feo和mno纳米粒子在cnt上原位沉淀生长，利用cnt的管壁结构固载和分散feo和mno纳米粒子，同时阻止cnt的团聚
21	一种石墨烯的制备方法<sep>本发明提供一种石墨烯的制备方法<sep>由如下方法制备：将炸药、表面活性剂加入到碳源中，机械快速分散得到炸药分散液，然后将炸药分散液经氧化性气体由喷雾器喷入密闭反应器中，经能量引发爆炸，得到石墨烯<sep>该材料具有纯度高、性能好、低层数、大面积、生成效率高、可大规模量产的优点，可在超级电容器、电池、电磁屏蔽、抗静电等领域得到广泛的应用
21	一种多孔膜基底调控的mofs纳米晶材料及其制备方法<sep>本发明公开了一种多孔膜基底调控的mofs纳米晶材料的制备方法<sep>主要包括以下步骤：(1)将多孔膜基底、金属离子、多羧酸和阻断剂置于水热釜中，以去离子水为介质；(2)加热，进行水热反应<sep>(3)降温、取出洗涤，得到mofs纳米晶，该方法能够解决目前制备mofs材料尺寸较大并且不可控的问题，本发明提供的方法能够使mofs材料的尺寸降到纳米级别，并且对mofs材料的尺寸可以调控。
21	一种快速沉淀制备一维bamoo的方法<sep>本发明涉及纳米材料制备技术领域<sep>且公开了一种快速沉淀制备一维bamoo的方法，包括以下步骤：1)将0.015m ba(no)和0.015m(nh)moo·4ho分别溶解在15ml水中并在300rpm下搅拌；2)将上述两种溶液混合后搅拌直至析出大量可见白色沉淀，以备用；3)用水和乙醇将白色沉淀产物洗涤数次，在放置至真空烘箱中60℃烘干，即得高纯度一维纳米材料bamoo<sep>该快速沉淀制备一维bamoo的方法，利用叔钼酸铵((nh)moo·4ho)为沉淀剂快速沉淀出目标材料；(nh)moo·4ho具有低解离系数，可以缓慢的释放出moo离子，平衡材料的生长速度和扩散速度，使得材料在生长过程中可以定向的按照一维方向生长
21	一种金属纳米复合物及其制备方法和应用<sep>本发明公开了金属纳米复合物<sep>包括作为核心的金属或金属氧化物纳米颗粒以及偶联在所述金属或金属氧化物纳米颗粒表面的甘露糖赤藓糖醇脂<sep>本发明的金属纳米复合物，采用绿色、生物方法合成，制备方法简单，所用材料绿色环保，反应过程易于控制和调节，不产生对环境有毒有害物质，该金属纳米复合物具有抗菌、抑癌、抗氧化等生理活性，在食品、化妆品、环境保护、生物医疗等领域具有良好的应用前景
21	一种纳米金修饰的二氧化钛-碳纳米管复合光催化剂的制备方法<sep>本发明提供了一种纳米金修饰的二氧化钛‑碳纳米管复合光催化剂的制备方法<sep>包括以下步骤：以醇的水溶液和稳态气体为介质，利用微纳气泡发生器处理，得到微纳气泡水；将所述微纳气泡水、碳纳米管和钛盐混合分散，得到分散液；将所述分散液与氨水溶液混合、水解，得到水解产物；d)将所述水解产物与金盐、微纳气泡水混合后，依次进行光照还原和加热反应，得到反应产物；对所述反应产物进行热处理，得到au‑tio‑cnts复合光催化剂<sep>本发明提供的制备方法简单易行，大大简化了制备过程；且制得的复合光催化剂结合稳定，具有有效且优异的催化降解效果；同时，制备过程无需使用有毒害有机溶剂及模板剂，大幅降低了成本及对环境的危害
21	石墨烯分拣检测结构及其检测方法<sep>石墨烯分拣检测结构<sep>包括接料框和电子显微镜系统，接料框的下方安装有底脚，其特征在于，所述接料框的上方安装有外框架，接料框与外框架之间安装有外挡板，所述外框架的内壁面上安装有进料料斗<sep>外框架的内边沿均布安装有弹簧，所述弹簧上安装有底圈，本发明的有益效果：本发明利用合理的结构设计，可以自动上料出料，自动检测，自动出料，整个过程自动化，速度快，检测效率高，填补了国内技术空白，适合推广使用。
21	一种掺氮石墨烯的银基复合材料及其制备方法<sep>本发明公开了一种掺氮石墨烯的银基复合材料<sep>本发明公开了一种掺氮石墨烯的银基复合材料及制备方法，包括以下制备步骤，首先配置氧化石墨烯分散液，将尿素溶于石墨烯分散液中，然后在水热反应釜中保温数小时后取出自然冷却至室温，将产物进行洗涤、离心处理和干燥得到掺氮石墨烯粉末。将掺氮石墨烯与银粉的无水乙醇溶液混合，在60‑80℃下搅拌干燥得到掺氮石墨烯与银粉的复合粉体。将该复合粉体球磨、三维混粉、压制和热压烧结最终得到掺氮石墨烯的银基复合材料<sep>通过上述方法，将氮原子掺杂到石墨烯中提高了还原氧化石墨烯的导电性，改善了石墨烯在基体中的分布以及石墨烯与金属基体间界面结合，获得了综合性能优异的掺氮石墨烯的银基块体复合材料
