label_id	text
29	一种电动汽车防漏电式充电口<sep>本发明公开了一种电动汽车防漏电式充电口<sep>主要涉及电动车充电技术领域<sep>包括充电插口，包括充电座，充电座的周侧中心对称分布设有三个与充电槽贯通的l充电位，且居中设有推柱，推柱的外端端面上设有配置槽，所述配置槽的槽底配置有用于连接零线的n端触头；充电插头，充电插头能够插入充电插槽内，设有安装槽，安装槽内设有能够伸缩的外插头，外插头与l充电位配合，安装槽内居中设有内插头，内插头与n端触头配合<sep>本发明的有益效果在于：它具有呈三角分布的l端充电结构，在恶劣天气下能够不影响充电，保证充电安全和设备运行
29	一种新能源汽车定时预约充电装置<sep>本发明公开了一种新能源汽车定时预约充电装置<sep>包括底座，所述底座的上端固定有置物箱，所述置物箱的内部设有置物腔，所述置物腔的内部设有充电电池，所述置物箱的上端固定有连接板，所述连接板的上端固定有储物箱，所述储物箱的内部设有储物腔，所述储物腔内设有控制器，所述充电电池的输出端与控制器的输入端通过连接线电连接，所述充电电池的输出端电连接有充电线，所述充电线的输出端贯穿置物箱并电连接有充电插头<sep>该新能源汽车定时预约充电装置可以定时预约充电，有效的避免了过充现象，充电电池散热好，增加了使用充电电池的使用寿命，且装置拆卸方便，检修方便
29	一种用电调节方法及车辆电池管理系统<sep>本发明实施例涉及无线充电技术领域<sep>公开了一种用电调节方法及车辆电池管理系统，该方法包括：当车辆驶入充电车位时，调整车辆的无线收发线圈与充电车位的无线收发线圈之间的距离至指定距离，获取充电车位接入的电网的电压值，判断电压值是否低于预设的电压值，若电压值低于预设的电压值，控制车辆通过无线收发线圈释放电池电能，以使充电车位将车辆释放的电池电能转换成电网电能<sep>实施本发明实施例，通过让汽车参与用电调节，能够有效缓解人们的用电需求与用电高峰期限电停电的矛盾
29	一种可升降式充换电站<sep>本发明提供一种可升降式充换电站<sep>包括充电桩、盘线机构以及验电机构，所述盘线机构安装在充电桩下端面，所述盘线机构包括箱体、线缆、底板、固定孔、螺纹杆、螺母一、箱门、接近开关、充电头、通孔、橡胶盘一、伺服电机、导向筒一、导向筒二、螺母二、橡胶盘二以及支撑杆，所述验电机构安装在充电桩前端面，所述验电机构包括壳体、豁口、套筒、验电笔、盖板、通口、磁铁一、磁铁二、条形板一、左限位槽、右限位槽、条形板二、磁铁三以及磁铁四，与现有技术相比<sep>本发明具有如下的有益效果：实现盘线整理的目的
29	一种新能源汽车用充电桩<sep>一种新能源汽车用充电桩<sep>包括壳体，壳体内上部设有第一横轴，第一横轴的前后两端分别与壳体内壁轴承活动连接，第一横轴上固定安装收纳转盘，收纳转盘上设有电缆，壳体右侧面靠近上端处开设凹槽，凹槽与壳体内部通过第一通孔连通，电缆的自由端穿过第一通孔后位于壳体的外部，电缆的自由端固定安装充电头，电缆靠近自由端处固定安装限位块，限位块能与凹槽相互配合，壳体内左侧壁上固定安装横向的电机，电机的输出轴的端部上侧设有第一竖轴，第一竖轴上通过轴承套装轴套，轴套与壳体内壁之间通过支架固定连接<sep>本发明可以在未充电时通过电动对电缆进行收纳，防止电缆始终外露而容易受到磨损，提高电缆的使用寿命
29	一种基于物联网技术的充电桩系统及双向有序充放电方法<sep>本发明公开了一种基于物联网技术的充电桩系统<sep>包括由若干充电桩构成的充电桩组，充电桩组通过mqtt协议与mqtt消息服务器通信连接，mqtt消息服务器通过mqtt协议还分别与管理后台、调度控制中心、计费系统通信连接，充电桩系统双向有序充放电时，首先系统各个组成部分开始上电并执行自检程序，并尝试与mqtt消息服务器建立通信连接；然后判断系统各个组成部分是否通过自检，如通过自检，判定是否与mqtt消息服务器成功建立通信连接；如建立通信成功，则转入充放电阶段，如不成功，系统停止服务并发出告警提示<sep>本发明解决了现有技术中存在的电动汽车充电对配电网冲击极大，严重影响城市供电质量的问题
29	一种新能源充电桩电线自动收纳装置<sep>本发明涉及新能源相关技术领域<sep>且公开了一种新能源充电桩电线自动收纳装置，包括太阳能板，该新能源充电桩电线自动收纳装置，通过在收线箱内固定连接有小储蓄电池，小储蓄电池为电机提供电量，电机通电后电机轴开始转动，电机轴的右侧固定连接有主动杆，主动杆与电机轴同步转动，主动杆远离电机轴的一端固定连接有连接轴，连接轴远离主动杆的一端固定连接有从动轮，从动轮与收线杆配合，从动轮转动带动收线杆运动，收线杆上开设有收线槽，在充完电后，只需按下收线箱的开关，收线杆即会开始转动，收线槽用于收纳电线，这样就实现了电线收纳的效果，无需再人工收纳<sep>电线收纳到收线箱内
29	一种电动车充电器进风口的防水装置<sep>本发明公开了一种电动车充电器进风口的防水装置<sep>包括外壳，所述外壳的顶端和底端侧壁上分别设有水平设置的第一进风管和第二进风管，第一进风管和第二进风管的竖切面均为矩形，第一进风管和第二进风管上均设有垂直设置的过滤网和阀门，第二进风管延伸至外壳的内部，第二进风管的内部中间位置固定有垂直设置的吸水层，第二进风管的一侧内壁上固定有垂直设置的固定板，本装置不仅能够在充电桩正常通风时对充电桩进行有效防水，防止外界水分进入充电桩的内部，还能够对进入充电桩的气体进行水蒸气含量的检测，从而检测出干燥剂是否失效，同时对失效的干燥剂进行加热<sep>使得干燥剂恢复干燥的功能
29	一种新能源汽车安全充电装置<sep>本发明属于汽车充电技术领域<sep>具体涉及一种新能源汽车安全充电装置，包括支撑座，支撑座设有挂钩，支撑座一侧固定连接有充电台，支撑座另一侧固定连接有底座，底座内部设有第一升降杆，第一升降杆固定连接有第一连杆，第一连杆固定连接有第二升降杆，底座内部设有第三升降杆，第三升降杆固定连接有第二连杆，第二连杆固定连接有第四升降杆，底座底部设有四个通槽，底座设有第三固定盘，充电台设有柜门，柜门设有门锁，充电台设有第一电线接头，第一电线接头连接有充电线，充电台设有固定槽，固定槽设有充电把手，充电把手设有通电指示灯<sep>充电台上侧固定连接有雨棚
29	一种新能源汽车充电桩充电接口<sep>本发明公开了一种新能源汽车充电桩充电接口<sep>本发明通过设置公插头机构，并在公插头机构上连接充电胀紧与锁定机构，充电胀紧与锁定机构可有效使得公插头机构侧的充电导电铜套胀开并胀紧于母插座机构内的导电铜环座内，使公插头机构与母插座机构电连接的同时实现对公插头机构与母插座机构之间的固定与锁紧，这样可有效实现充电的连接可靠性，并实现对插头的锁紧与固定，防止充电的松动，本发明还设置指示器，指示器能够对所述母插座机构与公插头机构之间的连接状态进行指示，便于使用者对状态情况进行观察，本发明采用胀紧的方式有效提高连接充电的可靠性，还可实现不同型号大小的充电座<sep>以便于对不同接口的汽车进行使用
29	一种安装有可升降装置的电力新能源充电装置<sep>本发明提供了一种安装有可升降装置的电力新能源充电装置<sep>包括：保护箱体，升降板，上护板，喷管，烟感探测器和距离传感器；所述升降板的顶侧设有上凸板，且橡胶密封圈粘贴套装在上凸板的外侧，所述下凸板的底侧中间位置通过螺栓固定有四组二氧化碳气瓶，所述横通管的底部均连接有喷管，且喷管的底端内侧封板上设有喷孔，所述盖板焊接在保护箱体的顶端，且盖板的中间设有升降口，所述升降口的外侧还焊接有一端为开放结构的围板，且该开放结构端的围板内侧分别固定有控制箱与超声波传感器。在充电桩降入到保护箱体内部时，控制电桩总开关闭，可有效的保护充电桩<sep>在充电桩或者充电汽车发生火灾时，电磁阀开启，使二氧化碳气体喷出灭火
29	私人专用电动汽车密码式充电装置<sep>本发明提供了私人专用电动汽车密码式充电装置<sep>包括与电动汽车连接的插头、与电源连接的插座，所述的插头包括与电动汽车连接并与插座相匹配的车辆连接机构，所述的插座包括罩壳、安装于罩壳内的加密接通机构与电路连接机构，加密接通机构采用以磁加密为主的四重加密方式，电路连接机构的一端与电源连接、另一端可与加密接通机构连接，车辆连接机构匹配插入加密接通机构内后<sep>电源电流可通过电流连接机构、加密连接结构、车辆连接机构输送至车辆内为其充电
29	一种电动汽车群的充放电优化控制方法<sep>本发明提供的电动汽车群的充放电优化控制方法包括获取每台参与充放电车辆的次日充放电时间段数据<sep>将次日时间离散为多个时隙，根据所有车辆的次日充放电时间段数据生成时隙集合；获取时隙集合中每个时隙的电力潮流数据和灵敏度数据；根据灵敏度数据采用内点法计算每个时隙中每台车辆的充放电功率<sep>充放电优化控制方法减轻电压波动，降低负荷峰谷差，减少配电网网损，增加电动汽车用户的经济收益
29	一种电动车充电桩的电路保护装置<sep>本发明公开了一种电动车充电桩的电路保护装置<sep>包括充电桩，所述充电桩上设有装夹空间，所述装夹空间的顶面上设有可以将装夹空间密封住的盖板，当在进行充电时，将充电器放置在装夹空间内，使夹紧板将充电器夹住，充电器的输入输出的电线放置在电线槽上，根据充电器的情况对充电进行控制，当充电器的指示灯变化时可以控制充电电路断电，使充电器和电池完全停止充电，减少电池充电时的发生事故的概率，在将插头插入到插孔内之后<sep>插头可以被紧紧的固定在插孔上
29	一种通过能源互联网供能的充电桩<sep>本发明公开了一种通过能源互联网供能的充电桩<sep>包括能量传输单元和充电单元，能量传输单元包括能源模块、能源路由器，以及与能源路由器102连接的配电房，充电单元包括充电桩本体和移动减震模块<sep>本发明所述装置通过能源路由器进行稳定电压，方便接入可再生能源；在充电桩底部设置万向轮，使充电桩可以移动，方便使用；设置网络支付和卡片支付的双重支付方式；在充电桩底部设置有减震装置，在充电桩遇到震动时可以有效地进行减震，增加充电桩使用寿命
29	一种电动汽车双枪直流充电控制系统及控制方法<sep>本发明公开了一种电动汽车双枪直流充电控制系统及控制方法<sep>其中系统包括：在车上设置第一直流充电插电座，在车上还设置有第二直流充电插电座，在充电时分别对应连接两个充电枪，每个充电枪通过对应的充电桩进行充电输出控制；车载bms与每一个充电枪对应的充电桩之间通讯连接，所述第一直流充电插电座、第二直流充电插电座分别通过高压继电器k6、高压继电器k7与车载蓄电池连接<sep>本发明的优点在于：通过两个充电抢对汽车进行充电，可以做到快速的充满蓄电池的目的，提高了充电效率，减少充电时间
29	电动汽车的充电方法<sep>本发明提供一种电动汽车的充电方法<sep>用于对至少两辆车辆进行充电，所述至少两辆车辆包括第一车辆和第二车辆，包括：交流充电桩提供交流电以对第一车辆进行交流充电；所述第一车辆通过直流充电线连接所述第二车辆，且所述第一车辆通过所述直流充电线提供直流电至所述第二车辆，对所述第二车辆进行直流充电<sep>本发明解决了一个充电桩无法自动对两个车辆进行充电的技术问题
29	一种便于收纳连接线的新能源汽车充电桩<sep>本发明公开了一种便于收纳连接线的新能源汽车充电桩<sep>属于充电桩领域<sep>一种便于收纳连接线的新能源汽车充电桩，包括底座，所述底座上固定连接有充电桩本体，所述底座上开设有一对收线槽，所述收线槽内连接有弹性转轴，所述弹性转轴上固定连接有收线盘，所述收线盘的一侧壁上固定连接有四个均匀分布的第一卡位块，所述充电桩本体的内部开设有开口与第一卡位块相对应的第一滑槽，所述第一滑槽内滑动连接有与第一卡位块相匹配的第二卡位块，所述第二卡位块与第一滑槽的内壁之间连接有一对拉伸弹簧，所述第一滑槽的内壁上固定连接有电磁铁<sep>它可以实现易于收纳充电枪连接线
29	一种电动车充电功率的修正方法及系统<sep>本发明提供了一种电动车充电功率的修正方法及系统<sep>采集电动车充电功率，并采集电动车充电过程中的有功功率，通过所述有功功率与采集的电动车充电功率之间的关系计算有功功率补偿系数，有功功率补偿系数的范围为[0，1]，通过所述有功功率补偿系数对所述采集的电动车充电功率进行修正，修正后得到的电动车充电功率较准确，对用户来说，相比于未修正之前能够延长充电时间<sep>对电动车充电功率的管理更加合理
29	一种可在野外使用的充电设备<sep>本发明公开了一种可在野外使用的充电设备<sep>包括充电块，所述充电块的上端设置有开口朝上的存储腔，所述存储腔的下方设置有齿轮腔，所述齿轮腔的右端设置有驱动腔，所述驱动腔内设置有驱动装置，所述齿轮腔左侧上方设置有位于所述存储腔下方左侧的带轮腔，所述带轮腔的下端设置有风扇驱动腔，该装置能够使装置一直处于发电速度最大的状态<sep>缩短给蓄电池充电的时间
29	一种车辆充电场景下的互动方法及互动系统、车辆<sep>本发明实施例涉及电动汽车技术领域<sep>公开了一种车辆充电场景下的互动方法及互动系统、车辆，车辆设置有外置灯具，该方法包括：根据车辆的当前充电情况，控制外置灯具执行与车辆的充电模式相匹配的灯效；其中，不同充电模式可匹配不同灯效<sep>实施本发明实施例，能够使得用户在车外直观地获知车辆的充电状态，提高车辆的智能化程度
29	车辆及其控制方法<sep>本发明提供车辆及其控制方法<sep>该车辆包括：电动机，输出行驶用的动力；蓄电装置，向电动机供给电力；主继电器，设置在电动机与蓄电装置之间；受电连接器，能够与外部充电装置的供电连接器结合；及充电继电器，与受电连接器连接，并且经由主继电器与蓄电装置连接，在主继电器及充电继电器闭合的状态下通过来自外部充电装置的电力对蓄电装置充电的期间，控制装置判定来自外部充电装置的电力是否正在向受电连接器供给，在判定为来自外部充电装置的电力未向受电连接器供给时，使主继电器断开
29	高压充电装置、方法及电动车<sep>本发明提供一种高压充电装置、方法及电动车<sep>所述高压附件装置包括：控制单元，用以获取充电监测信息，以生成充电控制信号和微控隔离信号；微控隔离单元，连接控制单元，用以根据微控隔离信号控制微控制单元的隔离状态；充电单元，连接蓄电单元和控制单元，用以根据充电控制信号控制蓄电单元充电；蓄电单元，藕接充电单元，用以通过充电单元获取并存储电能<sep>利用本发明，有效提高了电动车充电设备可靠性及安全性
29	一种新能源自动充电桩<sep>本发明提供了一种新能源自动充电桩<sep>包括机身、位于所述机身上方的固定架以及与所述固定架配合的插接头，所述机身内设置有第一传动腔，所述第一传动腔内设置有上升装置，所述第一传动腔底壁内设置向下延伸的第二传动腔，所述第二传动腔左侧端壁内设置有开口向右的第一滑动腔<sep>本发明的自动充电桩装置在整体结构上更加合理和巧妙，使用起来也非常方便，可以同时实现接电座的升降与收纳，同时设备能够自行移动，不仅操作方便而且设备的稳定，实用性高，而且上述操作均为自动化操作，同时设备能够收纳接电座，并在充电时利用锁定装置对充电连接处进行锁定提高使用安全性，具有较高的使用和推广价值。
29	一种车载储氢气瓶的供氢系统及其工作方法<sep>一种车载储氢气瓶的供氢系统及其工作方法<sep>属于清洁环保的氢能领域<sep>该供氢系统包括氢源、真空泵、车载储氢气瓶、备用储罐和三级压缩机构。氢源连接第一离子液压缩机。真空泵、第三级高压储罐和备用储罐连接车载储氢气瓶，车载储氢气瓶连接第一级高压储罐。第一高压分离器、第二高压分离器和第三高压分离器经储罐连接氢源。氢源先经过离子液压缩机，再经过冷却器冷却，通过高压分离器分离氢气与水，最后将氢气储存在高压储罐中为车载储氢气瓶供氢<sep>氢气经三级压缩后，在第三级高压储罐不能满足车载储氢气瓶压力要求时，可直接启动备用储罐为车载储氢气瓶快速充气
29	高层住宅中阻碍电动自行车通行的方法<sep>本发明公开了一种高层住宅中阻碍电动自行车通行的方法<sep>阻碍电动自行车通行的装置包括地插座式阻碍物、阻碍板、围栏和无障碍通道。通过在高层住宅入户处设置的具备围栏的无障碍通道内，放置地插座式阻碍物以及阻碍板，限制电动自行车的通行路线以及电动自行车姿态的调整空间，实现阻碍电动自行车通过高层住宅中的无障碍通道进入楼层的效果<sep>本发明可广泛应用于对居民住宅区内的高层住宅现有的无障碍通道进行改进，降低电动自行车通过无障碍通道进入建筑物内部的几率，减少因电动自行车入户所引起的各类不安全因素
29	一种电动汽车高适应性充电系统及方法<sep>本发明涉及一种电动汽车高适应性充电系统及方法<sep>该系统包括动力电池组、电池管理系统，充电接口、充电正极继电器、充电负极继电器和结构变换继电器组；充电正极继电器包括普通充电模式的正极继电器、高压充电模式的正极继电器和低压充电模式的正极继电器；采用构变继电器组控制电池组的串并联结构，调整电动汽车的充电电压；在充电机的许用充电电流下，调整电池组的充电电压以适应所连接的充电桩；对于高电压大功率充电机，提高电池组的充电电压，显著提高电池组的充电功率，缩短充电时间，提高了电动汽车对远距离行驶的适应性<sep>对于低电压充电机，降低电池组的充电电压，使电池组兼容低电压充电机，降低了电动汽车对一般充电基础设施的依赖性。
29	一种基于互联网的汽车充电系统<sep>本发明公开一种基于互联网的汽车充电系统<sep>包括优化充电设备、若干充电桩终端以及若干车载终端，优化充电设备分别与若干充电桩终端以及若干车载终端连接；充电桩终端包括第一处理器以及与第一处理器连接的输出检测模块、参数检测模块、存储数据库和第一通信传输模块；车载终端包括第二处理器以及与第二处理器连接的车载存储器、电量检测模块、第二处理器、连接配对模块和显示终端<sep>本发明引导车辆至充电累计时长最短的充电区域，减少车主盲目寻找浪费的时间，并通过自动拔插和位置的校准定位，提高充电效率，减少等待时长，且结合充电桩内的温度、湿度以及累计充电时长对充电桩的危险性进行评估，提高了充电桩的使用寿命和安全性
29	新能源汽车充电桩用充电枪及包括其的充电桩<sep>公开一种新能源汽车充电桩用充电枪及包括其的充电桩<sep>充电枪包括：枪筒，第一端的端口处设有弹性防护瓣膜；充电插头，可滑动设于枪筒第一端内，充电插头的外周壁上相对两侧各设有一卡凸；两个压柄，分别对称设于所述枪筒外周壁的相对两侧，各个压柄分别可转动连接于枪筒的外周壁上；驱动杆机构，包括对称设置的两个驱动杆组，各个驱动杆组分别包括彼此连接的第一驱动杆和第二驱动杆，两个驱动组的两端分别连接充电插头和各自对应的压柄，压柄下压时驱动驱动杆组带动充电插头外伸；回拉弹簧，设于枪筒内，该回拉弹簧第一端连接于充电插头上，第二端连接于枪筒上<sep>该充电枪使用环境广泛，并且能够防止对充电电极的污染以及触电等安全事故的发生
29	一种新能源汽车的充电自动对接装置<sep>本发明实施例公开了一种新能源汽车的充电自动对接装置<sep>包括通过第一驱动电机驱动且设置在新能源汽车底部的第一卷线轮和设置在车库地面上的安装板，所述第一卷线轮上缠绕有用于为新能源汽车充电的第一充电线，所述第一充电线的一端头设置有充电头，所述安装板上开设有若干个滑动槽，在所述滑动槽内滑动连接有与充电头对应的充电座，且在所述充电座的一侧设置有用于防止第一充电线断裂的缓冲组件，使用时，可将置于车底的充电头放下，进一步在将汽车开进车库时，可带动充电头使其与充电座连接，从而可实现对汽车充电的自动对接，其不仅能够大幅度的降低在使用时<sep>对于车主操作水平的要求
29	一种新能源汽车用地埋式充电桩<sep>本发明公开了一种新能源汽车用地埋式充电桩<sep>包括设置在地面上的绿植区、多个地埋坑和多个充电桩，每个所述地埋坑的内部均设有储水装置，所述储水装置包括两个与地埋坑内部连通的储水箱，两个所述储水箱的内底部均固定有一组推进弹簧，两组所述推进弹簧的上端均固定有与对应储水箱内壁密封滑动的推板<sep>优点在于：通过设置地埋坑，在需要充电时，启动升降杆使得充电桩上升至地面完成充电作业，在充电完毕后，升降杆收缩使得充电桩下移至地埋坑中，使得充电桩在不使用时不会暴露在地面上，从而减少了风吹雨打，使得充电桩的使用寿命提升，同时能够有效避免车辆对充电桩的意外撞击，使得充电桩的使用更加安全
29	发电车快速接入箱<sep>本发明的发电车快速接入箱<sep>通过设置柜体、柜门、配电模组、接地套件及缓冲套件<sep>在实际的应用过程中，柜体和柜门均起到保护的作用；配电模组用于配电；接地套件用于将柜体上的电导入大地，当需要安装接地端子时，将插接件的两个插接脚一一对应插接于两个安装槽内，无需借助任何工具即可将接地端子安装在安装台上，大大提高了安装效率，若后期需要维护或者更换接地端子时，人手握持握持件，将插接件拔出进行维修或者更换即可，无需借助拆卸工具；此外，荧光层的设置能够提示行人接地端子的存在，防止行人无意触碰到接地端子而发生触电事故；缓冲套件的性能能够防止接地套件被损坏，保护接地套件
