label_id	text
29	充电桩和充电板<sep>本发明实施例公开了一种充电板<sep>包括可拆卸地固定在电动汽车中的主体，以及固定在主体上用于从电动汽车获取电力支持和/或用于储存充电的第一电力接收组件。从电动汽车获取的电量；主体上设置有固定结构，用于固定电动滑板车。供电部分设置在主体上，用于利用第一受电部件获得的电能对电动滑板车进行无线充电。其中，固定结构固定在电动滑板车上后，供电部与设置在电动滑板车内的第二电力接收部处于预设位置关系，使得供电部可以通过电动滑板车为电动滑板车充电<sep>设置在电动滑板车中的第二电力接收部
29	一种新能源电动汽车充电枪<sep>本发明属于新能源领域<sep>具体为一种用于新能源电动汽车的充电枪，包括枪体、固定连接在枪体前端的充电头、枪体内的空腔、以及绝缘管固接于空腔内，绝缘管与空腔之间形成储液腔，储液腔内充满绝缘流体，绝缘管两侧设有导电片，两导电片分别与电源线和充电头电连接。绝缘管上设有导电板，导电板与腔体转动连接，导电板可沿绝缘管的轴线转动。两个弧槽，两个弧槽对称布置在绝缘管内壁的两侧；两个导电块，导电块为弧形块，两个弧形块固定连接在导电板的两端，弧形块与绝缘筒的中心重合，弧形块与内壁滑动连接绝缘筒壁<sep>本发明可实现温度过高时自动断电，提高充电过程的安全性，并可实现快速散热效果
29	路灯充电桩智能提醒方法及系统<sep>本发明提供一种路灯充电桩智能提醒方法及系统<sep>根据车主的收费路段，得出车主在该路段的过去违约率；违约是指车主在约定的时间预约到路灯充电桩充电，但在充电完成后的规定时间内没有开车；获取汽车的充电功率，当充电功率超过预设比例时，根据车主默认率判断是否需要获取车主位置。根据车主能否按时回来搬车，预测充电车主违约概率；提前提醒车主及时上门搬车；如果车主在充电完成后在规定时间内没有回来搬车，提醒车主可能造成交通拥堵，违约金将自动扣除；寻找路段附近的停车场，向车主推荐停车场位置，并提醒车主尽快搬家<sep>本发明智能提醒汽车在路灯充电桩充电，可以使提醒内容更有针对性、个性化、智能化，可以让更多的车主减少充电违约，减少交通拥堵
29	电动汽车输电系统直流环节电容的测量<sep>为了检测电力推进车辆中直流电源和逆变器负载之间的直流环节电容器的劣化<sep>在实际使用过程中必须准确地测量环节电容器的电容。在链路电容器上建立充电。将电容器与电源和逆变器负载隔离。启动恒流电路对电容放电。在放电的第一次测量电容器两端的第一电压。在放电过程中第二次测量电容器两端的第二电压。在放电期间测量来自电容器的放电电流。根据放电电流乘以第二次与第一次之差与第一与第二次电压之差的比值，计算出电容<sep>监测计算表明故障电容减小
29	一种新能源汽车充电装置<sep>本发明属于新能源充电技术领域<sep>具体公开了一种新能源汽车的充电装置，包括充电桩本体，该充电桩本体为地下充电桩，充电桩本体通过一杆吊出地面。升降装置。起重装置设置在地下，起重装置与多块汽车压板相连，每块汽车压板均设置在地面上。汽车压板通过弹簧与地面连接。充电桩本体上设有多个充电单元<sep>目的是汽车通过升降装置将充电桩抬起，这样被充电的车辆离开后，充电桩不会因为汽车的离开而倒下，而是当一个充电桩上充电的所有汽车都离开时，可满足多车同时充电的需求，加速新能源汽车的充电效率，满足多种使用场合，易于推广
29	基于数据处理的电动汽车智能充电系统<sep>本发明公开了一种基于数据处理的电动汽车智能充电系统<sep>包括充电停车位、入口处的闸门、底部的重力感应器、充电插头和充电插头。充电插头的外套管上设有第一对接装置；充电桩上设有第一信号发射模块；与充电插头连接的充电插孔；电力监控装置，设置在电动汽车的车身上。电量监测装置包括第二信号接收模块、监测模块、提醒模块和gps定位模块。 gps定位模块中设有规划模块<sep>通过设置电动汽车与充电桩的通信连接，电动汽车可以及时到达充电桩充电；通过设置电动汽车与充电停车位大门的通信连接，非充电车辆占用充电停车位；通过在充电插头外侧安装第一对接装置，保证人身安全，避免因充电不当造成电动汽车损坏
29	一种电动汽车社区充电实时优化调度方法<sep>本发明公开了一种电动汽车社区充电实时优化调度方法<sep>以优化调度周期开始时检测到的实时充电状态数据作为优化调度计算的输入参数，优化系统优化调度模型.在满足约束条件的前提下，计算结果最小化目标函数值，即按照最优调度方案对当前时段的电动汽车进行充电。所需的费用是最少的。优化计算采用实时计算，每个调度周期j计算一次，整个优化计算分为三步：第一步，调度周期前的数据预处理；第二步，根据第一步的结果建立调度优化模型；第三步，利用遗传优化算法计算模型的最优决策值<sep>本发明在满足充足电力的前提下，最大限度地降低了电动汽车的充电成本，保证了住宅电网的安全经济和用户的充电需求
29	充电桩和充电板<sep>本发明实施例公开了一种充电板<sep>包括可拆卸地固定在电动汽车中的主体，以及固定在主体上用于从电动汽车获取电力支持和/或用于储存充电的第一电力接收组件。从电动汽车获取的电量；主体上设置有固定结构，用于固定电动滑板车。供电部分设置在主体上，用于利用第一受电部件获得的电能对电动滑板车进行无线充电。其中，固定结构固定在电动滑板车上后，供电部与设置在电动滑板车内的第二电力接收部处于预设位置关系，使得供电部可以通过电动滑板车为电动滑板车充电<sep>设置在电动滑板车中的第二电力接收部
29	一种新能源电动汽车充电枪<sep>本发明属于新能源领域<sep>具体为一种用于新能源电动汽车的充电枪，包括枪体、固定连接在枪体前端的充电头、枪体内的空腔、以及绝缘管固接于空腔内，绝缘管与空腔之间形成储液腔，储液腔内充满绝缘流体，绝缘管两侧设有导电片，两导电片分别与电源线和充电头电连接。绝缘管上设有导电板，导电板与腔体转动连接，导电板可沿绝缘管的轴线转动。两个弧槽，两个弧槽对称布置在绝缘管内壁的两侧；两个导电块，导电块为弧形块，两个弧形块固定连接在导电板的两端，弧形块与绝缘筒的中心重合，弧形块与内壁滑动连接绝缘筒壁<sep>本发明可实现温度过高时自动断电，提高充电过程的安全性，并可实现快速散热效果
29	路灯充电桩智能提醒方法及系统<sep>本发明提供一种路灯充电桩智能提醒方法及系统<sep>根据车主的收费路段，得出车主在该路段的过去违约率；违约是指车主在约定的时间预约到路灯充电桩充电，但在充电完成后的规定时间内没有开车；获取汽车的充电功率，当充电功率超过预设比例时，根据车主默认率判断是否需要获取车主位置。根据车主能否按时回来搬车，预测充电车主违约概率；提前提醒车主及时上门搬车；如果车主在充电完成后在规定时间内没有回来搬车，提醒车主可能造成交通拥堵，违约金将自动扣除；寻找路段附近的停车场，向车主推荐停车场位置，并提醒车主尽快搬家<sep>本发明智能提醒汽车在路灯充电桩充电，可以使提醒内容更有针对性、个性化、智能化，可以让更多的车主减少充电违约，减少交通拥堵
29	电动汽车输电系统直流环节电容的测量<sep>为了检测电力推进车辆中直流电源和逆变器负载之间的直流环节电容器的劣化<sep>在实际使用过程中必须准确地测量环节电容器的电容。在链路电容器上建立充电。将电容器与电源和逆变器负载隔离。启动恒流电路对电容放电。在放电的第一次测量电容器两端的第一电压。在放电过程中第二次测量电容器两端的第二电压。在放电期间测量来自电容器的放电电流。根据放电电流乘以第二次与第一次之差与第一与第二次电压之差的比值，计算出电容<sep>监测计算表明故障电容减小
29	一种新能源汽车充电装置<sep>本发明属于新能源充电技术领域<sep>具体公开了一种新能源汽车的充电装置，包括充电桩本体，该充电桩本体为地下充电桩，充电桩本体通过一杆吊出地面。升降装置。起重装置设置在地下，起重装置与多块汽车压板相连，每块汽车压板均设置在地面上。汽车压板通过弹簧与地面连接。充电桩本体上设有多个充电单元<sep>目的是汽车通过升降装置将充电桩抬起，这样被充电的车辆离开后，充电桩不会因为汽车的离开而倒下，而是当一个充电桩上充电的所有汽车都离开时，可满足多车同时充电的需求，加速新能源汽车的充电效率，满足多种使用场合，易于推广
29	基于数据处理的电动汽车智能充电系统<sep>本发明公开了一种基于数据处理的电动汽车智能充电系统<sep>包括充电停车位、入口处的闸门、底部的重力感应器、充电插头和充电插头。充电插头的外套管上设有第一对接装置；充电桩上设有第一信号发射模块；与充电插头连接的充电插孔；电力监控装置，设置在电动汽车的车身上。电量监测装置包括第二信号接收模块、监测模块、提醒模块和gps定位模块。 gps定位模块中设有规划模块<sep>通过设置电动汽车与充电桩的通信连接，电动汽车可以及时到达充电桩充电；通过设置电动汽车与充电停车位大门的通信连接，非充电车辆占用充电停车位；通过在充电插头外侧安装第一对接装置，保证人身安全，避免因充电不当造成电动汽车损坏
29	一种电动汽车社区充电实时优化调度方法<sep>本发明公开了一种电动汽车社区充电实时优化调度方法<sep>以优化调度周期开始时检测到的实时充电状态数据作为优化调度计算的输入参数，优化系统优化调度模型.在满足约束条件的前提下，计算结果最小化目标函数值，即按照最优调度方案对当前时段的电动汽车进行充电。所需的费用是最少的。优化计算采用实时计算，每个调度周期j计算一次，整个优化计算分为三步：第一步，调度周期前的数据预处理；第二步，根据第一步的结果建立调度优化模型；第三步，利用遗传优化算法计算模型的最优决策值<sep>本发明在满足充足电力的前提下，最大限度地降低了电动汽车的充电成本，保证了住宅电网的安全经济和用户的充电需求
29	一种电动汽车充电预警方法及系统<sep>本发明公开一种电动汽车充电预警方法及系统<sep>该方法包括：获取电动汽车中的各单体电池的电池信息；实时测量各单体电池的充电实时电压；判定电动汽车的电池类型及电池的老化程度；根据电池类型和老化程度，得到预警信息；确定第一预警电压值及第二预警电压值；判断充电实时电压是否大于所述第二预警电压值，若不大于则进行大倍率充电模式；若大于则判断充电实时电压是否小于第一预警电压值；若小于则发出警报并将大倍率充电模式变换为小倍率充电模式；否则停止充电<sep>采用本方法或系统减轻了bms的工作压力，避免因bms故障发生充电事故，降低汽车成本并且提高了安全性
29	电动车充电控制设备<sep>本发明涉及电动车充电的技术领域<sep>公开了电动车充电控制设备，包括充电桩、控制器以及线路管道，充电桩连接有多个独立布置的充电线路，充电线路连接有充电头，控制器分别与充电线路及电源线路连接；充电线路置于所述线路管道中，线路管道上具有多个充电位，充电位上设置烟雾传感器，充电线路上设置有继电器以及短路检测元件；烟雾传感器及短路检测元件将监测数据传输给控制器，控制器控制继电器的导通或断开<sep>在进行充电的过程中，当有电动车短路导致周边环境起火，烟雾传感器感应到烟雾后，或者发生短路现象时，控制器则可以控制继电器断开，中断充电，保证整个充电过程的安全性，大大提高充电操作的安全性。
29	一种新能源汽车的快速充电装置<sep>本发明属于新能源汽车充电技术领域<sep>尤其是涉及一种新能源汽车的快速充电装置，包括充电桩体，所述充电桩体的前侧壁上开设有第一凹槽，且第一凹槽的内壁上开设有与其连通的第二凹槽，所述第二凹槽的侧壁上固定连接有双轴电机，所述双轴电机的外侧固定套接有方形框架，所述双轴电机的两个输出端分别固定连接有第一螺纹杆，所述第二凹槽的内壁上开设有与第一螺纹杆位置对应的圆形凹槽，且第一螺纹杆远离双轴电机的一端与圆形凹槽的内壁转动连接，所述方形框架的左右侧壁上均固定连接有水平的限位杆<sep>优点在于：本发明能够自动控制充电插接工作，并且能够满足两台电动汽车的同时使用，提高了空间的使用率
29	对多发射端/单接收端无线充电系统的互感估计方法<sep>本文公开了一种多发射端/单接收端无线充电系统的互感估计方法<sep>多个独立设置的发射线圈上的开关断开发射线圈，再将接受线圈与耦合驱动支路连通从而产生电磁场，使系统计入互感估计状态，无电流；发射线圈在电磁场中产生感应电动势，测得每个发射线圈的电动势；通过基尔霍夫电学理论对两线圈中的求解，即可得到每个发射线圈与接收线圈的互感；然后将接收线圈与负载回路连接，再闭合发射线圈开关，使系统进入电能传输状态。本发明由于发射线圈处于断开状态，只有感应电动势，而无电流，避免了过载的风险<sep>该方法的优势是快速、准确并且安全的对收/发线圈之间的互感做出估计，使得多发射端/单接收端无线充电系统对电动车的高效充电成为了可能
29	一种用于电动车的充电插座及充电系统<sep>本发明适用于电动车充电技术领域<sep>提供了一种用于电动车的充电插座及充电系统，所述充电插座包括：所述充电插座与集中器一体设置，所述充电插座具有第一状态和第二状态，所述第一状态为所述充电插座仅具有充电功能，所述第二状态为所述充电插座兼具集中器和充电两种功能<sep>使得充电站工作人员可以根据充电站的工程规模自由进行二层或者三层组网，提升了充电站的可扩展性，并且提高了资源的利用效率
29	充电接口防护组件及电动汽车<sep>本发明涉及电动汽车充电小门技术领域<sep>旨在解决现有的电动汽车充电接口的密封盖连接件易损坏和充电操作不方便的问题。为此，本发明提供了一种充电接口防护组件及电动汽车，充电接口包括充电插座，防护组件包括护盖和驱动部件，驱动部件与护盖连接，用于驱动护盖与充电插座抵接以便封闭充电插座的插座口。本发明的充电接口防护组件，通过设置护盖和用于驱动护盖的驱动部件，使得护盖能够在驱动部件的驱动下与充电插座抵接或分离，实现插座口的自动封闭或打开<sep>对于安装有该防护组件的电动汽车，在需要使用充电插座时，无需手动揭下护盖和放置护盖，简化了操作步骤，避免了链条划伤车体或因铰链损坏使密封盖丢失的问题，从而提升了用户体验
29	充电站的充电调度方法、充电调度系统及充电站<sep>本申请适用于新能源技术领域<sep>本申请实施例中提供一种充电站的充电调度方法、充电调度系统及充电站，其中方法包括：获取充电的电动汽车的需求充电量、开始充电时间、结束充电时间、最大充电功率及变压器的额定功率；获取结算周期内的峰值功率电价及不同的时槽对应的分时电价；根据需求充电量、开始充电时间、结束充电时间、最大充电功率及充电站中变压器的额定功率，结合峰值功率电价及分时电价，获取不同的电动汽车在不同的时槽中的充电需求功率<sep>根据充电需求功率，进行供电输出，实现对电动汽车的合理充电分配，提升充电站的充电效率及充电安全性。
29	一种新能源汽车的停车坪<sep>本发明公开了一种新能源汽车的停车坪<sep>包括基座、连接箱、固定框、活动框和活动板，所述基座上螺栓固定有与外界电网相连的充电桩，且充电桩与所述连接箱焊接为一体，并且基座分别与设置有所述固定框和所述活动框，所述活动板位于充电桩的正前方，所述固定框的正面内嵌有反光条，且所述固定框与所述活动框相贴合<sep>本新能源汽车的停车坪设置有活动板，当人们将车辆停放在停车坪上时，车辆的后轮会压在活动板上，活动板受到压力后，会将车辆施加的压力转变为带动活动框移动的动力，这样活动框就会进行水平位移，在移动过程中，会将挡雨棚拉伸开，从而挡雨棚可以为人们挡雨遮阳，在雨天来临时，方便了人们进行停车充电，使用效果好
29	一种电动公交车无人自动充电装置<sep>本发明公开了一种电动公交车无人自动充电装置<sep>涉及新能源汽车技术领域<sep>包括防雨棚、充电桩、以及充电组件，所述充电桩安装于防雨棚的一侧，所述充电组件安装于防雨棚的底面，所述充电组件包括充电电极、充电座、横向电机、丝杠、丝杠螺母、定位板以及收纳腔，本发明结构简单，可操作性强，充电稳定性好，采用可移动式的充电组件，可以根据不同工况的需要及时调整充电电极所处的位置，同时，在不使用时，也能收至收纳腔内<sep>减少外界环境对其造成的影响
29	高压下电控制方法、交流充电系统及电动汽车<sep>本发明实施例公开了一种高压下电控制方法、交流充电系统及电动汽车。该方法包括：接收电池管理模组发送的停止充电请求<sep>根据所述停止充电请求，控制电流转换器和充电机退出使能模式，检测所述充电机的输出电流和动力电池的输入电流，当所述充电机的输出电流和动力电池的输入电流满足设定条件时，控制与所述动力电池连接的主正继电器和主负继电器断开，控制电机控制器主动放电，以完成高压下电<sep>本发明实施例只有当充电机的输出电流和动力电池的输入电流均满足设定条件时，才会控制继电器断开，解决了现有技术中因电流检测装置精度差而引起系统电压异常升高的问题
29	一种电动汽车充电接头<sep>本发明涉及一种电动汽车充电接头<sep>包括承载基座、承载龙骨、收线轮、收线驱动机构、充电母线、接线端子、限流熔断器、过载保护电路、充放电控制器及综合控制电路，限流熔断器、过载保护电路、充放电控制器及综合控制电路均嵌于承载基座内，承载龙骨与承载基座上端面铰接，收线轮嵌于承载龙骨内且收线轮其中一端通过传动轴与收线驱动机构相互连接，充电母缠绕在一个收线轮上，充电母线两端分别接线端子电气连接<sep>本发明一方面极大的提高了充电作业的灵活性和便捷性，另一方面实现充电操作部位与充电电路间有效的绝缘隔离，并可对充电过程中的状态进行有效控制管理，从而极大的提高充电作业的安全性及可靠性
29	无线充电车位的充电控制方法、装置、设备和存储介质<sep>本申请涉及一种无线充电车位的充电控制方法、装置、计算机设备和存储介质<sep>所述方法包括：接收无线充电车位使用请求；无线充电车位使用请求携带使用车位标识信息和使用用户标识信息；查询使用车位标识信息对应的无线充电车位的预约状态；若无线充电车位的预约状态为已预约且查询到预约用户标识信息，且预约用户标识信息与使用用户标识信息一致，则发送无线充电车位可使用的提示信息至使用用户标识信息对应的用户终端；接收携带使用用户标识信息的充电请求，根据充电请求，对无线充电车位上的车辆进行充电。采用本方法能够减少无关车辆占用无线充电车位的情况，提升无线充电车位的使用效率<sep>且可以节约无线充电车位的地表使用空间，降低布置成本
29	一种用于电动汽车的充电装置<sep>本发明公开了一种用于电动汽车的充电装置<sep>包括机体，所述机体中左右对称设有水箱，所述水箱的底侧设有升降腔，所述升降腔的左右两侧对称设有带动空间，本发明可以安装在地下车库等地方的天花板中，从而可以有效得防止因为地下车库位置狭小而造成车辆将充电桩撞毁，可以保障人们汽车的财产安全的同时，也保障了充电桩的安全，同时本发明可以自动进行灭火，从而防止锂电池在充电的时候，因为温度升高而造成火灾的问题，从而保障了人们的生命安全，同时本发明设有触发装置<sep>从而不会在充电桩体下降的时候
29	一种用于电瓶车电瓶充电的保护装置<sep>本发明公开了一种用于电瓶车电瓶充电的保护装置<sep>包括机体，所述机体中设有充电腔，所述充电腔的右侧壁上下对称设有限位滑槽，当需要给锂电池充电的时候，用手打开开关门，然后将锂电池放入充电腔中，本发明相较于传统的电瓶车充电器，可以单独给锂电池进行充电，在充电的时候，时时刻刻抽入冷风，给正在充电的电池进行降温冷却，从而保护了电池的同时，减少了着火的几率,假如电池突然着火的时候，可以通过自带的灭火材料进行快速喷射降温，进行紧急灭火<sep>从而有效得防止了火灾的发生
29	一种具有多种充电模式的电动汽车充电系统及充电方法<sep>一种具有多种充电模式的电动汽车充电系统及充电方法<sep>属于电动汽车充电技术领域<sep>解决了由于现有电池充电站中电压转换装置的限制，导致无法满足电动汽车的大功率充电需求或快充需求的问题。本发明通过从ac/dc变换器将电网电能储存到扩充结构的电池组。当电动汽车需要快速充电时，电网及扩充结构的电池组同时对电动汽车进行充电；当电动汽车进行慢充时，电网通过主ac/dc变换器直接对电动汽车的充电端口供电；当无电动汽车充电时，电网对扩充结构的电池组充电；当电动汽车充电功率需求不同时，判断电动汽车的需求功率是否大于转换装置的额定输出功率，若是则使扩充结构与电网一起供电<sep>本发明适用于作为电动汽车充电桩使用
29	一种充电功率分配模块的检测装置<sep>一种充电功率分配模块的检测装置<sep>涉及新能源充电技术领域<sep>包括用于定位放置功率分配模块的底座，底座的一侧设置有用于功率分配模块宽度方向定位的第一定位块，底座的一端设置有用于功率分配模块长度方向定位的第二定位块；底座上连接有垂直向上的连接架，连接架的上方中部安装有升降驱动器，升降驱动器的伸缩端垂直向下、并连接有连接座，连接座的下端面连接有多个测试探针，测试探针的数量与底座上定位放置的功率分配模块输入端的接线端子相同、并且上下位置一一对应<sep>本实用新型简化了相应的过程操作，提升了品检效率，降低了人员劳动强度
29	一种国标obc产品适配美标充电枪的方法<sep>本发明提供一种国标obc产品适配美标充电枪的方法<sep>该方法采用包含美标充电枪、充电标准转换适配器、国标obc产品，其特征在于，在美标充电枪和国标obc产品之间加入充电标准转换适配器，把美标充电枪的pp信号转换成国标obc产品可以识别的cc信号<sep>本发明提供的这种国标obc产品适配美标充电枪的方法，实现了充电标准的转换，使得国标obc产品能够适用于美标充电枪，为国标obc产品在国际市场的推广扫平了障碍，为中国新能源汽车的发展做出贡献
