label_id	text
18	一种无水制备建筑装饰硅酸钙板的方法<sep>湖州达立智能设备制造有限公司<sep>本发明涉及本发明涉及建材制备技术领域<sep>特别是涉及一种无水制备建筑装饰硅酸钙板的方法，所述无水制备建筑装饰硅酸钙板的方法，包括以下步骤：（1）将硅质原料、钙质原料在含蜡介质中研磨分散均匀，得到混合料；（2）将混合料置于模具中，然后压制成型，得到预制板材；（3）将预制板材在蒸气中放置3~24h，然后取出干燥，得到建筑装饰硅酸钙板<sep>本发明在无水条件下预先压制成型，防止提前水合反应，使得后续养护时得到的硅酸钙晶体为整体，大幅提升硅酸钙板的强度，无需使用纤维增强；后续蒸汽养护时蜡质材料从硅质材料、钙质材料表面脱落，逐步水合反应，形成的硅酸钙密实而均匀，避免了自由水复合发造成的空隙，提高了硅酸钙板的强度和压实度
18	一种改性铝硅质颗粒及其改性剂<sep>武汉理工大学<sep>本发明公开了一种改性铝硅质颗粒及其改性剂<sep>在40‑60℃采用气相沉积的方法将改性剂喷涂到铝硅质颗粒表面制备而来；所述改性剂制备方法如下：将甲氧基聚乙二醇丙烯酸酯和水加入到反应釜中，升温到30‑50℃，加入过氧化氢；同时向反应釜中滴加丙烯酸、巯基丙酸和辛硫醇，滴加完成后，熟化；向反应釜中加入氢氧化钠，调节ph至5‑7；继续加入硫酸钠和乙酰乙酸乙酯，完全溶解后加入三异丙醇胺、三乙醇胺和水，制得改性剂溶液<sep>本发明所得改性铝硅质超细颗粒用于水泥基材料显著提高氯离子固化率，提高幅度达50％，减少氯离子对钢筋的破坏；还能代替水泥用量，显著提高早期和后期强度、优化孔结构
18	一种自析晶微晶玻璃及其制备方法和应用<sep>华南理工大学<sep>本发明公开了一种自析晶微晶玻璃<sep>以bi掺杂的zro为微晶相；所述微晶玻璃的组成为zro‑alo‑baco‑hbo‑bio，各组分的摩尔百分比分别为：5～30％的zro，0～5％的alo，0～30％的baco，0.01～5％的bio，余量的hbo。本发明的微晶玻璃可不经过热处理直接获得<sep>且在紫外光350nm激发下具有强烈的宽带黄光发射，发光范围(410‑750nm)覆盖蓝光、绿光和红光区，发光峰位为560nm，可用于紫外芯片激发的大功率白光led
18	一种用于传统土窑民居墙体抹面的轻质砂浆及其加工方法<sep>河北建科唐秦建筑科技有限公司<sep>一种用于传统土窑民居墙体抹面的轻质砂浆及其加工方法<sep>所述轻质砂浆是由下述原料制成的：水泥90～110份，浮石砂180～210份，熟石灰90～110份，水40～60份，秸秆纤维20～25份，橡胶颗粒25～35份，矿粉17～23份，糯米汁12～17份，松香9～12份，环氧树脂10～15份，萘系减水剂3～5份，硅树脂聚醚乳液3～5份，脂肪醇聚氧乙烯醚硫酸钠10～15份；糯米汁中糯米粉的质量分数为45％～65％。本发明还提供了轻质砂浆的加工方法<sep>本发明的轻质砂浆具有重量轻、早期强度高、粘结力强、抗渗性好、抗冻性好、耐久性强、保温隔热性能好等特点，满足了传统土窑民居墙体抹面对砂浆性能的要求，同时利用农业废秸秆、工业废橡胶等原料，绿色环保
18	一种具有晶体定向排列结构的高硬度透明微晶玻璃及其制备方法<sep>景德镇陶瓷大学<sep>本发明公开了一种具有晶体定向排列结构的高硬度透明微晶玻璃<sep>由mgo‑bo‑alo‑sio体系的基础玻璃、以及其表面的具有垂直定向排列结构的堇青石晶体层构成。此外还公开了上述具有晶体定向排列结构的高硬度透明微晶玻璃的制备方法<sep>本发明通过配方的调整和工艺的优化，以mgo‑bo‑alo‑sio体系组成的基础玻璃，结合其表面上原位生长的、具有晶体定向排列结构的堇青石晶体层，实现了微晶玻璃硬度、耐磨性以及光学性能的大幅度提升；并且技术方案简单可行，可广泛应用于有高耐磨需求的穿戴设备用电子玻璃、屏幕玻璃、光学窗口等领域，对于光学材料和电子玻璃材料领域的技术发展和应用具有重要的促进作用
18	用于防渗漏的塑性混凝土及其制备方法<sep>中国港湾工程有限责任公司<sep>本发明公开了一种用于防渗漏的塑形混凝土及其制备方法<sep>包括以下重量份组分制备而成：水泥23份、杜拉纤维0.2份、发泡剂0.1份、萘系减水剂0.5份、水20份、塑性调节剂0.2份、石膏15份、活性掺合液10份、活性炭0.2份、陶沙35份、以及碎石5份；步骤一、将发泡剂与水搅拌，然后加入萘系减水剂搅拌均匀，加入水泥和碎石搅拌均匀，加入塑性调节剂混合均匀、加入杜拉纤维和陶沙搅拌均匀得到混合物；步骤二、将活性掺合液与石膏和活性炭预先搅拌均匀，并置于1.05mpa、120℃条件下处理30min，再加入到步骤一中的混合物中并搅拌均匀，即得混凝土<sep>本发明具有提高混凝土的抗渗性能和塑形性能的有益效果
18	一种氧化锆修复体与天然牙粘接结合的方法<sep>杭州而然科技有限公司<sep>本发明公开了一种氧化锆修复体与天然牙粘接结合的方法<sep>本方法不采用现有的喷砂工艺处理，而对牙科氧化锆基陶瓷表面进行铣削加工，在不造成材料机械创伤，不影响其后期机械强度的条件下通过在表面制备微纹饰进行表面粗化<sep>提高氧化锆陶瓷的比表面
18	一种多层多孔空心碗形碳材料及其制备方法<sep>北京科技大学<sep>一种多层多孔空心碗形碳材料及其制备方法<sep>属于无机材料制备领域。该材料为碗形空心结构的无定形碳质颗粒，呈凹陷状的碗形形貌，内部具有空心结构，球壁为多层结构，碗壁上存在孔洞，包括微孔和介孔。本发明将表面活性剂、碳源分别溶于水中，进行水热碳化，得到水热碳空心碗形碳；将粉体分散在碱性水溶液中，滴入正硅酸乙酯，搅拌一定时间，然后对产物进行收集，然后，分散到碳源水溶液中，进行水热碳化包覆；根据层数的需要，重复氧化硅包覆和碳包覆步骤；最后，煅烧粉末并酸洗，去除含硅化合物，干燥后得到多层多孔空心碗形碳材料<sep>本材料具有高的空间利用率和振实密度，多层球壁可为化学反应提供大量活性位点，该方法可实现球壁层数和厚度的可控合成
18	一种碳化硅-镁铝尖晶石复合耐火材料<sep>中钢集团洛阳耐火材料研究院有限公司<sep>本发明属于耐火材料领域<sep>提出一种碳化硅‑镁铝尖晶石复合的耐火材料。提出的一种碳化硅‑镁铝尖晶石复合耐火材料的原料包括骨料和基质；以碳化硅颗粒为骨料，采用镁铝尖晶石、氧化铝、氧化镁的细粉或微粉作为基质，基质中还加入有抗氧化剂；骨料、基质与结合剂混匀后成型，经干燥后在埋炭或氮气气氛保护下烧成得到一种以sic为主晶相、镁铝尖晶石为次晶相的复合耐火材料，其中sic质量分数为58.5～83.5%、alo质量分数为10～28.5%、mgo质量分数为2.5～11%，显气孔率15～19%<sep>本发明产品不含氧化铬，价格低廉、绿色环保，具有强度高、抗热震性好，抗熔渣侵蚀性和抗熔渣渗透性优异等特点
18	一种高吸附性的膨胀蒙脱土及其制备方法<sep>北京航空航天大学<sep>本发明涉及一种膨胀层状硅酸盐<sep>特别涉及一种具有高吸附性的膨胀蒙脱土，以及该材料的制备方法和用途<sep>在膨胀蒙脱土的制备过程中，将聚醚胺盐改性的蒙脱土长时间分散在n‑甲基吡咯烷酮中，形成分散性良好的剥离型蒙脱土，然后通过低温去除有机物，高温下进行蒙脱土活化处理，得到了低堆密度的膨胀蒙脱土，其吸附效果堪比膨胀石墨，吸附率达到90wt％以上，该材料可以广泛应用于相变储能材料、建筑材料、保温材料等诸多领域
18	一种陶瓷釉料、制备方法及其施用方法<sep>平顶山学院<sep>本发明公开了一种陶瓷釉料<sep>其原料由以下重量份数的组分组成：40～50份的钢渣、10～20份的钾长石、5～10份的硼砂、3～5份的稻草灰、1～2份的yo、1～3份的六偏硫酸钠、0.5～1份的羟甲基纤维素钠、0～3份的萤石、0～3份的zno、0～2份的cuo、0～6份的coo。此外，本发明还提供了一种陶瓷釉料的制备方法及其施用方法<sep>本发明以钢渣为主要原料代替天然原料制备陶瓷釉料，降低了陶瓷釉料的生产成本，且本发明通过调节配方组成和添加不同色料可制得黑色、绿色、红色等不同颜色的釉料，制得的陶瓷釉料对坯体适应性强，熔融良好，还具有光泽度好、色泽鲜艳、性能稳定的优点
18	一种水泥熟料的制备方法<sep>重庆市富丰水泥集团特种水泥有限公司<sep>本发明属于建筑材料领域<sep>具体的说是一种水泥熟料的制备方法，该方法中使用的粉磨装置包括箱体、电机和鼓风机；所述箱体上端中部设有电机，所述箱体中部设有一号长轴，所述一号长轴顶部连接有一号齿轮，所述一号齿轮两侧对称啮合有二号齿轮，所述二号齿轮均连接有二号长轴，所述二号长轴底部连接有啮合的锥形齿轮副，所述箱体底部设有三号长轴，所述三号长轴连接在锥形齿轮副上，三号长轴两端安装有凸轮；所述一号长轴底部安装有甩桶，所述甩桶使原料碰撞挤压；所述凸轮上方设有压板，所述压板连接有筛网，装置通过一系列传动装置带动筛网对原料进行破碎细化<sep>所述压板内设有t形滑板，所述t形滑板对筛网进行撞击，使原料粉磨细化得更均匀。
18	一种夹层玻璃成型装置<sep>黄山市歙县凯旋工贸有限公司<sep>本发明提供一种夹层玻璃成型装置的具体技术方案<sep>其特征在于，包括包括多个夹层玻璃成型单元、真空装置和控制器，所述夹层玻璃成型单元包括预热室、真空室、冷却室、第一耐热绝缘隔板和第二耐热绝缘隔板，所述真空装置包括真空泵和真空管<sep>本发明的一种夹层玻璃成型装置，结构简单，设计新颖，预热段为真空高温挤压成型段提供了基础，降低了真空高温挤压成型段加热时间，提高了生产效率，真空高温挤压成型避免了高压生产，降低了生产风险，冷却阶段加快了成型夹层玻璃的冷却时间，同时该装置包括多个夹层玻璃成型单元，一次可以多块生产，进一步提高了生产效率
18	一种复相陶瓷铸型的激光选区快速成型方法及其产品<sep>北京钢研新冶精特科技有限公司<sep>本发明属于陶瓷制备领域<sep>并公开了一种复相陶瓷铸型的激光选区快速成型方法及其产品，该方法包括如下步骤：将不同粒径的alo粉体与环氧树脂e12充分混合后获得alo‑e12复合粉末，利用该粉末进行选择性激光烧结(sls)快速成型，得到alo‑e12铸型生坯，表面清粉后在真空下进行硅溶胶浸渗处理，然后对其脱脂和预烧得到alo‑sio陶瓷铸型生坯，再次在真空下对其进行硅溶胶浸渗处理，最后高温烧结制得所述复相陶瓷铸型<sep>本发明仅需采用简单的机械混合即能确保原料粉体具有良好的流动性能和sls成型性能，并且通过引入二次硅溶胶真空浸渗工艺，在确保尺寸精度的同时提升所得陶瓷铸型的致密度
18	一种干拌砂浆用机制砂的级配方法及制备的干拌砂浆<sep>章丘华明水泥新型建材有限公司<sep>本发明涉及一种干拌砂浆用机制砂的级配方法及制备的干拌砂浆<sep>本发明干拌抹灰砂浆用机制砂的级配方法如下：将粒径在4.75mm以下、细度模数2.3‑3.0的机制砂部分，筛分成粗砂、中砂、细砂三种砂，其中粗砂细度模数4.3～4.6，中砂细度模数3.7～4.0，细砂细度模数1.4～1.7。进一步地，本发明根据上述机制砂的级配配方，进行干拌砂浆的配制，根据砂浆品种调整其中两种或三种砂配比。并控制好0.15以下粉含量高低，进而能够有效控制砂浆中的粉含量的高低：砌筑砂浆(dmm)细度模数2.3～2.6；抹灰砂浆(dpm)的粉含量控制在26﹪～30﹪之间，成品砂浆的细度模数控制在2.1～2.3之间。保证了砂浆的质量<sep>结合复合外加剂的使用，大大提高了砂浆的施工性能，保证了砂浆的质量
18	混合水泥<sep>住友大阪水泥股份有限公司<sep>提供：包含煤灰、维持煤灰作为混和材料的特性、并且短期的强度表现性高的混合水泥<sep>一种混合水泥，其相对于煤灰和波特兰水泥的总计量，包含sio含量为55～60质量％且sio/alo的质量比为2.3～2.7的煤灰20～40质量％、和波特兰水泥60～80质量％，且包含具有3个碳数3以下的直链状的烷醇基的三烷醇胺100～300mg/kg
18	一种碳化硅聚合物先驱体陶瓷缺陷愈合方法<sep>厦门大学<sep>一种碳化硅聚合物先驱体陶瓷缺陷愈合方法<sep>涉及陶瓷材料制备<sep>将pcs粉末、vtes与卡斯特催化剂溶解于二甲苯中得二甲苯溶液，将go粉末分散于水中得水溶液；将二甲苯溶液和水溶液混合，水浴加热并用磁力搅拌器搅拌，反应后静置，取上层液体旋蒸后研磨，得先驱体pvg粉末，模压成型后得sic(rgo)素坯，将素坯置于气氛管式炉内氩气气氛下高温烧结，随炉冷却后即得黑色3d‑sic(rgo)陶瓷，然后浸没于分子量较小的液态聚碳硅烷先驱体中，浸渍后取出晾干，于氩气气氛中高温裂解，重复多次后即得浸渍3d‑sic(rgo)陶瓷，在不同温度下于空气中高温氧化，即得愈合3d‑sic(rgo)陶瓷
18	一种氧化钇-氧化镁纳米复合粉体及其制备方法<sep>航天特种材料及工艺技术研究所<sep>本发明涉及一种氧化钇‑氧化镁纳米复合粉体及其制备方法<sep>所述制备方法包括：配制包含钇离子和镁离子的金属离子溶液，然后向金属离子溶液中加入分散剂，得到反应溶液；将反应溶液和络合剂混合，调节混合体系的ph，然后将混合体系进行时效反应，得到溶胶体系；将溶胶体系进行溶胶‑凝胶化处理，得到湿凝胶；将湿凝胶进行冷冻干燥，得到干凝胶粉末；将干凝胶粉末进行煅烧，得到所述氧化钇‑氧化镁纳米复合粉体<sep>该制备方法采用氧化镁做为第二相引入氧化钇多晶材料中，形成纳米复合陶瓷，可改善单相多晶透明陶瓷的缺陷，抑制氧化钇制晶粒长大；通过调节溶胶‑凝胶制粉工艺获得形貌均匀、分散性好，粒径小于20nm的氧化钇‑氧化镁纳米复合粉体
18	一种具有空间三维导电网络结构的陶瓷及其制备方法<sep>三峡大学<sep>本发明公开一种具有空间三维导电网络结构的陶瓷及其制备方法<sep>属于导电材料制备领域。所述制备方法主要包括石墨骨架三维结构的设计制备及强化处理，陶瓷浆料的制备，浇注工艺和干燥、烧结工艺四个步骤。本方法制备的石墨/氧化铝陶瓷复合材料可以直接通过控制石墨的组成成分、尺寸结构和后处理以及烧结工艺和干燥工艺的改进，制备石墨/陶瓷导电复合材料。在提高导电性能的前提下，保证力学性能，实现石墨的按需分配<sep>石墨/氧化铝陶瓷复合材料能够具有石墨导电性能，同时又具有陶瓷的结构特征，如化学性质稳定、耐高温、抗氧化、抗辐射、耐腐蚀等，具有广阔的应用前景
18	一种耐久型混凝土养护剂<sep>广州市克来斯特建材科技有限公司<sep>本发明公开了一种耐久型混凝土养护剂<sep>属于建筑材料技术领域。本发明按重量份数计，将20～30份硝酸钙溶液，40～50份壳聚糖液，10～20份尿素，20～30份巴氏芽孢杆菌菌液搅拌混合，随后加入壳聚糖液体积0.2～0.3倍的硫酸钠溶液，继续搅拌混合，降温，滴加壳聚糖液体积0.3～0.4倍的戊二醛溶液，继续搅拌混合，调节ph，过滤，干燥，即得改性微囊；将改性微囊，桃胶液，阿拉伯胶液，表面活性剂，磷脂，硅烷偶联剂，改性麦饭石和水搅拌混合，即得耐久型混凝土养护剂<sep>本发明技术方案制备的耐久型混凝土养护剂具有对混凝土的力学性能及耐久性能具有显著的提高效果的特点
18	一种气密性混凝土材料及其制备方法<sep>江南大学<sep>本发明公开了一种气密性混凝土材料<sep>由连续级配石灰岩质粗骨料、洁净中河砂、磨细矿粉、ii级粉煤灰、普通硅酸盐水泥、高效减水剂、特种引气剂、水经搅拌、密实成型、标准养护制作而成，是有瓦斯等有毒有害气体外溢等环境隧道二衬结构的主要混凝土材料<sep>其主要特征在于致密，因亚观结构中毛细孔内存在弹性气泡，抗气体渗透能力、抗渗能力、抗碱骨料反应、抗裂能力、抗冻能力等十分优异；除特种引气剂外，其它原材料来源较广，制备工艺较简单
18	一种超致密高导热硅砖及其制备方法<sep>山东鲁桥新材料股份有限公司<sep>一种超致密高导热硅砖及其制备方法<sep>属于耐火材料技术领域。其特征在于：质量百分比组成包括：sio95%~96%、alo0.7%~1.0%、feo0.6%~0.8%、cao2.1%~2.5%、残余石英0.4%~0.5%；制备步骤中干燥制度为出车端温度80℃~100℃，进车端温度：35℃~50℃；推车速度为1.5~2.0h/车，干燥后残余水分小于1.5%；烧成制度为：室温升温至195℃~205℃，升温速率为27℃/h~33℃/h，在195℃~205℃首次保温7.5h~8.5h，然后继续升温至995℃~1008℃，升温速率为25℃/h~35℃/h，在995℃~1008℃二次保温4 h~5 h<sep>采用本发明的高导热硅砖能有效提高炼焦所需热量从燃烧室往炭化室传导的效率
18	一种轻质高强高透水性混凝土及其制备方法<sep>福建省建筑科学研究院有限责任公司<sep>一种轻质高强高透水性混凝土及其制备方法<sep>准备原料：普通硅酸盐水泥p.o42.5、硅灰、矿粉、5mm～10mm单粒级陶粒、5mm～10mm单粒级碎石、高效减水剂、强凝胶、羟丙基甲基纤维素、拌合水。将5mm～10mm单粒级碎石、5mm～10mm单粒级陶粒倒入搅拌机中，搅拌30s；称量好的减水剂先倒入拌合水中得到混合液，将混合液总量的1/2加入搅拌机中继续搅拌30s；加入水泥、硅灰、矿粉、羟丙基甲基纤维素和强凝胶混合搅拌30s，将剩余的混合液加入搅拌机中继续搅拌60s；将混合料倒入模中，振动捣实；养护<sep>本发明可有效地降低混凝土容重，提高混凝土抗压强度及透水性能
18	一种镁碳砖及其制备方法<sep>江苏苏嘉集团新材料有限公司<sep>本发明涉及一种镁碳砖及其制备方法<sep>属于耐火材料制备技术领域。其组分按重量份计如下：电熔镁砂颗粒75～90份，碳素5～10份，添加剂1～5份和结合剂1～3份；将上述组分放入混练机中进行混炼，再经过压制成型和烘烤固化后得到最终的产品镁碳砖<sep>本发明制备方法简单，步骤易于操作，改变了传统镁碳砖的思路，不配入镁砂细粉，基质中以碳素和少量添加剂为主，提高了镁碳砖对高温、真空、酸性渣的更好抵抗力，使得冶炼高级特殊钢时耐火材料炉衬的使用寿命得到提高，吨钢耐材消耗显著下降
18	海港码头抗渗防腐外加剂及其制备方法<sep>山东港湾建设集团有限公司<sep>一种海港码头抗渗防腐外加剂<sep>涉及海港码头防腐建筑材料技术领域，特别是属于一种适用于海港混凝土的海港码头抗渗防腐外加剂及其制备方法。它包括以重量百分比计如下组分：硅酸盐水泥30%～50%、石英砂25%～35%、硅灰5%～20%，其特征在于，它还包括以重量百分比计如下组分：活性物质15%～30%、钙离子补偿剂5%～8%；活性物质为微纳米级丙酸钠、丙烯酸钠、丁烯酸钠、反丁烯二酸钠、丁二酸二钠，丙酸钙、丙烯酸钙、丁烯酸钙、反丁烯二酸钙、丁二酸二钙中的任意一种或多种<sep>本发明具有整体防护能力和自修复性能，能够耐久性防护，同时无需额外外涂防腐涂料，能够降低施工难度和成本，安全可靠的积极效果
18	一种高强度超轻质水泥基复合材料及其制备方法<sep>中交第二航务工程局有限公司<sep>本发明公开了一种高强度超轻质水泥基复合材料<sep>其特征在于，包括以下组分：胶凝材料、空心玻璃微珠、聚羧酸系高性能减水剂、水，其中胶凝材料、聚羧酸系高性能减水剂、水的质量比为100:1‑2.5:100‑200，所述胶凝材料与空心玻璃微珠的体积比为1:3‑8；所述胶凝材料包括以下质量百分数的组分：水泥57％～78％、漂珠15％～25％、硅灰3％～10％，磷石膏1％～3％，聚合氯化铝3％～5％，以上水泥、漂珠、硅灰、磷石膏、聚合氯化铝质量百分数之和为100％<sep>本发明采用胶凝材料与空心玻璃微珠配合，得到低密度、高强度的超轻质水泥基复合材料，而且抗氯离子渗透性效果较好，在海上漂浮建筑上有较好的应用前景
18	一种石膏容器及其制备方法<sep>荆门千年健医疗保健科技有限公司<sep>本发明公开了一种石膏容器及其制备方法<sep>所述方法包括如下步骤：(1)内容器体的制作：首先制作出内容器体模具，在内容器体模具中部放置多个石膏支撑柱，通过内容器体浇铸孔向其注入熔化石蜡浇铸料，待冷却后得到石蜡材质的内容器体，且所述内容器体内穿设有所述石膏支撑柱；(2)外容器体的制作：将石蜡材质的内容器体放置于外容器体模具下层的凹槽中部，通过外容器体浇铸孔注入石膏浇铸料，待干燥后得到内含有所述内容器体的外容器体；(3)熔解石蜡得到含有内空腔的外容器体；(4)将成膜液注入含有内空腔的外容器体的内空腔中，使得内空腔的内壁表面形成一层防渗漏薄膜，得到该石膏容器<sep>制作出的石膏容器内部可以放置精油等液体且不会渗漏。
18	两相均匀分布的复合石榴石闪烁陶瓷及其制备方法<sep>中国科学院上海光学精密机械研究所<sep>一种两相均匀分布的复合石榴石闪烁陶瓷及其制备方法<sep>利用两种石榴石结构的相，制成两相均匀分布的复合石榴石闪烁陶瓷。本发明采用固相反应法，分别制备了两种相的粉体，分别在真空下预烧成相。两种相按照不同的比例均匀混合、球磨制成素坯，再在真空环境下烧结，制备密度及发射波长可调的两相复合闪烁陶瓷。该陶瓷中两种相分布均匀，具有高光学质量，宽波段发射以及高光输出等性能<sep>可调的发射波长可与多个光电二极管匹配，能够满足现代高能射线探测技术对于材料截止能及波长的要求，且制备工艺简单，成本低，可实现批量化工业生产
18	一种轻量高强六铝酸钙耐火材料的制备方法<sep>遵义润辉实业有限公司<sep>一种轻量高强六铝酸钙耐火材料的制备方法<sep>其特征在于：所述方法包括以下步骤：（1）将38～60wt%的碳酸钙质原料和40～62 wt%的氢氧化铝混合，之后加入上述原料之和80～120 wt%的水、0.02～0.05wt%的分散剂和1～4 wt%的结合剂，球磨3～5小时，得到混合浆料；（2）将混合浆料喷雾造粒，得到球形细颗粒；（3）将球形细颗粒在1000～1200℃条件下煅烧得到轻质多孔小球<sep>（4）将15～30wt%的轻质多孔球和70～85 wt%的氧化铝质原料混合，之后加入上述原料之和2～6wt%的结合剂，搅拌均匀后，10～30mpa压力压制成型，在1600～1700℃的条件下煅烧6～8小时，得到轻量高强六铝酸钙耐火材料。
18	玻璃料、显示装置和显示屏<sep>信利(惠州)智能显示有限公司<sep>本发明涉及一种玻璃料、显示装置和显示屏<sep>玻璃料包括：玻璃颗粒和金属纳米颗粒；所述玻璃颗粒与所述金属纳米颗粒均匀混合；所述金属纳米颗粒的材质为金属<sep>通过在玻璃颗粒中混合金属材质的金属纳米颗粒，在激光照射下，金属纳米颗粒能够很好地将激光反射，增大了玻璃颗粒对激光的接收面积，使得玻璃颗粒能够得到激光的充分照射，使得玻璃颗粒快速熔化，对元器件进行封装，使得封装效果较佳，而由于玻璃颗粒能够快速熔化，因此，可采用功率较低的激光进行照射，避免过高的温度对引线造成损坏，有效提高了元器件的产品良率
