label_id	text
18	一种碳化硅涂层熔盐堆热中子散射效应的计算方法<sep>华南理工大学<sep>本发明公开了一种碳化硅涂层熔盐堆热中子散射效应的计算方法<sep>包括：基于液态熔盐、固态石墨、固态碳化硅的热中子散射率，开展核数据加工，获得其热中子散射截面库；调用液态熔盐、固态石墨、固态碳化硅的热中子散射截面库，采用蒙特卡罗中子输运方法开展熔盐堆的组件均匀化，获得堆芯内部及反射层附近典型组件的均匀化群参数；调用熔盐堆典型组件的少群均匀参数，基于中子输运模型或中子扩散时空动力学模型，对于液体燃料碳化硅涂层熔盐堆，还需考虑液态熔盐流动影响，计算出熔盐堆的热中子散射效应对熔盐堆关键中子学参数的影响<sep>所述方法克服了传统的确定论方法难以完全适用熔盐堆复杂几何的缺陷，且获得的熔盐堆组件均匀化参数也更为精确
18	一种降低陶瓷表面产生缩釉缺陷的上釉方法<sep>界首市伟盛古窑彩陶制作发展有限公司<sep>本发明公开了一种降低陶瓷表面产生缩釉缺陷的上釉方法<sep>方法如下：1）镁砂、氧化铝、氧化铬、氧化钛与陶瓷胚体的原料混合研磨后注浆成型，得到陶瓷胚体；2）将硅化钼、硅化钽、玻璃粉、硼化硅、乙醇和羧甲基纤维素球磨得到的浆料涂覆在陶瓷胚体表面，干燥后进行热处理；3）将陶瓷胚体浸入经过纳米氧化铁分散液中，取出后用紫外灯进行照射处理；4）将釉料喷涂在陶瓷胚体表面进行釉面烧结即可<sep>本发明通过对常规的陶瓷胚体原料以及釉料进行改进，并且对胚体表面进行处理，使得烧结后的釉面波化均匀，光泽度高，热稳定性好，同时可以很好的消除釉面出现波浪形纹、裂纹、针孔甚至脱釉等缺陷，提高釉面的完整性，使得产品质量得到明显改善
18	一种焦炉用轻质保温涂层及其施工工艺<sep>武汉钢铁有限公司<sep>本发明公开了一种焦炉用轻质保温涂层<sep>它由内向外依次包括轻质保温层和抗裂保护层，其中轻质保温层以粉煤灰漂珠、蛭石粉、矿棉纤维素或玻璃棉、水玻璃、硅酸盐水泥、聚乙烯醇和水为主要原料制备而成；抗裂保护层以矾土粉、锆英石粉、钠膨润土、蓝晶石、高强铝酸盐水泥、六偏磷酸钠、三聚磷酸钠、十二烷基硫酸钠和水为主要原料制备而成<sep>本发明采用双层涂料方式，并通过优化各层涂料配方，所得涂层结构的粘结性强、保温性好，流动性好，易施工，施工后可在短时间内形成强度，实现保温蓄热的功能，且使用寿命长，适合推广应用
18	一种拼接缝新型蒸压加气混凝土板<sep>江苏美利美新型建材科技有限公司<sep>本实用新型公开了一种拼接缝新型蒸压加气混凝土板<sep>包括第一板和第二板，所述第一板的底面开设有滑槽，滑槽的内部卡接有与滑槽相适配的滑动箱，滑槽的内顶壁开设有固定槽，滑动箱的底面固定连接有等距离排列的第一固定杆，第一板的右侧面固定连接有两个第二固定杆<sep>该拼接缝新型蒸压加气混凝土板，通过第一固定杆和第一插槽的配合，能够使第一板和第二板进行连接，通过第二固定杆和第二插槽的配合，增加了第一板和第二板的连接性，通过弹簧所提供的弹力，能够对调节板进行调节，通过调节板的调节，能够使定位块伸入到固定槽的内部，采用上述方式的拼接，有效的避免了采用网格布挂抗裂砂浆会导致拼接缝处凸起，后期大量浪费材料的问题
18	一种提高微米氧化锆粉末烧结活性的方法<sep>江苏思麦尔生命科技有限公司<sep>本发明涉及一种提高微米氧化锆粉末烧结活性的方法<sep>所述方法包括以下步骤：1)采用微米氧化锆粉末，加入水和矿化剂，配成浆料；其中，浆料中氧化锆粉末的含量为(5~45)%，矿化剂含量为(0.5~5)%，余量为水；2)将配制好的浆料置于反应釜中，在不断搅拌的情况下，加热至(100~300)℃，保持反应釜的压力(0.5~5)mpa，保温(1~10)小时；3)保温完成后，自然冷却至室温；4)取出处理后的浆料，反复洗涤至粉末中不含有矿化剂阳离子；5）采用含水乙醇溶液洗涤粉末2~3次，其中乙醇与去离水的配比为（2~3）：1<sep>6)将洗涤后的粉末在100~120℃下干燥。
18	带孔盖板玻璃退镀工艺及大尺寸屏幕保护盖板玻璃<sep>蓝思科技(长沙)有限公司<sep>本发明公开了一种带孔盖板玻璃退镀工艺及大尺寸屏幕保护盖板玻璃<sep>退镀工艺包括以下步骤：先用ph值为1～2的酸性退镀液对次品玻璃进行退镀，再用ph值为12～13的碱性退镀液对次品玻璃进行退镀。本发明缓解了传统在玻璃盖板加工时，往往会产生具有缺陷的次品，这就需要对次品重新处理后进行重工，以降低成本。本发明提供的玻璃退镀工艺是一种带孔玻璃次品的退镀工艺，通过酸碱退镀液分步对次品玻璃进行退镀，不仅可以有效退掉玻璃表面的油墨层、镀膜层，也可以有效退掉玻璃通孔孔壁的油墨层，且退镀后玻璃损伤小，玻璃表面不易划伤，良率高<sep>采用该退镀工艺将玻璃次品进行退镀后，可重新作为原料玻璃基体进行重加工，节省了原料和成本
18	一种液态氯化氢制备方法<sep>滁州市三和纤维制造有限公司<sep>本发明属于氯化氢制备技术领域<sep>具体的说是一种液态氯化氢制备方法；该方便所使用的氯化氢制备器包括制备罐、引流盘、空心支柱、硫酸喷头、盐酸导管和盐酸喷头；引流盘包括多个，多个引流盘从上至下依次增大且插接转动配合，相邻插接配合的引流盘之间形成聚热腔，引流盘包括为易导热的环形罩体、固定于环形罩体外侧壁上的多个隔板、与环形罩体上端中央连为一体的上空心柱、与环形罩体下端中央连为一体的下空心柱，环形罩体的上端边缘设置有多个通气孔，且位于最上端引流盘的通气孔上部均倾斜布置有引气管<sep>本发明通过使浓硫酸与盐酸在引流盘上充分混合以及提高浓硫酸与盐酸混合后的混合液铺展面积，从而提高从盐酸中提取氯化氢气体比例。
18	用于直接观察岩心渗流现象的透明岩心的制备方法<sep>陕西科技大学<sep>本发明公开了一种用于直接观察岩心渗流现象的透明岩心的制备方法<sep>包括：配制硅酸钠溶液，加入气相二氧化硅；在容器底部放置玻璃平板，将含有二氧化硅的硅酸钠溶液倒入容器中；将容器转移至冷阱中，降温并恒温处理得到冻结的玻璃和冰块；将冻结的玻璃和冰块转移至冷冻干燥器中，得到单侧表面生长有硅酸钠海绵结构的玻璃板；取两块玻璃板，重叠放置并使得光滑面向外，利用自身重力相互挤压两块玻璃板之间的硅酸钠海绵结构；然后将重叠的玻璃板水平放置在马弗炉中，加热处理使部分硅酸钠进入熔融状态；降温冷却得到中间含有大量空隙的玻璃板，制得透明岩心<sep>制备的透明岩心可直接用光学设备记录和观测孔隙中流体的运动过程
18	itq-24沸石分子筛的合成方法<sep>中国石油化工股份有限公司上海石油化工研究院<sep>本发明涉及一种itq‑24沸石分子筛的合成方法<sep>主要解决现有技术存在合成itq‑24沸石分子筛所用有机模板剂制备繁琐、成本高昂和所得itq‑24沸石分子筛结构不稳定等问题。本发明通过使用价格相对更低廉、可从市售获取的二乙基二甲基氢氧化铵作为有机模板剂，按照二乙基二甲基氢氧化铵/yo＝0.1～1.0，杂原子元素w的氧化物/yo＝0～0.1，ho/yo＝1～30的组成，将混合物在100～200℃温度下水热晶化24～350小时，其中y为一种骨架四价元素，w为杂原子元素的方法得到多孔结晶沸石分子筛材料itq‑24<sep>本发明使用了更廉价的有机模板剂，降低了合成成本；合成得到的itq‑24分子筛结构稳定；合成范围广，操作简单易行，便于进行推广
18	一种熔盐化学合成碳粉体及其制备方法和应用<sep>东北大学<sep>一种熔盐化学合成碳粉体及其制备方法和应用<sep>属于碳材料化学合成领域。该熔盐化学合成碳粉体的制备方法，按配比，称量干燥cac粉末、干燥caco粉体、脱水后的熔盐原料，置于坩埚中，在放入密闭反应器中，通入惰性气体保护；将密闭反应器升温至反应温度，保温5min～10h进行碳化反应，得到碳产物；将碳产物进行超声清洗，固液分离，去除熔盐，干燥，得到碳粉体。将此碳粉材料用于作为锂离子电极负极碳材料，具有提高电池容量和循环性能的优点<sep>该方法的产物除了碳外，只有氧化钙生成，不产生其他有毒有害物质，工艺绿色环保，简单易行
18	一种缓解多孔氮化硅陶瓷与透明氧氮化铝陶瓷连接过程热应力的方法<sep>中国科学院上海硅酸盐研究所<sep>本发明涉及一种缓解多孔氮化硅陶瓷与透明氧氮化铝陶瓷连接过程热应力的方法<sep>采用多孔氧化铝陶瓷作为过渡层以缓解多孔氮化硅陶瓷与透明氧氮化铝陶瓷连接过程热应力<sep>所述多孔氧化铝陶瓷的孔隙率为30～70%
18	一种耐腐蚀抗冷冻的加气砖的制备工艺<sep>内蒙古阜丰生物科技有限公司<sep>本发明属于建筑材料领域领域<sep>公开了一种耐腐蚀抗冷冻的加气砖的制备工艺，其包括如下步骤：步骤1）制备物料a，步骤2）制备物料b，步骤3）制备物料c，步骤4）制备物料d，步骤5）制备混合料，步骤6）制备加气砖<sep>本发明以废弃炉渣为主要原料，辅助其他原料，制备工艺简易，制备的加气砖耐腐蚀抗冷冻，强度高，保温隔热性能好
18	一种具有抑菌作用的新型无纺布的制备方法<sep>浙江法来福无纺布有限公司<sep>本发明涉及一种具有抑菌作用的新型无纺布的制备方法<sep>包括以下步骤：（1）、制备改性纳米二氧化钛；（2）、纺丝；（3）、开松；（4）、梳理；（5）、铺网<sep>本发明的新型无纺布的抑菌效果好，强度高，使用过程中不起球，使用性能好。
18	一种利用电炉熔分海绵铁渣直接制备的岩棉及其制备方法<sep>北京大学<sep>本发明涉及资源综合利用领域和无机非金属材料制备领域<sep>尤其涉及一种利用电炉熔分海绵铁渣直接制备的岩棉及其制备方法；利用电炉熔分海绵铁渣直接制备岩棉的方法，不需要添加任何改质剂，所述海绵铁渣的酸度系数大于1.5，所述海绵铁渣包含6～13％的feo；优选所述海绵铁渣为以海绵铁为原料进行电炉炼钢的炉渣；本发明直接利用热态的海绵铁渣制备岩棉，将工艺利用热和回收热相结合，节省了熔体加热、离心成纤和岩棉固化环节的能量消耗，大幅度降低了岩棉的生产成本<sep>本发明不仅实现了电炉炼钢的炉渣的高效率能质耦合利用，达到钢铁冶金行业节能减排的目的，而且创造性地将海绵铁渣不经调质直接用于岩棉的制备，具有显著的环境效益、经济效益和社会效益
18	多孔质玻璃母材的烧结方法和烧结装置<sep>信越化学工业株式会社<sep>多孔质玻璃母材的烧结方法<sep>使垂下的多孔质玻璃母材相对于加热炉相对移动，顺次地从一端至另一端加热所述多孔质玻璃母材来进行透明玻璃化的多孔质玻璃母材，测量所述多孔质玻璃母材的输送速度v和该玻璃母材的下端的移动速度vw，对于基于比值vw/v计算的所述多孔质玻璃母材的直筒部的伸长率，对于每个所述多孔质玻璃母材的输送量l，预先设定大于1的目标值α(l)，来进行所述多孔质玻璃母材的烧结处理<sep>控制所述加热炉的温度和所述多孔质玻璃母材的输送速度的至少一个
18	一种钙钛矿单晶体的制备方法<sep>湖北大学<sep>一种钙钛矿单晶体的制备方法<sep>属于钙钛矿晶体技术领域。钙钛矿单晶体的制备方法包括将钙钛矿前驱体和溶剂混合均匀得到澄清液体，升温至出现黑色浑浊，记录出现黑色浑浊的温度为结晶温度，降温直至黑色浑浊完全消失，再次升温至结晶温度结晶并于结晶温度保温结晶后固液分离得到钙钛矿单晶体。本申请以较快速率升温能够用于找钙钛矿单晶体的结晶温度，其中出现黑色浑浊的温度即为结晶温度，在此结晶温度下结晶得到的钙钛矿单晶体的晶体较大，且结晶过程较易控制<sep>在升温过程中出现的黑色浑浊为细小的钙钛矿晶体颗粒，降温能够使细小的结晶的钙钛矿晶体颗粒溶解，溶液重新变得澄清后，再以较慢的速率升温至结晶温度能够结晶得到较大的钙钛矿单晶体
18	一种从石英矿物粉中直接生产制备白炭黑的方法<sep>杨鈜博<sep>本发明涉及一种从石英矿物粉中直接生产制备白炭黑的方法<sep>包括以下步骤：选用sio含量≥99％、细度200～400目以上的石英粉为原料；将上述石英粉放入反射炉，活化后出炉；将上述高温活化后的石英粉自然冷却至室温后，按每吨石英粉加入700至900立升体积的蒸馏水，打浆混合均匀；将上述浆料输入不锈钢高压反应釜内，搅拌2～3小时进行水合；将上述水合后的浆料放入陈化池中，静置陈化24～48小时<sep>将陈化后的浆料，打浆混合均匀，用输浆泵输入细化研磨器内进行浆体细磨至3000—4000目，并进行喷雾干燥，得到白炭黑。
18	一种泡沫碳材料的料浆发泡-凝胶注模成形制备方法<sep>北京交通大学<sep>本发明公开了一种以石墨粉为原料<sep>采用水基料浆发泡‑凝胶注模成形工艺制备泡沫碳材料的方法。本方法以石墨粉为原料，将石墨粉与去离子水及多种添加剂混合配制成料浆，通过高速搅拌使料浆发泡，再将泡沫料浆注入模具并使之凝胶成形，经干燥后得到泡沫碳材料<sep>本发明所制备的泡沫碳材料具有孔隙率高、孔径小且分布均匀、成形参数可控、免烧结和石墨化处理、成本低廉等优点，并具有良好的物理性能和力学性能，同时本发明所用石墨粉原料全部来源于石墨加工碎屑、边角料及废弃石墨制品，固废利用率高
18	一种粉煤灰基混凝土<sep>广东清大同科环保技术有限公司<sep>本发明公开了一种粉煤灰基混凝土<sep>其原料按质量份数包括人造粉煤灰粗骨料200‑300份、人造粉煤灰细骨料50‑150份、硅灰5‑20份、地质聚合物水泥100份、减水剂0.5‑3份、水20‑40份及外加剂5‑15份。本发明制备的粉煤灰基混凝土在保证混凝土强度的同时还能降低混凝土的容重，同时还具有优异的热稳定性、化学稳定性<sep>本发明使用粉煤灰做基质材料，能够使粉煤灰得到充分的再利用，解决了粉煤灰对环境的污染问题
18	一种多种强度性能石膏粉体的生产工艺方法<sep>湘潭大学<sep>本发明公开了一种多种强度性能石膏粉体的生产工艺方法<sep>本发明主要包括如下步骤：将二水石膏原料用微波辐照升温至110～500℃，翻炒5～240分钟得到产物a；将产物a与外加剂混合后送入密闭反应器中，在110～300℃下继续反应10～300分钟，排出水汽，陈化后得到产物b；将部分产物a与产物b混合研磨和调配，可获得不同强度性能的石膏粉体终产品；或者，将产物a和产物b分别直接研磨调配得到产品a(建筑石膏粉)和产品b(α‑高强石膏粉)<sep>本发明原料适应性强，转化反应快，生产高效；产品质量稳定可靠，可在一条生产线上实现不同强度石膏产品的设计和调配；流程简洁，大幅降低能耗与生产成本；工艺绿色环保
18	一种耐磨陶瓷复合管的制备方法<sep>湖北秦鸿新材料股份有限公司<sep>本发明属于耐磨材料技术领域<sep>特别涉及一种耐磨陶瓷复合管的制备方法，包括以下步骤：s1，按质量份计，称取碳化硅陶瓷颗粒40～50份，氮化硅陶瓷颗粒50～60份，亚微米级氮化钛5～12份，和粘结剂4～8份，放入容器中混合均匀后得到混合物料；s2，将所述混合物料倒入模具中成型，制得预制件；s3，将预制件烧结，再经淬火、回火步骤后制得多孔陶瓷基体；s4，将多孔陶瓷基体放入浇模中，将金属材料熔化后对多孔陶瓷基体浇注，冷却后形成耐磨陶瓷复合管<sep>本发明能够将金属的韧性、抗弯型，与陶瓷的高耐磨、高强度和抗氧化性能有机结合，制得的耐磨陶瓷复合管整体的强度、抗冲击韧性和耐磨性均有极大地提高
18	一种加气块电化学加气方法及生产方法<sep>安徽马钢嘉华新型建材有限公司<sep>本发明公开了一种加气块电化学加气方法及生产方法<sep>属于建筑材料技术领域。该方法包括步骤：将加气块主料及添加剂进行预处理并搅拌成均匀微流动性浆体，微流动性浆体注入到电解装置中，采用稳压电源对浆料进行电解加气<sep>本发明充分利用了加气块原料浆料的特性，通过电化学电解浆料和水，生成微气泡，微气泡进入浆料，使浆料中保有一定含量的气泡，通过调节电流密度和加气时间可以实现对加气速度和加气量的控制，有效解决了化学加气剂的加气速度难以调节及化学添加物和化学反应产物对制品质量产生影响的问题
18	一种珊瑚礁砂强化材料及其使用方法<sep>同济大学<sep>本发明提供一种珊瑚礁砂强化材料及其使用方法<sep>由100份水、1份聚丙烯酰胺、20‑25份水溶性热固型胶水、5‑10份聚醋酸乙烯酯乳液和50‑100份水泥组成，水溶性热固型胶水可以是酚醛树脂或丙烯酸树脂中的一种<sep>该材料制作和使用方法简单，制备原材料易得，对珊瑚礁砂的强化处理成本低廉，便于在海岛及沿海地区使用，经其强化处理后的珊瑚礁砂，显著提高了由其制备的水泥砂浆或混凝土强度，并有效阻止了珊瑚礁砂中所含氯离子向外界的扩散，降低了珊瑚礁砂混凝土中钢筋被腐蚀的几率，同时也改善了由珊瑚礁砂制备的砂浆或混凝土流动性
18	一种多孔碳化硅陶瓷的制备方法<sep>洛阳师范学院<sep>本发明公开了一种多孔碳化硅陶瓷的制备方法<sep>先将碳化硅和氮化硅按重量配比混合均匀制备混合料；然后制备聚氯乙烯醇水溶液和氯化铵水溶液：将所得混合料和溶液一起放入球磨机中进行球磨；向球磨后的浆料中加入粘结剂、双氧水、表面活性剂，继续球磨30min；之后加入10％的氯化铵水溶液，高速下球磨3min，迅速倒入模具中成型；将模具和模具中的浆料放入烘箱中进行发泡；然后放入冷冻箱中冷冻，形成凝胶；将凝胶样品进行脱模，经干燥后烧结，得到多孔碳化硅陶瓷<sep>本发明用硅酸盐水泥作为粘结剂，提高了粘结强度，降低了污染，得到的多孔碳化硅陶瓷孔隙率高，孔径均匀，提高了多孔碳化硅陶瓷的性能
18	预制干料喷射混凝土<sep>北京建工新型建材有限责任公司<sep>本发明公开了一种预制干拌喷射混凝土<sep>属于建筑材料技术领域，其技术方案要点是以重量份数计，包括如下组分：水泥、卵石、中砂、高效速凝剂、粘结剂、减水剂；所述水泥为p.o42.5级普通硅酸盐水泥；所述粘结剂包括凹凸棒土、硅酸钠以及钾水玻璃，所述凹凸棒土、硅酸钠以及钾水玻璃的重量比为2:1:1<sep>本发明通过选择合理的控制灰骨比以及砂率，可以在提高混凝土的强度以及致密性的同时，降低粉尘污染，降低回弹率；通过凹凸棒土、硅酸钠以及钾水玻璃，能提高干拌合物的干燥度，提高其喷射后的附着力与粘性，降低回弹率，此外硅酸钠以及钾水玻璃都具有良好的耐热性，能够提高混凝土的耐热性能
18	多孔氮化硅-碳化硅复合陶瓷的制备方法<sep>临沭县东升磨料有限公司<sep>本发明提出了一种多孔氮化硅‑碳化硅复合陶瓷的制备方法<sep>包括以下步骤：1)按照重量百分数计算，称取氮化硅粉体30～60％、碳化硅粉体15～40％、改性二氧化钛6～15％、稀土氧化物2～5％及结合剂3～6％备用；2)先将氮化硅粉体、碳化硅粉体、改性二氧化钛与稀土氧化物混合后，再加入结合剂混合均匀，干压成型得到素坯；3)将素坯在氮气气氛下以1～10℃/min的升温速度升温到1500～1650℃，保温2～10小时，烧结过程中始终通入流动氮气，最后随炉冷却，即获得多孔氮化硅‑碳化硅复合陶瓷；其中，改性二氧化钛主要由二氧化钛、椰壳粉与羟甲基纤维素制备得到<sep>该制备方法烧结温度较低，获得的多孔氮化硅‑碳化硅复合陶瓷气孔率高且断裂韧性高
18	一种人工物理岩心制作方法<sep>中国矿业大学(北京)<sep>本发明公开了一种天然砂岩的人工物理岩心制作方法<sep>本发明利用石英、水泥、减水剂混合物来模拟天然砂岩岩心的脆性矿物成份；利用黏土材料来模拟天然砂岩岩心的黏土矿物成份<sep>本发明通过调整石英、水泥、减水剂和黏土材料的配比，使得人工物理岩心在力学性质(包括抗压强度、弹性模量和泊松比)、全岩矿物成份和黏土矿物成分上和天然砂岩一致
18	一种亚光蓝色结晶釉料及烧制亚光蓝色结晶釉的方法<sep>浙江工业大学之江学院<sep>本发明公开了一种亚光蓝色结晶釉料<sep>其特征在于：所述的亚光蓝色结晶釉料各组分按照如下质量配比构成：钾长石22～27份，方解石9～12份，高岭土2～5份，氧化钴0.1～1份，氧化镁0.1～1份，碳酸钡0.2～2份。本发明还公开了一种使用所述亚光蓝色结晶釉料烧制亚光红色结晶釉的方法：将所述亚光蓝色结晶釉料与水按照质量比100：70～80混合，沉浮，过筛，得釉浆；调釉浆比重为1.51，上釉于陶瓷坯体上，电窑烧制，冷却，得到表面有亚光蓝色结晶釉的陶瓷制品<sep>按照本发明所述的烧制方法，能够得到具有强烈的浑厚的艺术效果的亚光蓝色瓷制品，精致美观；配方简单，操作方便，成本低
18	抗腐蚀水泥窑过渡带用氮化硼复合镁铝尖晶石砖及其制备方法<sep>芜湖乾凯材料科技有限公司<sep>本发明公开了一种抗腐蚀水泥窑过渡带用氮化硼复合镁铝尖晶石砖及其制备方法<sep>该制备方法包括：1）在保护气的存在下，将镁铝尖晶石、氮化硼、珍珠岩、碳粉、金属氯盐进行煅烧以制得煅烧产物；2）将铝矾土、莫来石、铝矿渣、碳化硅、氧化铝、锆英砂、煅烧产物、木质素磺酸钙、硅酸钠、环糊精和水进行混合、陈化以制得混合料；3）将混合料进行压制以制得砖坯；4）将砖坯进行干燥、烧制、冷却以制得抗腐蚀水泥窑过渡带用氮化硼复合镁铝尖晶石砖<sep>该过渡带用氮化硼复合镁铝尖晶石砖具有优异的抗腐蚀性能
18	一种混凝土用核-壳结构膨胀剂及其制备方法<sep>广西御龙新型材料有限公司<sep>本发明涉及一种混凝土用核‑壳结构膨胀剂<sep>包括氧化钙55～76％、高分子聚合物7～12％、偶氮二异丁腈1～5％、3‑氨丙基甲基二乙氧基硅烷3～6％、六偏磷酸钠2～4％、硅酸钠2～4％、氯化铁9～14％。上述膨胀剂的制备方法中，将氧化钙中先后加高分子聚合物的无水二氯甲烷溶液、3‑氨丙基甲基二乙氧基硅烷的乙醇溶液；再加偶氮二异丁腈完成表面接枝改性；最后加六偏磷酸钠溶液、硅酸钠溶液和氯化铁溶液，经马福炉焙烧制成核‑壳结构膨胀剂成品<sep>该膨胀剂颗粒粒径均匀，氧化铁外壳能避免氧化钙膨胀剂早期水化过快，氧化铁与混凝土中的碱液反应生成氢氧化铁，提供二次膨胀源，解决有效补偿收缩问题；增加混凝土的密实度，提高混凝土的抗压强度和抗渗性能
