label_id	text
18	一种紫外光激发的多色光发射玻璃及其制备方法<sep>南京邮电大学南通研究院有限公司<sep>本发明属于照明和显示技术领域<sep>具体涉及一种紫外光激发的多色光发射玻璃及其制备方法；所述玻璃的基质材料包括以下摩尔比的组成：sio：70％，sno：1.14％，nao：20％,cao：x％,caf：(10‑x)％，其中，x％为cao的摩尔比，(10‑x)％为caf的摩尔比；x为5、3、7、2或8。还掺杂摩尔比为0.1％‑1.5％的re；其中re为稀土离子；制备方法包括：(a)原料的选取，(b)配料的混合，(c)玻璃陶瓷熔制三个步骤<sep>本发明制备的透明玻璃陶瓷具有高效的紫外到可见下转换发光性能，并且能够实现多色光发射，本材料适合大面积工业生产
18	八苯基取代笼形倍半硅氧烷衍生物分子玻璃及其应用<sep>中国科学院理化技术研究所<sep>本发明公开了一种八苯基取代笼形倍半硅氧烷衍生物分子玻璃<sep>具有如下分子结构：其中，取代基r～r分别为氢原子、羟基或酸敏感性取代基；取代基r～r可相同或不同，但同一苯环上的三个取代基不能同时为氢原子。本发明还公开了该八苯基取代笼形倍半硅氧烷衍生物分子玻璃的应用<sep>该分子玻璃可作为光刻胶主体材料制成薄膜，并可用于光刻
18	一种复合型粉煤灰激发剂及其制备方法和使用方法<sep>山西科腾环保新材料股份有限公司<sep>本发明公开了一种复合型粉煤灰激发剂及其制备方法和使用方法。所述复合型粉煤灰激发剂由以下重量百分比的原料复配而成：盐石膏：65‑70%<sep>氢氧化钾：15‑25%，高分子聚羧酸盐：10‑15%<sep>该激发剂在高掺粉煤灰混凝土中掺量不超过2%，该激发剂适用于所有等级粉煤灰，且具有良好的激发效果，能够大幅度提升高掺粉煤灰混凝土3d、28d强度的同时改善高掺粉煤灰混凝土流动度，具有很高的可操作性，在生产过程中能够降低生产成本，该复合型激发剂生产方法简单、环保、安全值得推广
18	一种发光图案混凝土及其制备方法、应用<sep>中建商品混凝土有限公司<sep>本发明公开了一种发光图案混凝土的制备方法<sep>包括以下步骤：1、将所需图案水平翻转180°，以转印油墨为图案原料将其输出至基材表面；2、将步骤1所得带有图案的基材铺设至模具表面；3、将以发光石、玻璃珠为部分或者全部集料的自流平混凝土浇筑在步骤2所述基材表面，养护、脱模后揭去基材；4、用高压水枪冲刷步骤3中的混凝土表面未凝结浆料，露出发光石和玻璃珠集料，即得到发光图案混凝土<sep>本发明能够低成本、工业化呈现全天候图案效果，在光线较好时，通过水泥与骨料之间的视觉差凸显图案，而在光线较差时，通过露出的发光石将图案显现出来
18	固定化漆酶及其制备方法<sep>湖南大学<sep>本发明公开了一种固定化漆酶及其制备方法<sep>该固定化漆酶是以介孔化膨润土为载体，介孔化膨润土上固定有漆酶，介孔化膨润土是以膨润土为原料经酸碱刻蚀后制备得到。其制备方法为将介孔化膨润土与漆酶溶液混合进行振荡吸附，离心，得到固定化漆酶<sep>本发明的固定化漆酶具有操作稳定性好、热稳定性好、酶吸附量大、酶活力强、环境友好型等优点，其制备方法具有操作简便、易于控制、制备成本低、对漆酶固定化效果好、适合大规模制备等优点
18	无机颗粒发泡混凝土复合保温板<sep>阜阳市伟叶家具有限公司<sep>本发明属于建筑材料技术领域<sep>具体的说是无机颗粒发泡混凝土复合保温板；包括u型外板，所述u型外板内侧底部固连有支撑板，所述支撑板两侧均固连有梯形板，所述u型外板两侧内壁表面均开设有卡槽，所述卡槽内放置有与其相匹配的尖嘴板，所述u型外板上开设有连通槽，所述连通槽内放置有移动板，所述u型外板上开设有凹槽，凹槽和卡槽通过连通槽连通，所述移动板一侧固连有连接板，所述u型外板内侧设置有两个浮球<sep>本发明通过通过设置尖嘴板、浮球和斜板，能够通过发泡混凝土产生的浮力推动浮球上升，间接推动尖嘴板与梯形板接触，对斜板进行卡紧，提高了固定的效果，无需使用额外的紧固用配件。
18	基于交流电压下微波等离子体的碳化硅氧化方法<sep>中国科学院微电子研究所<sep>一种基于交流电压下微波等离子体的碳化硅氧化方法<sep>包括：步骤一、提供碳化硅衬底，将碳化硅衬底放置在微波等离子体发生装置中；步骤二、加入含氧气体，在交流电压下产生氧等离子体；步骤三、通过所述交流电压控制所述氧等离子体中的氧离子与电子的运动，在所述碳化硅衬底上生成预定厚度的氧化层，其中，碳化硅衬底电压为负时，氧离子靠近界面与碳化硅发生氧化反应，碳化硅衬底电压为正时，电子靠近界面与碳化硅发生还原反应，将碳残留去除；步骤四、停止通入含氧气体，反应结束<sep>本发明可以实现对碳化硅氧化层的实时修复，有效减小碳残留，改善界面质量，减小氧化层中的缺陷中心对载流子的散射作用
18	用于碱矿渣水泥的高效减水剂组合物及其使用方法<sep>重庆大学<sep>本发明涉及用于碱矿渣水泥的高效减水剂组合物及其使用方法<sep>属于工程材料技术领域，该高效减水剂组合物由含硼环状硅酸盐矿物和萘磺酸甲醛缩合物组成，其中，硼环状硅酸盐矿物为高负电荷密度矿物，在碱矿渣水泥体系中可以产生稳定电场，其表面可以负载高密度负电，矿物颗粒间通过静电斥力作用而达到分散的目的，同时该减水剂组合物中萘磺酸甲醛缩合物，不但可以降低体系液相的表面能，还能通过含硼环状硅酸盐矿物表面双电层的扩散层吸附在该矿物表面，进一步增大各矿物颗粒间的静电斥力及位阻，进而达到释放自由液相的效果<sep>有效降低碱矿渣水泥体系的屈服应力
18	沉淀碳酸钙的制备<sep>可泰克斯公司<sep>本发明涉及经解聚的羧化纤维素溶液用于通过以下方式制备沉淀碳酸钙(pcc)水溶液的用途：在水中使包含氧化钙的材料熟化<sep>然后使由此获得的石灰水碳酸化<sep>所述经解聚的羧化纤维素溶液具有相对溶液总重量的25重量％至40重量％的固体含量
18	一种提高半水硫酸钙晶须稳定性的常温改性方法<sep>西安建筑科技大学<sep>一种提高半水硫酸钙晶须稳定性的常温改性方法<sep>采用单掺草酸钠、氟化钠和海藻酸钠作为改性剂，无水乙醇和去离子水作为复合改性介质，基于溶度积原理，选用生成沉淀溶度积远小于硫酸钙且能溶于复合介质中的改性剂，控制复合介质体积比，使溶液介电常数下降，降低半水硫酸钙溶解度，通过沉淀转化的方式对半水硫酸钙晶须进行表面改性，本发明是在常温状态下得到了与无机基体相容性良好的改性半水硫酸钙晶须，改性制备成本低<sep>改性介质可重复利用
18	一种高强超硫磷石膏矿渣水泥混凝土及其制备方法<sep>武汉理工大学<sep>本发明涉及一种高强超硫磷石膏矿渣水泥混凝土及其制备方法<sep>所述高强超硫磷石膏矿渣水泥混凝土由以下方法制备得到：1)磷石膏球磨预处理：将磷石膏、粉煤灰、水泥、减水剂和水置于球磨罐中进行湿磨，随后筛出并进行陈化处理得到磷石膏浆体；2)高强超硫磷石膏矿渣水泥混凝土的制备：将砂、石粗骨料和水加入混凝土搅拌机中进行搅拌，混合均匀后将细骨料水泥、矿粉加入混凝土搅拌机中继续搅拌，搅拌均匀后缓慢加入磷石膏浆体，最后加入水和减水剂，充分搅拌后进行混凝土成型和养护，即得到高强超硫磷石膏矿渣水泥混凝土<sep>本发明提供的高强超硫磷石膏矿渣水泥混凝土具有强度高、凝结时间短的优点，并且体积稳定性良好，不易开裂
18	一种高粘无收缩水泥基磨砂地面材料及其铺装工艺<sep>湖北路城建设科技有限公司<sep>本发明提供一种高粘无收缩水泥基磨砂地面材料及其铺装工艺<sep>包括以下重量百分比的组分：硅酸盐水泥30%‑38%、减缩增强剂4%‑12%、膨润土0‑5%、硅灰1%‑2%、耐磨骨料45%‑60%、颜料0.5%‑1%、二氧化钛1%‑2%、缓凝剂0.2%‑0.4%、减水剂0.02%‑0.05%、可再分散性乳胶粉1%‑2%、纤维素醚0.1%‑0.2%、甲酸钙0‑1%、防水剂0.2%‑1%<sep>本发明在水泥基材料中添加一定细度的耐磨骨料和功能性添加剂，通过各种原材料的相互协同作用，使配制的地面材料具有优异的抗裂、强粘结、耐磨、防滑、耐候、防水抗渗等性能，同时使得施工过程简单快捷
18	一种玻璃脱墨剂及其用途<sep>广州亦盛环保科技有限公司<sep>本发明涉及一种玻璃脱墨剂<sep>按重量百分数计，所述玻璃脱墨剂包括5～30％的环保型主溶剂、5～20％的助溶剂以及1～20％的ph调节剂，本发明中得到的玻璃脱墨剂与传统的含有强碱玻璃脱墨剂相比，其脱墨效果未见明显下降，5min内脱墨率大于95％，甚至可达100％，用于曲面玻璃脱墨时，对玻璃表面的腐蚀程度极低，相较于传统脱墨剂有了极大的提升，具有挥发性小，易被环境降解且不含有对人体有毒有害的成分等优点，经过本发明中得到的玻璃脱墨剂处理后的玻璃表面平整，成品率高<sep>无需再进行研磨等后处理
18	一种微波磁控管用陶瓷支持体及其制备方法<sep>湖南省美程陶瓷科技有限公司<sep>本发明公开一种微波磁控管用陶瓷支持体及其制备方法<sep>涉及金属化陶瓷加工技术领域。本发明公开的微波磁控管用陶瓷支持体，包括陶瓷基体和金属化层，其中陶瓷基体用碳化硅‑三唑硅烷‑氮化铝网状基体、高炉矿渣、分散剂和除泡剂等原料，经碳化硅‑三唑硅烷‑氮化铝网状覆膜基体的制备、混料、造粒和烧结等步骤而制成；金属化层原料包括钛粉、铜粉、黏土和粘结剂，并公开了用金属化层和陶瓷基体组成的陶瓷支持体的制备方法<sep>本发明提供的微波磁控管用陶瓷支持体，具有高的致密度和抗拉强度，具有优异的抗拉强度、韧性、耐高温性能和热导性，并能降低原料成本，达到节能环保的目的
18	一种单组份碱激发水泥<sep>福州大学<sep>本发明公开了一种单组份碱激发水泥<sep>其所用原料按重量百分数计为：粉煤灰40%‑50%、固体氢氧化钠2%‑4%、矿渣23%‑27%、钠长石13%‑17%、固体硅酸钠6%‑8%、固体氧化钙3%‑5%、硼砂1%，各原料重量百分数之和为100%<sep>本发明单组份碱激发水泥制备工艺简单，成本较低，且其制备过程中不需经煅烧，所得水泥腐蚀性低、稳定性强，方便长期存放，具有广阔市场前景
18	一种导电无机陶瓷膜材料及制备方法<sep>浙江工商大学<sep>本发明公开了一种导电无机陶瓷膜材料及制备方法<sep>制备方法包括如下步骤：(1)无机陶瓷膜膜表面洗净后干燥，然后浸没入小分子有机碳溶液中；(2)将无机陶瓷膜膜取出后晾干，然后在负压条件下进行真空低温焦化；(3)低温焦化后的无机陶瓷膜在惰性气氛中进行高温热焦化，自然冷却至室温即得<sep>本发明制备得到的导电无机陶瓷膜，由无机陶瓷膜构成其多孔介质的基体结构，保证机械强度，平均孔径为0.5～10微米，确认过滤过程的实现，导电物质在其表面进行原位热负载，在膜表面构成导电性通路，可保证膜表面电化学过程
18	一种低碳胶凝材料及制备混凝土的方法<sep>北京建筑大学<sep>本发明一种低碳胶凝材料及制备混凝土的方法<sep>该胶凝材料以质量百分比计：20‑32%硅酸盐水泥熟料，36‑48%s105矿渣粉，10‑20%粉煤灰，8‑10%石膏，0‑7%石灰石粉，0‑10%钢渣粉，4‑6%的轻烧氧化镁。该胶凝材料粉体在制备过程中已经实现充分均化；与外加剂相容性、开裂敏感性、特定环境中的耐久性以及对于混凝土强度的保证均已在胶凝材料生产制备中充分考虑，可直接用于混凝土中。可以显著降低混凝土生产中的质量波动和开裂，简化生产管理环节<sep>水泥熟料比例低，水泥产量及其碳排放将显著降低，大量利用工业固体废弃物，有效的降低了胶凝材料的成本，且节约能源，保护生态环境
18	一种磷铝酸盐基海工胶凝材料<sep>济南大学<sep>本发明公开了一种磷铝酸盐水泥基海工凝胶材料<sep>该凝胶材料是由高铁磷铝酸盐水泥熟料40‑45％、辅助胶凝材料50‑58％、早强剂1％‑5％组成；所述辅助凝胶材料是由金砂尾矿、白钨尾矿、高硅磷尾矿粉、偏高岭土、铝土矿尾矿按照3‑5：1.5‑1：1：1：1的重量比组成<sep>该海工凝胶材料具有较高的抗氯离子渗透性、体积稳定性以及抗硫酸盐侵蚀性能，可满足海洋工程的需要
18	一种用于多彩混凝土装饰板材料及其制备方法<sep>陕西省建筑科学研究院有限公司<sep>本发明提供一种用于多彩混凝土装饰板材料及制备方法<sep>所述材料由以下重量份数的各组分组成：彩色骨料20～80份，胶凝材料10～50份，掺合料2～40份，颜料0.01～2份，外加剂0.1～5份，纤维0.01～2份<sep>本发明的混合料由多彩混凝土装饰板材料组成或彩色混凝土填充彩色骨料组成，将其浇筑试模中，养护到一定龄期后切割、抛光，涂覆保护剂，即形成色彩缤纷的艺术装饰板，可以大幅降低生产成本，有效节约资源；本发明涉及的多彩混凝土装饰板是在工厂预制，可集保温与装饰为一体，现场组装方便，施工快捷，装饰效果好
18	一种利用微通道反应器制备低砷黄磷的方法<sep>贵州微化科技有限公司<sep>本发明公开了一种利用微通道反应器制备低砷黄磷的方法<sep>包括以下步骤：将工业黄磷加热熔融；氧化剂用超纯水配置成质量浓度5%~20%氧化剂溶液；氧化剂溶液与熔融工业黄磷按体积流量比为1~9:1，分别通过计量泵输送至微通道反应器ⅰ内，在50‑90℃下反应5s‑60s，得脱砷黄磷；超纯水与脱砷黄磷的体积流量比为1~9:1，分别通过计量泵泵入微通道反应器ⅱ，在温度50‑90℃逆流洗涤5s‑60s，即得。其中氧化剂为硝酸、双氧水或次氯酸<sep>本发明具有高脱砷率、磷收率高、安全性好
18	堇青石-刚玉空心球匣钵、制备方法及其应用<sep>浙江大学<sep>本发明提供了一种堇青石‑刚玉空心球匣钵、制备方法及其应用<sep>涉及耐火材料技术领域，本发明提供的堇青石‑刚玉空心球匣钵主要以高岭土、滑石、氧化铝、特定粒径的刚玉、特定粒径的刚玉空心球和特定粒径的堇青石为原料，具有使用寿命长和使用成本低的优点；另外，各原料来源广、价格低廉。本发明提供的堇青石‑刚玉空心球匣钵的制备方法工艺步骤简单，只需将各原料混合均匀，加入结合剂后再次混合均匀，然后经成型和烧成后即得，制备得到的堇青石‑刚玉空心球匣钵具有成本低、性价比高和使用寿命长的优点<sep>将上述堇青石‑刚玉空心球匣钵应用于陶瓷生产中，能够有效降低陶瓷的生产成本
18	一种无铅热释电复合陶瓷材料及其制备方法<sep>深圳华中科技大学研究院<sep>本发明属于热释电能量收集领域<sep>更具体地，涉及一种能量密度及温度稳定性提高的无铅热释电复合陶瓷材料及其制备方法。其为在陶瓷材料0.94nabitio‑0.06bazrtio中引入sio纳米颗粒后获得，其中x为原子比，0≤x≤0.25；且sio纳米颗粒占陶瓷材料0.94nabitio‑0.06bazrtio的质量百分数不大于0.2％<sep>在热释电陶瓷晶界位置中引入sio纳米颗粒，使其形成sio三维网络结构，加快复合陶瓷的热传递，从而提升了复合陶瓷的能量密度及其温度稳定性
18	一种青瓷及其制备方法<sep>龙泉市昌宏瓷业有限公司<sep>本发明公开了一种青瓷及其制备方法<sep>采用矿物质原料和高分子材料制备胚料和釉料，所述胚料包括组分a、组分b及组分c,所述组分a包括按重量份数比计的白云石20‑30份、高铝矾土10‑20份；所述组分b包括按重量份数比计的菱镁石10‑20份；所述组分c包括按重量份数计的环氧树脂3‑5份、有机硅树脂3‑5份；所述釉料包括按重量份数比计的硅灰石10‑20份、白云母10‑15份；其制备方法包括胚料的浆料制备、釉料制备、胚体成型、素烧、上釉、釉烧<sep>本发明的青瓷具有高强度、耐高温、耐腐蚀的优点，且本发明的制备方法成本低、成品率高、适合批量生产
18	一种球形氧化镁的制备方法、装置及应用<sep>大连理工大学<sep>本发明提供了一种球形氧化镁的制备方法、装置及应用<sep>属于无机化工技术领域。将镁盐溶液和助剂溶液混合、搅拌条件下配置成前驱体溶液或溶胶；通过载气将前驱体溶液或溶胶经过反应装置，收集固体粉末经过煅烧获得球形氧化镁产品。该方法制备的氧化镁颗粒形貌可控，粒径均匀，可以实现连续性制备<sep>制备的球形氧化镁可以用于金属离子吸附，也可用于抗菌材料领域
18	轻质建筑用砖<sep>安徽恒创环保建材有限公司<sep>本发明公开了一种轻质建筑用砖<sep>包括砖体，以重量份计，所述砖体的原料组分包括：粉煤灰20—30份、橡胶粉末10—20份、莫来石纤维10—20份、秸秆粉10—15份、废白土20—30份、陶粒10—15份、废玻璃渣10—15份、废陶瓷渣10—15份、废黏土砖块10—15份<sep>本发明的优点是：重量较轻、强度较高、使用方便
18	一种薄壁管件功能梯度材料的离心烧结方法<sep>武汉理工大学<sep>本发明公开了一种薄壁管件功能梯度材料的离心烧结方法<sep>包括以下步骤：将均匀分布的两种粉末与溶剂及分散剂混合，在空气中搅拌并经真空除气后形成均匀料浆；将料浆装入喷浆机，然后将喷头伸入到离心机内的基板上，使料浆能够均匀喷涂在基板的内壁上；改变两种粉末的相对体积百分比，形成第二层复合材料层；重复上个步骤，形成多层喷涂；将石墨辐射发热体伸进基板的内腔通电并上下移动，同时在基板的外壁安装一层保温层，使保温层通电；关闭离心机，烧结坯体，将坯体从基板中取出，即得到所述空心管件<sep>本发明通过增加石墨辐射发热体，并且在基板外层安装了保温层，内部实现了均匀的温度梯度，从而为制备均匀致密的薄壁管件提供了有效的保障
18	一种干料混凝土及其制备方法<sep>周苏理<sep>本发明实施例公开了一种干料混凝土<sep>所述干料混凝土按重量份数计包括下列组分：水泥200‑460份、粗骨料800‑1550份、细骨料300‑700份、重钙粉5‑35份、硅灰6‑40份、减水剂2‑15份。所述干料混凝土用以解决现有混凝土运送和使用不便，从运输搅拌到工地浇筑的时长和距离受限的问题。该干料混凝土存放周期长，便于存放和运输，现场施工工艺简便，条件要求范围宽，从而满足各行各业对于混凝土不同的施工现场和工艺要求，大大拓宽了混凝土的应用范围<sep>本发明实施例还提供了所述干料混凝土的制备方法
18	一种高热导率、高强度氮化硅陶瓷材料及其制备方法<sep>中国科学院上海硅酸盐研究所<sep>本发明涉及一种高热导率、高强度氮化硅陶瓷材料及其制备方法<sep>所述氮化硅陶瓷材料包括主相β‑sin、resion、以及晶界相，所述晶界相包括rehfo、zrreo、zrreo、中的至少一种，所述re为y、yb、er、sc、la、ce、pr、nd、pm、sm、eu、gd、tb、dy、ho、tm和lu中的至少一种<sep>本发明在较低的烧结温度条件下，采用压力较低的烧结方式，以hfo、hfn或zrn中的一种作为制备高热导率氮化硅陶瓷材料的烧结助剂之一，不仅可以显著提高氮化硅陶瓷的热导率，且不会影响氮化硅陶瓷的强度和韧性
18	球形双介孔凹凸棒石复合载体及其制备方法和应用<sep>中国石油化工股份有限公司北京化工研究院<sep>本发明涉及催化剂领域<sep>公开了一种球形双介孔凹凸棒石复合载体及其制备方法和应用。所述制备球形双介孔凹凸棒石复合载体的方法包括以下步骤：(1)在模板剂的存在下，将硅源和氨水溶液进行接触，得到介孔材料；(2)将水玻璃与无机酸溶液进行接触，得到硅胶；(3)将所述介孔材料、所述硅胶与凹凸棒石混合，然后将混合物料依次进行过滤洗涤、球磨、制浆和喷雾干燥，其中，步骤(3)中的过滤洗涤在陶瓷膜过滤器中进行，过滤洗涤后的混合物料中钠离子以钠元素计的含量不高于0.2重量％、模板剂的含量不高于1重量％<sep>该方法中所述陶瓷膜过滤器采用错流过滤，分离高效简单，无需后期再次进行煅烧脱出模板剂，节能环保
18	一种石墨烯/水泥基材料的制备方法及分散装置和应用<sep>济南大学<sep>本发明涉及水泥混凝土制备技术领域<sep>尤其涉及一种石墨烯/水泥基材料的制备方法及分散装置和应用。包括：气力输送站、第一变径接头、第一外丝接头、第一三通接头、第一混合管、第二混合管、第二三通接头、软管、第二外丝接头和第二变径接头；气力输送站、第一变径接头、第一外丝接头、第一外丝接头、第一三通接头依次连接；第一三通接头的另两个端口分别与第一混合管、第二混合管的另一端口连接，第一混合管、第二混合管各自的另一端口分别与第二三通接头的两个端口分别连接；第二三通接头、软管、第二外丝接头、第二变径接头、气力输送站的入口依次连接<sep>本发明实现了石墨烯与水泥颗粒的均匀分散，克服了传统方法中石墨烯在水泥中分散存在的问题
18	一种复相陶瓷及其制备方法<sep>中南大学<sep>本发明公开了一种复相陶瓷及其制备方法<sep>该复相陶瓷由质量百分比为28～32％ysio，27～33％sic和35～45％β‑sin棒状晶体组成。本发明利用ysio中的残余yo和sio对氮化硅陶瓷的烧结的积极作用，采用ysio粉末、sic粉末和α‑sin粉末作为原料，在高温烧结过程中，ysio游离出si和稀土y离子促进α‑sin在烧结过程中向高长径比的棒状的β‑sin相转变，降低sin相转变过程中的烧结温度，简化烧结工艺，而且原位生长β‑sin棒晶，可以类似于纤维增强的作用，从而提高相陶瓷的力学性能<sep>本发明中ysio粉末起到烧结助剂的作用，从而可以提升碳化硅陶瓷的致密性，增强复相陶瓷材料的密度和力学性能
18	一种贝壳免蒸压建筑材料及其制备方法<sep>北京赛知科技有限公司<sep>本发明提供一种贝壳免蒸压建筑材料<sep>由以下重量份的原材料组成：贝壳30‑60份，粉煤灰10～30份，生石灰8～20份，硫酸钙2～5份，水泥12‑30份，减水剂0.2～1.5份，水25‑40份。贝壳破碎过2mm筛后与粉煤灰、生石灰、硫酸钙充分混合粉磨，将粉磨得到的混合料与水、减水剂、水泥充分搅拌混匀，得到贝壳建筑材料料浆，料浆倒入模具中，充分震荡成型，养护6～24小时脱模，脱模后自然养护即得<sep>本发明具有贝壳利用率高、生产成本低、产品抗压强度高、无二次污染等优点
18	一种大尺寸公斤级碳化硅单晶的制备方法<sep>江苏超芯星半导体有限公司<sep>本发明公开了一种大尺寸公斤级碳化硅单晶的制备方法<sep>包括：在坩埚底中心设置进气口，通入含硅和碳元素的原料气体和载流子气体；在坩埚上侧壁设置排气孔，坩埚顶的上盖无气孔，上盖内壁固定籽晶；加热所述坩埚，在所述坩埚底中心的进气口通入所述原料气体，在所述载流子气体的载动下向籽晶位置流动，同时所述原料气体进行化学反应，通过控制温度、压强、原料气体的浓度比及流量，所述化学反应产生碳化硅分子，并在所述籽晶表面沉积；所述反应副产物气体和未完全反应的原料气体在载流子气体的载动下通过所述的坩埚侧壁的排气孔排出；最终在所述籽晶处得到碳化硅晶体<sep>成功解决了现有技术无法同时实现大尺寸、公斤级、高质量的碳化硅晶体的生长的问题，增大产出、降低成本、提高晶体质量
