label_id	text
18	一种制备石膏基抹灰材料的方法<sep>北新集团建材股份有限公司<sep>一种制备石膏基抹灰材料的方法<sep>所述方法包括：将低品质脱硫石膏、相变蓄能储热材料和缓凝剂混合均匀，在温度为40±2℃，真空度为‑0.09mpa至0.01mpa的条件下，抽真空10分钟，使得所述相变蓄能储热材料被封装在所述低品质脱硫石膏上，得到预混粉；向所述预混粉中加入水泥、乳胶粉、减水剂、纤维素醚、粉煤灰和砂子，混合均匀，即得<sep>本申请的方法以杂质含量高的低品质脱硫石膏为主体材料，实现了低品质脱硫石膏的资源化利用，而且制备的石膏基抹灰材料具有较好的保温、隔音、防水和抗菌等性能
18	一种地砖用彩色砂<sep>重庆长江造型材料(集团)股份有限公司<sep>本发明属于彩色砂生产技术领域<sep>具体公开了一种地砖用彩色砂，包括如下质量组分的原料：骨料90‑100份、树脂0.5‑10份、抗氧化剂0.05‑1份、颜料0.05‑1份和抗紫外线剂0.05‑1份；所述骨料为不同粒度的石英砂<sep>该彩色砂粒度集中，颜色均匀且稳定，该彩色砂在室外紫外线的照射下性能稳定，耐候性强
18	一种用于防辐射砂浆、混凝土的重构铬渣粉及制备、应用<sep>郑州蓝霞环保工程有限公司<sep>本发明属于建筑混凝土材料技术领域<sep>具体涉及一种用于防辐射砂浆、混凝土的重构铬渣粉及制备、应用。该重构铬渣粉制备时以一定量的铬渣粉、熔融矿渣、催化助熔组分为原料，经熔融、水淬、烘干粉碎而成<sep>本发明制得的重构铬渣粉作为掺合料应用到砂浆、混凝土中能够提高砂浆、混凝土的抗辐射性能，同时重构铬渣粉具有良好的活性特征，掺合后对砂浆、混凝土的其他基本性能无不利影响，混凝土的各项指标符合国家标准要求
18	一种使用寿命长的环保建筑材料及其制备方法<sep>浙江索纳塔建筑材料有限公司<sep>本发明公开了一种使用寿命长的环保建筑材料及其制备方法<sep>包括外层建筑材料和内层建筑材料，所述外层建筑材料铺覆于内层建筑材料的两侧，所述内层建筑材料为改性硅胶布，且厚度控制在0.5毫米；所述外层建筑材料中的各原料按重量百分比分别为25‑35％的硅酸盐水泥、10‑20％的膨润土、10‑20％的聚氨酯、5‑15％的石英砂、5‑15％的粉煤灰、5‑15％的炉渣、3‑7％的碳纤维和4‑6％的纳米银粉<sep>本发明中的外部建筑材料和内部建筑材料均具有抗菌防霉的功能，并依据两者的配合作用，以及与改性硅胶布相覆合，使其耐候性和抗老化性增强，大大提高了使用寿命，且各原料易于获取、成本低廉。
18	光学玻璃<sep>agc株式会社<sep>本发明提供一种光学玻璃<sep>其红外线透射率高，作为车载用的红外线传感器等是有用的<sep>一种光学玻璃，其中，以原子％表示，所述光学玻璃含有：ge+ga：6％～30％、s+se+te：50％～85％、ti：0.001％～0.5％，并且所述光学玻璃的换算为厚度1mm的玻璃板的红外线透射率为10％时的长波长侧端部的波长(λ)为12μm以上
18	一种长期高效固化氯离子的混凝土外加剂及应用<sep>江苏苏博特新材料股份有限公司<sep>本发明公开了一种长期高效固化氯离子的混凝土外加剂及制备方法<sep>所述长期高效固化氯离子的混凝土外加剂添加了硅铝相组分，其占所述长期高效固化氯离子的混凝土外加剂总质量的20‑46.75%；所述硅铝相组分是400℃至800℃煅烧后的膨润土和/或高岭土，其颗粒粒径为80μm方孔筛筛余≤10%，alo的质量分数≥35%；且所述硅铝相组分能够在混凝土碱性环境下生成纯度在90%以上的friedel盐（水化氯铝酸钙）。本发明实现混凝土中氯离子的高效固化与长期稳定，有效降低混凝土内部氯离子的传输速率<sep>综上所述，该技术具有掺量低（1‑5%取代胶凝材料质量）、氯离子固化效率高与固化效果长期稳定的技术优势
18	一种轻质多孔大理石复合砖的制备方法<sep>泰州峰飞机械设备有限公司<sep>本发明公开了一种轻质多孔大理石复合砖的制备方法<sep>属于建筑材料技术领域。本发明首先将大理石粉碎过筛后，分散于无水乙醇中，再加入聚乙烯吡咯烷酮，制得大理石分散液，随后将正硅酸乙酯溶液滴加至大理石分散液中，并调节ph至碱性，恒温搅拌反应后，再加入硼酸、纳米铁粉和氟化钠，制得改性大理石分散液，接着将丙烯酰胺、n,n’‑亚甲基双丙烯酰胺、引发剂和改性大理石分散液加热搅拌反应，并过滤，得滤饼湿料，再将滤饼湿料注模后压制成型，随后干燥、脱模并烧制成型，即得轻质多孔大理石复合砖<sep>本发明所得轻质多孔大理石复合砖具有优异的力学性能
18	一种四氟草酸磷酸锂的制备方法<sep>森田新能源材料(张家港)有限公司<sep>本申请公开了一种四氟草酸磷酸锂的制备方法<sep>所述制备方法包括：(1)、将五氟化磷气体通入到已投加有草酸锂和碳酸二甲酯的反应釜中，在20～25℃条件下进行充分反应5小时以上，过滤后得到四氟草酸磷酸锂溶液；(2)、滴入二氯甲烷直至无晶体或沉淀析出，过滤得到四氟草酸磷酸锂粗制品；(3)、干燥<sep>本发明的反应条件温和、产率高、工艺设备简单，可以制得高品质的四氟草酸磷酸锂，同时反应过程中冷凝的dmc可重复使用，反应得到的副产物六氟磷酸锂也可重复利用，进而节省了成本
18	自清洁高透光率钢化玻璃的制备方法<sep>光能环保科技有限公司<sep>本发明的自清洁高透光率钢化玻璃的制备方法<sep>包括有以下步骤：（1）清洗玻璃；（2）玻璃等离子处理；（3）自清洁水性涂料制备，本步骤使用二氧化硅前驱体、硅烷偶联剂、偏钛酸、二氧化硅、氢氟酸混合反应再加入氨水调节ph，如此制得的纳米分散液具有超亲水、防雾、光催化作用（分解有机物）及释放负氧离子等功能，即自清洁功能；（4）玻璃辊涂；（5）干燥<sep>本方法制得的自清洁高透钢化玻璃具有较低的水滴角（小于10°）并具有较高的透过率（透过率提高>2%，400nm‑1100nm），自清洁性能优异
18	用于加氢催化剂的碳载体及其制备方法、钯系负载型加氢催化剂及其应用<sep>中国石油化工股份有限公司北京化工研究院<sep>本发明提供了一种用于加氢催化剂的碳载体及其制备方法、钯系负载型加氢催化剂及其应用<sep>所述碳载体的表面具有含氧基团，所述碳载体的强度为70～120n/颗；所述碳载体的比表面积为1～2000m/g，平均孔径为2～10nm。制备所述用于加氢催化剂的碳载体的方法包括：1)将有机高分子化合物与固化促进剂混合均匀，得到固化体系；2)将所述固化体系与水混合，并将得到的混合物依次进行捏合、成型，得到碳载体前驱体；3)将所述碳载体前驱体依次进行老化、烘干、固化和碳化，从而得到所述碳载体<sep>本发明制备的碳载体具有比表面积大，强度高，杂质少，形状易控，所述碳载体的制备方法简单易行，适用于大规模的工业生产
18	一种陶瓷表面铜紫色釉的制备方法<sep>卢群海<sep>本发明公开一种陶瓷表面铜紫色釉的制备方法<sep>包括以下操作步骤：（1）将金属铜粉、氧化铜、醋酸亚铜、高纯熔盐加入至球磨机中，球磨处理后，制得色粉；（2）将石英、长石、高岭土、氧化镧、钙基膨润土、木质素磺酸钠、水加入至球磨机中，球磨处理后，向其中加入色粉，继续球磨处理后，制得釉料；（3）将陶瓷体表面采用氢氟酸溶液进行浸泡处理25‑30s后，将步骤（2）制得的釉料涂抹在陶瓷体的表面，然后放入烧结炉中进行烧结处理，烧结处理时，烧结气氛为氮气和氢气的混合气体<sep>本发明提供的一种陶瓷表面铜紫色釉的制备方法，操作简单，成本低廉，处理过程中，三废少，铜紫色釉具有色泽均匀、亮度高、紫色纯正的特点，极大地提升了陶瓷的品质
18	抑制骨料上浮的轻质混凝土<sep>中交公路长大桥建设国家工程研究中心有限公司<sep>本发明公开了一种抑制骨料上浮的轻质混凝土<sep>其原料包括：以质量百分比计，水泥20％～40％、水10～30％、砂25％～50％、粉煤灰0％～15％、硅粉0％～5％、缓凝剂0.1％～0.2％、外加剂0.2％～1％、轻质高强陶粒15％～30％和矿物增稠剂1％～3％。同时还可以掺加一定体积的聚乙烯醇纤维和钢纤维<sep>本发明通过轻质高强陶粒调节其强度和容重，通过矿物增稠剂和纤维抑制骨料上浮，改善施工性能，通过复掺纤维增强韧性，通过外加剂提高耐久性，可制备强度等级lc30～lc70、密度1700～2150kg/m的系列轻质混凝土
18	一种用于二氧化碳还原的钌基催化剂及其制备方法和应用<sep>武汉大学<sep>本发明提供一种用于二氧化碳还原的钌基催化剂及其制备方法<sep>以钙铝石或钙铝石电子盐为载体，钙铝石或钙铝石电子盐表面负载活性成分钌，其中，活性成分钌和钙铝石或钙铝石电子盐质量比为0.5～8：100，钙铝石或钙铝石电子盐的比表面积为0.5‑60m/g。本发明制备方法简单，通过简单的水热反应即可制备得到较大比表面积的二氧化碳还原的ru催化剂载体<sep>得到的催化剂催化活性高、安全性能高、稳定性较好
18	一种凹凸棒饰面砂浆及其制备方法<sep>合肥万博制漆有限公司<sep>本发明公开了一种凹凸棒饰面砂浆及其制备方法<sep>涉及建筑材料技术领域。本发明饰面砂浆包括a、b两组分，使用时将a、b按比例混合即可；a组分由以下原料组成：改性环氧树脂、42.5白色硅酸盐水泥、石英砂混合物、重质碳酸钙粉、纳米氧化铝；b组分由以下原料组成：改性凹凸棒土、耐碱丙烯酸乳液、醇酯十二、色浆、天然植物油脂<sep>本发明对环氧树脂和凹凸棒进行改性处理，增强了饰面砂浆的耐候性和抗压强度，成本低、工艺简单无污染，适合工业化生产
18	一种耐腐蚀保温陶瓷材料的制备方法<sep>枣庄京弘电力材料有限公司<sep>本发明公开了一种耐腐蚀保温陶瓷材料的制备方法<sep>涉及保温陶瓷材料技术领域。该制备方法包括分散液体的制备：将硅藻土和硅烷偶联剂混合，加入适量水，置于反应釜中搅拌，超声，得到分散液体；物料混合球磨：向分散液体中依次加入如下物料：钛酸钡、钛酸铜钙、远红外陶瓷粉、纳米二氧化钛、硅酸钠、消泡剂、紫外吸收剂；研磨得到混合物料；烧结成型：将混合物料预烧，挤出造粒，过筛，沉化，压制成陶瓷生坯；陶瓷生坯排胶处理，烧结，自然冷却至室温，得到该保温陶瓷材料<sep>本发明的制备方法不仅提高了该陶瓷材料的耐温性、耐压性、耐腐蚀性，而且抗氧化、抗老化，延长了使用寿命，扩大了使用范围
18	一种连续梯度tic多孔陶瓷及其模板压缩制备方法<sep>北京交通大学<sep>本发明公开了一种连续梯度tic多孔陶瓷及其模板压缩制备方法<sep>该tic多孔陶瓷两侧孔隙率分别为60～90％和80～95％，两侧密度差为20％～100％，期间连续过渡。其制备方法如下：将ti粉、c粉、pvb和乙醇配制成料浆；选用一定孔径的聚氨酯海绵，将其裁切成梯形，放入一个宽度与梯形海绵上底尺寸相同的矩形框中，使梯形海绵由上到下产生程度不同的均匀压缩。以此海绵为模板，通过料浆浸渍法获得梯度多孔陶瓷坯体，再经无压烧结，即得到本发明的连续梯度tic多孔陶瓷<sep>本发明所制备的tic多孔陶瓷呈连续梯度结构，两侧孔隙率可通过选择适当孔径的海绵、改变梯形海绵上下底的比例以及改变挂浆次数进行调控；本发明操作简单，结构可控性高，成本低廉
18	一种保温吸音轻质材料及其制备方法<sep>林圣灼<sep>本发明公开了一种保温吸音轻质材料及其制备方法<sep>原料为：碳化硅、不定形二氧化硅、三甲基氯硅烷、甲基硅橡胶、碳酸钙、氧化硼、氧化铝、氧化铁。制备方法为：将碳化硅、不定形二氧化硅、三甲基氯硅烷、甲基硅橡胶、碳酸钙、氧化硼、氧化铝和氧化铁放入混料机中混料，得到混合物料；将混合物料移入玻璃装置中，加入氨水，搅拌后放入水浴锅中反应；将反应后的混合物料在烘箱中烘干，经过喷雾造粒处理后，挤压成型，获得平层坯体；最后将平层坯体放入马弗炉中烧结，即得保温吸音轻质材料<sep>本发明制备的保温吸音轻质材料是一种多孔材料，具有热导率低、吸音效果好、防火效果好、密度低的优点
18	一种建筑石膏砌块的制备工艺<sep>曾克云<sep>本发明公开了一种建筑石膏砌块的制备工艺<sep>所述制备工艺包括以下步骤：步骤a：将生石膏粉放入炒锅内经加热脱水，使物料升温到190‑220℃温度时，立刻出锅，冷却到室温，得到熟石膏粉；步骤b：将所述水和熟石膏粉按照重量比0.7‑0.75混合，人工搅拌1‑2min形成熟石膏浆液；步骤c：准备石膏砌块模具，将所述模具安装在陶瓷平板上，将所述熟石膏浆液加入所述模具中，在熟石膏浆液出现增稠后，通过平板玻璃对所述熟石膏浆液进行反复搓压后，静置5‑10min，硬化形成石膏砌块<sep>本发明石膏砌块的制备工艺生产的砌块表面平整光滑、外型尺寸偏差小、抗折强度高；本发明的工艺能够有效稳定产品质量和准确地控制砌块的脱模时间，通过判定平板玻璃与模具上端接触处能自行显示一道闭合的灰白色或浅黄色影线时，则预告砌块可以脱模，确保了制备石膏砌块的质量，和控制生产效率
18	一种茶渣透水砖及其制备方法<sep>贵州省凤冈县浪竹有机茶业有限公司<sep>本发明属于透水砖技术领域<sep>尤其是一种茶渣透水砖及其制备方法，采用茶渣、煤矸石、埃洛石、丙烯酸树脂、羧甲基纤维素、减水剂和水为底料，采用茶渣、废玻璃、丙烯酸树脂、羧甲基纤维素、减水剂和水为面料，按照一定的比例混合搅拌均匀，放置在成型模具中，经蒸汽养护后，制备成透水性能好、强度高、收缩小的透水砖<sep>同时还具有优异的耐磨性和抗裂性
18	一种加强型防爆玻璃制备设备<sep>盐城恒发玻璃制品有限公司<sep>本发明公开了一种加强型防爆玻璃制备设备<sep>包括机身，所述机身内设有左右贯穿的工作腔，所述工作腔内设有安装玻璃以及夹层胶膜的玻璃固定机构，所述工作腔底壁可安装有下层玻璃，所述下层玻璃顶面可安装有夹层胶膜，所述夹层胶膜上方设有上层玻璃，本发明的设备利用气囊与玻璃挤压排出防爆玻璃制备时产生的气泡，制备的防爆玻璃气泡残留少，质量高，设备制备时反应灵敏，自动化程度高，同时，制备过程中利用气囊减少了与玻璃之间的物理磕碰，防爆玻璃制备时不易损坏，可生产较为轻薄的防爆玻璃，设备安全可靠，另外，设备二次利用气囊中的暖气形成高温蒸汽<sep>设备热能利用率高
18	一种通过优化致密填充粒径分布提高材料颗粒填充密度的方法<sep>佛山科学技术学院<sep>本发明属于建筑材料领域<sep>具体明涉及一种通过优化致密填充粒径分布改善水泥浆、砂浆、混凝土配合比设计，进而提高材料颗粒填充密度的方法<sep>本发明比较分析了实际生产的掺加不同种类不同掺量矿物掺合料的水泥浆胶凝材料试样、砂浆固体材料试样、不同细骨料占比的混凝土骨料试样的粒径分布与优化致密填充粒径分布模型吻合度，并实验测量了相应水泥浆胶凝材料试样、砂浆固体材料试样、混凝土骨料试样的填充密度，表明了颗粒粒径分布越接近优化致密填充粒径分布模型，其填充密度越高，证明了优化致密填充粒径分布模型在水泥浆、砂浆、混凝土配合比优化中的有效作用
18	堇青石-尖晶石匣钵、制备方法及其应用<sep>浙江大学<sep>本发明涉及耐火窑具领域<sep>具体而言，提供了一种堇青石‑尖晶石匣钵、制备方法及其应用。所述堇青石‑尖晶石匣钵主要由以下质量份的原料制备而成：高岭土6‑12份，滑石6‑10份，α‑氧化铝3‑8份，粒径不大于46.9μm的尖晶石20‑30份，以及粒径不大于1mm的尖晶石40‑60份<sep>该匣钵具有耐腐蚀性强、热稳定性好、使用寿命长和使用成本低的优点，各原料来源广、价格低廉，因此匣钵的生产成本也较低
18	一种基于流延法制备铌酸钾钠织构透明陶瓷的方法<sep>福州大学<sep>本发明公开了一种基于流延法制备铌酸钾钠织构透明陶瓷的方法<sep>首先制备纯(kna)nbo粉料以及nanbo片状模板，采用流延成型工艺，在1000～1200℃下进行无压烧结，即可制得无杂相、结构致密且取向生长的knn压电织构透明陶瓷，且该样品具有良好的透光性和优异的压电性能等<sep>本发明设备简单，工艺简便，易于操作，且生产效率高，进一步拓展了knn基无铅压电陶瓷的功能
18	具有玻璃装饰的陶瓷的制备方法及其制品<sep>东莞信柏结构陶瓷股份有限公司<sep>本发明涉及一种具有玻璃装饰的陶瓷的制备方法及其制品<sep>该制备方法包括以下步骤：步骤1：取一陶瓷生坯和至少一块玻璃块，陶瓷生坯设有待装饰区，将玻璃块按预设图案排列放置于待装饰区；步骤2：然后经过排胶、烧结，并随炉冷却，玻璃块在排胶和烧结的过程中熔融成液态玻璃附着于陶瓷坯体的待装饰区的表面，冷却后，液态玻璃固化形成预设图案附着于陶瓷坯体，形成玻璃层，获得具有玻璃装饰的陶瓷素坯<sep>陶瓷生坯具有孔隙，在排胶过程中玻璃块软化熔融为液态玻璃，部分液态玻璃渗入陶瓷生坯的孔隙，至烧结温度玻璃块进一步熔融，冷却后，玻璃形成预设图案附着于陶瓷坯体的表面；玻璃具有一定的透亮性，使玻璃形成的图案具有较强的立体感
18	一种高密实抗侵蚀混凝土及制备方法<sep>济南大学<sep>本发明提供了一种高密实抗侵蚀混凝土<sep>包括以下重量份的原料制成：水0.3‑0.34份，钙矾石粉0.01‑0.22份，改性轮胎粉0.016‑0.032份，水泥1份，砂1.2‑1.4份，石子2.6‑2.8份；所述改性轮胎粉为丁苯橡胶轮胎粉在乙酸中浸泡后再进行亲水改性获得的。所述改性轮胎粉粒径为5‑25µm<sep>本发明原料易得，工艺简单，所得高密实抗侵蚀混凝土密实度高、耐腐蚀
18	一种一次性成型石墨坩埚的制造方法和装置<sep>吉林科工碳业有限公司<sep>本发明提供了一种一次性成型石墨坩埚的制造方法和装置<sep>涉及石墨技术领域，通过获得石墨粉与中温煤沥青的第一配比；判断所述第一配比是否符合第一预设条件；当所述第一配比符合第一预设条件时，获得所述石墨粉与所述中温煤沥青的第一混捏条件信息；根据所述第一混捏条件信息确定第一混捏糊料；获得所述第一混捏糊料的第一成型压力；根据所述第一成型压力确定第一压型生坯<sep>根据所述第一压型生坯获得第一焙烧温度，对所述第一压型生坯进行焙烧获得一次性成型石墨坩埚，达到了生产优质石墨坩埚，抗热震性、烧蚀性与防漏性良好，且机械强度高，能够满足锂电池负极材料的提纯以及冶炼行业的要求的技术效果。
18	晶体生长用坩埚以及释放碳化硅晶体热应力的方法<sep>中国科学院上海硅酸盐研究所<sep>本发明涉及晶体生长用坩埚以及释放碳化硅晶体热应力的方法<sep>所述坩埚是与制备的晶体侧面相接触的坩埚，所述坩埚具有环式非闭合拼接结构<sep>该晶体生长用坩埚具有环式非闭合拼接结构，因此可以避免紧箍晶体，从而使晶体生长过程中在晶体内聚集形成的热应力得到有效释放，降低晶体的开裂率，提高晶体的成品率
18	一种填料瓷球及其制备方法<sep>海南汉地阳光石油化工有限公司<sep>本发明公开了一种填料瓷球及其制备方法<sep>所述瓷球包括以下重量份的原料：氧化铝80～90份、氧化镁3～5份、氧化钛2～3份、氧化锆1～3份、高岭土3～5份、锂辉石1～5份、蛭石3～5份、砾石5～10份、火山岩1～3份和蟹壳粉5～8份。本发明制得的瓷球无裂纹、无气泡，吸水率低，耐酸度和耐碱度高，耐急变温差大，堆积密度大，抗压强度大，全面改善瓷球的品质，更好发挥催化剂的作用，极大提高塔内反应速度和反应效果<sep>而且，本发明蟹壳粉的制备、混料以及烧结等特殊工艺，进一步改善了瓷球品质
18	铋锌硼玻璃制造方法<sep>中国建筑材料科学研究总院有限公司<sep>本发明是关于一种铋锌硼玻璃制造方法<sep>涉及玻璃制造技术领域。主要采用的技术方案为：铋锌硼玻璃制造方法，其包括：通过使用溶剂配制具有预定固体含量的bio浆料、zno浆料以及bo浆料；按照重量百分比bio60‑94％、zno 3‑20％以及bo3‑20％的比例，将bio浆料、zno浆料以及bo浆料混合；将上述混合浆料加热预处理，进行干燥和排胶；将加热预处理后的混合物料在800‑1100℃进行熔化处理，并将熔化后的物料进行急冷处理得到成品<sep>本发明提供的制造铋锌硼玻璃的方法，采用浆料进行混合，能够便于混合，能够获得高均匀的混合原料，进而熔化获得性能优良的铋锌硼玻璃
18	一种大规模晶体硅颗粒的制备方法<sep>四川大学<sep>本发明提供了一种碳化硅表面外延生长大规模晶体硅颗粒的制备方法<sep>所述晶体硅颗粒生长在单晶碳化硅表面，所述制备方法包括如下步骤：s100：对单晶碳化硅片进行加热处理；s200：当所述密封环境的温度升至500℃‑2000℃后，进行保温处理；所述保温处理的时间为1 s‑100 h；s300：保温结束后，进行降温处理；降至室温后即可得到生长在单晶碳化硅表面的大规模晶体硅颗粒<sep>本发明生产设备更加简单，与单晶硅片激光打印法制不同晶型的硅颗粒相比，不需要昂贵的激光设备，成本廉价且能够大规模制备晶体硅颗粒
18	一种微波磁控管用绝缘环及其制备方法<sep>湖南省美程陶瓷科技有限公司<sep>本发明公开一种微波磁控管用支持体<sep>涉及金属化陶瓷加工技术领域，包括环状陶瓷基体和金属化层，其中环状陶瓷基体用碳化硅‑三唑硅烷‑氮化铝网状基体、高炉矿渣、钛酸锶、分散剂和除泡剂等原料，经碳化硅‑三唑硅烷‑氮化铝网状覆膜基体的制备、混料、造粒和烧结等步骤而制成；金属化层原料包括钛粉、铝粉、铜粉、黏土和粘结剂，并公开了用金属化层和环状陶瓷基体组成的支持体本体的制备方法<sep>本发明提供的微波磁控管用绝缘环，具有高的致密度和抗拉强度，具有优异的抗拉强度、韧性、耐高温性能和热导性，并能降低原料成本，达到节能环保的目的
18	一种用于焦炉炉墙裂缝热态修补的液体灌浆材料及制备方法和使用方法<sep>上海应用技术大学<sep>本发明公开一种用于焦炉炉墙裂缝热态修补的液体灌浆材料及制备方法<sep>按质量份数计算由100份水玻璃、100～250份固体填料及9～16份添加剂组成，所述固体填料按质量百分比计算由50%～70%莫来石、20%～30%耐火黏土和10%～20%石英砂组成，所述添加剂由分散剂、渗透剂和消泡剂组成。将添加剂和固体填料先后加入水玻璃溶液中并混合均匀后即得用于焦炉炉墙裂缝热态修补的液体灌浆材料，其是一种易泵送且可与被修补的耐火材料有较好的粘结性、可固化烧结温度广、施工方便的灌浆材料<sep>原料廉价易得、对人体无伤害、制备周期短、制备方法简单，因此具有生产成本低，生产过程环保，无污染、且可批量生产等特点
