label_id	text
19	一种用于漂浮式海上风力发电机的复合式嵌套压电阻尼器<sep>本发明涉及一种用于漂浮式海上风力发电机的复合式嵌套压电阻尼器<sep>包括多层嵌套的球型腔体，各球型腔体内部装有液体(10)并留有空气，最外层球型腔体(5)内壁以及其余球型腔体的内外壁分别设有压电陶瓷片(2)，最内层球型腔体(7)内部还设有耗能钢珠(4)；相邻球型腔体通过第一弹性耗能组件固定连接，最外层球型腔体(5)通过第二弹性耗能组件与风力发电机(14)内壁连接<sep>与现有技术相比，本发明具有多种耗能机制，耗能效果好，可将原本耗散的能量加以利用，提高能量的利用率
19	基于风电容量可信度的电力电量平衡优化方法<sep>本发明涉及电力系统自动化的技术领域<sep>具体涉及一种基于风电容量可信度的电力电量平衡优化方法。收集研究区域内各省火电、水电机组数据；获得决策周期内各省负荷预测曲线和风电预测出力；根据风电容量可信度和风电预测出力获得风电可信预测出力；制定联络线传输功率计划，分时段设定传输功率的最大、最小值；以全网运行成本最小为目标运行函数，以功率平衡约束、机组运行约束、联络线传输约束、电量约束和旋转备用约束为约束条件，构建电力电量平衡优化模型；求解模型得到各省发电机组最优出力和各省间联络线传输功率<sep>将不确定性的风电出力通过风电可信度计算转换为可信的机组出力，解决了传统电力电量平衡方法中不能妥善地考虑风电的难题
19	最大功率曲线获取方法及装置和最大功率跟踪方法及装置<sep>本申请实施例提供了一种最大功率曲线获取方法及装置和最大功率跟踪方法及装置<sep>涉及电力技术领域。该方法包括：获取风力发电机处于最大功率点运行时的风力发电机的第一运行参数的参数值和第二运行参数的参数值；根据预设的由第一运行参数、第二运行参数和最大功率曲线系数构成的第一关系方程，及第一运行参数的参数值和第二运行参数的参数值，计算最大功率曲线系数的数值；根据已知最大功率曲线系数的数值的第一关系方程，确定风力发电机的最大功率曲线方程<sep>采用本申请可以方便简单的获取风力发电机的最大功率曲线
19	一种辅翼变桨且可自启动的大型达里厄风机<sep>本发明公开了一种辅翼变桨且可自启动的大型达里厄风机<sep>风机包括：基座；塔架；风轮组件，风轮组件设于所述塔架的顶端，风轮组件包括：风轮轴；多个主翼，多个主翼环绕风轮轴的周向均匀间隔开分布，每个主翼均通过连接组件与风轮轴固定相连；多个辅翼，多个辅翼环绕风轮轴的周向均匀间隔开分布，且多个辅翼一一对应地设于多个主翼的邻近风轮轴的一侧，辅翼绕竖向轴线在第一位置和第二位置之间可转动地连接于连接组件上；多个变桨驱动装置，所述变桨驱动装置用于驱动辅翼在所述第一位置和所述第二位置之间转动<sep>本发明的风机可在保证其低速和启动性能的前提下兼顾其在高速下的风能转换率
19	关于风轮机叶片制造的改进<sep>描述一种制作风轮机叶片的方法。所述叶片包括具有层压结构的外壳。所述方法包括：提供限定所述叶片的所述外壳的至少一部分的形状的叶片模具(82)。所述模具沿翼展方向在根部端(94)与梢端(96)之间延伸<sep>并且沿翼弦方向在前缘(90)与尾缘(92)之间延伸。所述方法进一步包括提供包括干结构纤维材料的多个干层片(66)以及包括浸渍有树脂的结构纤维材料的多个预浸渍层片(68)。将所述多个干层片以及所述多个预浸渍层片布置在所述模具中，以形成所述叶片的所述外壳的多层所述层压结构<sep>将所述层片布置在所述模具中，使得所述干层片与所述预浸渍层片间插以形成混合壳结构，在该混合壳结构中所述层片以交错的关系布置，使得所述干层片的相应边缘沿所述模具的所述翼展方向以及/或者所述翼弦方向相互偏置并且/或者使得所述预浸渍层片的相应边缘沿所述模具的所述翼展方向以及/或者所述翼弦方向相互偏置
19	一种风电场次同步振荡抑制方法及系统<sep>本发明公开了一种风电场次同步振荡抑制方法及系统<sep>该方法包括：采集静止同步补偿器并网点的三相电压瞬时值或风电场送出线路中串联电容上的三相电压瞬时值，所述静止同步补偿器为风电场安装的静止同步补偿器；提取所述三相电压瞬时值中的振荡分量；对所述振荡分量进行克拉克变换，得到两路电压信号；根据克拉克变换得到两路电压信号以及设定的移相角和增益构造两路电流信号；对两路电流信号进行克拉克反变换，得到三路电流信号；将克拉克反变换得到的三路电流信号作为附加信号加到静止同步补偿器电流跟踪环的参考电流上<sep>本发明提供的风电场次同步振荡抑制方法及系统，能够有效地抑制基于双馈型风力发电机风电场的次同步振荡现象
19	一种风力发电装置<sep>本发明公开一种风力发电装置<sep>属于发电设备技术领域，本发明的装置包括：风车组件，风车组件包括：转轴，第一驱动组件，用于驱动转轴旋转，第一驱动组件安装于转轴端部，第二驱动组件，用于驱动转轴旋转，第二驱动组件沿转轴轴线安装于转轴上，其中，第一驱动组件包括与转轴端部连接且同轴的转盘，转盘的环绕连接有连接杆，连接杆轴线与转轴轴线垂直，连接杆上连接有第一叶片，第一叶片具有与连接杆装配的第一装配孔，第一叶片一侧面具有弧形凹面<sep>本发明，采用多级导风，使风向沿预定方向流动并增加风力，扩大风能捕获，有效提高单机发电能力，装置整体稳定性、安全性高
19	一种双馈风电机组的惯性控制方法<sep>本发明公开了一种双馈风电机组的惯性控制方法<sep>双馈风机有功输出参考值通过最大功率跟踪算法控制；通过系统频率检测若系统频率正常双馈风机有功输出参考值则通过最大功率跟踪算法控制，否则通过双馈风机转子转速线性有功输出控制；通过双馈风机转子转速检测若转速变化率小于等于双馈风机转子转速变化率阈值时双馈风机有功输出参考值通过双馈风机转子转速有功输出控制，否则通过双馈风机转子转速加速有功输出控制至系统频率恢复正常再通过最大功率跟踪算法控制<sep>与现有技术相比，本发明能有效为系统频率提供暂态支撑，同时能避免双馈风机转子动能过度释放和减小转速恢复瞬间功率跌落幅度
19	风力发电机及带有风力发电机的风洞<sep>本发明涉及一种风力发电机及带有该风力发电机的风洞<sep>该风力发电机包含外壳、设置在外壳内的发电机本体；该发电机本体包含外定子、设置在外定子内的转子、设置在转子内的内定子、分布在外壳内与转子连接的风叶；其中，内、外定子和转子均同轴设置；该风力发电机还包含分布在外壳内对外定子进行支撑第一支撑柱、分布在外壳内对内定子进行支撑的第二支撑柱。同现有技术相比，由于发电机本体是由内、外定子和转子构成，从而当各风叶在风力作用下带动转子进行转动时，发电机本体能够同时在转子外和转子内分别产生感应电动势，以提高风力发电机风能的利用率<sep>另外由于内、外定子分别是通过支撑柱与外壳进行固定连接，从而提升了发电机本体的支撑强度
19	一种具有限速功能的散热型风力发电设备<sep>本发明涉及一种具有限速功能的散热型风力发电设备<sep>包括固定箱、叶片、传动轴、转动轴、发电装置和限速机构，所述固定箱的一侧设有通孔，所述传动轴穿过通孔，所述传动轴与通孔滑动且密封连接，所述叶片设置在固定箱的设有通孔的一侧，所述叶片安装在传动轴上，所述转动轴与传动轴同轴设置，所述发电装置安装在转动轴的远离传动轴的一端，所述传动轴通过限速机构与转动轴的远离发电装置的一端连接，所述固定箱内还设有散热机构，该具有限速功能的散热型风力发电设备通过限速结构实现了限速的功能<sep>不仅如此
19	分散式悬浮风力发电系统<sep>本发明涉及风力发电技术领域<sep>涉及分散式悬浮风力发电系统<sep>分散式悬浮风力发电系统，包括风力发电机组、气囊本体、线缆和控制器；具体的，气囊本体呈环状，气囊本体上设置有用于使气囊本体自动迎风的尾翼，气囊本体的中心区域设置有风道，风道内设置有支架，风力发电机组设置在支架上，当气囊本体升空后，通过尾翼能够使风力发电机组迎风；同时在风力发电机组迎风面设置有遮挡组件，支架上设置有用于驱动遮挡组件开合的动力源，通过控制器控制动力源，调节遮挡组件的遮挡面积，从而调节风力发电机组的转速，进而调节风力发电机组的发电功率，同时在安装和升降气囊本体时，完全关闭遮挡组件能够有效的提高气囊本体的稳定性，方便安装和升降
19	基于风电场场级能量控制的风电机群启停机控制方法<sep>本发明公开了一种基于风电场场级能量控制的风电机群启停机控制方法<sep>包括如下步骤：1.以风电场每一台风电机组为测量点，采集风机实时数据，存储历史数据，分析评估以建立风机健康度、可控性、运行力评估、周期内启停机次数四个维度的数据模型；2.启停机控制策略模型：设定单台风电机组，有功功率限制值下限为5％；对于整个风电场而言，当全场的有功功率限制值小于5％或者场内有多台有功功率不可控的风机导致整场的功率无法达到要求时，则启用停机策略；若是风电场的有功功率能力低于风电场有功功率限制值的a％，则启动场内停止的风机<sep>本发明具有能够延长机组使用寿命，节约成本和提高稳定性的特点
19	一种风力发电机的智能控制系统<sep>本发明公开了一种风力发电机的智能控制系统<sep>包括风力发电机，风机故障控制单元，其设置在所述风力发电机内部，与所述风机故障控制单元电连接的风机灯光提示装置，以及，风机齿轮箱冷却控制系统<sep>本发明的灯光提示装置设置在风机内部和外部，通过不同颜色的led灯显示不同的风机故障，提高风机故障的发现率，风机齿轮箱冷却控制系统能够检测齿轮箱内部温度，自动对齿轮箱温度进行冷却作业
19	一种气压传动的扑翼式发电装置<sep>本发明公开了一种气压传动的扑翼式发电装置<sep>包括捕能装置、能量传输装置、能量转换装置和控制装置，捕能装置通过扑翼收集风能并转化为气缸内活塞和活塞杆沉升的机械能，能量传输装置和能量转换装置将气缸内活塞和活塞杆沉升的机械能转化为压缩气体的动能，并利用压缩气体驱动气动马达带动发电机输出电能，进行发电，控制装置控制整个装置的运动<sep>本发明提供的一种气压传动的扑翼式发电装置，利用扑翼的沉升运动捕捉流体动能，具有高效率，高适应性，高稳定性的特点
19	一种风电机净水设备<sep>本发明涉及一种风电机净水设备<sep>包括风电设备以及设置在风电叶片背侧的净水设备。所述风电设备包括风电叶片、叶片转轴以及风电塔杆。所述净水设备包括过滤腔和絮凝腔<sep>通过对过滤腔和絮凝腔整体进行改造，使得对于雨水的利用得到最大化，将可能承接到的雨水均净化为能够直接饮用的纯净水，对海上工作或大漠工作人员的淡水供应实现了保障
19	一种海上风电机组安装船装置及其安装方法<sep>本发明公开了一种海上风电机组安装船装置及其安装方法<sep>其安装船装置包括控制系统、安装船、吊机、水下液压系统，安装船包括支撑桩腿、风电机组安装底座、运输固定架、回转平台，水下液压系统包括液压打桩装置和液压升降装置。安装风电机组时采用水下液压打桩锤打桩，液压升降装置安装桩腿并抬起船身。运输固定架包括设置于安装船的左右两侧、相互平行的两个架体，当装载风机时，该两架体沿横向轨道滑动至中间位置锁定并保持风机稳定。回转平台与吊机底座、船体之间设置有防倾模块，使吊机在旋转时保持水平稳定状态<sep>本发明将运输船、海上作业平台、起重船以及海上供给船的各种功能集于一体，可不受风浪影响，能独立作业，且成本低，实用性强
19	张力腿式波浪能风能综合发电装置及其智能振动控制系统<sep>本发明提供了一种张力腿式海洋波浪能风能综合发电装置及其智能振动控制系统<sep>风力发电机构设置在张力腿式发电平台的上方，中央柱内部设有双动往复泵发电机构，每个双动往复泵组包括活塞，活塞和连杆连接，连杆的另一端通过万向节和球状连杆连接，球状连杆的另一端通过万向节连接到发电摆，还包括两个平行竖直的水管，进水管的中间设有进水口，出水管的中间设有排水口，进水口和出水口处都设有水轮发电机，第一进水支口、第二进水支口、第一排水支口和第二排水支口都和活塞外壁连接并贯穿活塞外壁，每个支口和活塞外壁的连接处都设有一个塞子<sep>本发明综合发电装置将风能发电与波浪能发电结合为一体，结构新颖，且设计合理，可在深海中实施
19	一种漂浮式风电发电平台<sep>一种漂浮式风电发电平台<sep>包括扣环、压力传感器、控制器、扣耳、浮体平台、风帆、锚链、锚、飞轮、第三齿轮、第二链条、第一链条、第一齿轮、第二齿轮、轮架、发电机、增速齿轮箱、惯性轮、单向轴承，所述浮体平台上安装多个风帆，浮体平台下安装锚链，锚链下端安装锚，浮体平台左右两端各安装压力传感器，浮体平台后侧安装两个扣耳，扣环扣在扣耳上<sep>本发明的优点是：能利用风能和波浪能。
19	一种风电电力系统agc调节速率需求的确定方法<sep>一种风电电力系统agc调节速率需求的确定方法<sep>其包括从风电场运行部门获取风电功率历史数据序列，从负荷管理系统中获取负荷历史数据序列；计算综合分量数据序列；利用滚动平均法平滑处理综合分量数据序列，得到m时刻平滑后的综合分量数据通过计算相邻的平滑后的综合分量数据差值，确定m时刻所需agc调节速率需求；选取m时刻所需agc调节速率需求最大值作为整个风电电力系统的agc调节速率需求等步骤<sep>本发明综合考虑负荷波动、风电波动等因素，利用滚动平均法，求取负荷与风电功率叠加后综合分量数据，通过计算相邻综合分量数据差值来精确确定风电电力系统agc调节速率需求，为实际电力系统运行提供指导和借鉴
19	一种平抑风电波动的p2h最优容量确定方法<sep>本发明公开了一种平抑风电波动的p2h最优容量确定方法<sep>该方法按照国家电网风电场接入电网技术规定，包括风电1分钟最大功率变化率和10分钟最大功率两个时间尺度方面的要求，利用电解水装置为满足此要求而需要消减掉的风电出力进行电解水，将不利用就会被弃掉的风能转化为可以为工业所用或者注入天然气管道，将电解水的投资成本和运行成本，与电解水转化后所得到的氢气氧气的销售收入进行综合考虑，研究电解水装置的最优容量配置，最大化电解水装置的经济效益，提高风电利用效率<sep>本发明方法降低风电出力的间歇性和波动性对电网的影响，并最大限度将多余风电通过电解水装置转换为氢气，提高能源利用效率
19	一种便于运输的使用寿命长的风力发电装置<sep>本发明涉及一种便于运输的使用寿命长的风力发电装置<sep>包括转动管、固定环、传动齿轮和至少三个叶片，所述固定环与转动管同轴设置，所述固定环的内径与转动管的外径相等，所述固定环穿过转动管，所述固定环与转动管固定连接，所述传动齿轮安装在转动管上，所述叶片以固定环的轴线为中心周向均匀分布在固定环的外周，其特征在于，所述转动管上设有收纳机构和辅助机构，所述收纳机构包括移动环、移动管、两个限位块、至少三个连杆和至少三个传动组件，该便于运输的使用寿命长的风力发电装置通过收纳机构实现了叶片收纳的功能，避免叶片在搬运期间损坏<sep>不仅如此
19	风电变流器及其控制方法、控制装置<sep>本发明提供一种风电变流器及其控制方法、控制装置<sep>所述控制方法包括：产生与风力发电机组中的n套电机绕组一一对应的n个机侧驱动信号；根据每个机侧驱动信号控制所述风电变流器中相应的机侧功率模块，以将相应的电机绕组的三相输出电流转换成直流电流；产生网侧驱动信号；根据所述网侧驱动信号控制所述风电变流器中的网侧功率模块对所述直流电流进行转换，以使所述风电变流器输出与电网对应的三相输出电流，其中，n为大于或者等于1的整数<sep>本发明的风电变流器及其控制方法、控制装置，通过主从控制的方式利用驱动信号对独立的功率模块进行控制，可以简化风电变流器的设计和制造，且有效提高运行可靠性
19	一种风浪联合发电用水平轴聚能风机及其工作原理<sep>一种风浪联合发电用水平轴聚能风机<sep>辐框架、外圆框架、内圆框架构成具有聚风功能的锥形叶轮；锥形导风板提高了风效率；钢丝拉索增加了叶轮牢固度；由风机直驱液压泵；其工作原理为，由辐框架、外圆框架、内圆框架构成一个锥形的叶轮面，再与锥形导风板和钢丝拉索构成一个立体的叶轮，立体的叶轮比常规平面的叶轮强度高，锥形的叶轮面凹面迎风，能增加叶轮面前后的压差，提高了效率；锥形导风板把叶轮中心部的风引导吹向叶片，再次提高了效率<sep>本发明与深水海浪发电装置联合使用，能省去对风装置、浮力框架、油箱、油路及液压马达、发电机，从而省去很多设备、降低了成本，提高了效率，推广应用具有良好的经济和社会效益
19	设有表面安装装置的风轮机叶片<sep>提供了一种用于具有基本水平的转子轴的风轮机的转子的风轮机叶片<sep>所述转子包括毂，风轮机叶片在安装至毂时从毂基本沿径向方向延伸，风轮机叶片具有带末梢端和根部端的纵向方向，以及横向方向。风轮机叶片还包括包含压力侧和吸力侧的异型轮廓，以及前缘和后缘，其带有具有在它们之间延伸的弦长的翼弦，异型轮廓在由进入空气流冲击时生成升力。表面安装装置附接至风轮机叶片的表面，其中表面安装装置经由至少第一附接部分附接至风轮机叶片的表面，第一附接部分连接至表面安装装置的一部分<sep>第一附接部分包括提供表面安装装置与风轮机叶片的表面之间的第一结合连接的外附接部分，其中第一结合连接是弹性结合，以及提供表面安装装置与风轮机叶片的表面之间的第二结合连接的内附接部分，其中第二结合连接具有结构结合
19	塔架及风力发电机组<sep>本发明提供一种塔架及风力发电机组。所述塔架上开设有门洞<sep>所述门洞包括上下对称的弧形段，并且所述弧形段呈n+1个控制顶点控制的k次b样条曲线形式，b样条曲线通过下面的等式来表示：其中，d是b样条曲线的控制顶点，n(u)是b样条基函数，其中，i是节点序号且i＝0,1,...,n，k是所述基函数的次数，n和k都是正整数并且满足2≤n，k≤n，节点矢量其中m＝n+k+1<sep>采用本发明的塔架及风力发电机组可有效降低塔架门洞的应力集中系数，减小塔架门洞位置处的塔架厚度，从而减轻塔架重量并且降低制造成本
19	一种海上风电嵌岩钢管桩的沉桩方法<sep>本发明公开了一种海上风电嵌岩钢管桩的沉桩方法<sep>对四根锚桩、一根试验桩、两根基准桩和两根基准桩护筒进行沉桩。沉桩方法包括以下步骤：搭设定位架，起重船驻位，平吊和竖桩，插桩，沉桩，拆除定位架，打设试验桩、基准桩和基准桩套筒。进行搭设定位架步骤时，先采用振动打桩锤将四根以正方形点阵布置的辅助桩沉设入土，再将定位架吊放至四根辅助桩上，在定位架落钩前完成初调平工作，找到水平点位置后，在辅助桩上设置反拉钩与定位架连接，并在吊重情况下焊接定位架与辅助桩之间的连接件，使定位架与辅助桩快速固定成一体<sep>本发明的沉桩方法，能使钢管桩沉桩后桩顶平面位置偏差控制在50mm以内，垂直度控制在千分之五以内
19	将缆线固定到风轮机叶片的方法<sep>描述了一种将缆线(22)固定到风轮机叶片的方法。该方法涉及提供预组装的缆线组件(34)<sep>其包括缆线(22)和多个支座(40a‑40e)，这些支座(40a‑40e)沿所述缆线(22)的长度以一定间隔预附接到所述缆线(22)。所述多个支座(40a‑40e)附接到风轮机叶片的表面(20)，使得所述支座(40a‑40e)沿着所述叶片的表面(20)间隔开。当所述支座(40a‑40e)附接到所述叶片时相邻支座(40a‑40e)之间的间隔小于缆线(22)在所述相邻支座(40a‑40e)之间的长度，使得在所述相邻支座(40a‑40e)之间的缆线(22)中提供预定量的松弛<sep>还描述了用于在该方法中使用的预组装的缆线组件以及组装缆线组件的方法
19	传动带、变桨驱动装置及风力发电机组<sep>本发明涉及一种传动带、变桨驱动装置及风力发电机组<sep>传动带包括：齿部；主体部，沿自身长度方向延伸以支撑齿部，主体部包括承载层和包覆于承载层周侧的包覆层，承载层为沿主体部的宽度方向和厚度方向上分布、并沿长度方向延伸的复合结构体<sep>本发明提供的传动带，通过在主体部上设置由复合结构体构成的承载层和包覆于承载层周侧的包覆层，改善了传动带的机械性能，提高了传动带的使用寿命
19	大型风力机叶片主梁内部缺陷类型红外自动识别方法<sep>本发明涉及风力发电设备运行维护技术领域<sep>同时也适用于其他树脂基复合材料的早期缺陷类型无损检测。其精准、适用性强且能够适用于野外工作环境<sep>包括以下步骤：s1获取环境温度、主梁样件厚度、热源距样件距离、样件表面风速以及含缺陷样件各缺陷部位热扩散系数的数据样本，建立这些参数与不同类型缺陷热扩散系数之间的非线性耦合关系，同时计算神经网络模型参数；s2持续照射风力机叶片表面；s3采集和提取叶片有缺陷区域和无缺陷区域的表面温差曲线；s4‑s5记录当前照射位置叶片主梁厚度；测量当前环境温度；测量叶片表面平均风速；s6按照bp神经网络计算方法，计算热扩散系数；s7利用热扩散系数相对误差率计算公式,从而完成缺陷类型识别
19	变阻值撬棒保护电路的变阻值撬棒阻值整定方法<sep>本发明公开了一种变阻值撬棒保护电路的变阻值撬棒阻值整定方法<sep>该发明通过在双馈风电系统中设置变阻撬棒保护单元不仅能有效缩短故障持续期间撬棒工作时间，减少带撬棒运行双馈感应发电机吸收的无功功率，支撑定子电压，同时也能最大限度降低故障切除时的双馈感应发电机无功振荡峰值，加速电网电压恢复，有助于提升风电场周边区域电网电压稳定性<sep>并且，变阻撬棒保护单元还能够根据不同电网电压跌落水平和故障不同时期自适应调整撬棒动态变阻值以向故障电网提供有效的无功支撑，灵活性更高，适应性更强。
