label_id	text
19	变形式风力发电机叶片<sep>变形式风力发电机叶片<sep>由叶片骨架(1)、连接横梁(2)、微型电动推杆(3)、活动横梁(4)、叶片内铺层(5)、叶片外弹性蒙皮(6)和独立尾缘(7)组成，叶片骨架(1)截面处通过连接横梁(2)径向固定，叶片骨架(1)截面内设有导槽(8)，导槽(8)内、以及叶片骨架(1)尾缘处分别固定设置微型电动推杆(3)，叶片活动横梁(4)两端伸进导槽(8)中，叶片骨架(1)外部设置叶片内铺层(5)，叶片骨架(1)尾缘设置独立尾缘(7)，叶片内铺层(5)外部设置有叶片外弹性蒙皮(6)<sep>本发明有益效果：根据不同风速进行变形，调节叶片的气动性能，控制风力机功率输出，可取代传统风力机的变桨距控制系统
19	一种风电机组传动链复合故障特征分离与辨识方法<sep>一种风电传动链复合故障特征分离与辨识方法<sep>步骤如下：使用加速度传感器获得振动信号；利用多小波包变换，将采集的振动信号全频率范围内分解；以排列熵作为评价指标，选择符合要求的单支信号分别进行重构，完成信号的降噪及复合故障分离<sep>采用能量算子解调方法对重构信号处理，完成故障信息的识别。
19	风力发电机组扭缆保护装置<sep>本发明公开了一种风力发电机组扭缆保护装置<sep>该装置用于保护风力发电机组的塔筒内部的扭缆，包括：电缆支架、第一电缆夹和第二电缆夹；电缆支架安装在塔筒下部，用于搭载扭缆并使扭缆顺沿塔筒内壁向下穿出塔筒；第一电缆夹为一个，第一电缆夹安装在塔筒下部的塔筒平台板上，第一电缆夹用于夹持扭缆并带动扭缆沿塔筒轴向上下运动；第二电缆夹为若干个，若干个第二电缆夹间隔安装在第一电缆夹与塔筒顶端间的若干个塔筒平台板上，第二电缆夹用于夹持扭缆并带动扭缆沿塔筒轴向旋转及上下运动<sep>本发明的风力发电机组扭缆保护装置能够保证塔筒内部的扭缆在机舱偏航过程中的扭转均匀性，避免由于各段扭缆旋转不均匀而导致扭缆过早损坏的问题
19	一种风电机组偏航控制方法、装置、设备及存储介质<sep>本申请公开了一种风电机组偏航控制方法、装置、设备及计算机可读存储介质<sep>方法包括：根据设定的第二对风偏差角度得到偏航停止角度，利用设定的第一对风偏差角度及第二对风偏差角度在满足约束条件情况下得到偏航启动角度；判断风电机组是否并网且当前风速是否大于等于切入风速，若并网且大于等于切入风速，则实时获取对风偏差角度并判断对风偏差角度是否大于偏航启动角度；若大于偏航启动角度，则控制偏航系统启动偏航，并实时获取启动后对风偏差角度，判断启动后对风偏差角度是否小于等于偏航停止角度，若小于等于偏航停止角度，则控制偏航系统停止偏航<sep>本申请公开的上述技术方案，可以减少风电机组的无效偏航次数，提高风电机组偏航的经济性
19	一种调峰供电控制方法与装置<sep>本发明提供了一种调峰供电控制方法与装置<sep>涉及供电技术领域。通过获取当前时间，然后依据当前时间与预设定的供电时段对应关系确定供电时段，其中，供电时段包括第一时段、第二时段以及第三时段，最后普依据供电时段控制发电装置与储能装置进行供电<sep>本发明提供的调峰供电控制方法与装置具有供电更加稳定的效果
19	用于风机叶片故障监测的数据采集器及状态监测系统<sep>本实用新型公开了一种用于风力发电机叶片故障监测的数据采集器<sep>包括：壳体、采集模块、cpu模块、电源调理模块和防雷模块；采集模块实时获取传感器采集的风机叶片状态数据，并传送给cpu模块；cpu模块对采集模块传送的风机叶片状态数据进行处理，并从风机主控制器获取风机状态数据，将风机状态数据及处理后的风机叶片状态数据上传给服务器；电源调理模块为采集模块和cpu模块供电；防雷模块提供防雷保护。本实用新型还公开一种风机叶片状态监测系统<sep>本实用新型可以提高数据采集的可靠性及在风场恶劣环境中的适应性
19	一种并网风电场的mtdc系统拓扑结构的评价方法<sep>一种并网风电场的mtdc系统拓扑结构的评价方法<sep>它属于多端柔性直流输电领域。本发明解决了解决目前缺少针对各种拓扑结构的优缺点及运行特点的可行、综合、全面的拓扑结构评价体系的问题。本发明以拓扑结构的稳定性、经济性、灵活性为评价准则，以各评价准则的影响因素作为准则的评价指标，运用层次分析法建立用于风电场并网的mtdc系统拓扑结构的多指标评价体系，通过确定各评价指标的权重以及各评价准则的权重，从多方面、多维度、多层次对拓扑结构进行评价，评价综合性更高，所得到的评价结果可信度更高，这具有一定的工程实际意义<sep>本发明可以应用于多端柔性直流输电领域用
19	一种风电塔筒扭缆用电缆限位装置<sep>本发明公开了一种风电塔筒扭缆用电缆限位装置<sep>涉及风力发电机零部件技术领域；包括固接在塔筒内壁的支架机构、固接在支架机构上的支撑板，所述支撑板上设有限位孔，所述限位孔内周面设有橡胶圈，所述支架机构两端均设有调节板，所述调节板一端固接在塔筒内壁上，所述支架机构抵靠在调节板上侧，所述调节板上设有调节长孔，所述支架机构在调节长孔对应位置均穿设有固定螺栓，所述固定螺栓穿过对应调节长孔并与调节板固接，所述调节板下侧固接有连接板，所述调节板与连接板构成一个横截面为l形结构的角钢，所述调节板两端均固接有加强筋，所述连接板上固接有焊接板，所述焊接板固接在塔筒内壁<sep>本发明通用性好
19	风电变流器低电压穿越控制方法、装置、设备及存储介质<sep>本发明实施例公开了一种风电变流器低电压穿越控制方法、装置、设备及存储介质<sep>该方法包括：实时监测风电场并网点电压；确定并网点电压的正序分量和负序分量；根据正序分量，控制风电变流器进入低电压穿越模式；根据正序分量和负序分量，确定风电变流器在低电压穿越期间向并网点提供的对称无功电流的数值；在执行低电压穿越模式下，按照所确定的对称无功电流的数值控制风电变流器提供无功电流<sep>本发明实施例的低电压穿越控制方法、装置、设备及存储介质，能够在并网电电压跌落为对称或不对称情况下，都向电网注入对称的三相电流，可以有效避免风电变流器在不对称无功控制策略和对称无功控制策略频繁切换，利于电网电压恢复
19	一种基于bls的风电机组智能恒功率控制方法<sep>本发明公开了一种基于bls的风电机组智能恒功率控制方法。获取机组某段时间内的有效风速信息和对应时间段的与有效风速相关的机组输出数据<sep>去除获取到的机组输出数据中的相关性并进行归一化操作，构造bls的训练集，使用该训练集确定bls的结构和参数，得到风速估计模型，该模型在线给出有效风速值，进而将机组动态分解为非线性部分和不确定部分，使用风速估计值对非线性部分设计非线性补偿器，最终给出恒功率控制器的表达式<sep>该方法设计过程简单，能够一定程度上减小了桨距系统的机械载荷，实施成本低，需要调试的参数少，相比于目前工业上采用的恒功率控制器，能够提高发电功率调节效果，改善机组发电质量
19	离心自平衡聚力式高效风能动力装置<sep>本发明为一种离心自平衡聚力式高效风能动力装置<sep>它有风叶片、动力杠杆和支点座，动力杠杆以与支点座切线平行但不过支点座圆心的方式安装在支点座上，每一根动力杠杆上有一块风叶片，各动力杠杆均匀分布在支点座上，风叶片的外端安装固定在连接座上，连接座通过轴销安装在动力杠杆上，动力杠杆与连接座之间有弹簧或弹片将风叶片的内端抵紧到动力杠杆上，连接座上有配重块，配重块重心不在动力杠杆的中心线延长线上。支点座为一圆盘，圆盘的上侧有安装动力杠杆的杠杆槽，下侧开有轴向的工作机连接孔，中央部位有中心孔安装锥形盖以加固动力杠杆<sep>本发明通过改变风叶片对支点座的力臂距离，使得力矩最大化，风能转换效率最大化
19	使用实时叶片模型的风力涡轮机的控制<sep>一种风力涡轮机控制系统<sep>包括风力涡轮机的控制机构的控制器，其中所述控制器实施计算机化的实时叶片模型以计算该控制器的操作参数，并且其中所述计算机化的实时叶片模型接收确定的风力涡轮机操作点和实时估算的转子平面风速值作为输入。另一方面，本发明的各实施方式提供了一种控制风力涡轮机的控制机构的方法<sep>有利地，本发明提供了一种更灵活和响应更快的控制系统，即使那些风况超出通常预测的范围，该控制系统也能够适应变化的风况
19	一种风叶平移式风机用承压带<sep>一种风叶平移式风机用承压带的工作原理<sep>承压皮带安装在串列的风机叶片下方，叶片轴的下端落在承压皮带上，把重量传递给承压皮带，再由承压皮带传递给承压轮，承压轮由中心轴安装在立面主体上；立面主体与立体框架焊接<sep>本发明与深水海浪发电装置的风叶平移式风机联合使用，承压皮带用于承受风叶平移式风机的叶片重量，承压皮带跟随叶片轴同步运行，使叶片在一个水平高度横向运行；两个相邻承压轮之间的距离小，承压皮带比较厚，所以在两个承压轮之间的承压皮带上产生的凹陷很微小，解决了串列的风机叶片下坠的问题，推广应用具有良好的经济和社会效益
19	一种风电发电设备<sep>本发明公开了一种风电发电设备<sep>包括浮动机身，所述浮动机身内左右对称的设置有发电机构，所述发电机构包括发电扇叶以及发电机组，所述浮动机身内转动设置有上下延伸的发电轴，所述发电轴顶部末端延伸至所述浮动机身外部，且所述发电扇叶固定设置于所述发电轴顶部末端<sep>该设备在整体结构上更加合理和巧妙，安装、维护以及检修均十分方便，并且该设备可根据风力大小进行动态调节自身高度，保证风力发电机组可维持在有效发电风力范围内，且该设备可在液压助力系统助力下进行转向，保证风力发电机组始终与风力方向垂直，保持发电效率，且该设备在使用过程中具有高效的自动化程度，具有较高的使用和推广价值。
19	基于改变局部浮力的海上风力机浮式平台自平衡装置<sep>本发明涉及一种基于改变局部浮力的海上风力机浮式平台自平衡装置<sep>包括浮体、平台和滚轮控制装置，浮体设置有四个，由两个滚轮控制装置控制，滚轮控制装置分别放置在平台支撑面上下中心位置；滚轮控制装置外部由滚轮控制装置外壳包围，滚轮控制装置外壳主要起支撑风力发电机和密封防水作用。本发明在漂浮式平台的基础上，设计了一种可根据平台倾斜位置，自动对其进行平衡的平衡装置，其结构紧凑且能够实时调节平台的局部浮力，达到了使平台实现自平衡的目的<sep>本发明通过改变浮体体积的方法，改变浮体局部的浮力，进而通过浮力的变化，对平台进行平衡
19	一种多机型风电机组混装风电场功率控制方法<sep>本发明提供了一种多机型风电机组混装风电场功率控制方法<sep>包括如下步骤：s1、获取风电场整场运行参数和各机型风电机组运行参数；s2、根据获取的风电场整场运行参数和各机型风电机组运行参数，设置各机型风电机组的调节参数；s3、根据风电机组运行参数，排列各机型风电机组调节优先级；s4、判断风电场实时有功与预设的有功功率目标值之间差值是否小于误差合理范围值；s5、根据风电机组的调节优先级排序和设置的各机型风电机组的调节参数，调节各机型风电机组的有功功率，最后返回步骤s1<sep>本发明的控制方法，能够协调控制风电场中混装的多种机型的风电机组，使风电场整场输出功率满足风电场并网要求
19	一种具有柔性伸缩风叶的风力发电装置<sep>本发明公开了一种具有柔性伸缩风叶的风力发电装置<sep>属于风力发电技术领域，包括收纳底座，收纳底座的底端设置有限位框架，限位框架的一端设置有支撑杆，支撑杆与限位框架的连接处设置有限位螺栓，支撑杆的顶端设置有风力发电机，所述风力发电机的一侧设置有限位圆盘，风力发电机的一端设置有与限位圆盘相对应的传动轴，传动轴的一端设置有与限位圆盘相对应的固定件，限位圆盘的底端设置有叶片，收纳底座的下方设置有减震机构<sep>本发明结构简单，使用方便，具有良好的减震功能，防止风力发电装置在使用时由于颠簸而发生损坏，使风力发电装置的功能更加丰富，提升用户对风力发电装置的使用体验。
19	一种基于外送通道确定风电最佳调峰装机规模的方法<sep>本发明提供一种基于外送通道确定风电最佳调峰装机规模的方法<sep>包括以下步骤：根据给定的一条特高压输电线路，评估输电线路、风电场、火电厂、抽水蓄能电站的建设与运行成本；给出初始状态下四种设施的装机（最大功率）比例关系，对负荷曲线进行供电，以终端单位用电成本最低为目标建立优化模型；改变四者的比例关系，得到不同比例关系下的优化结果，在所有优化结果中选择终端度电成本最低的结果，根据其对应的配比方案得出风电场、火电厂和抽水蓄能电站装机规模，即为风电最佳调峰装机方案<sep>本发明通过建立优化模型确定风火储送的最佳比例，在保证风力得到较好利用的前提下使终端用电成本最低，可以大幅降低弃风率和风电终端价格
19	确定风力涡轮的偏航方向<sep>本发明涉及确定风力涡轮的偏航方向<sep>提出了一种用于确定风力涡轮(210)的偏航方向(214)的方法，包括以下步骤：在风力涡轮(210)的构件(216)处接收从源(232)传播的信号(233)；基于所接收的信号(233)确定从构件(216)朝源(232)的方向(253)；确定相对于朝源(232)的确定方向(253)来说的风力涡轮(210)的偏航方向(214)<sep>此外，提出了用于执行所述方法的风力涡轮和装置及计算机程序产品和计算机可读介质
19	一种节省空间的可升降式风力发电机<sep>本发明公开了一种节省空间的可升降式风力发电机<sep>包括底座，所述底座中设有液压腔，所述液压腔左右侧底壁与同侧上臂之间连通有传输腔，所述传输腔中滑动连接有分隔板，所述分隔板上侧固设有在所述液压腔顶壁与所述底座顶面之间滑动连接的承重轴,在所述顶部块下降到最底点时可以下压所述环形板，接着所述环形桶中的润滑油则会在压力的作用下进入所述软管中<sep>接着通过所述单向阀将润滑油喷向所述传动腔中来保障所述传动腔中锥齿轮传动的润滑性,本发明保证在极端天气和风速过大时降低本发明的受力面积
19	一种双叶轮水平轴风力机设计优化方法<sep>本发明提供一种双叶轮水平轴风力机设计优化方法<sep>包括以下步骤：建立drwt设计优化模型；对drwt设计优化模型进行求解；通过耦合al理论与cfd对drwt设计优化模型求解过程中drwt的气动性能进行预测<sep>本发明针对drwt的模型设计，以drwt桨距角组合、两级叶轮间距、两级叶轮尺寸、两级叶轮转速为设计变量，以drwt输出功率最大为优化设计目标，以塔架所受载荷等为约束，提出采用al理论和cfd相耦合的数值模拟方法对两级叶轮间的详细流场进行求解，方便设计变量的寻优，并对双叶轮风力机气动性能进行预测评估，大幅度提高了drwt气动性能预测的精度和速度，从而提高了drwt的设计效率，为drwt的工程设计和drwt的工程应用奠定了基础
19	用于增加风力涡轮机功率输出的系统和方法<sep>公开用于增加风电场中的风力涡轮机的功率输出的系统和方法。特别地<sep>风电场能够包含第一和第二双馈感应发电机风力涡轮机系统。第一风力涡轮机系统的旋转的转子速度能够在降低的风速下至少部分基于指示转子电压的数据来调节以增加双馈感应发电机的功率输出。转子速度能够被调节，使得转子电压不超过电压阈值。第一风力涡轮机系统的功率输出能够通过降低第一风力涡轮机系统的无功功率输出来进一步增加<sep>第一风力涡轮机系统的降低的无功功率输出能够通过第二风力涡轮机系统的增加的无功功率输出来补偿
19	塔架振动阻尼器<sep>本发明涉及一种塔架阻尼器<sep>其适于安装在风轮机塔架中，所述塔架阻尼器包括：摆结构，其适于悬挂在所述风轮机塔架中，所述摆结构包括摆体；腔室，其保持阻尼液体，所述摆结构至少部分地浸入所述阻尼液体中；多个阻尼元件，其布置成当所述摆结构悬挂在所述风轮机塔架中时抑制所述摆结构的移动<sep>以及悬挂装置，其用于将所述摆结构悬挂在所述风轮机塔架中，使得所述摆结构能够从所述摆结构的中立位置移位。
19	一种风电试验平台变流器控制系统<sep>本实用新型公开了一种风电试验平台变流器控制系统<sep>包括处理器、第一信号调理电路、第二信号调理电路、交流电压电流采样电路、第一dsp控制器、第二dsp控制器、第三信号调理电路、第一电平转换隔离输出电路、转子侧ipm驱动及保护电路、第二电平转换隔离输出电路、网侧ipm驱动及保护电路、用于检测电网电压、定子电流、转子电流及转子转速的第一检测系统、用于检测网侧pwm变流器交流侧电压及电流的第二检测系统、用于检测直流母线电压的交流电压电流采样电路
19	一种风力发电机组转叶连接结构<sep>本实用新型公开了一种风力发电机组转叶连接结构<sep>该结构包括轮毂罩、转杆、风力发电机主壳体和风力发电机转叶；其中，轮毂罩连接在转杆上，同时，转杆的另一端伸进风力发电机主壳体内与对应于的齿轮箱和发电机连接；风力发电机转叶的端部与轮毂罩连接固定；其中，所述风力发电机转叶具有迎风面和与迎风面具有一定倾斜的折弯面<sep>本专利相对于现有风力发电机组转叶结构来讲，具有如下改进；其一，风力发电机转叶具有迎风面和与迎风面具有一定倾斜的折弯面，迎风面能够迎接正面的风力，倾斜的折弯面能够较好的吸收侧面（或侧向）的风力，将周围风能最大化利用；其二，简化的转叶的连接处结构，能够降低摩擦，快速将风能转化为电能
19	一种新型风力发电装置<sep>本发明公开了一种新型风力发电装置<sep>其结构包括垂直旋转扇叶、连接板、底座、发电主体，垂直旋转扇叶表面与连接板一端相焊接，连接板一端与发电主体外表面相焊接，发电主体通过嵌入方式安装在底座上并且相焊接，通过左翼第一皮带的传动作用带动了左翼转盘转动，从而使左翼二号齿轮旋转，左翼二号齿轮通过左翼第二皮带的传动使得左翼三号齿轮旋转，带动左翼传动大齿轮转动，右翼传动大齿轮转动和左翼传动大齿轮转动同时传动了齿板往上升起，带动垂直旋转扇叶、连接板升起，遇到风力等级较高的时候，通过启动电动机反转，将齿板收下<sep>使得垂直旋转扇叶和连接板得到保护
19	一种风电机组载荷在线预测方法、装置、设备、介质<sep>本申请公开了一种风电机组载荷在线预测方法、装置、设备、介质<sep>该方法包括：获取目标风电机组的第一机组运行数据和目标位置载荷数据；利用所述第一机组运行数据和所述目标位置载荷数据构造载荷预测模型，并确定所述载荷预测模型的模型参数，以得到目标载荷预测模型；当获取到未确定载荷的第二机组运行数据时，利用所述目标载荷预测模型，确定所述第二机组运行数据对应的载荷<sep>可见，本申请先利用获取到的目标位置载荷数据和相应的第一机组运行数据，以得到目标载荷预测模型，利用所得到模型确定其他风电机组相应位置的实时载荷数据，实现风电机组的载荷数据的虚拟镜像，以减低风电机组的成本，实现风电机组平价化
19	基于虚拟质量块的风力机双质块轴系稳定控制方法<sep>本发明公开了一种基于虚拟质量块的风力机双质块轴系稳定控制方法<sep>包括以下步骤：监测风力发电机的角速度；判断风电机组的轴系部分是否出现扰动；根据风力机风轮运行角速度的大小判断风电机组是否处于最大功率运行区域，对应设置风力机的桨距角：判断风力发电机的角速度是否进入允许波动范围<sep>本发明提供的基于虚拟质量块的风力机双质块轴系稳定控制方法，通过调节风力发电机的桨距角改变其输出的机械功率，能够减小两质块模型风电机组在动态过程中形成的不平衡功率，提高风电机组轴系柔性连接部件的耐受干扰能力，保证风电机组在系统扰动及大幅度功率调节过程中的轴系振荡稳定
19	一种基于潮汐风的追踪发电设备<sep>本发明公开了一种基于潮汐风的追踪发电设备<sep>包括底座，所述底座右上侧设有风力发电机构，所述风力发电机构包括嵌设于所述底座上端面的步进电机，所述步进电机控制有步进电机轴，所述步进电机轴上端固定有支座，所述支座内转动设有发电扇叶轴，所述发电扇叶轴水平贯穿所述支座，所述支座内设有发电机，本发明可通过传感器检测的形式来实现潮汐风的追踪发电，对于风能利用和恶劣环境的适应效果较为显著，发明内设有风力发电部分，可进行风力发电，风力检测机构，可进行风力风速的检测，风向检测机构，可进行风向的检测<sep>检测完成后根据风力发电的情况转动风力发电部分的角度
19	基于斜线平滑功率控制的风机变桨优化方法<sep>本发明公开了一种基于斜线平滑功率控制的风机变桨优化方法<sep>针对风机在高风速风况下频繁变桨的问题，该方法在基于斜线平滑功率控制减小风机输出功率波动的基础上，充分利用任意桨距角下的大转动惯量风轮动能缓冲/释放作用，实现风机在任意桨距角下的转速区间控制；变速调节与变桨调节配合使用，变速调节光滑由小幅值、高频率风速波动导致的风电功率波动，变桨调节应对大幅值、低频率的风速变化<sep>本发明在不扩大功率波动对电网频率影响的同时，有效降低变桨动作的幅度和频率，减小变桨伺服机构的疲劳程度和叶片载荷，延长风机寿命
19	一种双馈风电机组主动耗能运行的控制方法<sep>本发明公开了一种双馈风电机组主动耗能运行的控制方法<sep>获取双馈风电机组参数和故障前运行参数，当交流电网发生故障产生有功功率盈余时，对双馈风电机组进行调整控制，将亚同步运行的双馈风电机组从发电状态切换至电动状态，消纳交流电网盈余的有功功率，实现交流电网有功功率的平衡。该方法可在交流电网出现有功盈余时将双馈风电机组从发电状态迅速切换为电动状态，从而实现电网盈余有功的快速平衡<sep>本发明的控制响应快，吸收功率平稳，易于实现，代价小，可有效减小火电切机量，有利于提高系统功角稳定性和频率稳定性
