label_id	text
7	水泥生产和储存中电石渣的安全环保处理系统及处理技术<sep>本发明公开了一种水泥生产储存电石渣安全环保处理系统及其处理工艺<sep>采用置换法解决电石渣储存仓内乙炔气积聚问题，利用高温水泥生产产生的窑尾气对从电石渣储仓中置换出来的含有电石渣粉尘的气体进行加热，使干燥的高温电石渣粉尘气体通过布袋除尘器过滤。电石渣返回系统回用，环保达标气体直接排放，有效解决了电石渣储存库因乙炔气堆积而易爆的问题。同时也解决了除尘系统中管道、阀门、除尘器的堵塞问题<sep>本发明具有占地少、投资少、高效、安全、节能、环保、经济运行等优点
7	一种污泥脱水装置<sep>本实用新型公开了一种污泥脱水装置<sep>涉及污泥脱水装置技术领域。该实用新型包括机体，机体内部固定有加热丝，机体内部固定有第一转轴，第一转轴内圈固定有第一螺纹杆，第一螺纹杆外侧螺纹连接有螺纹管，螺纹管一侧固定有夹板，夹板内圈固定有第一伸缩杆，第一伸缩杆一端固定有定位钩，夹板内部固定有第二伸缩杆，第二伸缩杆一侧固定有定位槽，定位槽一侧开有滑槽，滑槽内部滑动连接有滑块<sep>本实用新型通过过滤网的作用，该装置利用过滤网和加热丝，使污泥可以更高效率的进行脱水，且该装置便于从机体内部拆除，将过滤网拆除后，更将其内部的污泥取出，也更便于后续对过滤网的清洁，防止出现污泥堵塞过滤网网孔的情况
7	一种用于烟雾净化器的滤芯<sep>本实用新型涉及空气净化技术领域<sep>具体涉及一种用于烟雾净化器的滤芯；所采用的技术方案是：一种用于烟雾净化器的滤芯，包括n层过滤层，所述过滤层为中通的圆柱形，所述n为大于2的偶数，所述n层过滤层形成n/2个过滤单元，所述过滤单元由两层相邻的过滤层固定连接而成。本实用新型通过将每两层相邻的过滤层固定连接，以将生产时过滤层占用的空间减半，减少生产时过滤层占用的仓储空间，降低过滤层的生产成本<sep>同时在装配滤芯时，能够减少过滤层套设或插设的次数，提高滤芯的装配效率
7	内燃发动机系统和用于这种系统的排气处理单元<sep>本发明提供了一种内燃发动机系统<sep>其包括：–被布置成压缩空气的压缩机(3)；–至少一个燃烧室(4)，所述至少一个燃烧室(4)中的至少一个被布置成接收压缩空气<sep>和–排气处理装置(8)，该排气处理装置被布置成处理由所述至少一个燃烧室(4)中的至少一个产生的排气，–其特征在于，所述系统包括热交换器(6)，该热交换器(6)被布置成在来自压缩机(3)的压缩空气到达所述至少一个燃烧室(4)中的至少一个之前接收所述压缩空气，且所述热交换器(6)被布置成将热量从所述压缩空气传递到排气处理装置(8)。
7	高效修复湿地土壤中重金属离子的方法<sep>本发明提供高效修复湿地土壤中重金属离子的方法<sep>包括如下步骤：1）微生物的培育：所述微生物的培育经由如下过程：取样、培养基中培养、目的菌种的分离和筛选；2）输水管道的设置；3）吸附剂的填埋：将吸附剂按照香菜提取物：改性凹凸棒土：木质素磺酸盐的质量比为2:5:1的比例混合均匀，放置入吸附剂容纳腔内，随喷淋管埋入土壤内；4）喷淋<sep>所述高效修复湿地土壤中重金属离子的方法操作简便，原材料易得，将培育的微生物释放到土壤中，对金属离子进行微生物修复，同时吸附剂对土壤中的金属离子进行吸附富集，提高对金属离子的处理效果，且吸附剂绿色环保，对金属离子的吸附能力强
7	基于液货港区vocs浓度自动监测预警系统的监测预警方法<sep>本发明公开了一种液货港区vocs浓度自动监测预警系统<sep>包括单片机、若干个vocs监测装置、无线通信模块、服务器、显示器、第一存储器、第二存储器和预警装置；所述单片机分别与通信模块、显示器、第一存储器和预警装置电连接，所述检测主机通过无线通信模块与单片机连接；服务器通过有线网络或无线网络与单片机连接，服务器与第二存储器电连接<sep>本发明实现了液货港区的vocs浓度的自动监测预警，可操作性高；将用户终端分别与单片机和服务器连接，提高了预警系统的时效性；对气体检测传感器探头进行清洁，提高了气体检测传感器探头的灵敏度，监测更加准确
7	一种用于微藻养殖的猪场污水的臭氧处理方法<sep>本发明涉及一种用于微藻养殖的猪场污水臭氧处理方法<sep>所述方法包括以下步骤：步骤s1，一级臭氧处理器中臭氧脱色、灭菌处理：步骤s2，二级臭氧曝气处理器中利用回收臭氧进行二次处理：步骤s3，三级空气曝气处理器中吹脱臭氧。其优点表现在<sep>本发明的一种用于微藻养殖的猪场污水臭氧处理方法，具有臭氧利用率高，污水处理效果好，无臭氧残留且处理后污水透明度提升明显，可直接用于微藻养殖的特点
7	一种制备改性sds纳米零价铁的工艺<sep>本发明属于污染环境中重金属污染修复领域<sep>公开了一种制备改性sds纳米零价铁的工艺，其特征在于，所述工艺包括如下步骤：步骤1)制备复合菌液，步骤2)制备sds纳米零价铁，步骤3)制备改性纳米零价铁<sep>本发明工艺操作方便，成本低廉
7	一种高炉出铁口除尘顶吸稳流器以及除尘装置<sep>本实用新型涉及一种高炉出铁口除尘顶吸稳流器以及除尘装置<sep>顶吸稳流器安装在顶吸管道位于除尘室内的一端上；包括顶吸筒，所述顶吸筒内形成有沿其轴向布置且与所述顶吸管道连通的进风通道，所述顶吸筒上部侧壁上设有上吸风口，底部形成有下吸风口，所述上吸风口与所述进风通道或所述顶吸管道连通，所述下吸风口与所述进风通道连通<sep>本实用新型的顶吸稳流器将吸风口分为上下两个部分，相当于将吸风口移至除尘室内且分为上下两个吸风口，下吸风口直接吸取出铁口烟尘，上吸风口吸取除尘室内温度较高的气体以及下吸风口未完全捕集而逸出的灰尘，总吸风量与实际吸风量相同，能够有效避免除尘室内气流紊乱和烟气弥漫，使除尘室内烟尘气流稳定流动
7	一种市政污水预处理铁箱箱体焊接装置<sep>本实用新型涉及污水处理箱制造设备技术领域<sep>涉及一种市政污水预处理铁箱箱体焊接装置。该焊接装置包括焊枪和防护机构；焊枪具有条形手柄和与手柄连接的喷嘴，防护机构设置于手柄；防护机构包括耐高温防护织物和折叠机构；折叠机构包括多组收放组件和套件；耐高温防护织物覆盖于折叠机构；套件包括套筒和可用于将套筒锁定于手柄的锁定组件<sep>该市政污水预处理铁箱箱体焊接装置能够在进行焊接时对操作人员的手进行保护，防止焊接喷溅的高温铁屑溅到手上导致受伤，能够省去专门佩戴手套的麻烦
7	一种旋转阀及蓄热式热力焚化炉<sep>本发明公开了一种旋转阀及蓄热式热力焚化炉<sep>旋转阀包括：配气室，包括气室本体、进气口、出气口和吹气口；气室本体被分割成3个相互独立的腔，分别为进气腔、出气腔和吹气腔，进气口连接进气腔，出气口连接出气腔，吹气口连接吹气腔；旋转板，包括第一通孔、第二通孔和第三通孔；驱动装置，驱动装置连接旋转板；旋转板置于配气室上，配气室可通过第一通孔、第二通孔和第三通孔与外接的蓄热组件进行气体交换，驱动装置驱动所旋转板在配气室上转动，废气从进气口流入经燃烧后从出气口流出，吹气口用于将配气室内的气体吹出；蓄热式热力焚化炉包括燃烧室、蓄热组件和本发明提供的旋转阀<sep>本发明提供了一种密闭性好的旋转阀及蓄热式热力焚化炉。
7	一种用于苯系物的气体检测装置及其操作方法<sep>本发明提供了一种用于苯系物的气体检测装置<sep>包括箱体，箱体设置有气体进样单元，所述箱体的内部设置有气体分离单元、检测单元、数据采集及处理单元、控制单元以及载气单元；所述气体分离单元设置在一个独立的分离箱中。所述气体分离单元包括一个设置在所述分离箱内部的十通阀。另外，本发明还提供了上述用于苯系物的气体检测装置的操作方法<sep>本发明的气体检测装置采用的特定组合的色谱柱，配合本发明的具有特殊结构和连接关系的十通阀，特别适用于大气中苯系物的检测，其可以在不停机的情况下持续的检测和清洗，可以在较短时间内进行重复检测，避免了外界状态变化带来的系统误差，检测结果更可靠，精度也更高
7	一种可控温的微型连续流动管反应器<sep>本发明涉及一种可控温的微型连续流动管反应器<sep>包括反应管，套设在反应管外的反应管套筒，设置在反应管一端的漏斗，连接在漏斗侧的温度控制装置<sep>与现有技术相比，本发明造价低，流动管的自身长度仅为50mm，反应气体能与团簇离子充分碰撞反应，增强离子电流以及离子信号强度，能实现对流动管反应器的有效控温，对团簇反应性的研究简单有效，可与质谱联用检测大气污染或者用于痕量气体分析等领域
7	蓄热室催化燃烧的废气处理装置<sep>本实用新型涉及蓄热室催化燃烧的废气处理装置<sep>包括一倒凹字形的装置本体，所述装置本体的内部设有一燃烧室、一第一催化燃烧单元与一第二催化燃烧单元，所述燃烧室设置在所述装置本体的顶端处，所述燃烧室的底端处设有所述第一催化燃烧单元与所述第二催化燃烧单元，一部分废气从所述第一催化燃烧单元进入，经过催化燃烧后从所述第一催化燃烧单元排出，另一部分废气从所述第二催化燃烧单元进入，经过催化燃烧后从所述第二催化燃烧单元排出<sep>该蓄热室催化燃烧的废气处理装置具有无焰燃烧、升温快与耗能低等优点
7	一种污水井监测装置<sep>本实用新型公开了一种污水井监测装置<sep>涉及环境监测技术领域，其技术方案要点包括污水井体、污水井盖以及固定在所述污水井体内的多个传感器，所述污水井体的侧壁上沿竖直方向设置有固定支柱，所述固定支柱沿竖直方向插接有插接柱，所述插接柱的一侧从所述固定支柱内穿出并与多个所述传感器连接固定，所述固定支柱设置有与所述插接柱匹配固定的固定件，所述插接柱的顶端设置有驱动所述固定件与所述插接柱分离的分离件<sep>本实用新型在需要对传感器进行维修维护时，通过分离件令固定件与插接柱分离即可实现从固定支柱内向上取出插接柱以及固定在插接柱上的多个传感器的目的，从而实现显著降低污水井内传感器的维修维护难度的效果
7	一种海绵城市调蓄容积的评价方法<sep>本发明公开了一种海绵城市调蓄容积的评价方法<sep>涉及一种海绵城市低影响开发评价方法，旨在解决现有的雨水低影响开发规划方法不便于获取全面、优质的海绵城市雨水设施布局方案的问题。其技术方案要点是，经过一级分解、二级分解、三级分解和四级分解，将规划区的年径流总量控制率分解到各地块。确定各地块所对应的设计降雨和综合雨量径流系数后，即可计算出地块所需总调蓄容积<sep>根据地块所需总调蓄容积即可方便的规划海绵城市的雨水设施布局，具有能够便于获得全面、优质的海绵城市雨水设施布局方案的优点
7	磁凝装置<sep>本实用新型提供了一种磁混装置<sep>属于污水处理设备领域。磁混装置包括外筒、内筒、驱动机构、搅拌总成、进水总成、污泥回流管和出水管；内筒设于外筒内，外筒与内筒之间设有至少一紊流环。驱动机构设置在外筒上，驱动机构与穿入外筒和内筒的传动轴连接。搅拌组件设置在内筒内并与传动轴连接，搅拌组件包括至少两个自上而下排列的叶片；进水组件包括连接的进水管和配水管，配水管设置在内筒内和叶片之间。污泥回流管与内筒相连，位于搅拌组件下方，出水管与内筒底部相连<sep>本品能促进混合物形成大而密、均匀的矾花，絮凝效果好，处理周期短，提高处理效率
7	焦化企业废气/污染物节能减排方法及装置<sep>一种焦化企业废气/污染物节能减排方法及装置<sep>涉及大气污染控制技术和焦化行业技术领域。本发明通过焦炉进煤、出焦和焦炉燃烧室内化工工艺废气作为助燃空气梯度利用，减少了多环芳烃和环境恶臭气体的排放。同时，采用焦炉干法熄焦结合焦炭密闭输送技术，解决了传统工艺焦炭输送过程中无组织排放污染的问题。本发明提供一种系统深度控制方法，减少焦化企业废气量和常规/非常规污染物排放，同时经济、合理、高效地利用废气和助燃气体成分的潜热时间<sep>环境效益与企业减少产能的效益相近
7	一种适用于高氨氮分散生活污水的处理工艺<sep>本发明涉及一种适用于高氨氮分散生活污水的处理工艺,高氨氮生活污水首先经过调节池均质后<sep>流入由好氧脱碳区、缺氧反硝化区、超氧硝化区三区组成的循环生物反应区，经过多次循环处理，最后经过沉淀区处理后出水。硝化细菌和脱碳异氧菌在超氧区和好氧区分区生长，降低了相互竞争作用。不需要安装搅拌反应器，循环生物反应区所需的水力驱动由超氧硝化区强曝气产生的气提作用提供。污水经过超氧‑好氧‑缺氧多次循环，实现氨氮硝化转化和有机物去除<sep>与现有技术相比，本发明具有硝化能力强，工艺高效集约，运维简易等优点，能高效处理高氨氮分散生活污水，实现分散污水氮磷资源化利用
7	适用于烘焙车间的空气过滤器<sep>本实用新型公开了一种适用于烘焙车间的空气过滤器<sep>包括具有空腔的壳体，壳体的两端分别设有进风口和出风口。外壳内从进风口到出风口依次设置有粗滤单元、精滤单元和紫外线消毒单元。紫外线消毒单元包括导板，多个紫外灯旋转模块设置在导板之间。 UV灯旋转模块包括两个UV灯座，UV灯座通过连接柱可拆卸和连接。两个UV灯座之间还设置有多个UV灯，在UV灯座远离UV灯的一侧设置有转轴。壳体内壁上设有旋转盲孔，连接柱上设有多个叶片<sep>适用于烘焙车间的空气过滤器可以使烘焙车间真正意义上的无菌无尘，杜绝微生物对食品的污染
7	厨房柔性排杂涡流连接装置及其使用方法<sep>本发明涉及厨房污水处理设备技术领域<sep>具体涉及一种厨房柔性排杂涡流连接装置及其使用方法。本发明要解决的技术问题是厨房管道容易堵塞。为了解决上述技术问题，本发明提供了一种厨房柔性排杂涡流连接装置，包括锥头水箱，进水管插入锥头水箱两侧的开口中，圆弧角箱体固定连接在锥头进水箱的顶部，驱动装置设置在弧角箱内，涡流制造装置设置在锥头水箱内，驱动装置的底部固定连接涡流制造装置的顶部。锥头取水槽底部的出水口通过排水机构与锥头集水槽顶部的进水口相连<sep>本发明提出的螺旋片上每个圆锥片的直径不同，可以改变水流的方向，形成一个漩涡，通过叶片和排列在上面的杂物后，可以将柔软的杂物打碎向上
7	大气盐雾含量在线检测装置及方法<sep>本发明公开了一种大气盐雾含量在线检测装置及其检测方法。该装置包括采样模块和分析模块。取样模块包括吸收液储罐、试剂储罐、气泵、输送泵、取样瓶、反应瓶、取样针和比色皿<sep>气泵用于抽取大气至取样瓶。输送泵用于将吸收液从吸收液储存箱抽取至取样瓶，将溶液从取样瓶抽取至反应瓶，将试剂液从试剂储存罐抽取至反应瓶，比色输送带上设有盘，取样针可将反应瓶中的溶液全部抽出，注入输送带上的比色盘中。分析模块包括分光光度计<sep>本发明可以缩短大气盐雾含量的测量周期，提高检测精度
7	封闭公共空间防疫废气监测系统<sep>本实用新型涉及一种封闭公共空间防疫排气监测系统<sep>满足封闭公共空间防疫监测的需要。该检测系统设置在有顶有墙的公共空间内，其特征是公共空间的屋顶通过吊杆设置排风管，下侧设有多个上风口。排气管。排气管后端连接防疫监测段，防疫监测段沿排气方向依次设置粗滤板和集毒插板。病毒集插板后侧设有除菌净化过滤装置，除菌净化过滤装置后侧设有主排风扇<sep>本实用新型在封闭的公共空间的排气管末端设置防疫监测的病毒采集插板，定期更换病毒采集插板，对病毒采集插板上的病毒进行检测，从而以实时监测疫情并迅速做出反应
7	一种循环风热污泥处理设备的加热装置<sep>本发明公开了一种循环风热污泥处理装置的加热装置<sep>包括圆柱形后盖和前盖，前盖螺旋连接在后盖内，内壁上形成圆形后挡圈的后盖。前盖内壁上形成圆形前挡圈，前盖前端形成锥形导筒，前盖导向管前端形成出风管，进气孔形成在后盖的后端。后盖上固定有一进风口，进风口与进风口相连。后盖壳内插有锥形导风罩，导风罩内壁固定加热线圈，导风罩底端固定盖板，导风罩侧面具有折边，折边上开有若干通风孔。导风罩和折边套有过滤网罩，过滤网罩和导风罩的下摆夹在前罩前环和后罩后环之间<sep>本发明可以防止灰尘在加热线圈上堆积，从而保护加热线圈，减少灰尘对加热效率的影响
7	空气净化器<sep>提供了一种空气净化器<sep>其包括：空气净化模块，该空气净化模块包括第一风扇和在轴向上连接到第一风扇的第一电机；以及气流控制器，该气流控制器被配置为沿竖直方向旋转并调节从第一风扇排出的气流。风扇，气流控制器包括第二风扇和与第二风扇轴向连接的第二电机，当气流控制器时，气流控制器可从处于倾斜垂直状态的第二位置移动到处于平直状态的第一位置。处于第一位置 第一电机和第二电机轴向排列 当风量控制器处于第二位置时，第一电机和第二电机不轴向排列<sep>本发明可以提高空气净化器的吸风能力、排风能力和净化能力，便于用户识别操作信息
7	一种焦化企业废气/污染物节能减排方法及装置<sep>本发明提供了一种焦化企业废气/污染物节能减排方法及装置<sep>涉及大气污染控制技术和焦化行业的技术领域。本发明通过焦炉装煤、出焦及化产工艺废气梯度利用于焦炉燃烧室作为助燃空气，减少了多环芳烃及环境异味气体排放；同时采用焦炉净烟气干法熄焦结合焦炭密闭输送技术，解决传统工艺焦炭输送过程中无组织排放污染问题<sep>本发明提供一种系统深度控制方法，削减了焦化企业废气量和常规/非常规污染物排放，同时经济、合理、高效的利用废气潜热及助燃气体成分，起到与企业削减产能异曲同工的环境效益
7	氯化亚铁盐酸溶液废液处理一体化设备<sep>本实用新型提供一种氯化亚铁盐酸溶液废液处理一体化设备<sep>自上而下依次包括空气净化室、干燥段、旋转沸腾煅烧炉和料仓。洁净空气室下端通过连接法兰与干燥段固定，干燥段下端通过连接法兰与旋转沸腾煅烧炉固定，旋转沸腾煅烧炉底部有一个筒仓。本实用新型的氯化亚铁盐酸溶液废液处理一体化设备直接从氯化亚铁盐酸废液中回收氧化铁和氯化氢气体<sep>本实用新型得到的产品为氧化铁，其产品价值远优于氯化亚铁晶体，一体化设备还可实现全封闭生产，有利于环境，提高废液利用率产品
7	智能洒水系统<sep>本发明涉及环保降尘技术领域<sep>具体涉及一种智能喷雾系统，包括喷雾控制系统、湿度传感装置和空气质量传感装置。喷淋控制系统的信号输出端与喷淋回路电磁阀和出料电磁主阀相连，喷淋回路电磁阀的信号输出端与远传压力表信号输入端相连。远传压力表信号输出端与增压泵信号输入端相连，增压泵信号输出端与浮球液位开关信号输入端相连，浮球液位开关置于储水箱内.系统可智能启闭，无需人工参与<sep>当粉尘监测系统检测到空气中PM2.5浓度和地面湿度达到预警值时，自动启动洒水程序
7	铂电极多功能传感器<sep>本发明公开了一种铂电极多功能传感器。数据处理模块由微处理器和存储器组成<sep>通信模块为无线通信模块Zigbee。数据采集模块通过传感器检测水中的重金属离子，如温度、电导率、pH值、氧化还原电位、铅离子等。检测信号通过AMagar D转换器输入微处理器，微处理器对数据进行滤波、融合和存储。通信模块采用无线通信技术与远程控制中心进行通信，微处理器将处理后的数据通过汇聚节点转发至远程控制中心。如果水质指标不在规定范围内，则报警电路报警。远程控制中心查询异常索引并进行相应处理<sep>本发明的有益效果是该传感器检测精度高，可以实现水质检测功能
7	用于处理放射性有机废物的装置和方法<sep>处理包含有机化合物和含硫化合物和/或含卤素化合物的放射性废物。一种装置包括用于进行废物热处理的包含滤器的反应容器和热氧化器<sep>用共反应剂从废物处理减少气相硫和卤素
7	一种高除藻率复合除藻剂的制备方法<sep>本发明公开了一种高除藻率复合除藻剂的制备方法<sep>属于除藻剂制备技术领域<sep>本发明利用粉煤灰和膨胀石墨混合为载体，蔗糖为外覆炭层前驱体，壳聚糖的吸附以及铜离子的覆盖制备而成具有可见光催化活性的复合除藻剂，呈蠕虫状，具有良好的漂浮性，提高除藻剂的除藻率，接着在光的照射下，藻类能通过光合作用在其表面产生氧气，加速其死亡，藻类的叶绿素的含量下降速度不断加快，并加速其死亡，再次提高除藻剂的除藻率；利用壳聚糖和粉煤灰都具有较好的絮凝能力和吸附能力，由于壳聚糖和盐酸反应后形成带正电荷的氨基基团，当氨基基团较多，利用酸性溶液和磁铁矿粉对粉煤灰和膨胀石墨进行共同改性，进一步提高除藻剂的除藻率，具有广泛的应用前景
7	一种空气质量实时监测站<sep>本实用新型公开了一种空气质量实时监测站<sep>属于环境监测技术领域，包括监测箱体，监测箱体正面设置有太阳能板安装架，该太阳能板安装架上安装有若干太阳能板，太阳能板与太阳能板安装架滑动连接；监测箱体两侧设置有通气孔，该监测箱体顶部设置有大气颗粒物分级采样器，该监测箱体底部设置有控制箱，该监测箱体内设置有空气监测模块，控制箱内设置有充电电池、控制主机，控制主机与充电电池相连，该控制主机内设置有处理器和与处理器相连的dtu数传模块和存储模块，太阳能板与充电电池相连，大气颗粒物分级采样器分别与充电电池和控制主机相连，控制箱底部安装有滚轮<sep>本实用新型具有结构紧凑，可移动，实时监测的优点
7	一种防爆型气体探测器机壳<sep>本实用新型涉及一种防爆型气体探测器机壳<sep>包括机壳主体、端盖、底盖、透气罩、隔爆网、隔爆压片、防爆玻璃和玻璃压条；机壳主体的侧部形成有侧接口，机壳主体的下端形成有底接口；端盖与机壳主体的侧接口采用螺纹旋接，端盖的中心形成有玻璃台阶；底盖与机壳主体的底接口的内螺纹旋接，底盖的中心形成有隔爆台阶；透气罩与机壳主体的底接口的外螺纹旋接，透气罩覆盖于底盖的外部；隔爆网置于隔爆台阶，隔爆压片置于隔爆网的上部；防爆玻璃置于玻璃台阶，玻璃压条压在防爆玻璃的边缘<sep>本技术方案结构强度大，安全性高，可靠性强，不易爆裂，使用寿命长
