label_id	text
5	一种用于长链α-烯烃聚合的催化剂组合物及其催化长链α-烯烃聚合的方法<sep>本发明提供一种用于长链α‑烯烃聚合的催化剂组合物及其催化长链α‑烯烃聚合的方法，催化剂组合物包括：主催化剂、助催化剂和链转移剂；所述主催化剂为化学结构如下所示的配合物：其中，r‑r相同或不同，各自独立地选自氢、饱和或不饱和的烃基、烃氧基或卤素；x选自卤素；助催化剂选自烷基铝氧烷、芳烃基硼和硼酸盐中的至少一种；链转移剂选自三烷基铝和/或二烷基锌。催化剂组合物催化长链α‑烯烃聚合的方法包括：在惰性气体存在下，使长链α‑烯烃、主催化剂、助催化剂和链转移剂接触进行聚合反应。该催化剂组合物催化α‑烯烃链转移聚合时，具有较高催化活性和良好的热稳定性，用于合成分子量可控的聚α‑烯烃。
5	用于3d打印的含聚氨酯改性粉末橡胶的聚乙烯混合物的制备方法<sep>本发明公开了一种用于3d打印的含聚氨酯改性粉末橡胶的聚乙烯混合物的制备方法，包括以下步骤：将氟化石墨烯、聚氨酯加入到全氟烷烃中，得聚氨酯溶液；将丁腈胶乳、软水、聚氨酯溶液、防老剂、破乳剂、隔离剂、凝聚剂均匀混合后升温至60～90℃搅拌，然后经洗涤、脱水、干燥，得到丁腈橡胶；将丁腈橡胶、聚乙烯、硅烷偶联剂、酚醛树脂、蒙脱土均匀混合，于150～200℃下在双螺杆挤出机中进行造粒，制得3d打印用粉末混合物料。该混合物料具有优良的拉伸屈服应力、拉伸断裂应力等性能。
5	用于制备具有一个或多个末端官能化的分支的聚烯烃的方法<sep>本发明涉及经由烯烃单体和包含主族金属烃基链转移剂共聚制备具有末端官能化的分支的聚烯烃的方法。本发明另外涉及通过所述方法获得的具有末端官能化的分支的支化的聚烯烃。
5	一种高固体金属涂料及其制备方法与应用<sep>本发明涉及一种高固体金属涂料。它是由高固体聚酯树脂，珠光粉，完全甲醚化氨基树脂，透明红颜料，助剂，高固醋酸丁酸纤维素，金属粉定相助剂份，有机溶剂组成。本发明是通过高固体聚酯树脂和完全甲醚化氨基树脂交联反应得到良好的漆膜性能，并可以大大提高涂料的固体份；通过降粘型分散剂来降低分散透明红颜料的粘度；通过高固醋酸丁酸纤维素来提高漆膜的表干速度，并比较普通的醋酸丁酸纤维素固体份要高一倍；通过金属粉定相助剂来防止珠光粉沉淀，并可以使珠光粉有更均匀的排列效果；各项性能均能达到汽车漆的各项指标，尤其具有高固低粘的特点，可以达到涂装用涂料≤35g/m的voc排放要求。
5	一种防霉抗菌的耐候性水性内墙涂料及其制备方法<sep>本发明公开了一种防霉抗菌的耐候性水性内墙涂料，以重量份计，包括以下组分：丙烯酸酯类单体18‑35份，尾巨桉粉末3‑6份，纳米蒙脱土1‑3份，乳化剂1‑2份，引发剂0.8‑1份，白炭黑1‑5份，成膜助剂1‑2份，消泡剂0.5‑1.5份，增稠剂0.5‑1份，流平剂0.5‑1份，去离子水20‑30份。本发明还公开了该水性内墙涂料的制备方法。本发明公开的内墙涂料涂膜性能好，稳定性优异，具有良好的防霉抗菌性能，涂膜力学性能佳，且制备简单。
5	一种耐高温防火涂料及其制备方法<sep>本发明属于防火涂料技术领域，尤其是一种耐高温防火涂料及其制备方法，解决了现有技术中防火涂料存在腐蚀基材、环境污染、附着力差、涂膜脆、力学性能和加工性能差的问题，所述耐高温防火涂料，包括以下原料：复合基料树脂、阻燃性氨基树脂、聚醋酸乙烯乳液胶粘剂、钛白粉、膨胀蛭石、三聚磷酸钠、阻燃协效剂、十八烯酸丁酯、助剂。本发明制备的防火涂料防火阻燃性能显著，防火时间长，当涂膜厚度在13±1mm时耐火时间超过2小时，超过国家标准20mm耐火2小时的要求；其涂膜性能稳定，弹性好，防水、耐油、耐候、耐腐蚀、耐摩擦等性能优异，附着力强，可广泛适用于各类基材的防火保护。
5	多异氰酸酯组合物、聚氨酯树脂、二液固化型聚氨酯组合物及涂覆材料<sep>多异氰酸酯组合物含有：苯二甲撑二异氰酸酯的改性体及五亚甲基二异氰酸酯的改性体，以及/或者，由苯二甲撑二异氰酸酯和五亚甲基二异氰酸酯形成的改性体。五亚甲基二异氰酸酯相对于苯二甲撑二异氰酸酯和五亚甲基二异氰酸酯的总量的比例为5摩尔％以上40摩尔％以下。
5	一种高纯苯氧乙醇的制备方法<sep>本发明公开了一种高纯苯氧乙醇的制备方法，该制备方法包括以下步骤：将工业苯氧乙醇在有机溶剂中溶解；通过碱水洗涤；降温结晶，得到高纯度苯氧乙醇。本发明得到的苯氧乙醇纯度高(gc纯度≥99.5％，单杂≤0.1％)，常规设备即可生产，生产成本低，工艺简洁，易于工业化生产。
5	高固含低voc水性聚丙烯酸酯树脂及其制备方法<sep>本发明涉及聚合物技术领域，尤其是一种高固含低voc水性聚丙烯酸酯树脂及其制备方法，包括多元酸‑叔碳酸缩水甘油酯加成物以及高固含低voc水性聚丙烯酸酯树脂的制备。首先使用多元酸对叔碳酸缩水甘油酯进行开环，制备得到多元酸‑叔碳酸缩水甘油酯加成物作为反应型稀释剂。利用所制备的反应型稀释剂制备高固含低voc水性聚丙烯酸酯树脂，树脂制备过程中完全不使用有机溶剂，完全做到了水性树脂的零voc。在涂料成膜过程中，反应型稀释剂分子链中的羟基可以与涂料固化剂发生反应完成固化。反应型稀释剂中的叔碳酸结构也可以提升涂层的耐水、耐乙醇和耐候性。反应型稀释剂在降低粘度的同时，可以进一步提升涂层综合性能。
5	可光固化的亲水聚合物、基于其的涂料组合物及亲水润滑涂层和制品<sep>本发明涉及可光固化的亲水聚合物、基于其的涂料组合物及亲水润滑涂层和制品。可光固化的亲水聚合物由特定结构的可聚合光敏单体与亲水性单体共聚而成。所述可光固化的亲水聚合物具有高的光固化效率，制备方法简易、生产效率高、环境污染少，基本不存在凝胶化的问题。通过固化所述涂料组合物可以获得高牢固度、高润滑性、具有优异的生物安全性和相容性的亲水涂层。
5	一种含有微纳米复合填料的pfa涂层及其制备方法<sep>一种含有微纳米复合填料的pfa涂层及其制备方法，其属于涂料加工的技术领域。该涂层主体为高温烘烤型pfa氟碳树脂，涂层添加了负载二氧化钛的氧化石墨烯填料，氧化石墨烯采用微米级，二氧化钛采用纳米级。制备方法为：（1）将纳米tio与go反应得到go‑纳米tio复合物。（2）再将复合物与pfa有机分散乳液混合均匀（3）将q235碳钢工件进行喷砂、磷化等预处理，喷涂添加了复合填料的pfa，喷涂后进行程序控温烧结，涂层厚度控制在20‑30um。该涂层具有结合力好，防腐性能好，使用寿命长，涂层接触角大等优点，在一定程度上解决了高温烘烤型涂料溶剂挥发后涂层孔隙多的问题。在较薄的涂层厚度下也有良好的防腐蚀效果，可应用于烟道气余热回收、相变传热等领域。
5	一种提高聚丙烯塑料热变型温度的方法<sep>本发明公开一种提高塑料热变形温度的方法，包括以下操作步骤：（1）将硝酸锆、硝酸镝加入至水中，混合搅拌均匀后，然后向其中加入氨水,混合搅拌均匀后,加入至密闭反应容器中,反应处理后,得到纳米氧化锆‑镝；（2）将纳米氧化锆‑镝、异丙基三(硬脂酰基)钛酸酯、聚乳酸‑羟基乙酸共聚物加入至高速混合机中，混合搅拌均匀后，制得添加剂；（3）将聚丙烯树脂、添加剂、碳酸钙、顺丁烯二酸酐、抗氧剂加入至高速混合机中，混合均匀后，然后加入至双螺杆挤出机中，挤出造粒后，制得聚丙烯塑料母粒。本发明中加入较少量的无机填料，就能使得聚丙烯塑料具有较高的热变形温度。
5	一种具有良好稳定性能的抗静电离型乳液及其制备方法<sep>本发明涉及离型乳液技术领域，公开了一种具有良好稳定性能的抗静电离型乳液及其制备方法。所述具有良好稳定性能的抗静电离型乳液，按重量份计，其组成为：烯基聚硅氧烷5～20份、含氢聚硅氧烷0.5～10份、苯基羟基网状硅树脂0.05～1份、导电聚合物聚噻吩0.05～5份、单臂碳纳米管水溶液0.05～2份、含环氧基的线性硅烷偶联剂1～5份、表面活性剂1～10份、水60～85份。本发明的抗静电离型乳液应用于薄膜基材，制备的离型膜既具有良好稳定的抗静电性能，同时具有稳定的离型性能，适合在线涂布，可减少工序，降低成本。
5	一种水溶性过渡金属配合物催化分子氧氧化水相合成不对称硫化物的方法<sep>本发明针对现有技术中不对称硫化物的制备存在有机溶剂污染、反应副产物多的问题，提供一种水溶性过渡金属配合物催化分子氧氧化水相合成不对称硫化物的方法，以摩尔比为1:1的巯基化合物和肼类化合物为底物并将其分散于碱性水溶液中，在40‑100℃且氧气存在条件下，以水溶性过渡金属配合物为催化剂，搅拌反应即得不对称硫化物。本发明利用分子氧作为氧化剂，以水作溶剂，避免了有机溶剂的使用，且收率高，基本不存在副产物的问题。
5	一种防火涂料界面剂及其制备方法<sep>本发明公开了一种防火涂料界面剂及其制备方法，涉及建筑防火涂料的技术领域。其技术要点是：防火涂料界面剂包括如下重量份数的组分：珍珠岩30‑40份；蛭石粉480‑520份；漂珠180‑220份；粉煤灰400‑450份；轻质碳酸钙310‑350份；乙酸乙烯酯‑乙烯共聚乳液280‑320份；聚乙烯醇80‑120份；木质纤维8‑12份；水性增稠剂2‑4份；滑石粉70‑90份；水900‑1100份。本发明具有粘结强度高、不易出现空鼓开裂现象的优点。
5	一种环氧树脂基保温隔热涂料<sep>本发明公开了一种环氧树脂基保温隔热涂料，属于涂料技术领域。本发明将环氧树脂与稀释剂置于混料机中，于转速为600～800r/min条件下，搅拌混合40～60min，接着向混料机中加入碳酸氢钠，固化剂，增粘树脂，碱性酚醛树脂，氮化铝晶须，预处理木炭粉，芒硝搅拌，过氧化钠和硅烷偶联剂，于转速为600～800r/min条件下，搅拌混合40～60min，即得环氧树脂基保温隔热涂料。本发明提供的环氧树脂基保温隔热涂料具有优异的力学性能和保温性能。
5	一种红外固化粉末涂料及其制备方法<sep>本发明提供了一种红外固化粉末涂料及其制备方法。所述红外固化粉末涂料包括如下重量份数的组分：基体树脂50份、固化剂12‑50份、脂肪族二元酸0.5‑5份、羟基官能化超支化树脂0.5‑5份和纳米填料0.5‑5份。所述红外固化粉末涂料是通过将各组分混合，用挤出机挤出，然后压片并粉碎的方法制备得到。本发明提供的红外固化粉末涂料具有较高的红外吸收率，其固化速度快，固化后形成的涂层具有较高的交联密度、硬度、韧性、附着力、耐溶剂性、耐酸碱性和耐湿热性，适合用于木材、工程塑料、玻璃和纸张等热敏性基材的涂装。
5	一种导热硅橡胶复合材料的制备方法<sep>本发明公开了一种导热硅橡胶复合材料的制备方法。制备方法是先用水和层状导热填料混合，超声分散，再加入乙烯基硅油，加热搅拌，使水分蒸发，得到预分散物；通过橡胶捏合机将硅橡胶、补强剂、预分散物、硫化剂混合，得到混炼胶，利用橡胶压延机将混炼胶压延成薄片，经热空气预硫化，然后拉伸牵引，使胶片减薄，并发生拉伸取向，把薄胶片卷成圆柱体，沿垂直于圆柱体轴线方向将其切片，硫化定型。本发明由于导热填料沿胶片厚度方向发生取向，胶片具有高热导率。该硅橡胶复合材料的热导率范围为4～14w/(m·k)，且热导率可通过改变压延机的工艺参数和牵引伸长率进行调整，复合材料的制备过程工艺简单，绿色环保。
5	聚烯烃组合物和聚烯烃母粒与聚烯烃膜以及表面装饰复合材料及其制备方法<sep>本发明公开了一种聚烯烃组合物和聚烯烃母粒与聚烯烃膜以及表面装饰复合材料及其制备方法。所述组合物包括聚烯烃体系、交联剂、交联助剂和微球膨胀剂，以所述聚烯烃体系100重量份为基准，所述交联剂的含量为0.01‑3重量份，所述交联助剂的含量为0.01‑3重量份，所述微球膨胀剂的含量为0.1‑10重量份；所述交联剂为有机过氧化物交联剂，所述交联助剂为丙烯酸酯类交联助剂和/或聚丁二烯类交联助剂；本发明通过在聚烯烃组合物中加入微球膨胀剂，采用微球膨胀的方式代替气体发泡的形式，不但能够降低所形成的聚烯烃膜的密度，而且能够使得形成的聚烯烃膜表面无小孔生成，使得聚烯烃膜表面结构致密、柔软舒适。
5	一种环氧固化剂的制备方法<sep>本发明提供了一种环氧固化剂的制备方法。该方法包括以下步骤:(1)称取适量环氧树脂、有机酚和催化剂加入反应容器中，加热至75‑250℃保温0.5‑7小时后，降温至30‑120℃并加入溶剂，出料；(2)向上述反应容器中加入胺类物质和部分溶剂升温至40‑125℃，在搅拌状态下缓慢滴加步骤(1)中的产物，在70‑135℃下保温0.4‑6小时；(3)缓慢加入剩余的溶剂，搅拌5‑100分钟，得到环氧固化剂。本发明通过有机酚改性后的环氧固化剂与环氧树脂的混溶性较好，得到的涂膜光泽较高，同时，环氧固化剂与环氧树脂反应后形成大分子量的体型结构，提高了涂膜的耐腐蚀、耐介质性能。此外，引入有机酚，提高了涂膜的柔韧性和疏水性，控制了环氧树脂和环氧固化剂的反应速度，延长了施工时限。
5	一种钒系催化剂及制备烯烃聚合物的方法<sep>本发明属于烯烃聚合领域，涉及一种钒系催化剂及采用该钒系催化剂制备烯烃聚合物的方法。该钒系催化剂包括：组份a：主催化剂，所述主催化剂为含钒化合物；组份b：助催化剂，所述助催化剂为有机铝化合物；组份c：复合添加剂，和任选的组份d：活化剂。采用本发明的催化剂体系可以大幅度提高共聚催化活性，本发明的聚合反应活性提高近一倍；提高了α‑烯烃和二烯烃的转化率及插入率，减少了未参与共聚单体的回收量，提高了单体利用率；此外，在共聚反应中还可提高共聚物中无规序列分布的含量，提高共聚物的分子量，提高产品质量。
5	一种用于烯烃聚合的催化剂组分及其催化剂<sep>本发明涉及一种用于烯烃聚合的催化剂组分及其催化剂。所述催化剂组分其包含镁、钛、卤素、内给电子体化合物和助析出剂，其中，所述助析出剂包括如通式(i)所示的助析出剂a；通式(i)所示的助析出剂a包含如通式(i‑a)和/或通式(i‑b)所示的光学异构体，且通式(i‑a)和/或通式(i‑b)所示的光学异构体的含量大于90wt％。将本发明的催化剂用于烯烃聚合反应时，具有较高的活性和立体定向能力，制备的聚丙烯具有很宽的分子量分布，特别适用于制备宽分子量分布的丙烯聚合物。
5	蓝色固化性树脂组合物、滤色器及包含其的图像显示装置<sep>本发明提供一种蓝色固化性树脂组合物、滤色器及包含其的图像显示装置，其特征在于，含有包含下述化学式1所表示的化合物的着色剂、包含乙烯性不饱和键的光聚合性化合物、包含下述化学式2所表示的化合物的热交联剂、和包含封端的(blocked)苯酚系抗氧化剂的抗氧化剂，相对于上述蓝色固化性树脂组合物中的总固体成分重量％，包含上述着色剂25～30重量％、上述光聚合性化合物20～40重量％、上述热交联剂1～10重量％、上述抗氧化剂1～2重量％、碱溶性树脂20～40重量％、光聚合引发剂10～15重量％和添加剂1～2重量％，下述化学式1和2中的取代基与说明书中的定义相同。
5	耐高温高强度粉末涂料的制备方法及粉末涂料的喷涂方法<sep>本发明提供了一种耐高温高强度粉末涂料的制备方法，耐高温高强度粉末涂料的制备方法包括如下步骤：提供物料a以及物料b，其中，物料a包括聚酯树脂、固化剂、颜料以及助剂，物料b包括碳纤维、多壁碳纳米管以及碳酸钙晶须；对物料a进行高速混合，得到均匀分散的物料a；对物料b进行球磨，得到均匀分散的物料b；对均匀分散的物料b进行表面处理；将均匀分散的物料a以及经过表面处理的物料b混合，得到混合物料；对混合物料进行高速混合，得到均匀分散的混合物料；对均匀分散的混合物料进行混炼，得到混炼后的物料；对混炼后的物料进行挤出，得到挤出的熔融物料；对熔融物料进行压片并破碎，得到物料碎片；对物料碎片进行次级粉碎，得到耐高温高强度粉末涂料。
5	一种环保型高强度聚苯胺复合涂料及其制备方法<sep>本发明公开了一种环保型高强度聚苯胺复合涂料及其制备方法。采用通过接枝共聚方法，首先采用环氧氯丙烷改性聚乙烯醇。以苯胺、改性聚乙烯醇为单体，盐酸为掺杂剂，过硫酸铵为氧化剂，通过接枝共聚合成聚苯胺接枝聚乙烯醇共聚物。以聚苯胺接枝聚乙烯醇为基体，以丙烯酸酯单体为改性剂，在引发剂的作用下，引发丙烯酸酯单体之间的共聚合及其在聚苯胺和聚乙烯醇分子链上的接枝共聚，形成pa/pani‑pva分散液。以水性聚合物如环氧树脂乳液等作为基体，以水性pa/pani‑pva分散液为改性剂，添加增稠剂、消泡剂、成膜助剂，得到高强度的改性聚苯胺聚乙烯醇防腐涂料。该涂料经济环保，此外，本发明产品制备工艺简单，成本低廉，耐久性好等优点，具有广泛的市场应用前景。
5	一种阻燃隔热水性漆及其制备方法<sep>本发明提供一种阻燃隔热水性漆，按照重量份计由以下成分制成：成膜聚合物55‑65份、表面修饰泡沫铝基纳米管5‑10份、助溶剂1‑5份、水10‑20份、成膜助剂1‑3份、乳化剂1‑3份、流平剂1‑3份、润湿剂1‑3份；所述成膜聚合物是由二(2‑氨基乙基)氢磷酸酯、外‑3,6‑环氧‑1,2,36‑四氢邻苯二甲酸酐、1,1‑二甲氧基‑3‑(三甲基硅氧基)‑1,3‑丁二烯、聚醚胺制成。本发明还公开了所述阻燃隔热水性漆的制备方法。本发明制备得到的阻燃隔热水性漆具有成本低廉，阻燃隔热效果好，耐水性、耐碱性、耐磨损性、耐候性优异，对环境影响小，使用安全环保的优点。
5	一种智能响应自修复防腐涂层材料和制备方法<sep>本发明公开了一种智能响应自修复防腐涂层材料和制备方法。该涂层材料包括氧化锌微胶囊和涂层基体；氧化锌微胶囊包括囊芯和囊芯载体，囊芯为缓蚀剂，囊芯载体为多孔氧化锌；在囊芯载体外表面具有zif‑8膜。多孔无机材料zno保证了缓蚀剂的活性，同时zno表面生成的zif‑8膜不仅可以提高结合性能，还可作为封孔物质，防止缓蚀剂过早释放。本发明成功构建了具有ph响应和自修复双重功效的防腐涂层材料，当涂层产生裂纹时，微胶囊会破裂并释放出缓蚀剂，能够实现自修复功能；当涂层无明显破损，而内部腐蚀已然发生时，根据腐蚀位点周围ph的变化，微胶囊可降解自动释放出缓蚀剂，实现自修复功能。
5	一种基于层间共价作用增强的荷负电型含氟聚合物基复合膜及其制备方法<sep>本发明公开了一种基于层间共价作用增强的荷负电型含氟聚合物基复合膜膜。该复合膜由支撑层和功能层组成，支撑层为含聚酯纤维的增强层，功能层由含氟聚合物和荷负电型聚合物组成，荷负电型聚合物在功能层内的质量百分含量为5～40%。复合膜中支撑层和功能层以c‑o和/或c‑n共价键作用结合，复合膜为荷负电型微滤膜或超滤膜，表面含有羧基和/或磺酸基。本发明的复合膜具有通量高、通量稳定性好、截留和抗污染性优异、膜内各层间结合稳定等特点。同时，由于膜本身的荷负电性，该复合膜对某些荷电型污染物具有更好的选择性和抗污染性。因此该膜使用过程中综合性能稳定，膜寿命长，耐反洗。本发明同时公开了该复合膜的制备方法，生产过程简单，适用于制备平板膜或中空纤维膜。
5	一种环保涂料及其制备方法<sep>本发明公开了一种环保涂料，由如下重量份数的原料制成：环氧树脂40‑55份，氨基化氧化石墨烯5‑10份，聚酰亚胺纤维1‑5份，钛白粉10‑15份，成膜助剂1.5‑2.5份，润湿分散剂1‑3份，消泡剂0.02‑0.06份，流平剂0.5‑1.2份和水30‑50份。所得环保涂料耐火时间≥2.4h，环保涂料耐火性能优异；粘结强度≥0.57mpa，粘附性好；耐水性测试，浸泡360h无起层、发泡、脱落现象，环保涂料耐水性能好。
5	一种感光银浆用低分子量含硅丙烯酸树脂及其制备方法<sep>本发明公开了一种感光银浆用低分子量含硅丙烯酸树脂，包含以下质量百分含量的成分：固体组分30％～70％、液体组分30％～70％；所述固体组分包含非硅类单体、有机硅化合物、引发剂和链转移剂，所述有机硅化合物占所述单体质量的0.01％～2％，所述引发剂占所述单体质量的0.01％～2％，所述链转移剂占所述单体质量的0.01％～1％。本发明将有机硅引入小分子量丙烯酸树脂，能够在实现良好显影效果的同时，提升电极和膜片之间的附着力。同时，本发明还公开一种所述感光银浆用低分子量含硅丙烯酸树脂的制备方法。
5	一种水溶性酸性聚丙烯酸钠的制备方法<sep>本发明涉及高分子聚合领域，特别是一种水溶性酸性聚丙烯酸钠的制备方法。本发明的制备方法，包括以下步骤：(1)复合缓聚剂的制备；(2)增溶剂的制备；(3)光‑热引发剂水溶液的制备；(4)中和液的制备；(5)胶液的制备；(6)通过光、热引发反应，得到水溶性酸性聚丙烯酸钠。本发明的生产工艺过程简单，无污染，绿色环保；制备得到的水溶性酸性聚丙烯酸钠粘度高，难溶物含量低，残单量低，性能优良。
5	功能化石墨烯负载蒙脱土的润滑油添加剂、制备方法及其应用<sep>本发明公开了一种功能化石墨烯负载天然蒙脱土的润滑油添加剂、制备方法及其应用。首先，用硅烷偶联剂改性处理氧化石墨烯获得功能化氧化石墨烯；然后，将功能化氧化石墨烯与天然蒙脱土纳米粉体混合，水(或溶剂)热反应得到负载蒙脱土的功能化石墨烯复合材料添加剂；最后，将该复合材料润滑油添加剂与润滑油按一定比例混合后进行摩擦磨损实验，极少的添加量就能达到摩擦系数明显降低的效果，具有优良的抗磨减摩和智能修复功效，最高可以达到比润滑油摩擦系数降低32%的效果。本发明的添加剂粉体在润滑油中具有优异的稳定性和分散性，并且工艺简单、性价比高，原料易得，具有良好的润滑性能和高承载能力。
5	一种环氧防腐涂料组合物及其制备方法和应用<sep>本发明属于涂料技术领域，公开了一种环氧防腐涂料组合物及其制备方法和应用，组合物包括甲组分和乙组分；所述甲组分的制备：将双酚a型环氧树脂，聚多巴胺改性氟化二硫化钼粉末，防腐颜填料、助剂和稀释剂混合后，高速分散，制得聚多巴胺改性氟化二硫化钼的环氧防腐蚀涂料的甲组分；所述乙组分的制备：将环氧固化剂和稀释剂混合，搅拌均匀，制得聚多巴胺改性氟化二硫化钼的环氧防腐蚀涂料的乙组分。本发明采用聚多巴胺和全氟癸基三氯硅烷来改性二硫化钼，然后将其添加到环氧防腐涂料中，从而使得涂层与基材之间的附着力及涂层对水、氧气的屏蔽性能得到了显著提高。本发明所得产品与市场上的环氧防腐涂料相比较，其防腐蚀性能了有了大幅度的提高。
