label_id	text
5	碱性燃料电池用阴离子交换膜的制备方法及阴离子交换膜<sep>本发明公开了碱性燃料电池用阴离子交换膜的制备方法及阴离子交膜,包括以下步骤：csebs溶液和bpei溶液制取；csebs/bpei成膜溶液制取；交联csebs膜；主链苯环亚甲基氯季铵化和bpei季铵化；氯离子转换为oh。本发明制备出的碱性燃料电池用高离子交换容量阴离子交换膜离子交换容量高，力学性能好。
5	一种耐溶剂聚酰亚胺膜、制备方法及应用<sep>本发明涉及一种耐溶剂聚酰亚胺分离膜、制备方法及应用，属于聚合物膜技术领域。本发明通过在聚酰亚胺膜表面通过三亚乙基四胺（teta）和氧化石墨烯（go）构成的修饰液，以真空过滤的方法，对其进行表面反应修饰。本发明的特点是简单的一步操作既提高了聚酰亚胺膜的耐溶剂性又提高了氧化石墨烯在表面修饰的稳定性，同时二胺单体交联的go片提高片层间距与稳定性。制得的复合膜可用在极性溶剂中的染料处理，截留高、通量大。
5	含有改性聚丙烯树脂的自乳化型乳液<sep>本发明提供对聚乙烯、聚丙烯等烯烃系基材具有优异的胶粘特性的、不使用乳化剂的自乳化型乳液。本发明是含有具有阴离子性官能团的改性聚丙烯树脂与增粘剂并满足下述(1)及(2)的自乳化型乳液，其中，(1)具有阴离子性官能团的改性聚丙烯树脂在没有乳化剂的存在下分散于水中；(2)由具有阴离子性官能团的改性聚丙烯树脂构成的分散体粒子中包含有增粘剂。
5	一种水性木器漆及制备方法<sep>本发明提供了一种水性木器漆及制备方法，是由以下重量份的组分制成的：蔗糖聚酯与丙烯酸联合改性的醇酸树脂40～50份，脂肪族改性聚氨酯分散体20～30份，氯醋树脂12～18份，乳化剂2～3份，分散剂2～3份，消泡剂1～2份，流平剂1～2份，促进剂2～3份，引发剂1～2份，去离子水20～30份。本发明的木器漆表干和实干时间短，可以较快干燥，形成的涂膜硬度大、耐磨性好、耐水性佳，并且具有较低的voc水平，环保性能更好。
5	递变三嵌段共聚物<sep>通过以下方法制备递变三嵌段共聚物，所述递变三嵌段共聚物具有受控的乙烯基分布、扩大的具有中间组成和微观结构的中间嵌段、提高的相邻嵌段之间的相容性、良好的加工特性和25,000‑300,000的峰值平均分子量，所述方法为：使共轭二烯单体和单乙烯基芳香族单体、极性改性剂和引发剂发生阴离子聚合，以形成富含共轭二烯的第一嵌段，形成第二嵌段，所述第二嵌段是共轭二烯与单乙烯基芳香族单体的共聚物，并且与第一嵌段相比较不富含共轭二烯，并且形成第三嵌段，所述第三嵌段是单乙烯基芳香族单体的均聚物。所述第一嵌段、所述第二嵌段和所述第三嵌段分别占所述递变三嵌段共聚物的30‑60、20‑50重量％和10‑40重量％。所述递变三嵌段共聚物可用作沥青改性剂、粘合剂、密封剂、增容剂、补强剂和冲击改进剂。
5	一种防腐强化的自修复复合涂层<sep>本发明公开一种防腐强化的自修复复合涂层，复合涂层由层叠在一起的底涂层和面涂层组成，底涂层的涂料采用甲乙双组份体系，甲组份包括环氧树脂、自修复剂、耐腐蚀颜料、填料、助剂、溶剂，乙组分为固化剂；面涂层的涂料采用甲乙双组分体系，甲组分包括高耐候树脂、改性微波吸收剂、填料、助剂、溶剂，乙组分为固化剂。本发明有效解决在破损时及时形成新的保护能力，可有效解决常规涂层防护性能丧失的技术问题。
5	一种玄武岩鳞片防腐蚀吸波涂料及其制备方法<sep>本发明为一种添加了玄武岩鳞片的防腐蚀吸波涂料及其制备方法，属于涂料技术领域。所述防腐蚀吸波涂料含有树脂、稀释剂、片状铁硅铝粉体、玄武岩鳞片和固化剂。所述防腐蚀吸波涂料是在含有单一片状铁硅铝粉体吸波涂料的基础上，添加占树脂质量10％‑60％的玄武岩鳞片制备而成。所述的玄武岩鳞片防腐蚀吸波涂料制备的涂层的吸波性能，较单一片状铁硅铝涂层的吸波性能得到了明显的改善，其吸收峰值降低了，吸收频段有了显著的拓宽。另一方面，由于玄武岩鳞片的屏蔽特性，使得涂层具有良好的耐腐蚀性能。本发明采用的方法操作简单，成本低，性能稳定，具有很强的实际应用价值。
5	双组份涂料混合物<sep>本发明涉及双组份涂料混合物的用途，所述双组份涂料混合物含有五亚甲基二异氰酸酯的异氰脲酸酯和nco基团反应性化合物，在最高至80℃的温度下快速硬化并且具有良好的耐化学性。
5	一种硅锌改性催化剂载体及其制备方法和应用<sep>本发明涉及催化剂领域，公开了一种硅锌改性催化剂载体及其制备方法和应用。该方法包括将改性硅油和水溶性锌化合物与氧化铝载体进行接触的接触工序，所述改性硅油为选自烷基改性硅油、聚醚改性硅油、环氧改性硅油、氨基改性硅油、聚酯改性硅油和羟基改性硅油中的一种或多种。通过本发明的方法，改善载体的表面酸量和酸强度性质，使其成为能够制备高活性加氢处理催化剂的载体。
5	一种低挥发分树脂的制备方法<sep>本发明涉及一种低挥发分树脂的制备方法，将聚乙烯粉料、去离子水、低分子量助剂的混合物加入螺杆挤出机中，在密闭、高温的螺筒中混溶、挤出、造粒。本发明采用挤出脱挥的方法可以增强小分子挥发物的脱除，所制备的树脂挥发性气体含量低，气味弱，具有较好的耐冲击性能、强度及韧性。
5	负氧离子涂料及其制备方法<sep>本发明公开了一种负氧离子涂料，包括以下组分：优创‑e、丙烯酸水性乳液、钛白粉、超细轻钙、超细滑石粉、超细电气石粉、有机膨润土粉、去离子水、乙二醇、丙二醇、活性炭粉、超细硅藻土、羟乙基纤维素、香精、ph值调节剂调节ph值为8‑9；助剂ⅰ：成膜助剂、杀菌剂、消泡剂、降粘剂和分散剂。本发明还公开了一种负氧离子涂料的制备方法，将各组分按照合理的顺序进行预混合和研磨分散处理，以制备更高效释放负氧离子，实用性强，应用前景广阔的负氧离子涂料。
5	一种在物品表面制备具有自清洁功能的高分子涂层的方法<sep>一种在物品表面制备具有自清洁功能的高分子涂层的方法，包括：步骤1:清洁待涂敷的物品表面污染物，得到表面干净的物品；步骤2:配制含有nacl的聚二甲基二烯丙基氯化铵(pdadmac)水溶液；步骤3:利用步骤2所配制的所述含nacl的pdadmac水溶液涂敷步骤1得到的所述表面干净的物品，得到含pdadmac薄膜的物品；步骤4:配制无机或有机盐水溶液；步骤5:将步骤3得到的所述含pdadmac薄膜的物品浸泡在步骤4得到的所述盐水溶液中，得到在物品表面涂敷自清洁的pdadmac涂层。在所制备的涂层表面上任何油性污染物，可以完全、快速、有效地被水清洗干净，不需借助洗涤剂和洗涤设备。将pdadmac涂层修饰在各种滤膜或筛网的表面，可制成简易、高效的油/水分离滤膜和筛网。
5	一种具有互穿网络结构的阻尼涂料及其制备方法<sep>一种具有互穿网络结构的阻尼涂料及其制备方法，其原料由聚氨酯树脂、环氧树脂、固化剂、阻尼填料、隔声填料、颜料和助剂组成，其中，各原料占原料总重量的重量百分比依次为：聚氨酯树脂20~30%、环氧树脂5~30%、固化剂10~35%、阻尼填料5~25%、隔声填料10~40%、颜料0.1~5%和助剂1~10%。本发明的ipn型阻尼涂料，在10‑1000hz（25℃）范围内，材料自身的阻尼因子最大可达0.83，在500~4000hz时，隔声量最小值为26db。依据本发明的配方和制备方法制得的阻尼涂料，具有互穿聚合物网络结构、高阻尼因子，可取代我国现役约束阻尼结构型阻尼涂料体系。
5	易剥离性保护用树脂薄膜形成组合物<sep>一种易剥离性保护用树脂薄膜形成组合物，其特征在于，其包含：以聚四亚甲基二醇骨架作为主骨架的氨基甲酸酯(甲基)丙烯酸酯化合物、至少包含单官能(甲基)丙烯酸酯的(甲基)丙烯酸酯、以及自由基聚合引发剂，前述单官能(甲基)丙烯酸酯的含量相对于前述(甲基)丙烯酸酯的总量为50质量％以上。
5	一种丁香酚表面活性剂及其应用<sep>本发明公开了一种丁香酚表面活性剂应用，属于表面活性剂科学和材料制备技术领域。该丁香酚表面活性剂的合成路线简单，水溶性好，对于丁香酚在表面活性剂领域的应用有着重要价值。该丁香酚表面活性剂含有不饱和的双键结构，与苯乙烯共聚得到的纳米微球具有核壳结构，粒径分布为52.4‑167.5nm。该纳米微球在催化、电子信息、生物等高新技术领域具有广泛的应用前景。
5	一种防闪锈剂及其制备方法和应用<sep>本发明涉及防闪锈技术领域，尤其是涉及一种防闪锈剂及其制备方法和应用。本发明所述的防闪锈剂以烷氧链为主链，烷氧链主链的一端包括炔基，烷氧链主链的另一端包括磷酸酯盐。所述防闪锈剂包括炔基和磷酸酯盐两个官能团，能够在基材表面进行吸附和配位，有效防止水性涂料的闪锈的形成，并能够解决水性涂料漆膜干燥后遇水返锈的问题，能够应用于各种领域，尤其是涂料领域，能够在短时间内牢固吸附在基材表面形成一层保护膜，表现出优异的防锈性能和耐盐雾性能，达到长时间防锈的目的。
5	用于定向自组装的高弗洛里赫金斯参数嵌段聚合物及无规聚合物及其制备方法和自组装方法<sep>本发明高分子化合物合成与应用，具体地，本发明涉及可用于定向自组装的具有高弗洛里赫金斯参数χ的嵌段聚合物及无规聚合物及其制备方法和自组装方法。嵌段聚合物通过阴离子聚合得到，嵌段之间弗洛里赫金斯参数(flory‑huggins)极大，且相容性极低；无规聚合物由所述嵌段聚合物的单体和环氧甲基丙烯酸酯类单体通过自由基聚合得到，该类无规聚合物对上述嵌段聚合物的嵌段呈中性。本发明的嵌段聚合物，涂布于交联后的无规聚合物中性层上后经过退火热处理就能形成垂直于基片的相分离结构，生产效率提高；且能形成20nm以下尺寸范围的图案；同时，本发明提供的嵌段聚合物和无规聚合物应用于微电子领域图案的转以上，降低了其工艺要求及生产成本。
5	一种硅气凝胶防火、防水、环保保温膏<sep>本发明属于节能环保材料技术领域，尤其涉及一种建筑以及工业节能保温用的硅气凝胶防火、防水、环保保温膏；该保温膏在制备时加入了气凝胶前驱体，以硅溶胶、有机硅改性丙烯酸乳液作为结合剂，具备了传统材料不可比拟的隔热性能，本发明中保温膏干燥后，具有较高的机械强度，实现了防火a1级别，另外，还具有较好的防水和低成本优势，为建筑节能、环保以及工业节能提供了一种新型材料。
5	一种聚四氟乙烯防静电膜及其制备方法<sep>本发明公开了一种聚四氟乙烯防静电膜及其制备方法。以质量百分比计，该聚四氟乙烯防静电膜由90‑96％聚四氟乙烯和4‑10％的改性炭黑组成，改性炭黑由炭黑经n‑(苯并环丁烯‑4‑基)马来酰亚胺表面处理获得。n‑(苯并环丁烯‑4‑基)马来酰亚胺能够提高炭黑的亲油性和分散性，从而炭黑能够均匀分散在聚四氟乙烯中，不会出现炭黑团聚体，使得聚四氟乙烯防静电膜具有优良的断裂伸长率和抗静电性能；经n‑(苯并环丁烯‑4‑基)马来酰亚胺改性后的炭黑能使制品表面电阻率波动变小；改性炭黑的分解温度达到450℃以上，从而在370‑390℃的聚四氟乙烯加工温度下，改性炭黑仍旧具有优良的热稳定性，不会发生热分解。
5	隔热涂料与隔热多孔膜及其形成方法<sep>隔热多孔膜的形成方法包括：混合100重量份的含聚硅倍半氧烷结构的聚合物、20至75重量份的界面活性剂；以及20至2000重量份的溶剂，以形成隔热涂料，其中涂料中的含聚硅倍半氧烷结构的聚合物为管状或平板状；将隔热涂料涂布于基板上；以及干燥及烧结隔热涂料，以得隔热多孔膜。
5	具有水性聚合物分散体的聚氨酯泡沫<sep>用于形成聚氨酯泡沫的反应体系包括具有至少一种异氰酸酯的异氰酸酯组分和异氰酸酯反应性组分，所述异氰酸酯反应性组分是通过添加至少多元醇组分、添加剂组分和预制的水性聚合物分散体所形成的混合物。所述混合物包括以所述混合物的总重量计50.0重量％到99.8重量％的包括至少一种聚醚多元醇的多元醇组分、0.1重量％到50.0重量％的包括至少一种催化剂的添加剂组分以及0.1重量％到6.0重量％的预制的水性聚合物分散体。所述预制的水性聚合物分散体的固体含量以所述预制的水性聚合物分散体的总重量计为10重量％到80重量％，并且所述预制的水性聚合物分散体是水性酸聚合物分散体或水性酸改性的聚烯烃聚合物分散体中的一种，其中所述聚烯烃衍生自至少一种c到cα‑烯烃。
5	一种用于低声波反射的改性聚丙烯挤出板材料及其制备方法<sep>本发明公开了一种用于低声波反射的改性聚丙烯挤出板材料及其制备方法，其技术方案要点是：所述挤出板材料按重量百分比由以下组分组成：pp树脂40～55％，长玻纤15～20％，空心微珠5～10％，脱水处理植物粉末10～20％，增韧体系10～15％，其他助剂5％。本发明的一种用于低声波反射的改性聚丙烯挤出板材料，具有较好的低声波反射效果，同时成本低廉，还满足客户的装饰需求。
5	一种抗落球冲击、良外观的长玻纤增强聚丙烯材料及其制备方法和应用<sep>本发明的抗落球冲击、良外观长玻纤增强聚丙烯材料包括重量份数比为20‑90:10‑80的甲组分和乙组分；甲组分包括以下组分及重量份数：聚丙烯30‑60份，长玻纤40‑60份，相容剂0‑10份，助剂0.2‑2份；乙组分包括以下组分及重量份数：聚丙烯30‑80份，聚乙烯5‑20份，高抗冲聚丙烯10‑50份，三氧化二锑0‑5份，助剂0.2‑2份。本发明通过聚乙烯、高抗冲聚丙烯、三氧化二锑复配的方法大幅提高抗落球冲击能力，改善了落球冲击中的落球开裂及应力发白问题。
5	一种聚酰胺原位聚合包覆黑磷阻燃剂及其制备方法和应用<sep>本发明公开的聚酰胺原位聚合包覆黑磷阻燃剂，在惰性气体保护下，对黑磷进行聚酰胺原位聚合包覆制得。创造性地在具有黑磷的非质子极性溶剂或极性质子溶剂中引入聚酰胺对其进行表面改性或包覆，通过对聚酰胺的选择，再结合黑磷大小尺寸的选择，制备阻燃剂。该阻燃剂利用聚酰胺包覆纳米级或微米级黑磷，使聚酰胺发挥其与基材的相容性，有利于黑磷纳米级分散于材料基体中，不仅能提升材料的阻燃性能，还能提升材料的各项力学性能，拓宽该阻燃剂的应用领域，特别是应用于工程塑料、橡胶、涂料和纤维各种材料的阻燃领域，如聚酰胺、聚酰亚胺、聚氨酯、丁腈橡胶和丙烯酸涂料等材料方面。
5	离火自熄且可导电导热的阻燃塑料合金及其制备方法<sep>本发明公开了一种离火自熄且可导电导热的阻燃塑料合金及其制备方法，其中，离火自熄且可导电导热的阻燃塑料合金包括丙烯腈‑丁二烯‑苯乙烯三元共聚物、聚氯乙烯、石墨、氮化铝、硫醇有机锡和金属氧化物，所述阻燃塑料合金采用同向平行双螺杆挤出机进行共混挤出加工。本发明的阻燃塑料合金同时具有优异的导电性、导热性和阻燃性；流动性好，易于成型，适用于注塑、挤出等工艺，对环境友好，可以广泛使用于各类场景中。
5	一种永久亲水的聚偏氟乙烯膜及其制造方法<sep>本发明涉及水处理技术领域，尤其涉及并公开了一种永久亲水的聚偏氟乙烯膜，包括微孔支撑层和致密分离层，微孔支撑层是海绵状开孔，孔径≥0.5µm，致密分离层孔径≤0.1µm，致密分离层的水接触角≤70°，在高温水中长期浸泡后膜水接触角变化幅度≤10%。本发明还公开了一种永久亲水的聚偏氟乙烯膜制造方法，包括如下步骤：制备均相溶液；通过模具成型；通过冷却介质分离固化；除去稀相并干燥。本发明的一种永久亲水的聚偏氟乙烯及其制造方法，具有海绵状、开孔的微孔支撑层和与微孔支撑层相比较致密的致密分离层结构，具有制造成本低、生产工序简单、分离层致密、支撑层疏松、耐压强度高、透过流量高、亲水性高度稳定的优点。
5	一种轻量化、低收缩的白色聚酯膜<sep>一种轻量化、低收缩的白色聚酯膜，比重的范围为0.6至1.2，包含a/b/a三层结构，其特征在于a层和b层的内部均含有孔洞，其中，a层由65～95wt％聚酯系树脂和5～35wt％无机粒子所组成，b层包含：50～90wt％聚酯系树脂、5～25wt％改性聚丙烯树脂及5～25wt％无机粒子，所述改性聚丙烯树脂为以0.1～3phr过氧化物作为交联改性，热变形温度为120℃以上，熔体指数(mi)(温度230℃，负载2.16kg)为0.2～1g/10min。
5	一种碳酸亚乙烯酯及聚乙二醇(甲基)丙烯酸酯基聚合物电解质及其制备方法<sep>本发明公开了一种碳酸亚乙烯酯及聚乙二醇(甲基)丙烯酸酯基聚合物电解质及其制备方法，所述电解质，其特征在于，锂盐分散在固态聚合物基体内，所述固态聚合物基体中锂盐的含量为5～50wt％；所述固态聚合物基体为聚碳酸亚乙烯酯与聚乙二醇(甲基)丙烯酸酯共聚物、或者聚碳酸亚乙烯酯及聚乙二醇(甲基)丙烯酸酯与骨架单体的共聚物。本发明的固态聚合物电解质制备简单，室温电导率高，可作为锂离子电池的电解质使用。
5	一种水性环氧丙烯酸防腐涂料<sep>本发明公开了一种水性环氧丙烯酸防腐涂料，所述水性环氧丙烯酸防腐涂料，包括如下质量份数的组分：a组份，环氧丙烯酸树脂40~60份、颜填料15~30份、防锈颜料5~15份、润湿分散剂0.5~2份、增稠剂0.2~1.5份和水6~15份；b组份，水性胺固化剂4~10份，助剂0~5份和水2~10份。本发明通过选择乳液型润湿分散剂，配合增稠剂分两部分前后添加的制备工艺，以及配方的合理搭配，制备得到一种水性环氧丙烯酸防腐涂料；制得的水性环氧丙烯酸防腐涂料单独采用水性环氧丙烯酸树脂作为成膜物质，其防腐性能优异、稳定性好、适用期长，而且成本低。
5	uv led水性紫外光固化木门家具涂料及其制备方法<sep>本发明公开了uv led水性紫外光固化木门家具涂料及其制备方法，所述涂料按照重量份计算，包括：水性脂肪族聚氨酯分散体70～90份，水性气相二氧化硅0.1～0.5份，消光粉1～5份，水性蜡乳液1～5份，水性光引发剂3～8份，杀菌剂0.05～0.2份，罐内防腐剂0.1～0.3份，助剂1～4份，去离子水3～5份；该涂料固化能耗低，能节省50%～70%的电力，固化过程对环境无污染，对人体不产生危害，固化速度快，效率高；所述制备方法操作简单，容易实施。
5	一种高硬度聚乙烯电缆料及其制备方法<sep>本发明涉及一种聚乙烯电缆料，所述聚乙烯电缆料包括以下重量份的原料组分：第一聚乙烯树脂100份,第二聚乙烯树脂30‑50份,润滑剂1‑3.5份,抗氧剂0.2‑0.6份,耐候母料2.5‑7.5份。本发明的一种聚乙烯电缆料为一款硬度较高，耐磨高韧性的聚乙烯护套，以适应不同的敷设施工及使用环境，提高电缆的使用寿命，节约社会资源与成本。
5	一种阳离子-自由基混杂型3d打印立体光刻快速成型光敏树脂及制备方法<sep>一种阳离子‑自由基混杂型3d打印立体光刻快速成型光敏树脂及制备方法。所述光敏树脂的原料组份为：1,3‑双[(3‑乙基‑3‑甲氧基氧杂环丁烷)丙基]四甲基二硅氧烷5～90%；丙烯酸酯类预聚物5～80%；丙烯酸酯类稀释剂0～40%；阳离子型光聚合引发剂0.5～10%；自由基型光聚合引发剂0.5～10%。所制备的光敏树脂光敏性好，临界曝光量e小于17.0mj/cm；通过3d打印立体光刻成型后，成型精度高，成型零件或模具的翘曲因子cf(6)在±0.02范围内，cf(11)在±0.05范围内。可以直接制造出任意复杂形状的、具有高精度的零件或模具。
5	一种单组分抗流挂聚氨酯防水涂料<sep>本发明公开了一种单组分抗流挂聚氨酯防水涂料，防水涂料的原料包括聚氨酯预聚体、触变剂、填料、溶剂和助剂，聚氨酯预聚体由聚醚多元醇与第一异氰酸酯反应制成，其特征在于，触变剂由改性纳米碳酸钙、聚脲和改性纳米气相二氧化硅复合而构成，改性纳米碳酸钙、聚脲和改性纳米气相二氧化硅的投料质量比为15~35︰2~8︰1，聚氨酯预聚体的投料量与改性纳米碳酸钙、聚脲和改性纳米气相二氧化硅三者的总投料质量之比为1~2︰1，聚脲由第二异氰酸酯和二元胺反应制成；本发明的防水涂料能够兼具优异的抗流挂性能以及物理力学性能和防水性能。
5	一种环保型阻燃抑烟剂及其制备方法<sep>本发明公开了一种环保型阻燃抑烟剂及其制备方法，所述环保型阻燃抑烟剂由以下质量份的组分组成：无机阻燃剂100份，含钼硼酸酯活性剂0.5～2.5份，其结构式为：其中，r为碳原子数8～22的烷基；所述的无机阻燃剂为氢氧化镁、水镁石、氢氧化铝或水滑石。本发明采用加热条件下机械搅拌分散的方法制成环保型阻燃抑烟剂，该制备方法简单、环保、成本低，制得的环保型阻燃抑烟剂具有良好的阻燃性和优异的抑烟效果，原料来源广泛、价格低、热稳定性高，可应用于聚氯乙烯、丁腈橡胶、聚苯乙烯和不饱和树脂等高分子材料。
5	一种氧化铁颜料色浆及其制备方法<sep>本发明公开了一种氧化铁颜料色浆及其制备方法，通过使用具有通式(i)结构的表面改性剂对氧化铁颜料进行表面改性，通过共价键接枝在颜料表面，提升颜料颗粒间的空间阻力，从而提高稳定性、降低细度、提升着色力；引入具有通式(ii)结构的聚氨酯分散剂，该分散剂可与其它类型分散剂复配，可以显著提高稳定性和着色力，通式(ii)结构的聚氨酯分散剂具有多锚固定基团，在颜料表面锚固定效果好，有利于色浆中颜料颗粒的分散和稳定；因此，该色浆具有储存稳定性高、细度小、着色力高等优点。
5	具有火灾预警和超疏水功能的三明治结构高效阻燃涂层及其制备方法与应用<sep>本发明公开了具有火灾预警和超疏水功能的三明治结构高效阻燃涂层及其制备方法与应用。该制备方法通过在易燃基材上依次制备底部导电层、中部温敏传感层和顶部超疏水导电层，其中底部导电层制备是将金属纳米材料和油溶性长链高分子一起均匀分散于有机溶剂中形成涂料a，然后将涂料a喷涂于基材上，第一次干燥；喷涂并干燥的过程重复1～10次。与现有技术相比，本发明制备的阻燃涂层即便是应用在大面积基材上，也能表现出超灵敏的火灾预警功能和优异的阻燃性能；涂层表面还具有超疏水性，使其表现出出色的自清洁和耐水性能。本发明所制备的阻燃涂层可赋予易燃材料可靠的火灾安全性，可广泛应用于交通运输、家具电器、建筑装饰和电线电缆等领域。
5	一种用于烯烃聚合的催化剂组合物及烯烃聚合的方法<sep>本发明涉及烯烃聚合催化剂领域，提供一种用于烯烃聚合的催化剂组合物及烯烃聚合的方法，该催化剂组合物包括：(1)第一烯烃聚合催化剂(a)，选自通式i所示金属配合物，r～r，r～r相同或不同，各自独立地选自氢、烃基或卤素；m为第iva族金属，x相同或不同，选自卤素、烃基、烃氧基；l为第ⅵa族元素；(2)第二烯烃聚合催化剂(b)，选自通式ii所示金属配合物，r‑r相同或不同，各自独立地选自氢、烃基、烃氧基或卤素；r、r相同或不同，各自独立地选自氢、烃基、烃氧基或卤素；m为第ⅷ族金属，x选自卤素；(3)链穿梭剂；(4)助催化剂。该催化剂组合物在高温下仍具有较高活性。
